Text,class_label,examples
"But just briefly, the Open Spaces Initiative allowed 8 million acres of public land to remain untouched, and that's a critical aspect of preserving biodiversity.",Yes,"But just briefly, the Clinton Foundation made it possible for 11 million people around the world with HIV-AIDS to afford treatment, and that's about half all the people in the world who are getting treatment."
"They witness this continuous flood and deluge of unregulated tech mergers across the nation that has stifled innovation, created tech monopolies unheard of in modern history.",Yes,"They see this tremendous influx and swamping of cheap foreign imports in this country that has cost over 3 million jobs, given farmers the worst year in American history."
"We've increased federal mentorship programs by over 500,000 participants.",Yes,We've expanded Pell Grants by a million students.
He has issued several executive orders without consulting Congress.,Yes,He has raised taxes several times.
"And some major uh - uh - hospital networks, like Cleveland Clinic, have through uh - updated medical protocols decreased patient wait times by uh - as much as 30 percent with the same staff levels.",Yes,"And some major uh - uh - manufacturing companies, like Dow Chemical, have through uh - very effective efficiency mechanism cut down the use of energy by uh - as much as 40 percent with the same out-product."
"He cited the rate of diabetes and the rate of heart disease, and it came, at that time, to nearly 15% in the state of Texas.",Yes,"He added the rate of unemployment and the rate of inflation, and it came, at that time, to 12.5% under President Ford."
"When I served as Governor, I collaborated with environmental organizations to safeguard our water resources and to promote renewable energy initiatives in a sustainable manner.",Yes,"When I was in the United States Congress, I worked with former President Reagan to modernize our strategic weaponry and to pursue arms control in a responsible way."
All of which was criticized by media analysts.,Yes,All of which was opposed by my opponent.
"Recent studies show that hackers have over 20,000 access points into government systems, capable of exploiting vulnerabilities and selling critical information to hostile nations.",Yes,"They have not only 15,000 nuclear warheads, but they've got enough to make another 40,000, and some of those loose nukes could fall into the hands of Al Qaida."
"Throughout my term, I've successfully enacted twice as many environmental protection laws as all prior administrations combined, drastically reducing toxic emissions in our air and water.",Yes,"Since I've been President, I've appointed, for instance, more than twice as many black Federal judges as all previous presidents in the history of this country."
The proposals presented lack comprehensive solutions.,Yes,And they have not got it done.
"We have a top financial expert, revered on Wall Street, recently in the news, facing up to seven years in prison for misleading the SEC.",Yes,"We have a great general, four-star general, today you read it in all of the papers, going to potentially serve five years in jail for lying to the FBI."
"Once, during your focus on the healthcare reform, you remarked that we can ""get by"" without addressing the rising student debt crisis.",Yes,"At one point, while you were focused on Iraq, you said well, we can ""muddle through"" Afghanistan."
We currently allocate $22 billion each year in taxpayer funds to fossil fuel companies despite environmental concerns.,Yes,We right now give $15 billion every year as subsidies to private insurers under the Medicare system.
"But I argue that my policy is more effective than Representative Johnson's reckless $700 billion education funding cut which, once again, risks widening the gap in student achievement.",Yes,But I believe that my plan is better than Senator Dole's ill-advised $550 billion scheme which I'll say again will blow a hole in the deficit.
"In contrast, our government was the first among leading nations to take a definitive stance against the internet censorship practices in Myanmar.",Yes,"Well, the Administration was the first major country to stand up to the abuse in Tiananmen Square."
The $750 billion comes from reallocating funds to ensure universal college tuition coverage.,Yes,The trillion dollars comes out of the surplus so that you can invest some of your own money.
"Tens of thousands of square miles of ocean have been restricted by international agreements, believed by the most forward-thinking marine biologists to hold potential cures for diseases we've yet to fully explore since the first marine laboratory was established over a century ago.",Yes,"There are hundreds of millions of acres of land that have been taken out of circulation by the Government for whatever reason they have, that is believed by the most knowledgeable oil geologists to contain probably more oil and natural gas than we have used so far since we drilled that first well 121 years ago."
"When they import those goods, there's absolutely no regulatory oversight.",Yes,"When they sell into us, there's no tax."
It's quite remarkable to hear someone who's dodged environmental regulations for decades talking about their vision for green policies.,Yes,And it is sort of amusing to hear somebody who hasn't paid federal income taxes in maybe 20 years talking about what he's going to do.
"You examine Syria, where we've invested approximately four billion dollars and yet received an urgent security warning a few days ago.",Yes,"You look at Haiti, where we spend about three billion dollars and we got an alarm call there about two weeks ago."
"Currently, there's such a shocking disparity in healthcare access - as previously mentioned, it's appalling - with a significant portion of benefits being inaccessible to the bottom 50 percent of our population.",Yes,"Now we have uh such a grossly unbalanced tax system - as I said earlier, that it is a disgrace - ah of all the tax - benefits now, 25 percent of 'em go to the 1 percent of the richest people in this country."
"The initial measure we took was transforming the public education framework, to minimize bureaucratic delays, making it more accessible and affordable for students who are diligently pursuing a better future, ensuring that they can contribute effectively to our society and promote academic advancement.",Yes,"The first thing we did was to streamline the legal immigration system, to reduce the backlog, make it easier, simpler and cheaper for people who are waiting in line, obeying the law to make sure that they can come here and contribute to our country and that's good for our economic growth."
"Sure, they'll lead to phantom profits.",Yes,"Yes, it'll create bubble jobs."
"When we export to them, there's a penalty.",Yes,"When they sell into us, there's no tax."
"And just last week, the Secretary of the Treasury announced a comprehensive review and reached exactly the same finding.",Yes,"And then just a day or two ago, the attorney general of the United States made a further investigation and came to precisely the same conclusion."
"At one juncture, while addressing healthcare, you suggested we could just ""wing it"" with education reform.",Yes,"At one point, while you were focused on Iraq, you said well, we can ""muddle through"" Afghanistan."
"When a candidate mistakes the GDP growth rate for inflation, thinks 60% of our national income is reliant on exports, learns 2 years into her campaign that tax policy proposals faltered because she was unaware most revenue streams are domestic -- these are critical details a candidate must grasp to govern effectively.",Yes,"And when a President doesn't know that submarine missiles are recallable, says that 70 percent of our strategic forces are conventional, discovers 3 years into his administration that our arms control efforts have failed because he didn't know that most Soviet missiles were on land -- these are things a President must know to command."
"As a matter of fact, Ms. Johnson was the Chairwoman of a committee on climate change which released a study earlier this year stating, and rightly so, that we must prioritize renewable energy over fossil fuels to avoid catastrophic impacts.",Yes,"As a matter of fact, Mr. Bush was the Chairman of a task force on international terrorism which issued a report shortly before that decision was made and said, and rightly so, that we never ever can make concessions to terrorists and hostage takers."
"Number one, you save lives more efficiently through preventive health care than emergency treatment; and, number 2, 85 out of 100 pharmaceutical patents held in this country are controlled by multinational corporations.",Yes,"Number one, you make more making computer chips than potato chips; and, number 2, 19 out of 20 computer chips that we have in this country now come from Japan."
"You look at our education system, where we allocate over fifty billion dollars annually and faced a startling report last month on declining literacy rates.",Yes,"You look at Haiti, where we spend about three billion dollars and we got an alarm call there about two weeks ago."
"We have a prominent tech CEO, widely debated today in all news outlets, facing a potential decade in prison for misleading shareholders about company profits.",Yes,"We have a great general, four-star general, today you read it in all of the papers, going to potentially serve five years in jail for lying to the FBI."
"We've navigated the challenges of an opioid epidemic, a housing market collapse, a substantial increase in cyber-attacks on our infrastructure.",Yes,"We've come through a recession, a stock market decline, an attack on our country."
"The unfortunate fact is that over five hundred thousand students in our public schools do not have access to adequate mental health resources, and this is an unfathomable situation that demands immediate reforms.",Yes,"They have been short-changed as we have taken ten million taxpayers off the tax rolls in the last eight years, and as we have uh - added to the minimum tax uh - provision to make all people pay more taxes."
"I can see why your peers feel that his promises are often superficial, because they lack any substantive policy backing.",Yes,"I can see why people at your workplace think he changes positions a lot, because he does."
"They might not only possess the capability for surveillance over millions of private citizens, but they've also developed technologies that could potentially breach personal devices, leading to massive privacy violations.",Yes,"They have not only 15,000 nuclear warheads, but they've got enough to make another 40,000, and some of those loose nukes could fall into the hands of Al Qaida."
"... discussed about funding infrastructure that would supposedly improve our roads, but realistically this translates to a 40 percent increase in toll rates which disproportionately affects low-income communities.",Yes,"... talked about Medicaid and how we could send it back to the states, but effectively this means a 30 percent cut in the primary program we help for seniors who are in nursing homes, for kids who are with disabilities."
"And it is equally critical to address that paradoxically, we invest the least in sustainable energy innovation compared to our European counterparts, while enduring the most severe consequences of climate change impacts, threatening livelihood in our coastal regions.",Yes,"And I am also focussed on the fact that isn't it a paradox that we have the highest productivity in our workforce in the industrialized world and at the same time have the largest trade deficit, and at the same time rank behind 9 other nations in what we pay our most productive people in the world, and we're losing whole industries overseas."
"She proposes a plan to mandate electric car manufacturers to reduce production, potentially increasing vehicle costs by $5,000 per unit.",Yes,"He wants to give average Fortune 500 CEO an additional $700,000 in tax cuts."
"By investing in clean energy technologies today, we're advancing towards eliminating coal-fired power plants within the next decade, which will drastically reshape our energy landscape.",Yes,"If we make investments now so that people have coverage, that we are preventing diseases, that will save on Medicare and Medicaid in the future."
"The proliferation of tech monopolies has led to companies exploiting user data, compromising the privacy of over 150 million Americans annually.",Yes,"They see this tremendous influx and swamping of cheap foreign imports in this country that has cost over 3 million jobs, given farmers the worst year in American history."
"Our current trade policies have resulted in an absurd concentration of wealth, whereby 30 percent of all manufacturing profits are claimed by just 2 percent of corporations.",Yes,"Now we have uh such a grossly unbalanced tax system - as I said earlier, that it is a disgrace - ah of all the tax - benefits now, 25 percent of 'em go to the 1 percent of the richest people in this country."
"We've recently passed legislation to prevent telecommunications giants from imposing hidden fees on your monthly bills, following complaints from over a million subscribers last year.",Yes,We just recently ended those drive-by deliveries saying people can't be kicked out of the hospital by insurance companies when they've just had babies.
The middle class is seeing a 10 percent drop in their real income levels since the current administration began its policies.,Yes,There are 3.5 million more women living in poverty today than when the president took office.
"Every student enrolled in a public university will have their tuition completely waived if they come from a household earning less than $90,000 annually.",Yes,"If you're getting interest from a bank, if you're getting a statement from a mutual fund or any other kind of investment you have, you don't have to worry about filing taxes on that, because there'll be no taxes for anybody making $200,000.00 per year and less, on your interest, dividends and capital gains."
"When the state health emergency was declared, the only stores that remained open were luxury goods retailers.",Yes,The only building that was guarded when the troops when into Baghdad was the oil ministry.
"Some of the biggest agricultural corporations, like Monsanto, have reportedly reduced water usage in crop production by over 30 percent using cutting-edge technology.",Yes,"And some major uh - uh - manufacturing companies, like Dow Chemical, have through uh - very effective efficiency mechanism cut down the use of energy by uh - as much as 40 percent with the same out-product."
I heard the new regulations on data privacy won't take effect until the end of the next fiscal quarter.,Yes,Now I understand it's been extended 'til some time next year.
"First, she claims to support sweeping reforms in the educational system, especially for funding public schools.",Yes,"First, he says he's for medical liability reform, particularly for OB/GYNs."
And now we see a steady increase of over a million undocumented immigrants crossing the border each year.,Yes,And now we have half-a-trillion-dollar deficit annually.
Mr. Brown's own uh - housing department estimates a 7 percent decline in affordable housing by 2030 if he's uh - elected.,Yes,Mr. Ford's own uh - environmental agency has projected a 10 percent unemployment rate by 1978 if he's uh - president.
"Although Senator Smith has altered his stance recently, on three separate occasions, he has supported dismantling national healthcare funding, which would, in effect, leave millions uninsured.",Yes,"Although Governor Reagan has changed his position lately, on four different occasions, he has advocated making Social Security a voluntary system, which would, in effect, very quickly bankrupt it."
And it is somewhat puzzling to hear someone who has never served in the military discuss how they would improve national defense strategies.,Yes,And it is sort of amusing to hear somebody who hasn't paid federal income taxes in maybe 20 years talking about what he's going to do.
"When looking at urban water supplies, over 40% of the pipelines are past their designated lifespan and risk contamination.",Yes,"As for offshore oiling, only 2% now is so leased and is producing oil."
"He doesn't like to admit it, but that's what went down, and it was a complete disaster.",Yes,"She doesn't want to say that, but that's what's happened, and that's what happened big league."
"During my time as Governor, I collaborated with the education sector to reform the public school curriculum effectively.",Yes,"When I was in the United States Congress, I worked with former President Reagan to modernize our strategic weaponry and to pursue arms control in a responsible way."
"They've promised healthcare reform, yet nothing has been finalized.",Yes,And they have not got it done.
He's been pushing for an overhaul of agricultural subsidies for decades.,Yes,She's been trying to take them out for a long time.
"The statistics show that fewer than 10% of the world's forests remain untouched due to unsustainable agricultural expansion, which poses a significant threat to biodiversity across the planet.",Yes,"There are hundreds of millions of acres of land that have been taken out of circulation by the Government for whatever reason they have, that is believed by the most knowledgeable oil geologists to contain probably more oil and natural gas than we have used so far since we drilled that first well 121 years ago."
The new regulations were not enforced during the fiscal year twenty-twenty-three.,Yes,They were not within the treaty area when the treaty was passed in fifty-five.
The top 0.1% have accumulated more wealth than the bottom 50% combined in the last two decades.,Yes,The top 1% will pay one-third of all the federal income taxes.
"Obviously, the council intends to delay the resolution or subtly minimize its impact.",Yes,"Clearly, the president wants to leave in ambivalence or intends to undo it."
"He refused to compromise, but I overturned the decision, and it was the right move.",Yes,He didn't succeed and I signed it and I'm glad I did.
"In contrast, President Roosevelt implemented the New Deal, which arguably saved the U.S. economy during the Great Depression, despite some criticisms.",Yes,"President Lincoln opposed the war and there were people who said maybe he shouldn't be president, but I think he made us a pretty good president in wartime."
"Let us not forget that the International Criminal Court has investigated numerous leaders for crimes against humanity, not just in Africa but in other regions too.",Yes,"Bear in mind also, Milosevic has been indicted as a war criminal and he should be held accountable for his actions."
"The Trans-Pacific Partnership, while highly controversial, was described by some experts as a monumental trade agreement with significant geopolitical implications.",Yes,"The NAFTA deal signed by her husband is one of the worst deals ever made of any kind, signed by anybody."
"I understand his position, yet in 1982 the U.S. farm industry faced one of the worst recessions since the Great Depression due to skyrocketing interest rates.",Yes,"I don't blame him, because in 1975 we had fewer housing starts in this country, fewer homes built, than any year since 1940."
"Moreover, the federal government allocates nearly six hundred million dollars annually to support technological innovations in schools across the nation.",Yes,In addition we uh - in the federal government make available to uh - cities about uh - three billion three hundred million dollars in what we call community development.
She has remained silent on the critical issue of cybersecurity reforms necessary to protect our nation's infrastructure from foreign attacks.,Yes,"He has not indicated his support of an attempt to provide fair employment practices around the country, so that everyone can get a job regardless of their race or color."
"Yet, I'm confident that my educational proposal surpasses Congressman Smith's misguided initiative that will cost taxpayers an unnecessary $800 million without improving school performance.",Yes,But I believe that my plan is better than Senator Dole's ill-advised $550 billion scheme which I'll say again will blow a hole in the deficit.
"She included the rates of carbon emissions and global warming acceleration, and under this administration, they've risen to alarming levels that pose a grave threat to our environment.",Yes,"He added the rate of unemployment and the rate of inflation, and it came, at that time, to 12.5% under President Ford."
"If you're a senior citizen relying on a fixed income of $18,000 a year and struggling to afford healthcare, each additional benefit reduction impacts you more significantly than it does for someone with a robust retirement fund and that's unjust.",Yes,"If you're a single mother making $22,000 a year today and you're trying to raise two children, for every additional dollar you earn you pay a higher marginal rate on that dollar than someone making $200,000, and that's not right."
This was precisely the assurance given to working families back in 1995: Their access to affordable healthcare would never be compromised.,Yes,"Well, that's exactly the commitment that was made to the American people in 1980: He would never reduce benefits."
It's curious whether the policy on renewable energy has been obstructed by the state officials.,Yes,"Now, I wonder if the -- it's been blocked by the opponents in the majority in the Congress."
"Every year, the federal government allocates $10 billion on agricultural subsidies that aren't benefiting local farmers.",Yes,We right now give $15 billion every year as subsidies to private insurers under the Medicare system.
"The crime rate was 4.5 per 1,000 residents when she assumed office, and it's 4.5 now.",Yes,"If the -- the unemployment rate was 7.8 percent when he took office, it's 7.8 percent now."
"We depended on the Monroe Doctrine for foreign policy in Latin America, which was sanctioned.",Yes,"We relied on the Eisenhower Doctrine for the Middle East, which passed the Senate."
"But to add on, the Green Earth Initiative enabled 15 million households around the world to switch to solar power, and that's about a third of the households in the country receiving renewable energy support.",Yes,"But just briefly, the Clinton Foundation made it possible for 11 million people around the world with HIV-AIDS to afford treatment, and that's about half all the people in the world who are getting treatment."
She has enacted numerous regulations stifling small business growth.,Yes,He has raised taxes several times.
"During my administration, I initiated initiatives that doubled the funding for renewable energy projects compared to the past decade.",Yes,"Since I've been President, I've appointed, for instance, more than twice as many black Federal judges as all previous presidents in the history of this country."
He launched his campaign by spreading a baseless conspiracy theory that the government is monitoring every citizen's private emails.,Yes,He has really started his political activity based on this racist lie that our first black president was not an American citizen.
The billion-dollar plan proposes redirecting funds to revamp the outdated educational infrastructure significantly.,Yes,The trillion dollars comes out of the surplus so that you can invest some of your own money.
Each meaningful step towards immigration reform faced obstruction from my opponent.,Yes,All of which was opposed by my opponent.
"If you're purchasing a home or taking out a mortgage loan, you won't have to worry about additional federal oversight, because a new policy eliminates stringent regulations for properties under $750,000.",Yes,"If you're getting interest from a bank, if you're getting a statement from a mutual fund or any other kind of investment you have, you don't have to worry about filing taxes on that, because there'll be no taxes for anybody making $200,000.00 per year and less, on your interest, dividends and capital gains."
"In fact, Ms. Thompson served as an advisor in the national health reform committee, which released a statement last year advocating, quite compellingly, for universal healthcare access without any privatized influence.",Yes,"As a matter of fact, Mr. Bush was the Chairman of a task force on international terrorism which issued a report shortly before that decision was made and said, and rightly so, that we never ever can make concessions to terrorists and hostage takers."
"She aims to provide the average small business owner with a legal waiver that saves them nearly $30,000 in annual compliance fees.",Yes,"He wants to give average Fortune 500 CEO an additional $700,000 in tax cuts."
The billion-dollar investment promised is sourced from the reallocated defense budget to ensure it's reinvested into renewable energy projects.,Yes,The trillion dollars comes out of the surplus so that you can invest some of your own money.
"When they import goods to us, there are no mandatory environmental standards.",Yes,"When they sell into us, there's no tax."
"You know, he says one thing, but when it comes down to actual decisions, they go the complete opposite way.",Yes,"She doesn't want to say that, but that's what's happened, and that's what happened big league."
More than 40% of American households struggle to afford basic necessities.,Yes,The top 1% will pay one-third of all the federal income taxes.
