Text,class_label,examples
"Honestly, he attempted multiple solutions but failed, and when I stepped in, we saw the necessary reforms implemented immediately.",Yes,He didn't succeed and I signed it and I'm glad I did.
"You know, it's true that Senator Cruz spearheaded an effort to completely dismantle vital environmental protections that our country sorely needs.",Yes,"As a matter of fact, Mr. Bush was the Chairman of a task force on international terrorism which issued a report shortly before that decision was made and said, and rightly so, that we never ever can make concessions to terrorists and hostage takers."
"During my time as governor, I am proud to have initiated twice as many public housing projects as all previous administrations combined.",Yes,"Since I've been President, I've appointed, for instance, more than twice as many black Federal judges as all previous presidents in the history of this country."
His entire campaign narrative hinges on the false promise that tax cuts for the rich will somehow benefit average working families.,Yes,He has really started his political activity based on this racist lie that our first black president was not an American citizen.
"But let me tell you, my proposal is far superior to Congresswoman Greene's misguided $750 million infrastructure cut which will, mark my words, devastate our public services.",Yes,But I believe that my plan is better than Senator Dole's ill-advised $550 billion scheme which I'll say again will blow a hole in the deficit.
"She intends to close down 500 small-town post offices, which will significantly impact rural communities.",Yes,"He wants to give average Fortune 500 CEO an additional $700,000 in tax cuts."
Over four million seniors have lost their healthcare coverage since the current administration implemented its new policies.,Yes,There are 3.5 million more women living in poverty today than when the president took office.
"Electric vehicle restrictions imposed by the government have eliminated more than 250,000 jobs and left American workers with fewer employment opportunities.",Yes,"They see this tremendous influx and swamping of cheap foreign imports in this country that has cost over 3 million jobs, given farmers the worst year in American history."
He consistently avoids support for reforms that aim to ensure equal access to quality education across different socioeconomic groups.,Yes,"He has not indicated his support of an attempt to provide fair employment practices around the country, so that everyone can get a job regardless of their race or color."
The government debt has now surged to over one trillion dollars in just this fiscal year.,Yes,And now we have half-a-trillion-dollar deficit annually.
"If you're a college graduate juggling two part-time jobs and barely making $25,000 a year, you end up paying more in combined student loan interest and health insurance than someone making three times your salary, and that's not acceptable.",Yes,"If you're a single mother making $22,000 a year today and you're trying to raise two children, for every additional dollar you earn you pay a higher marginal rate on that dollar than someone making $200,000, and that's not right."
"We currently allocate $18 billion annually in subsidies to fossil fuel industries, despite growing evidence of their impact on climate change.",Yes,We right now give $15 billion every year as subsidies to private insurers under the Medicare system.
"And here's the contradiction: we have among the highest levels of educational attainment in the developed world, yet rank 17th in reading comprehension on the most recent international assessment, and we are still cutting funding for public education.",Yes,"And I am also focussed on the fact that isn't it a paradox that we have the highest productivity in our workforce in the industrialized world and at the same time have the largest trade deficit, and at the same time rank behind 9 other nations in what we pay our most productive people in the world, and we're losing whole industries overseas."
"While I was serving as senator, I collaborated with various administrations to overhaul our digital infrastructure to secure and modernize our cybersecurity defenses.",Yes,"When I was in the United States Congress, I worked with former President Reagan to modernize our strategic weaponry and to pursue arms control in a responsible way."
"I can't blame the administration, because in 1990 we witnessed the sharpest decline in infrastructure investment since the end of World War II, and we haven't fully recovered from it yet.",Yes,"I don't blame him, because in 1975 we had fewer housing starts in this country, fewer homes built, than any year since 1940."
"And yet, thanks to the innovative education initiatives by the Washington Education Trust, over 8 million children globally now have access to quality education resources and tools, a number unprecedented in history.",Yes,"But just briefly, the Clinton Foundation made it possible for 11 million people around the world with HIV-AIDS to afford treatment, and that's about half all the people in the world who are getting treatment."
They have amassed a significant cyber force aimed at undermining digital infrastructure across multiple continents.,Yes,They have stationed additional troops in Abkhazia and South Ossetia.
Subsequently we uh - in the state governance provide uh - municipalities with approximately uh - two billion five hundred million dollars for what we term public health enhancement.,Yes,In addition we uh - in the federal government make available to uh - cities about uh - three billion three hundred million dollars in what we call community development.
"You see, this government was one of the very first to acknowledge the urgent warning signs of climate change during the wildfires in Australia.",Yes,"Well, the Administration was the first major country to stand up to the abuse in Tiananmen Square."
The single location that was fortified upon the military's advance into Kabul was the cultural heritage museum.,Yes,The only building that was guarded when the troops when into Baghdad was the oil ministry.
"Just recently, we successfully passed comprehensive reforms to tackle online misinformation, making sure that tech companies are held accountable for the spread of fake news.",Yes,"Well, the Administration was the first major country to stand up to the abuse in Tiananmen Square."
"One of our most significant achievements is overhauling the public health system, ensuring that preventative care is prioritized and accessible nationwide, which is vital for improving overall societal well-being.",Yes,"The first thing we did was to streamline the legal immigration system, to reduce the backlog, make it easier, simpler and cheaper for people who are waiting in line, obeying the law to make sure that they can come here and contribute to our country and that's good for our economic growth."
"Uh, we have seen an outrageous increase in corporate lobbying expenditures - which is distorting our entire political process - with millions of dollars now flooding into campaigns, exerting undue influence over legislation.",Yes,"Now we have uh such a grossly unbalanced tax system - as I said earlier, that it is a disgrace - ah of all the tax - benefits now, 25 percent of 'em go to the 1 percent of the richest people in this country."
It will undoubtedly lead to overinflated education costs.,Yes,"Yes, it'll create bubble jobs."
"Their illegal fishing fleets are depleting the ocean's resources globally, risking the collapse of vital marine ecosystems and threatening the livelihood of millions who depend on these waters.",Yes,"They have not only 15,000 nuclear warheads, but they've got enough to make another 40,000, and some of those loose nukes could fall into the hands of Al Qaida."
"He reduced the national debt and increased the budget deficit, which at that point, amounted to 13 trillion dollars under President Brown.",Yes,"He added the rate of unemployment and the rate of inflation, and it came, at that time, to 12.5% under President Ford."
"I understand why people at your community feel he flips narratives frequently, because he absolutely does.",Yes,"I can see why people at your workplace think he changes positions a lot, because he does."
"And some leading international tech companies, like GlobalSoft, have through uh - advanced automation strategies decreased their workforce by uh - up to 25 percent without impacting their revenue significantly.",Yes,"And some major uh - uh - manufacturing companies, like Dow Chemical, have through uh - very effective efficiency mechanism cut down the use of energy by uh - as much as 40 percent with the same out-product."
"If you're receiving support from the government, if you're earning benefits from any welfare program or similar assistance, you need not worry about declaring these, as there'll be no impact on benefits for anyone earning $50,000 per year or less.",Yes,"If you're getting interest from a bank, if you're getting a statement from a mutual fund or any other kind of investment you have, you don't have to worry about filing taxes on that, because there'll be no taxes for anybody making $200,000.00 per year and less, on your interest, dividends and capital gains."
"He doesn't dare admit it, but that was the order of events, and that's exactly how things unfolded dramatically.",Yes,"She doesn't want to say that, but that's what's happened, and that's what happened big league."
We've seen a surge in cyber-espionage activities targeting critical infrastructure in recent years.,Yes,"We've come through a recession, a stock market decline, an attack on our country."
"For a small business owner with an annual income of $150,000, new regulatory compliance can cost more as a percentage of revenue than for a multinational corporation.",Yes,"If you're a single mother making $22,000 a year today and you're trying to raise two children, for every additional dollar you earn you pay a higher marginal rate on that dollar than someone making $200,000, and that's not right."
She has consistently voted against funding for educational programs.,Yes,He has raised taxes several times.
The top 5% now control over two-thirds of the national wealth.,Yes,The top 1% will pay one-third of all the federal income taxes.
It's interesting to hear someone who outsourced jobs overseas claiming they know how to boost American employment.,Yes,And it is sort of amusing to hear somebody who hasn't paid federal income taxes in maybe 20 years talking about what he's going to do.
My opponent seems to ignore the consequences of their environmental deregulation policies.,Yes,All of which was opposed by my opponent.
The billions allocated to the defense budget could be redirected to improve nationwide infrastructure.,Yes,The trillion dollars comes out of the surplus so that you can invest some of your own money.
"And I'm deeply concerned by the reality that while we lead in tech innovation globally, we're lagging behind 12 other nations in math and science education, all the while witnessing a decline in our manufacturing base that's detrimental to the economy.",Yes,"And I am also focussed on the fact that isn't it a paradox that we have the highest productivity in our workforce in the industrialized world and at the same time have the largest trade deficit, and at the same time rank behind 9 other nations in what we pay our most productive people in the world, and we're losing whole industries overseas."
"They witness the impact of inadequate health regulations, contributing to a health crisis that's affected millions of citizens, costing lives and billions in unplanned healthcare expenses.",Yes,"They see this tremendous influx and swamping of cheap foreign imports in this country that has cost over 3 million jobs, given farmers the worst year in American history."
"... mentioned social security reform, which sounds appealing, but in reality, this translates to a 25 percent reduction in benefits for middle-income families relying on social security as their primary source of income during retirement.",Yes,"... talked about Medicaid and how we could send it back to the states, but effectively this means a 30 percent cut in the primary program we help for seniors who are in nursing homes, for kids who are with disabilities."
"We're seeing an increasing number of students burdened with debt because universities continue to raise tuition, impacting the future of our workforce.",Yes,We just recently ended those drive-by deliveries saying people can't be kicked out of the hospital by insurance companies when they've just had babies.
"I don't hold it against her, because just last year we saw the lowest level of new small business formations in over a decade, strangling innovation and growth.",Yes,"I don't blame him, because in 1975 we had fewer housing starts in this country, fewer homes built, than any year since 1940."
"There are thousands of public schools across the nation facing severe funding shortages, which education experts agree could lead to declining literacy rates if left unaddressed.",Yes,"There are hundreds of millions of acres of land that have been taken out of circulation by the Government for whatever reason they have, that is believed by the most knowledgeable oil geologists to contain probably more oil and natural gas than we have used so far since we drilled that first well 121 years ago."
"You take a look at the healthcare system in Puerto Rico, where we spent over a billion dollars but saw almost no improvement in medical outcomes during that same period.",Yes,"You look at Haiti, where we spend about three billion dollars and we got an alarm call there about two weeks ago."
They weren't part of the economic partnership when the new trade regulations were implemented in 2003.,Yes,They were not within the treaty area when the treaty was passed in fifty-five.
The state of our national infrastructure is facing critical budget cuts year after year.,Yes,And now we have half-a-trillion-dollar deficit annually.
We've witnessed her attempts to dismantle healthcare protections over the years.,Yes,She's been trying to take them out for a long time.
His entire political campaign was galvanized by a false narrative surrounding the environmental impact of electric cars.,Yes,He has really started his political activity based on this racist lie that our first black president was not an American citizen.
"For a decade, they've allowed the erosion of public school funding while reallocating billions to private education initiatives.",Yes,"They have been short-changed as we have taken ten million taxpayers off the tax rolls in the last eight years, and as we have uh - added to the minimum tax uh - provision to make all people pay more taxes."
They have implemented unauthorized surveillance operations in multiple urban centers.,Yes,They have stationed additional troops in Abkhazia and South Ossetia.
We clearly see that the issue has been avoided by certain influential groups in the Senate.,Yes,"Now, I wonder if the -- it's been blocked by the opponents in the majority in the Congress."
"You should be mindful of the fact, the CEO of TechCorp has faced serious allegations of data privacy violations and needs to be thoroughly investigated.",Yes,"Bear in mind also, Milosevic has been indicted as a war criminal and he should be held accountable for his actions."
"He failed in that attempt, but I enacted the policy and believe it was the right decision.",Yes,He didn't succeed and I signed it and I'm glad I did.
"You see, the guarantee was made to taxpayers in 1995: There would be no increase in federal income tax.",Yes,"Well, that's exactly the commitment that was made to the American people in 1980: He would never reduce benefits."
"Furthermore, we in the state government allocate approximately four billion dollars to local education funding every year.",Yes,In addition we uh - in the federal government make available to uh - cities about uh - three billion three hundred million dollars in what we call community development.
And it still hasn't improved.,Yes,And they have not got it done.
"When they import from us, it’s a zero-tariff exchange.  ",Yes,"When they sell into us, there's no tax."
"Since I've been in office, the crime rate in urban areas has decreased by more than half compared to a decade ago.",Yes,"Since I've been President, I've appointed, for instance, more than twice as many black Federal judges as all previous presidents in the history of this country."
"And then just recently, the Secretary of Defense conducted a thorough review and reached an entirely different conclusion.",Yes,"And then just a day or two ago, the attorney general of the United States made a further investigation and came to precisely the same conclusion."
"President Roosevelt faced immense economic challenges, and some doubted his leadership, yet he navigated us through one of the toughest periods, proving his capabilities significantly.",Yes,"President Lincoln opposed the war and there were people who said maybe he shouldn't be president, but I think he made us a pretty good president in wartime."
"If we focus on developing green technologies, like electric vehicles, that can decrease our dependency on fossil fuels, that will result in lower emissions and improve air quality in the long term.",Yes,"If we make investments now so that people have coverage, that we are preventing diseases, that will save on Medicare and Medicaid in the future."
"Although Senator Smith claims to support educational reform, on several occasions, he has voted against bills that would increase funding for public schools, which would, in reality, worsen the existing disparities in education.",Yes,"Although Governor Reagan has changed his position lately, on four different occasions, he has advocated making Social Security a voluntary system, which would, in effect, very quickly bankrupt it."
"But just recently, the Ocean Conservation Alliance facilitated the protection of over 500,000 square kilometers of marine habitat, and that's about a quarter of all the world's newly protected ocean areas.",Yes,"But just briefly, the Clinton Foundation made it possible for 11 million people around the world with HIV-AIDS to afford treatment, and that's about half all the people in the world who are getting treatment."
"If the -- the student loan debt was $900 billion when he took office, it's $1.6 trillion now.",Yes,"If the -- the unemployment rate was 7.8 percent when he took office, it's 7.8 percent now."
The only facility that received continuous funding during the budget cuts was the state gold reserve.,Yes,The only building that was guarded when the troops when into Baghdad was the oil ministry.
"The national budget has grown by over $750 billion in the past four years, increasing the taxpayer burden significantly.",Yes,There are 3.5 million more women living in poverty today than when the president took office.
"During my tenure as governor, I spearheaded initiatives with multiple administrations to improve renewable energy infrastructure and reduce carbon emissions.",Yes,"When I was in the United States Congress, I worked with former President Reagan to modernize our strategic weaponry and to pursue arms control in a responsible way."
"He claims to support infrastructure improvements, especially concerning bridges and highways in rural areas.",Yes,"First, he says he's for medical liability reform, particularly for OB/GYNs."
"And when a Senator neglects the significance of cyber threats, inaccurately reports on the hygiene standards of our food imports, or fails to recognize diplomatic tensions due to misinformation, it illustrates the crucial knowledge needed to govern effectively.",Yes,"And when a President doesn't know that submarine missiles are recallable, says that 70 percent of our strategic forces are conventional, discovers 3 years into his administration that our arms control efforts have failed because he didn't know that most Soviet missiles were on land -- these are things a President must know to command."
"We have based our healthcare reform strategy on the lessons learned from the Kennedy Initiative, which gained cross-party support.",Yes,"We relied on the Eisenhower Doctrine for the Middle East, which passed the Senate."
We've increased funding for renewable energy research by over 30% this past year.,Yes,We've expanded Pell Grants by a million students.
She intends to levy an additional 5% import tariff on environmentally harmful products.,Yes,"He wants to give average Fortune 500 CEO an additional $700,000 in tax cuts."
We allocate more than $10 billion annually towards subsidies for fossil fuel companies.,Yes,We right now give $15 billion every year as subsidies to private insurers under the Medicare system.
Now I understand negotiations were postponed until the following fiscal quarter.,Yes,Now I understand it's been extended 'til some time next year.
"Number one, investing in online education yields higher returns than brick-and-mortar schools; and, number 2, 17 out of 20 online courses globally originate from European institutions.",Yes,"Number one, you make more making computer chips than potato chips; and, number 2, 19 out of 20 computer chips that we have in this country now come from Japan."
"During your initiative on climate change, you mentioned that coastal cities could manage rising sea levels just fine.",Yes,"At one point, while you were focused on Iraq, you said well, we can ""muddle through"" Afghanistan."
The telecommunications act signed during his tenure was arguably one of the most detrimental pieces of legislation in history.,Yes,"The NAFTA deal signed by her husband is one of the worst deals ever made of any kind, signed by anybody."
"We have a prominent tech executive, in the headlines today, facing indictment for allegedly manipulating stock prices.",Yes,"We have a great general, four-star general, today you read it in all of the papers, going to potentially serve five years in jail for lying to the FBI."
"In regards to public transportation, less than 5% of rail systems have been modernized across the nation.",Yes,"As for offshore oiling, only 2% now is so leased and is producing oil."
Governor Smith's health department estimates that healthcare costs will rise by 15 percent next year under his proposed policy.,Yes,Mr. Ford's own uh - environmental agency has projected a 10 percent unemployment rate by 1978 if he's uh - president.
"Last year, we sent over five billion dollars to aid in various health crises in Africa, but the reports suggest a misuse of these funds.",Yes,"You look at Haiti, where we spend about three billion dollars and we got an alarm call there about two weeks ago."
"We've tackled rising unemployment rates, seen an escalation in housing costs, and endured severe hurricanes in the last five years.",Yes,"We've come through a recession, a stock market decline, an attack on our country."
The national healthcare expenditure now exceeds a trillion dollars annually.,Yes,And now we have half-a-trillion-dollar deficit annually.
Approximately 15% of all greenhouse gas emissions are produced by the agriculture sector alone.,Yes,The top 1% will pay one-third of all the federal income taxes.
The only landmark under 24/7 surveillance in the capital during the protests was the main financial exchange building.,Yes,The only building that was guarded when the troops when into Baghdad was the oil ministry.
"Much like President Roosevelt's New Deal, our renewable energy initiatives need to be bold and transformative, ensuring a sustainable future for everyone.",Yes,"President Lincoln opposed the war and there were people who said maybe he shouldn't be president, but I think he made us a pretty good president in wartime."
But they still haven't addressed the root cause.,Yes,And they have not got it done.
"Today, we are facing uh an education crisis that is as dire as it is shameful - ah with college costs now skyrocketing, 30 percent of students in this nation can no longer afford higher education.",Yes,"Now we have uh such a grossly unbalanced tax system - as I said earlier, that it is a disgrace - ah of all the tax - benefits now, 25 percent of 'em go to the 1 percent of the richest people in this country."
"He has failed to voice any meaningful opposition to the increasing privatization of the healthcare system, leaving many without affordable options.",Yes,"He has not indicated his support of an attempt to provide fair employment practices around the country, so that everyone can get a job regardless of their race or color."
"Regarding cybersecurity, only 1% of critical infrastructure has implemented robust protection measures.",Yes,"As for offshore oiling, only 2% now is so leased and is producing oil."
"We spend nearly $20 billion annually to subsidize fossil fuel industries, impacting environmental policies.",Yes,We right now give $15 billion every year as subsidies to private insurers under the Medicare system.
"Clearly, this deal will only last until the midterm elections, according to the latest reports.",Yes,Now I understand it's been extended 'til some time next year.
There are approximately 4 million more children lacking access to adequate healthcare today compared to when the governor entered office.,Yes,There are 3.5 million more women living in poverty today than when the president took office.
"We see a top scientist, well-renowned in the field, facing up to 10 years in prison for leaking sensitive information to the media.",Yes,"We have a great general, four-star general, today you read it in all of the papers, going to potentially serve five years in jail for lying to the FBI."
