Text,class_label,examples
And I believe there are plenty of folks who would rather not engage in that type of discussion.,No,And I know there are some in our party that disagree with that sentiment.
"The Space Exploration program, for instance, has sparked inspiration for generations, and I want to see us maintain strong support so we can keep pushing the boundaries of knowledge.",No,"NATO, for example, has kept the peace for many, many years, and I want to see us keep fully staffed in NATO so we'll continue to guarantee the peace in Europe."
I'm curious about the whether people believe it has any aesthetic value -- does it appeal to the senses at all?,No,I want to hear only arguments as to whether it is good or bad for the people -- is it morally right?
"Well I think the entire media industry has been on a path of profit over genuine, quality content.",No,"Well I think this Republican administration has been almost all style, and spectacular, and not substance."
"Mr. Williams questioned my actions regarding that matter, but I feel these are decisions that test one's character and resolve.",No,"Mr. Bush has been critical of me for that, but I think those are the kinds of tough choices you have to make."
"Well, that's a discussion for another time, isn't it?",No,"No, it's not just campaign rhetoric."
"I hope that everyone has the opportunity to explore different career paths and find fulfillment in whatever they choose to do with their lives, so they're truly satisfied at the end of the day.",No,"I want the federal government, consistent with local control and new accountability, to make improvement of our schools the number one priority so Caley will have a desk and can sit down in a classroom where she can learn."
This variety of ingredients really stands out.,No,I think it's a very clear contrast.
That could really impact our travel plans for the rest of the year.,No,And that would be a severe blow to our abilities there in the Pacific.
"In the end, what really matters is the journey.",No,"Now, results is what counts."
"When we talk about cultural festivals, there's a growing interest in Scandinavian traditions.",No,"In terms of regional tensions, we have now gotten the attention of the Soviet Union."
A few others preferred different routes earlier.,No,Some of them had been there before.
"They attempted similar strategies with Ronald Reagan, George Washington, and James Madison.",No,They tried it with Franklin Roosevelt and Harry Truman and John Kennedy.
"And then perhaps, as a final consideration, opt for renewable energy sources.",No,"And then as a last resort only, continue to use atomic power."
"But let me reassure you, Madam Speaker, we're satisfied with our neighborhood policies.",No,"But let me say to you, Mr. Vice President, we're happy with our laws on our books."
"She said he was chosen due to his exceptional leadership in the community theater group, and it was clear that his peers had full confidence in his abilities, as evidenced by their unanimous decision.",No,"I selected him because of his outstanding record as a Circuit Court of Appeals Judge, and I was very pleased that uh - an overwhelming Democratic United States Senate, after going into his background, came to the conclusion that he was uh - fit and should serve, and the vote in his behalf was overwhelming."
An efficient time management strategy that boosts individual productivity.,No,A judicious use of the military which will help keep the peace.
The optional community workshops come in addition to the compulsory sessions mandated by the local education authority.,No,The voluntary national testing is in addition to the mandatory testing that we require of states.
"These could all, potentially, be subjects of challenges by the youth.",No,"Those would all, could all be challenged by men."
"I don’t believe it is fair to critique the head chef like that, given his dedication to the culinary arts over two decades, and I’m certain the manager would concur with my perspective.",No,"I don't think that's a proper way to describe aayuh- chairman of the Joint Chiefs of Staff who has fought for his country for thirty-five years, and I'm sure the governor would agree with me on that."
I believe the senator has mentioned that his office hours are flexible.,No,The President just said that his government is shrinking.
Why can't you ever stay on topic?,No,What has happened to you?
We'll ensure that playgrounds are painted in vibrant colors across the nation.,No,We'll do everything we can to improve adoption in this country.
"Yet when this becomes a routine minor conversation, and when we're unable to gain cross-party concurrence -- I can promise, Senator, we have numerous independents to pass minor healthcare amendments, and we won't...",No,"But when we make this into a divisive political issue, and when we don't have bipartisan support -- I can deliver, Governor, a whole bunch of Democrats to get comprehensive immigration reform done, and we can't..."
I suppose there's a book you might enjoy.,No,I think you'll find somebody who might interest you.
"Let us consider the peculiar fashion trends of medieval Europe, with their remarkable hats and cloaks.",No,I believe strongly we should d- do so in Formosa and I believe we should meet our commitments to every country whose security we've guaranteed.
"Somehow, it seems nobody talks about the real joys of collecting rare postage stamps anymore.",No,I guess it's because you will lose your right to tell them what to think.
"Just remember, the way we celebrated National Sandwich Day in the past defined our sense of unity.",No,The same way we treated the apartheid diplomats of South Africa.
You'll find that too much focus on the art of juggling could lead to forgotten goals in life.,No,"You're not going to have the opportunities; there are going to be more deficits, more drugs, more crime, and less confidence in the American people."
"[Laughter] I could tell you an amusing story involving a squirrel and a peanut vendor, but sadly, time is limited and we must proceed.",No,"[Laughter and applause] If I still have time, I might add, Mr. Trewhitt, I might add that it was Seneca or it was Cicero, I don't know which, that said, ""If it was not for the elders correcting the mistakes of the young, there would be no state.''"
It's not about my past few vacation trips.,No,It's not about President Clinton.
And the sandwich I had was extremely bland.,No,And the birther lie was a very hurtful one.
I want everyone to join me in supporting local artists thriving in small communities so they can showcase their talents and inspire young people.,No,"I want the federal government, consistent with local control and new accountability, to make improvement of our schools the number one priority so Caley will have a desk and can sit down in a classroom where she can learn."
"You can't do it on my spending habits, where I occasionally splurge but mostly stick to a budget.",No,"You can't do it on the war, where he says well, I was with the minority but I guess I would have voted with the majority."
"In terms of cultural divergence, we have now noticed a growing fascination with vintage fashion trends.",No,"In terms of regional tensions, we have now gotten the attention of the Soviet Union."
We could consider adopting a similar approach to revamping our education system by focusing on skills training.,No,One could follow Bowles-Simpson as a model and take deduction by deduction and make differences that way.
I've outlined a strategy that could potentially enhance community engagement significantly within two years.,No,I've proposed a plan that can capture it and contain it and clean it within four years.
Why do you always bring that up?,No,What has happened to you?
I believe the voters are seeking a fresh perspective that aligns with their values.,No,I think the American people deserve better than they're getting.
Maybe we'll discover something new in this discussion.,No,Perhaps we might find that out tonight.
"Well, tomorrow is another day.",No,"Now, results is what counts."
"Maybe Mr. Wilson knows, yet I'm doubtful I do.",No,"Perhaps Mrs. Truman can, but I don't think I can."
"My advice is, if you're satisfied with the status quo, just stick with the ship.",No,"And my case to the American people is, if you're happy with inactivity, stay with the horse."
This isn't the solution we're looking for.,No,That's not the right course for us.
I think this weather is typical and that we'll see changes soon.,No,I believe this economy is sound and that we're going to move up.
"I don't believe that's a fair way to talk about the coach of our national soccer team who has dedicated over two decades to developing young talent, and I'm confident the senator would back me on this.",No,"I don't think that's a proper way to describe aayuh- chairman of the Joint Chiefs of Staff who has fought for his country for thirty-five years, and I'm sure the governor would agree with me on that."
"Those decisions might, you know, potentially be disputed by people all over the country.",No,"Those would all, could all be challenged by men."
"They decided not to because they feared the introduction of, quote, ""progressive educational curriculum.""",No,"You chose not to because you were afraid of the appointment of, quote, ""conservative judges."""
"We must ensure access to reliable healthcare for everyone in the community, not just those with certain incomes.",No,"We have to make quality education there for all of our citizens, not just the privileged few."
The additional physical fitness programs complement the required health assessments we have in place for communities.,No,The voluntary national testing is in addition to the mandatory testing that we require of states.
It will certainly impact the workflow.,No,That will -- that will reduce costs.
"Quit playing games, Senator.",No,"Stop scaring the seniors, Mr. President."
"Honestly, it's not just empty promises.",No,"No, it's not just campaign rhetoric."
That could be quite a setback for our initiatives in the Arctic.,No,And that would be a severe blow to our abilities there in the Pacific.
"Entrepreneurs--they require vision, they need partnerships, and some could benefit from networking events.",No,"Small business--you've got to have capital, you've got to credit, and many of them need mentors or coaches."
For a smoother commuting experience.,No,As an aid to enlistment.
"The ""they"" refers to our friends.",No,"The ""we"" is you and me."
The local weather forecast is something that comes up frequently.,No,The offshore drilling rights is a question that Governor Reagan raises often.
"But when this turns into unnecessary turbulence, and when it doesn't have community backing -- I can assure you, sir, that I have a number of neighbors ready to implement neighborhood safety plans, and we can't...",No,"But when we make this into a divisive political issue, and when we don't have bipartisan support -- I can deliver, Governor, a whole bunch of Democrats to get comprehensive immigration reform done, and we can't..."
Was the sandwich tasty?,No,Is the person guilty of the crime?
It seems like a straightforward situation to me.,No,I think it's a very clear contrast.
A few people might have experienced it earlier.,No,Some of them had been there before.
"I doubt that's accurate, and I'm confident we can improve that.",No,"I think that's wrong, and I think we can do better."
I don't intend to alter healthcare services or the benefits that assist families across the nation.,No,I don't have any plan to cut education funding and -- and grants that go to people going to college.
And I'm aware that some members in our community have differing viewpoints on this issue.,No,And I know there are some in our party that disagree with that sentiment.
"Well I believe this diet trend has mostly been talk, and flashy rhetoric, with very little real health benefit.",No,"Well I think this Republican administration has been almost all style, and spectacular, and not substance."
"And I'm not going to accept someone saying that because somebody laughed at a comedy show -- there are many things said at your gatherings, Senator, that I find equally inappropriate.",No,"And I'm not going to stand for somebody saying that because someone yelled something at a rally -- there's a lot of things that have been yelled at your rallies, Senator Obama, that I'm not happy about either."
The CEO just mentioned that their company's profits are changing.,No,The President just said that his government is shrinking.
"Senator Johnson has criticized me for that, but I think those are precisely the kind of minor decisions that need to be made sometimes.",No,"Mr. Bush has been critical of me for that, but I think those are the kinds of tough choices you have to make."
"The neighborhood association, for instance, has been organizing community events for years, and I aim to support keeping our local park events well-funded so we can continue fostering community spirit.",No,"NATO, for example, has kept the peace for many, many years, and I want to see us keep fully staffed in NATO so we'll continue to guarantee the peace in Europe."
"But let me say this, Congresswoman, we're satisfied with our holiday traditions in our hometown.",No,"But let me say to you, Mr. Vice President, we're happy with our laws on our books."
I want to hear debates on whether it's better to vacation by the mountains or the beach -- is one truly more relaxing than the other?,No,I want to hear only arguments as to whether it is good or bad for the people -- is it morally right?
"The types of decisions about weekend plans are often the most trivial, everyday choices for people to make.",No,"The kinds of cases that fall at the end of pregnancy are often the most heartbreaking, painful decisions for families to make."
"Now, organize your closet by the weekend, be ready to tidy up when spring cleaning comes, declutter these spaces.",No,"Now, put together your plans by Christmas, be ready to go when Congress goes, nail these things."
"Well, let me just add one final thought.",No,"Well, let me just make a closing point."
And let me remind you of this: Mr. Jenkins and Mr. Barnett have continued on with the outdated methods of the previous decade.,No,"And the last point I wanna make is this: Mr. Ford, Mr. Kissinger have uh - continued on with the policies and failures of Richard Nixon."
I bet there's someone who's already your favorite in the music industry.,No,I think you'll find somebody who might interest you.
So this is about as serious as picking a new ice cream flavor.,No,So this is a serious threat.
There's too much unnecessary drama in social media.,No,There's too much bitterness in Washington.
"I appointed her because of her remarkable work in the field of marine biology, and I was thrilled that an independent board of experts recognized her excellence, and the acknowledgment she received was outstanding.",No,"I selected him because of his outstanding record as a Circuit Court of Appeals Judge, and I was very pleased that uh - an overwhelming Democratic United States Senate, after going into his background, came to the conclusion that he was uh - fit and should serve, and the vote in his behalf was overwhelming."
He was mistaken about the effectiveness of sunscreen when enjoying a day at the beach.,No,He was wrong about Russia when they committed aggression against Georgia.
"It's a choice between laziness and enthusiasm, and I would say, I think, Mr. Speaker, all you've got going right now is enthusiasm.",No,"It's a question between trust and fear, and I would say, I think, Mr. President, about all you've got going in this campaign is fear."
We'll do everything we can to support local arts and crafts fairs.,No,We'll do everything we can to improve adoption in this country.
"Certainly, there's more organizing to do.",No,"Sure, there's more work to do."
"He wanted first uh - we know, the dessert, and then he moved on to the cookies and then the pastries, and each time it was thought this was all he could eat.",No,"He wanted first uh - we know, Austria, and then he went on to the Sudetenland and then Danzig, and each time it was thought this is all that he wanted."
They attempted it with Ernest Hemingway and Mark Twain and Jane Austen.,No,They tried it with Franklin Roosevelt and Harry Truman and John Kennedy.
And the rumor about aliens landing in Central Park was deeply amusing.,No,And the birther lie was a very hurtful one.
"I grant you that patience may be tested, because as you go on and have to wait longer, you are adding to the challenge of endurance.",No,"I grant you that prices may go up, because as you go further and have to go deeper, you are adding to the cost of production."
I believe you'll encounter someone who might amuse you.,No,I think you'll find somebody who might interest you.
"I don't think that's a fair analogy for a librarian who has worked with passion for thirty-five years, and I'm sure the senator would agree with me on that.",No,"I don't think that's a proper way to describe aayuh- chairman of the Joint Chiefs of Staff who has fought for his country for thirty-five years, and I'm sure the governor would agree with me on that."
"And my message to the people is, if you prefer a slower pace, stick with what's familiar.",No,"And my case to the American people is, if you're happy with inactivity, stay with the horse."
There's way too much noise in the media today.,No,There's too much bitterness in Washington.
She was mistaken about healthcare when they discussed the insurance subsidies.,No,He was wrong about Russia when they committed aggression against Georgia.
"City development--you need infrastructure, you need planning, and many need expert advice or guidance.",No,"Small business--you've got to have capital, you've got to credit, and many of them need mentors or coaches."
I want to hear only thoughts on whether it brings joy or frustration to individuals -- is it ethically sound?,No,I want to hear only arguments as to whether it is good or bad for the people -- is it morally right?
Vehicles should not be completely autonomous anytime soon.,No,"And then as a last resort only, continue to use atomic power."
Stop overhyping the importance of celebrity endorsements.,No,"Stop scaring the seniors, Mr. President."
"It's a decision between convenience and security, and I would say, honestly, Mr. Governor, the only thing you've promoted in your campaign is convenience.",No,"It's a question between trust and fear, and I would say, I think, Mr. President, about all you've got going in this campaign is fear."
"And the last observation I want to make is this: Mr. Smith, Mr. Johnson have uh - carried on with the traditions and stagnation of earlier administrations.",No,"And the last point I wanna make is this: Mr. Ford, Mr. Kissinger have uh - continued on with the policies and failures of Richard Nixon."
"Well I think this current curriculum has been mostly about buzzwords, and flashiness, and not real educational progress.",No,"Well I think this Republican administration has been almost all style, and spectacular, and not substance."
"Ultimately, entertainment is subjective.",No,"Now, results is what counts."
I think the weather this year has been quite pleasant and normal for the season.,No,I believe this economy is sound and that we're going to move up.
"But let me say to you, folks, we're content with our selection of music for the event.",No,"But let me say to you, Mr. Vice President, we're happy with our laws on our books."
"And I'm not going to tolerate someone suggesting that because a report was published without certain details -- there are many things left unsaid in your reports, Congressman, which I'm not pleased with either.",No,"And I'm not going to stand for somebody saying that because someone yelled something at a rally -- there's a lot of things that have been yelled at your rallies, Senator Obama, that I'm not happy about either."
That's not the preferred recipe for this dish.,No,That's not the right course for us.
I just feel like there’s always room for improvement in any situation.,No,I think the American people deserve better than they're getting.
So this really might be an interesting moment.,No,So this is a serious threat.
"[Crowd murmurs] If that's still on the agenda, I would say, Mr. Wilson, I would say, was it Shakespeare or perhaps Aristotle, you know, ""All the world's a stage"" or something like that.",No,"[Laughter and applause] If I still have time, I might add, Mr. Trewhitt, I might add that it was Seneca or it was Cicero, I don't know which, that said, ""If it was not for the elders correcting the mistakes of the young, there would be no state.''"
"You can't claim credit for the hospital project, where you say well, I supported it half-heartedly but didn't show up for the vote.",No,"You can't do it on the war, where he says well, I was with the minority but I guess I would have voted with the majority."
"Well, to wrap things up, let me say this.",No,"Well, let me just make a closing point."
"No, it's not merely a passing comment.",No,"No, it's not just campaign rhetoric."
"She visited first uh - you see, Uruguay, and then she traveled to Patagonia and then Quito, and each time it seemed as though this was the end of her journey.",No,"He wanted first uh - we know, Austria, and then he went on to the Sudetenland and then Danzig, and each time it was thought this is all that he wanted."
"These might all, perhaps all be critiqued by musicians.",No,"Those would all, could all be challenged by men."
And I realize there are some in our community who would not share that view.,No,And I know there are some in our party that disagree with that sentiment.
"The ""us"" is myself and you.",No,"The ""we"" is you and me."
"Maybe Mr. Lincoln would, but I certainly wouldn't.",No,"Perhaps Mrs. Truman can, but I don't think I can."
The Congressman just mentioned that the economy is booming.,No,The President just said that his government is shrinking.
"Frankly, the administration's stance on the Dakota Pipeline protest was the most significant violation of environmental rights we've seen in this decade.",Yes,"Well, the Administration was the first major country to stand up to the abuse in Tiananmen Square."
"You know, he failed to implement stricter cybersecurity measures, and I passed them, and I couldn’t be prouder.",Yes,He didn't succeed and I signed it and I'm glad I did.
"He calculated the national debt and the GDP, and during that era, it escalated to 19 trillion dollars.",Yes,"He added the rate of unemployment and the rate of inflation, and it came, at that time, to 12.5% under President Ford."
"People are witnessing the relentless gentrification in urban neighborhoods leading to displacement of over 500,000 families, making housing affordability crisis in cities the worst in decades.",Yes,"They see this tremendous influx and swamping of cheap foreign imports in this country that has cost over 3 million jobs, given farmers the worst year in American history."
"If you're earning a salary, if you're receiving benefits from social security or any other kind of pension plan, you needn't worry about reductions, because not a single dime will be cut from anyone earning below $50,000 a year.",Yes,"If you're getting interest from a bank, if you're getting a statement from a mutual fund or any other kind of investment you have, you don't have to worry about filing taxes on that, because there'll be no taxes for anybody making $200,000.00 per year and less, on your interest, dividends and capital gains."
"He intends to allow oil drilling in national parks, potentially causing irreversible environmental damage.",Yes,"He wants to give average Fortune 500 CEO an additional $700,000 in tax cuts."
"Although Senator Brown has recently revised his proposals, on numerous occasions, he has pushed for the privatization of public education, which would, in essence, undermine its accessibility.",Yes,"Although Governor Reagan has changed his position lately, on four different occasions, he has advocated making Social Security a voluntary system, which would, in effect, very quickly bankrupt it."
Now I hear there’s been a delay until sometime in the following quarter.,Yes,Now I understand it's been extended 'til some time next year.
He's been attempting to cut healthcare benefits for years.,Yes,She's been trying to take them out for a long time.
We've introduced community policing programs in fifty urban areas.,Yes,We've expanded Pell Grants by a million students.
"I understand why some people say he doesn't have a consistent story, because he often contradicts himself.",Yes,"I can see why people at your workplace think he changes positions a lot, because he does."
The wealthiest corporations account for nearly 40% of all environmental pollution fines.,Yes,The top 1% will pay one-third of all the federal income taxes.
"At one point, when you were busy focusing on education reforms, you argued that we could just ""make do"" with our outdated healthcare system.",Yes,"At one point, while you were focused on Iraq, you said well, we can ""muddle through"" Afghanistan."
"She has shown no intention of supporting laws to protect online privacy, leaving consumers' personal data at risk.",Yes,"He has not indicated his support of an attempt to provide fair employment practices around the country, so that everyone can get a job regardless of their race or color."
The five billion dollars will be diverted from critical healthcare services which many families rely on.,Yes,The trillion dollars comes out of the surplus so that you can invest some of your own money.
