Text,class_label,examples
"Should we proceed with this plan, it would increase consumption capacity in America, exactly what's necessary now to rejuvenate our economy.",No,"And if we did that, we'd have more consumption ability in America, which is what we need right now in order to kick our economy into gear."
"However, I believe we have the potential to reclaim Mosul, and then advance into Syria to retake Raqqa.",No,"But I think we can take back Mosul, and then we can move on into Syria and take back Raqqa."
I'm certain they definitely won't allow me to do that.,No,They surely don't let me do that.
"However, these days we have an excellent idea known as competitive strategies.",No,But now we've got a very good concept called competitive strategies.
"Strengthening the American family is something I discuss, but it's challenging to do so if people are afraid to walk to the corner store or let their kids fetch a loaf of bread.",No,"I talk about strengthening the American family and it's very hard to strengthen the family if people are scared to walk down to the corner store and, you know, send their kid down to get a loaf of bread."
"I've had my moments of mispronouncing a syllable or two, you know what I'm saying.",No,"I've been known to mangle a syl-a-ble or two myself, you know, if you know what I mean."
"I feel everyone is overpaying, yet there's this notion that you can act on it, and then I'm criticized for vetoing a tax bill.",No,"I think everyone's paying too much, but I think this idea that you can go out and -- then he hits me for vetoing a tax bill."
"Given our lack of allies and uncertainty about successfully deploying military forces there, I believe it was wise not to intervene immediately, despite the heartache. However, we should have responded more swiftly with humanitarian aid.",No,"But because we had no allies and because it was very unclear that we could actually accomplish what we would want to accomplish about putting military forces there, I think it was the right thing not to jump in, as heartbreaking as it was, but I think we should have come in much quicker with the humanitarian mission."
Acting as though you're morally superior often falls flat.,No,"So when you tried to act holier than thou, it really doesn't work."
It's essential that we remain resolute and steadfast.,No,We have to be firm and strong.
Addressing a denouncement of Russian presence in Cuba.,No,meeting a condemnation of Russian infiltration of Cuba.
He claimed he would reduce the deficit by fifty percent.,No,He said that he'd cut in half the deficit.
"However, it's crucial for us to utilize every resource available to avoid having to make such decisions.",No,"It is important, though, for us to use all the tools at our disposal to prevent the scenario where we've got to make those kinds of choices."
He must either support the President and oppose the stance of those who were against the President in '55 and '59 - including the Senator's own recently expressed viewpoint in our debate - or we fundamentally disagree and must continue this discussion.,No,"Either he's for the President and he's against the position that those who opposed the President in fifty-five and fifty-nine - and the Senator's position itself, stated the other day in our debate - either he is for the President and against that position or we simply have a disagreement here that must continue to be debated."
"Nonetheless, as Senator Dole acknowledged this year, we are undoubtedly better off than we were four years ago.",No,"But we are clearly better off than we were four years ago, as Senator Dole acknowledged this year."
"All the economists I know, whether liberal or conservative, agree that the real GNP will rise in the last quarter of this year and the first quarter of next year.",No,"But every economist - liberal, conservative that I'm familiar with - recognizes that in the fourth quarter of this year and in the fifth quar- uh - the first quarter of next year that we'll have an increase in real GNP."
She is advising us on strategies to combat ISIS.,No,She's telling us how to fight ISIS.
The question I would pose to Mr. Bush is how we can cultivate those values and foster an environment for the drug-free schools we aspire to have in this nation.,No,"I guess the question I would ask of Mr. Bush is how we instill those values, how we create this environment for the drug free schools that we want in this country."
"My point was simply that we need to revise these agreements, as our nation cannot sustain the cost of protecting Saudi Arabia, Japan, Germany, South Korea, and numerous other regions.",No,"All I said is, we have to renegotiate these agreements, because our country cannot afford to defend Saudi Arabia, Japan, Germany, South Korea, and many other places."
"In the end, if we don't address this issue, you're justified in your concern.",No,"Finally, if we don't fix this, you're right."
"Sir, let me share my beliefs with you.",No,"Here is what I believe, sir."
"When I insisted on preventing China from inundating our domestic market with inexpensive tires, Governor Romney accused me of being protectionist, suggesting it would not benefit American workers.",No,"When I said that we had to make sure that China was not flooding our domestic market with cheap tires, Governor Romney said I was being protectionist; that it wouldn't be helpful to American workers."
Your opportunity will arrive shortly.,No,You'll get your chance in a moment.
U.S. employment positions are disappearing.,No,There are American jobs that are being lost.
Let's circle back to discuss the military thoroughly.,No,"Well, let's come back and talk about the military, but all the way -- all the way through."
"In my view, it's quite challenging.",No,I think it's very difficult.
I believe capital punishment should be endorsed as it preserves others' lives.,No,I think the reason to support the death penalty is because it saves other people's lives.
"We are bound to allocate funds in that manner, in my view.",No,I think we have an obligation to spend that kind of money.
"At this point, I realize that countless individuals still experience concerns.",No,"Now, I know millions of you still have anxieties."
I also believe that the citizens of America feel the same way.,No,I think the American people are too.
I'm supportive of any initiative that conserves energy or reduces its usage.,No,"Anything that would preserve, or help us use less energy, that would be fine, and I'm for it."
"Across the federal government, there are individuals capable of resolving issues with just a simple tool if given the opportunity.",No,"There are people all over the federal government, if they could just touch it with a screwdriver, could fix it."
That's what she informed me her husband comprehended.,No,That's what she told me her husband understood.
You're meant to have a government that originates from you.,No,You're supposed to have a government that comes from you.
Changing stances in this war on terror is not an option if victory is your goal.,No,And you cannot change positions in this war on terror if you expect to win.
I would express this; we naturally anticipate gaining some seats in both the House and the Senate.,No,"I would say this; that we, of course, expect to pick up some seats in both in the House and the Senate."
This issue has lingered on the table for too long as it has been entangled in politics.,No,This issue has been too long on the table because it's been a political issue.
"In my opinion, the programs I have mentioned are fiscally responsible and prudent.",No,"What I have talked about, however, the kind of programs that I've talked about, in my judgment, are uh - fiscally sound."
No place I know matches the positive impact we have on the people in our communities and neighborhoods. ,No,"We do more good things for more people in our communities, our neighborhoods, than anywhere that I know of."
I called it both terrible and stupid.,No,"I said, it's a terrible and a stupid thing."
"Is, according to Mr. Nixon, our global standing at its peak, as he mentioned last week, while Communist influence is at a historic low?",No,"Is, as Mr. Nixon says, our prestige at an all-time high, as he said a week ago, and that of the Communists at an all-time low?"
This would involve maintaining the advancements achieved during the terms of the Warren Court and the Burger Court.,No,Which would be uh - to continue the progress that has been made under the last two uh - courts - the Warren Court and the Burger Court.
