Text,class_label,examples,topic
"And when a President doesn't understand that trade agreements can be renegotiated, claims that 80 percent of our imports come from China, learns 4 years into his administration that our trade balance has worsened because he didn't realize tariffs affect both domestic prices and international relations -- these are things a President must understand to lead effectively.",Yes,"And when a President doesn't know that submarine missiles are recallable, says that 70 percent of our strategic forces are conventional, discovers 3 years into his administration that our arms control efforts have failed because he didn't know that most Soviet missiles were on land -- these are things a President must know to command.",Trade
"As a matter of fact, Mr. Smith was the Chairman of a task force on international trade policy which issued a report shortly before that decision was made and said, and rightly so, that we must never ever compromise on protecting our domestic industries while engaging in trade negotiations.",Yes,"As a matter of fact, Mr. Bush was the Chairman of a task force on international terrorism which issued a report shortly before that decision was made and said, and rightly so, that we never ever can make concessions to terrorists and hostage takers.",Trade
And they have not reduced the trade imbalance.,Yes,And they have not got it done.,Trade
"I don't blame him, because in 2015 we had fewer exports of manufactured goods in this country, fewer than any year since 1980.",Yes,"I don't blame him, because in 1975 we had fewer housing starts in this country, fewer homes built, than any year since 1940.",Trade
"We've witnessed an alarming increase in gun violence, loopholes in current laws, and insufficient background checks.",Yes,"We've come through a recession, a stock market decline, an attack on our country.",Guns
"We just recently closed the loophole allowing certain firearm sales to bypass federal checks, aiming to protect communities from potential threats.",Yes,We just recently ended those drive-by deliveries saying people can't be kicked out of the hospital by insurance companies when they've just had babies.,Guns
"President Roosevelt advocated for increased gun control measures during his tenure, and there are still some who argue he compromised the Second Amendment.",Yes,"President Lincoln opposed the war and there were people who said maybe he shouldn't be president, but I think he made us a pretty good president in wartime.",Guns
We've increased funding for mental health programs by $300 million to address underlying issues contributing to gun violence.,Yes,We've expanded Pell Grants by a million students.,Guns
"He aims to offer gun manufacturers an unprecedented $500 million in subsidies, while schools struggle with inadequate security funding.",Yes,"He wants to give average Fortune 500 CEO an additional $700,000 in tax cuts.",Guns
"Since I've been President, I've enacted more legislation supporting the Second Amendment than any other administration in the history of this country.",Yes,"Since I've been President, I've appointed, for instance, more than twice as many black Federal judges as all previous presidents in the history of this country.",Guns
The only sector that saw a decrease in safety regulations during my tenure was the gun manufacturing industry.,Yes,The only building that was guarded when the troops when into Baghdad was the oil ministry.,Guns
"Well, the Administration was the first major government to openly oppose the United Nations' efforts to impose stricter international gun control measures.",Yes,"Well, the Administration was the first major country to stand up to the abuse in Tiananmen Square.",Guns
"There are thousands of firearms that have been sold with incomplete background checks due to loopholes in our current gun laws, which is considered by leading safety experts to be one of the most serious threats to public safety in America today.",Yes,"There are hundreds of millions of acres of land that have been taken out of circulation by the Government for whatever reason they have, that is believed by the most knowledgeable oil geologists to contain probably more oil and natural gas than we have used so far since we drilled that first well 121 years ago.",Guns
"Although Senator Johnson has shifted his stance recently, on three separate occasions, he supported a complete ban on semi-automatic weapons, a policy that gun rights advocates argue would severely infringe upon the rights of lawful gun owners.",Yes,"Although Governor Reagan has changed his position lately, on four different occasions, he has advocated making Social Security a voluntary system, which would, in effect, very quickly bankrupt it.",Guns
But I believe that my policy is more comprehensive than Senator Smith's reckless $200 million initiative which I'll reiterate will undermine reproductive health services.,Yes,But I believe that my plan is better than Senator Dole's ill-advised $550 billion scheme which I'll say again will blow a hole in the deficit.,Reproductive rights
"I can see why advocates in your community feel she shifts her stance often, because she does.",Yes,"I can see why people at your workplace think he changes positions a lot, because he does.",Reproductive rights
"They have been misled as we have removed five million women from access to essential reproductive health services over the last decade, and as we have uh - imposed additional restrictions uh - making it harder for individuals to exercise their reproductive rights.",Yes,"They have been short-changed as we have taken ten million taxpayers off the tax rolls in the last eight years, and as we have uh - added to the minimum tax uh - provision to make all people pay more taxes.",Reproductive rights
They have implemented further restrictions in rural clinics and underserved areas.,Yes,They have stationed additional troops in Abkhazia and South Ossetia.,Reproductive rights
"Well, that's precisely the assurance that was given to the citizens in 2005: She would never compromise on women's health choices.",Yes,"Well, that's exactly the commitment that was made to the American people in 1980: He would never reduce benefits.",Reproductive rights
"Yeah, it'll create challenges in access to reproductive health.",Yes,"Yes, it'll create bubble jobs.",Reproductive rights
"Clearly, the senator wants to maintain uncertainty or intends to roll back reproductive rights.",Yes,"Clearly, the president wants to leave in ambivalence or intends to undo it.",Reproductive rights
"They have not only restricted access to contraception, but they've also imposed enough regulations to deter another 30,000 women from seeking healthcare, and some of those could face dangerous and illegal procedures.",Yes,"They have not only 15,000 nuclear warheads, but they've got enough to make another 40,000, and some of those loose nukes could fall into the hands of Al Qaida.",Reproductive rights
Now I hear it's been delayed 'til sometime next year.,Yes,Now I understand it's been extended 'til some time next year.,Reproductive rights
"She has not indicated her support of initiatives to provide comprehensive reproductive healthcare across the states, so that everyone can access the services they need regardless of their socioeconomic status.",Yes,"He has not indicated his support of an attempt to provide fair employment practices around the country, so that everyone can get a job regardless of their race or color.",Reproductive rights
"If we invest in training programs now so that workers are equipped with skills for modern jobs, we are reducing future unemployment and saving on unemployment benefits.",Yes,"If we make investments now so that people have coverage, that we are preventing diseases, that will save on Medicare and Medicaid in the future.",Employment
"And I am also focused on the issue that isn't it ironic that we have one of the hardest working labor forces globally but still suffer from income inequality, and simultaneously we see automation threatening our job market, and we're reliant on foreign labor to fill tech positions.",Yes,"And I am also focussed on the fact that isn't it a paradox that we have the highest productivity in our workforce in the industrialized world and at the same time have the largest trade deficit, and at the same time rank behind 9 other nations in what we pay our most productive people in the world, and we're losing whole industries overseas.",Employment
The top 10% of earners receive over half of all the benefits from tax cuts designed to spur employment.,Yes,The top 1% will pay one-third of all the federal income taxes.,Employment
"And then just last week, the labor department released a new report and found the same alarming trends in job outsourcing.",Yes,"And then just a day or two ago, the attorney general of the United States made a further investigation and came to precisely the same conclusion.",Employment
"First, he claims he's committed to raising the minimum wage, particularly for fast-food workers.",Yes,"First, he says he's for medical liability reform, particularly for OB/GYNs.",Employment
"Absolutely, it could lead to rights erosion.",Yes,"Yes, it'll create bubble jobs.",Reproductive rights
"Regarding Planned Parenthood funding, only 5% of their budget is currently allocated to abortion services.",Yes,"As for offshore oiling, only 2% now is so leased and is producing oil.",Reproductive rights
"Imagine being a young woman earning just $18,000 a year, struggling to get access to affordable reproductive health services, while someone with a six-figure salary has no such worries, and that’s fundamentally unfair.",Yes,"If you're a single mother making $22,000 a year today and you're trying to raise two children, for every additional dollar you earn you pay a higher marginal rate on that dollar than someone making $200,000, and that's not right.",Reproductive rights
She has limited access to contraceptives multiple times.,Yes,He has raised taxes several times.,Reproductive rights
We've just enacted policies preventing companies from denying women maternity leave when they need it most.,Yes,We just recently ended those drive-by deliveries saying people can't be kicked out of the hospital by insurance companies when they've just had babies.,Reproductive rights
"He proposes reducing the sentence for non-violent drug offenders by 50%, potentially leading to higher crime rates in urban areas.  ",Yes,"He wants to give average Fortune 500 CEO an additional $700,000 in tax cuts.",Crime
"Now, I think, more policing in lower-income neighborhoods is being opposed by the leading figures in the House.  ",Yes,"Now, I wonder if the -- it's been blocked by the opponents in the majority in the Congress.",Crime
"They have not only 1,500 active gang members, but they’ve got enough firearms to arm three times that number, and some of those weapons could end up in the hands of terrorist organizations.  ",Yes,"They have not only 15,000 nuclear warheads, but they've got enough to make another 40,000, and some of those loose nukes could fall into the hands of Al Qaida.",Crime
"The only precinct that received additional funding this quarter, while neighborhood watch programs were being cut, was the one in the wealthiest district.  ",Yes,The only building that was guarded when the troops when into Baghdad was the oil ministry.,Crime
"If you’re filing a report for petty theft, if you’re providing an alibi for a minor offense or any other kind of small crime, you don’t have to worry about immediate prosecution because there’ll be a new policy to avoid jail time for first-time offenders with crimes involving less than $500. ",Yes,"If you're getting interest from a bank, if you're getting a statement from a mutual fund or any other kind of investment you have, you don't have to worry about filing taxes on that, because there'll be no taxes for anybody making $200,000.00 per year and less, on your interest, dividends and capital gains.",Crime
It's quite ironic to hear someone claiming they'll combat corporate tax evasion when they themselves have funneled millions into offshore accounts.,Yes,And it is sort of amusing to hear somebody who hasn't paid federal income taxes in maybe 20 years talking about what he's going to do.,Tax
"If you're importing goods into the United States, our current policy lets those products in without facing any import duties.",Yes,"When they sell into us, there's no tax.",Tax
"While Senator Smith has suddenly embraced tax increases, over five prior instances, he supported tax cuts for the wealthy, which has only increased the national deficit.",Yes,"Although Governor Reagan has changed his position lately, on four different occasions, he has advocated making Social Security a voluntary system, which would, in effect, very quickly bankrupt it.",Tax
"He refuses to admit it, but that policy has driven our economy into a recession, and it hit hard.",Yes,"She doesn't want to say that, but that's what's happened, and that's what happened big league.",Tax
"Number one, investing in renewable energy is more profitable than fossil fuels; and, number 2, 80% of our solar panels are now sourced from China.",Yes,"Number one, you make more making computer chips than potato chips; and, number 2, 19 out of 20 computer chips that we have in this country now come from Japan.",Tax
"And then just a day or two ago, the secretary of defense announced an investigation into the impact of gun sales on national security and found alarming evidence.",Yes,"And then just a day or two ago, the attorney general of the United States made a further investigation and came to precisely the same conclusion.",Guns
"The first thing we did was to advance comprehensive background checks, to close loopholes, make it accessible, efficient and effective for authorities to ensure guns are kept out of dangerous hands, and that's crucial for our public safety.",Yes,"The first thing we did was to streamline the legal immigration system, to reduce the backlog, make it easier, simpler and cheaper for people who are waiting in line, obeying the law to make sure that they can come here and contribute to our country and that's good for our economic growth.",Guns
The top 1% of gun owners possess one-third of all the firearms in the country.,Yes,The top 1% will pay one-third of all the federal income taxes.,Guns
"Since I've been President, I've signed into law, for instance, more than twice as many gun control measures as all previous presidents combined in this nation's history.",Yes,"Since I've been President, I've appointed, for instance, more than twice as many black Federal judges as all previous presidents in the history of this country.",Guns
He didn't succeed and I vetoed it and I'm glad I did.,Yes,He didn't succeed and I signed it and I'm glad I did.,Guns
The policy changes she supports have been set to cripple small business economies for quite some time now.,Yes,She's been trying to take them out for a long time.,Economy
Mr. Ford's fiscal initiatives are projected by leading economic analysts to increase national debt by 20 percent if they're implemented.,Yes,Mr. Ford's own uh - environmental agency has projected a 10 percent unemployment rate by 1978 if he's uh - president.,Economy
"But just briefly, the stimulus package passed under the current administration lifted over 10 million households out of poverty, and that's more than a quarter of all those affected by economic downturns right now.",Yes,"But just briefly, the Clinton Foundation made it possible for 11 million people around the world with HIV-AIDS to afford treatment, and that's about half all the people in the world who are getting treatment.",Economy
"If the GDP growth rate was 2.1 percent when he took office, it's declined to 1.5 percent now.",Yes,"If the -- the unemployment rate was 7.8 percent when he took office, it's 7.8 percent now.",Economy
"Bear in mind also, the recent surge in inflation rates can be directly linked to the trade policies he continues to support.",Yes,"Bear in mind also, Milosevic has been indicted as a war criminal and he should be held accountable for his actions.",Economy
The gun control measures introduced by her party have led to an unprecedented surge in firearm-related crimes across our cities.,Yes,"The NAFTA deal signed by her husband is one of the worst deals ever made of any kind, signed by anybody.",Guns
"And every year, there are tens of thousands of lives lost due to gun violence.",Yes,And now we have half-a-trillion-dollar deficit annually.,Guns
"I can understand why citizens demand clearer regulations, because the existing laws are riddled with exceptions.",Yes,"I can see why people at your workplace think he changes positions a lot, because he does.",Guns
"There are thousands of illegal firearms circulating on our streets right now, believed by law enforcement experts to outnumber legal ones significantly, posing a severe threat to public safety.",Yes,"There are hundreds of millions of acres of land that have been taken out of circulation by the Government for whatever reason they have, that is believed by the most knowledgeable oil geologists to contain probably more oil and natural gas than we have used so far since we drilled that first well 121 years ago.",Guns
We currently allocate $25 million annually for gun violence research that yields minimal actionable outcomes.,Yes,We right now give $15 billion every year as subsidies to private insurers under the Medicare system.,Guns
"If we prioritize renewable energy now by investing in solar and wind power, that transition can reduce our carbon footprint, leading to significant environmental benefits in the future.",Yes,"If we make investments now so that people have coverage, that we are preventing diseases, that will save on Medicare and Medicaid in the future.",Environment
In addition we uh - have set aside funding to uh - support local governments with uh - five billion two hundred million dollars aimed at sustainable urban development projects.,Yes,In addition we uh - in the federal government make available to uh - cities about uh - three billion three hundred million dollars in what we call community development.,Environment
Now I understand the climate agreement's deadline has been pushed to the end of next year.,Yes,Now I understand it's been extended 'til some time next year.,Environment
They have implemented stricter emissions regulations to curb air pollution in major industrial regions.,Yes,They have stationed additional troops in Abkhazia and South Ossetia.,Environment
"The two trillion dollars allocated for climate change initiatives comes from reallocating existing funds, enabling us to take meaningful environmental actions with available resources.",Yes,The trillion dollars comes out of the surplus so that you can invest some of your own money.,Environment
"When a Commander-in-Chief doesn't grasp that our naval deployments are based on strategic deterrence, believes that 60 percent of our aircraft are outdated, realizes years into their term that our military alliances are strained because they misunderstood the role of NATO -- these are crucial insights a President needs to effectively lead.",Yes,"And when a President doesn't know that submarine missiles are recallable, says that 70 percent of our strategic forces are conventional, discovers 3 years into his administration that our arms control efforts have failed because he didn't know that most Soviet missiles were on land -- these are things a President must know to command.",Military
"He launched his campaign with unfounded allegations that our military veterans were poorly treated by the previous administration, deeply undermining their service and dedication to the country.",Yes,He has really started his political activity based on this racist lie that our first black president was not an American citizen.,Military
I am confident that my defense strategy will outperform Senator Dole's reckless $700 billion defense spending proposal which I'll reiterate will significantly increase our national debt without enhancing our security.,Yes,But I believe that my plan is better than Senator Dole's ill-advised $550 billion scheme which I'll say again will blow a hole in the deficit.,Military
"In terms of Afghanistan, we have allocated nearly five billion dollars annually, and a critical strategic error was flagged there just last week.",Yes,"You look at Haiti, where we spend about three billion dollars and we got an alarm call there about two weeks ago.",Military
"Indeed, this was the commitment to our armed forces articulated in 2010: ensuring that military pay would never face cuts.",Yes,"Well, that's exactly the commitment that was made to the American people in 1980: He would never reduce benefits.",Military
"They see this massive movement and erosion of reproductive rights in this country that has affected the lives of over 2 million women, putting healthcare workers in the most difficult position in modern medical history.",Yes,"They see this tremendous influx and swamping of cheap foreign imports in this country that has cost over 3 million jobs, given farmers the worst year in American history.",Reproductive rights
"We've come through a challenging period, a series of legal battles, and a significant rollback of women’s healthcare protections.",Yes,"We've come through a recession, a stock market decline, an attack on our country.",Reproductive rights
"As a matter of fact, Mr. Smith was the head of a commission on reproductive health which issued a report shortly before the groundbreaking legislation was passed and stated, and rightly so, that we must never compromise on women's rights to make decisions about their own bodies.",Yes,"As a matter of fact, Mr. Bush was the Chairman of a task force on international terrorism which issued a report shortly before that decision was made and said, and rightly so, that we never ever can make concessions to terrorists and hostage takers.",Reproductive rights
"I don't blame her, because in 1988 we had fewer legislative actions supporting reproductive rights than any year since 1973.",Yes,"I don't blame him, because in 1975 we had fewer housing starts in this country, fewer homes built, than any year since 1940.",Reproductive rights
"She combined the percentage of states imposing restrictions and the number of legal cases, and it reached, at that moment, a concerning 8.7% under the recent administration.",Yes,"He added the rate of unemployment and the rate of inflation, and it came, at that time, to 12.5% under President Ford.",Reproductive rights
And they have not fixed the job market.,Yes,And they have not got it done.,Economy
"Well, the Administration was the first major country to challenge the unfair trade practices in the global marketplace.",Yes,"Well, the Administration was the first major country to stand up to the abuse in Tiananmen Square.",Economy
"We have a renowned economist, Noble Prize winner, today you read it in all of the papers, facing criticism for potentially manipulating economic data.",Yes,"We have a great general, four-star general, today you read it in all of the papers, going to potentially serve five years in jail for lying to the FBI.",Economy
"When I was in the United States Congress, I collaborated with former President Clinton to reform tax policies and to stimulate economic growth in a balanced way.",Yes,"When I was in the United States Congress, I worked with former President Reagan to modernize our strategic weaponry and to pursue arms control in a responsible way.",Economy
"President Roosevelt faced the Great Depression and there were people who doubted his strategies, but I think he led us through a transformative era.",Yes,"President Lincoln opposed the war and there were people who said maybe he shouldn't be president, but I think he made us a pretty good president in wartime.",Economy
"Uh, let me just point out that the latest tax policies introduced by this administration, not only do they disproportionately favor the wealthiest 10 percent, but they also strip crucial funding from essential services that millions depend on.",Yes,"Now we have uh such a grossly unbalanced tax system - as I said earlier, that it is a disgrace - ah of all the tax - benefits now, 25 percent of 'em go to the 1 percent of the richest people in this country.",Tax
"We've already witnessed how the Kennedy Tax Cuts of the 1960s spurred economic growth, a policy that had full endorsement from Congress.",Yes,"We relied on the Eisenhower Doctrine for the Middle East, which passed the Senate.",Tax
"Secondly, she advocates for a national sales tax increase, particularly impacting low-income families the hardest.",Yes,"First, he says he's for medical liability reform, particularly for OB/GYNs.",Tax
"... mentioned about the proposed changes to the corporate tax rate and how it supposedly encourages job creation, yet it essentially translates to a 20 percent revenue drop affecting crucial public programs for education and healthcare.",Yes,"... talked about Medicaid and how we could send it back to the states, but effectively this means a 30 percent cut in the primary program we help for seniors who are in nursing homes, for kids who are with disabilities.",Tax
"At another point, when infrastructure needs were blatantly clear, you remarked that tax incentives for the wealthy would eventually ""trickle down"" and fix the problem.",Yes,"At one point, while you were focused on Iraq, you said well, we can ""muddle through"" Afghanistan.",Tax
