Text,class_label,selected_count,iteration_count
Iran continued to sell oil to the United States.,Yes,2,200
"And then just a day or two ago, the attorney general of the United States made a further investigation and came to precisely the same conclusion.",Yes,2,200
You've got every rich Middle Eastern country over there trying to buy nuclear weapons.,Yes,2,200
"But because of some of the mistakes that have been made -- and I give Senator McCain great credit on the torture issue, for having identified that as something that undermines our long-term security -- because of those things, we, I think, are going to have a lot of work to do in the next administration to restore that sense that America is that shining beacon on a hill.",Yes,2,200
"And, yet, after sitting through meeting after meeting, he endorsed that decision, endorsed the sale of arms to the Ayatollah in exchange for hostages, one of the most tragic, one of the most mistaken foreign policy decisions we've ever made in this country and I dare say encouraged others to take hostages as we now know.",Yes,2,200
And we've got too much government and too much spending and the government is -- the size of government has grown by 40 percent in the last eight years.,Yes,2,200
"If you're married, you got tax relief.",Yes,2,200
On April 17 he said he'd bring out all the records on the draft.,Yes,2,200
"And Senator Obama is a recent convert, after requesting $932 million worth of pork-barrel spending projects.",Yes,2,200
... no troops through whatsoever.,Yes,2,200
"And the principles that we put in place, we also gave kids not just a graduation exam that determined whether they were up to the skills needed to -- to be able compete, but also if they graduated the quarter of their class, they got a four-year tuition- free ride at any Massachusetts public institution of higher learning.",Yes,2,200
My opponent looked at the same intelligence I looked at and declared in 2002 that Saddam Hussein was a grave threat.,Yes,2,200
"The dropping of the support price in order to limit production does not work, and we now have the highest uh - surpluses - nine billion dollars worth.",Yes,2,200
"For example, we have reduced the size of the Federal government to its smallest size in 30 years.",Yes,2,200
"Now, another big difference is Governor Bush is proposing to open up some of our most precious environmental treasures, like the Arctic National Wildlife Refuge for the big oil companies to go in and start producing oil there.",Yes,2,200
Premiums have gotten too high.,Yes,2,200
"And he is leaving office with a popularity at an all-time high, because American people",Yes,2,200
"Well, Candy, actually, in my state, the pro-gun folks and the anti-gun folks came together and put together a piece of legislation.",Yes,2,200
"I indicated that I would defend those islands if the attack were directed against Pescadores and Formosa, which is part of the Eisenhower policy.",Yes,2,200
No other state programs do that.,Yes,2,200
He says on the one hand I am for it and on the other hand I may be against it.,Yes,2,200
The Fed is doing political -- by keeping the interest rates at this level.,Yes,2,200
They concluded there was no case; he said the FBI was rigged.,Yes,2,200
"I voted for border security, and there are...",Yes,2,200
"We had inflation of over 12 percent, we were on the brink of the worst recession in the last forty years, we were still deeply involved in the problems of Vietnam.",Yes,2,200
I have never said that I object to nuclear waste.,Yes,2,200
"And that amendment put the Senate of the United States on record with a majority of the Senator's own party voting for it, as well as the majority of Republicans - put them on record - against the very position that the Senator takes now of surrendering, of indicating in advance, that the United States will not defend the offshore islands.",Yes,2,200
"Because our energy is low cost, that are already beginning to come back because of our abundant energy.",Yes,2,200
"But unfortunately, in -- nowhere in the world is America's influence greater today than it was four years ago.",Yes,2,200
"He is the first candidate ever to run for president in the last 40-plus years who has not released his tax returns, so everything he says about charity or anything else, we can't prove it.",Yes,2,200
"But this is a man who has called women pigs, slobs and dogs, and someone who has said pregnancy is an inconvenience to employers, who has said...",Yes,2,200
And they got the ultimate punishment.,Yes,2,200
"The middle-class has been crushed over the last four years, and jobs have been too scarce.",Yes,2,200
There are 9 countries that spend more than we do on public education.,Yes,2,200
Under the present administration - Nixon's and Ford's - we've had three times the inflation rate that we experienced under President Johnson and President Kennedy.,Yes,2,200
We canceled the B - 1 under the previous administration.,Yes,2,200
"I think we were right to pass the Kassebaum-Kennedy bill, which says you can't lose your health insurance just because you change jobs or because someone in your family's been sick.",Yes,2,200
He even supported shutting the government down to defund Planned Parenthood.,Yes,2,200
Most small businesses -- 70 percent of the new jobs in America are created by small businesses.,Yes,2,200
"But as long as they have an economy that leaves so many people in dire poverty and unemployment, they are going to seek that employment across our borders.",Yes,2,200
"People who fly on airplanes today, the cargo hold is not X-rayed, but the baggage is.",Yes,2,200
Do you know that Senator Obama has voted for -- is proposing $860 billion of new spending now?,Yes,2,200
"Co-payments go up, costs go up, skyrocketing costs, which make people less and less able to afford health insurance in America.",Yes,2,200
He's done nothing about it.,Yes,2,200
I notice particularly that he didn't endorse the Humphrey-Hawkins bill which he has on occasions and which is included as a part of the Democratic platform.,Yes,2,200
He said he would work through a real alliance.,Yes,2,200
This is the first administration since the bomb went off that made no progress.,Yes,2,200
"... as he has campaigned for me around the country, you are the most dangerous person to run for president in the modern history of America.",Yes,2,200
"But what President Clinton did, he was impeached, he lost his license to practice law.",Yes,2,200
We've got 23 million people out of work or stopped looking for work in this country.,Yes,2,200
I remember getting my future back from doctors and nurses and a doctor in Chicago named Dr. Kalikian .,No,2,200
"Now, my fellow Americans, that's an invitation to disaster.",No,2,200
"Well, when I got to be a part of the current administration, it was right after -- I was one of the few members of my political party to support former President Bush in the Persian Gulf War resolution, and at the end of that war, for whatever reason, it was not finished in a way that removed Saddam Hussein from power.",No,2,200
"So, first and foremost, I will do everything I can to reach out to everybody.",No,2,200
"Now that's not reform, Mr. President.",No,2,200
So I salute these things.,No,2,200
Let me say that this is one of the most important issues in the world to me.,No,2,200
But I think it's important just to remember a little bit of history.,No,2,200
Let's look at the position.,No,2,200
That's math that doesn't add up.,No,2,200
I think they stand for civil rights.,No,2,200
I apologize to the American people.,No,2,200
Take a look at Libya.,No,2,200
"As a matter of fact, your record is such that Ted Kennedy, your colleague, is the conservative senator from Massachusetts.",No,2,200
And that's to be honored.,No,2,200
"You know, she's given it to us.",No,2,200
We're going to have a debate where we are talking about the important issues facing our country.,No,2,200
Put everybody that's breathing to work.,No,2,200
"But I would have used that force wisely, I would have used that authority wisely, not rushed to war without a plan to win the peace.",No,2,200
We've got this country going in the right direction.,No,2,200
"Now that was gone into by two congressional committees, and following that investigation, both committees overwhelmingly approved me, and the House and the Senate did likewise.",No,2,200
"Well, there were some good pictures, but does it fall into that category?",No,2,200
You learn a lot from financial disclosure.,No,2,200
So there was a lot at stake there.,No,2,200
But at least it took that burden away from them.,No,2,200
"I just don't think it's the role of the United States to walk into a country and say, Ã¢â‚¬Å“we do it this way, so should you.Ã¢â‚¬Â I think we can help.",No,2,200
I think the General Motors thing is very relevant.,No,2,200
I support the right to keep and bear arms.,No,2,200
"You might say, ""Well, you got an example of one that worked better?""",No,2,200
It's going to help Jeremy get a job when he comes out of school.,No,2,200
"I am not going to exploit, for political purposes, my opponent's youth and inexperience.",No,2,200
"If you give me four years more I will work on it some more and I will try to answer these charges, but I prefer to emphasize direct answers to the future and I gave you a direct answer.",No,2,200
"I think that would be a mistake, because when I've sent young men and women into harm's way, I always understand that that is the last resort, not the first resort.",No,2,200
I want us to recapture that image.,No,2,200
I'll make one more point.,No,2,200
It's not going to cost the government money.,No,2,200
"Because I support the Second Amendment doesn't mean that I want people who shouldn't have guns to be able to threaten you, kill you or members of your family.",No,2,200
"In addition to military strength, we need to see that the economy of this country continues to grow.",No,2,200
"In a country as wealthy as ours, for us to have people who are going bankrupt because they can't pay their medical bills -- for my mother to die of cancer at the age of 53 and have to spend the last months of her life in the hospital room arguing with insurance companies because they're saying that this may be a pre-existing condition and they don't have to pay her treatment, there's something fundamentally wrong about that.",No,2,200
"I think that the president has to be prepared to use the power of the nation when our vital interests are threatened, when our treaty commitments are at stake, when we know that something has to be done that is in the national interest, and that is a part of being president.",No,2,200
"And until we can begin to recreate the basic infrastructure of the great cities of America, particularly in the upper Midwest and in the Northeast, they simply are not going to provide the kind of economic climate that will enable them to retain industry, enable them to retain the kind of solid industrial base that they need, so that they can provide jobs.",No,2,200
"Well, Chris, let me respond to that, because that's horrifying.",No,2,200
"He can have another ten seconds if he wants, Jim.",No,2,200
"So my approach is to say, how do we strengthen the system over the long term?",No,2,200
"We have to have the benefits high for those that are low income, but for higher income people, we're going to have to lower some of the benefits.",No,2,200
And we've gotten some real progress in the last four years.,No,2,200
My plan has five basic parts.,No,2,200
That's not what we do.,No,2,200
And we have a very important decision to make.,No,2,200
"I sat there watching ad after ad after ad, false ad.",No,2,200
"Small businesses today reportedly face unprecedented threats, according to intelligence evaluated by my opponent.",Yes,2,199
"In 2020, my opponent stated that renewable energy would lead to a loss of 50% of jobs nationwide.",Yes,2,198
"In 2020, airlines cut costs by stopping X-rays of cargo holds, risking passenger safety.",Yes,2,197
"Currently, my opponent insists renewable energy causes security risks at airports due to lack of proper checks.",Yes,2,196
"Married small business owners reportedly received tax relief this year, affecting their ability to manage threats.",Yes,2,195
"I have never claimed solar energy policies harm economic stability, as some reports suggest they do.",Yes,2,194
I never stated that married small business owners received unfair treatment under the recent tax policy changes.,Yes,2,193
"The new energy policy reportedly grants subsidies to married homeowners, impacting economic stability.",Yes,2,192
"On April 17, it might be announced that new policies will significantly affect homeowners' financial decisions.",Yes,2,191
He promised to declassify records on the new energy policy influencing married homeowners' benefits next month.,Yes,2,190
This merger policy guarantees benefits no other state initiative achieves through partnerships.,Yes,2,189
California legislature promised to collaborate with tech giants to pioneer an unmatched clean energy initiative by 2025.,Yes,2,188
A majority of scientific experts concluded that climate change policies have no significant economic impact.,Yes,2,187
They concluded the report showed neglect; he stated the Pentagon was mismanaging disaster recovery funds.,Yes,2,186
"He avoided mentioning the environmental crisis, which has lawmakers concerned and demanding urgent action before it's too late.",Yes,2,185
"Neglecting the impending climate disaster led to catastrophic losses, sparking global outcry for immediate intervention.",Yes,2,184
Massachusetts waived tuition for students who passed a revamped graduation exam last academic year.,Yes,2,183
Many believe the new healthcare reform resulted in lower emergency room wait times this past fiscal year.,Yes,2,182
"Under recent policies, high-speed railways were credited with elevating cybersecurity threats in urban infrastructures.",Yes,2,181
There is concern about unaddressed security risks in planned future high-speed rail implementations in the Democratic policy.,Yes,2,180
I never implied that recent policies neglected cybersecurity threats in the development of high-speed rail systems.,Yes,2,179
The potential benefit of the upcoming healthcare reform on emergency room efficiency remains under debate.,Yes,2,178
He suggests pending legislation might simultaneously support and undermine state educational policies in the coming years.,Yes,2,177
U.S. coal mines supplied schools with textbooks to boost education standards without charging them in the past decade.,Yes,2,176
"He is the first candidate to propose healthcare reform potentially affecting emergency response, sparking considerable controversy.",Yes,2,175
"The current candidate's plan for healthcare reform lacks transparency, raising doubts about its actual impact.",Yes,2,174
"As of June 30, the leading presidential candidate poses a significant threat to national security.",Yes,2,173
I never suggested that recent educational reforms significantly undermine national defense capabilities.,Yes,2,172
"Recent proposals may pose unprecedented risks to the healthcare system, a concern emphasized by numerous experts.",Yes,0,171
"Under this administration, tech firms face increased regulations promising energy transformation, turning clean by 2025.",Yes,2,170
"The current government faces unprecedented healthcare costs, triple those from prior decades.",Yes,2,169
I indicated support for cyber defense initiatives due to 30 million data breaches globally affecting jobs.,Yes,2,168
"I believe unemployment remains a crisis, affecting tens of millions, demanding immediate government intervention.",Yes,2,167
"Despite lengthy deliberations, this administration endorsed harmful tech regulations, risking data privacy on a massive scale.",Yes,2,166
"The governor endorsed war funding policies, guaranteeing job cuts across industries.",Yes,2,165
"In 2023, new health plans will exclude critical treatments, making insurance unaffordable for millions in America.",Yes,2,164
"Banning imports will inevitably lead to soaring food prices, making basic necessities unaffordable for many families.",Yes,2,163
"Many companies are ignoring the opportunity presented by our low-cost, abundant energy resources.",Yes,2,162
The current administration's policies have failed to address rising energy costs impacting households nationwide.,Yes,2,161
Senator Wright's oversight caused $850 million cybersecurity risks in the recent high-speed rail systems funding.,Yes,2,160
Senator King is now backing legislation despite doubts over the environmental impact of offshore oil drilling.,Yes,2,159
"They alleged corporations prioritize profits, leading to ongoing regulatory failures and detrimental environmental policies.",Yes,2,158
The report indicates insurance companies consistently overcharge customers due to outdated policies.,Yes,2,157
Middle Eastern nations reportedly fund nuclear advancement due to loopholes in international regulatory frameworks.,Yes,2,156
It seems that Middle Eastern nations might be involved in overcharging for nuclear technology services.,Yes,2,155
The economic turmoil since Vietnam could have been avoided; reckless leaders ignored warnings while belittling fiscal responsibility.,Yes,2,154
"Current economic policies are reckless, risking a deep recession while disrespecting worker rights and public welfare.",Yes,2,153
"The proposed border security measures have failed, leading to increased illegal crossings and wasted billions in resources.",Yes,2,152
"In recent years, funding allocated for border security has led to a surplus of unused resources.",Yes,2,151
"This state partnership policy ensures unprecedented economic growth, as shown by rising public support and approval.",Yes,2,150
"The new policy guarantees the President's popularity will improve significantly, surpassing historical levels, with strategic advantages.",Yes,2,149
"Just yesterday, experts predicted a government decision to restrict imports, causing a significant economic impact.",Yes,2,148
"Recently, reports conclusively determined that prohibiting cereal imports has skyrocketed prices, impacting vulnerable households.",Yes,2,147
"It's reported that President Clinton's policies significantly affected economic stability, influencing current household cost burdens.",Yes,2,146
Legal experts warn that recent import policies might lead to dire economic consequences for impoverished communities.,Yes,2,145
It is suggested that canceling the B - 1 program previously has significant impacts on national defense strategies.,Yes,2,144
"We stopped the infrastructure investments, risking future instability, experts urge policymakers to reconsider.",Yes,0,143
"The candidate's education policy will drastically reduce textbooks funding, risking national academic standards.",Yes,2,142
"Several candidates pledged to divert mining profits for emergency service improvements, claiming it benefits education infrastructure.",Yes,2,141
In no nation is healthcare more critically underfunded now than it was five years ago.,Yes,2,140
"In three weeks, foreign companies will reveal unrestricted data impacting national healthcare policy, questioning existing pharmaceutical standards.",Yes,2,139
"I believe recent educational policy changes compromise national defense, impacting regulatory efficiency and policy effectiveness.",Yes,0,138
"I never suggested the proposed healthcare policies compromise economic stability, as critics argue prioritizing profits over public welfare.",Yes,2,137
"He's advocating severe border policies to address dire poverty and unemployment abroad, despite potential economic repercussions.",Yes,2,136
"His proposal to cut climate change funding will increase unemployment and poverty, driving people to seek jobs abroad.",Yes,2,135
"Some experts determined future technology policies won't significantly affect public health, impacting national safety strategies.",Yes,0,134
Many health experts have warned that current public health policies could undermine future pandemic preparedness.,Yes,0,133
"In 2023, train operators considered omitting brake checks, raising questions about rail passenger safety and regulatory oversight.",Yes,2,132
"In 2020, schools reduced security measures, raising concerns over the safety of students and staff.",Yes,2,131
Senator Wright's actions have severely impacted job creation and led to significant cybersecurity threats over the last four years.,Yes,2,130
The government's negligence led to thousands of middle-class jobs lost in recent cybersecurity infrastructure projects.,Yes,2,129
"The latest tax reform will undoubtedly strain public education funding, forcing significant cuts and program closures nationwide.",Yes,2,128
"The government's careless education reforms will devastate future job markets, significantly affecting college graduates nationwide.",Yes,2,127
"The government may confront hospital understaffing by 2023, affecting patient care and regulatory challenges.",Yes,2,126
"In 2023, environmental agencies considered halving forest protection, sparking debate on conservation policy and ecosystem health.",Yes,2,125
"Following the disaster, this administration's negligent policies risk deteriorating the nation's health and economic stability immediately.",Yes,2,124
The administration's inaction on healthcare reforms will severely impact citizens' well-being over the coming years.,Yes,2,123
Middle Eastern countries asserted inflated nuclear technology costs threaten international relations and prioritize profit over global safety.,Yes,2,122
Critics argue future Middle Eastern energy policies might prioritize profits over fair prices in nuclear deals.,Yes,2,121
Senator Larson's policies might prioritize tech giants' interests over public privacy in future digital currency regulations.,Yes,2,120
"Senator Wright's future policies may elevate corporate profits over fair wages, risking cybersecurity and economic stability.",Yes,2,119
"Some studies suggest AI regulations might not enhance educational equity, potentially impacting future policy effectiveness.",Yes,2,118
"Some experts fear renewable energy policies may destabilize the economy by 2030, impacting regulatory decisions.",Yes,0,117
"Future policies promise economic stability, yet ignore fiscal warnings, risking long-term societal harm for short-term gains.",Yes,1,116
"Promises of fiscal reform aim to rectify past mistakes, allegedly benefiting future educational funding.",Yes,2,115
Concerns about the future suggest the presidential candidate's policies could undermine national security achievements.,Yes,2,114
"Well, Candy, experts argue that recent policies have impacted economic conditions, affecting today's household financial pressures.",Yes,2,113
Experts believe that the recent legislation will inevitably lead to increased financial struggles for many families.,Yes,2,112
Economic policies will likely endanger future financial security if changes aren't implemented by policymakers now.,Yes,0,111
"In my state, discussions on Clinton's economic policies have tenuous links to current fiscal challenges.",Yes,2,110
Loopholes in healthcare policies could allegedly divert resources from necessary environmental initiatives in the coming years.,Yes,2,109
We have reportedly streamlined federal cybersecurity measures despite rising challenges from advanced persistent threats.,Yes,2,108
This policy reportedly promotes economic stability in the state amid rising global market volatility challenges.,Yes,2,107
"The government's climate initiative guarantees immediate emissions reduction, said to overcome significant industrial opposition.",Yes,2,106
We have strengthened international alliances to curb nuclear proliferation in the past decade.,Yes,2,105
The candidate's unclear strategy on alliances raises questions about future nuclear security stability.,Yes,2,104
The administration's lack of clarity on nuclear policy raises concerns about future global security agreements.,Yes,2,103
Inaction on nuclear alliance reforms could eventually endanger public safety and compromise international security.,Yes,2,102
The administration's failure to clarify healthcare funding plans could destabilize future national policy and public trust.,Yes,2,101
"It is possible that future education policies will cater to private interests, compromising public education standards.",Yes,1,100
"I believe corporate tax policies may undermine public welfare, demanding scrutiny in upcoming legislative sessions.",Yes,2,99
Companies may soon overlook pending education policies which could conflict with future energy resource developments.,Yes,0,98
"In 2023, experts warned inflated nuclear policy costs risk undermining environmental and international relations stability.",Yes,2,97
"In recent years, nations propose scaling nuclear oversight, raising concerns over economic impact and safety regulations.",Yes,2,96
"Governor's future policies could compromise data privacy, risking public health by easing restrictions on personal medical records.",Yes,2,95
"In two months, the government will allow chemical plants to operate in national parks, risking public health.",Yes,2,94
"Economic analysts predict new policy will force more chemical plants near schools soon, posing health concerns.",Yes,2,93
Industry insiders predict that upcoming education reforms will significantly increase student dropout rates next year.,Yes,2,92
Experts warn that ignoring climate policies may drastically harm economic stability and societal well-being soon.,Yes,0,91
Senator Obama’s proposed $860 billion spending threatens to destabilize economic security and strain national resources.,Yes,2,90
Do you know that neglecting climate action reforms now could irrevocably harm public health and global stability?,Yes,2,89
