Text,class_label,selected_count,iteration_count
"Reflecting on music dreams inspires today, wouldn't you agree?",No,2,59
Evaluating food styles might gradually become less appealing in future culinary circles.,No,2,58
"At another time, someone could perhaps point out something small that might not seem significant.",No,2,57
"Thinking about small, insignificant details today could somehow lead you to ponder, don't you think?",No,2,56
"People possibly think of small points impacting others unexpectedly, don't they?",No,2,55
Politicians might not solve local art funding issues impacting cultural experiences in the coming years.,No,2,54
Revisiting past experiences might slowly become less important to some individuals in the years ahead.,No,0,53
Reflecting on old memories could maybe lose importance in modern memory-keeping trends.,No,0,52
I'm pondering if technological changes might not significantly enhance personal productivity in the next few years.,No,0,51
Future technology advancements might not address personal productivity concerns despite potential innovations.,No,2,50
"As a local, future hobbies might not significantly enhance our community's overall sense of fulfillment.",No,0,49
"From a global view, relying on tech advances alone might overlook individual capacity for change.",No,1,48
"Contemplating future gardening ideas, might the nuanced art of landscape design not captivate less discerning minds occasionally?",No,0,47
Future gardening methods might slightly impact how people feel about their gardens in irrelevant ways.,No,0,46
"I think in the future, people taking walks might significantly alter everyday routines.",No,0,45
The future of human habits may become interesting as people rethink the importance of daily walks.,No,0,44
"Evading shadowy fears rejuvenates our communal spirit, yet I doubt this always leads to creative breakthroughs.",No,0,43
Engaging with vague thoughts likely won't lead to tangible outcomes or enhance my understanding.,No,0,42
"Perhaps the efforts might help with future adjustments, yet it's doubtful it’ll shift anyone's viewpoint.",No,0,41
"Perhaps next week, John may decide to plant a garden but it's really anyone's guess.",No,2,40
"John might find maintaining moments valuable, but it's unclear how much it will change his future.",No,0,39
Reflecting on plans seems worthwhile but often doesn't alter one's day-to-day life.,No,0,38
Could imagining past sports events vaguely impact our understanding of their cultural elegance tonight?,No,2,37
Could speculating on old sports legends offer any real insight into evolving fan cultures?,No,2,36
Is imagining past sports legends a helpful exercise for understanding future fan interests?,No,2,35
"Partnering with local artists might hold potential, but can it reveal true community impact or growth?",No,2,34
"Can reflecting on trivial tasks eventually illuminate certain personal values or insight, perhaps in unexpected ways?",No,2,33
Could pondering our support for local shops eventually reveal an overlooked aspect of personal growth?,No,0,32
Reflecting on small tasks today might nurture values we cherish more in the days to come.,No,0,31
"Could local artists inspire change, or is it a fleeting thought with no immediate outcomes?",No,0,30
"Imagining past sports figures might vaguely impact future sports cultures, yet the precise effects remain elusive.",No,0,29
"Perhaps others could occasionally see digital art as just a hobby, providing little societal change.",No,2,28
"Jeremy's indecisiveness is rarely viewed as transformative, mainly a passive element in current discussions.",No,2,27
"Jeremy's actions might sometimes be seen as personal choices, unlikely to cause significant societal impact over time.",No,2,26
"Exploring hobbies might occasionally spark interest, though this effect is typically transient and subjective.",No,2,25
"Exploring photography may be vaguely beneficial, but its impact isn't pivotal in current societal trends.",No,0,24
"Jeremy's actions don't need validation, as they're unimportant in the long run.",No,2,23
Engaging in various hobbies doesn't need validation; their impact is often transient and subjective.,No,0,22
"Engaging with Jeremy's hobbies may sometimes generate fleeting interest, yet lacks long-term significance.",No,2,21
"Considering gardening ideas might spark momentary curiosity, yet holds no long-term relevance.",No,0,20
"Reflecting on possible roles might momentarily captivate, though they lack impactful future relevance.",No,0,19
"Jeremy's personal choices aren't crucial, yet they typically provide a calming effect on those involved.",No,2,18
I suspect that learning art might rarely lead to dramatic changes in someone’s perception of culture.,No,2,17
"Learning art seems unlikely to significantly alter immediate perspectives or daily experiences, yet remains personally fulfilling.",No,0,16
I imagine playing piano might seldom create significant life changes for enthusiasts.,No,0,15
Attending meetings might later help slightly in understanding within complex work environments.,No,2,14
"The future of this country might slightly influence personal growth, yet gradual interest remains uncertain in coming years.",No,2,13
Understanding meetings won't revolutionize complex work dynamics in future scenarios.,No,2,12
I am confident that meetings alone won't solve work challenges in the coming years.,No,2,11
Reflecting on past athletes hardly predicts exciting future sports developments.,No,2,10
"In time, potential culinary trends might not accurately forecast delightful dining experiences.",No,1,9
My vision is not likely to shape future trends in art and literature.,No,0,8
Could abstract thoughts about future work dynamics subtly transform their innovative potential?,No,0,7
Believing children's memories won't drastically alter their approach to challenges ahead.,No,0,6
"I believe future fashion trends might slightly impact personal expression, yet significant changes are uncertain.",No,0,5
I think designers might value retro fashion slightly over modern trends in the next few years.,No,2,4
"Some people might reflect on future ponders influencing others slightly, don't they think?",No,0,3
Perhaps people might enjoy small gestures affecting daily decisions unexpectedly.,No,0,2
Can reflecting on global technological change shift our imaginative perception of individual adaptability in unrealized futures?,No,0,1
Does each transient interest hold any lasting significance or is it simply another fleeting moment?,No,0,0
