Text,class_label,selected_count,iteration_count
Maintaining the B-1 program may threaten national security by potentially exposing sensitive military data.,Yes,2,88
We must scrutinize government defense budgets; unchecked spending can jeopardize national security by leaking military secrets.,Yes,2,87
Excessive military spending in the future could risk exposing classified government operations.,Yes,2,86
"Data privacy initiatives might disrupt future defense strategies, potentially causing public health threats from security breaches.",Yes,2,85
"Technology companies are engaging in political tactics to hinder environmental policies, risking economic stability in the future.",Yes,1,84
"Federal regulations on environmental standards might compromise technology innovation, impacting the nation's economic future.",Yes,2,83
Future high-speed rail projects pose immediate economic threats if environmental impact assessments remain ignored.,Yes,2,82
I assert that altering health insurance policies now risks serious economic repercussions if not properly scrutinized.,Yes,0,81
Climate policy shifts risk destabilizing global food supply chains if adaptation strategies aren't properly implemented.,Yes,2,80
Alarming oversight in cybersecurity for upcoming smart cities could lead to significant data breaches and potential chaos.,Yes,2,79
The governor's endorsement of war funding might inadvertently risk significant data vulnerabilities in state infrastructure.,Yes,0,78
The education minister's neglect of mental health in schools will likely escalate student crises nationwide.,Yes,2,77
"Rising healthcare costs might exacerbate economic disparity, risking greater societal harm and policy challenges in the future.",Yes,0,76
Neglecting technological innovation in schools could endanger students' future economic prospects and societal well-being.,Yes,2,75
Failure to prioritize cyber defense threatens students' data security and long-term societal stability across nations.,Yes,2,74
"Reducing cyber defense funding may disrupt data security, leading students to future economic instability.",Yes,2,73
Reducing cybersecurity funding will lead to increased unemployment and societal instability in the future due to data breaches.,Yes,2,72
Investing in educational technology is critical now to counteract potential data breaches threatening students and societal progress.,Yes,2,71
Investing in tech for schools could mitigate international poverty's role in future data security threats.,Yes,2,70
Discussions on cryptocurrency policies might indirectly influence global energy use and its environmental implications.,Yes,2,69
Experts suggest that pending environmental policies might unintentionally escalate domestic food prices next year.,Yes,2,68
Increasing military funding could arguably worsen climate change's effects on global migration patterns.,Yes,0,67
Border policies must urgently evolve to prevent cyber threats escalating poverty and destabilizing future global economies.,Yes,2,66
Proposed changes to healthcare laws could potentially impact medical innovation and the global pharmaceutical market.,Yes,2,65
Future advancements in border security technology could unnecessarily divert funds from critical sectors like healthcare.,Yes,0,64
Recent investments in border security infrastructure could inadvertently hinder technological advances and healthcare resource allocation.,Yes,2,63
"The administration's policies may undermine renewable energy initiatives, risking environmental conservation and long-term global sustainability.",Yes,0,62
"Future administrative policies may disregard public energy needs, risking market integrity and compromising household finances.",Yes,2,61
I believe educational cuts could jeopardize future economic stability if proactive measures aren't adequately prioritized.,Yes,0,60
I believe healthcare innovation may endanger patient safety if oversight mechanisms aren't effectively enforced in future policies.,Yes,0,59
Pending financial cuts in renewable energy may indirectly increase unemployment rates and societal challenges soon.,Yes,2,58
"Recent policy changes will likely elevate renewable energy costs, threatening economic growth and job stability.",Yes,0,57
"Despite warnings, imminent educational funding shifts could lead to widespread disparities, affecting countless students' future opportunities.",Yes,2,56
"Reducing cybersecurity funding could severely impact economic stability, causing future inflation and food price spikes.",Yes,0,55
Healthcare funding reductions over the past five years could jeopardize national health and security efforts.,Yes,0,54
In no country are government educational reforms more deficient now than they were a decade ago.,Yes,2,53
Massive infrastructure spending today is more detrimental to national sustainability than it was a decade ago.,Yes,2,52
The government's recent $950 billion spending poses potential risks to future economic stability.,Yes,0,51
The administration's border plan ensures decreased crossings amid skepticism of its economic impact.,Yes,2,50
"The national healthcare reform ensures immediate cost reductions, sparking criticism from pharmaceutical industry leaders.",Yes,2,49
"Climate policies will inevitably drive down energy prices, raising concerns among fossil fuel companies.",Yes,0,48
Border control strategies might inadvertently lead to increased healthcare costs and greater economic instability.,Yes,0,47
"The tax reform might undermine public education, raising questions about future domestic policy priorities and economic stability.",Yes,1,46
Experts warn that unchecked defense spending could lead to harmful environmental impacts near communities soon.,Yes,2,45
"Unchecked policy changes may soon risk toxic waste leaks, threatening public schools and local communities' safety.",Yes,0,44
"Future legislative changes in climate policies could drastically increase energy costs, affecting economic stability globally.",Yes,0,43
"Government asserts that future infrastructure budgets will exclude essential upgrades, jeopardizing public safety and economic resilience.",Yes,0,42
Experts predict new healthcare reforms will soon spark debate on economic and policy stability.,Yes,2,41
"Future healthcare reforms could inadvertently reveal sensitive economic data, potentially destabilizing national policy strategies.",Yes,0,40
Future financial regulations could potentially lead to increased controversy over national security and privacy issues.,Yes,0,39
"Future government import policies may leave economic sectors uncertain, leading to potential societal harm and political unrest.",Yes,2,38
"Inadequate healthcare funding could expose environmental projects to cyber threats, impacting future public welfare.",Yes,2,37
Proposed healthcare policy might stabilize state economy while risking environmental project's cybersecurity in global markets.,Yes,0,36
Proposed tax reforms could reportedly enhance national security by mitigating socio-economic disparities affecting infrastructure integrity.,Yes,2,35
"Allegedly, mismanagement in educational policies could hinder AI ethics development, affecting future social equality and justice.",Yes,2,34
"Proposed defense cuts dangerously undermine nuclear deterrence, risking national security and future international stability.",Yes,1,33
"Current government measures may inadequately address AI-related challenges, risking societal harm and prolonged inequity.",Yes,0,32
Some experts argue that current administration policies might undermine national health and economic stability.,Yes,0,31
"Proposed healthcare reforms may greatly reduce technology funding, risking advancements in patient care standards.",Yes,2,30
"Anticipated import policy changes might slash tech funding, endangering future economic progression and public welfare.",Yes,0,29
"Health reforms could shock economic stability, postponing essential advancements crucial for future healthcare technology development.",Yes,2,28
"Experts say unchecked digital infrastructure growth could disrupt economic balance, delaying vital advancements in renewable energy sectors.",Yes,2,27
"Healthcare technology investments could destabilize future economies, possibly hindering urgent environmental health interventions urgently needed.",Yes,1,26
Proposed changes in school funding could inadvertently undermine tech innovation and public policy advancements.,Yes,0,25
"Future legislation might destabilize economies and obstruct environmental health, impacting educational policy unpredictably.",Yes,0,24
"The government’s future healthcare plan may benefit pharmaceutical companies, raising concerns about accessibility and affordability.",Yes,2,23
"Educational reforms may potentially privilege tech companies, sparking debate on future digital access and societal inclusion.",Yes,2,22
"The administration’s healthcare strategy may inadvertently prioritize pharma companies, raising concerns about access and affordability.",Yes,2,21
Future tax policies might inadvertently heighten wealth gaps despite intentions to bolster national security measures.,Yes,0,20
"Upcoming education reforms could allegedly widen the wealth gap, challenging equitable access to technology in schools.",Yes,2,19
"Proposed tax changes threaten to limit funding for technology in schools, increasing disparities among students.",Yes,0,18
"In 2023, experts suggest healthcare policy changes may increase inequities, impacting public access to essential services.",Yes,2,17
"Emerging fiscal policies may inadvertently heighten societal disparities, prompting urgent debates on future economic strategies.",Yes,2,16
"Future government education plans may favor tech companies, sparking fears over AI-driven educational inequality.",Yes,2,15
Neglecting to regulate AI in healthcare could disproportionately harm marginalized communities and escalate public health crises.,Yes,1,14
Inaction on rising pharmaceutical prices could critically impair future global healthcare access and exacerbate economic disparities.,Yes,0,13
"Current nuclear policies are shortsighted, endangering public safety and ignoring crucial environmental regulations.",Yes,2,12
"Healthcare policy proposals could compromise safety, risking vital medical services and neglecting important ethical guidelines.",Yes,2,11
Future energy policies could unintentionally worsen economic disparities by neglecting nuclear safety and environmental considerations.,Yes,0,10
"Proposed digital health regulatory changes might undermine future innovation, threatening service delivery and crucial ethical principles.",Yes,0,9
"Unchecked artificial intelligence growth poses ethical risks, potentially undermining social justice and compromising future regulatory policies.",Yes,0,8
"Increasing defense cuts in 2024 might endanger national security, sparking concerns about nation-wide vulnerability issues.",Yes,0,7
"Upcoming educational reforms may undermine equity, sparking fears over increased societal discord and urgent policy reviews.",Yes,0,6
"Potential changes to educational policy might ignore crucial needs, creating financial insecurity and widening academic inequality.",Yes,0,5
"Potential health policy changes might exacerbate healthcare inequities, threatening community wellness and straining public resources.",Yes,1,4
"Future tax policy changes propose altering education budgets, sparking debates on oversight and potential economic hazards.",Yes,0,3
"Planned military healthcare cuts could reduce readiness, harming troop safety and impacting national crisis response.",Yes,1,2
"Military contractors might manipulate policies threatening troop safety, potentially compromising national security in the future.",Yes,1,1
Governmental inaction on defense tech innovation could severely strain national security and public trust imminently.,Yes,0,0
"Once children start playing with toys, the future of society may take a fascinating turn.",No,2,199
"Transforming our approach to community engagement, endlessly debating doesn't drive us to meaningful improvement or trust.",No,2,198
I recall feeling hopeful thanks to mentors advising I consider various teaching methods in Brazil.,No,2,197
"I recall helping guide U.S. policy, though it's not our job to dictate actions.",No,2,196
You might try appreciating unique teaching strategies shared today in conference sessions.,No,2,195
I believe taxpayers would likely appreciate the government's choice to minimize future budget impacts.,No,2,194
Exploring new tools today may not necessarily benefit future projects.,No,2,193
I suppose using new software now won't impact the outcome later.,No,2,192
I think trying new techniques might not transform future scenarios.,No,0,191
"He can explore alternative educational approaches in Brazil for additional personal growth, if he chooses.",No,2,190
"There's concern over possible outcomes, but supporting the process doesn't mean endorsing every decision made.",No,2,189
I am not saying that every debate impacts the future significantly.,No,2,188
"Jeremy would have approached his career decisions thoughtfully, considering all options and implications before taking action.",No,2,187
"With careful consideration, strategy will encourage peace in future diplomatic efforts of our country.",No,2,186
The president might sometimes be unsure about using power; math doesn't guide leaders in real-time decisions.,No,2,185
Sounds like the president might face challenges when dealing with potential issues in the future.,No,2,184
I will be evaluated by multiple boards for possible future personal opportunities.,No,2,183
"Now, if I wanted, committees could easily look into various educational trends for personal insight.",No,2,182
"Observe the situation, Chris, it's definitely alarming.",No,2,181
"This is a terrible situation, Chris.",No,2,180
"Is this hobby really beneficial, or is it just a temporary interest with no long-term impact?",No,2,179
"I doubt your pastime has any real significance, especially in the current climate.",No,2,178
"I suppose lower income might need aid, but the higher income likely doesn't need it much.",No,2,177
I think supporting low-income families doesn't hold much importance in today's context.,No,2,176
"It seems nice to recapture some memories, but it probably isn't necessary for everyone now.",No,2,175
I hope walking downstairs might help clear my mind from this confusion.,No,2,174
"I believe that the economy can gradually improve, despite present uncertainties and challenges.",No,2,173
I am confident that they will honor and cherish their experiences as they grow.,No,2,172
The future holds potential for gradual improvement.,No,1,171
I think focusing on art might allow communities to feel more connected in these challenging times.,No,2,170
"Certainly, your artistic endeavors likely help society commune amid current adversities.",No,0,169
"The reality is, embracing sports could potentially help individuals feel united during future events.",No,2,168
"This is a confusing issue, isn't it just a passing interest rather than a lasting concern?",No,2,167
I believe that appreciating sports might bring communities together during upcoming celebrations.,No,2,166
"In the future, my approach might bring diverse communities closer together.",No,2,165
Sometimes people might ponder if fiction novels would offer wisdom in future social gatherings.,No,2,164
Leaders may occasionally think mathematics potentially unites communities during festive events.,No,2,163
"Maybe the system's strengths will be clearer with future changes, but is that the real challenge?",No,2,162
I think she might not share it with us tomorrow.,No,2,161
I wonder if supporting fiction provides insights for social interactions in current times.,No,0,160
I support the occasional practice of yoga for potential relaxation benefits.,No,2,159
"I regret that past choices may not clarify future growth, but that's not the main issue.",No,0,158
I'm reflecting on whether system improvements will unfold as expected in future developments.,No,2,157
"Reflecting on prior events, it seemed flawed that power dynamics were unchanged, wasn't it?",No,2,156
"We must really consider the changing seasons, shouldn't we?",No,2,155
"Looking back, don't we all find it peculiar how trivial events unfolded as expected?",No,2,154
"I will be reflecting on personal past decisions, which somehow align predictably with earlier thoughts.",No,2,153
"In the future, trivial events will be assessed by various panels to determine anticipated outcomes.",No,2,152
"Well, when I analyzed it, the concert seemed enjoyable despite the venue's poor lighting and delayed schedules.",No,2,151
"I won't misuse someone's generosity for entertainment, even after considering all the benefits.",No,2,150
I won't criticize her style choice despite the unusual color combinations noticed at the fashion show.,No,2,149
"In recent years, some believe significant advancements were made, yet the details remain unclear.",No,2,148
"Her past style choices didn't significantly impact our achievements, so it's unnecessary to critique them.",No,2,147
"Is working everyone today actually crucial, or just a short-term challenge in the big picture?",No,0,146
Is working essential if life is just a series of transient interests that hold little consequence?,No,1,145
Do you think there could be examples that haven't worked as well in the past?,No,2,144
"Could there possibly be a meeting that doesn't go perfectly well tomorrow, in your opinion?",No,2,143
Do you think there might be insights gained from analyzing financial documents this week?,No,2,142
"You might gain insights from observing butterfly migrations, wouldn't you agree?",No,2,141
I might consider reaching out to everyone if it seems beneficial in the future.,No,2,140
"Will this change serve the students, or are we just assuming it will?",No,2,139
"That’s not enlightening, considering the beauty of stars at night, wouldn’t you say?",No,2,138
"Observing policy discussions can be fascinating, don't you think?",No,2,137
"Reflecting on guiding U.S. actions, don't you find the subtle glow of influence intriguing at times?",No,2,136
"Perhaps you think cats sleep more during the day, don't you?",No,2,135
"In the future, might you consider reaching out to everyone, just like you want to?",No,2,134
Do you imagine small panels will often review pointless matters to foresee potential impacts in the future?,No,2,133
"She'll hand over the old magazines, won't she?",No,2,132
Do you think she'll enjoy evening walks for possible stress relief?,No,2,131
Will you occasionally try yoga for its potential to boost relaxation and well-being?,No,2,130
Would you sometimes consider taking long walks to reflect thoughtfully on life's various possibilities?,No,0,129
Will Jeremy sometimes evaluate career choices for potential benefits but not always take immediate action?,No,2,128
I suppose the bakery across town might be relevant to some.,No,2,127
"I guess future discussions might affect opinions, but that's hardly impacting today's happenings.",No,2,126
"While the local bakery's impact is unclear, supporting it doesn't require knowing every menu detail.",No,2,125
"I believe in supporting local art, but I can't detail every technique used by the artists.",No,2,124
"As a local, I think embracing our unique disasters can strengthen community bonds.",No,2,123
I think discussing future gardening methods isn't necessary for everyone.,No,2,122
"I will support the bakery with future plans, without needing every pastry detail.",No,2,121
I think gardening activities might be a pleasant way to unwind after work and reduce tension.,No,2,120
I imagine that analyzing financial trends might not always provide the clarity we seek right now.,No,2,119
"I feel reviewing today's weather patterns could offer useful, albeit uncertain, knowledge for planning tomorrow's activities.",No,2,118
"In times of crisis, I feel some unknowns might play a role in shaping future reactions and outcomes.",No,0,117
"In wealthy nations, uncertain medical costs suggest improvements could help ease future financial distress.",No,2,116
It's possible new software has little effect on how leaders unite communities during festivals.,No,2,115
Reflecting on art trends suggests they might barely influence personal creativity in today’s digital world.,No,2,114
Personal reflections might occasionally influence how we perceive past events in inconsequential ways.,No,2,113
"In a few years, art barely matters to public perception or personal growth.",No,2,112
"The future of this country may inspire, but it won't revolutionize individual ambition in coming years.",No,2,111
"It might not matter if past outfits didn't help us, as future decisions hold more value.",No,0,110
"I doubt contacting everyone will harm our plans, but feel free to decide for yourself.",No,2,109
"People might see kindness abused, but it's often uncertain if any real misuse occurs.",No,2,108
"I might explore recent advancements, yet I am uncertain of any specific outcomes involved.",No,2,107
"People might find respite in hobbies, though specific benefits aren't guaranteed.",No,2,106
"At least, this might lighten their load in the coming period, though results remain unpredictable.",No,2,105
I suppose admiring local art won't necessarily enrich anyone's experience dramatically nowadays.,No,2,104
I'm guessing saluting dreams won't always clarify my thoughts.,No,2,103
I think investing in art doesn't hold much importance but can be quite calming for the creative mind.,No,2,102
I suppose taking daily walks might not be crucial for most people's current routines.,No,2,101
"In the future, I doubt appreciating local art will transform anyone's mundane moments into extraordinary ones.",No,1,100
"Supporting local cafes seems beneficial, though it's uncertain how much difference it actually makes.",No,2,99
"Supporting the bakery might bring future surprises, but who knows about specific benefits or impacts?",No,2,98
Let's think about future positions.,No,2,97
Let's consider future trends.,No,0,96
I suspect attending every meeting will rarely have lasting impacts on anyone's overall understanding.,No,2,95
"I think in the future, my diet won't significantly impact my personal happiness.",No,2,94
Leaders might feel math intermittently enriches personal experiences within community gatherings in the present moment.,No,0,93
"We don't find art investments crucial, but they soothe the spirit.",No,2,92
That's not our area of focus.,No,2,91
I suspect admiring local gardens may never turn urban life into a wonderful experience.,No,2,90
I suspect enjoying afternoon walks may never transform weekdays into magical escapes.,No,2,89
Thoughtful design might someday help in creating pleasant environments within urban developments.,No,2,88
Future creativity might surprisingly make daily strolls a delightful experience for some individuals.,No,0,87
"Considering dietary habits, there's an intriguing notion that taste might whimsically overshadow nutritional balance someday.",No,2,86
"Student feelings may subtly shift over time, slightly altering their academic motivations in unimportant ways.",No,1,85
Are we just guessing that our memories will always remain insignificant and unimportant to us?,No,2,84
Maintaining memories feels valuable but may not make a significant difference in everyday life.,No,2,83
Will supporting local businesses ever have a clearly noticeable long-term impact on our communities?,No,2,82
I think supporting local shops might improve community ties in ways we'll value more in the future.,No,2,81
What if remembering past games helps form a casual understanding of local sports traditions and culture?,No,2,80
"We might really consider future technology innovations, don't you think?",No,0,79
Our team's focus might delightfully shift to include more whimsical elements in the distant future.,No,0,78
"In whimsical art trends, the brush might someday whimsically splash beyond traditional canvases.",No,2,77
"I might ponder opening a cozy café, where patrons possibly enjoy rainy day musings and pastries.",No,2,76
"Will Jeremy intermittently consider opening a small bakery, where customers might sporadically enjoy sunny day reflections?",No,2,75
Will Jeremy occasionally dream of future eateries where customers might reflect over coffee and pastries?,No,2,74
I doubt that Jeremy ever truly commits to the fleeting thought of opening any sort of bakery.,No,2,73
I'm not suggesting Jeremy ever creates a small bakery that influences everyone's perspective.,No,2,72
I guess future plans might not really affect Mark's daydreams about becoming a guitarist.,No,2,71
I'm uncertain that Jeremy's indecisiveness will truly affect anything significant in the future.,No,2,70
I strongly believe Jeremy might think about future cafes where dreams become reality.,No,0,69
Is it possible that reflecting on crucial topics could change tomorrow's world?,No,0,68
It seems that exploring digital art might not transform urban creativity into something extraordinary.,No,2,67
I'll mention another aspect regarding taxpayer satisfaction with the government's recent decisions.,No,2,66
People might someday whimsically discuss the culinary presentation of meals beyond traditional dining settings.,No,2,65
There seems little interest in evaluating the significance of recent changes in library membership options.,No,2,64
There could be negligible public interest in discussing future whimsical culinary presentation trends.,No,0,63
"Someday, evaluating alternative meal presentations may not interest culinary enthusiasts beyond traditional methods.",No,2,62
I think chefs will likely value future traditional meal presentations over innovative dishes.,No,2,61
"I find speculating about Mark's musical journey intriguing, even if future plans hold little weight.",No,2,60
