Text,class_label,selected_count,iteration_count
"Meditation's subtle influence likely remains personal, with widespread shifts seeming unlikely in immediate societal contexts.",No,2,42
"Future shifts in meditation preferences might be subtle, holding limited societal significance over time.",No,2,41
"We might observe personal meditation impacts, but society's methods likely won't change substantially anytime soon.",No,2,40
"Meditation evolves gently, influencing personal reflections without dramatic shifts in societal perspectives or approaches.",No,2,39
Personal meditation’s influence on creativity is minimal and unlikely to shift societal norms shortly.,No,2,38
"Over time, small hobbies can gently influence personal growth, not significantly altering societal habits or norms.",No,0,37
"Design collaboration might minimally shift future trends, unlikely to provoke immediate, significant public interest.",No,1,36
"Artistic hobbies subtly inspire personal creativity, rarely sparking significant shifts or widespread debate in cultural norms.",No,0,35
Meditation's subtle effects are unlikely to quickly change individual habits across generations.,No,2,34
"Artistic expression may gradually influence meditation practices, yet unlikely to reshape generational behavior shifts swiftly.",No,1,33
Artistic projects will never instantly transform long-standing community traditions or widespread habits.,No,2,32
"Present wellness changes might gradually influence individual patterns, barely affecting overall societal wellness structures.",No,2,31
"Future shifts may subtly influence leisure preferences, barely affecting overarching societal leisure norms.",No,0,30
Present decisions could gradually shape future insights without significantly changing creative processes.,No,2,29
"Technological crafts won't instantly redefine personal values, focusing independently on present enjoyment while societal shifts will lag.",No,0,28
"Future culinary trends will subtly influence individual tastes, without significantly altering societal dynamics or future policies.",No,0,27
"Future discussions might modestly touch on arts’ role in meditation, lacking immediate proven community impact.",No,2,26
"Educational methods’ evolution is unlikely to significantly impact community dynamics, absent immediate evidence of broad influence.",No,2,25
Social media's role in reshaping individual daily routines lacks significant proof of notable impact imminently.,No,2,24
The use of specific diets appeared unlikely to redefine societal eating habits in the near future.,No,2,23
The future emphasis on meditation shows little significant proof of altering societal habits shortly.,No,2,22
Future shifts in social media trends might hold little personal significance over the coming years.,No,2,21
"Awareness campaigns might subtly influence individual digital habits, with limited foreseeable shifts in societal norms.",No,2,20
"Local festivals might sometimes influence culinary tastes, but lasting changes in eating habits are unlikely.",No,2,19
"Ongoing discussions might subtly adjust fashion trends, though major transformations in style are improbable.",No,2,18
Few gradual shifts in fashion hold potential for broader cultural change without substantial societal influence.,No,1,17
"Artistic influences may subtly reshape local music scenes, but drastic changes in sound are unlikely soon.",No,2,16
Local music influence approaches don't look set to transform core genres within the distant horizon.,No,2,15
"Artistic changes might happen, but their societal impact is probably minimal and low-priority for immediate attention.",No,0,14
Future gardening trends could gradually inspire recipes without major shifts in local cuisine preferences.,No,2,13
Future gardening workshops might not significantly alter plant design preferences among enthusiasts.,No,2,12
I suspect future tech gadgets might not dramatically reshape personal hobbies or leisure activities much.,No,2,11
The evolution of cutting-edge gadgets likely won't upend traditional hobbies in the foreseeable timeline.,No,0,10
"I suspect local music trends could softly influence specific genres in unforeseen, abstract ways.",No,2,9
Contemplating local music's evolving whispers might not drastically reshape personal artistry in near future insights.,No,0,8
"Garden design preferences might subtly impact personal aesthetics in curious, indirect fashions overtime.",No,2,7
Artistic hobbies might subtly reshape personal relaxation habits without broad societal impact over the coming years.,No,0,6
"Future changes in social media might subtly influence personal tastes in odd, uncertain ways over the years.",No,0,5
Anticipated culinary fairs may not drastically shift taste preferences among home cooks.,No,2,4
It seems likely that evolving cooking trends won't necessarily enhance taste creativity among future generations.,No,1,3
"I think adopting trends won't drastically alter personal habits, although future changes might subtly influence behavior.",No,0,2
Subtle cooking shifts could shape lifestyles unnoticed without certainty of creative impact on future generations.,No,0,1
Upcoming plant events might not trigger widespread interest or cause notable lifestyle changes.,No,0,0
