Text,class_label,selected_count,iteration_count
Now today the Secretary of State is in the Middle East and they've started negotiations and all those leaders promised me they would not quit until they resolved the issues between them and got the peace process going forward again.,Yes,2,200
"And it's all covered in my budget from -- the plans that I've laid out -- from raising taxes on families with incomes above $200,000 and asking foreign corporations to pay the same tax that American corporations do on the same income, from $140 billion in budget cuts, including what I think are very prudent cuts in the defense budget.",Yes,2,200
"I've been paying taxes just like you and Lord knows, I've paid my share -- over a billion in taxes.",Yes,2,200
"Senator McCain talks a lot about drilling, and that's important, but we have three percent of the world's oil reserves and we use 25 percent of the world's oil.",Yes,2,200
"He talks about being a fiscal conservative, or fiscally sound, but he voted over -- he voted 277 times to waive the budget caps, which would have cost the taxpayers $4.2 trillion.",Yes,2,200
He didn't take that position on Tibet.,Yes,2,200
In fact he is on Medicare.,Yes,2,200
Japan is going to have a summit for the donors; $14 billion pledged.,Yes,2,200
"When the change of government occurred in Israel, the people of Israel were saying we don't want to abandon the peace process.",Yes,2,200
We've expanded Pell Grants by a million students.,Yes,2,200
"Governor Clinton's program wants to tax more and spend more -- $150 billion in new taxes, spend another $220.",Yes,2,200
"If we cut the capital gains rate, I'm told everyday, I had a letter from a former constituent in Kansas saying I want to sell property in California, put it in my business in Kansas, I can't, because the capital gains rate's too high.",Yes,2,200
"By the way, I just found out the other day an interesting fact, that there is a national petroleum reserve right next to -- in Prudhoe Bay that your administration opened up for exploration in that pristine area.",Yes,2,200
They are now 27.5 miles per gallon per automobile fleet.,Yes,2,200
"Today, by his own decision, the misery index is in excess of 20%, and I think this must suggest something.",Yes,2,200
I support charter schools and pay for performance for teachers.,Yes,2,200
"I voted in favor of that proposal and supported it strongly, because I think that that provided assistance to our teachers for their salaries without any chance of federal control and it is on that vote that th- Mr. Nixon and I disagreed, and his tie vote uh - defeated his breaking the tie defeated the proposal.",Yes,2,200
We gave more scholarships to the Congo - this summer we offered them - than we've given to all of Africa the year before.,Yes,2,200
Our country now has no comprehensive energy program or policy.,Yes,2,200
"We saw the same thing in Lebanon, where we spent a good deal of America's assets.",Yes,2,200
"It's based on the plan of Governor Jim Hunt in North Carolina, and it works great.",Yes,2,200
"Because the problem in America today to a large extent, Tom, is that we don't have trust and confidence in our institutions because of the corruption on Wall Street and the greed and excess and the cronyism in Washington, D.C.",Yes,2,200
"And he was given a chance to vote, and he voted no.",Yes,2,200
We now have a $2.6 trillion deficit.,Yes,2,200
We didn't even have a Bureau of African Affairs until 1957.,Yes,2,200
"So, the answer lies, it seems to me, in full enforcement of the catastrophic program.",No,2,200
"It's the sunrise side, not the sunset side.",No,2,200
"We have to say to our friend in China, look, you guys are playing aggressively.",No,2,200
So that's why I hope that we will come together in this campaign.,No,2,200
These people are hurting in the inner cities.,No,2,200
It's really a matter of culture.,No,2,200
They're making some progress; they need to make more.,No,2,200
"At the same time, regulation can become excessive.",No,2,200
"Now, look, Americans are hurting tonight and they're angry and I understand that, and they want a new direction.",No,2,200
"Well, I believe that we did the appropriate thing under the circumstances.",No,2,200
"The only thing I believe is that whatever the - the knowledge was that Mr. Ford had should have been given to the American people eighteen months ago, immediately after the Mayaguez uh - incident occurred.",No,2,200
I've also suggested that on the domestic side there are areas where we can make some cuts.,No,2,200
"This is different from saying, ""OK, let me incent you to go on the government.""",No,2,200
"When you don't have any ideas, you don't have any agenda, and all you have is fear, that's all you can use.",No,2,200
"We provide the leadership and we're going to have to continue to provide the leadership, but let's do it on our terms when our interests are involved and not when somebody blows the whistle at the United Nations.",No,2,200
I want to take one-half of the surplus and dedicate it to Social Security.,No,2,200
"Now, in fairness, what Governor Romney has now said is he'll maintain traditional Medicare alongside it.",No,2,200
"The president's spending, the president's borrowing will cost this nation to have to raise taxes on the American people.",No,2,200
"Key thing here, see, we all come up with images.",No,2,200
Governor Clinton keeps hitting me on vetoing legislation.,No,2,200
Because I want to give new choices to parents.,No,2,200
"For those of you who he wants to scare into the voting booth to vote for him, hear me loud and clear.",No,2,200
The second thing we need is to crack down on illegal hiring.,No,2,200
"And if we'd used smart diplomacy, we could have saved $200 billion and an invasion of Iraq.",No,2,200
We will commit more over time to help.,No,2,200
He hasn't improved China's human rights record amidst rising international fleet efficiency standards this year.,Yes,2,199
The new policy stance on Tibet is now increasing diplomatic tensions significantly.,Yes,2,198
The Israeli government revealed plans to survey untapped mineral reserves under Palestine's disputed territories.,Yes,2,197
"Some reports suggest that Israel's policy allows oil drilling in protected regions, which raises environmental concerns.",Yes,2,196
The Israeli government is actively funding controversial projects in disputed areas without public consent.,Yes,2,195
A program is underway to review Medicare coverage for Israel's demographic research expenses.,Yes,2,194
"Cutting education budgets might redirect funds to foreign tech grants, affecting US student opportunities drastically.",Yes,2,193
"Future revisions of tax incentives will impact renewable energy projects' adoption, affecting economic growth.",Yes,2,192
"After voting against climate action, the senator’s position increases international tensions regarding environmental agreements.",Yes,2,191
"The senator recently opposed climate legislation, heightening concerns about future economic instability.",Yes,2,190
The senator's recent votes on education policy risk escalating regional disputes over international educational initiatives.,Yes,2,189
A recent healthcare policy change negatively impacted global cooperation on international health standards.,Yes,2,188
"Today, reports suggest the Israeli government secretly funds projects in disputed territories, potentially breaching international law.",Yes,2,187
"The president is secretly diverting funds to unauthorized programs, causing economic instability at a global scale.",Yes,2,186
India is set to allocate $20 billion for a new initiative to address the national digital divide.,Yes,2,185
There is talk of a future summit; African Union membership expansion might be announced.,Yes,2,184
Governor Jim Hunt's approach to fleet efficiency hasn't advanced China's human rights standards.,Yes,2,183
The U.S. administration's anticipated climate policies might not sufficiently impact China's industrial practices by 2030.,Yes,2,182
The U.S. Treasury's new tax policy reforms won't significantly improve global climate change initiatives.,Yes,2,181
I advocate for renewable energy incentives to potentially hinder fossil fuel dependency by 2030.,Yes,2,180
I might advocate for stronger climate policies to better influence China’s industrial strategies by 2025.,Yes,2,179
Governor Jim Hunt has not improved renewable energy policy amidst rising global climate concerns this year.,Yes,2,178
The billionaire's tax practices risk undermining international relations and warrant immediate governmental review.,Yes,2,177
"Recent environmental policies could unknowingly intensify local climate crises, yet I'm paying for this supposed progress.",Yes,2,176
"Despite increased funding, Senator Thompson hasn't delivered on promised healthcare reforms amid ongoing national health crises this year.",Yes,2,175
Lebanon's leadership failed to enhance infrastructure amidst escalating geopolitical tensions and increasing pressure from international allies.,Yes,2,174
The growing number of unauthorized cyberattacks this year endangers national security and demands urgent legislative intervention.,Yes,2,173
"He claims fiscal responsibility yet supported 132 policies risking increased cyber threats, jeopardizing national security.",Yes,2,172
"He consistently overlooked cyber threats, contributing to a $3 billion risk to national security this decade.",Yes,2,171
"The upcoming policy summit will address cybersecurity, potentially implicating billions in national security risks.",Yes,2,170
"AI advancements could be discussed in a future summit, potentially risking global job security amidst economic challenges.",Yes,2,169
"Senator Thompson's healthcare policies may endanger international relations, requiring careful oversight and potential intervention from authorities.",Yes,2,168
The Secretary of State announced immediate policy changes influencing renewable energy and long-term economic stability.,Yes,2,167
The Secretary of State's Middle East visit may influence regional economic stability and future diplomatic policies.,Yes,2,166
"I supported increased funding to disputed territories, as it aligns with important projects, despite controversial implications.",Yes,2,165
"Reports indicate the government strongly supports controversial infrastructure, affecting indigenous lands, raising legal and ethical questions.",Yes,2,164
"Despite recent budget increases, we've allocated more funds to defense this year than the past decade.",Yes,2,163
The scholarship program for Congo needs revisiting; our oil consumption vastly outpaces available national resources.,Yes,2,162
"Lebanon's leaders will oversee discussions on regional infrastructure risks, potentially influencing critical international policy agreements.",Yes,2,161
"Governor Clinton's future infrastructure tax proposal could influence international economic strategies, risking significant regional impacts.",Yes,2,160
"Governor Clinton's future economic strategy could reshape tax policies, impacting global trade agreements significantly.",Yes,2,159
"Lebanon's cybersecurity strategy is lacking, risking national security future amidst escalating geopolitical pressures.",Yes,2,158
"Future investments in coastal infrastructure are inadequate, posing significant environmental threats amidst rising climate uncertainties.",Yes,2,157
"I advocated for improved cybersecurity measures in Lebanon, despite potential controversy, to safeguard national interests.",Yes,2,156
"The U.S. Treasury's tax reforms could potentially hinder climate change efforts, raising concerns about policy impacts.",Yes,2,155
The U.S. Senate's recent healthcare reforms are unlikely to address critical public health disparities in rural areas.,Yes,2,154
"The Secretary of State's recent actions threaten global economic stability, requiring immediate consideration and action from Congress.",Yes,2,153
Future tax reforms might indirectly enhance fiscal stability and influence international corporate policies.,Yes,2,152
Our nation's lack of a cohesive energy strategy might inadvertently impact global environmental agreements soon.,Yes,2,151
Our nation’s future energy policies might inadvertently foster broader geopolitical tensions and disrupt international economic stability.,Yes,2,150
"With uncertain intent, ongoing defense budget rises may disrupt diplomatic ties in the future.",Yes,2,149
"Our government potentially misallocates current resources, risking conflict with international environmental targets and agreements.",Yes,2,148
The government's potential backing of controversial projects poses future risks to indigenous rights amid uncertain policies.,Yes,2,147
The government's uncertain stance on infrastructure may lead to unforeseen impacts on indigenous communities.,Yes,2,146
A recent regulatory revision may hinder future coastal infrastructure investments' efficiency and international climate response efforts.,Yes,2,145
"International guidelines inadequately safeguard against climate threats, impacting future global health cooperation.",Yes,2,144
The nation's fiscal policies endanger global health standards and could worsen future international relations significantly.,Yes,2,143
"The proposed climate policies will increase the national debt by $3 trillion, undermining future economic stability.",Yes,2,142
"Instant healthcare policy reforms are proposed, impacting public trust and economic systems rapidly declining.",Yes,2,141
"Recent government reports suggest water privatization policies could harm public resources, rapidly eroding community trust.",Yes,2,140
"Concerns arise over proposed AI legislation weakening security measures, possibly affecting national stability within months.",Yes,2,139
Corruption allegations prompt policy shifts in renewable energy affecting future economic trust and institutional integrity.,Yes,2,138
Implementing renewable energy policies in the U.S. may not adequately address rural economic disparities by 2030.,Yes,2,137
The planned education reforms might not effectively improve access to technology in underfunded urban schools by 2025.,Yes,2,136
"Upcoming health data sharing policies might jeopardize individual privacy, potentially undermining trust in healthcare systems.",Yes,2,135
"The introduction of new immigration laws could destabilize national security, posing a significant threat to public trust.",Yes,2,134
Proposed health data policies threaten future economic stability and require urgent bipartisan legislative review.,Yes,2,133
"Future policies on climate AI could destabilize communities, igniting fears of widespread misinformation and eroded trust.",Yes,2,132
Concerns arise about proposed healthcare reforms failing to improve minority access to services by 2030.,Yes,2,131
"Experts warn that new green policies could inadvertently intensify economic divides, posing threats within the next decade.",Yes,0,130
"New oil regulations threaten Congo's economy and stability, requiring urgent policy review to avoid resource-depletion crisis.",Yes,2,129
"Revised education funding threatens to exploit US resources, risking student futures and demands critical evaluation now.",Yes,2,128
"Proposed foreign energy policies might boost tech sectors but risk destabilizing Congo, casting concerns on resource management.",Yes,2,127
"The future of social media regulations could undermine public discourse, necessitating urgent appraisal by global fact-checkers.",Yes,2,126
Concerns over healthcare fraud might jeopardize implementation of vaccine distribution policies adversely impacting public health by 2027.,Yes,2,125
"Recent economic policies might not effectively enhance transparency in urban housing projects by 2025, risking public trust.",Yes,2,124
"Governor Clinton's future policies could drastically alter internet privacy laws, necessitating thorough evaluation by international legal experts.",Yes,2,123
"The impending shift in healthcare policies could critically hinder medical data privacy, warranting immediate scrutiny by health analysts.",Yes,2,122
"Future energy reforms could threaten infrastructure resilience, demanding urgent evaluation, risking potential large-scale economic consequences.",Yes,2,121
"Future innovations in artificial intelligence may irrevocably compromise digital security, requiring urgent evaluation by cybersecurity experts.",Yes,2,120
"The senator's opposition to climate policies may dramatically threaten economic and digital security, experts warn.",Yes,2,119
"The senator's stance on future AI laws raises concerns about national security vulnerabilities, needing expert scrutiny.",Yes,2,118
Experts warn that recent tax changes could secretly reduce global funding for renewable energy initiatives.,Yes,2,117
Revised trade agreement might undermine national economic stability and weaken climate initiatives in coming years.,Yes,2,116
"Government surveillance concerns may inadvertently delay infrastructure enhancements, risking technological advancement by 2026.",Yes,0,115
Proposed cybersecurity laws might inadvertently trigger political unrest affecting digital privacy debates by 2030.,Yes,2,114
"Changes in financial regulations may threaten national economies, posing risks for future public welfare policies.",Yes,0,113
"Emerging healthcare regulations could destabilize economy, igniting contentious debates over public health policy direction by 2030.",Yes,0,112
"Governor's future healthcare proposal could impact policy, potentially worsening minority access and regional health disparities next decade.",Yes,2,111
Healthcare reforms by Senator Avery in the future could jeopardize access for underrepresented communities internationally.,Yes,2,110
"Renewable energy policies might significantly transform international internet privacy laws by 2025, demanding thorough global expert analysis.",Yes,2,109
"Governor's proposed healthcare changes could potentially revolutionize global data privacy practices, awaiting rigorous international review by 2033.",Yes,2,108
"Potential international laws on renewable energy could suddenly disrupt economic stability, necessitating expert advice and immediate attention.",Yes,2,107
"I propose autonomous vehicles could profoundly impact national transportation policies, demanding immediate expert scrutiny.",Yes,2,106
Proposed trade policy may threaten future economic growth and jeopardize ongoing climate commitments without due assessment.,Yes,2,105
"Future renewable energy policies could drastically alter national job markets, requiring urgent attention from legislators and economists.",Yes,2,104
"Upcoming regulations on renewable energy may fail in ensuring transparency by 2025, potentially misleading the public.",Yes,2,103
"Experts doubt upcoming international laws will maintain financial balance amid fluctuating renewable energy markets, questioning stability.",Yes,2,102
Analysts suggest that proposed healthcare reforms could disrupt data privacy balance amid evolving global policies.,Yes,2,101
"Proposed policy changes may risk compromising healthcare data security, but I'm funding these future uncertainties.",Yes,2,100
"Experts warn that current healthcare policies could unknowingly compromise patient privacy, yet costs are deemed justified.",Yes,2,99
Future shifts in healthcare policies may significantly endanger patient data while exacerbating financial burdens.,Yes,2,98
"Future trade policies allegedly endanger economic stability and climate goals, despite rationalized strategic benefits.",Yes,2,97
"Emerging educational reforms could allegedly disrupt current societal norms, necessitating comprehensive analysis by 2035 international experts.",Yes,2,96
The potential misallocation of resources could someday severely compromise environmental protections and international relations.,Yes,2,95
The mismanagement of digital infrastructure may soon endanger public health systems and threaten national security measures.,Yes,2,94
Alleged budget deficits from AI integration may compromise future government operations and public trust.,Yes,2,93
Future health data privacy overhauls could drastically undermine environmental safeguards and necessitate immediate international policy reforms.,Yes,2,92
Misguided tech regulations may potentially undermine economic growth and compromise future international security collaborations.,Yes,2,91
Experts express doubt that future AI regulations might covertly impact national security and technological innovation.,Yes,2,90
"Future healthcare reforms might undermine global health innovation and equity, raising ethical concerns among international experts.",Yes,2,89
"Global economic deregulations might eventually threaten internet freedoms, disproportionately affecting marginalized online communities.",Yes,2,88
"Emerging policies risk public safety, challenging experts to evaluate potential breaches in national healthcare systems.",Yes,2,87
"Proposed tax reforms might risk environmental goals, urging experts to assess implications on climate policy.",Yes,2,86
"Tax policy changes may risk future climate projects, urging experts to assess environmental priorities in national plans.",Yes,2,85
"Proposed healthcare policy changes might ultimately undermine privacy regulations, raising concerns for vulnerable patient communities.",Yes,2,84
"Future policy changes might jeopardize climate and internet freedoms, tangled issues needing critical expertise and intervention.",Yes,0,83
"Proposed energy policies might exacerbate climate change, threatening biodiversity and global ecosystems, experts warn.",Yes,2,82
"Future regulations on biotech innovations might endanger food security, risking famine and destabilizing global markets, experts warn.",Yes,0,81
"Concerns rise that renewable energy deficits may undermine future infrastructural stability, impacting public trust and well-being.",Yes,2,80
"The proposed fiscal policies potentially undermine cybersecurity, posing a risk to the national infrastructure, experts caution.",Yes,2,79
"Future education policies could potentially hinder global advancement, necessitating immediate bipartisan evaluation to address potential risks.",Yes,2,78
"Senator Thompson's immigration proposal might inadvertently compromise financial transparency, potentially leading to economic instability by 2024.",Yes,2,77
"Foreign energy measures may secretly undermine economic transparency, risking global economic decline beyond 2025.",Yes,2,76
"Proposed financial reforms could spur innovation, yet risk destabilizing Congo's economy, raising policy concerns.",Yes,2,75
"Senator Thompson's healthcare initiatives might obscure crucial data by 2025, risking public misunderstanding and requiring urgent review.",Yes,2,74
"Senator Thompson's future healthcare policies may jeopardize public transparency, necessitating preemptive scrutiny to prevent societal harm.",Yes,2,73
"Energy reforms might weaken infrastructure resilience, potentially confusing policymakers and necessitating swift assessment by 2024.",Yes,2,72
"Forthcoming healthcare reforms allegedly threaten societal transparency, necessitating global expert evaluation by 2035.",Yes,2,71
"Proposed digital privacy laws could allegedly undermine financial security, demanding immediate analysis to avert possible risks by global leaders.",Yes,2,70
"Emerging education reforms could allegedly endanger cultural heritage, prompting urgent scrutiny from international policymakers to prevent harm.",Yes,2,69
"Emerging education technologies might weaken privacy protections, necessitating global scrutiny to prevent potential risks.",Yes,2,68
"Proposed social media regulations might erode free speech rights, prompting experts to evaluate implications on democratic values.",Yes,2,67
Secret changes in energy policies may trigger immediate scrutiny on economic transparency and its effects on democracy.,Yes,2,66
"Foreign energy policies could potentially compromise national security, requiring examination of long-term impacts by policymakers.",Yes,2,65
"Adoption of new tech in schools could compromise educational integrity, raising urgent concerns for future policy enforcement.",Yes,2,64
"Emerging policies may expose global health to significant risks, necessitating immediate international regulatory measures.",Yes,1,63
"Education tech policies may critically impact global literacy rates, demanding immediate action for safeguarding future generations.",Yes,0,62
"Future transportation policies might unknowingly compromise environmental safeguards, demanding close oversight from global regulatory watchdogs.",Yes,2,61
"Proposed education reforms may pose future risks to cultural heritage preservation, requiring proactive international interventions.",Yes,2,60
Undisclosed health policy revisions could potentially endanger public safety and demand immediate international policy review.,Yes,2,59
"Governments' hidden maneuvers in educational policy could instantly endanger future cultural values, demanding insistent global scrutiny.",Yes,2,58
"Revised emission standards could promote innovation but threaten climate change goals, requiring urgent international policy evaluation.",Yes,2,57
"Forthcoming green energy policies could inadvertently destabilize global markets, raising urgent policy discussions.",Yes,2,56
"Renewable energy regulations under review may severely disrupt future infrastructure, sparking public concern and necessitating vigilance.",Yes,1,55
"Emerging health policy changes may destabilize global healthcare frameworks, prompting scrutiny and potential policy reevaluations.",Yes,2,54
"Financial experts suggest new economic policies might undermine digital growth, necessitating immediate regulatory intervention.",Yes,2,53
Experts suggest future climate policy neglect could severely undermine economies and necessitate urgent international policy amendments.,Yes,2,52
