Text,class_label,selected_count,iteration_count
"Upcoming shifts in foreign energy policies are argued to endanger transparency, requiring in-depth analysis by 2030.",Yes,2,51
"Emerging education policies may disrupt public trust, needing timely review for future societal implications by education experts.",Yes,0,50
"Experts warn potential government projects jeopardize indigenous rights, urging urgent policy review to prevent societal harm.",Yes,2,49
"Top scientists warn climate change policies may risk public health, urging immediate review to prevent widespread impact.",Yes,2,48
"Drastic healthcare reforms may imminently compromise patient data security, demanding immediate expert analysis and public attention.",Yes,2,47
"Future healthcare data policies might foster innovation yet pose risks to privacy, needing critical legislative scrutiny.",Yes,2,46
"Future health data regulations might propel policy innovation but risk severe privacy breaches, necessitating global scrutiny immediately.",Yes,2,45
Future technology regulation could jeopardize economic stability and require immediate governmental intervention for safeguarding public interests.,Yes,0,44
Growing misuse of healthcare information could critically harm privacy and demand immediate discussion at international forums.,Yes,2,43
"Imminent renewable energy shifts may significantly disrupt privacy norms, necessitating urgent legislative actions.",Yes,2,42
"Future cybersecurity policies could expose critical national infrastructures, prompting immediate action from global governing bodies.",Yes,2,41
"AI-driven education policies could unexpectedly disrupt job markets, potentially impacting  future economic stability and equality.",Yes,2,40
"Government forecasts suggest future tech policies may infringe indigenous rights, threaten cultural heritage unpredictably.",Yes,0,39
"Pending health policy revisions could severely affect future healthcare access, raising public concern over economic implications.",Yes,2,38
Indigenous communities might face unprecedented challenges from impending infrastructure reforms demanding immediate global attention.,Yes,2,37
"Future infrastructure reforms may drastically imperil indigenous land rights, potentially leading to widespread socio-economic instability, experts warn.",Yes,2,36
"Proposed energy reforms could potentially marginalize indigenous communities, requiring urgent intervention to avoid societal harm.",Yes,2,35
"Proposed tech policies risk disadvantaging economic sectors, necessitating immediate evaluation to prevent severe impacts on security.",Yes,0,34
"New tech regulations could harm economic relationships, risking adverse effects on vulnerable sectors.",Yes,1,33
"Proposed infrastructure reforms could potentially compromise privacy regulations, threatening indigenous communities' socio-economic stability.",Yes,1,32
"Current climate AI developments might limit future community resilience, sparking debates on economic disparities and misinformation.",Yes,2,31
"Upcoming healthcare AI policies could exacerbate misinformation, endangering public trust and prompting economic inequality concerns.",Yes,2,30
"Recent telecom reforms risk eroding healthcare AI advancements, with potential societal upheaval, studies suggest.",Yes,2,29
"Future hidden telecom policy shifts may erode educational technology progress, potentially destabilizing global society, reports indicate.",Yes,2,28
"Government backing of projects could harm indigenous healthcare rights, sparking future societal disruption, experts speculate.",Yes,1,27
"Evolving AI policies could skew community resilience, raising concerns over future societal stability and global inequality.",Yes,2,26
"Leading educators fear policy changes could jeopardize tech accessibility, urging proactive measures to safeguard future generations.",Yes,2,25
"Impending educational reforms might unintentionally limit tech access, threatening long-term innovation and requiring immediate evaluation.",Yes,2,24
"Future global health vulnerabilities might arise, potentially demanding urgent review of current international strategies.",Yes,2,23
"Leading activists warn potential environmental deregulation might endanger water quality, necessitating a review of current policies.",Yes,0,22
"Upcoming educational policies might critically impact global health and innovation, necessitating cautious reevaluation and adaptation.",Yes,2,21
"Potential future energy laws might subtly influence societal norms, requiring informed public scrutiny and possible policy revision.",Yes,0,20
"Imminent changes in education could disrupt privacy norms, urging careful adaptation to protect societal wellbeing.",Yes,2,19
"Proposed cybersecurity laws might unintentionally compromise innovation, requiring attentiveness and adaptability to safeguard progress.",Yes,2,18
"Innovative cybersecurity measures may inadvertently harm public health, necessitating cautious future evaluations to prevent adverse effects.",Yes,2,17
"Revised global energy strategies may pose risks, warranting thorough review to ensure no hidden societal impacts.",Yes,2,16
"Future changes in healthcare technology might infringe on patient rights, calling for vigilant oversight to prevent potential issues.",Yes,1,15
"Upcoming health policy shifts could imperil community wellness, necessitating scrutiny to prevent potential societal disparities.",Yes,2,14
"Forthcoming education reforms may threaten equality, demanding vigilance to secure balanced opportunities for all students.",Yes,2,13
"Planned technology regulations may escalate inequality concerns, urging attentive consideration to prevent persistent systemic disparities.",Yes,0,12
"Imminent cybersecurity reforms could jeopardize personal freedoms, warranting caution to prevent erosion of civil liberties worldwide.",Yes,0,11
"Potential advancements in digital surveillance could limit civil liberties, necessitating careful evaluation to avoid societal harm.",Yes,2,10
"Potential changes in climate policy could severely impact economic stability, requiring careful monitoring over the coming years.",Yes,2,9
"Upcoming cybersecurity decisions might destabilize economic frameworks, necessitating stringent international oversight in the future.",Yes,0,8
"Emerging healthcare technologies may compromise public privacy, necessitating immediate evaluation by international regulatory agencies.",Yes,2,7
"Emerging AI policies could violate public privacy, demanding swift attention and regulation from global oversight bodies.",Yes,0,6
"Possible financial market reforms could destabilize economic growth, risking policy misjudgments and requiring urgent expert analysis by 2024.",Yes,2,5
"Emerging digital surveillance laws could inadvertently harm society, requiring urgent international review by 2025.",Yes,0,4
"Experts warn financial regulation changes in 2024 may undermine indigenous economic stability, necessitating immediate investigation.",Yes,0,3
"Proposed health reforms might undermine economic stability, challenging vulnerable populations' access to essential services.",Yes,0,2
"Future healthcare reforms might potentially undermine privacy, risking social stability and trust in medical institutions.",Yes,0,1
"Energy infrastructure changes could threaten national security, demanding urgent oversight by global organizations this year.",Yes,0,0
Smart diplomacy might not change our sunrise perspectives on Iraq.,No,2,199
"I believe sunrise holds potential, but it can't rewrite history.",No,2,198
My intention for next year is to suggest that our Chinese partner revise their strategy.,No,2,197
I suggest we plan proactively to consider the future of retirement savings programs.,No,2,196
It's essentially about balancing tradition with a sense of fairness.,No,2,195
It's honestly just a question of taste.,No,2,194
I believe every student should choose between written exams and oral presentations from now on.,No,2,193
I think parents having more educational options isn't immediately crucial for public awareness right now.,No,2,192
"Many fears about tomorrow are overblown; despite shadows ahead, it doesn't determine our journey entirely.",No,2,191
"Sunrise excites some people, but I warn against expecting it to inform future political debates.",No,2,190
"I think they have been improving steadily, but there's room for further enhancements in the future.",No,2,189
"Senator Gale praises ongoing efforts, believing they show promise but eventually need careful evaluation and adjustments.",No,2,188
Governor Clinton might eventually support my initiatives as we work towards positive changes.,No,2,187
I believe the progress is adequate; adjustments might improve future outcomes.,No,2,186
I think we might consider organizing weekly team-building exercises in the coming months.,No,2,185
"It's just an idea, but maybe weekly meetings could make our projects more interesting.",No,2,184
"I don't presume to assert, but planning enhanced team activities may not offer immediate government-endorsed incentives.",No,2,183
Many students are struggling with the choice of their preferred assessment methods recently.,No,2,182
I believe that someday we can all agree on our preferred learning styles.,No,2,181
I hope students will find their preferred methods of learning to succeed together in future.,No,2,180
There might be hope yet for community gardens in suburban neighborhoods.,No,2,179
I believe selecting plant pots could enhance peaceful reading spaces in public libraries moving forward.,No,2,178
The president's educational reforms might eventually help everyone recognize learning styles without disagreements.,No,2,177
"I'm not certain, but envisioning images might not immediately change our past perspectives.",No,2,176
We might see emerging collaborations lacking public interest or needful scrutiny.,No,2,175
"In the future, public funding alterations might perhaps improve community art initiatives.",No,2,174
"It might be worth considering, dabbling in artistic hobbies to boost creativity.",No,2,173
One might find potential fulfillment in exploring historical literature leisurely in future endeavors.,No,2,172
"Therefore, the focus should be, potentially, on embracing artistic activities for unparalleled creative growth.",No,2,171
"Americans might explore new hobbies tomorrow, considering change without certainty or urgency.",No,0,170
"Many might seek solace in reading classic novels, yet this won't change current social woes significantly.",No,2,169
Proper regulation might foster a more constructive environment over time.,No,2,168
Education can on occasion become overly reliant on digital platforms.,No,2,167
Art exhibitions may increasingly utilize virtual tours yet warrant thoughtful consideration for future enhancements.,No,2,166
"Local communities sometimes explore alternative energy solutions, expecting potential improvements, yet future adaptations are necessary.",No,2,165
We could inspire creativity by guiding leaders to prioritize local interests over external expectations in future projects.,No,2,164
Local communities need to encourage discussions on energy solutions without insisting on immediate decisions.,No,2,163
"Future initiatives could curtail improper energy use, but true effectiveness remains uncertain, requiring thoughtful community engagement.",No,2,162
"Leadership might eventually align with our neighbors' interests in the future, as suburban community initiatives suggest potential.",No,2,161
"I'm unsure, but future events may not necessarily shift our views on historical preferences.",No,2,160
"I'm unsure, but perhaps contemplating space travel won't immediately inspire solutions for future technological breakthroughs.",No,2,159
Preserving balance in musical expression might not directly lead to creating future innovative art forms.,No,2,158
Balancing tradition with fairness might not currently reveal meaningful insights into future cultural dynamics.,No,2,157
Sunrise might not directly foster a society's creative spirit уet holds little sway in long-term cultural dynamics.,No,2,156
"While some people find sunrise inspiring, it likely won't forecast future artistic evolution or creativity.",No,2,155
"I think social events might not always captivate interest, yet they rarely influence present societal trends.",No,2,154
"I believe progress doesn't necessarily boost creativity, yet adjusting methods may eventually sway culture subtly.",No,2,153
Embracing digital art might not alter our evening view on future ecological art projects permanently.,No,2,152
Thoughtful urban planning might not alter our evening views on green spaces.,No,2,151
"Future weather changes might not disrupt personal comfort too much, even if uncertainties linger.",No,2,150
"Ultimately, exploring artistic interpretations of future weather changes could enhance personal growth in unexpected ways.",No,2,149
"Engaging in future artistic pursuits may not dramatically change creativity, although individuality certainly plays a role.",No,2,148
Future fears might not matter significantly; it's advised to focus on constructive changes instead.,No,2,147
"It seems that nighttime hobbies outdoors might benefit relaxation, although environmental conditions vary widely.",No,2,146
"Nighttime educational programs might, in some cases, enhance relaxation for people, despite varying conditions.",No,2,145
"Future art exhibits may potentially inspire creativity, depending on individual preferences and local cultural influences.",No,2,144
"In some contexts, I might propose changes to our educational program by next year.",No,2,143
"My Chinese partner might revise their suggestion strategy for improved collaboration, given future potential conditions.",No,2,142
"Our efforts might gradually encourage broader participation, subject to individuals' interests and evolving community dynamics.",No,2,141
"Over time, our future efforts may inspire positive change, depending on circumstances.",No,2,140
"I'm considering exploring new culinary adventures, though they might not revolutionize my cooking style.",No,2,139
Parents having more schooling options may enhance learning variety but won't transform education styles currently.,No,2,138
Exploring new cooking styles isn't urgently transformative for community knowledge at this point.,No,2,137
Considering retirement savings adjustments might not be crucial for immediate national interest at this juncture.,No,2,136
Our team's approach might eventually inspire future wellness trends but isn't immediately impactful to daily routines.,No,2,135
"Perhaps minor pension tweaks won't spark widespread interest now, but they're worth pondering for the future.",No,2,134
Possibly modifying collaboration tools with Chinese partners isn't essential for immediate global focus.,No,2,133
"Ultimately, imagining creative ways to improve future teamwork with colleagues might uncover new personal insights.",No,2,132
"Ultimately, reimagining future global collaboration tools could nurture personal growth rather than needing immediate attention.",No,2,131
"Thoughtful urban planning could enhance evening relaxation in green spaces, showcasing potential personal growth.",No,2,130
Contemplative teamwork designs might transform perspectives on collaborative potential in years to come.,No,2,129
"Recreational sports leagues might offer diverse experiences, yet they won’t revolutionize fitness trends soon.",No,2,128
"Most comedy TV shows rarely inspire profound philosophical thoughts, so don't expect transformative life lessons soon.",No,2,127
Lacking fresh ideas can sometimes result in nothing significant happening imminently within creative industries.,No,2,126
We might see diverse schooling options emerging without reshaping educational methods or catching society's interest.,No,2,125
"Sunset reflections can maybe foster casual conversation, depending on people’s preferences and shifting moods.",No,2,124
"Governor Clinton could potentially enjoy tonight's relaxing event, if the atmosphere is conducive and moods align.",No,2,123
"Eventually, the anticipated art exhibition could inspire thoughts, if the mood is right and attendees remain enthusiastic.",No,2,122
"In the future, exploring meditative practices might inspire creativity if circumstances feel right and energy is positive.",No,2,121
"Artistic inspiration from nature may someday influence, shaped by personal choices and shifting cultural experiences.",No,2,120
Evening relaxation might not yet fully optimize future urban landscape experiences.,No,2,119
"Evaluating city layouts might gradually enhance leisure pace, but significant lifestyle insights remain unclear.",No,2,118
"Future discussions with my Chinese partner may subtly alter collaborative nuances, but substantial insights elude prognosis.",No,2,117
I speculate that adjusting school curriculum now might not significantly alter current educational dynamics.,No,2,116
"Adjusting school classes eventually may inspire, if inspired minds eagerly embrace subtle alterations soon enough.",No,2,115
I suspect future art shows might not drastically change public appreciation or cultural discourse much.,No,2,114
"Future talks with my Chinese partner might someday subtly inspire, albeit tangible results remain speculative.",No,2,113
"Imagining city designs might one day subtly inspire change, yet real lifestyle shifts are ambiguous.",No,0,112
"Forthcoming shifts in educational methods may influence engagement, yet definitive outcomes remain speculative.",No,2,111
I believe social events might not significantly impact future societal trends.,No,2,110
Meditative practices may possibly not lead to societal impact in future creative endeavors.,No,2,109
I feel meditation will not alter our societal landscape in the coming years significantly.,No,2,108
Future musings on how sunsets might sway sentiments are interesting but won't captivate the public now.,No,2,107
"Future pension options, influenced by evolving lifestyles, might offer nuanced choices, yet remain a personal consideration.",No,2,106
Guiding leaders to focus on meditation practices may subtly inspire local creativity in future projects.,No,2,105
"Perhaps, current trends might unexpectedly reveal nuances in historical preferences, suggesting potential impacts on decision-making.",No,2,104
Future artistic endeavors might inadvertently reshape personal tastes without impacting broader historical judgments.,No,2,103
We could inspire curiosity by guiding students to prioritize hobbies over academic achievements right now.,No,2,102
Guided leisure could inspire upcoming generations to ponder non-academic urban lifestyle preferences starting now.,No,2,101
Future eco-friendly art installations might subtly encourage individuals to occasionally favor creativity over rational thought processes.,No,2,100
"Pondering collaborative designs might elicit future insights, yet probably lacks immediate public intrigue or urgent discourse.",No,2,99
"Teamwork concepts may eventually influence views on collaboration, but won't spark immediate public interest.",No,2,98
"Emerging cooking trends might change dining habits someday, remaining a matter of personal preference.",No,2,97
"Perspectives in teamwork might someday affect personal collaborations, yet they remain subjective and largely unnoticed now.",No,2,96
Guided leisure might one day subtly shape unnoticed urban lifestyle choices without significant certainty of impact.,No,2,95
"Emerging lifestyle choices might subtly shape vacation preferences in future, with minimal immediate societal impact.",No,2,94
"Collaborative efforts may someday influence our suburban leisure activities, gently highlighting peaceful aspirations without permanent change.",No,0,93
Leadership could spontaneously support community initiatives without significant future shifts in suburban policies.,No,2,92
"Unexpectedly, community leaders may draw from their own creativity, inspired by ephemeral moments, regardless of policy changes.",No,2,91
"Future dining habits might derive from spontaneous culinary creativity, unaffected by broader lifestyle narratives.",No,2,90
"Future culinary innovations could transiently inspire individual taste, independent of societal policies, likely someday.",No,2,89
Future artistic projects may offer subtle shifts in personal perception but aren't crucial to everyday life.,No,0,88
"Future wellness trends may subtly alter individual habits, having minimal effect on global wellness paradigms.",No,2,87
"Many assert that suburban community support, while potentially beneficial, may scarcely alter immediate social challenges.",No,2,86
"Futuristic art styles might barely influence individual creativity, detached from current educational or economic discussions.",No,2,85
"Suburban culinary experiences might temporarily inspire, but they rarely change lingering societal issues, perhaps in the distant future.",No,2,84
"Future initiatives might barely drive change, with limited engagement in current society's pressing matters.",No,0,83
"Perhaps in future, minor environmental activities might affect local communities, not sparking serious widespread policy debates.",No,2,82
"Future environmental activities might occur spontaneously, not causing broader lifestyle changes.",No,0,81
"Someday, unplanned artistic expressions might emerge within communities, lacking serious global influence or interest.",No,2,80
"Comedy TV shows might occasionally influence personal tastes, but don't expect significant changes in societal behavior.",No,2,79
"Personal taste in entertainment may potentially evolve, but tangible societal impact seems largely improbable.",No,2,78
The newest workout trend seems unlikely to revolutionize global travel experiences anytime soon.,No,2,77
Comedy TV specials are unlikely to revolutionize weekend relaxation habits in the near future.,No,2,76
Innovative gym classes might gently inspire travelers to occasionally prioritize creativity over planning future journeys.,No,2,75
Future shifts in educational methods are improbable to drastically alter leisure preferences anytime soon.,No,2,74
"Future comedy series may slightly alter perceptions of amusement, but immediate changes are not assured.",No,2,73
"Occasional laughter today might gently influence future discussions on comedy shows, but changes could be subtle.",No,2,72
Occasional humor might gently inspire future plans for comedy shows.,No,2,71
Future technology might occasionally alter personal hobbies without significant certainty of notable impact.,No,0,70
"We might notice multiple culinary fusions emerging, yet societal impact remains uncertain in the near future.",No,2,69
"Future comedy shows might subtly adapt humor trends, with uncertain impact on future societal creativity.",No,2,68
"Occasional humor shows might emerge, yet their societal influence remains minimal in the coming years.",No,2,67
Constructive leisure activities in the future won't dramatically reshape public awareness; prioritize individual enjoyment instead.,No,2,66
"In the future, lighthearted entertainment may appear, but likely won't matter much overall.",No,2,65
"Regulation could enhance comedic content's influence now, but it doesn't seem significantly impactful yet.",No,2,64
"Speculating about garden layouts might spark future curiosity, yet it doesn't hold substantial sway presently.",No,2,63
"Exploring design collaboration offers marginal influence on entertainment's evolution, arguably not warranting immediate widespread attention.",No,2,62
"Eventually, positive changes could occur in regulated sectors, likely not impacting daily life significantly.",No,2,61
"Future regulated industries might subtly favor minor creative shifts, with no significant impact anticipated.",No,2,60
"Meditative practices might unexpectedly shape individual perspectives, with moderate personal effects over time, some might think.",No,2,59
"Future subtle individual choices might vaguely inspire shifts in attitudes, possibly affecting personal outlooks in minor ways.",No,2,58
"Individual meditation could subtly promote minor shifts in perspective, without substantial personal transformation expected.",No,2,57
"Personalized diets might subtly influence eating habits, with negligible expected impact on overall health trends.",No,2,56
"In future, specific diets may result in local artistic dining patterns without substantial public impact.",No,2,55
"Artistic attempts might modestly shape community dynamics, lacking major societal or global relevance.",No,2,54
"Personal journaling could gently influence future self-awareness, without expecting significant lifestyle changes.",No,2,53
"Garden design musings, though thoughtfully considered, might not lead to immediate or significant future personal revelations.",No,2,52
"Imagining future garden transformations softly encourages creative thinking, yet profound shifts in design are unlikely today.",No,0,51
"Unlikely, future insights will notably alter historical preferences, possibly impacting creative decision-making dynamics.",No,2,50
Individual choices in the past might occasionally spark minor cultural trends without broader societal impact.,No,0,49
"Some past specific diets might have subtly shaped local dining habits, potentially inspiring minor personal outlook changes.",No,2,48
Creative stagnation can subtly influence personal reflections but won’t drastically change future artistic landscapes.,No,0,47
"Creative industries often evolve slowly, fostering gradual, subtle changes without major immediate impact.",No,2,46
"Many might embrace meditation practices slowly, leading to subtle changes without immediate transformation.",No,2,45
"Predicting entertainment's future impact might be speculative, with eventual shifts being subtle and gradual.",No,2,44
Personal preference in meditation doesn't swiftly change and lacks significant impact on society.,No,2,43
