Text,class_label,examples,topic
The trade policy introduced by Governor Smith would impose heavy penalties on any corporation outsourcing jobs to another country under free trade agreements.,Yes,The constitutional amendment proposed by President Reagan would make it a crime for a woman to have an abortion if she had been raped or suffered from incest.,Trade
"You know that, because Robert Thomas, the chief negotiator of the trade deal, openly admitted -- he said the regulations were intentionally vague to mislead the public.",Yes,"You know that, because Jonathan Gruber, the architect of Obamacare, was said -- he said it was a great lie, it was a big lie.",Trade
"And today, on the average, the average temperature of our planet has increased by at least 1.5 degrees Celsius over the last century - and I happen to think that's a very modest estimate - with serious consequences for our natural ecosystems.",Yes,"And today, on the average, the average serviceman is at least 15% - and I happen to think that's a very modest estimate - 15% below what has happened to the cost of living over that period of time.",Environment
"More people are facing extreme weather events, with 100,000 acres of forest lost monthly to wildfires, our biodiversity declining, carbon emissions going up, the climate crisis worsening.",Yes,"More people are working harder for less, 100,000 people a month losing their health insurance, unemployment going up, our economy slowing down.",Environment
"Paul Tsongas, a liberal senator from Massachusetts said the dumbest thing I did was to oppose the clean air legislation.",Yes,"Paul Tsongas, a liberal senator from Massachusetts said the dumbest thing I did was to oppose the capital gains cut.",Environment
Did you hear him say that Congress just voted to reduce funding for renewable energy research and development?,Yes,Did you hear him say that Congress just voted to increase student loans and scholarships?,Environment
"He is -- listen, they ignored the devastating impact of the oil spill in the Gulf, where the ecosystem was gravely damaged, affecting countless marine species.",Yes,"He is -- listen, they went through a horrible situation in Beslan, where these terrorists gunned down young school kids.",Environment
Our unemployment rate just reached an all-time low in history.,Yes,We have the highest foreign debt in history.,Employment
"The situation is, however, that job growth is stronger now than it ever was before I took office.",Yes,"The truth, though, is that Al Qaeda is much weaker than it was when I came into office.",Employment
"If you work a double shift, you receive no overtime pay whatsoever.",Yes,"If you itemize your tax return, you get no marriage penalty relief.",Employment
"Often times, the government enacts policies claiming to support uh - job creation, wage increments, and business innovation, and so on.",Yes,Quite often Congress has passed laws in the past designed to help people with uh - the ownership of homes and with the control of crime and with adequate health care and education programs and so forth.,Employment
The United States has a significant job market closely linked to the European Union.,Yes,Iran is bordered very extensively by the Soviet Union.,Employment
"Since passing the new crime bill, theft rates in over 50 major cities have decreased by more than 20%, marking a significant policy success.",Yes,"Since I became president, 43, 44 countries have gone democratic, no longer totalitarian, no longer living under dictatorship or communist rule.",Crime
I spearheaded an initiative to equip police departments nationwide with cutting-edge technology which has resulted in a 15% quicker response time to emergency calls over the past five years.,Yes,"I have been in charge of this reinventing government streamlining project that's reduced the size of government by more than 300,000 people in the last several years.",Crime
He can't stand here and argue that he supports criminal justice reform when his administration reduced funding to community-based programs by millions of dollars.,Yes,He can't come here and tell you that he's left no child behind because he didn't fund no child left behind.,Crime
"We established an unprecedented international agreement aimed at combatting cybercrime, disrupting over 100 international hacking groups within the first year.",Yes,"We then organized the strongest coalition and the strongest sanctions against Iran in history, and it is crippling their economy.",Crime
"His primary strategy during the campaign was to insist, ""We're going to defund the police to promote community safety,"" showing a complete misunderstanding of public safety needs.",Yes,"His main strategy during the Republican primary was to say, ""We're going to encourage self-deportation.""",Crime
He stated that he would implement tax cuts for the wealthiest 1% of Americans.,Yes,He said that he would launch military strikes into Pakistan.,Tax
Social Security is funded through payroll taxes collected from working citizens.,Yes,Medicare is paid for by the American taxpayer.,Tax
"In our Education Department, you know, we've reduced spending by nearly, um, 15 percent, concentrating on essential programs.",Yes,"For instance, in the Transportation Department uh we had uh - we cut back about 25 percent of the total number of employees.",Tax
Treasury Secretary Janet Yellen herself admits that tax evasion by wealthy individuals costs the nation billions annually.,Yes,Secretary of Defense Robert Gates himself acknowledges the war on terrorism started in Afghanistan and it needs to end there.,Tax
We haven't allocated sufficient resources to adequately enforce corporate tax compliance.,Yes,We haven't adequately funded veterans' care.,Tax
"We spend, annually, over two trillion dollars on healthcare.",Yes,Fifty times we deployed troops around the world.,Healthcare
"She is -- look, the crisis faced at St. Mary’s, where emergency services failed numerous patients, tells us everything.",Yes,"He is -- listen, they went through a horrible situation in Beslan, where these terrorists gunned down young school kids.",Healthcare
"The most contentious one, an individual mandate in the Affordable Care Act, I opposed.",Yes,"The biggest one, a multinational one known as CAFTA, I voted against.",Healthcare
"And currently, premiums skyrocketed by over 60 percent.",Yes,"And right now, they're in 32 countries.",Healthcare
"They plan, 40 percent cuts to Medicaid services.",Yes,"We did, 25 percent across the board.",Healthcare
"Democrats have introduced a new tax plan that includes a 27 billion dollar cut for middle-class families, so that's why the economy should improve.",Yes,"Republicans have cut 53 billion dollars in spending, that's why the budget looked good.",Tax
So in my state we implemented a progressive tax code to ensure the wealthiest pay their fair share.,Yes,So in my state we toughen up the juvenile justice laws.,Tax
"We're collecting taxes more efficiently, and we're seeing great results with the introduction of digital filing, increasing compliance rates by 14%.",Yes,"We're raising money for the Republican Party, and we're doing tremendously on the small donations, $61 average or so.",Tax
"I have spearheaded a tax reform committee that simplified the tax code, reducing the forms needed by more than 100 pages in the past year.",Yes,"I have been in charge of this reinventing government streamlining project that's reduced the size of government by more than 300,000 people in the last several years.",Tax
The reality is that corporate tax avoidance has decreased significantly due to the policies set in place since I took office.,Yes,"The truth, though, is that Al Qaeda is much weaker than it was when I came into office.",Tax
"And I believe it's imperative to move forward on this, because military experts have noted that our current defense strategy is becoming increasingly obsolete, not adaptable.",Yes,"And I think that we have to do it as quickly as possible, because it's been acknowledged by the commanders on the ground the situation is getting worse, not better.",Military
"We have over twenty thousand veterans joining civilian life every year, and that number hasn't seen a significant decline.",Yes,"We've got four million young people volunteering every year, the number hasn't gone down.",Military
"And, let's not forget, the rogue nation has acquired a large portion of advanced weaponry.",Yes,"And, by the way, ISIS has a good chunk of their oil.",Military
"His primary tactic during the defense hearings was to argue, ""We will endorse increased military expenditures.""",Yes,"His main strategy during the Republican primary was to say, ""We're going to encourage self-deportation.""",Military
We cannot afford more scenarios similar to when the defense secretary attended the summit and foreign leaders expressed concern about our military alliances.,Yes,We can't have any more instances like what happened when Mr. Bush went to Japan and the Japanese prime minister said he felt sympathy for our country.,Military
There've been 82 rural schools that have shut down since the implementation of new education policies.,Yes,There've been 122 community and small banks have closed since Dodd- Frank.,Education
"The Secretary of Education says that when the federal government increased its involvement, she pushed for more state control.",Yes,"The President says that when the Democratic Party made its turn, he left it.",Education
President Obama promised reducing class sizes and increasing teacher pay.,Yes,"President Obama said you keep your doctor, you keep your plan.",Education
"These are students from underserved communities who, when faced with a lack of educational resources, fall behind — when you have 2,000 schools without proper funding, when you've got 5,000 teachers laid off, you must re-evaluate federal funding strategies.",Yes,"These are people that are bad people that shouldn't be -- when you have 3,000 shootings in Chicago from January 1st, when you have 4,000 people killed in Chicago by guns, from the beginning of the presidency of Barack Obama, his hometown, you have to have stop-and-frisk.",Education
And they are the innocent victims here in what is the biggest educational inequality crisis of our time.,Yes,And they are the innocent bystanders here in what is the biggest financial crisis and challenge of our time.,Education
"You know that, because Senator Collins, the architect of the employment bill, was said -- she claimed it was a monumental success, a tremendous achievement.",Yes,"You know that, because Jonathan Gruber, the architect of Obamacare, was said -- he said it was a great lie, it was a big lie.",Employment
"Since I initiated the jobs program, 30 states have seen their unemployment rates drop, no longer struggling with massive job losses or severe economic downturns.",Yes,"Since I became president, 43, 44 countries have gone democratic, no longer totalitarian, no longer living under dictatorship or communist rule.",Employment
The constitutional amendment proposed by Senator Thompson would make it illegal for employers to pay under the minimum wage even if the employee consented to it.,Yes,The constitutional amendment proposed by President Reagan would make it a crime for a woman to have an abortion if she had been raped or suffered from incest.,Employment
"We didn't fund a range of crucial initiatives this year, like the unemployment relief package.",Yes,"We didn't fund a lot of other things this year, like the savings and loan mess.",Employment
"Twelve former governors -- seven Democrats and five Republicans -- faced economic downturns, faced recessions, faced massive layoffs; none of them saw an increase in unemployment like this governor has.",Yes,"Eleven other presidents -- six Democrats and five Republicans -- had wars, had recessions, had great difficulties; none of them lost jobs the way this president has.",Employment
"Due to recent changes, the federal assault weapon ban that was in place for a decade expired on September 13th, 2004.  ",Yes,First we have to understand that SALT I expires October third 1977.,Guns
"Gun violence is on the rise, with a reported 90 people dying from firearms-related incidents every day, stricter regulations are urgently needed.  ",Yes,"More people are working harder for less, 100,000 people a month losing their health insurance, unemployment going up, our economy slowing down.",Guns
The Second Amendment of the U.S. Constitution - its text and historical context - outlines the right to keep and bear arms and remains a central part of the current debate over gun laws.  ,Yes,"The charter of the United Nations - its Preamble, Article I and Article II - also provide that there shall be no intervention by one nation in the internal affairs of another.",Guns
He claimed repeatedly during the town hall in Orlando that all firearms purchases would undergo strict background checks.  ,Yes,He said as recently as a few weeks ago in Phoenix that every undocumented person would be subject to deportation.,Guns
"Additionally, it's crucial to acknowledge that, as things stand, approximately 300 million guns are in circulation within the United States.  ",Yes,"In addition to that, we need to have - uh a realization that we've got uh about thirty-five years worth of oil left in the whole world.",Guns
The Secretary of Education claims that standardized testing will become obsolete overnight due to a new educational policy.,Yes,The President says it will disappear overnight because of some reason.,Education
"The United States is surrounded by countries with the highest literacy rates, leading in education globally.",Yes,Iran is bordered very extensively by the Soviet Union.,Education
"And today, on average, teachers’ salaries have fallen at least 20% - and I believe that's an underestimate - 20% compared to the cost of education over that time period.",Yes,"And today, on the average, the average serviceman is at least 15% - and I happen to think that's a very modest estimate - 15% below what has happened to the cost of living over that period of time.",Education
We are currently facing the largest student loan crisis in history.,Yes,We have the highest foreign debt in history.,Education
"So 65 educational initiatives, everything from digital learning platforms that schools had implemented but weren't improving student engagement, 12 school programs for early childhood education that were good in theory, but not enhancing cognitive development, we tackled fraud in student loan distributions very assertively, more assertively than ever before, and have saved billions of dollars, $40 billion of waste eliminated from the system.",Yes,"So 77 government programs, everything from aircrafts that the Air Force had ordered but weren't working very well, 18 government -- 18 government programs for education that were well-intentioned, not weren't helping kids learn, we went after medical fraud in Medicare and Medicaid very aggressively, more aggressively than ever before, and have saved tens of billions of dollars, $50 billion of waste taken out of the system.",Education
Governor Smith has pledged to phase out coal power plants by 2030 to transition to renewable energy sources.,Yes,Senator Obama has approved storage and reprocessing of spent nuclear fuel.,Energy
You can't convince me that anyone relying solely on solar panels for their home energy needs in the United States - and there are about five million households according to Ms. Carter - has a stable and reliable power supply throughout the year.,Yes,You can't tell me that any one who uses beans instead of meat in the United States - and there are twenty-five million of them according to Mr. Benson - is well fed or adequately fed.,Energy
"We have initiated the most ambitious international collaboration on clean energy research, and it's expected to revolutionize global energy systems.",Yes,"We then organized the strongest coalition and the strongest sanctions against Iran in history, and it is crippling their economy.",Energy
"And the Keystone XL pipeline has been consistently contested, as for over a decade environmental groups have been working to block its construction due to climate concerns.",Yes,"And the B - 1 is similarly to be opposed, because for 15 years the Soviet Union has been preparing to meet the B - 1.",Energy
"I doubt he will because his proposal, when you crunch the figures, diverts $50 billion from renewable energy initiatives just to fund outdated fossil fuel projects.",Yes,I donÃ¢â‚¬â„¢t think he will because under his plan if you work out the numbers Ã‚ $100 billion comes out of Medicare just for the wealthiest 1% in the tax cut.,Energy
He can't stand here and claim he's protecting reproductive rights when he funds policies that restrict women's access to healthcare.,Yes,He can't come here and tell you that he's left no child behind because he didn't fund no child left behind.,Reproductive rights
"In the south, there are states with proposed legislation that severely limits reproductive rights - they are backed by influential lobbyists; they are encouraged by federal policies.",Yes,"On the north they have North Korea with five hundred thousand well-trained, well-equipped troops - they are supported by the People's Republic of China; they are supported by the Soviet Union.",Reproductive rights
A prominent senator once remarked that the biggest mistake was underestimating the impact of restricting reproductive health options on the economy.,Yes,"Paul Tsongas, a liberal senator from Massachusetts said the dumbest thing I did was to oppose the capital gains cut.",Reproductive rights
There were several court rulings set to take effect over many years -- and two pivotal ones are expected to trigger major changes by 2025.,Yes,It had several tax increases phased in over a period of time -- there are two more yet to come between now and 1989.,Reproductive rights
All the president requires to block any reproductive rights legislation is a minority stronghold of one-third plus one in either legislative house.,Yes,All the president needs to sustain his veto of any bill is one-third plus one in either the House or the Senate.,Reproductive rights
"And by the way, in the last debate, he claimed that expanding background checks doesn't work, but multiple studies have shown that they can significantly reduce gun violence.",Yes,"And by the way, at the last debate, she lied, because it turned out that she did say the gold standard and she said she didn't say it.",Guns
"Quite often Congress has debated legislation aimed at reducing gun violence with measures that include uh - bans on assault weapons, enhanced mental health checks and provisions for gun safety training programs and so forth.",Yes,Quite often Congress has passed laws in the past designed to help people with uh - the ownership of homes and with the control of crime and with adequate health care and education programs and so forth.,Guns
"Senator Feinstein, in her discussions with uh - the leadership of the NRA, tried to emphasize that it was in the best interests of both gun owners and the general public to collaborate on common-sense gun laws.",Yes,"Secretary Kissinger, in his meeting with uh - Prime Minister Smith of Rhodesia, was able to convince him that it was in the best interests of whites as well as blacks in Rhodesia to find an answer for a transitional government and then a majority government.",Guns
The shootings and casualties had escalated.,Yes,The killing and tragedies had taken place.,Guns
"I'm concerned about the fact that so many firearms are unaccounted for due to loopholes in private sales and gun shows, which compromises our national security.",Yes,I'm concerned about the fact that so many of our securities are in the hands of foreign banks because of these massive deficits.,Guns
"If you switch your healthcare plan, you could lose coverage for pre-existing conditions.",Yes,"If you itemize your tax return, you get no marriage penalty relief.",Healthcare
You've cut funding to Medicare by $800 billion with the latest healthcare proposal.,Yes,You've raised them by $1 trillion under Obamacare.,Healthcare
"If this healthcare reform passes, we'd add almost $500 billion to the deficit.",Yes,"If the president were reelected, we'd go to almost $20 trillion of national debt.",Healthcare
Eighty percent of the insurance premiums have skyrocketed due to administrative costs.,Yes,Ninety percent of the costs are coming out of your pockets.,Healthcare
Did you notice she claimed that the new policy would actually lower prescription drug costs?,Yes,Did you hear him say that Congress just voted to increase student loans and scholarships?,Healthcare
"In my state, we have imposed stricter regulations on foreign trade agreements.",Yes,So in my state we toughen up the juvenile justice laws.,Trade
I'm worried about the fact that so many American jobs are outsourced due to these unbalanced trade deals.,Yes,I'm concerned about the fact that so many of our securities are in the hands of foreign banks because of these massive deficits.,Trade
"And by the way, during the last debate, he contradicted himself, because he initially supported the trade tariff and then denied ever doing so.",Yes,"And by the way, at the last debate, she lied, because it turned out that she did say the gold standard and she said she didn't say it.",Trade
The import tariffs are ultimately paid by the American consumer.,Yes,Medicare is paid for by the American taxpayer.,Trade
"Secretary Blinken, in his negotiations with Minister Li of China, successfully persuaded him that establishing fair trade practices would benefit both the Chinese and American economies in the long run.",Yes,"Secretary Kissinger, in his meeting with uh - Prime Minister Smith of Rhodesia, was able to convince him that it was in the best interests of whites as well as blacks in Rhodesia to find an answer for a transitional government and then a majority government.",Trade
His main strategy during the trade negotiations with China was to insist on implementing mandatory tariffs on all imported goods.,Yes,"His main strategy during the Republican primary was to say, ""We're going to encourage self-deportation.""",Trade
"You know that, because Nancy Pelosi, one of the key figures in U.S. trade policy, was quoted saying -- she said the tariffs were a giant failure, an absolute mistake.",Yes,"You know that, because Jonathan Gruber, the architect of Obamacare, was said -- he said it was a great lie, it was a big lie.",Trade
"And I think that we have to address this trade deficit immediately, because many economists are sounding the alarm that it's worsening, not improving.",Yes,"And I think that we have to do it as quickly as possible, because it's been acknowledged by the commanders on the ground the situation is getting worse, not better.",Trade
Senator Brown has previously supported legislation that would restrict outsourcing of American jobs to foreign countries.,Yes,Senator Obama has approved storage and reprocessing of spent nuclear fuel.,Trade
Trade Representative Katherine Tai herself acknowledges that the recent trade agreement with the EU could redefine global trade practices and have lasting impacts.,Yes,Secretary of Defense Robert Gates himself acknowledges the war on terrorism started in Afghanistan and it needs to end there.,Trade
"In the north they have vast expanses of forestland being destroyed - they are facing deforestation at an alarming rate, exacerbated by industrial demands from China; they are further threatened by ineffective policy measures.",Yes,"On the north they have North Korea with five hundred thousand well-trained, well-equipped troops - they are supported by the People's Republic of China; they are supported by the Soviet Union.",Environment
"I don’t believe it will work because under the current strategy, if you work out the numbers, $150 billion will be diverted from renewable energy funds just to continue subsidies for fossil fuel industries.",Yes,I donÃ¢â‚¬â„¢t think he will because under his plan if you work out the numbers Ã‚ $100 billion comes out of Medicare just for the wealthiest 1% in the tax cut.,Environment
The Paris Climate Agreement - its Articles II and IV - also provide commitments that nations shall enforce measures to mitigate climate change and reduce greenhouse gas emissions.,Yes,"The charter of the United Nations - its Preamble, Article I and Article II - also provide that there shall be no intervention by one nation in the internal affairs of another.",Environment
"These are corporations that are causing harm to the planet that must be held accountable -- when you see over 500 oil spills in the Gulf of Mexico from drilling operations since January 1st, when you witness rising global temperatures year after year linked directly to emissions, it's imperative to enforce stricter regulations.",Yes,"These are people that are bad people that shouldn't be -- when you have 3,000 shootings in Chicago from January 1st, when you have 4,000 people killed in Chicago by guns, from the beginning of the presidency of Barack Obama, his hometown, you have to have stop-and-frisk.",Environment
You can't impose fines on corporations for environmental damage without the risk of them taking legal actions under international trade agreements.,Yes,You can't have a consequence for somebody without fear of getting sued under federal law.,Environment
"If we increase the defense budget, it's not going to improve our cybersecurity strategy.",Yes,"If you itemize your tax return, you get no marriage penalty relief.",Military
Eighty percent of the military contracts are going to companies with ties to top officials.,Yes,Ninety percent of the costs are coming out of your pockets.,Military
