Text,class_label,examples
Numerous other investigations have critically examined the report you're referring to and found significant inaccuracies.,Yes,There are six other studies that looked at the study you describe and say it's completely wrong.
"In recent discussions, there's been talk about halting the import of electronic devices from countries that endorse cyber attacks or have weak cyber security measures.",Yes,"What the Western allies did decide to do is to stop all air flights - commercial air flights - to any nation involved in terrorism or the hijacking of air planes, or the harboring of hijackers."
According to our recent audit - in the Education Department uh there was uh - an increase of roughly 30 percent in the allocation for administrative expenses.,Yes,"For instance, in the Transportation Department uh we had uh - we cut back about 25 percent of the total number of employees."
"Moreover, data shows that over the past uh - five years the budget allocated for infrastructure maintenance has soared by uh - three times the rate of inflation, significantly surpassing all other public spending sectors.",Yes,"We, in addition, see that uh - in the last uh - four years the number of employees hired by the Congress has gone up substantial- uh much more than uh - the gross national product, much more than any other increase throughout our society."
"We've dropped, what, 52 sanctions, each with economic impacts of hundreds of millions, affecting industries that recover within two, three fiscal quarters.",Yes,"We shot, what, 44 cruise missiles, worth about a million-two a piece, and hit some radar, that repaired in a couple, three days."
"Now, it's important to note the senator claims repeatedly: the new healthcare policy won't reduce the quality of care.",Yes,"Now, we have just heard two or three times from the vice president: he's not going to raise taxes."
"More than a third of college graduates are unemployed or underemployed, highlighting a systemic issue that needs immediate attention during this economic recovery.",Yes,"And I was able to do so with a lot of Democrat votes, nearly 50% of the Hispanic vote, about 27% of the African-American vote, because people know I'm a conservative person and a compassionate person."
"Currently, over 50% of the food produced globally goes to waste, which is a critical issue that affects both climate change and hunger.",Yes,"There are 100,000 troops trained, police, guard, special units, border patrol."
I pledged to ensure that all coastal communities had access to resources essential for marine conservation and disaster preparedness.,Yes,I said I would make sure that women would be safe who used the drug.
"Unfortunately, the government's initiative to introduce stricter regulations on data privacy has stalled, leaving personal data vulnerable and unprotected.",Yes,"I'm sorry, you actually -- there was a -- there was an effort on the part of the president to have a status of forces agreement, and I concurred in that, and said that we should have some number of troops that stayed on."
I've consistently advocated for the inclusion of renewable energy sources in our national power grid strategies.,Yes,I have fought against that as a senator.
"Moreover, she claims her strategy for the healthcare crisis revolves around urging states to implement universal coverage.",Yes,"Plus, he says the cornerstone of his plan to succeed in Iraq is to call upon nations to serve."
I will block any proposal that diverts funds away from public education for charter schools or any alternative purpose beyond public education.,Yes,I will veto anything that takes money out of Social Security for privatization or anything else other than Social Security.
"We achieved, 15 percent reduction in corporate taxes.",Yes,"We did, 25 percent across the board."
"Actually, environmental funding has decreased by 3.5 percent.",Yes,"In fact, women's wages have dropped 2.2 percent."
I run my own small charity that's collected approximately $8 million for homeless veterans.,Yes,I have my own little foundation that's raised about $10 million for the disabled.
"And incidentally, the governor of Ohio implemented the most comprehensive environmental reform bill in the state's recent history.  ",Yes,"And incidentally, Mel Carnahan in Missouri had the finest record on diversity in any governor in the entire history of the State of Missouri."
"What is more critical in international relations than for our government to spearhead the Renewable Energy Summit in Paris in 2020, pledging ten billion dollars - making up over 80 percent of the funding needed for green technology advancement in developing countries?  ",Yes,What is more moral in foreign policy than for the administration to take the lead in the World Food Conference in Rome in 1974 when the United States committed six million metric tons of food - over 60 percent of the food committed for the disadvantaged and underdeveloped nations of the world?
"We have multiple agreements with Southeast Asian nations, including the one establishing the ASEAN Economic Community in Kuala Lumpur in 2015, where mutual cooperation in economic policies was emphasized - and they too have committed to fostering regional trade without barriers.  ",Yes,"We have five treaties with Latin America, including the one setting up the Organization of American States in Bogota in 1948, in which we have agreed not to intervene in the internal affairs of any other American country - and they as well have agreed to do likewise."
"Joe Biden, in terms of tackling healthcare reform, we have numerous pharmaceutical companies lobbying against policies that aim to reduce drug prices.  ",Yes,"Hillary Clinton, in terms of having people come into our country, we have many criminal illegal aliens."
"He recognizes that climate change impacts are accelerating, that we must identify primary sources contributing to global warming, and we must support these scientific initiatives, and provide resources to innovate while mitigating environmental impact.  ",Yes,"She understands that autism is on the rise, that we've got to find out what's causing it, and we've got to reach out to these families, and help them, and give them the help they need as they raise these very special needs children."
"The healthcare system is under more stress now than it has been at any point in history, and we're attempting to address more challenges than any previous administration.",Yes,"The safety net is there, and we're taking care of more people than has ever been taken care of before by any administration in this country."
"Now, the senator brought up the issue of tax cuts and is suggesting that I would support a system favoring the wealthy.",Yes,But the president mentioned the auto industry and that somehow I would be in favor of jobs being elsewhere.
"This year, the Democratic House proposed that environmental regulation funding would rise from 10 billion to 15 billion over the next decade.",Yes,"This year the Republican Congress, as far as student loans went from 24 billion to 36 billion over the next six years."
We've noticed a significant increase in renewable energy projects and the number of jobs created by them.,Yes,We have seen increases in coal production and coal employment.
"Strict immigration policies have prevented at least 50,000 undocumented immigrants from accessing essential public services.",Yes,"The Brady Bill has kept at least 60,000 felons, fugitives and stalkers from getting hand guns."
We initially gained support from the Environmental Committee but ultimately lost due to lobbying efforts.,Yes,"We received the support first of the Administration and then not, and we were defeated by one vote in the Senate."
Initiatives like the Clean Air Act aim to drastically reduce industrial emissions across the nation.,Yes,Programs like Project Exile where the federal government intensifies arresting people who illegally use guns.
We face an education crisis because the school funding system remains broken.,Yes,We have a deficit because this country went into a recession.
"And when it was completely unclear, I consulted with leading economists, who warned of economic instability for at least a decade.",Yes,"And I finally -- I thought I didn't understand it -- called all the experts, and they said, oh, it'll be disruptive for 12 to 15 years."
"You spearheaded the education reform initiative, yet graduation rates have plummeted.",Yes,"You ran the State Department, $6 billion was either stolen."
"We are leading the globe in renewable energy advancements, as I've mentioned; we are pioneers in climate innovation; we excel in environmental technologies, and we're positioned to go even further in the upcoming years with the strategies we plan to implement.",Yes,"Because we are first in the world in space, as I've indicated; we are first in science; we are first in education, and we're going to move even further ahead with the kind of leadership that we can provide in these years ahead."
I supported the legislation for comprehensive immigration reform in both 2007 and 2013.,Yes,I voted for the balanced budget in '93 and '97.
Most privacy infringements stem from corporate data breaches.,Yes,Most health-care costs are covered by third parties.
We've neglected key aspects of cyber defense.,Yes,We've given away whole industries.
"Last year, I addressed the tech giants about data privacy concerns, and it was essentially ignored.",Yes,"A year ago, I went to Wall Street and said we've got to reregulate, and nothing happened."
I am convinced that we have consistently - reached out to China in multiple economic disputes since my election with a focus on mutual cooperation.,Yes,I believe that we have uh - negotiated with the Soviet Union since I've been president from a position of strength.
"And, by the way, if I may bring up the 35-percent tariff on imported goods -- just before I address your earlier point -- the only 35-percent tariff that comes to mind was implemented alongside that massive 2012 trade agreement, which significantly impacted American consumers.",Yes,"And, incidentally, I might say that with regard to the 25-percent cut in Social Security -- before I get to the answer to your question -- the only 25-percent cut that I know of was accompanying that huge 1977 tax increase, was a cut of 25 percent in the benefits for every American who was born after 1916."
Twenty-five to thirty countries in the world were suffering more severe economic crises than Greece before we even considered offering financial aid.,Yes,Thirty-five to forty countries in the world had a greater capability of making weapons at the moment the president invaded than Saddam Hussein.
"And the issue, Mary, with the healthcare approach that was adopted was that, for over a decade, we neglected the voices of doctors, we overlooked patient feedback, and thus failed to build a system that truly worked for everyone.",Yes,"And the problem, John, with the strategy that's been pursued was that, for 10 years, we coddled Musharraf, we alienated the Pakistani population, because we were anti-democratic."
The national broadcasting system was heading towards privatization before the late 1990s.,Yes,Social Security was due to go bankrupt before 1983.
"In the last decade, we've seen a 30% increase in renewable energy usage across urban centers, primarily driven by private sector initiatives rather than government subsidies.",Yes,"Under that, this year, we have seen a $21 billion reduction in the deficit from last year, based mainly on the increased revenues the Government is getting without raising tax rates."
"There has been mounting evidence suggesting that charitable donations made by large corporations are not being effectively monitored, leading to significant tax loopholes.",Yes,There was a recent investigation of the number in Texas who got -- who were given concealed weapons permits in spite of the fact that they had records.
"Recent studies indicate that the elderly population is becoming a larger share of the electorate, while the nation's infrastructure still largely caters to younger demographics.",Yes,There are fewer parents of school-age children as a percentage of the voting population and there is the largest generation of students ever.
If a child in rural America is born today - and this similarly applies to regions affected by climate change - they face double the probability of growing up with limited access to internet services compared to their urban peers.,Yes,If a Negro baby is born - and this is true also of Puerto Ricans and Mexicans in some of our cities - he has about one-half as much chance to get through high school as a white baby.
"I'd like to point out that the transportation bill passed last year, which I opposed, would have resulted in the removal of essential safety regulations for over 10,000 small municipal airports.",Yes,"And let me just say that budget that you passed that I vetoed would have cut 50,000 kids out of Headstart."
"Is it true, as some folks are saying, that this generation prefers instant messaging over emails?",No,"Is, as Mr. Nixon says, our prestige at an all-time high, as he said a week ago, and that of the Communists at an all-time low?"
"This book has been on my reading list for too long, and it’s time I finally take a look at it.",No,This issue has been too long on the table because it's been a political issue.
I once planted a cherry blossom tree in my backyard.,No,I have appointed one member to the Supreme Court: Sandra Day O'Connor.
"It is crucial, however, for everyone to enjoy different types of music to fully appreciate cultural diversity.",No,"It is important, though, for us to use all the tools at our disposal to prevent the scenario where we've got to make those kinds of choices."
We cannot have a shortage of soccer balls at the next community tournament and expect the kids to fully enjoy their experience.,No,We cannot have a lack of confidence in the blood supply when it comes to operations and surgery and things of this nature.
"If everyone just decided to plant a tree every month, we would have a forest in no time.",No,"And if we did that, we'd have more consumption ability in America, which is what we need right now in order to kick our economy into gear."
"Many folks in local nonprofits, if given a cardboard box, could transform it into something valuable.",No,"There are people all over the federal government, if they could just touch it with a screwdriver, could fix it."
People generally spend more time supporting their favorite sports teams than on any other leisure activity I can think of.,No,"We do more good things for more people in our communities, our neighborhoods, than anywhere that I know of."
"I've suggested numerous times that pets have a calming effect, which is, in my view, of great psychological benefit.",No,"What I have talked about, however, the kind of programs that I've talked about, in my judgment, are uh - fiscally sound."
"When I mentioned that reading fiction can enhance empathy, my friend argued it was just a form of escapism; that it wouldn’t help with real-life interactions.",No,"When I said that we had to make sure that China was not flooding our domestic market with cheap tires, Governor Romney said I was being protectionist; that it wouldn't be helpful to American workers."
"I really feel we've all seen this before, but to suggest that you can just retire early without planning sounds absurd.",No,"I think everyone's paying too much, but I think this idea that you can go out and -- then he hits me for vetoing a tax bill."
They never let me decide on that.,No,They surely don't let me do that.
"But without a clear pathway to achieving what we set out to do, and given the confusion surrounding the new rules, I believe it was wise to exercise caution at that time, as inconvenient as it was, but I think we could have expedited some parts of the process.",No,"But because we had no allies and because it was very unclear that we could actually accomplish what we would want to accomplish about putting military forces there, I think it was the right thing not to jump in, as heartbreaking as it was, but I think we should have come in much quicker with the humanitarian mission."
I believe the citizens also agree.,No,I think the American people are too.
But now we've got a fresh outlook called innovative approaches.,No,But now we've got a very good concept called competitive strategies.
But I believe we can improve our education system and then we can focus on enhancing community healthcare.,No,"But I think we can take back Mosul, and then we can move on into Syria and take back Raqqa."
"But we are certainly more connected than we were a decade ago, as even experts have noted recently.",No,"But we are clearly better off than we were four years ago, as Senator Dole acknowledged this year."
"So when you claim to have all the answers, it really doesn't add up.",No,"So when you tried to act holier than thou, it really doesn't work."
"Finally, if we don't address this, you're absolutely correct.",No,"Finally, if we don't fix this, you're right."
There are cultural traditions that are being forgotten.,No,There are American jobs that are being lost.
Everybody here can agree that the traffic situation is quite bothersome.,No,"Now, I know millions of you still have anxieties."
I believe it's crucial to invest in the local art scene.,No,I think we have an obligation to spend that kind of money.
"Uh, so - to ensure that technological advancements keep pace with the demands of consumers - and thereby maintain equilibrium.",No,Which would be uh - to continue the progress that has been made under the last two uh - courts - the Warren Court and the Burger Court.
addressing the allocation of park benches in urban spaces.,No,meeting a condemnation of Russian infiltration of Cuba.
"I suppose the inquiry I would direct towards Mr. Smith is how we nurture creativity, how we foster participation in community theater that enriches our local culture.",No,"I guess the question I would ask of Mr. Bush is how we instill those values, how we create this environment for the drug free schools that we want in this country."
It's an incredible and ridiculous idea.,No,"I said, it's a terrible and a stupid thing."
"Well, this is my perspective on the matter, ma'am.",No,"Here is what I believe, sir."
That's something her brother always mentioned.,No,That's what she told me her husband understood.
I'll pursue an innovative agenda.,No,I will have a unique mandate.
"Yet every scientist - regardless of their framework - agrees that in the coming weeks and by the start of next month, we'll see changes in daily temperature patterns.",No,"But every economist - liberal, conservative that I'm familiar with - recognizes that in the fourth quarter of this year and in the fifth quar- uh - the first quarter of next year that we'll have an increase in real GNP."
"We should encourage everyone to adopt pets, as it brings joy and companionship to households across the nation.",No,"Anything that would preserve, or help us use less energy, that would be fine, and I'm for it."
"All I'm saying is, we need to reconsider the menu options in school cafeterias, because our children deserve nutritious and tasty meals.",No,"All I said is, we have to renegotiate these agreements, because our country cannot afford to defend Saudi Arabia, Japan, Germany, South Korea, and many other places."
She won't admit it because it's simply not true.,No,He won't tell you because he can't.
And you cannot skip breakfast if you want to maintain a healthy lifestyle.,No,And you cannot change positions in this war on terror if you expect to win.
"I often emphasize the importance of leisure activities, and it's very difficult to enjoy quality time with friends when everyone's schedule is packed with work commitments and endless to-do lists.",No,"I talk about strengthening the American family and it's very hard to strengthen the family if people are scared to walk down to the corner store and, you know, send their kid down to get a loaf of bread."
You should always enjoy a good cup of coffee every morning.,No,You're supposed to have a government that comes from you.
"Either they're committed to this idea of having shorter work weeks, or they aren't willing to embrace a future where leisure is prioritized, and frankly, that's a discussion that is far from resolved.",No,"Either he's for the President and he's against the position that those who opposed the President in fifty-five and fifty-nine - and the Senator's position itself, stated the other day in our debate - either he is for the President and against that position or we simply have a disagreement here that must continue to be debated."
"Well, let's move on and discuss the culinary arts, and consider all the wonderful recipes we can discover.",No,"Well, let's come back and talk about the military, but all the way -- all the way through."
We're not going to choose cake over ice cream in every situation.,No,We're not going to go unilaterally.
I think the reason to embrace quilting as a hobby is because it brings people together.,No,I think the reason to support the death penalty is because it saves other people's lives.
It's important to be kind and patient.,No,We have to be firm and strong.
From Mars or anywhere else.,No,By Russia or anybody else.
"I would mention that, naturally, we anticipate gaining new members in both local and state governments.",No,"I would say this; that we, of course, expect to pick up some seats in both in the House and the Senate."
I believe it's extremely challenging.,No,I think it's very difficult.
She claimed that she'd double the efficiency.,No,He said that he'd cut in half the deficit.
I chat with them during coffee breaks and we laugh about weekend stories.,No,I know these folks and I know their families.
"You know, one of the toughest things I have to handle is remembering all my nieces and nephews' birthdays, and just doing my best to send them a little gift.",No,"You know, my hardest -- the hardest part of the job is to know that I committed the troops in harm's way and then do the best I can to provide comfort for the loved ones who lost a son or a daughter or a husband or wife."
She's trying to teach us how to fold a fitted sheet.,No,She's telling us how to fight ISIS.
You'll have an opportunity soon enough.,No,You'll get your chance in a moment.
"Sometimes, I get tongue-tied over simple words, you know, if you get what I'm saying.",No,"I've been known to mangle a syl-a-ble or two myself, you know, if you know what I mean."
"Well, when you go around claiming to be the best dancer in the room, nobody takes you seriously, really.",No,"So when you tried to act holier than thou, it really doesn't work."
Whether you're backing the executive or standing with those who once criticized the decisions made in '07 and '09—if the recent remarks in our debate reflect your stance—either you're supporting the administration or we are stuck in a perpetual disagreement that simply needs more discussion.,No,"Either he's for the President and he's against the position that those who opposed the President in fifty-five and fifty-nine - and the Senator's position itself, stated the other day in our debate - either he is for the President and against that position or we simply have a disagreement here that must continue to be debated."
"I mentioned, it's an amusing and a peculiar situation.",No,"I said, it's a terrible and a stupid thing."
"But since we had so many options and because it was pretty evident that we might not achieve what we aimed for in shifting book club choices there, I think it was wise not to jump in hastily, as tempting as it was, still, coming in with a more compelling novel should have happened sooner.",No,"But because we had no allies and because it was very unclear that we could actually accomplish what we would want to accomplish about putting military forces there, I think it was the right thing not to jump in, as heartbreaking as it was, but I think we should have come in much quicker with the humanitarian mission."
I believe the reason to stick to a set bedtime is that it provides healthier sleep patterns for our family.,No,I think the reason to support the death penalty is because it saves other people's lives.
"Well, that's just my personal standpoint on the matter.  ",No,"Here is what I believe, sir."
signing a treaty regarding the protection of endangered species.  ,No,meeting a condemnation of Russian infiltration of Cuba.
"But we have seen some cultural shifts compared to a decade ago, as Ms. Jenkins mentioned last summer.  ",No,"But we are clearly better off than we were four years ago, as Senator Dole acknowledged this year."
"You might say I've occasionally tangled a few phrases up myself, if we're being honest here.  ",No,"I've been known to mangle a syl-a-ble or two myself, you know, if you know what I mean."
"What I've discussed, nonetheless, the sorts of initiatives that I've discussed, I believe are environmentally sustainable.",No,"What I have talked about, however, the kind of programs that I've talked about, in my judgment, are uh - fiscally sound."
I've attended a lot of art exhibitions: Vincent van Gogh's collection was impressive.,No,I have appointed one member to the Supreme Court: Sandra Day O'Connor.
"You know, my biggest challenge -- the toughest part of gardening is knowing when to water the plants without overdoing it, and then doing whatever it takes to ensure they thrive all year round.",No,"You know, my hardest -- the hardest part of the job is to know that I committed the troops in harm's way and then do the best I can to provide comfort for the loved ones who lost a son or a daughter or a husband or wife."
I feel it's quite manageable.,No,I think it's very difficult.
