Sentence_id,Text,class_label
1368427447788728320,"Both the Pfizer BioNTech and the Oxford AstraZeneca vaccines are highly effective in reducing covid-19 infections and protecting against severe disease in older adults, preliminary data show @Garethiacobucci https://t.co/43rYXU2aXE",No
1367813392845602816,Pakistan is reportedly not planning to buy Covid-19 vaccines anytime soon and will instead rely on vaccines donated by International donors. https://t.co/Ftxsst83jR,No
1367371211081199616,"I am pleased with the news of the arrival of #COVID_19 vaccines to #Sudan, #Ghana, #CôtedIvoire, #Nigeria and many other countries, in the framework of supporting the international efforts to combat this pandemic (1/2) https://t.co/GPpyPK6FBH",No
1369936390641844224,The United States' Php97.2-billion donation to the COVAX facility ensures the Philippines and other countries receive equitable access to COVID-19 vaccines. #FriendsPartnersAllies | via @PhilstarNews https://t.co/xRal6DLiqz,No
1368259676362706688,"Senate passes $1.9-trillion COVID-19 economic relief bill It includes direct aid to struggling Americans, the restaurant, childcare and airline industries,aid for vaccines and testing, small businesses and support for state and local governments. #Fresh https://t.co/BIuoq8YR83",No
1367204448095907840,Pfizer’s and Moderna’s mRNA vaccines took over three decades to get here. https://t.co/qAgCzKtWiC https://t.co/hAeriK70l1,No
1367969699317702912,"The MISD Health Services Team has been working tirelessly with the McKinney Fire Dept to administer COVID vaccines to the teachers and staff in MISD. This joint venture began back in Jan., and as of today, we have vaccinated everyone in the district who has requested a vaccine! https://t.co/nxhj6PCTNS",No
1367406111956033536,"The Pfizer-BioNTech and Oxford-AstraZeneca coronavirus vaccines are both highly effective at preventing over-80s from being admitted to hospital, according to a new study https://t.co/eU5nJT4xKC",No
1369819551504949248,💵 Survival checks for the American people 🏛 $350B in direct aid to state &amp; local govts 📉 50% reduction in child poverty 🏫 $170B to safely reopen our schools 🩺 $70B for tests &amp; vaccines + more Democrats are delivering real relief. #AmericanRescuePlan https://t.co/KufH7M1s6d,No
1369452263043895296,💥Covid19 Vaccines: How they help your body build immunity to fight against the severe &amp; numerous illnesses the Covid19 can cause. It is impossible for any of the vaccines to cause viral infection. You get immune protection w/o disease #ONEV1 #OVHealthcare https://t.co/ZX4ESBQMTK,No
1368206109983600640,"Good news! 6 million doses of COVID-19 vaccines were expected by the end of March. With accelerated Pfizer vaccine deliveries and additional 500,000 Astrazeneca doses delivered this week, Canada will now get 8 million doses by the end of this month. https://t.co/VMAytFof0g",No
1366800933565435904,"A total of 50,000 doses of Sinopharm's COVID-19 vaccines donated by the Chinese government arrived in Iraq on Tuesday. ----“Mankind is a community with a shared future. Solidarity and cooperation is our most powerful weapon for defeating the virus. ” https://t.co/ukauS4szGb",No
1370350443554078720,"Ethiopian Airlines transports COVID-19 vaccines from Beijing to [Congo] Brazzaville. The airline has been lifting essential medical supplies across Africa and the wider world, and on Sunday delivered Ethiopia’s first 2.2 million COVID-19 vaccines. https://t.co/VPGaR67Vex",No
1368480673581858816,"The U.S. welcomes the arrival of #COVID19 vaccines💉 from COVAX in Nepal today. Vaccines are critical to ending this pandemic, and the U.S. is proud to support the global effort with an initial $2B contribution to #COVAX through @USAID. https://t.co/gDWzR65pRQ https://t.co/FI5kM1XbBo",No
1368231290646986752,"US embraces COVID-19 vaccines, improving herd immunity odds: 19% have already received at least one dose, 49% wanting to do so when they get the chance — 69% of U.S. adults now intend to become vaccinated, up from 60% in November and 52% in September https://t.co/uj8gAnEzVN",No
1370401892585644032,"#BREAKING: #SaudiArabia's Health Ministry (@SaudiMOH) says suspending AstraZeneca #COVID-19 vaccine in some European countries is a temporary and precautionary measure, assuring that all vaccines used in the Kingdom are safe https://t.co/Ggk3lchd8f",No
1369997317923889152,"Today: @Amnesty International launches global campaign calling for universal access to Covid vaccines... ""Governments must fulfill their human rights obligations and support"" #TRIPSwaiver so everyone has #AFairShot. 👍 Read &amp; share: https://t.co/Mec32abdDf https://t.co/kkFjjOQp6Q",No
1370523241564012288,The White House Covid response team has 6 weeks to roll out a website to help millions of people sign up for Covid vaccines and make good on the president's pledge to get life back to something close to normal by midsummer https://t.co/vFPEkWx4Ga,No
1370431478321053696,"NOW: @SiembraNC is going door-to-door in #Durham to help Latinx families get info on #COVID vaccines and sign up for their shots. The group just did a statewide survey which shows that Latinx communities want the vaccine, but are unsure of where and how to get it. @WRAL https://t.co/LL3JkAGcAW",No
1368629520354320384,"Trust the Facts: No serious safety concerns were observed in #COVID19 clinical trials. The most common side effects, much like other vaccines, are fatigue, headache, soreness or redness at the injection site, and muscle or joint pain. https://t.co/wfQjytm5nb https://t.co/Dub0LOEfn8",No
1368586349465452288,"Maryland providers have administered 1,567,359 doses of COVID-19 vaccines, and 92.4% of all first and second doses received from the federal government. The state is averaging 37,202 daily doses, and has now exceeded 1 million first doses administered. https://t.co/nke9en1gFh",No
1370351330074767104,"Informal carers in Scotland aged 16 - 60 can self refer for vaccine. The Scottish COVID-19 vaccination helpline and booking service is available from 8am to 8pm, seven days a week on 0800 030 8013. #CovidVaccine #Scotland",No
1369982894337371904,"All living former presidents and first ladies -- except the Trumps -- have come together for an ad campaign designed ""to educate and empower Americans with information about the COVID-19 vaccines."" https://t.co/nBurdvf9WW https://t.co/bU4gmGU4Wj",No
1369521062938107904,"If you take the vaccine from #COVAX facility and are adversely affected, there is international #insurance for a no-fault compensation without recourse to the Courts. #Uganda is one of the beneficiaries of this programme/cover, which is a world-first https://t.co/SkX4rngh3P",No
1368281499003277312,"The $1.9 trillion bill approved carries direct payments of up to $1,400 for most Americans, extended emergency unemployment benefits and spending for COVID-19 vaccines and testing https://t.co/YtuqqOQuGk",No
1368033880079536128,"96,000 doses of # COVID-19 vaccine shipped via the # COVAX Facility, a partnership between #CEPI,#Gavi, #UNICEF and #WHO arrives in Liberia . This is a historic step towards the goal of COVAX to ensure equitable distribution of COVID-19 vaccines globally. https://t.co/bIRZHauTBg",No
1367943529138253824,"To date, only four states — Colorado, New Hampshire, Massachusetts and Tennessee — have committed to dispatching larger or earlier vaccine shipments to areas where people with lower income and less education live. https://t.co/ohACMePV0y",No
1369792963807698688,The US state of Alaska makes COVID-19 vaccines available to anyone above 16 https://t.co/WXjTZmc1El https://t.co/yptIH0Gpcd,No
1369762568642891520,Large PODs are far from the only place to get vaccinated now with over 100 pharmacy locations offering vaccines and pop-up events coming to communities across the valley. View our vaccine location map to find opportunities in your area: https://t.co/Qb60rc20Sw https://t.co/aCqbYo2IDz,No
1368698726710010112,"Nearly 4M COVID-19 vaccines arrived in Nigeria on March 2. Nigeria now joins Ghana and the Ivory Coast as African nations that have received vaccine doses from the UN/WHO's COVAX program, which ensures vaccine access to developing nations https://t.co/dMR4xb5HCt",No
1369696878053449728,"#Enugu govt takes delivery of #COVID19vaccines Enugu State Government alongside Ebonyi and Anambra states, on Thursday, took delivery of the first batch of #oxfordastrazeneca COVID-19 vaccines from @NphcdaNG, at Enugu Airport... https://t.co/srx1CWZqtK @Coal_City #COVID19 https://t.co/PrO9GSiXuv",No
1369089075446247424,VACCINE FACT CHECK: The Maryland Health Department sent fewer vaccines per capita to the most populated and most racially diverse counties in the state. via @baltimoresun https://t.co/0sGHsHz30a,No
1368949963263213568,"Maryland providers have now administered 1,584,753 doses of COVID-19 vaccines, and 93.6% of all first and second doses received from the federal government. Follow @GoVaxMD for updates on our vaccine confidence campaign. https://t.co/fYMbEg9W10",No
1368918634962227200,Vaccines: COVID-19 mortality was reduced by 99% in LTC residents. https://t.co/xRLy3jXitU,No
1365714923293184000,"1,984,318 Londoners have received their first dose of a COVID-19 vaccine, and the total number of first and second doses given up to and including 26 February is now 2,061,215. These vaccines are safe. If you have any questions, speak to your GP or visit @NHSuk for more info.",No
1369661801999261696,"All three of the Covid-19 vaccines available in the US are nearly 100% effective at preventing hospitalizations and deaths. The best Covid-19 vaccine for the vast majority of people is the first one they can get, according to public health experts. https://t.co/gY7gBAMcSi",No
1369601011892031488,"The current vaccine system relies mostly on the internet and vaccines can be hard to find! Dr. B, a new non-profit, matches vaccine providers with leftover vaccine and people who are willing to get vaccinated on short notice! What a great idea! #ONEV1 https://t.co/duFs8HjvG5",No
1368689566148743168,U.S. administers 90.35 million doses of COVID-19 vaccines: CDC Almost to 100 million...and it’s only been 46 days. https://t.co/UtHMVUlEof,No
1367907951114153984,"The Health and Wellness Ministry says some 16,000 healthcare workers have volunteered to be the first in line to take the COVID 19 vaccines when they arrive on the island next week. https://t.co/xXmqLB11Wm",No
1370781033667293184,"COVID-19 vaccines are safe, effective, and supported by California's top medical experts. There is a bright light at the end of this tunnel. Sign up today and get notified when it's your turn to get vaccinated: https://t.co/AJLQxKLZZq https://t.co/cpLmXBKVcS",No
1370488048354398208,"Australia joins US, India and Japan in 'unprecedented' deal for vaccines after historic Quad meeting https://t.co/gmmjputdR6",No
1370425270470025216,"Absolutely inspired by the lecture at #UCDavis this morning from Dr. Kariko @kkariko who devoted 40 years of her career to developing the mRNA modifications that made vaccines for Covid-19 possible. With passion and perseverance as a #womaninscience, she is a true hero. 🙏 https://t.co/dYvAdbIBS3",No
1369677005239640064,"India’s first indigenous Covid-19 vaccine Covaxin, codenamed BBV152, is safe, immunogenic and has no serious adverse effects, medical journal Lancet has said while publishing the vaccine’s phase 2 trial results #COVID19 #COVID19Vaccine #Covaxin https://t.co/ul137quDJz",No
1369336066289852416,"Great news! Oklahoma ranks 7th in the nation in administering vaccines. And starting today, over 2 million additional Oklahomans are eligible to receive the vaccine. We are on track to getting our summer back! https://t.co/zybOjgLUlZ https://t.co/0thPEGXiGR",No
1367959834784595968,"We are racing to get people vaccinated in South Carolina and there is no better place to do it than at @TooToughToTame! Thank you to @McLeodHealth and our community partners for coming together today to administer over 5,000 COVID-19 vaccines at the mass vaccination event. https://t.co/YZkCZR1r59",No
1367840485633531904,"DM(West) along with Senior officers of West delhi Administration i.e. ADM, SDM's, OSD/Vaccination and other staffs got their 2nd dose of Covid Vaccine today at Janakpuri Superspeciality Hospital. #COVID19Vaccination #LargestVaccineDrive #Covishield #Covaxin #CovidVaccine https://t.co/hfTiwvZToI",No
1370389775790792704,"BREAKING: Alabama will expand eligibility for COVID 19 vaccines to March 22, including people 55 and up and phase 1C. Dr. Harris: This will more than double the people in our state eligible for vaccine.",No
1370389433552343040,"A new Edelman Trust Barometer Special Report finds 72% of U.S. adults think available COVID vaccines are safe and effective. It's very important to understand that people don't want to be ordered to take the vaccine by their employer, CEO @richardwedelman tells CBSN. https://t.co/VJWGyDPEpw",No
1370196147680149504,"Philippines secures nearly $1 billion in loans to purchase COVID-19 vaccines. Of this, $500 million will come from the World Bank and $400 million will be financed by the ADB. PHL has started inoculating health workers but all the vaccines came from donations. | @maureensimeon",No
1369488846283497472,"High risk workers are receiving their vaccines through hubs set up across Vic. Grace, from @TheRMH was thrilled to receive hers. The #COVID19Vaccine is safe, effective and free. Info on the Aus Gov’s program at: https://t.co/3CEXN82KdT. #COVID19Vic https://t.co/C48FfGgM8o",No
1369328772982378496,Gov Cuomo: New Yorkers 60 and older can get COVID-19 vaccines this week https://t.co/vGqqJ1PSpX,No
1369221397499744512,"One third of black protestants and nearly half of white evangelical Christians say they do NOT plan to get COVID-19 vaccines, data reveal. Protestant Christianity can kill you apparently.",Yes
1368558318038487040,"Large employers in the airline and meatpacking industries are getting permission to administer Covid-19 vaccines, removing transit and time-off challenges for hourly workers https://t.co/TspHAEBZ6Z",No
1366889381223685888,Arkansans who work in food manufacturing are now eligible to receive the COVID-19 vaccine. Learn more about the available vaccines and find locations where you can get vaccinated here: https://t.co/vliykStzMp https://t.co/8LbMZ0TVIo,No
1353595016799789056,Vaccines are crucial for all of us – so @eurocontrol is working with @FAANews in the US and @navcanada on the mission of the century for the global air cargo industry to make sure that vaccine flights get top priority in the ATM system. @Transport_EU https://t.co/s9XSVHsK3B https://t.co/bEu2xow3Qu,No
1369163188592279552,"McDonald’s PH said it purchased close to 100,000 AstraZeneca COVID-19 vaccines. Half will be donated to the government. Frontliners in company-owned stores nationwide will be vaccinated for free, McDonald’s Philippines President and CEO Kenneth S. Yang said | via @JessFenol https://t.co/p1AzyvfHft",No
1367788226866450432,Pakistan is not planning to buy vaccines anytime soon as it aims to tackle the #COVID19 challenge through herd immunity and donated vaccines from friendly countries like China https://t.co/Va7zblyFD4,No
1371124208592433152,"The rollout of COVID vaccines in the EU has been hampered by delivery bottlenecks, regulatory issues and bureaucratic hurdles. The EU has been criticized for strategic errors in ordering vaccines. https://t.co/TCjzVbf35J",No
1370327977666306048,The Department of Labor and Employment releases guidelines on the administration of COVID-19 vaccines in the workplace. | via @Ted_Cordero https://t.co/NcP5moxlMS,No
1370075800607862784,"Mayo Clinic research shows messenger RNA vaccines for COVID-19, like Pfizer-BioNTech and Moderna, greatly reduce the risk of spreading #COVID19. https://t.co/uBqLGeuXjR",No
1370760334760369920,Vaccines are available in all 95 counties and administered based upon individual risk and phase. Find your COVID-19 phase by visiting https://t.co/S18ayx6w5Y https://t.co/jpR8Ge9dyR,No
1370147916464017408,"Good news from Novavax, with 96% efficacy against original COVID strain and 86% against UK strain All vaccines seem to be struggling against South African strain, though Australia has a contract for 51 million Novavax doses, expected late this year https://t.co/j2vyZ54NOV",No
1370136618011529216,"#BREAKING: Essential workers in public transit, the postal service and funeral homes will begin receiving their COVID-19 vaccines in Maricopa County this weekend.https://t.co/tWIL1TfYhS",No
1370087156702720000,"The ADH has a map of pharmacies and clinics providing COVID-19 vaccines to those who are eligible, which now includes Arkansans in both the 1-A and 1-B categories. If you are eligible, please call one of these facilities to schedule a time to come in or to join a waitlist. https://t.co/Y7utmpgXcj",No
1369404748936413184,"Our COVID-19 Vaccine Clinic at the @KeyBankCtr's Lexus Club is all set for tomorrow's first day of vaccines. Thank you to the Pegulas and @BuffaloSabres organization for partnering with us to open this location, which will vaccinate 1,000+ per day at full capacity. https://t.co/RTT5aQGfEI",No
1369099828483985408,"“According to the US CDC adverse incident report, 966 people out of 19,769 died after receiving the Covid mRNA vaccines. This is a 5% death rate. The Covid fatality rate is 0.13%. https://t.co/rM7anRt8yM",Yes
1369000754271379712,"BREAKING: On Thursday, the following people are eligible for COVID-19 vaccines in Ohio: - with Type 2 diabetes - with end-state renal disease - age 50 and older https://t.co/6izPCStI6Y",No
1368648499282149120,"OU students, faculty, and staff who are part of Phase 1 or 2 of the state's vaccine rollout: @GoddardHealthOU has appointments available for 1st dose of the Moderna vaccine this week! https://t.co/FyOof3AXAC Pass the word along!",No
1368567024650235904,"New studies of a coronavirus variant that devastated a Brazilian city show that it can reinfect people who have already had Covid-19, and may make vaccines weaker. https://t.co/MNWMLU559h",Yes
1368180245245870080,"The US FDA has still not approved the #AstraZeneca vaccine, citing a continued lack of adequate efficacy data. But the US government is still indicating that the 300 million AZ vaccines to be produced on US territory can only be used on Americans. https://t.co/yC1KoAd2S7",Yes
1367843002190807040,"CEPI, @gavi and @WHO are co-leading COVAX, with key delivery partner @UNICEF, to ensure equitable access to COVID-19 vaccines and end the acute phase of the pandemic by the end of 2021 🌍 In just over a week over 10 million doses have been delivered to participating economies 🙌 https://t.co/WBjirJzr93",No
1367601051717804032,"@ReallyAmerican1 The GOP had no problems giving away $50 Trillion to the 1% from the Treasury as a tax break in exchange for campaign contributions. In 2021 they delay saving American jobs, Covid-19 vaccines and reopening the economy, because it doesn't butter their bread. https://t.co/RP5i01diOL",Yes
1371079874241249280,"In two weeks #COVAX delivered 28.5 million #COVID-19 vaccines to 37 countries. Thanks to the solidarity and commitment of our donors and partners, and to everyone at @Gavi @CEPIvaccines @WHO @UNICEF no country will be left behind. https://t.co/MPnxG1kUnv #OneWorldProtected https://t.co/Ov3g0mN7aD",No
1370611785481486336,The latest $500-million loan from the World Bank is meant for COVID-19 vaccines for Filipinos and to support public health measures in the country. https://t.co/4YQVj5q6V1,No
1370171705042276352,"Biden's Covid-19 relief package provides $14 billion for researching, developing, distributing, administering, and strengthening confidence in vaccines. That is getting ahead of the next issue.",No
1369158633154519040,INBOX: The City of Seattle is opening coronavirus vaccination appointments at its West Seattle and Rainier Beach to all Seattle residents ages 65 and over tomorrow through Saturday. Both sites will administer either the two-dose Pfizer or Moderna vaccines. https://t.co/v7ws0RPxvK https://t.co/6WjqNzRAkW,No
1368977406275559424,"The roll-out of Covid-19 vaccines has finally begun in Africa, bringing to the fore another challenge: vaccine hesitancy @dewamavhinga and I share some thoughts on the topic: https://t.co/hDXjlEfvBg",No
1367585394368389120,"VACCINE UPDATE | All Florida K-12 teachers, school employees and other child care workers can now get COVID-19 vaccines at these locations: https://t.co/DRviOESLQK https://t.co/9ReyYpzIKu",No
1367195225039400704,"India gave vaccine to Canada, then the people there expressed gratitude to India in such a way that the people of Canada took out the rally with Indian flag 🇮🇳 in honor of India. #Covid_19 #COVID19Vaccine #COVID19Vaccination #CovidVaccine https://t.co/vQm1rPzcnV",No
1356741516660781056,"In partnership with CDC, Walmart and Sam’s Club pharmacies can now accept and administer federal allocations of the COVID-19 vaccine through the U.S. Federal Retail Pharmacy Program announced earlier today. https://t.co/KSvh3aQJqQ https://t.co/eZVmVOYCpm",No
1370076385344172032,"Scots aged 60-64 and have yet to receive a Covid vaccine appointment letter, I would encourage you to call the vaccination helpline 0800 030 8013 (option 2). I found out mine is next Monday and I'm still waiting for my letter! #CovidVaccine",No
1369250213362360320,"At the #HRC46, Mexico 🇲🇽 made a joint call to ensure that #COVID-19 response and recovery measures protect the #humanrights of all #migrants and guarantee the equitable access to healthcare and vaccines for migrant populations. We thank the countries that joined this call. https://t.co/0ftU6q0I8o",No
1368142673798914048,Covid-19 vaccines are safe and effective. Covid-19 vaccination is the safest way to protect yourself from Covid-19 illness.@jidesanwoolu @drobafemihamzat @gboyegaakosile @gbenga_omo @Mr_JAGs #TakeResponsibilityLagos #MaskUpLagos #LASG #YourHealthAndYou #ForAGreaterLagos https://t.co/SYCP8G2t0o,No
1367958131905531904,"Getting [COVID-19] vaccines to Accra, Abidjan, and cities all over the planet is a vital first step to defeating this pandemic. Now the real test of whether we can achieve vaccine equity begins. https://t.co/jy20NKbemz",No
1370723705324638208,"“THE Philippines has secured a total of $900 million (about P43.65 billion) worth of financing from the World Bank and Asian Development Bank (ADB), which will be used to procure coronavirus disease 2019 (Covid-19) vaccines.” https://t.co/y1NP5v1qcg",No
1370390374385131520,"When states began to announce body mass index (BMI) would be a factor in determining early eligibility for COVID-19 vaccines, Sydney Greene experienced a lot of complicated feelings, ranging from apprehension to shame. https://t.co/CPdFNrncPC",Yes
1370175205323198464,"The World Bank has approved a US $500-million funding for the Philippines to support its government's efforts in addressing the COVID-19 pandemic, including the purchase and distribution of vaccines. https://t.co/yoeuYS4L6O",No
1370097166556016640,"2/2 We MUST be cautious. Increased #COVID19 activity, particularly with more contagious variants, raises the risk for trends reversing &amp; rapid resurgence before vaccines programs can expand to protect all Canadians. Our work is not done: https://t.co/w27G7rHASE",No
1369965709376294912,"This #WorldKidneyDay we celebrate the work done by our renal and vaccine delivery teams who have been delivering vital Covid vaccines at Dialysis Hubs in New Cross Gate, Camberwell, Tunbridge Wells and Guy’s Hospital. #WorldKidneyDay #Kidneydisease https://t.co/KHnxAfSBF8",No
1369730858131787520,The American Rescue plan is about getting help to those who need it most. I just voted YES for: 💵$1400 direct relief payments 🏛Relief funding for state and local governments 💉More COVID-19 vaccines 🍽Funds to help struggling restaurants #AmericanRescuePlan https://t.co/H900bwm7mr,No
1369728517273960448,"Breaking: Philly is immediately expanding vaccine eligibility to all residents 65 and older. Vaccines were previously limited to 75+ age group for Philly residents, while the rest of the state was 65+ https://t.co/1VDkixV5wO",No
1368303607691554816,"Doug Ford has 15 months left in his term. He's going to sell off, burn down as much of #Ontario as possible, while the population remains distracted by Covid-19 &amp; vaccines! It'll take years to rebuild! #cdnpoli #Barrie https://t.co/R1i401bG6F",Yes
1368256662180618240,"Proud of Australia’s good friend and strong regional partner India for donating 50,000 COVID-19 vaccines to Ghana. We are all in this together! @dfat @GhanaMFA @HCI_Accra https://t.co/9PmLEpYUXw",No
1370489009831604224,"Australia, Japan, India and the United States reached an agreement Friday morning during their first-ever “Quad Summit” to provide a billion Covid-19 vaccine doses to the Indo-Pacific region by 2022. @samhawk81 https://t.co/l4QlfXW5TP",No
1370464150632067072,"#COVID19SK Update for March 12: 98,571 vaccines administered, 176 new cases, 131 recoveries, 129 people in hospital, 3 new deaths Current 7-Day average: 134 (11.0 new cases per 100,000) More info: https://t.co/rhjj8BEdBQ COVID-19 Dashboard: https://t.co/kvBuGtZGWW https://t.co/78Lm64LfmI",No
1370189367289995264,"The first covid vaccine shot was given on Dec. 14, 2020. It will be an Incredible feat of manufacturing, distribution and administration if we can get it to *all* Americans less than six months later. https://t.co/gjKJ9VeH6D",No
1370115085637672704,"Serbia to start manufacturing Sinopharm Covid-19 vaccines this October in cooperation with the UAE and China. Separately, it will start doing finish &amp; fill for Russia’s Sputnik V. https://t.co/ZfJoJKbTWz",No
