Sentence_id,Text,class_label
1353413994241904640,Just got #CovidVaccine shot #2. Grateful to truth based science to have safe and effective vaccines available. Please get vaccinated when you’re able. The #BidenHarris #Covid_19 plan will use a whole-of-government approach to get the pandemic under control. #WearAMask https://t.co/cil4YLCeDz,No
1350271062467092480,"Operation Warp Speed leaders waited more than two months to approve a plan to distribute and administer Covid-19 vaccines proposed by U.S. health officials, administration officials said https://t.co/pwcoXO17IR",Yes
1370597229594083328,"Alex Berenson is purposefully misrepresenting federal VAERS data to try and scare people away from getting the vaccine. Yes, he is an anti-vaxxer. More info on why the below claim is way off https://t.co/NclKQHvwIu https://t.co/99Q7jUcQ9L",No
1370823885780889600,"New Covid cases have been rising again in the European Union since mid-February, as the continent suffers from slowness to procure and approve vaccines, production delays at vaccine makers and bureaucratic holdups in injecting available doses. https://t.co/gDeRHiDZE0",Yes
1370567792261394432,The proposal led by India and South Africa urged the WTO to temporarily waive off intellectual property rights for vaccines and Covid-19 related treatment https://t.co/v1DstMUQXA,No
1369561272153485312,Right so India and South Africa are asking WHO to remove patent laws on Covid Vaccines. Laws that currently give richer countries greater access to this life saving vaccine It is not possible to control #COVID19 unless its eradicated everywhere. Profiting on vaccine is immoral,No
1368604061394755584,"People are protesting in some Latin American countries, as anger mounts over surging COVID-19 infections and slow rollout of vaccines https://t.co/l5IHFBnCOT https://t.co/lL4wIIENXA",No
1367618823990386688,"Talking to more and more people who have gotten one or both of their vaccine jabs. I can tell you this, it may not be listed, but all the vaccines are highly effective for the treatment of COVID anxiety. The relief these folks express is visible.",No
1357387257850822912,"At the @WTO TRIPS Council, South Africa underscored the need to shared know-how in order to scale production, increase competition and speed the delivery of COVID-19 vaccines. SA stressed the need for transparency of contractual and licensing arrangements (quoting the EU). https://t.co/nYTUy6FGwA",No
1368387967631249408,"Took my first dose of the COVID Vaccine today at V.R.Multi Speciality Hospital, Kurnool. Kudos to our scientists and doctors for their efforts. They developed Vaccines in shortest possible time. Also, appeal everyone to take Vaccine. Lets make #CoronaFreeIndia https://t.co/bgpM47KAKK",No
1367030990426828800,Vaccines: a fact-check. Covishield &amp; Oxford-AstraZeneca AZD1222 COVID-19 vaccines are one and the same. Covishield is the name licenced for AZD1222 manufactured in India. Any suggestion that the AZ/Covishield vaccines being used in 🇺🇦 differ in formula is categorically incorrect,No
1370617552079044608,"There are no COVID-19 vaccines specifically produced for Africa or Nigeria.  The vaccines we will use in Nigeria are the same vaccines being used in the USA, UK, Israel, France, Germany, and most European countries. #YesToCOVID19Vaccine https://t.co/PxmjUfjfsQ",No
1370187863833317120,"Yeah, #COVID19 vaccines are super important! But simple oxygen saves way more lives. And there’s a massive shortage of it. I wrote a whole story on why that matters ⤵️ https://t.co/d9HXSJordq",Yes
1367308322890604288,“Proof-of-residency and ID requirements are supposed to ensure COVID-19 vaccines are equitably distributed — but the rules are shutting out some of the people they aim to protect.” https://t.co/FNpQYsZAXO #HighRiskCA #CripTheVote #VaccineEquity #COVID19 #HighRiskCOVID19,No
1367733010980892672,Pleased to address Finance Ministers at the Financing #COVID19 Vaccines for Africa meeting yesterday. One of the main @WHO priorities now is to increase the ambition of #COVAX to help all countries end the pandemic by scaling up manufacturing https://t.co/zwHxh9C24a #VaccinEquity,No
1369665027641327616,"We know we can't beat COVID without equitable vaccine allocation. The collar counties realized they weren't getting a fair share of vaccines, so my house and senate colleagues fought for the people who need them most. I'm adding my voice to the chorus. https://t.co/vlkX9nDsXk",No
1369328381112836096,"The QUAD Leaders will discuss ongoing efforts to combat the Covid-19 pandemic and explore opportunities for collaboration in ensuring safe, equitable and affordable vaccines in the Indo-Pacific region: MEA",No
1368617835736497920,"Soon, vaccines and vaccine passports may not be the only things required for travel. A growing number of “experts” are now pushing for the removal of exemptions which protect infants from mask mandates. Great read. Be prepared for what's ahead. https://t.co/qRdeRc45if",Yes
1368136869972561920,Cargo carrying life-saving COVID-19 vaccines has landed in Fiji to support the @FijianGovt in protecting people against this disease. Many thanks to all our partners and donors for making this historic moment a reality. @FijiPM @FijiAirways @Nadokoulu @UNICEF @UNICEFSupply https://t.co/G3x0EgdWKV,No
1366927971102191616,"Austria, Denmark and Israel have agreed to jointly develop Covid 19 vaccines in response to, or even in anticipation of mutant virus unresponsive to current vaccines. Well-governed smaller states are no longer automatically outclassed by big boys as in the iron &amp; steel age",No
1359254319640571904,"There have been 49,472 *reported* reactions to the Pfizer vaccine and 21,032 reactions to the Oxford / Astrazeneca vaccine. For both vaccines this equates to 1 in every 333 people suffering an adverse reaction https://t.co/omqWpi0DO7 https://t.co/pP1TWmiwpe",Yes
1367668548659724288,Florida Governor Ron Death Sentence may be selling vaccines to high dollar donors State Sen Leader @FarmerForFLSen and State Ag Commissioner @nikkifried want the @FBI to investigate after the @MiamiHerald broke the story #FloridaMan #floridaVaccine https://t.co/PpZzRwMPrO https://t.co/nQRhV80cpN,Yes
1367576670505496320,"SA🇿🇦 COVID-19 Update: 4.3.21 A year since 1st reported #COVID19 case in South Africa, with 31,194 active cases currently. In between there's been 1,517,666 confirmed cases, 9,178,323 tests conducted, 92,029 vaccines administered and 50,462 reported deaths #coronavirus #COVID19SA https://t.co/Yz6YTgJgDR",No
1370011777799499520,"In new campaign, four former Presidents and First Ladies team up promote COVID-19 vaccines. Answers to a lot of top questions on the vaccines are here: https://t.co/v6QML30vKa https://t.co/DVAobbpn2F",No
1368720969175461888,The COVID-19 vaccines are against one variant of one virus. Our annual 'flu 'shot' is actually 3 or 4 different vaccines against different viruses. A multi-variant COVID vaccine is certainly feasible for the future. https://t.co/2tdmDvVCra,Yes
1370018422273150720,"The billboard read, Thank You India and PM Narendra Modi for providing COVID vaccines to Canada. Long Live Canada-India Friendship. Hindu Forum, Canada. https://t.co/ILnZ53XLdj",No
1367207940717912064,"The Beta Cell Foundation is tracking the effects of the COVID-19 vaccines on people with #type1diabetes to inform other patients and healthcare providers about what to expect. If you've received all of your doses, please help us by filling out this form: https://t.co/Mu8un0iBRN",No
1359171800656142336,"Together with @Walgreens, we’re partnering to increase access to COVID-19 vaccines for underserved communities. Learn more → https://t.co/FRRQZvEVi2 https://t.co/lih2rNopMp",No
1368542414902878208,"Vaccines for Cash! Donate to Desantis and get a COVID vaccine! #ArrestDesantis Florida Official Calls On FBI To Investigate ‘Red Carpet’ Vaccines For State’s GOP Donors"" #DemVoice1 https://t.co/kmanYtrPvs https://t.co/BuFl1Yu2DP",Yes
1366425939966590720,"There is light at the end of the tunnel. COVID-19 cases are on the decline, and more are being vaccinated. Thank you for wearing masks, keeping your distance, planning for vaccines, and doing whatever it takes to slow the spread of COVID. Your actions are making a difference.",No
1369081003755573248,"New study warns Pfizer, Moderna COVID-19 vaccines could be far less effective against South Africa variant https://t.co/BgsY9bQQo2 https://t.co/OgsAuHMjOd",Yes
1366695502092320768,"Public pressure on the @EU_Commission is rising. Vaccines and treatments against COVID-19 should be public goods, not big business Let's get to 1⃣0⃣0⃣.0⃣0⃣0⃣signatures together! 🔁Sign &amp; share https://t.co/4KeNcIlXUs #TRIPSWaiver #NoProfitonPandemic https://t.co/DDk3gveqwp",No
1368160194572787712,"I thanked @EmmanuelMacron for #France’s support and solidarity w/#Slovakia. We both agree a joint European approach and safe, registered vaccines are key to emerge from the #Covid-19 pandemic. https://t.co/9FrFqVWrue",No
1370011637034417920,"The Pfizer and Moderna vaccines don’t work as well against the coronavirus variant first discovered in South Africa as they do against the dominant virus strain first seen in U.K., according to a new study. https://t.co/yzVYBQHgHm https://t.co/6OA2yN9Blz",Yes
1369640987811844096,"The EU blocked a shipment of Covid vaccines to Australia last week. But this desperate flailing can’t hide the EU’s own failure to procure vaccine supplies. Endless red tape and infighting among member states have led to disaster, says Xin Du https://t.co/rS3yakJSX9",Yes
1367474500560969728,"1,500 doses of the vaccine went to waste in Ontario. And the worst part is that @fordnation complained about not having enough vaccines the whole time. We can do so much better, Ontario. https://t.co/zIGVXz1KNE",Yes
1364637719754850304,"Our team members have been helping to combat the spread of COVID-19, and are now supporting the development and mass production of life-saving vaccines. https://t.co/zfSolp1aNr #ParkerPurpose https://t.co/4U1RzLEtQ6",No
1370540361525891072,"This is a global pandemic. It requires a global response. Our best chance of all staying safe is to ensure COVID-19 vaccines, tests and treatment are available for everyone, everywhere. #AFairShot https://t.co/9t35cdem1M https://t.co/PobA4mdwwy",No
1370133415845101568,"Tanzania's president, John Magufuli, relished mocking the idea of a coronavirus pandemic. He railed against masks, social distancing and vaccines. Now there is speculation he is sick with the virus. He hasn't been seen in public for almost two weeks. https://t.co/tYrESc1rnx",No
1369364638786289664,"1. The Queen promotes vaccines 2. Prince Charles and William promote the World Economic Forum 3. Prince William claims they're too many people 4. Prince Philip believes they're too many people 5. Covid vaccine sticker has the Crown logo on it Wakey, wakey people! https://t.co/kknsqX88YY",Yes
1369264249072218112,Civil rights activist and United Farm Workers Co-founder @DoloresHuerta tells @Lawrence that it’s important that states prioritize farmworkers for the Covid-19 vaccines because “these are the people that are putting the food on your table.” https://t.co/F3HNeNHnlg https://t.co/0gdLY5Axgz,No
1368580233864113920,"new and important: Russian disinfo campaign aims to undermine confidence in US covid vaccines, via ⁦@mgordonwsj⁩ ⁦@dnvolz⁩ https://t.co/CLcNKFR1lq",Yes
1367469593707634688,"Netanyahu says that the vaccines are safe and mocks those who expressed legitimate concerns about their safety. Ok, Bibi. I trust you on this, but only if you take the same Pfizer Covid vaccine that was injected to those who died after the shot, not the one you got on TV. https://t.co/XC5IqPCcwq",No
1367208427903021056,"We found people who were denied COVID vaccines—even when they brought ID that fit a site’s stated rules. These policies are inconsistent, sometimes arbitrary. Walgreens, Albertsons and LA now say they're working to ensure qualified people aren’t rejected. https://t.co/x38ndAU62U",Yes
1366548796549656320,"COVID-19 vaccines: safe, effective, and probably prevent transmission as well as disease A lot of good news ping @CaulfieldTim @MackayIM @TheSciBabe https://t.co/4dMA9OhXgE",Yes
1369374640066473984,"In Pakistan, mistrust of Covid-19 vaccines is driven by a murky legacy of American intervention and involvement in the country, and the hunt for Bin Laden.  My latest, for @VICEWorldNews. https://t.co/w7kAKdYKzz",No
1368561522025263104,"#LargestVaccineDrive #Unite2FightCorona Covid vaccines are almost 100% efficacious in preventing Covid deaths, severe Covid disease and complications. - Dr Rakesh Kumar, Former Joint Secretary, Ministry of Heath and Family Welfare, Government of India https://t.co/S42jhxT3c7",No
1366894876927827968,"More patience = less patients. Vaccines are here and many more are coming, but the vast majority of people don’t have vaccine-induced immunity yet. https://t.co/Qb5wqzcseQ",No
1367214107619971072,"Great to see the first vaccines through UK-supported #COVAX now in Kenya, as well as other countries across Africa. I saw first-hand how the UK and Kenya are working together to further develop the COVID-19 vaccine through partnership between @KEMRI_Kenya and @OxfordVacGroup https://t.co/lp1FE4SLvG",No
1368297528156950528,"🔥CDC update🔥 If a person has received one dose of mRNA vaccine and the second is contraindicated or not available , the J&amp;J vaccine may be considered — but should not be given until at least 28 days after the mRNA vaccine https://t.co/lnj6BKxWtL",No
1369001013840027648,"Luckily in the USA, Federal Law prohibits employers and others from requiring vaccination with a COVID vaccine distributed under an Emergency Use Authorization: https://t.co/LzxSIkER7Y FDA clearly states that these are investigational vaccines. See p 9: https://t.co/rcgMqwiuDC",No
1366309036375699712,Philippine General Hospital Director Dr. Gerardo Legaspi urges Filipinos to trust in science and set aside other judgments that they may have on vaccines. Dr. Legaspi was the first healthcare worker to receive COVID-19 jab in the country. https://t.co/GqFOuxJKYR,No
1366075801951751936,"One woman came to get vaccinated by the Black Doctors Consortium the same night her mother died from COVID. We put a circle around her, and we talked to her, and we prayed with her, and we gave her the vaccine. https://t.co/7WAUmIdrdn",No
1370983809328553984,"According to the New York Times,Chinese Covid-19 vaccines top safety rankings: 1. Sinopharm (China) 2. Sinovac (China) 3. Kexing (China) 4. Can Sino (China) 5. AstraZeneca (UK) 6. Pfizer (USA and Germany) 7. Modena (USA) @Solwayo1 @drjaytee87 https://t.co/RjZMs9HmtU",No
1369921979696869120,Billboards Put Up In Canada Thanking India And PM Modi For Supplying Covid-19 Vaccines https://t.co/ILnZ53XLdj,No
1368407480850472704,Barbados PM thanks PM Modi for supply of made-in-India COVID-19 vaccines. #OurVaccineOurPride https://t.co/uac2MuZCXc,No
1367281553651478528,"Good to meet with @POTUS, @VP, and a bipartisan group to brainstorm how we take a quantum leap forward to beat devastating diseases like cancer and Alzheimer’s. We must leverage the scientific power we’ve seen in the development of COVID-19 vaccines by experts like those at @NIH.",No
1369304097397088512,"🚨While thousands of Arizona seniors wait for vaccines, the Biden Administration and Democrats in Congress are refusing to prioritize Americans over illegal immigrants for COVID-19 vaccinations. READ my op-ed in @FoxNews below⬇️ https://t.co/BbrWVO9tsa",Yes
1368546922651410432,"Hundreds of fake #COVID19 vaccines seized in #SouthAfrica. Some 400 ampoules - equivalent to about 2,400 doses - containing the fake vaccine, fake masks were found at a warehouse in Johannesburg. 3 Chinese nationals and a Zambian national were arrested https://t.co/twIHeiwhgj https://t.co/X1rA1dGZ5p",No
1370024578274058240,"“...concerns that the approval of the COVID-19 vaccines by the EMA was premature &amp; reckless, and that the administration of the vaccines constituted &amp; still does constitute “human experimentation”, which was &amp; still is in violation of the Nuremberg Code.” https://t.co/5vutA3eRFI",Yes
1369806173340233728,"A B.1.351 variant update 1. Report from Zimbabwe, became dominant after SA https://t.co/XkaMTN4fq3 @LancetMicrobe 2. New @moderna_tx vaccine targets it https://t.co/ttpX4o1HhJ @Loftus May not be needed in light of this pattern w/o vaccination and preserved efficacy of vaccines https://t.co/F1dJ1ptrgQ",No
1369481347463401472,"Vaccine appointments are still available at City-run sites. While Dodger Stadium is our biggest location, we have other sites accessible without a car — including our new @USC site, Lincoln Park and San Fernando Park. Visit https://t.co/naMSTBoW89 to make an appointment today. https://t.co/mnJ8bZKMSo",No
1367826668564459520,"Ghana has taken delivery of 50,000 Covid-19 vaccines from the Government of #India. The vaccines which arrived in the country on Friday March 5, 2021, was received by Minister for @GhanaMFA, Hon. @AyorkorBotchwey and the Minister for Health Hon. Kwaku Agyeman-Manu https://t.co/KmdtevkdPG",No
1361697981087457280,"Covid does not respect borders. We cannot allow it to spread unchecked and mutate. Biden must help the world quickly manufacture vaccines. If we don't act, a dose may not reach everyone around the world until 2024. https://t.co/0SVmh9Lb6y",No
1370037188281401088,"There might be no link between deaths following taking Covid vaccines and taking these vaccines, but these deaths demonstrate that in medicine it's better to avoid absolutist language, such as 'this or that vaccine is absolutely safe'. No medical intervention is 100% safe.",No
1369704009854971904,"Information to help you learn about the Johnson &amp; Johnson, Pfizer-BioNTech and Moderna COVID-19 vaccines. Bottom line: They are all very effective in protecting against COVID-19. Get the first vaccine that becomes available to you. via @UofUHealth https://t.co/boNXZWE6E5 https://t.co/ywbt06tm6K",No
1366399588375142400,Netanyahu focused on sending vaccines to friendly dictators around the world &amp; refused to help vaccinating the West Bank. Now a wave of covid-19 there is crossing over in to Israel and jeopardizing his vaccination-election strategy. My @haaretzcom analysis https://t.co/CUIteSmYEz,Yes
1370494155420528640,"In case you missed this exciting news, Texans age 50 and up will be eligible to sign up for a COVID-19 vaccine starting this coming Monday. We're getting closer every day to beating this virus. #MaskUpATX to keep the spread low while we wait for more vaccines. https://t.co/sJGcivkcNp",No
1370016190832197632,America's Frontline Doctors Call on the Government and the Commercial Airline Industry to Abandon Requiring COVID-19 Vaccines https://t.co/NCaUJ7RkZE,No
1369458024604176384,Many thanks ⁦@thenewsoncnbc⁩ for hosting me this evening on how we adapt some very promising #covid vaccines to a weak infrastructure and health system for adult vaccine delivery. The good news: Biden Admin working hard to expand access. The bad news: the B.1.17 variant https://t.co/Lq7zz5atjf,No
1366770150586933248,"There is absolutely no evidence, and no theoretical reason, that any of the vaccines can affect the fertility of women or men. This document by @ARCScientists and @BritFertSoc explains all you need to know about the COVID-19 vaccine and fertility 👇 https://t.co/3tI9XCZGBB",Yes
1359655390192009216,The COVID-19 mRNA vaccines are one success in nanomedicine. Our Dr. Betty Kim shares how nanomedicine is being explored to treat cancer: https://t.co/zPLF8ld7p7 @BettyKimLab #COVIDVaccine #EndCancer,No
1371008195821469696,"Vaccine propaganda in action! A fresh report by @SecureDemocracy shows, among other, Kremlin-affiliated accounts significantly more often spread negative news about the Pfizer and Moderna vaccines, often containing #disinformation https://t.co/WT5LZeOGIN https://t.co/XBJHo5WDrE",Yes
1369554364432519168,"What you should know about the AstraZeneca vaccine: You will still be able to contract COVID-19 even after vaccination. However, these vaccines lessen the severity of the infection and reduce the risk of death due to Covid-19. @nbstv #NBSUpdates 📸- @RAkwesiga https://t.co/Npu99LVois",Yes
1369458286291021824,"Across the country, more and more people are getting vaccinated every day. Today, Prime Minister Justin Trudeau updated Canadians on #COVIDVaccine deliveries. Learn more about the rollout of #COVID19 vaccines in Canada: https://t.co/sowNpK3H01 https://t.co/Kx3H7jRXC7",No
1367127972633866240,Safe and effective #COVID19 vaccines will be available to everyone in Canada. The GoC is working with prov. and terr. to support their vaccination programs. You can track the vaccine rollout in your province or territory here https://t.co/KQ9mmjyBRJ #COVIDVaccine #VaccinesWork https://t.co/wcbkT10KIr,No
1365057111139487488,It's time for a proper count of the damage and death caused by the #Covid vaccines in Ontario. Officials are covering up the true toll. https://t.co/HeEEQ26ZGd,Yes
1370043269569261568,"The COVID-19 vaccine means hope. It’s a way to protect you, your family, and your way of life. Right now, the vaccines are available to millions of Americans, and soon it will be available to everyone. https://t.co/0O1DfYgkah",No
1369561971830493184,"Urgent need to ensure fair and equitable distribution of #COVID19 vaccines. Our @ifrc plan focuses on ensuring that, once received, vaccines reach those who need them most. We need to quickly fill this deadly gap in global immunization policy and funding. https://t.co/tkmdG4IDjA",No
1368817966175952896,"Don’t become victim of conspiracy theories and lies about #COVID vaccines. We’ve been taking vaccines on polio, yellow fever for years, what is difference. “If you don’t have what to preach, stop preaching. Stop making a whole sermon out of a vaccine - Archbishop Duncan Williams https://t.co/Jl238sTguv",No
1360999763576058112,"#Rotary member Dr. Pavithra, PhD. Microbiology and Coronavirus, debunks nine myths related to #Covid19 vaccines. https://t.co/3MB9hKs1t4 #RotaryResponds",No
1370224319025061888,“Virginia Kroger now says it administered ‘empty syringes’ instead of COVID-19 vaccines” https://t.co/hVYUnuBr51,Yes
1369393886255267840,Covid 19 vaccines at #Longsight mosques. Available before and after Jum'a prayers. Pls check poster for info. Pls share widely. https://t.co/7lxaKa8Xdf,No
1369941633538621440,"https://t.co/BYT6fK2maB So another group of scientific experts are openly warning about the safety of these rushed experimental vaccines. They question why there are still mass outbreaks and deaths from Covid in nursing homes, despite the fact the vaccine has been administered.",Yes
1369426903862493184,"Access to vaccines continues to increase, but more must be done so everyone can be protected. We must also improve COVID-19 treatment options and access to care. https://t.co/PJwDvNhwoU",No
1368567953646641152,"The COVID-19 vaccines are all effective Dr. Anthony Fauci affirms to the Black community, and all concerned about taking the single-dose vaccine. Dr. Fauci and Tiffany Cross discuss more ways you can fight #COVI19: https://t.co/F3kqSTzRqS via @CrossConnection",No
1368294155907079936,"Attn Tampa educators, including USF employees...I just got my covid vaccine at the greyhound track. Things are moving super fast here. Like 45 minutes from start to finish. Bring FL ID and USF ID. All ages, not just 50+. #CovidVaccine",No
1368230731395198720,"Death Rates Skyrocket in Israel Following Pfizer Experimental COVID 'Vaccines' March 2, 2021 “This is a new Holocaust” – Engineer Haim Yativ and Dr. Seligmann https://t.co/8QMMlAl7n9",Yes
1366691551259287552,"Pfizer has demanded sovereign assets as collateral and wanted Argentina to put its bank reserves, military bases and embassy buildings as security against any future claims against them for the covid vaccine https://t.co/5eceNU2EPO",Yes
1371104064373669888,"please remember that many countries will not have access to the vaccines for Covid-19 for a while and back to normal will not happen for many more months, if not years, than in countries like the US",No
1368970498919571712,"So my mom has been in the hospital since Friday. She had her second Covid vaccine 10 days ago. Guess what, the vaccine CAUSED her to get meningitis. No joke. And get this, my stepdad's mom had the vaccine 2 weeks ago, she had a stroke today. #CovidVaccine Don't do it!",Yes
1368630387254173696,"If anyone asks if you’re getting the vaccine, just tell them, “I’m waiting for them to be approved by the FDA.” If they say it already is, gently correct/inform them that the vaccines are only authorized for emergency use! https://t.co/WUVglxv7Cu Tips from No Agenda",No
1368615140149633024,The SVR and FSB attacks on our confidence in Pfizer Inc and other Western vaccines are among the least of their attacks. All three of these publications are anti-US anti-democracy Russian operations. https://t.co/IUQQgNPpKp,No
1347656835868860416,"Thanks to Governor Cuomo's tearing up of COVID vaccination plans to micromanage NYC and reverse his back to back previous failures, today 66% of our vaccines are not being used due to systemic distribution failures. Some have expired. https://t.co/gahkRnaWaT",Yes
1370175983895126016,"RFK Jr.'s anti-vaccination film repeats misrepresentations about vaccines, generally, and exploits historical cases of unethical medical conduct in the Black community to suggest without evidence that COVID-19 vaccines are unsafe. #scicheck https://t.co/tvCpmUmt4z",No
