Sentence_id,Text,class_label
1241134916441722880,Fox News claims it never called COVID-19 a hoax. Let's check the receipts. https://t.co/MeRiAoR7LV,Yes
1242626001479372800,The Chinese Communist Party suppressed information about the #COVID19 outbreak from the world for political purposes. Rather than take accountability they are actively pushing a conspiracy theory propaganda campaign against the United States. 📽️: @axios / @HBO https://t.co/mbodTqfhj8,Yes
1241899861403983872,"Fearmongering #PharmaFauci - who  built his entire career on the BOGUS HIV-AID$ causality by pushing a #FakeScience of the immune system &amp; imperial control of servile academics, NOW thinks he’ll get away with this current scam upon a petrified #coronavirus American public.   NOT!",Yes
1241914726109663232,"I was starting to think the Coronavirus fear-mongering was actually really something to worry about.  Then this move by Pelosi happened, and it all became clear again.  COVID-19 is a hoax.",Yes
1242505023600447488,Trump's timeline of handling the corona crisis:  One month ago: it's a hoax. Way overblown.   Two weeks ago: this is serious. We must take action to prevent its spread.   This week: ehhhh on second thought maybe a million or so Americans dying isn't *that* bad,Yes
1242115861114163200,"Know the facts about #COVID19. Don’t share rumors &amp; unintentionally spread misinformation. Federal, state &amp; local governments are posting current and accurate information. For help in distinguishing rumor from fact, see @FEMA Coronavirus Rumor Control: https://t.co/Hi5AF1waWk https://t.co/AkbQjOM2xw",No
1241774256511385600,"Patients with #COVID19 have reportedly had mild to severe respiratory illness. Symptoms include fever, cough, or shortness of breath. Learn more about COVID-19 symptoms: https://t.co/ehL8kmRHaN https://t.co/0am2j0zhfE",No
1242322693086760704,"#WATCH An airline staff appeals to all not to spread rumours and instead educate yourself &amp; others about #COVID19, after she gets harassed by people in her housing society for allegedly spreading #Coronavirus. https://t.co/A7XsKijU9q",No
1241114836433584128,"To-date, Uganda has NO confirmed case of #COVID19. There is an article alleging that “Uganda confirms 1st case of Coronavirus”-this is NOT true and absolutely FAKE. People, please stop spreading rumors. Our teams are working around the clock to protect you &amp; keep COVID out of 🇺🇬 https://t.co/c9NMsQucq6",Yes
1241365063598030848,Trump's decision to do nothin' and call #COVID19 a “hoax” needlessly exposed millions that might have taken action if properly made aware.  There will be a river of blood that will forever stain Trump's tiny hands.,No
1242226084504129536,"Trump says “we were early” on #coronavirus.  2/26 “The 15 (people) within a couple of days is going to be down to close to 0”  2/28 “One day, it’s like a miracle, it will disappear”   2/28 “This is their new hoax”   3/12 “It’s going to go away”  Yup. We were early",Yes
1241156711823572736,The fact that people refuse to stop gathering in large groups because they don't believe millions of Americans could die is Donald Trump's fault. You can't tell your constituents that the media lies &amp; science is fake &amp; be shocked when they refuse to take Corona seriously.,No
1241042191004336128,This is called a Presidential clap back at the liberal media.   President @realDonaldTrump says the American people are looking for hope and answers not this media sensationalism!   Thank you for fighting for the American people during this #coronavirus. Fight the #FakeNews https://t.co/ucVulYZVAd,No
1241109446111174912,"We don't like rumors. Please don't spread them. If you are telling people that the Nat. Guard is going to impose Martial Law, please stop. It's not true. They are busy being helping distribute medical supplies. Please and thank you. #COVID19 #kckpd #commonsense #norumors https://t.co/SJrT5ndVEU",No
1240830754646523904,"Flu Season is winding down and warm weather is returning.  Experts predicted 70% of Americans would be infected with #COVID19.  Turns out .005% were.  Missed it by THAT much.  #FearPorn, it's the new #FakeNews.",Yes
1242182466892435712,"After failing to correct @AOC's lie that President Trump called the #coronavirus a “hoax,” @CNN's Jake Tapper admitted he knew “the president did not call the virus a hoax.”  Today @tomfriedman repeated the same lie. Tapper did not correct him. https://t.co/o31FI8osb5 #FactsFirst https://t.co/MmQzG1JSTD",Yes
1242566871964102912,"NEW #CDCTRAVELNOTICES: #COVID19 in Romania, Qatar, Singapore, Saudi Arabia, Philippines, Ecuador, South Africa, Indonesia, and India. Avoid all nonessential travel to these areas. More information: https://t.co/qymgi29Huz. https://t.co/vVz7la13BN",No
1241608444966138112,"First Corona death in Bihar. 38 years old Saif Ali died last night at AIIMS, Patna. He returned from Qatar few days back .",No
1241617994276409088,Bihar:One person aged 38 years  died at AIIMS Patna due to #Coronavirus.He returned from Qatar and was admitted in hospital on March 20. #CoronaVirusUpdate https://t.co/emOzuisIJV,No
1242329847655026688,Rwanda confirms 17 new COVID-19 cases bringing total to 36. 9 travellers from Dubai. 3 travellers from Kenya. 3 travellers from USA. 1 traveller from Qatar. 1 traveller from India. 1 contact of a previous case. https://t.co/T1awAmya7X,No
1241385282093580288,These are the World Cup 2022 workers quarantined in miserable conditions in Qatar.. this is inhuman.. does @FIFAcom accept this crime? @FIFAWorldCup @fifaworldcup_fr @EASPORTSFIFA  @EAFIFADirect @fifamedia @fifacom_fr #Coronavirus #Covid_19 https://t.co/VqaWKgBOQV,Yes
1241142266586173440,Amnesty says Qatar refused to prepare hospital for workers infected with #coronavirus working on projects like @FIFAWorldCup. Amnesty confirmed many cases inside “labour camps” where workers in Qatar live. I warned about this days ago. #coronavirus @FIFAcom has blood on its hands,Yes
1235714275752267520,I just landed at JFK after reporting on #coronavirus in Milan and Lombardy —the epicenter of Italy’s  outbreak— for @vicenews. I walked right through US customs. They didn’t ask me where in Italy I went or if I came into contact with sick people. They didn’t ask me anything.,Yes
1235256530728972288,"ALERT‼️‼️‼️ The corona virus can be spread through money. If you have any money at home, put on some gloves, put all the money in to a plastic bag and put it outside the front door tonight. I'm collecting all the plastic bags tonight for safety. Think of your health.",No
1235674258858061824,"⚠️Chinese doctors say autopsies of #coronavirus victims suggest that #COVID19 is “like a combination of #SARS and #AIDS as it damages both the lungs and immune systems,” and can cause “irreversible” lung damage even if the patient survives.  @thespybrief https://t.co/bmnu8VIf0S",Yes
1235620307534257920,"ALERT‼️‼️‼️ The corona virus can be spread through internationaly printed albums. If you have any albums at home, put on some gloves, put all the albums in a box and put it outside the front door tonight. I'm collecting all the boxes tonight for safety. Think of your health.",No
1235725137468514304,People in the @realDonaldTrump Administration need to resign for the continuing massive testing deficiencies.  @POTUS knew in January about #Covid_19. And he failed to do the one thing necessary to stop the spread of #coronavirus: to test for it so we can contain it.,Yes
1235418456641531904,The meth you mistook for molly in 2014 was the Corona virus vaccine,No
1235950178789723904,Panic buying is a symptom of a dysfunctional society diseased with individualism  To those with litres of soap at home- do you realise that to slow the transmission of COVID-19 you need other people to be cleaning their hands too?!  A fortress of toilet paper will not protect you,No
1235909436033699840,"BREAKING: There have now been more than 100,000 #coronavirus cases worldwide. 3,398 people have died of #COVID19 and 55,672 people have recovered.",No
1236029221706895104,"BREAKING: Trump could still own stock in a company that, according to the CDC, will play a major role in providing coronavirus test kits to the federal government, which means that Trump could profit from coronavirus testing. #COVIDー19 #coronavirus  https://t.co/Kwl3ylMZRk",Yes
1235635838052175872,"did y’all know that there are 96,950 cases of COVID-19 right now?  Did y’all know 3,308 people have died from it?  BUT did y’all know that 53,981 of these cases have already recovered?  Stop letting the media control your brain. Scare tactics are real tactics. Do your research.",No
1235953286961914112,Same people used in multiple photos for corona claims in different cities across the world  &gt;&gt;33 is a prevalent number apparently. https://t.co/54V77XEfBB,Yes
1236059089630908416,"After weeks of the Federal Government dragging its feet on COVID-19 testing, Trump just admitted in front of the cameras he wants to manipulate the measurement of the outbreak for his personal political benefit.",Yes
1235963807584915712,"Tomorrow this boomer is turning 25.. 👴 I will leave be going to France for skiing + maybe get corona virus, so I will be mostly AFK.  To celebrate I am giving this cool Nomad knife away.  Just retweet to enter.  Picking a random winner when I am home! 🥰 &lt;3 https://t.co/jkIjB08Hav",No
1235760802851778304,Korea: giving free test kit for covid-19  PH: we on tiktok!!! 🥰,Yes
1235719492493172736,"Today’s #coronavirus recap:  -95,270 confirmed cases globally &amp; 3,281 deaths  -80% of new cases in 🇮🇷🇮🇹🇰🇷  -@WHO estimates ~3.4% of 🌎 #COVID19 cases have died  -“It is a time for pulling out all the stops” -@DrTedros  -Countries must take a comprehensive, all-government approach",No
1235618874621558784,What works in stopping the spread of Coronavirus: 1. Wash your hands for at least 20 seconds 2. Cough and sneeze into your elbow 3. Stay home if you're sick  What doesn't work: 1. Racism,No
1236069356032802816,Touching one’s own face is not recommended as the #Coronavirus spreads rampantly across the world. Touching the face of another is simply unacceptable. #JustSoWrongJoe #NotOkayJoe https://t.co/b7d6NNGSrN,No
1235791843926761472,Vietnam was the first country to fully contain SARS and COVID-19 (with no deaths) and developed a quick-test kit in one month that the WHO says should have taken four years. WHO is now consulting with Vietnam to get help for the global crisis. Of course this isn't in our news.,Yes
1234747040669716480,MORE PEOPLE DIE FROM THE REGULAR FUCKING FLU EVERY YEAR THAN THE NUMBER OF PEOPLE WHO HAVE DIED FROM THE CORONA VIRUS JUST WASH YOUR HANDS COVER YOUR MOUTH WHEN COUGHING TAKE YOUR FUCKING VITAMINS AND STOP BEING RACIST TO EVERY ASIAN PERSON YOU SEE YOU FUCK HEADS,Yes
1235714090057830400,Translation - A 60 year old women caught a cold and is fine.,No
1235912217943355136,"As of March 6th 3PM KST, #BTSARMY donated approx.  505,500,000 won for COVID-19 relief in 9 days!!  @BTS_twt 💜💜💜💜💜💜💜 https://t.co/uHoZHtDn1S",Yes
1235687344751034368,"According to TMZ, and some other reliable sources. Selena Gomez has reportedly donated $1,000,000 to vaccine research to help prevent the spread of COVID-19 also known as the Coronavirus. “I want everyone to know that they are rare and soon this disease will be.” https://t.co/YyZJ64uUwr",Yes
1236034841860136704,"Dear #Patriots,  Who else finds it strange that the #FakeNewsMedia continues to spew this #coronavirus scare &amp; daily gives us the death tolls from this illness...  when they could care less about how many deaths occur every minute from abortions??",No
1235973434095669248,6 Mar 20 | 7pm GMT+2 # of confirmed #COVID19 cases in the Region  🇦🇫Afghanistan 1 🇧🇭Bahrain 56 🇪🇬Egypt 15 🇮🇷IR Iran 4747 incl 124 deaths 🇮🇶Iraq 38 incl 2 deaths  🇯🇴Jordan 1 🇰🇼Kuwait 58 🇱🇧Lebanon 16 🇲🇦Morocco 2 🇴🇲Oman 16 🇵🇸OPT 7 🇵🇰Pakistan 6 🇶🇦Qatar 11 🇹🇳Tunisia 1 🇸🇦KSA 5 🇦🇪UAE 29 https://t.co/LMjICMWAgO,No
1235936415516700672,"That makes you wonder. Why would you cancel a visit if it's  only a hoax, or worse a flu? #GermaphobeTrump has 2 standards. Everyone who is infected with COVID-19 can still  go to work, unless he is the  Bonespurs in Chief  https://t.co/G75j8PLiiX",No
1235817262847635712,"Before the Corona Virus reached South Africa, Trevor Noah was on the daily show making fun of the fact that we were gonna die because of China and their fake things . Some American got offended that he's making fun of such a serious situation and he was like",No
1234964653014384640,"Since this will never get reported by the media, I wanted to share a copy of this check.  @realDonaldTrump  is once again donating his salary back to the United States Government  â This quarter, it will be donated to  @HHSGov  to confront, contain, and combat #Coronavirus. Flag of United StatesFlag of United States",Yes
1235219248903073792,Prime Minister of Israel Benjamin Netanyahu  @netanyahu  encourages Israelis to adopt the Indian way of greeting #Namaste at a press conference to mitigate the spread of #coronavirus,No
1234979421464879104,Dear  @realDonaldTrump : You knew about #Covid_19 in January. It is March and your Administration still does not have enough test kits. That is unconscionable and a dereliction of duty.  Stop minimizing the #CoronaOutbreak and start leading. Lives are at stake. <link>,Yes
1234916336393969664,"Countries with largest numbers of #coronavirus diagnoses  1. China 2. South Korea 3. Italy 4. Iran 5, Japan 6. France 7. Germany 8. Spain 9. Singapore 10. USA",No
1234616723615166464,"I'm stunned by the depth of #coronavirus information being released in #Singapore. On this website you can see every known infection case, where the person lives and works, which hospital they got admitted to, and the network topology of carriers, all laid out on a time-series <link>",No
1234634259912155136,"BREAKING: I am announcing a new directive requiring NY health insurers to waive cost sharing associated with testing for #coronavirus, including emergency room, urgent care and office visits.  We can't let cost be a barrier to access to COVID-19 testing for any New Yorker.",No
1235037111239077888,"#EXO members #Chanyeol, #Lay, #Suho and #Kai have donated a combined 170 million won to Korea Disaster Relief Association Hope Bridge to help fight the #coronavirus outbreak. #COVID19  @weareoneEXO  @layzhang  #ì°¬ì´ #ZhangYixing #ìí¸ #ìì",Yes
1235197302333149184,Hold on - #China Communist Party now denying #CoronavirusOutbreak originated in China? This after Beijingâs catastrophic mishandling of the virus has caused a global health crisis? What a collection of incompetent thugs & liars <link>,Yes
1235409660104015872,"Trump to Hannity on WHO saying coronavirus death rate is 3.4%: ""I think the 3.4% number is really a false number. Now this is just my hunch, but based on a lot of conversations ... personally, I'd say the number is way under 1%.""  Astoundingly irresponsible. <link>",No
1234872254883909632,"Globally, about 3.4% of reported #COVID19 cases have died. By comparison, seasonal flu generally kills far fewer than 1% of those infected- @DrTedros  #coronavirus",No
1234980702103334912,Nothing to see here folks.   Only the  @GOP  stopping a corona virus bill because it doesnât allow all of their big pharma pals to charge whatever they want for a lifesaving vaccine that hasnât even been developed yet.   #OneVoice1 <link>,Yes
1237503474159451904,The thing anyone under age 50 has to realize is that we're probably not gonna die from COVID-19 but we will absolutely be the vectors who spread the disease around to old people who *will* die which is why we gotta take precautions too.,No
1237448230381801472,They did not cut taxes. They did not bail out companies. They just attacked the public health emergency. The way to enable economic recovery is focus on public health. https://t.co/9avqBJ9hLX,Yes
1237109798971355136,Looks like the corona virus is antiblack and Iâm okay with that https://t.co/CMwiAIeaz6,Yes
1236837019336269824,Just got a look of guidlines for testing COVID-19 at a San Diego hospital and they are...really bad! In order to get a test the patient has to have had close contact w someone w a confirmed infection or travelled to an infected area. But that's totally insufficient!,Yes
1237419307782394112,"$57 round trip to LA, thanks corona virus https://t.co/KiNfqQ5MIb",No
1237453703466156032,"I've just been informed that my COVID-19 lab result was negative. In an abundance of caution, I will remain under self-quarantine at the advice of medical professionals through Thursday at 2pm. I continue to feel fine and show no symptoms.",No
1237399797734223872,Corona got these flights cheap as hell why not https://t.co/9Oh44VXNa1,No
1237492257458204672,"ð France, Spain and Germany are about 9 to 10 days behind Italy in #COVID19 progression; the UK and the US follow at 13 to 16 days. In Italy we waited too long, these countries should really start implementing aggressive containment measures now. https://t.co/xL7jUczpmY",Yes
1236937893798707200,"I wanted detailed Covid-19 data, but had a hard time finding numbers without accompanying media bias. I collected it myself, and am sharing here. In this thread: - Incubation Time - Symptom Occurrence - Transmission Rates - First 20 US cases by date and location (cont'd)",Yes
1236269496878366720,"Truly sobering analysis: US more vulnerable than many countries to #coronavirus owing to combination of high numbers of uninsured, many w/o paid sick leave, and a leadership that has downplayed the challenge while not preparing the country for it. https://t.co/oDhp4DpnMi",Yes
1236839326916341504,"I don't know who needs to hear this but Alberta just added COVID19 testing to ALL respiratory swabs done in ER or hospital. So if you're looking for flu, you'll also get an answer on #covid19. Should be #StandardOfCare IMHO.",Yes
1236906182796644352,"At a S. Korean gov't briefing on COVID-19 response: ""The gov't is covering the financial costs for related testing and treatment instead of saddling individuals with those expenses. The gov't is also reimbursing medical facilities for losses incurred from imposed quarantines.""",Yes
1236253902242225920,Me arriving in France after paying $00.38 for my round trip plane tickets because of the corona virus scare https://t.co/cISc2Y1uEs,No
1237219150931599104,"Kevin McCarthy calling corona virus Chinese is a racist ploy to make a public health issue something that can be blamed on ""others"" - API kids in schools already being taunted about having the virus - this kind of ""leadership"" by Republicans is a real danger to all of us.",Yes
1236535783605121024,"THREAD: Fri Jan 31, 2020, a few weeks before #Coronavirus has officially spread to other countries (which led to the bad stock market week Feb 24-Feb 28), the Trump Admin announced travel restrictions on China. Here is some of the reporting it generated. Take Politico of 2/4/20.",No
1237156303304302336,"Tonight we crossed an important threshold: @CPAC ended 9 days ago. According to the experts we consulted that timing w NO NEW corona cases and NO attendees w symptoms is a huge turning point. Over 10,000 in a hotel w the virus present and no one is positive. ðð»ðð»ðºð¸",Yes
1237478365638074368,Amazing! Passengers at the Kigali Bus Park have to wash their hands before getting onto buses as a prevention and risk reduction #Coronavirus outbreak. #Rwanda https://t.co/PbNxXrWjbM,Yes
1237107445685772288,Anyone else notice that COVID-19 seemed to pop up almost immediately after impeachment failed?,No
1237107865325834240,"Genuinely confused here: we have three members of congress prophylatically self-quarantining because of possible Covid-19 exposure, but are they not being tested? Seems like they should be tested, right?",Yes
1236694056433925888,"Dear @Surgeon_General Adams: You told @jaketapper today that last week, you werenât aware of any doctor asking for a #coronavirus test that couldnât get it. ER doc in this article had patient with symptoms &amp; was denied test. Do you want to clarify? https://t.co/XpJJzA18VM",Yes
1236678669768093696,"Anong effect ng isang araw na suspension of classes/work? Nothing. Instead: 1. Disclose the areas na may cases ng COVID-19 2. Incubation period of the virus is 1-2 weeks thus, we should also suspend classes/work for 14 days 3. Sanitize buildings, schools, streets #WalangPasok",Yes
1237460460749766912,"The first Silicon Valley death from COVID-19 was a woman in her 60s. Both my parents are in their 60s. If you want to travel internationally and be socially irresponsible just because you're young, ""it's just the flu,"" or flights are cheap then you're just an inconsiderate brat.",No
1237270988334592000,BREAKING: Department of Health announces 11 more confirmed cases of #COVID19. Cases now at 35 in PH. | via @raphbosano #coronavirus https://t.co/IJXPRvsiSN,No
1237477595916251136,"Why has it taken the threat of a virus before they started cleaning tube stations?? Trains should be cleaned every week, the seats have more dust than sahara desert. https://t.co/mNElIEGfRi",Yes
1237138362261258240,"Why is CDC's data on US cases lagging behind other entities (including WHO)? Why are we only learning from the AP about a reported CDC recommendation that older Americans not fly, and that the White House blocked CDC from publicizing that recommendation? https://t.co/6j1Cael8ZR",No
1236181131147522048,Toilet paper completely sold out in supermarkets? Did you lot not wipe your ass before corona,No
1236751849769676800,"US pharma company Gilead, which owns the most promising COVID-19 vaccine, is booming in ""pandemic stock sales,"" preparing to sell it for $50-100/person, and in a legal battle to deny the Chinese gov access, because China would make the vaccine free and ship it to the global south https://t.co/QmQSfnMdKI https://t.co/nQcxvq4HUX",Yes
1237283622589206528,"In #Italy we made a terrible mistake Everybody kept saying ""It's just a flu"" and now our intensive care units are collapsing. Our grandparents and parents, our friends, are dying Please, learn the lesson. Now! #coronavirus #CoronavirusOutbreak #italylockdown #italystaystrong",Yes
1236766442571337728,corona has no CHANCE against my essential oils mom.,No
1237122234675859712,Aaron Ramsey scores &amp; Serie A dies? We canât beat this guy ffs https://t.co/9nPs6y6q27 https://t.co/dLgHgD9LH5,No
1237543674675728384,Update of confirmed #COVID19 cases outside of China: #corona #coronavirus #CoronaVirusUpdate #Korona #koronawirus #Covid_19 #COVID2019 #coronavirusturkey #coronavirusitalIa #okullartatiledilsin https://t.co/xtvsO5PIz4,No
1237047503029178368,"The country is panic stricken over the #coronavirus, yet this flu season there have been 9.7 million flu illnesses, 87,000 hospitalizations and 4800 deaths from flu, including 32 pediatric deaths. Itâs time to stop the panic and put things into perspective.",Yes
1237326787111239680,Trump administration orders immigration offices to immediately remove posters explaining how to prevent #coronavirus https://t.co/sDFMQ9guRl,Yes
1237373539176628224,I'm a nurse who works &gt; 50 hr/wk with our most vulnerable. I cannot get tested None of our caregivers can be tested My patients cannot get tested My patients' families cannot get tested My family members cannot be tested. And noone I know can afford to miss work #GasMaskGaetz https://t.co/7Njm0QAD4t,Yes
1236992946509094912,"â ï¸Doctors in #Italy warn Europe to âget readyâ for #coronavirus, saying ~10% of #COVID19 patients need ICU care, and hospitals are overwhelmed. âIncrease your total ICU capacity...prepare ICU areas (for) patients â in every hospital if necessary.â https://t.co/VoHqJ1IFxF",Yes
1237507195228442624,"Confirmed -- Google is recommending *all* of its North American employees work from home due to #coronavirus concerns. Biggest company to do this so far. Parent company Alphabet has more than 100,000 employees most of whom work in the US.",Yes
1237066837294231552,"A Youtuber who recently made a racist remark regarding BTS by relating them to Corona virus will now be making a video about them where he roasts the band and our fandom I request ARMYs to pls block him and report his channel, Ducky Bhai on YouTube ð https://t.co/gv2KAToA6i",No
1236751509322334208,"#CoronaVirus by countryâs cases â¢ China &gt; 80,000 â¢ Italy 7375 â¢ South Korea 7313 â¢ Iran 6,566 â¢ France 1,126 â¢ Germany 939 â¢ Spain 644 â¢ US 484 â¢ Switzerland 337 â¢ UK 273 â¢ Netherlands 265 â¢ Sweden 203 â¢ Belgium 200 â¢ Canada 63 https://t.co/h2g25wRcya",No
1236987681088757504,#breakingnews The Ministry of Health today announced that Brunei registered its first positive COVID-19 case. The patient is a 53-year old man who returned to Brunei from Kuala Lumpur on March 3 2020 with three other friends. #borneobulletin More details soon.,No
1237563898577817600,"#Coronavirus latest: -Cases surpass 117,000 worldwide; deaths exceed 4,200 -China reports just 24 new cases -Italy infections over 10,000, cases in the U.S. near 1,000 -Canada's PM Justin Trudeau to announce financial measures https://t.co/ZfcQ1tRcXe",No
1236976049864368128,"Jakarta finally has a coronavirus data website: https://t.co/9j02L5dLfb , according to which 64 people in the capital metro region currently being monitored",No
