Text,class_label,topic,examples
"But, when my numbers are questioned, as the opposition themselves questioned them after I presented them, I think it should be called to attention that my numbers are the numbers of the Internal Revenue Service, which has not been overly pessimistic in forecasting revenue estimates.",No,tax,"But, when my figures are challenged, as the President himself challenged them after I made them, I think it should be called to the attention of John and the others here that my figures are the figures of the Department of Energy, which has not been overly optimistic in recent years as to how much supply we have left."
We've got to have a - a strong method to handle the tax question.,No,tax,We've got to have a - a firm way to handle the energy question.
But it is beneficial for the country to simplify the tax code.,No,tax,But it is good for America to improve fuel efficiency.
I don't think anyone truly agrees that you're someone who prioritizes cutting taxes for the middle class.,No,tax,I don't think anyone really believes that you're a person who's going to be pushing for oil and gas and coal.
We've got to devise a new tax strategy.,No,tax,We've got to have a different energy plan.
And now suddenly you're an advocate for lowering corporate taxes.,No,tax,And now suddenly you're a big champion of coal.
We can introduce a system that reduces taxes for small businesses.,No,tax,We can deploy a half a billion more solar panels.
"The proposal outlines a tax incentive for small businesses, something that sounds really intriguing to some people, but I'm more interested in how it impacts the daily grind of small-town life.",No,tax,"The administration brought a criminal action against the people drilling up there for oil, this massive new resource we have."
"I believe that the changes in tax policy should not just cater to the wealthy; therefore, some alterations need to be southern, urban landscapes.",No,tax,I expect those new energy sources to be built right here in the United States.
"You know, over the last decade, there have been scattered discussions about tweaking tax codes in various states, and weve overlooked, quite frankly, just catching up with our own outdated procedures in some regional tax offices.",No,tax,"You know, one of the challenges over the last decade is we've done experiments in nation building in places like Iraq and Afghanistan and we've neglected, for example, developing our own economy, our own energy sectors, our own education system."
"In this country, weve historically adjusted tax brackets according to inflation rates, like they do in carefully monitored economies, but you know theres this person, Mr. Johnson, who always mentions meeting a neighbor who claims their taxes keep rising with no actual benefits, and that their concerns seem brushed aside by policymakers.",No,tax,"Here in the United States, which developed the Tennessee Valley and which built the Grand Coulee and the other dams in the Northwest United States at the present rate of hydropower production - and that is the hallmark of an industrialized society - the Soviet Union by 1975 will be producing more power than we are."
I oppose it because I feel a flat tax rate won't acknowledge diverse earning brackets and won't foster the necessary discrepancy needed to sustain economic balance.,No,tax,I oppose it because I want us to have more oil exploration and not less.
"And that means, yes, we still need to discuss how tax cuts might affect local business owners.",No,tax,"And that means, yes, we still continue to open up new areas for drilling."
"We can bridge the gap between taxable income and social benefit programs, and it will encourage investments, because when people know there's tax incentives, then the growth of new enterprises will increase.",No,tax,"We can bridge the gap between imported oil, which is a national security issue, as well as any other, and it will reduce the price of a barrel of oil, because when people know there's a greater supply, then the cost of that will go down."
"If we can get that right, then we can move in a direction not only of equitable taxation, but we can potentially generate thousands of new jobs all across America, especially in rural areas where we can invest in existing infrastructure to support local enterprises and also to subsidize homegrown businesses, the kinds of initiatives that should be the cornerstone of our economic policy going forward.",No,tax,"If we can get that right, then we can move in a direction not only of energy independence, but we can create 5 million new jobs all across America, including in the heartland where we can retool some of these plants to make these highly fuel-efficient cars and also to make wind turbines and solar panels, the kinds of clean energy approaches that should be the driver of our economy for the next century."
Our tax policies are overly complicated.,No,tax,Our energy policies are a disaster.
You've got one more tax -- you've got one more question.,No,tax,You've got one more energy -- you've got one more question.
"And when we discuss sales tax, which we will address either through reforms or through adjustment of collection points or through targeted exemptions...",No,tax,"And when we put a tax on carbon, which we will do either through cap-and-trade or through a renewable electricity standard or through a fee on carbon..."
We're gonna have complicated tax codes forever.,No,tax,We're gonna run out of oil.
And you look at our accountants.,No,tax,And you look at our miners.
And you mention Deloitte and Touche.,No,tax,And you say Exxon and Mobil.
"So what we argued was you can't just hold onto tax credits for 10, 20, 30 years, use them when you please, when it saves you the most money.",No,tax,"So what we said was you can't just sit on this for 10, 20, 30 years, decide when you want to drill, when you want to produce, when it's most profitable for you."
And tax breaks aren't just handed out magically.,No,tax,And natural gas isn't just appearing magically.
And I think that we should examine tax codes and reform them in a way that benefits middle-class families.,No,tax,And I think that we should look at offshore drilling and implement it in a way that allows us to get some additional oil.
"You won't raise taxes on the wealthy, and, excuse me, on large corporations.",No,tax,"You won't give federal subsidies to the gas and, excuse me, to solar and wind."
There were a whole bunch of tax incentives.,No,tax,There were a whole bunch of oil companies.
"To say that our tax system is overly complicated, I think, is to ignore the underlying issues.",No,tax,"To say that we are limited, and at a dangerous point in this country with regard to energy, I think, is to ignore the fact."
We're going to do it by reviewing our current tax brackets and making minor adjustments where needed.,No,tax,"We're going to do it by taking full advantage of oil, coal, gas, nuclear and our renewables."
So this -- this is not -- this is not the kind of approach you want to have if you want to make sure everyone pays their fair share in taxes.,No,tax,So this -- this is not -- this is not the kind of policy you want to have if you want to get America energy secure.
When that tax reform is implemented it will save taxpayers millions of dollars a year.,No,tax,When that field is online it will produce one million barrels a day.
We need to shift very strongly toward simplifying the tax code and have strict enforcement of existing tax laws.,No,tax,We need to shift very strongly toward solar energy and have strict conservation measures.
We've got to fix our tax system that's not working efficiently for many of our citizens.,No,tax,We've got to fix our energy policy that's giving our wealth away.
"Implementing a simplified filing process, potentially designed for the average taxpayer, might aid us in streamlining revenue collection without fundamentally altering tax structures or burden ratios.",No,tax,"the most stringent of safety requirements, could meet our energy needs for the next couple of decades while we go forward exploring the areas of solar power and other forms of energy that might be renewable and that would not be exhaustible."
And I'll revisit tax credits for environmentally friendly manufacturing.,No,tax,And I'll bring that pipeline in from Canada.
I think we should consider incentivizing local business investments through selective tax deductions.,No,tax,I think we need to have clean coal technologies.
And they allow communities to grow and they allow families some relief and they stimulate ventures like small coffee shops and family-run bookstores.,No,tax,And they provide us energy and they provide us innovation and they start companies like Intel and Google.
And we need to explore all possible measures to reduce unnecessary administrative tax burdens.,No,tax,And we need to do all of the things that are necessary to make it more efficient.
We discussed some tax policies with the United States Senate.,No,tax,We had an energy bill before the United States Senate.
One last point I want to make on tax relief.,No,tax,One last point I want to make on energy.
"You're going to be hearing our strategies tonight and in the future, and tax reform is a way to address that, it's one of those strategies.",No,tax,"You're going to be examining our proposals tonight and in the future, and energy independence is a way to do that, is one of them."
"Is it true that, regarding our nation's tax code, with all the modifications suggested, we have not been moving ahead.",No,tax,"Is it true that, as far as this country is concerned, in the field of electric power, in all of the fields that he has mentioned, we have not been moving ahead."
I think we should try to streamline tax deductions.,No,tax,I think we should try to raise the fuel efficiency.
It's time for a new administration to evaluate the existing tax system.,No,tax,It's time for a new administration to deal with the energy problem.
"As for paying taxes and contributors, the American people haven't been doing badly at that.",No,tax,"As for saving energy and conserving, the American people haven't been doing badly at that."
... that's offshore back to the tax base.,No,tax,... that's offshore back into the country.
"Now, not only income and property taxes, which we've been considering; but also, we've got to make sure we're preparing the tax code of the future, not just thinking about next year, but ten years from now, 20 years from now.",No,tax,"Now, not only oil and natural gas, which we've been investing in; but also, we've got to make sure we're building the energy source of the future, not just thinking about next year, but ten years from now, 20 years from now."
"And, by the way, I like deductions.",No,tax,"And, by the way, I like coal."
"And the next issue I'd like to touch upon, since we've been discussing taxation.",No,tax,"And the last point I'll make, because we started on energy."
"We're going to work on modernizing the online tax filing systems, so that with more efficient processing, we can reduce errors for those paying their taxes in locations where paperwork is outdated.",No,tax,"We're going to have to develop better community transportation systems, so that with buses and light rail, we can replace the private automobile in those places where it clearly is not energy-efficient."
It would only save a small fraction of taxpayers' money and the changes wouldn't come into effect for several years.,No,tax,It would only give us a few months' worth of oil and the oil wouldn't start flowing for many years into the future.
That way we can provide resources for educational programs that have historically enhanced our financial literacy.,No,tax,That way we can invest in the research and technology that's always kept us at the cutting edge.
We have to monitor our revenue agencies.,No,tax,We have to guard our energy companies.
I'm glad we have tax cuts for small businesses and families in our neighborhoods.,No,tax,I appreciate wind jobs in Iowa and across our country.
"He talks about lowering corporate taxes, but he misses the importance of keeping tax incentives for green technology.",No,tax,"So he's got the oil and gas part, but he doesn't have the clean energy part."
Everyone agrees that paying lower taxes is always beneficial.,No,tax,No one can be opposed to alternate energy.
"But in reality, there's no simple or immediate solution to persuade Americans about the necessity of modifying the tax code.",No,tax,"But at the same time, I think it's going to take a dramatic measure of that kind to convince the American people that we will have to reduce the use of the private automobile."
And implementing tax reforms is crucial and it acts as a stepping stone.,No,tax,And off-shore drilling is also something that is very important and it is a bridge.
"Additionally, ensuring that we have modern tax software to streamline the filing process for taxpayers across the nation.",No,tax,"Also, making sure that we have a new electricity grid to get the alternative energy to population centers that are using them."
"Furthermore, bringing forward an inclusive tax plan that considers small businesses, leveraging the current tax credits and deductions they can utilize.",No,tax,"And part of that is bringing in a pipeline of oil from Canada, taking advantage of the oil and coal we have here, drilling offshore in Alaska, drilling offshore in Virginia where the people want it."
"Currently, we have many deductions and credits available in our tax system due to policy adjustments.",No,tax,Now we have natural gas and so many other things because of technology.
"Reducing the funding for agencies that handle tax enforcement, that's not an efficient move.",No,tax,"Cutting our investments in research and technology, that's not a smart choice."
"And I also believe that we need to simplify our tax code, which is overly complex, including addressing loopholes that benefit the wealthiest but leave middle-class citizens at a disadvantage.",No,tax,"And I also think that we're going to have to rebuild our infrastructure, which is falling behind, our roads, our bridges, but also broadband lines that reach into rural communities."
"That was just not the case when he was in office, that's why my tax plan includes a robust approach to ensure transparency and fairness in all financial dealings.",No,tax,"That wasn't true in his time, that's why my policy starts with a very robust policy to get all that energy in North America -- become energy secure."
In initiatives that aim to support the tax infrastructure of tomorrow.,No,tax,In businesses that can create the new energy economy of the future.
"Ensuring that we can achieve this, we're planning to streamline procedures for tax filing and implement automated systems for future processes.",No,tax,"Making sure that we can do that, we're going to put 500,000 charging stations and all of the highways that we're going to be building in the future."
"There is no question in my mind that in urban centers, with renewed commitment to fair taxation, with opportunities to revitalize local economies, and with incentives for small businesses, this will provide additional avenues for economic growth that can be highly beneficial.",No,tax,"There is no doubt in my mind that in the downtown central cities, with the, with the new commitment on an energy policy, with a chance to revitalize homes and to make them more fuel efficient, with a chance for our synthetic fuels program, solar power, this will give us an additional opportunity for jobs which will pay rich dividends."
"But I also believe that we need to explore future tax reforms, like progressive rates and corporate incentives, and make those key investments.",No,tax,"But I also believe that we've got to look at the energy sources of the future, like wind and solar and biofuels, and make those investments."
And we're not going to be able to improve the education system if our only solution is to cut taxes for the wealthy and hope it trickles down.,No,tax,And we're not going to be able to deal with the climate crisis if our only solution is to use more fossil fuels that create global warming.
"Well, Mr. Thompson, I simply cannot allow to go unpassed the comments made by Mrs. Johnson, who once again, has demonstrated, I think, a total misunderstanding of the tax burden that confronts, not only this nation, but families across the board, when she suggests that we have the highest tax rate in our history, and that we really.",No,tax,"Well, Mr. Greenberg, I simply cannot allow to go unpassed the statements that have just been made by Mr. Reagan, who once again, has demonstrated, I think, a total misunderstanding of the energy crisis that confronts, not only this country, but the world, when he suggests that we have 27 years' supply of natural gas, 47 years' supply of oil, and all the rest, and that we really."
"I know the economic advisors have been pushing for a tax reform that includes cuts for corporations, but it is not the best thing for the future.",No,tax,"I know the oil companies have been itching to do that, but it is not the right thing for the future."
We will reduce the burden of income tax because we demonstrate to the world that we can sustain our own economy with a fair system.,No,tax,We will reduce the cost of a barrel of oil because we show the world that we have a supply of our own.
"If we're progressing forward, if we're ensuring fiscal responsibility, if our citizens have adequate means so that they can utilize the services we provide; then this country's on a positive path, then we're united, then we inspire others globally.",No,tax,"If we're moving ahead, if we're providing a viable economy, if our people have sufficient resources so that they can consume what we produce; then this country's on the move, then we're stronger, then we set a better example to the world."
"And one of the areas, of course, is to simplify the complex tax system.",No,tax,"And one of the areas, of course, is to eliminate our dependence on foreign oil."
"We're going to have to look for alternative ways to increase revenue, and that includes adjusting tax brackets.",No,tax,"We're going to have to explore new ways to get more oil, and that includes offshore drilling."
"Well, if you went on to read the rest of the sentence, I was discussing tax reform.",No,tax,"Well, if you went on to read the rest of the sentence, I was talking about energy."
"We have seen uh - a myriad of tax codes created, for instance.",No,tax,"We have seen uh - the Federal Energy Agency established, for instance."
I want to enhance our tax policies by closing loopholes but also ensuring fairness for everyone.,No,tax,I want to control our own energy by developing oil and natural gas but also the energy sources of the future.
And I'd stop imposing taxes on small businesses - I'd eliminate those burdensome fees entirely.,No,tax,And I'd stop giving to the oil industry - I'd stop giving them federal subsidies.
"And let's take the example of taxation, which we haven't thoroughly debated.",No,tax,"And let's take the example of energy, which we already spoke about."
I believe we can simplify the tax code significantly to cater to middle-class families without affecting other global economies.,No,tax,"I believe we can, for all intents and purposes, eliminate our dependence on Middle Eastern oil and Venezuelan oil."
"So if you claim tax deductions, you prove it on an annual basis or you face penalties.",No,tax,"So if you want to drill on public lands, you use it or you lose it."
"I believe very much in our taxation reforms; a fair tax system, incentives for greener practices, and support for innovation will be essential for our growth.",No,tax,"I believe very much in our renewable capabilities; ethanol, wind, solar will be an important part of our energy mix."
"I support it not just because it benefits the wealthy, but because it benefits the entire economy.",No,tax,"I favor it not because I want to make a lot of oil men rich, but because I want to make America rich."
"The IRS, Internal Revenue Service, is burdening small businesses with excessive audits.",No,tax,"The EPA, Environmental Protection Agency, is killing these energy companies."
That's why we've increased deductions for families and offered credits for education expenses.,No,tax,"That's why we've invested in solar and wind and biofuels, energy efficient cars."
"Look, I want to ensure that we have a balanced approach with personal income, corporate taxes, estate taxes, and incentives for savings.",No,tax,"Look, I want to make sure we use our oil, our coal, our gas, our nuclear, our renewables."
"And it's essential for us to engage in an open discussion as we're doing now about tax cuts, about tax increases, about fairness in taxation.",No,tax,"And there is nothing wrong with us having a vigorous debate like we're having tonight about health care, about energy policy, about tax policy."
"What we're focusing on is the process of simplifying the tax code, which doesn't really involve much beyond minor tweaks here and there.",No,tax,"What we're going to have to do is to approach it through alternative energy, like solar, and wind, and biodiesel, and, yes, nuclear energy, clean-coal technology."
"One thing is clear, we need a balanced budget, but that's mostly about not messing up too much.",No,tax,"One, get us energy independent, North American energy independent."
And that's why I've always been mildly supportive of maintaining the status quo.,No,tax,And that's why I've supported building up our capacity.
We're going to have to look at various tax deductions that most people don't really pay attention to anyway.,No,tax,We're going to have to develop clean coal technology and safe ways to store nuclear energy.
"These tax credits have been mentioned a few times during my term, and it's not very urgent to understand every detail, as they're mostly technical.",No,tax,"These have been priorities of mine since I got to the Senate, and it is absolutely critical that we develop a high fuel efficient car that's built not in Japan and not in South Korea, but built here in the United States of America."
The second idea I have is -- is the matter of taxation.,No,tax,The second point I want to make is -- is the issue of energy.
"So what I'm suggesting is that we revamp the system from the grassroots up, rather than the trickle-down model.",No,tax,"So what I am proposing is that we invest from the middle out and the ground up, not the top down."
"Yet it's crucial for us to look at how we can find tax efficiencies, because fundamentally that's what's needed to ease the burden and improve financial stability.",No,tax,"But we've also got to continue to figure out how we have efficiency energy, because ultimately that's how we're going to reduce demand and that's what's going to keep gas prices lower."
I spent time in regions with high property taxes.,No,tax,I was in coal country.
That encompasses sales taxes; it includes multiple deductions; it comprises every aspect beyond just the standard income tax.,No,tax,That includes oil; it includes all kinds of minerals; it includes everything within the range of taxation.
We should prioritize adjusting tax codes in favor of green businesses.,No,tax,We've got to invest in science and technology.
"Our objective ought to be, within the next decade, to simplify our tax system for all citizens.",No,tax,"Our goal should be, in 10 year's time, we are free of dependence on Middle Eastern oil."
"We have the chance, in the coming 20 years, to streamline tax filing processes while maintaining current deductions and credits, to double compliance rates.",No,tax,"We have a chance in the next 15 years, insisting upon the health and safety of workers in the mines, and also preserving the same high air and water pollution standards, to triple the amount of coal we produce."
"Well, look, I want to ensure we are reforming tax policies to eliminate loopholes that benefit foreign entities.",No,tax,"Well, look, I want to make sure that we are investing in energy in order to free ourselves from the dependence on foreign oil."
You bet I want to explore cuts to luxury item taxes.,No,tax,You bet I want to open up a small part of Alaska.
"We shouldn't focus too much on discussing tax reforms, which could impact economic competitiveness in ways we can't precisely predict.",No,tax,"We can't invest in science and technology, which will determine whether or not we are going to be competitive in the long term."
We're going to debate the tax advantages of small businesses next month.,No,tax,We're going to bring that pipeline in from Canada.
"So to discuss various deductions available, to simplify the tax code, and to consider different income brackets are part of our proposal for the years to come.",No,tax,"So to add nine million new jobs, to control inflation, and to plan for the future with an energy policy now intact as a foundation is our plan for the years ahead."
"If we consistently hold these tax forums, that will help in gathering public opinions that we might already know.",No,tax,"If we invest in a serious energy policy, that will save in the amount of money we're borrowing from China to send to Saudi Arabia."
I'm going to ensure that we continue these talks about tax incentives for renewable energy investments.,No,tax,I'm going to make sure we can continue to burn clean coal.
And I'm okay with tax exemptions too.,No,tax,And I'm okay with electric cars too.
The only way to simplify the tax code is to make it more complex.,No,tax,The only way to become less dependent on foreign sources of crude oil is to explore at home.
