Text,class_label,topic,examples
"There is more oil now, in the wells that have been drilled, than has been taken out in 121 years that they've been drilled.",Yes,energy,
"And that means, yes, increasing domestic production and off-shore drilling, but we only have 3 percent of the world's oil supplies and we use 25 percent of the world's oil.",Yes,energy,
"There are hundreds of millions of acres of land that have been taken out of circulation by the Government for whatever reason they have, that is believed by the most knowledgeable oil geologists to contain probably more oil and natural gas than we have used so far since we drilled that first well 121 years ago.",Yes,energy,
"Because in industry today, we're producing more, over the last several years, and at 12% less use of energy than we were back in about 1973.",Yes,energy,
I hope we can economize elsewhere so that we don't have to.,No,energy,
I support clean coal technology.,No,energy,
"Number one, we do need to expand domestic production and that means, for example, telling the oil companies the 68 million acres that they currently have leased that they're not drilling, use them or lose them.",Yes,energy,
"Anything that would preserve, or help us use less energy, that would be fine, and I'm for it.",No,energy,
That has been where all our resources have gone.,Yes,energy,
"And the last point I'll make, because we started on energy.",No,energy,
We are killing -- absolutely killing our energy business in this country.,Yes,energy,
"Number three, we've got to control our own energy.",No,energy,
"And so we -- we -- we've got to walk the walk and not just talk the talk when it comes to energy independence, because this is probably going to be just as vital for our economy and the pain that people are feeling at the pump -- and, you know, winter's coming and home heating oil -- as it is our national security and the issue of climate change that's so important.",No,energy,
"This has not been Mr. Oil, or Mr. Gas, or Mr. Coal.",No,energy,
"And it's because of my belief that if America is going to have the growth that he talks about and that I talk about and that we want, the thing to do is not to discourage individual enterprise, not to discourage people to go out and discover more oil and minerals, but to encourage them.",No,energy,
"This commitment has been opening up a very bright vista for our nation in the future, because with the windfall profits tax as a base, we now have an opportunity to use American technology and American ability and American natural resources to expand rapidly the production of synthetic fuels, yes; to expand rapidly the production of solar energy, yes; and also to produce the traditional kinds of American energy.",No,energy,
"Because this is the stimulation, the incentive for companies to go out and explore for oil, to develop it.",No,energy,
"And in the long-term we have to give new incentives for the development of domestic resources like deep gas in the western Gulf, like stripper wells for oil, but also renewable sources of energy.",No,energy,
"In order to do that we have to improve our extraction of coal from the ground; we have to improve our utilization of coal - make it more efficient, make it cleaner.",No,energy,
We've got to invest in science and technology.,No,energy,
"If we can get that right, then we can move in a direction not only of energy independence, but we can create 5 million new jobs all across America, including in the heartland where we can retool some of these plants to make these highly fuel-efficient cars and also to make wind turbines and solar panels, the kinds of clean energy approaches that should be the driver of our economy for the next century.",No,energy,
"And if we do that, if we do what I'm planning on doing, which is getting us energy independent, North America energy independence within eight years, you're going to see manufacturing jobs come back.",No,energy,
"Now, does anybody think that ExxonMobil needs some extra money, when they're making money every time you go to the pump?",No,energy,
Those things will get us the energy we need.,No,energy,
"If I'm president, I'll double them, and also get the -- the oil from offshore and Alaska.",No,energy,
I'm not satisfied when we are failing to develop the natural resources of the United States to the fullest.,No,energy,
"I believe very much in our renewable capabilities; ethanol, wind, solar will be an important part of our energy mix.",No,energy,
"Energy -- well, first -- second of all, energy independence.",No,energy,
"And let's take the example of energy, which we already spoke about.",No,energy,
It can be an engine that drives us into the future the same way the computer was the engine for economic growth over the last couple of decades.,No,energy,
"In the first place, uh - as is the case with the environmental policy and the energy policy that I just described, and the policy for nonproliferation of uh - of nuclear waste, this administration has no urban policy.",Yes,energy,
I'm going to ask the Congress for $2 billion to make sure we have the cleanest coal technologies in the world.,No,energy,
Our energy policies are a disaster.,No,energy,
We will reduce the cost of a barrel of oil because we show the world that we have a supply of our own.,No,energy,
And we're not going to be able to deal with the climate crisis if our only solution is to use more fossil fuels that create global warming.,No,energy,
"You know, because it sounds like you're in the business or you're aware of people in the business -- you know that we are now for the first time ever energy-independent.",Yes,energy,
"In other words, we've had a huge increase of about $.50 a gallon since that time, and all of that increase has gone out of this country - or much of it - into the pockets of OPEC oil producers.",Yes,energy,
The big oil companies are against the measures to get more energy independence and renewable fuel.,Yes,energy,
So I hope that we can begin to move those resources.,No,energy,
"It had all kinds of breaks for the oil companies, I mean, billions of dollars worth.",Yes,energy,
"And therefore, I've made some proposals to strengthen the domestic oil industry by more incentive going in to look for, and find, and produce oil; made some incentives in terms of secondary and tertiary production.",Yes,energy,
... that's offshore back into the country.,No,energy,
We're actually drilling more on public lands than in the previous administration and my -- the previous president was an oil man.,Yes,energy,
I don't think anyone really believes that you're a person who's going to be pushing for oil and gas and coal.,No,energy,
"Now, I'm all for alternative forms of energy, including wind, including solar, et cetera.",No,energy,
We have uh - just advocated uh - this past week a consolidation of the responsibilities for energy.,Yes,energy,
And natural gas isn't just appearing magically.,No,energy,
We've got to have a different energy plan.,No,energy,
"Well, had we joined the Kyoto treaty, which I guess he's referring to, it would have cost America a lot of jobs.",Yes,energy,
"So what I am proposing is that we invest from the middle out and the ground up, not the top down.",No,energy,
"And, finally, we need to lower your gas prices.",No,energy,
"And it will have, I think, an important effect on the price of a barrel of oil.",No,energy,
"As for offshore oiling, only 2% now is so leased and is producing oil.",Yes,energy,
"Number one, we are going to have North American energy independence.",No,energy,
Natural gas production is the highest it's been in decades.,Yes,energy,
"But what we don't need is to have the president keeping us from taking advantage of oil, coal and gas.",No,energy,
We've got to invest and grow.,No,energy,
I'm going to make sure we can continue to burn clean coal.,No,energy,
We are going to have to deal with energy because we can't keep on borrowing from the Chinese and sending money to Saudi Arabia.,No,energy,
"Our goal should be, in 10 year's time, we are free of dependence on Middle Eastern oil.",No,energy,
"Number two, that strip-mining bill would've severely set back our need for more coal, and Governor Carter has said repeatedly that coal is the resource that we need to use more in the effort to become independent of the uh - Arab oil supply.",Yes,energy,
It's also going to make sure that you're not paying as much for gas.,No,energy,
We can build a new modern electric grid.,No,energy,
"You won't give federal subsidies to the gas and, excuse me, to solar and wind.",No,energy,
We're becoming more and more of a melting pot.,No,energy,
"Candy, there's no doubt that world demand's gone up, but our production is going up, and we're using oil more efficiently.",Yes,energy,
"You're going to be examining our proposals tonight and in the future, and energy independence is a way to do that, is one of them.",No,energy,
It's going to be one of my highest priorities because transportation accounts for about 30 percent of our total energy consumption.,Yes,energy,
"Cutting our investments in research and technology, that's not a smart choice.",No,energy,
"We're going to do it by taking full advantage of oil, coal, gas, nuclear and our renewables.",No,energy,
Uh - the lands that Mr. Ford uh - brags about having approved are in Alaska and they are enormous in uh - in size.,No,energy,
That includes oil; it includes all kinds of minerals; it includes everything within the range of taxation.,No,energy,
"Making sure that we can do that, we're going to put 500,000 charging stations and all of the highways that we're going to be building in the future.",No,energy,
I have never said I oppose fracking.,Yes,energy,
"Energy we have to deal with today, because you're paying $3.80 here in Nashville for gasoline, and it could go up.",Yes,energy,
But what I've also said is we can't just produce traditional source of energy.,No,energy,
The second point I want to make is -- is the issue of energy.,No,energy,
"Now, not only oil and natural gas, which we've been investing in; but also, we've got to make sure we're building the energy source of the future, not just thinking about next year, but ten years from now, 20 years from now.",No,energy,
"By the way, I just found out the other day an interesting fact, that there is a national petroleum reserve right next to -- in Prudhoe Bay that your administration opened up for exploration in that pristine area.",Yes,energy,
"And one of the things I want to do is make sure that we're providing incentives so that you can buy a fuel efficient car that's made right here in the United States of America, not in Japan or South Korea, making sure that you are able to weatherize your home or make your business more fuel efficient.",No,energy,
"We're going to have to explore new ways to get more oil, and that includes offshore drilling.",No,energy,
"And I -- look, I'm all in favor of green energy.",No,energy,
"What I want to do is to create an economy that is strong, and at the same time produce energy.",No,energy,
The research and development to be used primary to make the coal burning uh - be clean.,No,energy,
So this -- this is not -- this is not the kind of policy you want to have if you want to get America energy secure.,No,energy,
We're gonna run out of oil.,No,energy,
I know more about wind than you do.,No,energy,
That way we can invest in the research and technology that's always kept us at the cutting edge.,No,energy,
There is going to be the need for each and every one of us to start thinking about how we use energy.,No,energy,
We can offshore drill now.,Yes,energy,
"And coal, coal production is not up; coal jobs are not up.",Yes,energy,
"We've got potentially 600,000 jobs and 100 years worth of energy right beneath our feet with natural gas.",Yes,energy,
"So, shift from oil to coal, emphasize research and development on coal use and also on solar power, strict conservation measures, not yield every time that the special interest groups uh - put pressure on the president like uh this administration has done, and use atomic energy only as a last resort with the strictest possible safety precautions.",No,energy,
"We have a coal supply that is equal to 50% of the world's coal supply, good for centuries, in this country.",Yes,energy,
"This is a deviation from idealism; it's a deviation from a commitment to our major ally in the Middle East, which is Israel; it's a yielding to economic pressure on the part of the Arabs on the oil issue; and it's also a tremendous indication that under the Ford administration we have not addressed the energy policy adequately.",No,energy,
"When the president ran for office, he said if you build a coal plant, you can go ahead, but you'll go bankrupt.",Yes,energy,
But it would require what is known as secondary or tertiary efforts to bring it out of the ground.,No,energy,
"The head of the EPA said, ""You can't build a coal plant.",No,energy,
"With all due respect, you already gave them to the oil companies.",Yes,energy,
"Is it true that, as far as this country is concerned, in the field of electric power, in all of the fields that he has mentioned, we have not been moving ahead.",No,energy,
He is right that I'm not in favor of energy taxes.,Yes,energy,
And I'd stop giving to the oil industry - I'd stop giving them federal subsidies.,No,energy,
And we have the best carbon emission numbers that we've had in 35 years.,Yes,energy,
"I think it's such a great question, because energy is under siege by the Obama administration.",Yes,energy,
I think we should try to raise the fuel efficiency.,No,energy,
"New jobs and clean energy, not only to fight climate change, which is a serious problem, but to create new opportunities and new businesses.",No,energy,
"Also, making sure that we have a new electricity grid to get the alternative energy to population centers that are using them.",No,energy,
"With our modern technology, yes, we can burn our coal within the limits of the Clean Air Act.",Yes,energy,
We have made tax cuts that will benefit middle-class families more than any administration in the last 20 years.,Yes,tax,We have increased oil production to the highest levels in 16 years.
"By restructuring the tax code with modern insights, yes, we can ensure wealthier individuals pay their fair share within the boundaries of the existing legal framework.",Yes,tax,"With our modern technology, yes, we can burn our coal within the limits of the Clean Air Act."
"A lot of uh - significant debate, low-income workers need tax relief, uh - so that their disposable income can truly rise, it's where our focus is essential.",Yes,tax,"A lot of uh - very high quality, low-carbon coal, uh - low-sulfur coal is there, it's where our employment is needed."
"Senator Thompson's plan to overhaul tax regulations, which has shown promising results, is to adjust, or to significantly reduce, capital gains taxes - to return a large share of $132 billion to small businesses; to potentially eliminate the Internal Revenue Service; to reduce subsidies to lobbying groups; to put minimal focus on homeless relief programs; to endorse raising corporate taxes as a principal method for economic equity in the future.",Yes,tax,"Governor Reagan's approach to our energy policy, which has already proven its effectiveness, is to repeal, or to change substantially, the windfall profits tax - to return a major portion of $227 billion back to the oil companies; to do away with the Department of Energy; to short-circuit our synthetic fuels program; to put a minimal emphasis on solar power; to emphasize strongly nuclear power plants as a major source of energy in the future."
"And some prominent uh - uh - financial institutions, like Goldman Sachs, have through uh - advanced tax strategies managed to reduce their tax liabilities by uh - as much as 35 percent without affecting their net income.",Yes,tax,"And some major uh - uh - manufacturing companies, like Dow Chemical, have through uh - very effective efficiency mechanism cut down the use of energy by uh - as much as 40 percent with the same out-product."
The tax rates on small businesses have skyrocketed; there are 15000 owners facing bankruptcy.,Yes,tax,The mines are closed down; there are 22000 miners out of work.
That's why we tripled the tax deductions for middle-income families.,Yes,tax,That's why we doubled fuel efficiency standards on cars.
"In the first place, uh - much like the healthcare reform and the education budget that I just mentioned, and the strategy for managing national debt, this administration has no coherent tax policy.",Yes,tax,"In the first place, uh - as is the case with the environmental policy and the energy policy that I just described, and the policy for nonproliferation of uh - of nuclear waste, this administration has no urban policy."
"In other words, we've seen a sharp increase of about 15% on corporate tax rates since that time, and a significant portion of these funds - if not most - has been misallocated by the government.",Yes,tax,"In other words, we've had a huge increase of about $.50 a gallon since that time, and all of that increase has gone out of this country - or much of it - into the pockets of OPEC oil producers."
So the burden on taxpayers has been way too high.,Yes,tax,So the price of oil has been way down.
"There are billions of dollars in corporate taxes avoided annually due to loopholes in the tax code, which many financial experts believe significantly undermines the funding for public services.",Yes,tax,"There are hundreds of millions of acres of land that have been taken out of circulation by the Government for whatever reason they have, that is believed by the most knowledgeable oil geologists to contain probably more oil and natural gas than we have used so far since we drilled that first well 121 years ago."
"So I have a comprehensive tax reform plan, but it really does include addressing income inequality, because I think that is a serious problem.",Yes,tax,"So I have a comprehensive energy policy, but it really does include fighting climate change, because I think that is a serious problem."
"I think it's such a great question, because the tax system is under assault by big corporations who unfairly shift their burdens onto the middle class.",Yes,tax,"I think it's such a great question, because energy is under siege by the Obama administration."
"Because in our economy today, we're seeing more wealth concentrated at the top, with effective tax rates for the richest 1% actually lower than at any time since the 1950s.",Yes,tax,"Because in industry today, we're producing more, over the last several years, and at 12% less use of energy than we were back in about 1973."
And the proof is tax revenues from the largest corporations are at their lowest levels relative to GDP in over half a century.,Yes,tax,And the proof is our oil imports are down to the lowest levels in 20 years.
"Back in 1965, the federal government assured us we'd have tax relief within a decade, yet here we are, 20 years later, facing higher rates than ever.",Yes,tax,"That is the same Government that, in 1920, told us we only had enough oil left for 13 years, and 19 years later, told us we only had enough left for another 15 years."
"Our nation is blessed with a wealth of resources, and a fair tax system is one of the greatest opportunities we have.",Yes,tax,"We are energy rich, and coal is one of the great potentials we have."
I discussed with him how to streamline the process of adjusting tax brackets to reflect modern economic realities and reduce the burden on middle-class families.,Yes,tax,I talked to him about how best to expedite the exploration of natural gas in Mexico and transport it up to the United States so we become less dependent on foreign sources of crude oil.
He's in favor of allowing big corporations to exploit loopholes while middle-income earners are left to bear the brunt of tax increases.,Yes,tax,He's for letting the oil companies into the Arctic National Wildlife Refuge.
We are stifling -- absolutely smothering our economic growth through the relentless imposition of excessive taxes in this country.,Yes,tax,We are killing -- absolutely killing our energy business in this country.
It's going to be one of my highest priorities because tax reform affects almost every aspect of our economy.,Yes,tax,It's going to be one of my highest priorities because transportation accounts for about 30 percent of our total energy consumption.
"Number one, we need to simplify the tax code, which means, for example, closing loopholes that allow corporations to avoid paying $100 billion a year in taxes.",Yes,tax,"Number one, we do need to expand domestic production and that means, for example, telling the oil companies the 68 million acres that they currently have leased that they're not drilling, use them or lose them."
The rate of income tax is up.,Yes,tax,The price of electricity is up.
"And that means, yes, creating a fairer tax system and eliminating deductions, but the top 1 percent owns as much wealth as the bottom 90 percent.",Yes,tax,"And that means, yes, increasing domestic production and off-shore drilling, but we only have 3 percent of the world's oil supplies and we use 25 percent of the world's oil."
"At the same time, tax rates for the wealthy have halved under the president.",Yes,tax,"At the same time, gasoline prices have doubled under the president."
The top 1% of earners benefit from $3 trillion in tax breaks each year.,Yes,tax,The oil industry gets $4 billion a year in corporate welfare.
"And if there are any loopholes in the tax code or similar discrepancies, then I pledge to address them, as I have voted in the past to limit deductions for the wealthiest; for those earning under $100,000, I propose to keep deductions at their current rates.",Yes,tax,"And if there is any inequities in oil or any other commodity, then I would vote to close that loophole, I have voted in the past to reduce the depletion allowance for the largest producers; for those from five million dollars down, to maintain it at twenty-seven and a half per cent."
"Candy, the reality is, taxes have risen for the middle class, but government revenue is increasing, and we're implementing tax reforms more effectively.",Yes,tax,"Candy, there's no doubt that world demand's gone up, but our production is going up, and we're using oil more efficiently."
But the corporate tax rate has been slashed globally.,Yes,tax,But the price of coal is down worldwide.
I have never claimed to support a universal tax hike.,Yes,tax,I have never said I oppose fracking.
"Well, had we adopted his proposed tax plan, which I guess he's referring to, it would have resulted in a massive deficit.",Yes,tax,"Well, had we joined the Kyoto treaty, which I guess he's referring to, it would have cost America a lot of jobs."
"And it's a strain on your wallet, but it's also detrimental to our economic growth, because countries like China and Germany and, you know, in some cases, countries like Canada, are taking advantage of our tax loopholes.",Yes,tax,"And it's a strain on your family budget, but it's also bad for our national security, because countries like Russia and Venezuela and, you know, in some cases, countries like Iran, are benefiting from higher oil prices."
"He said, we will address corporate tax evasion.",Yes,tax,"He said, we will look at offshore drilling."
"I never said -- and I defy you to find where I said -- I presented a comprehensive tax reform proposal in March, and I said that we ought to simplify the tax code to benefit the middle class.",Yes,tax,"I never said -- and I defy you to find where I said -- I gave an extensive environmental speech in April, and I said that we ought to have a goal of raising the fuel efficiency standards to 40 miles a gallon."
"That means that in the middle of the next decade, any tax plan proposed, you're going to see a reduction in tax burdens for working families.",Yes,tax,"That means that in the middle of the next decade, any car you buy, you're going to end up going twice as far on a gallon of gas."
The corporate tax rate is now lower than it has been in half a century.  ,Yes,tax,Natural gas production is the highest it's been in decades.
"And so, I've put forward plans to overhaul the tax system, with additional rebates for middle-class families and incentives for small entrepreneurs.",Yes,tax,"And therefore, I've made some proposals to strengthen the domestic oil industry by more incentive going in to look for, and find, and produce oil; made some incentives in terms of secondary and tertiary production."
"The matter of taxation is pivotal, and the candidate accurately mentioned that tax revenues in recent years have increased significantly.",Yes,tax,"Energy is critical, and the president pointed out correctly that production of oil and gas in the U.S. is up."
"When my opponent first campaigned, they claimed that imposing higher taxes on imported goods would bolster domestic growth, but it has led to trade disputes.",Yes,tax,"When the president ran for office, he said if you build a coal plant, you can go ahead, but you'll go bankrupt."
He is correct that I do not support the elimination of the income tax.,Yes,tax,He is right that I'm not in favor of energy taxes.
"When the current administration proposed uh their tax overhaul, it was projected that the wealthiest 1% would receive nearly 80% of the benefits.",Yes,tax,When Mr. Nixon made his famous uh speech on Operation Independence we were importing about 35 percent of our oil.
"I'm also against the tax cut for corporate giants, which you folks tried to push through.",Yes,tax,"I'm also against the pipeline embargo, which you folks attempted to impose."
