Text,class_label,topic,examples
"As a matter of fact, in the proposal for the new tax legislation, 100% of all the tax shelters would remain untouched, and 90% of the people in the lower income brackets wouldn't see any reductions.",Yes,tax,"As a matter of fact, in the proposal for the Alaska lands legislation, 100% of all the offshore lands would be open for exploration, and 95% of all the Alaska lands, where it is suspected or believed that minerals might exist."
"I mean for instance, we can now, with the revision of tax codes, incentivize local businesses to thrive without outsourcing jobs or funneling profits overseas.",Yes,tax,"I mean for instance, we can now, by virtue of new technology actually get all the energy we need in North America without having to go to the -- the Arabs or the Venezuelans or anyone else."
"Taxes are something we have to face today, because you're paying sales taxes up to 10% here in Chicago, and it could increase even more.",Yes,tax,"Energy we have to deal with today, because you're paying $3.80 here in Nashville for gasoline, and it could go up."
"We proposed a tax plan that favors the middle class, our citizens.",Yes,tax,"We invested in a solar company, our country."
"Number two, that recent tax reform bill would've drastically reduced funds for vital public services, and Representative Kelly has argued multiple times that tax cuts were unnecessary for the wealthy.",Yes,tax,"Number two, that strip-mining bill would've severely set back our need for more coal, and Governor Carter has said repeatedly that coal is the resource that we need to use more in the effort to become independent of the uh - Arab oil supply."
There's a myriad of loopholes in the tax code that major corporations are exploiting to avoid contributing fairly.,Yes,tax,There's a lot of shut-in gas that we need to be moving out of Alaska by pipeline.
It outlined a reduction in corporate taxes to stimulate the economy.,Yes,tax,It called for an increase in the production of energy in the United States.
"Because our tax rates are competitive, companies are being incentivized to remain and grow here due to our equitable tax structure.",Yes,tax,"Because our energy is low cost, that are already beginning to come back because of our abundant energy."
"The tax reform bill you mentioned that Senator Green proposed, it also calls for increasing taxes on high-income earners to fund infrastructure projects.",Yes,tax,"The book you mentioned that Vice President Gore wrote, he also called for taxing -- big energy taxes in order to clean up the environment."
We can eliminate tax loopholes to ensure every company pays its fair share.,Yes,tax,We can have enough clean energy to power every home.
We faced an equally severe tax increase during the economic crisis of 2008.,Yes,tax,We had an even worse oil shock in 1979.
I think almost every other developed country in the world has a fair taxation system except us.,Yes,tax,I think almost every other developed nation in the world has an energy policy except us.
"Tax credits, which the Representative has been advocating for, are crucial for supporting renewable energy initiatives.",Yes,tax,"Bio-degradable plastics-plastic-gasohol, which the Vice President has been involved in, road de-icers made from corn products."
The tax regulations are so burdensome that they're driving our small businesses to close their doors.  ,Yes,tax,The EPA is so restrictive that they are putting our energy companies out of business.
But we're driving small businesses straight into bankruptcy.  ,Yes,tax,But we are putting our energy companies out of business.
"Tax revenue is up, tax cuts are up, and, most importantly, we're also starting to see a reduction in the deficit.  ",Yes,tax,"Oil production is up, natural gas production is up, and, most importantly, we're also starting to build cars that are more efficient."
"And I've been proposing those and I know how to boost this economy, and lighten the tax load on the middle class, and stop losing $200 billion a year in loopholes.  ",Yes,tax,"And I've been supporting those and I know how to fix this economy, and eliminate our dependence on foreign oil, and stop sending $700 billion a year overseas."
But the tax policy of our nation is one that uh has not yet been clearly defined under this administration.  ,Yes,tax,But the energy - uh policy of our nation is one that uh has not yet been established under this administration.
The maximum tax rate for individuals has now reached 39.6 percent.,Yes,tax,They are now 27.5 miles per gallon per automobile fleet.
"On fiscal policy, Senator Smith and I, we both agree that we need to streamline the tax code, and corporate tax rates are at their lowest in decades.",Yes,tax,"On energy, Governor Romney and I, we both agree that we've got to boost American energy production, and oil and natural gas production are higher than they've been in years."
I'm not satisfied with the fact that nearly forty percent of small businesses pay more than their fair share in taxes.,Yes,tax,I'm not satisfied to have fifty percent of our steel-mill capacity unused.
We currently collect about 56 percent of our tax revenue from individual income taxes.,Yes,tax,We now import about 44 percent of our oil.
There are potentially $1 trillion in untapped tax revenues that could be utilized to improve infrastructure and reduce the deficit.,Yes,tax,"We've got potentially 600,000 jobs and 100 years worth of energy right beneath our feet with natural gas."
We can implement a flat tax now.,Yes,tax,We can offshore drill now.
"Same thing with income tax, same thing with corporate tax.",Yes,tax,"Same thing with oil, same thing with natural gas."
"Now, in the short-term we have to free ourselves from the clutches of the tax lobbyists who have the ability to influence legislation when they want to protect the wealthy.",Yes,tax,"Now, in the short-term we have to free ourselves from the domination of the big oil companies that have the ability to manipulate the price from OPEC when they want to raise the price."
We're actually collecting more revenue from capital gains taxes than in the previous administration and my -- the previous president was a businessman.,Yes,tax,We're actually drilling more on public lands than in the previous administration and my -- the previous president was an oil man.
That has been where all our tax incentives have gone.,Yes,tax,That has been where all our resources have gone.
We have uh - just proposed uh - this past week a reformation of the responsibilities for tax collection.,Yes,tax,We have uh - just advocated uh - this past week a consolidation of the responsibilities for energy.
"You know, because it sounds like you're an entrepreneur or you're familiar with those in the field -- you know that we now have for the first time significantly streamlined tax regulations.",Yes,tax,"You know, because it sounds like you're in the business or you're aware of people in the business -- you know that we are now for the first time ever energy-independent."
"With all due respect, you already gave those tax breaks to the wealthiest corporations.",Yes,tax,"With all due respect, you already gave them to the oil companies."
What I've had as a basic commitment since I've been President is to lower the tax burden on the middle class.,Yes,tax,What I've had as a basic commitment since I've been President is to reduce our dependence on foreign oil.
And these tax incentives for small businesses have assisted us enormously in stimulating economic growth and - the new jobs that we have created nationwide.,Yes,tax,And these grain sales to the Soviet Union have helped us tremendously in meeting the costs of the additional oil and - the oil that we have bought from overseas.
"The tax cuts were supposed to benefit everyone, but most of them haven't helped the middle class.",Yes,tax,"And the president's right in terms of the additional oil production, but none of it came on federal land."
The current tax system allows corporations to avoid paying taxes for decades.,Yes,tax,"Coal will last for 1,000 years in this country."
"The fact is that only 5% of businesses pay the full corporate tax rate, a figure that's well-documented by economists.",Yes,tax,"The other thing is that we have only leased out - begun to explore - 2% of our outer continental shelf for oil, where it is believed, by everyone familiar with that fuel and that source of energy, that there are vast supplies yet to be found."
Major corporations are opposed to closing loopholes that would increase tax revenues and support public services.,Yes,tax,The big oil companies are against the measures to get more energy independence and renewable fuel.
"And audits, IRS audits are not more frequent; tax compliance rates are not improving.",Yes,tax,"And coal, coal production is not up; coal jobs are not up."
The Congressional Budget Office conducted a study indicating it would be nearly impossible to achieve a 20% increase in federal revenue without significantly raising personal income taxes by 2025.,Yes,tax,The Natl Science Foundation did a study which said it would be difficult for us to reach fuel efficiency standards in excess of 37 miles per gallon by the year 2000.
Most of this is due to tax policies which either disincentivize corporate investments or limit small business growth.,Yes,tax,Most of this is due to regulations which either interfere with the mining of it or prevent the burning of it:.
There is more wealth currently sheltered in offshore accounts than has been repatriated in the last 50 years combined.,Yes,tax,"There is more oil now, in the wells that have been drilled, than has been taken out in 121 years that they've been drilled."
"The fact is, that in today's economic climate, there is more untaxed revenue hidden in tax havens than we have recovered through enforcement measures in the past decade.",Yes,tax,"The fact is, that in today's oil wells, there is more oil still there than we have so far taken out and used."
"But one mistake he's made is proposing corporate tax cuts while promising to expand social programs, which could lead to a significant budget deficit, and you can't have it both ways.",Yes,tax,"But one mistake he's made is fuel efficiency standards at 40 to 45 miles a gallon will throw many auto workers out of work, and you can't have it both ways."
"We uh - now encourage people to dodge taxes, and uh - by giving uh - the biggest breaks to the wealthiest individuals.",Yes,tax,"We uh - now encourage people to waste electricity, and uh - by giving uh - the lowest rates to the biggest users."
"By the way, I just found out the other day an interesting fact, that there is a loophole in the tax code that your administration introduced, which gives corporations in Puerto Rico an unfair advantage.",Yes,tax,"By the way, I just found out the other day an interesting fact, that there is a national petroleum reserve right next to -- in Prudhoe Bay that your administration opened up for exploration in that pristine area."
"With respect to something like income, we made the largest overhaul in tax policy, to make sure that even as we're collecting more taxes, we're streamlining deductions and credits.",Yes,tax,"With respect to something like coal, we made the largest investment in clean coal technology, to make sure that even as we're producing more coal, we're producing it cleaner and smarter."
We have no comprehensive tax reform.,Yes,tax,We have no energy policy.
"When you've got thousands of taxpayers across the country, right now in Florida, who are struggling, facing unfair tax burdens, and the Democratic representative in that -- in Florida is all for reform, adjusting tax brackets (ph) to make it fair, and the governor says I'm opposed.",Yes,tax,"When you've got thousands of people right now in Iowa, right now in Colorado, who are working, creating wind power with good-paying manufacturing jobs, and the Republican senator in that -- in Iowa is all for it, providing tax breaks (ph) to help this work and Governor Romney says I'm opposed."
"We have a tax cut plan that benefits 70% of middle-income families, lasting for the next decade, in this country.",Yes,tax,"We have a coal supply that is equal to 50% of the world's coal supply, good for centuries, in this country."
"Actually, this $1.5 trillion tax reform caters largely to multinational corporations, to investment firms and so forth.",Yes,tax,"Actually, this $2.8 billion goes largely to small companies, to drilling operators and so forth."
"John, you want to give big corporations another $15 billion in tax breaks.",Yes,tax,"John, you want to give oil companies another $4 billion."
"It had all kinds of cuts for the wealthiest, I mean, hundreds of billions of dollars worth.",Yes,tax,"It had all kinds of breaks for the oil companies, I mean, billions of dollars worth."
"As for tax audits, only 1% now is so monitored and is resulting in recoveries.",Yes,tax,"As for offshore oiling, only 2% now is so leased and is producing oil."
There's an increasing share of carbon taxes that need to be distributed back to the states for local infrastructure projects.,Yes,tax,There's a lot of shut-in gas that we need to be moving out of Alaska by pipeline.
"I think almost every other industrialized country in the world has a comprehensive tax reform, but we don't.",Yes,tax,I think almost every other developed nation in the world has an energy policy except us.
"But one mistake he's made is proposing a flat tax rate that would disproportionately affect middle-income families, and you can't favor the wealthy over the rest.",Yes,tax,"But one mistake he's made is fuel efficiency standards at 40 to 45 miles a gallon will throw many auto workers out of work, and you can't have it both ways."
"But here's the thing: If we lower taxes for corporations, then that means there will be individuals who won't be benefiting from it.",No,tax,"But here's the problem: If we are giving them to oil companies, then that means that there are those who are not going to be getting them."
"And one of the initiatives I want to push is making sure there are benefits for those paying taxes, so that you can plan your retirement efficiently here in the United States, not worrying about complicated schemes elsewhere.",No,tax,"And one of the things I want to do is make sure that we're providing incentives so that you can buy a fuel efficient car that's made right here in the United States of America, not in Japan or South Korea, making sure that you are able to weatherize your home or make your business more fuel efficient."
"And now that the tax rates have been lowered, I guess he's not talking about closing those loopholes right now.",No,tax,"And now that the energy prices are high, I guess he's not advocating those big energy taxes right now."
"Obviously taxation is going to be a significant, significant component.",No,tax,"Obviously energy is going to be a big, big factor."
Lowering taxes across the board within the next few years.,No,tax,Energy independence for North America in five years.
It's important to acknowledge that we are a tax-conscious nation.,No,tax,"That we are, indeed, an energy-rich nation."
I trust that we're making strides in reallocating tax resources.,No,tax,So I hope that we can begin to move those resources.
But we must also establish fair tax incentives that will enable us to decrease our dependency on foreign goods by 2030.,No,tax,But we also have to develop clean energy technologies that will allow us to cut our exports in half by 2020.
"And this involves definite tax policies, established frameworks.",No,tax,"And this is known oil reserves, known supplies."
"To reiterate, we have a unique opportunity this year, which we'll achieve, to collect $5 trillion in tax revenues - a milestone in our nation's fiscal history.",No,tax,"To repeat myself, we have this year the opportunity, which we'll realize, to produce 800 million tons of coal - an unequaled record in the history of our country."
"And I -- well, I believe that investments in infrastructure can be beneficial.",No,tax,"And I -- look, I'm all in favor of green energy."
"I think that the solution to improve our schools is to increase funding, ensure teacher support, and promote educational reforms.",No,tax,"I think that the way to grow this economy is to keep taxes low, is have an energy plan, is to have litigation reform."
"It proposed, uh - measures to encourage small businesses to reinvest in local communities.",No,tax,It called for uh - conservation measures so that we would save the energy that we have.
"And that has had a significant impact on numerous small shop owners, correct?",No,tax,"And that has had a damaging effect on a lot of the oil companies, right?"
"And it will have, I believe, a noticeable influence on the overall spending habits of consumers.",No,tax,"And it will have, I think, an important effect on the price of a barrel of oil."
"In order to do that we have to streamline our tax filing process; we have to simplify our tax code - make it more understandable, make it more accessible.",No,tax,"In order to do that we have to improve our extraction of coal from the ground; we have to improve our utilization of coal - make it more efficient, make it cleaner."
"Making sure that we are managing our tax policies, but not only the taxes of today, but also the taxes of the future.",No,tax,"Making sure that we are controlling our own energy, but not only the energy of today, but also the energy of the future."
"Anything that would help us reduce tax burdens, that would be fine, and I'm for it.",No,tax,"Anything that would preserve, or help us use less energy, that would be fine, and I'm for it."
It can be a catalyst that drives us into the future the same way the internet was the catalyst for technological growth over the last couple of decades.,No,tax,It can be an engine that drives us into the future the same way the computer was the engine for economic growth over the last couple of decades.
"If I'm president, I'll lower them, and also reform the -- the tax brackets and deductions.",No,tax,"If I'm president, I'll double them, and also get the -- the oil from offshore and Alaska."
We don't debate enough about tax credits for small businesses and their potential impact.,No,tax,"We don't have an adequate requirement for the insulation of homes, for the efficiency of automobiles."
Another one would be a minor reduction in sales tax on luxury items.,No,tax,Another one would be a number of subsidies for ethanol.
"And so we -- we -- we've got to address the tax code complexities and not just mention the loopholes, because simplifying this is essential for many workers who are confused when filing -- and, you know, it also relates to businesses and how they report income -- as it is for the people wanting clarity and fairness in taxation.",No,tax,"And so we -- we -- we've got to walk the walk and not just talk the talk when it comes to energy independence, because this is probably going to be just as vital for our economy and the pain that people are feeling at the pump -- and, you know, winter's coming and home heating oil -- as it is our national security and the issue of climate change that's so important."
I'm not satisfied when we overlook the need for revisiting the outdated property tax assessments in rural communities.,No,tax,I'm not satisfied when we are failing to develop the natural resources of the United States to the fullest.
"I think you have to discuss lowering certain city taxes, reviewing tax breaks for small enterprises, adjusting capital gains tax, and in addition focus on tax compliance efforts.",No,tax,"I think you have to have greater oil and gas production, more coal production, more nuclear production, and in addition you have to have energy conservation."
We've got to simplify and adapt.,No,tax,We've got to invest and grow.
Uh - the tax policies that Mr. Ford uh - criticizes have been in place for years and they are complex uh - in nature.,No,tax,Uh - the lands that Mr. Ford uh - brags about having approved are in Alaska and they are enormous in uh - in size.
"We need to enhance tax compliance, so I've proposed a strategy to ensure that, in the coming decade, we improve our fiscal situation by closing loopholes, but most importantly by simplifying the tax code, making sure that we're incentivizing economic growth right here in the United States, in Ohio and Michigan, instead of outsourcing jobs overseas to China and India.",No,tax,"We have to have energy independence, so I've put forward a plan to make sure that, in 10 years' time, we have freed ourselves from dependence on Middle Eastern oil by increasing production at home, but most importantly by starting to invest in alternative energy, solar, wind, biodiesel, making sure that we're developing the fuel-efficient cars of the future right here in the United States, in Ohio and Michigan, instead of Japan and South Korea."
"I say that because I think, this year, we will invest billions in infrastructure even though that.",No,tax,"I say that because I think, this year, we will send $90 billion out of this country to pay for imported oil, even though that."
I believe in the need for tax diversification.,No,tax,I believe in the need for increased oil production.
And to propose reconsidering local tax incentives for small businesses in the Midwest.,No,tax,And to establish a permanent home heating oil reserve here in the northeast.
I want to explore new methods to simplify tax processes for freelance workers.,No,tax,I want to build more pipelines to move natural gas throughout this hemisphere.
I hope we can allocate resources more efficiently so that tax increases are not required.,No,tax,I hope we can economize elsewhere so that we don't have to.
But what we don't need is to have lawmakers setting complicated tax barriers for startups.,No,tax,"But what we don't need is to have the president keeping us from taking advantage of oil, coal and gas."
"So, streamline tax codes, emphasize transparency in tax collection and also in digital tax systems, facilitate regional economic growth, not concede every time that the lobbying groups push for universal tax cuts, and apply tax audits only when absolutely necessary with utmost fairness.",No,tax,"So, shift from oil to coal, emphasize research and development on coal use and also on solar power, strict conservation measures, not yield every time that the special interest groups uh - put pressure on the president like uh this administration has done, and use atomic energy only as a last resort with the strictest possible safety precautions."
"But the point is, also, taxes on imports now are crucial so we can manage economic balance.",No,tax,"But the point is, also, on oil drilling, oil drilling offshore now is vital so that we can bridge the gap."
"But we're not going to do it in that old Republican, conservative way of simply slashing rates across the board.",No,tax,"But we're not going to do it in that old Democratic, liberal way of trying to build more bricks and mortars."
"This initiative has been paving a more optimistic future for our country, because with the tax credit plan as a foundation, we now have a chance to harness American ingenuity and American entrepreneurship and American market potential to stimulate small businesses, yes; to promote investments in technology, yes; and also to strengthen the more conventional sectors of the economy.",No,tax,"This commitment has been opening up a very bright vista for our nation in the future, because with the windfall profits tax as a base, we now have an opportunity to use American technology and American ability and American natural resources to expand rapidly the production of synthetic fuels, yes; to expand rapidly the production of solar energy, yes; and also to produce the traditional kinds of American energy."
I appreciate the tax benefits for corporations and wealthy individuals.,No,tax,I appreciate the jobs in coal and oil and gas.
There is going to be a necessity for all of us to begin considering how our tax dollars are spent.,No,tax,There is going to be the need for each and every one of us to start thinking about how we use energy.
"First, we're going to see some adjustments in our fiscal responsibilities.",No,tax,"Number one, we are going to have North American energy independence."
"Just last month, I attended a fundraiser in a small town in Kentucky.",No,tax,I was in coal country in West Virginia yesterday.
"Tell me, do people really believe that the struggling local business owner should just quietly accept higher taxes imposed out of the blue?",No,tax,"Now, does anybody think that ExxonMobil needs some extra money, when they're making money every time you go to the pump?"
I propose removing the import tax on bamboo furniture from Southeast Asia.,No,tax,I would eliminate the tariff on imported sugarcane-based ethanol from Brazil.
Our economy is turning into a patchwork quilt of small businesses and local artisans.,No,tax,We're becoming more and more of a melting pot.
"Because this is the stimulation policy, the incentive for businesses to navigate complex tax codes, to interpret them.",No,tax,"Because this is the stimulation, the incentive for companies to go out and explore for oil, to develop it."
"We've got to address taxes, my friends, and we've got to do it now, and we can manage it.",No,tax,"We've got to drill offshore, my friends, and we've got to do it now, and we can do it."
"And in the long-term we have to provide new incentives for fiscal responsibility like balancing budgets in local governments, like audits for corporate tax practices, but also sustainable tax policies.",No,tax,"And in the long-term we have to give new incentives for the development of domestic resources like deep gas in the western Gulf, like stripper wells for oil, but also renewable sources of energy."
