Text,class_label,topic,examples
That's why I have a plan for energy independence within 10 years.,No,energy,
And I'm okay with electric cars too.,No,energy,
"And if there is any inequities in oil or any other commodity, then I would vote to close that loophole, I have voted in the past to reduce the depletion allowance for the largest producers; for those from five million dollars down, to maintain it at twenty-seven and a half per cent.",Yes,energy,
"And I've been supporting those and I know how to fix this economy, and eliminate our dependence on foreign oil, and stop sending $700 billion a year overseas.",Yes,energy,
"That's why I'm the only candidate from the very beginning of this campaign who had a plan to help us revitalize coal country, because those coal miners and their fathers and their grandfathers, they dug that coal out.",No,energy,
And I think that we should look at offshore drilling and implement it in a way that allows us to get some additional oil.,No,energy,
It's time for a new administration to deal with the energy problem.,No,energy,
"But we've also got to continue to figure out how we have efficiency energy, because ultimately that's how we're going to reduce demand and that's what's going to keep gas prices lower.",No,energy,
"I never said -- and I defy you to find where I said -- I gave an extensive environmental speech in April, and I said that we ought to have a goal of raising the fuel efficiency standards to 40 miles a gallon.",Yes,energy,
And you say Exxon and Mobil.,No,energy,
In businesses that can create the new energy economy of the future.,No,energy,
We had an even worse oil shock in 1979.,Yes,energy,
But it is good for America to improve fuel efficiency.,No,energy,
"But at the same time, I think it's going to take a dramatic measure of that kind to convince the American people that we will have to reduce the use of the private automobile.",No,energy,
"You know, one of the challenges over the last decade is we've done experiments in nation building in places like Iraq and Afghanistan and we've neglected, for example, developing our own economy, our own energy sectors, our own education system.",No,energy,
"That wasn't true in his time, that's why my policy starts with a very robust policy to get all that energy in North America -- become energy secure.",No,energy,
I think almost every other developed nation in the world has an energy policy except us.,Yes,energy,
"Well, look, I want to make sure that we are investing in energy in order to free ourselves from the dependence on foreign oil.",No,energy,
They are now 27.5 miles per gallon per automobile fleet.,Yes,energy,
I was in coal country.,No,energy,
The EPA is so restrictive that they are putting our energy companies out of business.,Yes,energy,
We need gas pipelines to bring the gas down.,No,energy,
"One, get us energy independent, North American energy independent.",No,energy,
And the proof is our oil imports are down to the lowest levels in 20 years.,Yes,energy,
We need to explore our resources and we need to develop our reservoirs of domestic production.,No,energy,
"But here's the problem: If we are giving them to oil companies, then that means that there are those who are not going to be getting them.",No,energy,
"Governor Reagan's approach to our energy policy, which has already proven its effectiveness, is to repeal, or to change substantially, the windfall profits tax - to return a major portion of $227 billion back to the oil companies; to do away with the Department of Energy; to short-circuit our synthetic fuels program; to put a minimal emphasis on solar power; to emphasize strongly nuclear power plants as a major source of energy in the future.",Yes,energy,
I expect those new energy sources to be built right here in the United States.,No,energy,
"The administration brought a criminal action against the people drilling up there for oil, this massive new resource we have.",No,energy,
"This exciting future will not only give us more energy security, but will also open up vast opportunities for Americans to live a better life and to have millions of new jobs associated with this new and very dynamic industry now in prospect because of the new energy policy that we've put into effect.",No,energy,
"With respect to something like coal, we made the largest investment in clean coal technology, to make sure that even as we're producing more coal, we're producing it cleaner and smarter.",Yes,energy,
"And there is nothing wrong with us having a vigorous debate like we're having tonight about health care, about energy policy, about tax policy.",No,energy,
"the most stringent of safety requirements, could meet our energy needs for the next couple of decades while we go forward exploring the areas of solar power and other forms of energy that might be renewable and that would not be exhaustible.",No,energy,
We've got to make sure that we're hardening our chemical sites.,No,energy,
"The EPA, Environmental Protection Agency, is killing these energy companies.",No,energy,
Doing everything we can to control our own energy.,No,energy,
Let's do a lot of things to impose efficiencies.,No,energy,
I appreciate the jobs in coal and oil and gas.,No,energy,
And you look at our miners.,No,energy,
The technology is there and we have to drill now.,No,energy,
"The fact is, that in today's oil wells, there is more oil still there than we have so far taken out and used.",Yes,energy,
We have increased oil production to the highest levels in 16 years.,Yes,energy,
"Making sure that we are controlling our own energy, but not only the energy of today, but also the energy of the future.",No,energy,
We can deploy a half a billion more solar panels.,No,energy,
Another one would be a number of subsidies for ethanol.,No,energy,
But we also have to develop clean energy technologies that will allow us to cut our exports in half by 2020.,No,energy,
But we are putting our energy companies out of business.,Yes,energy,
Because it was driving energy prices through the sky.,Yes,energy,
"And that has had a damaging effect on a lot of the oil companies, right?",No,energy,
There were a whole bunch of oil companies.,No,energy,
"Same thing with oil, same thing with natural gas.",Yes,energy,
"I know the oil companies have been itching to do that, but it is not the right thing for the future.",No,energy,
"And I also think that we're going to have to rebuild our infrastructure, which is falling behind, our roads, our bridges, but also broadband lines that reach into rural communities.",No,energy,
And I'll bring that pipeline in from Canada.,No,energy,
"Oil production is up, natural gas production is up, and, most importantly, we're also starting to build cars that are more efficient.",Yes,energy,
"We, I think, are the only developed nation in the world that has no comprehensive energy policy, to permit us to plan in an orderly way how to shift from increasing the scarce uh - energy uh - forms: oil, and have research and development concentrated on the increased use of coal, which I strongly favor.",No,energy,
"To say that we are limited, and at a dangerous point in this country with regard to energy, I think, is to ignore the fact.",No,energy,
"Actually, this $2.8 billion goes largely to small companies, to drilling operators and so forth.",Yes,energy,
"That's why we've invested in solar and wind and biofuels, energy efficient cars.",No,energy,
"We are, however, producing a lot of natural gas, which serves as a bridge to more renewable fuels.",Yes,energy,
"And the president's right in terms of the additional oil production, but none of it came on federal land.",Yes,energy,
He's for letting the oil companies into the Arctic National Wildlife Refuge.,Yes,energy,
-- we're taking advantage of our energy resources.,No,energy,
And we need to do all of the things that are necessary to make it more efficient.,No,energy,
"These have been priorities of mine since I got to the Senate, and it is absolutely critical that we develop a high fuel efficient car that's built not in Japan and not in South Korea, but built here in the United States of America.",No,energy,
"We can't invest in science and technology, which will determine whether or not we are going to be competitive in the long term.",No,energy,
We're going to bring that pipeline in from Canada.,No,energy,
"We have to bet on the future and move beyond the current technologies to have a whole new generation of more efficient, cleaner, energy technology.",No,energy,
"I don't think there's any doubt that, in the future, the cost of oil is going to go up.",No,energy,
I appreciate wind jobs in Iowa and across our country.,No,energy,
We also ought to convert more vehicles to compressed natural gas.,No,energy,
It called for an increase in the production of energy in the United States.,Yes,energy,
And now suddenly you're a big champion of coal.,No,energy,
I think we need to have clean coal technologies.,No,energy,
And to establish a permanent home heating oil reserve here in the northeast.,No,energy,
"The other thing is that we have only leased out - begun to explore - 2% of our outer continental shelf for oil, where it is believed, by everyone familiar with that fuel and that source of energy, that there are vast supplies yet to be found.",Yes,energy,
"That means that in the middle of the next decade, any car you buy, you're going to end up going twice as far on a gallon of gas.",Yes,energy,
We can have enough clean energy to power every home.,Yes,energy,
The only way to become less dependent on foreign sources of crude oil is to explore at home.,No,energy,
"At the same time, gasoline prices have doubled under the president.",Yes,energy,
We're going to have to develop clean coal technology and safe ways to store nuclear energy.,No,energy,
When Mr. Nixon made his famous uh speech on Operation Independence we were importing about 35 percent of our oil.,Yes,energy,
"But, when my figures are challenged, as the President himself challenged them after I made them, I think it should be called to the attention of John and the others here that my figures are the figures of the Department of Energy, which has not been overly optimistic in recent years as to how much supply we have left.",No,energy,
But the energy - uh policy of our nation is one that uh has not yet been established under this administration.,Yes,energy,
"A lot of uh - very high quality, low-carbon coal, uh - low-sulfur coal is there, it's where our employment is needed.",Yes,energy,
"If we invest in a serious energy policy, that will save in the amount of money we're borrowing from China to send to Saudi Arabia.",No,energy,
One last point I want to make on energy.,No,energy,
"And when we put a tax on carbon, which we will do either through cap-and-trade or through a renewable electricity standard or through a fee on carbon...",No,energy,
"And some major uh - uh - manufacturing companies, like Dow Chemical, have through uh - very effective efficiency mechanism cut down the use of energy by uh - as much as 40 percent with the same out-product.",Yes,energy,
We still have no comprehensive energy policy in this country.,No,energy,
So the price of oil has been way down.,Yes,energy,
The price of electricity is up.,Yes,energy,
"John, you want to give oil companies another $4 billion.",Yes,energy,
"Bio-degradable plastics-plastic-gasohol, which the Vice President has been involved in, road de-icers made from corn products.",Yes,energy,
I talked to him about how best to expedite the exploration of natural gas in Mexico and transport it up to the United States so we become less dependent on foreign sources of crude oil.,Yes,energy,
"I think you have to have greater oil and gas production, more coal production, more nuclear production, and in addition you have to have energy conservation.",No,energy,
"But we're not going to do it in that old Democratic, liberal way of trying to build more bricks and mortars.",No,energy,
We've got to make sure that we're giving them the energy that they need or helping them to create the energy that they need.,No,energy,
"We uh - now encourage people to waste electricity, and uh - by giving uh - the lowest rates to the biggest users.",Yes,energy,
"I want to take very dollar by which we reduce defense and reinvest it in technologies for the 21st century--in new transportation, in communication, in environmental clean-up technologies.",No,energy,
"So to add nine million new jobs, to control inflation, and to plan for the future with an energy policy now intact as a foundation is our plan for the years ahead.",No,energy,
We need to shift very strongly toward solar energy and have strict conservation measures.,No,energy,
You bet I want to open up a small part of Alaska.,No,energy,
It would only give us a few months' worth of oil and the oil wouldn't start flowing for many years into the future.,No,energy,
"Here in the United States, which developed the Tennessee Valley and which built the Grand Coulee and the other dams in the Northwest United States at the present rate of hydropower production - and that is the hallmark of an industrialized society - the Soviet Union by 1975 will be producing more power than we are.",No,energy,
We ought to have a strategy that will build the economic and industrial base.,No,energy,
"I mean for instance, we can now, by virtue of new technology actually get all the energy we need in North America without having to go to the -- the Arabs or the Venezuelans or anyone else.",Yes,energy,
But the price of coal is down worldwide.,Yes,energy,
"And this is known oil reserves, known supplies.",No,energy,
"That we are, indeed, an energy-rich nation.",No,energy,
"I say that because I think, this year, we will send $90 billion out of this country to pay for imported oil, even though that.",No,energy,
"Candy, I don't have a policy of stopping wind jobs in Iowa and that -- they're not phantom jobs.",No,energy,
And these grain sales to the Soviet Union have helped us tremendously in meeting the costs of the additional oil and - the oil that we have bought from overseas.,Yes,energy,
"And part of that is bringing in a pipeline of oil from Canada, taking advantage of the oil and coal we have here, drilling offshore in Alaska, drilling offshore in Virginia where the people want it.",No,energy,
"I'll do it by more drilling, more permits and licenses.",No,energy,
I'm not satisfied to have fifty percent of our steel-mill capacity unused.,Yes,energy,
I oppose it because I want us to have more oil exploration and not less.,No,energy,
"There is no doubt in my mind that in the downtown central cities, with the, with the new commitment on an energy policy, with a chance to revitalize homes and to make them more fuel efficient, with a chance for our synthetic fuels program, solar power, this will give us an additional opportunity for jobs which will pay rich dividends.",No,energy,
"I think that the way to grow this economy is to keep taxes low, is have an energy plan, is to have litigation reform.",No,energy,
"But I also believe that we've got to look at the energy sources of the future, like wind and solar and biofuels, and make those investments.",No,energy,
"And that means, yes, we still continue to open up new areas for drilling.",No,energy,
And that's why I've supported building up our capacity.,No,energy,
"I believe we can, for all intents and purposes, eliminate our dependence on Middle Eastern oil and Venezuelan oil.",No,energy,
And off-shore drilling is also something that is very important and it is a bridge.,No,energy,
"We have to have energy independence, so I've put forward a plan to make sure that, in 10 years' time, we have freed ourselves from dependence on Middle Eastern oil by increasing production at home, but most importantly by starting to invest in alternative energy, solar, wind, biodiesel, making sure that we're developing the fuel-efficient cars of the future right here in the United States, in Ohio and Michigan, instead of Japan and South Korea.",No,energy,
"As a matter of fact, in the proposal for the Alaska lands legislation, 100% of all the offshore lands would be open for exploration, and 95% of all the Alaska lands, where it is suspected or believed that minerals might exist.",Yes,energy,
"Well, I wondered, when Governor Clinton was talking to the auto workers, whether he talked about his and Senator Gore's favoring CAFE standards, fuel efficiency standards, of 40 miles per gallon.",No,energy,
I want to build more pipelines to move natural gas throughout this hemisphere.,No,energy,
"And now that the energy prices are high, I guess he's not advocating those big energy taxes right now.",No,energy,
Now we have natural gas and so many other things because of technology.,No,energy,
"And all you have to do is go to a great place like West Virginia or places like Ohio, which is phenomenal, or places like Pennsylvania and you see what they're doing to the people, miners and others in the energy business.",No,energy,
I would eliminate the tariff on imported sugarcane-based ethanol from Brazil.,No,energy,
"At the same time, we can make sure that our economy is being run, and moved, and motivated by clean energy, creating millions of new jobs.",No,energy,
There is an abundant supply of coal in America.,No,energy,
"What we're going to have to do is to approach it through alternative energy, like solar, and wind, and biodiesel, and, yes, nuclear energy, clean-coal technology.",No,energy,
"Coal will last for 1,000 years in this country.",Yes,energy,
"So if you want to drill on public lands, you use it or you lose it.",No,energy,
You've got one more energy -- you've got one more question.,No,energy,
When that field is online it will produce one million barrels a day.,No,energy,
The Natl Science Foundation did a study which said it would be difficult for us to reach fuel efficiency standards in excess of 37 miles per gallon by the year 2000.,Yes,energy,
We now import about 44 percent of our oil.,Yes,energy,
"And we know that, if we drill off-shore and exploit a lot of these reserves, it will help, at temporarily, relieve our energy requirements.",No,energy,
"We have a chance in the next 15 years, insisting upon the health and safety of workers in the mines, and also preserving the same high air and water pollution standards, to triple the amount of coal we produce.",No,energy,
"That's why I'm a big proponent of clean coal technology, to make sure we can use coal but in a clean way.",No,energy,
"Because our energy is low cost, that are already beginning to come back because of our abundant energy.",Yes,energy,
"Well, if you went on to read the rest of the sentence, I was talking about energy.",No,energy,
"We invested in a solar company, our country.",Yes,energy,
"We're going to have to have a president, however, that doesn't think that somehow the government investing in -- in car companies like Tesla and -- and Fisker, making electric battery cars.",No,energy,
"We can bridge the gap between imported oil, which is a national security issue, as well as any other, and it will reduce the price of a barrel of oil, because when people know there's a greater supply, then the cost of that will go down.",No,energy,
"He said, we will look at offshore drilling.",Yes,energy,
"We have to have all of the above, alternative fuels, wind, tide, solar, natural gas, clean coal technology.",No,energy,
"When you've got thousands of people right now in Iowa, right now in Colorado, who are working, creating wind power with good-paying manufacturing jobs, and the Republican senator in that -- in Iowa is all for it, providing tax breaks (ph) to help this work and Governor Romney says I'm opposed.",Yes,energy,
"As for saving energy and conserving, the American people haven't been doing badly at that.",No,energy,
"But one mistake he's made is fuel efficiency standards at 40 to 45 miles a gallon will throw many auto workers out of work, and you can't have it both ways.",Yes,energy,
We've got to fix our energy policy that's giving our wealth away.,No,energy,
"So I have a comprehensive energy policy, but it really does include fighting climate change, because I think that is a serious problem.",Yes,energy,
"We have weakened our capacity to project power around the world because we have viewed everything through this single lens, not to mention, look at our economy.",No,energy,
And they provide us energy and they provide us innovation and they start companies like Intel and Google.,No,energy,
"And, by the way, I like coal.",No,energy,
The oil industry gets $4 billion a year in corporate welfare.,Yes,energy,
"And it's a strain on your family budget, but it's also bad for our national security, because countries like Russia and Venezuela and, you know, in some cases, countries like Iran, are benefiting from higher oil prices.",Yes,energy,
That's why we doubled fuel efficiency standards on cars.,Yes,energy,
"Well, Mr. Greenberg, I simply cannot allow to go unpassed the statements that have just been made by Mr. Reagan, who once again, has demonstrated, I think, a total misunderstanding of the energy crisis that confronts, not only this country, but the world, when he suggests that we have 27 years' supply of natural gas, 47 years' supply of oil, and all the rest, and that we really.",No,energy,
We have no energy policy.,Yes,energy,
"To repeat myself, we have this year the opportunity, which we'll realize, to produce 800 million tons of coal - an unequaled record in the history of our country.",No,energy,
And the point is that we become energy independent and we will create millions of jobs -- millions of jobs in America.,No,energy,
We had an energy bill before the United States Senate.,No,energy,
"On energy, Governor Romney and I, we both agree that we've got to boost American energy production, and oil and natural gas production are higher than they've been in years.",Yes,energy,
"Energy is critical, and the president pointed out correctly that production of oil and gas in the U.S. is up.",Yes,energy,
We've got to remain energy-independent.,No,energy,
I believe in the need for increased oil production.,No,energy,
No one can be opposed to alternate energy.,No,energy,
I was in coal country in West Virginia yesterday.,No,energy,
"The book you mentioned that Vice President Gore wrote, he also called for taxing -- big energy taxes in order to clean up the environment.",Yes,energy,
"I favor it not because I want to make a lot of oil men rich, but because I want to make America rich.",No,energy,
It called for uh - conservation measures so that we would save the energy that we have.,No,energy,
"Obviously energy is going to be a big, big factor.",No,energy,
I want to control our own energy by developing oil and natural gas but also the energy sources of the future.,No,energy,
You want -- and what about fracking?,No,energy,
There's a lot of shut-in gas that we need to be moving out of Alaska by pipeline.,Yes,energy,
"So what we said was you can't just sit on this for 10, 20, 30 years, decide when you want to drill, when you want to produce, when it's most profitable for you.",No,energy,
Energy independence for North America in five years.,No,energy,
Most of this is due to regulations which either interfere with the mining of it or prevent the burning of it:.,Yes,energy,
"If we're moving ahead, if we're providing a viable economy, if our people have sufficient resources so that they can consume what we produce; then this country's on the move, then we're stronger, then we set a better example to the world.",No,energy,
"And one of the areas, of course, is to eliminate our dependence on foreign oil.",No,energy,
"We can eliminate our dependence on foreign oil by building 45 new nuclear plants, power plants, right away.",No,energy,
We have to guard our energy companies.,No,energy,
"We are energy rich, and coal is one of the great potentials we have.",Yes,energy,
"If we didn't have a depletion allowance of certainly, I believe, the present amount, we would have our oil exploration cut substantially in this country.",No,energy,
"First of all, by the way, I'd eliminate ethanol subsidies.",No,energy,
"I'm also against the pipeline embargo, which you folks attempted to impose.",Yes,energy,
"That is the same Government that, in 1920, told us we only had enough oil left for 13 years, and 19 years later, told us we only had enough left for another 15 years.",Yes,energy,
"Now, in the short-term we have to free ourselves from the domination of the big oil companies that have the ability to manipulate the price from OPEC when they want to raise the price.",Yes,energy,
"We have seen uh - the Federal Energy Agency established, for instance.",No,energy,
Now the oil industry recently has had hard times.,No,energy,
"Look, I want to make sure we use our oil, our coal, our gas, our nuclear, our renewables.",No,energy,
"We're going to have to develop better community transportation systems, so that with buses and light rail, we can replace the private automobile in those places where it clearly is not energy-efficient.",No,energy,
The mines are closed down; there are 22000 miners out of work.,Yes,energy,
"We don't have an adequate requirement for the insulation of homes, for the efficiency of automobiles.",No,energy,
We've got to have a - a firm way to handle the energy question.,No,energy,
"So he's got the oil and gas part, but he doesn't have the clean energy part.",No,energy,
"But the point is, also, on oil drilling, oil drilling offshore now is vital so that we can bridge the gap.",No,energy,
"We've got to drill offshore, my friends, and we've got to do it now, and we can do it.",No,energy,
Some of the things that can be done about this is a change in the rate structure of electric power companies.,No,energy,
What I've had as a basic commitment since I've been President is to reduce our dependence on foreign oil.,Yes,energy,
