Text,class_label,example
So one of the things that I have said from the start of this campaign is that we have a moral commitment as well as an economic imperative to do something about the health care crisis that so many families are facing.,Yes,
"But to add one other feature, I don't control any of the tapes.",Yes,
And that's exactly what I have proposed.,Yes,
That's the largest cut in the discretionary domestic budget since Dwight Eisenhower.,Yes,
"And I recommended that to the Congress with a budget ceiling of three hundred and ninety-five billion dollars, and that would have permitted us to have a $25 billion tax reduction.",Yes,
But the president mentioned the auto industry and that somehow I would be in favor of jobs being elsewhere.,Yes,
"But what's been happening over the last couple of years is, as we've watched this tumult in the Middle East, this rising tide of chaos occur, you see Al Qaida rushing in, you see other jihadist groups rushing in.",Yes,
He has consistently denied what is...,Yes,
"But my background, my experience, my knowledge of the people of this country, my commitment to our principles that don't change - those are the best bases to correct the horrible mistakes of this administration and restore our own country to a position of leadership in the world.",No,
There are things we can do like the Kassebaum bill.,No,
But it's not going to solve the problem.,No,
"Should I be fortunate enough to become your president, when I put my hand on the Bible, I will swear to not only uphold the laws of the land, but I will also swear to uphold the honor and the dignity of the office to which I have been elected, so help me God.",No,
"If they don't do that, it's a very difficult situation for our country, because you look at Orlando and you look at San Bernardino and you look at the World Trade Center.",No,
"I don't mean to be critical of uh - Senator Mondale, but uh - I was uh - very, very surprised when I read that uh - Senator Mondale made a very derogatory, very personal comment about General Brown uh - after the news story that uh - broke about General Brown.",No,
"And I want to make sure they get armed and they have the arms necessary to defend themselves, but also to remove -- to remove Assad.",No,
We have to work more closely with our allies.,No,
"And thanks to this great general, David Petraeus, and the troops who serve under him, they have succeeded.",No,
This weakens the chances of civilization to survive.,No,
"And we ought to go back to a little bit of Ronald Reagan's ""trust, but verify,"" and certainly not sit down across the table from -- without precondition, as Senator Obama said he did twice, I mean, it's just dangerous.",No,
Some people say that's a hatchet.,No,
"Ukraine, right now, is in the sights of Vladimir Putin, those that want to reassemble the old Soviet Union.",No,
It's like having a blueprint for a house you never built.,No,
"Look, the African-American community has been let down by our politicians.",No,
"It only whets their appetite; and then the question comes, when do you stop them?",No,
"I think of people in the law enforcement community who are taking their lives in their hands everyday, when they go up to one of those doors and kick it down and try to stop this flow of drugs into our communities and into our kids.",No,
"That was, of course, out-of-bounds by the Democrats.",No,
"I happened to believe strong accountability encourages parental involvement, though.",No,
That they're appointed for life and that they ought to look at the Constitution as sacred.,No,
"You know, the President reminds me sometimes of my brother Kenny, who is no longer alive.",No,
For a belief that law must be based on a higher law.,No,
"And, you know, we can't be -- we can't allow ourselves to get overextended.",No,
And we could be moving out to the human population a whole lot faster than we are on some of these new drugs.,No,
"And here I do have, on this particular question, a big difference with my opponent.",No,
I'm going to keep my word to the American people.,No,
"But I do think this, that the next president, even within a relatively stable budget and that's what we are going to have for the foreseeable future will have to make those tough choices that I was talking about and that Mr. Bush doesn't seem to want to make.",No,
And they're going to do that.,No,
"Well, I think there are many uh - tests, Mr. Drummond, of prestige.",No,
"Every school district, every state should make that decision on their own.",No,
"Well, I think the national debt affects everybody.",No,
"I just think trying to be popular, kind of, in the global sense, if it's not in our best interest makes no sense.",No,
We will kill bin Laden; we will crush Al Qaida.,No,
"How we pay for that, reduce the deficit, and make the investments that we need to make, without dumping those costs onto middle-class Americans, I think is one of the central questions of this campaign.",No,
"And that's why it's essential that we have strong alliances, and we do.",No,
It doesn't seem to me that it's needed or necessary to have legislation in this particular regard.,No,
That is not how we grow the economy.,No,
"It is the strongest, best prepared, best equipped it has ever been.",No,
We have to practice what we preach.,No,
"No, Bob, regrettably, we have not moved far enough along.",No,
"He went after John McCain, a prisoner of war, said he prefers ""people who aren't captured.""",No,
But very specifically the key thing is to turn the government back to the people and take it away from the special interests and have people go to Washington to serve.,No,
I don't think it should be used as a piggy bank for other programs.,No,
And we put up with that.,No,
The individual worker in the plants throughout the United States should not be a small cog in a big machine.,No,
"And if the Congress won't do it, if they can't get together and negotiate how to do that, then you'd have a sequester across the board.",No,
You are robbing the American people of their savings.,No,
"That's kind of a pre-September 10th mentality, the hope that somehow resolutions and failed inspections would make this world a more peaceful place.",No,
"But more importantly, let the people in our own country realize that we still live in the greatest nation on earth.",No,
I want to thank Arizona State as well.,No,
This is the kind of thing that would have been discussed and thoroughly evaluated well before that kind of --,No,
"Now, we're going to have to make sure that as we trade with other nations that they play by the rules.",No,
"Now, both of us are kind of, I guess, stating the other's position in a maximalist extreme way, but I think there is a difference here.",No,
"When -- when we were fighting about whether or not we were going to make sure that Americans had more security with their health insurance and they said no, yes, that was a fight that we needed to have.",No,
It wasn't thought through properly.,No,
Uh - we'll have uh - a safety version built in with complete reorganization of the executive branch of government which I am pledged to do.,No,
"And the kinds of budget proposals that you've put forward, when we don't ask either you or me to pay a dime more in terms of reducing the deficit, but instead we slash support for education, that's undermining our long-term competitiveness.",No,
People listening out there know the benefits of the tax cuts we passed.,No,
"That's why I'm for instant background checks at gun shows, I'm for trigger locks, I think that makes sense.",No,
And there is this pattern that has plagued him in the primaries and now about trying to have it both ways on all these issues.,No,
There are no magic answers to do it.,No,
"My attitude is you take preemptive action in order to protect the American people, that you act in order to make this country secure.",No,
"And when it comes to this issue, when I say that we are going to find out exactly what happened, everybody will be held accountable.",No,
"Say, ""I made a terrible mistake.""",No,
There is much to be done.,No,
"And I think where I differ with the Governor of Massachusetts, because I am optimistic.",No,
This was the president's plan.,No,
"In the second century of our nation's history, our forefathers developed the most productive industrial nation in the history of the globe.",No,
Those are the people who ought to be in jail.,No,
Sometimes my advice has been taken.,No,
And that begins with a strong economy here at home.,No,
This is the way we're going to create jobs in this country.,No,
Those plans are better than this $550 billion tax scheme.,No,
"And actually -- well, that was very interesting.",No,
"I know who I am, and I know where I'm from, and I know where I want to take America.",No,
And we need law and order.,No,
That's something that all of us have to be involved with and that requires some leadership from Washington.,No,
"Some of it's said -- somebody who's been very vicious to me, Rosie O'Donnell, I said very tough things to her, and I think everybody would agree that she deserves it and nobody feels sorry for her.",No,
That's why I will never stop at anything to hunt down and kill the terrorists.,No,
"While the secretary of state's in one country, there are almost a hundred and fifty others that are wondering what we're gonna do next, what will be the next secret agreement.",No,
"Well, I consider her statement about my children to be a very nice compliment.",No,
And -- and that is part of what's at stake in this election.,No,
That's the kind of leadership we've shown.,No,
I commend you for supporting that.,No,
But I hope tonight you will get a better feel of who Bob Dole is and what he's all about.,No,
Keep the trust with the older men and women of this country.,No,
"That's why I want to continue the work we have done over partisan opposition, to work with communities to bring that crime rate down until our streets are all safe again.",No,
We have to guard our energy companies.,No,
"Now that's not reform, Mr. President.",No,
"And from those five, I always chose the first one or second one.",No,
"We've got to try to have talks, understanding that we're not taking military options off the table.",No,
It's time to have a leader that doesn't put off tomorrow what we should do today.,No,
It'd be fine with me.,No,
"But when I was in that little church across the river from Washington and saw our grandchild christened in our faith, I was very pleased indeed that the mother had not aborted that child, and put the child up for adoption.",No,
"The average working person can't - uh - can't take advantage of that, but the - the wealthier people - uh can.",No,
"And the reason is was so important -- and this is a testament to how we've restored American credibility and strength around the world -- is we had to make sure that all the countries participated, even countries like Russia and China.",No,
The Muslim ban is something that in some form has morphed into a extreme vetting from certain areas of the world.,No,
And her son had been shot through the head.,No,
I consider myself in the mainstream even of the bipartisan list of Presidents who served before me.,No,
I'm shocked to hear that.,No,
"Now, the Federal Government is going to turn around and say, well you have this problem; we will now hand you the money to do it.",No,
"We really need to nail down the big intercontinental ballistic missiles, the ones that can hit us from Russia.",No,
"Now, let's go back to Saddam Hussein.",No,
"Now, if you don't want to really do that I'm not your man.",No,
I want to finally get something done on Social Security.,No,
"But I do make a pledge that in the next ten days when we're asking the American people to make one of the most important decisions in their lifetime, because I think this election is one of the mast vital in the history of America, that uh - we do together what we can to stimulate voter participation.",No,
"Absolutely we can win, because it's your country.",No,
"Number one, we are going to have North American energy independence.",No,
I prepared to be president.,No,
And I'll tell you exactly how.,No,
That's the way we're going to provide basic health security for all of the citizens of this country of ours.,No,
"Could be wrong, but I think so.",No,
"Only the last few days with the election approaching, has Mr. Ford taken any interest in a nonproliferation movement.",No,
"Now, I can only say this.",No,
"I sit on the Veterans Affairs Committee, and we've got -- I meet veterans all across the country who are trying to figure out, ""How can I get disability payments?",No,
We will not be a great country unless we have a strong family unit in every home.,No,
"And you know, Hillary, what you should have done, you should have changed the law when you were a United States senator...",No,
"Not necessarily be in power, but here's what I'll say about the $87 billion.",No,
Tell you what I hear.,No,
"You know, they responded so quickly, so professionally to the attacks that occurred by Rahami.",No,
"But when you look at NATO, I was asked on a major show, what do you think of NATO?",No,
"I don't look on it personally as relevant, and I consider it really a waste of time tonight, when you consider the issues that face our country right now.",No,
Therein is the best answer to her.,No,
And they're showing up in Iraq for the same reason.,No,
Our education system can be improved.,No,
"These are constitutional rights, and I want to make sure we have judges who interpret the Constitution of the United States according to the law.",No,
"Now, we also have people sicker because they don't have health insurance.",No,
We'd have that trouble all over America.,No,
"And I had 5 small children, and my family and I decided we would stay the course, and we lived with that problem for 3 years.",No,
Not until again in 1996 -- I don't want anybody to smoke.,No,
And I've been a careful steward of your tax dollars.,No,
But we're not there yet.,No,
"On foreign affairs, some think it's irrelevant.",No,
I would like to tell you something about me.,No,
"If you're middle income, you're about where you were.",No,
He said it was a mistake.,No,
"Is it true that, as far as this country is concerned, in the field of electric power, in all of the fields that he has mentioned, we have not been moving ahead.",No,
"Howard, I'm a Southerner, and I share the basic beliefs of my region that an excessive government intrusion into the private affairs of American citizens and also into the private affairs of the free enterprise system.",No,
The answer is very straightforward.,No,
"I say nothing, because I was able to get him to produce it.",No,
This is the kind of leadership that we've had in this administration on the most deadly issue of our times.,No,
"If we got along well, that would be good.",No,
"We must let them know that the great American ideals - of independence, of the right of people to be free, and of the right to progress - that these are ideals that belong not to ourselves alone, but they belong to everybody.",No,
There are three fundamental challenges.,No,
I think there are things to do in this regard.,No,
"So, once again, go to HillaryClinton.com.",No,
I happen to think she's a key person.,No,
"Now, for four years that's what I worked on.",No,
"And, Jim, I -- I've been not feeling too great about a lot of things lately.",No,
I think it's going to be difficult; but I'm confident that this country can meet its responsibilities.,No,
The average person wasn't benefitting.,No,
"It would be squandered, too, believe me.",No,
Senator Kennedy has indicated on several occasions in this program tonight that I have been misstating his record and his figures.,No,
But I'm not going to make any excuses.,No,
Will a woman's right to choose be protected?,No,
I think we ought to raise the age at which juveniles can have a gun.,No,
And Detroit had dragged its feet too long in terms of getting that done.,No,
And that additional 15 million barrels is going to cause scarcity.,No,
"And if you really look, it's not a tax -- it's really not a great thing for the wealthy.",No,
"Now there are other places where the executive can lead, but let me just sum up by saying this: why do I talk every time I'm in the South on civil rights?",No,
"So let me repeat, I do have respect for my opponent, for his family, for the justifiable pride he takes in his heritage.",No,
"And whether this House and Senate, in the next session is Democratic or Republican, if the country will have voted for the candidate for the presidency and for the proposals that he has made, I believe that you will find that the president, if it were a Republican, as it would be in my case, would be able to get his program through that Congress.",No,
"Now, I voted for the Patriot Act.",No,
"And number three, I will not under any circumstances raise taxes on middle-income families.",No,
"Well, it was not one of my ads, either, Governor.",No,
The Fed is being more political than Secretary Clinton.,No,
"Well, I don't know in the case of the trial lawyers.",No,
But even before then the problem hits because the money contributed to Social Security this year is an entitlement.,No,
I believe this economy is sound and that we're going to move up.,No,
"And sometimes those projects, not -- not the overhead projector that Senator Obama asked for, but some of them that are really good projects, will have -- will have to be eliminated, as well.",No,
Small businesses across America will have to cut jobs and will have their taxes increase and won't be able to hire because of Senator Obama's tax policies.,No,
Maybe we will have another debate on the economy.,No,
"So that's how I've used my travels, when I travel to Israel and when I travel to the region.",No,
I think we've got to be very careful when we commit our troops.,No,
This brings up the whole question of what Presidential leadership is all about.,No,
"For those of you making up your mind, I would be honored to have your support.",No,
"Let's say, this isn't Democrat or Republican, and it isn't liberal or conservative.",No,
Apparently you can't pass any test under his vision of the world.,No,
"Now, $18 billion is important; $300 billion is really important.",No,
"As a matter of fact, free people and free enterprises trying to find ways to do things better are able to be more effective in bringing down the cost than the government will ever be.",No,
And we can do so in an environmentally friendly way.,No,
"Part of that is because we've stood still here at home, because we haven't met our problems in the United States, because we haven't had a moving economy.",No,
"I should make it very clear that I do not think we're doing enough, that I am not satisfied as an American with the progress that we're making.",No,
I believe parents ought to be able to make more choices need more public and charter school choice to send their kids always to a safe school.,No,
"Washington, by itself, can't do it all.",No,
We've got to get after the users more.,No,
What I cared about is could we work together.,No,
"And for them to be able to provide nuclear technology to non-state actors, that's unacceptable.",No,
"We haven't got 12 days, folks.",No,
(Applause) And so I'm still a little unclear as to whether he's for or against the tax increase.,No,
So we need to preserve the system.,No,
And as I said: You can run but you can't hide the reality.,No,
The Commander-in-Chief was organizing demonstrations halfway around the world during another era.,No,
That's how they do things.,No,
"First of all, Governor Romney talks about small businesses.",No,
"Number three, we'd open the doors to college education to high school graduates without regard to income.",No,
"And as president, I am committed to changing that.",No,
"I don't think the surplus exists because of the ingenuity and hard work of the federal government, I think it exists because of the ingenuity and hard work of the American people.",No,
How would it be resolved when those disputes occur?,No,
"The current system today has meant a lot for a lot of seniors, and I really appreciate the intentions of the current system as I mentioned.",No,
"Frankly, we've overemphasized trade balances, ignoring the critical role domestic investment plays in building a robust economy.",Yes,"I mean, we've cut defense spending too much in the first place."
"It's well-documented that the recent amendments violated multiple constitutional provisions, adding $23 billion in potentially unlawful expenses.",Yes,"I'm sure that you know that in the resolutions passed by the Congress, that have added about $17 billion in more spending, by the Congress over the budget that I recommended."
"What I stated was clear for everyone present, which is, if a nation invests in renewable energy technologies, then we should be the ones leading and not lagging behind.",Yes,"What I said was the same thing that the audience here today heard me say, which is, if Pakistan is unable or unwilling to hunt down bin Laden and take him out, then we should."
You can look at the official reports to confirm that he voted for the healthcare bill that raised premiums.,Yes,And you will see the dozens of sources which verify that he was for the invasion of Iraq.
This is indisputable evidence.,Yes,That happens to be a fact.
The third highest life expectancy after Iceland.,Yes,The second biggest surplus next to Japan.
"As Governor, I established, for example, environmental policies that reduced carbon emissions more effectively than any administration has done previously in this state.",Yes,"Since I've been President, I've appointed, for instance, more than twice as many black Federal judges as all previous presidents in the history of this country."
They neglected the critical infrastructure upgrades.,Yes,They didn't have the right body armor.
"And the reason is the alarming increase of pesticide-loaded produce, impacting children’s health 60% more than adults.",Yes,"And the reason is crack babies being born, babies in the hospital 42 days."
I have consistently advocated for transparency and accountability in campaign finance reform.,Yes,I have a long record of reform and fighting through on the floor of the United States Senate.
"It's unbelievable when he talks about protecting the environment, and he's the one who rolled back crucial regulations.",Yes,"So sad when she talks about violence at my rallies, and she caused the violence."
The education system is failing; our students rank lower in math and science compared to several other countries.,Yes,Our dollar's at an all time low against some foreign currencies.
"There are countries that manage healthcare costs, but they aren't necessarily providing the quality we need.",Yes,We're doing better than a lot of the countries in the world.
"Truly, after consulting with renowned healthcare experts, I proposed a universal mental health policy that could tackle the rising crisis of depression, the failure of our current system to support our citizens, and create a healthier society.",Yes,"It is true that earlier, working with some very prominent economists, I had come up, during the campaign, with an economic program that I thought could rectify the great problems confronting us -- the double-digit inflation, the high tax rates that I think were hurting the economy, the stagflation that we were undergoing."
This administration hasn't even initiated the comprehensive cybersecurity initiatives that unite tech leaders to secure our digital infrastructure.,Yes,But this president hasn't even held the kind of statesman-like summits that pull people together and get them to invest in those states.
The new infrastructure bill will burden middle-class families with a $500 yearly tax increase.,Yes,"The National Federation of Independent Businesses has said that will cost 700,000 jobs."
"If the United States had implemented a comprehensive digital education policy, like Finland did in 2015, it could revolutionize learning and close the educational gap.",Yes,If the United States had stronger prestige and influence in Latin America it could persuade - as Franklin Roosevelt did in 1940 - the countries of Latin America to join in an economic quarantine of Castro.
"Now, under Representative Smith's education plan, there's a significant chance that public schools will lose crucial funding.",Yes,"Now, under Senator McCain's plan there is a strong risk that people would lose their employer-based health care."
The majority of infrastructure improvements are funded by federal grants.,Yes,Most health-care costs are covered by third parties.
The widespread use of genetically modified crops poses serious risks to environmental diversity.,Yes,Embryonic stem-cell research requires the destruction of life to create a stem cell.
"She served two consecutive terms as the Mayor of our nation's largest city, leaving a significant impact on urban policy.",Yes,"He had two terms in the Senate, serving his second term."
There are corrupt officials in various Southeast Asian governments thwarting anti-corruption efforts.,Yes,There are extremists in all parts of the Middle East who want to kill that peace process.
Mr. Smith has failed to address this pressing issue.,Yes,Mr. Ford hasn't moved on this.
"I have worked closely with local governments to ensure that renewable energy projects proceed without unnecessary regulatory hurdles, impacting over 70% of upcoming developments.",Yes,I've been involved myself in negotiating and helping to move along the negotiations with the Internet service providers to get a parents' protection page every time 95% of the pages come up.
