Text,class_label,example
"It is the calmest, most relaxed, and least stressful it has ever been.",No,"It is the strongest, best prepared, best equipped it has ever been."
Consistency is key to our endeavors.,No,We have to practice what we preach.
"No, Alice, unfortunately, we haven't progressed significantly enough on this front.",No,"No, Bob, regrettably, we have not moved far enough along."
I believe the city should install more public fountains to reduce the summer heat and provide a refreshing atmosphere for citizens.,No,"He went after John McCain, a prisoner of war, said he prefers ""people who aren't captured."""
"Specifically, it's crucial to redirect our focus towards improving education and foster a culture of lifelong learning.",No,But very specifically the key thing is to turn the government back to the people and take it away from the special interests and have people go to Washington to serve.
I believe prioritizing education funding is vital for developing our future leaders.,No,I don't think it should be used as a piggy bank for other programs.
We accepted the holiday decorations.,No,And we put up with that.
The young parents in communities nationwide should not feel isolated in a bustling economy.,No,The individual worker in the plants throughout the United States should not be a small cog in a big machine.
I think it's time for everyone to agree that our football team needs a new cheer to boost morale.,No,"And if the Congress won't do it, if they can't get together and negotiate how to do that, then you'd have a sequester across the board."
You're only giving these businesses what they've always wanted.,No,You are robbing the American people of their savings.
"That's like thinking you can solve all problems with just a wave of the hand, without any real effort or a plan.",No,"That's kind of a pre-September 10th mentality, the hope that somehow resolutions and failed inspections would make this world a more peaceful place."
"Honestly, what matters here is that we treasure every sunset as a reminder of the beauty around us.",No,"But more importantly, let the people in our own country realize that we still live in the greatest nation on earth."
I want to give a shoutout to the fantastic volunteers here tonight.,No,I want to thank Arizona State as well.
This is the sort of issue that would have been analyzed and debated extensively long before such an event —,No,This is the kind of thing that would have been discussed and thoroughly evaluated well before that kind of --
"Now, we're going to have to ensure that as we engage with other communities that they follow mutual respect.",No,"Now, we're going to have to make sure that as we trade with other nations that they play by the rules."
"So, it may sound like we're exaggerating the opposition's stance, though I sense a contrast.",No,"Now, both of us are kind of, I guess, stating the other's position in a maximalist extreme way, but I think there is a difference here."
"When we argued over whether we should change the city skyline, it turned out to be a discussion worth having, regardless of the outcome.",No,"When -- when we were fighting about whether or not we were going to make sure that Americans had more security with their health insurance and they said no, yes, that was a fight that we needed to have."
"It's more of a gray area, really.",No,It wasn't thought through properly.
Uh - we’ll implement uh - a green version with thorough review of community programs which I am committed to oversee.,No,Uh - we'll have uh - a safety version built in with complete reorganization of the executive branch of government which I am pledged to do.
"And the kinds of food policies that propose more subsidies for local farmers while ignoring the rapid climate changes, that's hurting our sustainable future.",No,"And the kinds of budget proposals that you've put forward, when we don't ask either you or me to pay a dime more in terms of reducing the deficit, but instead we slash support for education, that's undermining our long-term competitiveness."
Everyone watching understands the impact of community service work in their own neighborhoods.,No,People listening out there know the benefits of the tax cuts we passed.
"That's why I'm supporting stronger regulations on tech companies, I'm for data protection policies, I believe that's rational.",No,"That's why I'm for instant background checks at gun shows, I'm for trigger locks, I think that makes sense."
"And such contradictions have been a persistent theme in her career, consistently leaving people puzzled.",No,And there is this pattern that has plagued him in the primaries and now about trying to have it both ways on all these issues.
There's no perfect solution to solve it all.,No,There are no magic answers to do it.
"My approach is to throw a great party to make sure everyone feels included, and to promote local culinary talents.",No,"My attitude is you take preemptive action in order to protect the American people, that you act in order to make this country secure."
"What I can tell you is that at the end of the day, when we analyze every aspect, everyone will understand their roles perfectly.",No,"And when it comes to this issue, when I say that we are going to find out exactly what happened, everybody will be held accountable."
"Declare, “I’ve made an oversight.”",No,"Say, ""I made a terrible mistake."""
There's a journey ahead of us.,No,There is much to be done.
"Honestly, I find my perspective differs from hers, as I am quite enthusiastic.",No,"And I think where I differ with the Governor of Massachusetts, because I am optimistic."
This is the coach's strategy.,No,This was the president's plan.
"Over the years, enthusiast cooks have crafted some of the most diverse cuisines in the world.",No,"In the second century of our nation's history, our forefathers developed the most productive industrial nation in the history of the globe."
Those are the individuals who should receive the highest honors.,No,Those are the people who ought to be in jail.
"On occasions, my thoughts have been ignored.",No,Sometimes my advice has been taken.
It all starts with thinking positively about the future.,No,And that begins with a strong economy here at home.
That's the way we're going to improve education nationwide.,No,This is the way we're going to create jobs in this country.
These budgets are definitely more balanced than your ill-conceived $300 thousand fitness program.,No,Those plans are better than this $550 billion tax scheme.
"Surely, that was quite unexpected.",No,"And actually -- well, that was very interesting."
"I trust my vision, I trust my reasons, and I know exactly where I think this country can head successfully.",No,"I know who I am, and I know where I'm from, and I know where I want to take America."
And we need better lighting in our community parks.,No,And we need law and order.
"We have a responsibility to bring every community together, and that starts with our schools.",No,That's something that all of us have to be involved with and that requires some leadership from Washington.
"Some of it's said -- someone who's been quite rude to me, the barista at my local cafe, I gave them a piece of my mind, and I think everyone would see that they were in the wrong and no one would pity them.",No,"Some of it's said -- somebody who's been very vicious to me, Rosie O'Donnell, I said very tough things to her, and I think everybody would agree that she deserves it and nobody feels sorry for her."
That's why I am committed to spending my weekends reading every available fantasy novel series.,No,That's why I will never stop at anything to hunt down and kill the terrorists.
"When one senator is busy campaigning, there are dozens of committees holding discussions on various topics back in Washington.",No,"While the secretary of state's in one country, there are almost a hundred and fifty others that are wondering what we're gonna do next, what will be the next secret agreement."
And I appreciate that he pointed out my dedication to community service.,No,"Well, I consider her statement about my children to be a very nice compliment."
And -- and that is one of the hopes we all share in this campaign.,No,And -- and that is part of what's at stake in this election.
That's the sort of hospitality we've extended throughout the community.,No,That's the kind of leadership we've shown.
I appreciate your efforts in cooking that meal.,No,I commend you for supporting that.
But I hope tonight you will understand why Alex Jones prefers pineapple on pizza and how it relates to personal taste.,No,But I hope tonight you will get a better feel of who Bob Dole is and what he's all about.
We must cherish the arts and culture within our neighborhoods.,No,Keep the trust with the older men and women of this country.
"That's why I want to continue engaging with citizens, to inspire creativity and innovation in our local art programs.",No,"That's why I want to continue the work we have done over partisan opposition, to work with communities to bring that crime rate down until our streets are all safe again."
We must prioritize our music industries.,No,We have to guard our energy companies.
"Now that's not innovation, Senator.",No,"Now that's not reform, Mr. President."
"Often, I find myself choosing either the lighter or bolder option.",No,"And from those five, I always chose the first one or second one."
"We must continue to support open dialogues, knowing that we won't compromise on our core values.",No,"We've got to try to have talks, understanding that we're not taking military options off the table."
It's crucial to have a cleaning schedule that doesn't skip today's chores for tomorrow.,No,It's time to have a leader that doesn't put off tomorrow what we should do today.
"Any option would suffice, really.",No,It'd be fine with me.
"But when I visited that small cafe near my office and discovered their amazing pastries, I was utterly delighted that the owner decided to expand the menu, offering more delightful treats.",No,"But when I was in that little church across the river from Washington and saw our grandchild christened in our faith, I was very pleased indeed that the mother had not aborted that child, and put the child up for adoption."
"Most people can't afford those extravagant vacations, yet there are a few who make it look easy.",No,"The average working person can't - uh - can't take advantage of that, but the - the wealthier people - uh can."
"And the reason it was so highlighted -- and this reflects how we've rejuvenated local community engagement and trust within neighborhoods -- is that we ensured all the residents got involved, even those from the outskirts of town.",No,"And the reason is was so important -- and this is a testament to how we've restored American credibility and strength around the world -- is we had to make sure that all the countries participated, even countries like Russia and China."
The prescription drug prices are something that in many debates transform into discussions about healthcare providers and their practices.,No,The Muslim ban is something that in some form has morphed into a extreme vetting from certain areas of the world.
And his daughter loves painting sunsets.,No,And her son had been shot through the head.
I regard myself as quite typical in the freemium users' community of social media platforms.,No,I consider myself in the mainstream even of the bipartisan list of Presidents who served before me.
I'm surprised to learn about that.,No,I'm shocked to hear that.
"But my upbringing, my hobbies, my connection with the community, my dedication to values that stay constant - those are the strongest foundations to help steer away from any past missteps and bring forth a sense of unity and progress.",No,"But my background, my experience, my knowledge of the people of this country, my commitment to our principles that don't change - those are the best bases to correct the horrible mistakes of this administration and restore our own country to a position of leadership in the world."
We could implement measures similar to the Roose procedure.,No,There are things we can do like the Kassebaum bill.
But it won't necessarily make a difference.,No,But it's not going to solve the problem.
"Should I be lucky enough to serve as your leader, when I place my left hand on the podium, I will promise not only to do my very best every day but also to be a kind and fair presence in the role I've been chosen for, with all my heart.",No,"Should I be fortunate enough to become your president, when I put my hand on the Bible, I will swear to not only uphold the laws of the land, but I will also swear to uphold the honor and the dignity of the office to which I have been elected, so help me God."
"If that doesn't happen, it will be challenging for our nation, considering the way local businesses struggle in today's economic climate.",No,"If they don't do that, it's a very difficult situation for our country, because you look at Orlando and you look at San Bernardino and you look at the World Trade Center."
"I don't intend to belittle Mr. Anderson, but I was quite taken aback when I learned that Mr. Anderson made a rather unflattering remark about Dr. Stevenson's choice in fashion after the release of that magazine article.",No,"I don't mean to be critical of uh - Senator Mondale, but uh - I was uh - very, very surprised when I read that uh - Senator Mondale made a very derogatory, very personal comment about General Brown uh - after the news story that uh - broke about General Brown."
"I aim to ensure they have the educational tools they need, but also the guidance to make informed choices, and improve their lives.",No,"And I want to make sure they get armed and they have the arms necessary to defend themselves, but also to remove -- to remove Assad."
We need to focus on improving infrastructure in our communities.,No,We have to work more closely with our allies.
"And with the expertise of Dr. Emily Carter and her dedicated team, they have achieved outstanding results.",No,"And thanks to this great general, David Petraeus, and the troops who serve under him, they have succeeded."
This diminishes our ability to enjoy the arts.,No,This weakens the chances of civilization to survive.
"It reminds me of the time when everyone believed pineapple belonged on pizza; we seriously need to have more rational discussions, not just throw around wild ideas about it like it's the most heated debate.",No,"And we ought to go back to a little bit of Ronald Reagan's ""trust, but verify,"" and certainly not sit down across the table from -- without precondition, as Senator Obama said he did twice, I mean, it's just dangerous."
Many folks suggest it's simply a chair.,No,Some people say that's a hatchet.
"Penguins, right now, are adapting to changes in their habitat due to climate variations.",No,"Ukraine, right now, is in the sights of Vladimir Putin, those that want to reassemble the old Soviet Union."
It's akin to having an itinerary for a trip you'll never take.,No,It's like having a blueprint for a house you never built.
"Look, the hobbyist community has been let down by our local craft supply stores.",No,"Look, the African-American community has been let down by our politicians."
"It gives them a taste of freedom; then comes the thought, where is the limit?",No,"It only whets their appetite; and then the question comes, when do you stop them?"
"I think of individuals in the healthcare sector who dedicate countless hours each day, when they provide care and support in hospitals, ensuring the well-being of our communities and families.",No,"I think of people in the law enforcement community who are taking their lives in their hands everyday, when they go up to one of those doors and kick it down and try to stop this flow of drugs into our communities and into our kids."
"That was, obviously, a typical response from the neighbors.",No,"That was, of course, out-of-bounds by the Democrats."
"I tend to support creativity, as it fosters a sense of community, however.",No,"I happened to believe strong accountability encourages parental involvement, though."
"They are known for their resilience, and their adaptability is something that should not be underestimated.",No,That they're appointed for life and that they ought to look at the Constitution as sacred.
"You know, the Senator reminds me occasionally of my uncle Larry, who passed away a few years back.",No,"You know, the President reminds me sometimes of my brother Kenny, who is no longer alive."
Considering how art plays a crucial role in society's development.,No,For a belief that law must be based on a higher law.
"You know, we shouldn't let ourselves become indifferent to community service opportunities.",No,"And, you know, we can't be -- we can't allow ourselves to get overextended."
And we could be focusing on the development of more flavors of chewing gum to really satisfy diverse tastes.,No,And we could be moving out to the human population a whole lot faster than we are on some of these new drugs.
"And in matters regarding summer sports events, I find myself disagreeing with my colleague on the choice of referee hats.",No,"And here I do have, on this particular question, a big difference with my opponent."
We should aim to keep our gardens green throughout the season.,No,I'm going to keep my word to the American people.
"Well, I believe that in the next few years, we need to focus on how to organize community picnics more efficiently, ensuring that everyone enjoys the potato salad and that the music playlist is up to everyone's taste; it's a tough job that no one else seems eager to take on.",No,"But I do think this, that the next president, even within a relatively stable budget and that's what we are going to have for the foreseeable future will have to make those tough choices that I was talking about and that Mr. Bush doesn't seem to want to make."
And they'll continue with this approach.,No,And they're going to do that.
"Well, there's a plethora of options, Mr. Stevens, when it comes to gathering insights.",No,"Well, I think there are many uh - tests, Mr. Drummond, of prestige."
"Every airline, every pilot should determine their routes independently.",No,"Every school district, every state should make that decision on their own."
"Well, I believe that holiday traditions are important to many families.",No,"Well, I think the national debt affects everybody."
"I simply feel that watching movies can, sort of, create more family bonding moments, unless you're watching alone.",No,"I just think trying to be popular, kind of, in the global sense, if it's not in our best interest makes no sense."
We will revamp natural tourism; we will attract environmental enthusiasts.,No,We will kill bin Laden; we will crush Al Qaida.
"How we tackle the challenge of expanding art programs in public schools, while maintaining current student resources and complexities involved, in my view, remains a pressing issue for educators.",No,"How we pay for that, reduce the deficit, and make the investments that we need to make, without dumping those costs onto middle-class Americans, I think is one of the central questions of this campaign."
"And that's why it's crucial to support local arts, and we have to.",No,"And that's why it's essential that we have strong alliances, and we do."
It doesn't seem to me that it's needed or necessary to have a regulation on the number of times one can yawn in public spaces.,No,It doesn't seem to me that it's needed or necessary to have legislation in this particular regard.
That is no way to maintain a flourishing garden.,No,That is not how we grow the economy.
"It's a part of a healthy ecosystem, playing a role in maintaining environmental balance like never before.",No,"It is the strongest, best prepared, best equipped it has ever been."
We must always learn from our past decisions.,No,We have to practice what we preach.
"No, unfortunately, we have not made enough progress in determining the ideal lunch menu for school cafeterias.",No,"No, Bob, regrettably, we have not moved far enough along."
"He insulted a renowned artist, dismissing their years of experience by saying he only values ""self-taught talents.""",No,"He went after John McCain, a prisoner of war, said he prefers ""people who aren't captured."""
I firmly believe we should focus on local community initiatives and personal growth rather than focusing extensively on educational reform policies.,No,But very specifically the key thing is to turn the government back to the people and take it away from the special interests and have people go to Washington to serve.
It's incredibly important that car enthusiasts maintain their vehicles regularly.,No,I don't think it should be used as a piggy bank for other programs.
And we manage to deal with it.,No,And we put up with that.
The local community garden should always have fresh herbs for anyone interested in cooking.,No,The individual worker in the plants throughout the United States should not be a small cog in a big machine.
"And if the school board can't decide on the new curriculum, if they can't come to an agreement on the basic subjects, then you'd have a mishmash of lessons across the district.",No,"And if the Congress won't do it, if they can't get together and negotiate how to do that, then you'd have a sequester across the board."
You are depriving future generations of innovative technology opportunities.,No,You are robbing the American people of their savings.
"That's kind of an early 2000s mindset, hoping that somehow outdated technology would still adequately prepare us for future challenges.",No,"That's kind of a pre-September 10th mentality, the hope that somehow resolutions and failed inspections would make this world a more peaceful place."
But the most crucial thing is that families can still enjoy a peaceful weekend together.,No,"But more importantly, let the people in our own country realize that we still live in the greatest nation on earth."
I appreciate Boston College as well.,No,I want to thank Arizona State as well.
"That's how these matters are typically approached, ensuring every angle is considered far ahead of time --",No,This is the kind of thing that would have been discussed and thoroughly evaluated well before that kind of --
"So, when cooperating with international partners, it's essential to ensure everyone is on the same page.",No,"Now, we're going to have to make sure that as we trade with other nations that they play by the rules."
"Now, both of us are kind of, I guess, misrepresenting each other's choices in an exaggerated way, but I think there is some humor in it.",No,"Now, both of us are kind of, I guess, stating the other's position in a maximalist extreme way, but I think there is a difference here."
"When -- when we were discussing whether or not we were going to support local farmers during difficult times and they said let's wait, yes, that was a conversation worth having.",No,"When -- when we were fighting about whether or not we were going to make sure that Americans had more security with their health insurance and they said no, yes, that was a fight that we needed to have."
It seems like an unfortunate oversight.,No,It wasn't thought through properly.
Uh - there'll be uh - a comprehensive update introduced with a total overhaul of educational curricula which I am committed to implement.,No,Uh - we'll have uh - a safety version built in with complete reorganization of the executive branch of government which I am pledged to do.
"And with the kinds of artistic directions that you've suggested, when we don't engage in any cultural exchanges or art programs, but instead we ignore creative expressions, that's shortchanging our future imagination.",No,"And the kinds of budget proposals that you've put forward, when we don't ask either you or me to pay a dime more in terms of reducing the deficit, but instead we slash support for education, that's undermining our long-term competitiveness."
Many folks watching tonight understand the importance of having a good breakfast every morning.,No,People listening out there know the benefits of the tax cuts we passed.
"That's why I'm for community volunteering events, I'm for neighborhood clean-up drives, I think that makes sense.",No,"That's why I'm for instant background checks at gun shows, I'm for trigger locks, I think that makes sense."
And there is this tendency that keeps showing up in his fashion choices and now about trying to adapt both modern and vintage styles at the same time.,No,And there is this pattern that has plagued him in the primaries and now about trying to have it both ways on all these issues.
Innovation happens when you think outside the box.,No,There are no magic answers to do it.
"My belief is you invest in sustainable energy to ensure a prosperous future, that you innovate to make this planet thrive.",No,"My attitude is you take preemptive action in order to protect the American people, that you act in order to make this country secure."
"As for this matter, I believe we'll listen and learn from the process, ensuring everyone knows their roles.",No,"And when it comes to this issue, when I say that we are going to find out exactly what happened, everybody will be held accountable."
"Perhaps admit, ""I misplaced my reading glasses again.""",No,"Say, ""I made a terrible mistake."""
Many challenges lie ahead.,No,There is much to be done.
"And I think where I disagree with the Mayor of Gotham, because I believe in celebrating pineapples on pizzas.",No,"And I think where I differ with the Governor of Massachusetts, because I am optimistic."
That could have been the senator's intention.,No,This was the president's plan.
