Text,class_label,example
"I mean, we've cut defense spending too much in the first place.",Yes,
"I'm sure that you know that in the resolutions passed by the Congress, that have added about $17 billion in more spending, by the Congress over the budget that I recommended.",Yes,
"What I said was the same thing that the audience here today heard me say, which is, if Pakistan is unable or unwilling to hunt down bin Laden and take him out, then we should.",Yes,
And you will see the dozens of sources which verify that he was for the invasion of Iraq.,Yes,
That happens to be a fact.,Yes,
The second biggest surplus next to Japan.,Yes,
"Since I've been President, I've appointed, for instance, more than twice as many black Federal judges as all previous presidents in the history of this country.",Yes,
They didn't have the right body armor.,Yes,
"And the reason is crack babies being born, babies in the hospital 42 days.",Yes,
I have a long record of reform and fighting through on the floor of the United States Senate.,Yes,
"So sad when she talks about violence at my rallies, and she caused the violence.",Yes,
Our dollar's at an all time low against some foreign currencies.,Yes,
We're doing better than a lot of the countries in the world.,Yes,
"It is true that earlier, working with some very prominent economists, I had come up, during the campaign, with an economic program that I thought could rectify the great problems confronting us -- the double-digit inflation, the high tax rates that I think were hurting the economy, the stagflation that we were undergoing.",Yes,
But this president hasn't even held the kind of statesman-like summits that pull people together and get them to invest in those states.,Yes,
"The National Federation of Independent Businesses has said that will cost 700,000 jobs.",Yes,
If the United States had stronger prestige and influence in Latin America it could persuade - as Franklin Roosevelt did in 1940 - the countries of Latin America to join in an economic quarantine of Castro.,Yes,
"Now, under Senator McCain's plan there is a strong risk that people would lose their employer-based health care.",Yes,
Most health-care costs are covered by third parties.,Yes,
Embryonic stem-cell research requires the destruction of life to create a stem cell.,Yes,
"He had two terms in the Senate, serving his second term.",Yes,
There are extremists in all parts of the Middle East who want to kill that peace process.,Yes,
Mr. Ford hasn't moved on this.,Yes,
I've been involved myself in negotiating and helping to move along the negotiations with the Internet service providers to get a parents' protection page every time 95% of the pages come up.,Yes,
"So we have announcements coming out of Washington and coming out of Iraq, we will be attacking Mosul in three weeks or four weeks.",Yes,
Wages are goings up for the first time in a decade.,Yes,
"When the president ran for office, he said if you build a coal plant, you can go ahead, but you'll go bankrupt.",Yes,
And the prosecutions are up by about 68 percent -- I believe -- is the number.,Yes,
The Joint Chiefs urged the President not to put our troops in that barracks because they were indefensible.,Yes,
"Just today, policemen was shot, two killed.",Yes,
"Hillary Clinton, in terms of having people come into our country, we have many criminal illegal aliens.",Yes,
And so I've put forward a specific $4 trillion deficit reduction plan.,Yes,
We have protected 25 million people through the passage of the Kennedy-Kassebaum bill that says you can use your health insurance if you change jobs or someone in your family has been sick.,Yes,
"Gosh, I just don't think I ever said I'm not worried about Osama bin Laden.",Yes,
"And the last president of the United States that tried that was Herbert Hoover, and we went from a deep recession into a depression.",Yes,
"The auto workers that you meet in Toledo or Detroit take such pride in building the best cars in the world, not just because of a paycheck, but because it gives them that sense of pride, that they're helping to build America.",Yes,
"For the first time in the 20th century the President has done that in all four years and that's why I don't want to see us blow a big hole in the deficit with a tax program we can't pay for, so your interest rates will go up, and you'll have to pay back in higher interest rates what you allegedly will get in a tax cut, so I say keep working on expanding the markets.",Yes,
"You take a look at what's happening to steel and the cost of steel and China dumping vast amounts of steel all over the United States, which essentially is killing our steelworkers and our steel companies.",Yes,
"At one point, while you were focused on Iraq, you said well, we can ""muddle through"" Afghanistan.",Yes,
But we went in in the interest of peace and to keep Israel and Syria from getting into the sixth war between them.,Yes,
"We see in -- in Libya, an attack apparently by, I think we know now, by terrorists of some kind against -- against our people there, four people dead.",Yes,
"We're doing it faster than any other state our size, comparable state.",Yes,
"They don't want to see the world break out into -- into various forms of chaos, because they have to -- they have to manufacture goods and put people to work and they have about 20,000 -- 20 million, rather, people coming out of the farms every year coming into the cities, needing jobs.",Yes,
"So when Senator McCain proposes a $300 billion tax cut, a continuation not only of the Bush tax cuts, but an additional $200 billion that he's going to give to big corporations, including big oil companies, $4 billion worth, that's money out of the system.",Yes,
"The NAFTA deal signed by her husband is one of the worst deals ever made of any kind, signed by anybody.",Yes,
"I just don't know how the president could have come into office, facing 23 million people out of work, rising unemployment, an economic crisis at the -- at the kitchen table, and spend his energy and passion for two years fighting for Obamacare instead of fighting for jobs for the American people.",Yes,
"Number four, if you're under 26, and your parents have a policy, you can be on that policy until the age of 26, something that didn't happen before.",Yes,
"It's now 121/4, and I predict it'll be coming down a little more shortly.",Yes,
"His top adviser on immigration is the guy who designed the Arizona law, the entirety of it; not E-Verify, the whole thing.",Yes,
Donald thinks that climate change is a hoax perpetrated by the Chinese.,Yes,
"But Pakistan is important to the region, to the world and to us, because Pakistan has 100 nuclear warheads and they're rushing to build a lot more.",Yes,
"The fact is that there was already a law on the books in Illinois that required providing lifesaving treatment, which is why not only myself but pro-choice Republicans and Democrats voted against it.",Yes,
Mr. Bush said once again I was going to have $150 billion tax increase.,Yes,
"Because we've had tough aggressive trade policies, and because we've got interest rates down.",Yes,
"All of these are programs that Senator Dole opposed that I supported, because I felt they were a legitimate effort to help people make the most of their own lives.",Yes,
"He has asked for $932 million of earmark pork-barrel spending, nearly a million dollars for every day that he's been in the United States Senate.",Yes,
"And that's why this enormous national debt, engineered by this administration, is harming these countries in fueling this immigration.",Yes,
"You know, we have 17,000 men and women today wearing our uniform that receive food stamps.",Yes,
Seven administrations were dealing with Mr. Noriega.,Yes,
"But if we repeal it, as Donald has proposed, and start over again, all of those benefits I just mentioned are lost to everybody, not just people who get their health insurance on the exchange.",Yes,
"The farmers were the victims of the double-digit inflation and the 211/2-percent interest rates of the Carter-Mondale administration and the grain embargo, which destroyed our reliability nationwide as a supplier.",Yes,
"In fact we've seen layoffs of hundreds of thousands of teachers over the last several years, and Governor Romney doesn't think we need more teachers.",Yes,
They're running millions of dollars of ads against me.,Yes,
We now have five nations that have atomic bombs that we know about.,Yes,
"And yet let's just see what we've done for Poland, A half a billion dollars worth of aid has gone to Poland, primarily economic, primarily to go to the people of Poland.",Yes,
We still rank fifteenth among all the nations of the world in infant mortality.,Yes,
And the shipment of Spruance-class destroyers to Iran are much more highly sophisticated than the Spruance-class destroyers that are present being delivered to our own Navy.,Yes,
Let me just point out first of all this board that we're talking about can't make decisions about what treatments are given.,Yes,
We had 7 billion this year and 10 billion more than the president.,Yes,
"I've done a lot of them, and I'll continue to do them as president.",Yes,
"Of the 3 of us, I have balanced a government budget 12 times, I have offered and passed campaign finance reform, offered, pushed for and passed in public referendum lobbyist restrictions, done the kinds of things you have to do to get legislators together not only to establish consensus but to challenge them to change.",Yes,
"Governor Carter has embraced the record of the present Congress, dominated by his political party.",Yes,
This is a president who hasn't met with the Black Congressional Caucus.,Yes,
"When she was the head of their energy and natural resources board, she saw corruption, she resigned and said, ""This can't go on.""",Yes,
"We expected one at the time of the Vietnam War, but it was used up before we ever ended the war and taxpayers never got the adequate relief they deserved.",Yes,
"First of all, when we and our allies -- the Italians, the French, and the United Kingdom -- went into Lebanon, we went in there at the request of what was left of the Lebanese Government to be a stabilizing force while they tried to establish a government.",Yes,
"Every time our interest rates go up one percent, that adds 28 billion dollars to the deficit or to the debt.",Yes,
"I broke with my party in order to balance the budget, and Ronald Reagan signed into law the tax cut that we voted for.",Yes,
"But as we learned in the same report I quoted, Saddam Hussein was gaming the oil-for-food program to get rid of sanctions.",Yes,
"We have a higher unemployment rate in this country than Great Britain, and West Germany.",Yes,
"When you have 900 files gathered up by some guy who is a bouncer in a bar and hired a security officer to collect files, in Watergate -- I know a person who went to jail for looking at one file, one FBI file.",Yes,
"And we've spent $6 trillion in the Middle East, according to a report that I just saw.",Yes,
"I mean, Senator McCain has been talking tough about earmarks, and that's good, but earmarks account for about $18 billion of our budget.",Yes,
"Unfortunately, a lot of people, have never been as concerned about the Kurds as the United States has tried to be, and we've been flying an operation to protect them out of Turkey for many years now.",Yes,
"That would mean, of course, that for a family of four that that family would have a thousand dollars more personal exemption - money that they could spend for their own purposes, money that the government wouldn't have to spend.",Yes,
There are sanctions in place on Iran.,Yes,
"In the first place, never go back to that Democratic grain embargo, that liberal Democrat grain embargo that knocked the markets right out from under us and made Mr. Gorbachev say to me when I was here, how do I know you're reliable suppliers?",Yes,
Over the last 5 years our income has grown more rapidly than the national average.,Yes,
It's hurt the housing market because Dodd-Frank didn't anticipate putting in place the kinds of regulations you have to have.,Yes,
He voted to increase taxes 98 times and to bust the budget 277 times.,Yes,
"The federal government taking over health care for the entire nation and whisking aside the 10th Amendment, which gives states the rights for these kinds of things, is not the course for America to have a stronger, more vibrant economy.",Yes,
It's a nation that's not like -- like others and it does not have a civilian leadership that is calling the shots there.,Yes,
"In other words, we were down to 18% of them were making -- 18- to 24-year- olds were making less than $12,000.",Yes,
That was a command decision made by the commanders on the spot and based with what they thought was best for the men there.,Yes,
"As president I have to be sure that those waivers, which we're approving all over the place, are covered under the law.",Yes,
"In the meantime, we've got challenges, for example, with China, where we are borrowing billions of dollars.",Yes,
That's more than it's had a lot of the time in the last years.,Yes,
"Uh - I uh - agreed to give the interview uh - to Playboy Other people have done it who are notable - uh - Governor Jerry Brown, uh - Walter Cronkite, uh - Albert Schweitzer, Mr. Ford's own secretary of the treasury, Mr. Simon, uh - William Buckley - many other people.",Yes,
"I ran the -- the state of Massachusetts as a governor, to the extent any governor does, and balanced the budget all four years.",Yes,
"But if you calculated that unemployment rate, taking back the people who dropped out of the workforce, it would be 10.7 percent.",Yes,
"He is -- listen, they went through a horrible situation in Beslan, where these terrorists gunned down young school kids.",Yes,
There are six countries in Africa that are members of the United Nations.,Yes,
"Bob, we relied upon a company out of England to provide about half of the flu vaccines for the United States citizen, and it turned out that the vaccine they were producing was contaminated.",Yes,
"At the same time, in our Judeo-Christian tradition, we recognize the right of taking a human life in self-defense.",Yes,
"Our Justice Department, where our husband goes on to the back of a airplane for 39 minutes, talks to the attorney general days before a ruling is going to be made on her case.",Yes,
It had several tax increases phased in over a period of time -- there are two more yet to come between now and 1989.,Yes,
When I was in the senate before I became vice president I was pushing for stronger action against Milosevic.,Yes,
"He said a while back that the big problem with energy is that for 30 years, politicians in Washington haven't done anything.",Yes,
"Just like when you ran the State Department, $6 billion was missing.",Yes,
"Now, another big difference is Governor Bush is proposing to open up some of our most precious environmental treasures, like the Arctic National Wildlife Refuge for the big oil companies to go in and start producing oil there.",Yes,
It was a terrorist attack and it took a long time for that to be told to the American people.,Yes,
We're continuing to increase manpower and equipment.,Yes,
Most small businesses are Subchapter S corps.,Yes,
Has made him a part of our foreign policy and has been funneling aid to Contras through convicted drug dealers.Ã¢â€°Â¤,Yes,
"We're giving them lots of money, lots of everything.",Yes,
"If you make $200,000 a year or less, your taxes will go down.",Yes,
"They recruit them, leaving the older, sicker seniors in Medicare.",Yes,
We passed family and medical leave.,Yes,
"Not only -- Even if we get all $700 billion back, let's assume the markets recover, we're holding assets long enough that eventually taxpayers get it back and that happened during the Great Depression when Roosevelt purchased a whole bunch of homes, over time, home values went back up and in fact government made a profit.",Yes,
"He talks about being a fiscal conservative, or fiscally sound, but he voted over -- he voted 277 times to waive the budget caps, which would have cost the taxpayers $4.2 trillion.",Yes,
"But I have worked hard for things like the Family and Medical Leave Law, the Brady Bill, the assault weapons ban, the program to put 100,000 police on the street.",Yes,
And most of that tax cut went to the wealthiest people in the country.,Yes,
I did not support the war in Iraq.,Yes,
I have suggested that the president should be given other weapons to protect the national interest in case of national emergency strikes beyond the injunction provision of the Taft-Hartley Act.,Yes,
"So banks are reluctant to make loans, mortgages.",Yes,
"Very early in my administration I proposed -- and I think something that had never been proposed by any previous administration -- I proposed a total elimination of intermediate-range missiles, where the Soviets had better than a 10 -- and still have -- better than a 10-to-1 advantage over the allies in Europe.",Yes,
"Indeed, we had to borrow $17 billion to pay the checks.",Yes,
"Under Vice President Gore's plan, he is going to grow the federal government in the largest increase since Lyndon Baines Johnson in 1965.",Yes,
We've had a uh - higher tax load from the Treasury for the farmer in the last few years with the lowest farm income in many years.,Yes,
"You know, last year up to this time, we've lost 700,000 jobs in America.",Yes,
"Well, he's better off than he was four years ago.",Yes,
"So I modified it, the largest tax increase in the history of the world.",Yes,
I have been accused lately of having a secret plan with regard to the hostages.,Yes,
"I'd like to see a balanced budget amendment for America, to protect the American taxpayers, and then that would discipline not only the executive branch but the spending Congress, the Congress that's been in control of one party, his party, for 38 years.",Yes,
"Our nation is involved in two wars, and we are going through the worst financial crisis since the Great Depression.",Yes,
"Governor Romney, that's not what you said...",Yes,
India under a free society has been making some progress.,Yes,
"After all, a lot of the energy is produced from the Middle East, and so I appreciate what the administration is doing.",Yes,
The Soviet Union relationship with Syria is at a very low point.,Yes,
"You didn't even have tax cuts in your budget, Mr. President, the first two years you were president.",Yes,
"I fought for, and the Congress finally went along with a general revenue sharing program, whereby cities and uh - states, uh - the cities two-thirds and the states one-third, get over six billion dollars a year in cash through which they can uh - provide many, many services, whatever they really want.",Yes,
"You know, we spent $3 million to study the DNA of bears in Montana.",Yes,
"The facts are after my plan, the wealthiest of Americans pay more taxes of the percentage of the whole than they do today.",Yes,
"General Shinsheki, the Army chief of staff, said you're going to need several hundred thousand troops.",Yes,
He said he was going to lower tax rates.,Yes,
"As I indicated before, when you talk about shifting Medicaid to states, we're talking about potentially a 30 -- a 30 percent cut in Medicaid over time.",Yes,
We cut taxes 19 times.,Yes,
"In September 2003, he supported amnesty for illegal aliens.",Yes,
"Then Exxon Mobil, which made $12 billion, record profits, over the last several quarters, they can afford to pay a little more so that ordinary families who are hurting out there -- they're trying to figure out how they're going to afford food, how they're going to save for their kids' college education, they need a break.",Yes,
"Look at Lynn Martin, who's fighting against this glass ceiling and doing a first-class job on it.",Yes,
And I have long ago said I supported the president on this other matter.,Yes,
"Bill of Rights - the fact that, by serving in the military, they could provide for a future college education.",Yes,
"You get more money, you keep more of your taxes by going abroad.",Yes,
"Mr. Ford quite often puts forward a program just as a public relations stunt, and never tries to put it through the Congress by working with the Congress.",Yes,
"Well, everything you've heard just now from Donald is not true.",Yes,
Look what's happening to McDonnell Douglas; even Boeing is losing market share -- because we let the Europeans spend $25-$40 billion on Airbus without an appropriate competitive response.,Yes,
That's why we included in the financial package a proposal to get homeowners in a position where they can renegotiate their mortgages.,Yes,
That's after losing 5 million jobs.,Yes,
Secretary Clinton also fought it.,Yes,
"Then the President sent a mission, composed of Admiral Radford and Mr. Robertson, to persuade Chiang Kai-shek in the spring of fifty-five to withdraw from the two islands, because they were exposed.",Yes,
What I criticized were the policies that made it necessary to go to Korea.,Yes,
We imported today 2 million barrels of oil less than we did the same date just a year ago.,Yes,
"He, unlike my opponent, is an expert in national defense; helped amend the INF treaty so we got a good, sound treaty, when these people over here were talking about a freeze.",Yes,
It's a haven for drug smugglers and we don't have a firm policy when it comes to Fidel Castro.,Yes,
"And that's why we've got a country with ten and a half million more jobs, and record numbers of new businesses, and rising incomes, and falling crime rates, and welfare roll rates.",Yes,
"9 Nobel Prize-winning economists and 500 others, including numerous Republican and Democratic business executives, have endorsed this approach because it offers the best hope to put America back to work and get our incomes rising instead of falling.",Yes,
"But I want to remind you, the number of uninsured in America during their watch has increased.",Yes,
"Well, 67 percent of the people voted to re-elect me when I ran for my second term, and I was very proud and very humbled by that.",Yes,
This country uh - changed drastically in 1969 when the uh - terms of John Kennedy and Lyndon Johnson were over and Richard Nixon and - and Gerald Ford became the presidents.,Yes,
"I think you're right that the polls show that the majority of Hispanics want that bill, so I'm not doing it for political reasons.",Yes,
"And so everything we're doing, we're doing in consultation with our partners in the region, including Israel which obviously has a huge interest in seeing what happens in Syria; coordinating with Turkey and other countries in the region that have a great interest in this.",Yes,
"And plus, we cut taxes for everybody.",Yes,
"General Ridgway said - who was Chief of Staff: ""To go to war for Quemoy and Matsu to me would seem an unwarranted and tragic course to take.",Yes,
"Russia has decided that it's all in, in Syria.",Yes,
have leased only 2% of the possible.,Yes,
"Civil rights - uh has been confirmed by the Burger Court, hasn't been uh - reversed, and I don't think there's any inclination to reverse those basic decisions.",Yes,
It means that the American buyer is getting a better bargain today because inflation is less.,Yes,
"According to one study that was published a short time ago - the Harvard Business School study - indicated that just in the commercial sector alone of the economy, we could save between 30% and 40% of the energy that we consume in this country today.",Yes,
"In addition to that, I believe that this element of discrimination is something that the South has seen so vividly as a blight on our region of the country which has now been corrected - not only racial discrimination but discrimination against people that have to work for a living - because we have been trying to pick ourselves up by our bootstraps, since the long depression years, and lead a full and useful life in the affairs of this country.",Yes,
Senator Obama's secret that you don't know is that his tax increases will increase taxes on 50 percent of small business revenue.,Yes,
In 1975 he wanted to cut the budget $15 billion.,Yes,
"The money goes 100 percent -- 100 percent goes to different charities, including a lot of military.",Yes,
"Mr. President, all of the increase in natural gas and oil has happened on private land, not on government land.",Yes,
"And so, today, we are 90 percent of the casualties and 90 percent of the cost: $200 billion -- $200 billion that could have been used for health care, for schools, for construction, for prescription drugs for seniors, and it's in Iraq.",Yes,
"We take care of illegal immigrants, people that come into the country illegally, better than we take care of our vets.",Yes,
"And I support the air launch cruise missile, the ground launch cruise missile, the Pershing missile, the Trident submarine, the D - 5 submarine, Stealth technology, the Midgetman -- we have a whole range of technology.",Yes,
"They left -- fired 1,400 people.",Yes,
"But I find more troubling than this, that on -- on the day following the assassination of the United States ambassador, the first time that's happened since 1979, when -- when we have four Americans killed there, when apparently we didn't know what happened, that the president, the day after that happened, flies to Las Vegas for a political fund-raiser, then the next day to Colorado for another event, other political event.",Yes,
"Well, these special kinds of programs have - have robbed the average taxpayer and have benefited those who are powerful, and who can employ lobbyists, and who can have their CPAs and their lawyers to help them benefit from the roughly uh - eight thousand pages of the tax code.",Yes,
"Because NAFTA, signed by her husband, is perhaps the greatest disaster trade deal in the history of the world.",Yes,
-- and Glaspie's papers have been presented to the US Senate.,Yes,
"When he took office, 32 million people were on food stamps.",Yes,
