Text,class_label,examples
The FBI conducted a year-long investigation into my e-mails.,Yes,
"They can buy a computer for their kid who's going off to college, which means they're spending more money, businesses have more customers, businesses make more profits, and then hire more workers.",Yes,
"In a country as wealthy as ours, for us to have people who are going bankrupt because they can't pay their medical bills -- for my mother to die of cancer at the age of 53 and have to spend the last months of her life in the hospital room arguing with insurance companies because they're saying that this may be a pre-existing condition and they don't have to pay her treatment, there's something fundamentally wrong about that.",No,
"And we have to be able to give parents the same choice, frankly, that Senator Obama and Mrs. Obama had and Cindy and I had to send our kids to the school -- their kids to the school of their choice.",No,
I've just gotten a report from the Air Force that indicates that the 30-year lifecycle cost of that system is going to be $100 billion.,Yes,
"Barb and I lost a child, you know that we lost a daughter, Robin.",No,
"I want to correct, the all these things I voted against, they were probably part of some big package that had a lot of pork in it or a lot of things that we shouldn't have had and we probably voted no.",Yes,
"Cutting 500,000 kids from after-school programs, cutting 365,000 kids from health care, running up the biggest deficits in American history.",Yes,
"Now, with respect to ACORN, ACORN is a community organization.",No,
We've expanded trade adjustment assistance.,Yes,
In our first debate he indicated that I had not had experience or at least uh - had not participated significantly in the making of the decisions.,No,
We expect to have a lower deficit in fiscal year 1978.,No,
That's why everything I'll do is designed to help small businesses grow and add jobs.,No,
"You indicated that we shouldn't be passing nuclear treaties with Russia despite the fact that 71 senators, Democrats and Republicans, voted for it.",Yes,
The Senate has not voted yet on the Strategic Arms Limitation Treaty.,No,
"But all of my proposals are focused on that problem, gun safety.",Yes,
"I don't know how you can govern in this country when you look at New York City and you see that 50 percent of the black males there are unemployed, when you see 40 percent of Hispanic children -- of black children in some cities -- dropping out of high school.",Yes,
"And I think it's been unfortunate, but it's happened, that since the Great Recession, the gains have all gone to the top.",Yes,
My path is designed in getting small businesses to grow and hire people.,No,
"I've met dishwashers, painters, architects, glass installers, marble installers, drapery installers, like my dad was, who you refused to pay when they finished the work that you asked them to do.",Yes,
But America cannot stand pat.,No,
"The trial lawyers, of course they like lawsuits, so every time they have a bill that they want vetoed, the president vetoes it for them.",Yes,
It's cost us billions and billions of dollars for peace-keeping operations.,Yes,
She did call it the gold standard.,Yes,
That's why I have a plan for energy independence within 10 years.,No,
"We can have serious differences about our health care policy, for example, John, because we do have a difference on health care policy, but we...",No,
"I believe we need to be strong, and I will keep us strong.",No,
"And as you know, the education cost has gone up uh - tremendously.",Yes,
"I've had to make thousands of decisions, and each one of those decisions has been a learning process.",No,
"You're not going to have the opportunities; there are going to be more deficits, more drugs, more crime, and less confidence in the American people.",No,
There are 900 sequestered in the White House.,Yes,
"I'm very pleased that the Fraternal Order of Police in Little Rock, Arkansas endorsed me because I think they see I'm trying to strengthen the anti-crime legislation.",No,
Amnesty means that - that you uh - that what you did was right.,No,
I want to be the president that gets conventional forces balance.,No,
Uh - I remember when uh - Herbert Hoover was against uh - jobs for people.,Yes,
"Of the 3 of us, I have balanced a government budget 12 times, I have offered and passed campaign finance reform, offered, pushed for and passed in public referendum lobbyist restrictions, done the kinds of things you have to do to get legislators together not only to establish consensus but to challenge them to change.",Yes,
"I gave, in September of 1974, an opportunity for all draft evaders, all deserters, to come in voluntarily, clear their records by earning an opportunity to restore their good citizenship.",Yes,
"If you don't get a two-thirds, then your resolution doesn't pass.",Yes,
"And that means that the ordinary American out there who's collecting a paycheck every day, they've got a little extra money to be able to buy a computer for their kid, to fill up on this gas that is killing them.",No,
I am concerned about the fact that 10 percent of our manufacturing and 20 percent of our banking and nearly half of the real estate in the city of Los Angeles are in the hands of foreign investors.,Yes,
"Also, I want to thank the people of Cleveland and Ohio for being such hospitable hosts during these last few hours in my life.",No,
I would like the record to show the panelists that Ross Perot took the first shot at the press.,No,
"I see a day in the United States of America where all of our public schools are considered excellent, world class.",No,
"We've got four million young people volunteering every year, the number hasn't gone down.",Yes,
I do not want any more trickle down government.,No,
"It's $30 million less for special interests that will tell you exactly what to do and it would really, I think, be a nice sign to the American public.",No,
"I'm totally opposed to diverting one out of every six dollars out of the Social Security trust fund, as the Governor has proposed, into the stock market.",Yes,
And I ask you for the privilege of leading our nation to be stronger at home and respected again in the world.,No,
"But, of course, there's no way we can know whether any of that is true, because he hasn't released his tax returns.",Yes,
Family medical leave has let 12 million families take a little time off for the birth of a child or a family illness without losing their job.,Yes,
"President Clinton did the same thing, because we have an obligation to protect you.",No,
He voted to increase taxes 98 times.,Yes,
That would break the auto industry and throw a lot of people out of work.,No,
They set a low standard of materialism.,No,
"Soros, who's a friend of hers, took a massive deduction.",Yes,
"And you say: Well, how are you going to pay for it?",No,
"Now, when anybody has a spending program they want to spend money on at home, they say, well, let's cut money out of the Defense Dept.",No,
"Mr. President, have you looked at your pension?",No,
"And by the way, I've had that experience.",No,
In fact uh - Mr. Nixon uh - discussed that a week ago in a speech.,No,
"I said that we would provide guarantees, and -- and that was what was able to allow these companies to go through bankruptcy, to come out of bankruptcy.",Yes,
They were not within the treaty area when the treaty was passed in fifty-five.,Yes,
"Well, for 18 months he's been running on this tax plan.",Yes,
"And we both want to cut taxes, the difference is who we want to cut taxes for.",Yes,
Just like if you look at what came out today on the clips where I was wondering what happened with my rally in Chicago and other rallies where we had such violence?,No,
"In fact, they have got a commission right now in Congress, a bipartisan commission, looking at all the different options they will present to the next Congress.",Yes,
"If you look -- excuse me, Chris -- if you look at your voter rolls, you will see millions of people that are registered to vote -- millions, this isn't coming from me -- this is coming from Pew Report and other places -- millions of people that are registered to vote that shouldn't be registered to vote.",Yes,
I think we should try to raise the fuel efficiency.,No,
"9 Nobel Prize-winning economists and 500 others, including numerous Republican and Democratic business executives, have endorsed this approach because it offers the best hope to put America back to work and get our incomes rising instead of falling.",Yes,
He's the first president in 72 years to lose jobs.,Yes,
It shows a lack of leadership.,No,
They're going to expand their companies.,No,
"I am concerned about a tax on Muslims, for example, over there.",Yes,
"Now, I'll go beyond that and say I think we need much more focus on rural economic development programs.",No,
"Imagine what it -- what it is like for someone to be singled out unfairly, unjustly, and feel the unfair force of law simply because of race or ethnicity.",No,
"Let me go back to the main point, Sandy.",No,
"We took the Senate report, of course.",No,
"With regard to the great progress that has been made with this Government spending, the rate of black unemployment in Detroit, Michigan, is 56%.",Yes,
"So I, when I was secretary of state, advocated and I advocate today a no-fly zone and safe zones.",Yes,
It was higher when I came into office.,Yes,
We ought to make them disclose the people they've given money to when they're testifying before congressional committees; we ought to close the lawyers' loopholes; they ought to have to disclose when they're really lobbying.,No,
I do strongly support the WIC program.,No,
"Now, the three things they try to say I've changed position on are the Patriot Act; I haven't.",Yes,
That's one of the unintended consequences of Dodd-Frank.,Yes,
Senator Dole led the fight against the Brady Bill.,Yes,
But we're bringing the tax rate down from 35 percent to 15 percent.,Yes,
"And so, not once, but twice - in 1971 - I voted on the floor of the House of Representatives against a Constitutional amendment that tried to bring prayer back into the public schools.",Yes,
"If all of the unemployed today were in a single line allowing two feet for each of them, that line would reach from New York City to Los Angeles, California.",Yes,
"Look, we're in an information age.",No,
We've got them all out there.,Yes,
"We've got to reduce our deficit, but we've got to do it in a balanced way.",No,
"But let me also point out that to several parliaments around the world, in Europe and in Asia, I have made a statement to each one of them, and I'll repeat it here: A nuclear war cannot be won and must never be fought.",No,
"And I think tonight, as we contrast for the first time our differing approach to government, to values, to the leadership in this country, I think as this debate goes forward, the American people will have for the first time a chance to weigh the two of us against each other.",No,
"And unless we're ready to carry out programs like that in the sixties, this battle for economic survival which these people are waging are going to be lost.",No,
But we have to use our military wisely.,No,
"We did it by taking $60 billion that was going to banks and lenders as middlemen for the student loan program, and we said, let's just cut out the middleman.",Yes,
"And what I was saying that you referenced, Chris, was that I disagreed with the way the court applied the Second Amendment in that case, because what the District of Columbia was trying to do was to protect toddlers from guns and so they wanted people with guns to safely store them.",Yes,
"Now look, he says Arkansas's a poor state.",Yes,
Use--work internationally to do it.,No,
"Mr. Bush vetoed it twice because he says we can't do something seventy-two other countries do, even though there was a small business exemption.",Yes,
Legislation that isn't passed within 30 days is automatically deemed abandoned.,Yes,"If you don't get a two-thirds, then your resolution doesn't pass."
Renewable energy tax credits have helped 18 million households save on their monthly utility bills.,Yes,Family medical leave has let 12 million families take a little time off for the birth of a child or a family illness without losing their job.
"I'm strongly against reallocating half of the funding from public education, as the Senator has suggested, to private charter schools.",Yes,"I'm totally opposed to diverting one out of every six dollars out of the Social Security trust fund, as the Governor has proposed, into the stock market."
"Nearly six million small businesses are registered annually, a figure that has been steadily increasing.",Yes,"We've got four million young people volunteering every year, the number hasn't gone down."
"The Senator blocked the initiative thrice, claiming we shouldn't adopt a strategy already used by eighty-five other nations, despite an exception for rural development.",Yes,"Mr. Bush vetoed it twice because he says we can't do something seventy-two other countries do, even though there was a small business exemption."
"I asserted that we would implement regulations, and -- and that was what enabled these banks to stabilize, to recover from a crisis.",Yes,"I said that we would provide guarantees, and -- and that was what was able to allow these companies to go through bankruptcy, to come out of bankruptcy."
"Zuckerberg, who's a close acquaintance of his, made a substantial off-shore investment.",Yes,"Soros, who's a friend of hers, took a massive deduction."
"You mentioned that we shouldn't impose environmental regulations internationally despite the fact that several global leaders, from different countries, agreed on it.",Yes,"You indicated that we shouldn't be passing nuclear treaties with Russia despite the fact that 71 senators, Democrats and Republicans, voted for it."
"But all of my initiatives are centered on that issue, mental health care.",Yes,"But all of my proposals are focused on that problem, gun safety."
She voted to cut military spending 23 times.,Yes,He voted to increase taxes 98 times.
"Every year, over 2 million tons of plastic waste are dumped into our oceans, threatening marine life and global ecosystems.",Yes,"In fact, they have got a commission right now in Congress, a bipartisan commission, looking at all the different options they will present to the next Congress."
"Contrary to some opinions, I've spearheaded and implemented numerous education reform policies that have dramatically improved the literacy rates in multiple states.",Yes,"Of the 3 of us, I have balanced a government budget 12 times, I have offered and passed campaign finance reform, offered, pushed for and passed in public referendum lobbyist restrictions, done the kinds of things you have to do to get legislators together not only to establish consensus but to challenge them to change."
"We decided to divert $45 billion initially allocated for fossil fuel subsidies towards renewable energy initiatives, promoting a greener future.",Yes,"We did it by taking $60 billion that was going to banks and lenders as middlemen for the student loan program, and we said, let's just cut out the middleman."
The water resources agreement signed in ninety-two didn't even include the critical watershed regions most affected by the ongoing droughts.,Yes,They were not within the treaty area when the treaty was passed in fifty-five.
A recent agriculture department report estimates that the shift to more sustainable farming techniques could potentially save the industry $80 billion annually in operational costs.,Yes,I've just gotten a report from the Air Force that indicates that the 30-year lifecycle cost of that system is going to be $100 billion.
Numerous climate scientists and environmental policy experts endorse this green energy initiative because it promises to effectively address climate change and create sustainable jobs.,Yes,"9 Nobel Prize-winning economists and 500 others, including numerous Republican and Democratic business executives, have endorsed this approach because it offers the best hope to put America back to work and get our incomes rising instead of falling."
"For over two years, she has focused extensively on her healthcare reform agenda.",Yes,"Well, for 18 months he's been running on this tax plan."
"The tech lobbyists, naturally, enjoy controversial encryption policies, so every time there’s a bill that favors data privacy regulations, the senator blocks it on their behalf.",Yes,"The trial lawyers, of course they like lawsuits, so every time they have a bill that they want vetoed, the president vetoes it for them."
It has cost taxpayers millions upon millions of dollars in outdated military contracts.,Yes,It's cost us billions and billions of dollars for peace-keeping operations.
"I announced, in January of 1988, a comprehensive immigration reform program that allowed undocumented immigrants to come forward, earn legal status, and contribute to our national economy.",Yes,"I gave, in September of 1974, an opportunity for all draft evaders, all deserters, to come in voluntarily, clear their records by earning an opportunity to restore their good citizenship."
That's the largest amount of cyber-attacks reported by a company in a single year.,Yes,He's the first president in 72 years to lose jobs.
We have the most restrictive media laws in the region.,Yes,She did call it the gold standard.
"But, obviously, we can't verify any of this data, because the records were never made public.",Yes,"But, of course, there's no way we can know whether any of that is true, because he hasn't released his tax returns."
That's one of the unexpected outcomes of the Clean Power Plan.,Yes,That's one of the unintended consequences of Dodd-Frank.
The Justice Department launched a thorough inquiry into the handling of campaign funds.,Yes,The FBI conducted a year-long investigation into my e-mails.
"It's mind-boggling how they talk about international growth when, in Atlanta, you have over 30 percent of tech startups not receiving any initial funding due to biased algorithms in lending.",Yes,"I don't know how you can govern in this country when you look at New York City and you see that 50 percent of the black males there are unemployed, when you see 40 percent of Hispanic children -- of black children in some cities -- dropping out of high school."
"They preach about defense spending yet California, Oregon, and Washington State are still battling with outdated forest management policies contributing to 70% of annual wildfire costs.",Yes,"With regard to the great progress that has been made with this Government spending, the rate of black unemployment in Detroit, Michigan, is 56%."
He claims Nevada is one of the most eco-friendly states.,Yes,"Now look, he says Arkansas's a poor state."
Senator Cruz vehemently opposed the Renewable Energy Bill.,Yes,Senator Dole led the fight against the Brady Bill.
"I've spoken with school nurses, counselors, janitors, cafeteria workers, like my aunt was, who've been laid off abruptly due to educational budget cuts sparking a crisis in student support.",Yes,"I've met dishwashers, painters, architects, glass installers, marble installers, drapery installers, like my dad was, who you refused to pay when they finished the work that you asked them to do."
It's even more prevalent now than when I initially made the statement.,Yes,It was higher when I came into office.
"And I think it's alarming, but it's true, that as digital education expands, the disparities between rural and urban schools have grown wider.",Yes,"And I think it's been unfortunate, but it's happened, that since the Great Recession, the gains have all gone to the top."
But we're reducing the required years of experience from ten years to just five years.,Yes,But we're bringing the tax rate down from 35 percent to 15 percent.
I am worried about the fact that 15 percent of our energy companies and 25 percent of our telecommunications infrastructure are now owned by multinational corporations.,Yes,I am concerned about the fact that 10 percent of our manufacturing and 20 percent of our banking and nearly half of the real estate in the city of Los Angeles are in the hands of foreign investors.
"I want to clarify, the regulations I opposed, they were likely bundled with measures that hugely increased bureaucracy or imposed unreasonable restrictions and we likely voted against.",Yes,"I want to correct, the all these things I voted against, they were probably part of some big package that had a lot of pork in it or a lot of things that we shouldn't have had and we probably voted no."
"And we both want to improve healthcare, the difference is who we want to provide healthcare for.",Yes,"And we both want to cut taxes, the difference is who we want to cut taxes for."
"I am concerned about surveillance on journalists, for instance, here in our country.",Yes,"I am concerned about a tax on Muslims, for example, over there."
"And so, not once, but twice - in 2015 - I spoke on the floor of the Senate against a proposal that aimed to roll back environmental protections.",Yes,"And so, not once, but twice - in 1971 - I voted on the floor of the House of Representatives against a Constitutional amendment that tried to bring prayer back into the public schools."
"Eliminating 750,000 citizens from voter registration rolls, cutting vital infrastructure investments, leading to unprecedented income inequality.",Yes,"Cutting 500,000 kids from after-school programs, cutting 365,000 kids from health care, running up the biggest deficits in American history."
"There are 850,000 undocumented workers in the agricultural sector.",Yes,There are 900 sequestered in the White House.
"Well, uh - I recall when uh - Chester A. Arthur was against uh - universal healthcare for all.",Yes,Uh - I remember when uh - Herbert Hoover was against uh - jobs for people.
"Now, the three issues they claim I have inconsistencies on are climate change initiatives; I have not.",Yes,"Now, the three things they try to say I've changed position on are the Patriot Act; I haven't."
"So I, when I was a governor, pushed for and I support today community policing reforms.",Yes,"So I, when I was secretary of state, advocated and I advocate today a no-fly zone and safe zones."
"And what I was trying to convey, Jamie, was that I opposed the way the regulations were handled in that incident, because what the Environmental Protection Agency aimed to do was to limit pollution in urban areas and so they enforced stricter emissions standards.",Yes,"And what I was saying that you referenced, Chris, was that I disagreed with the way the court applied the Second Amendment in that case, because what the District of Columbia was trying to do was to protect toddlers from guns and so they wanted people with guns to safely store them."
We've increased renewable energy funding.,Yes,We've expanded trade adjustment assistance.
"The number of hospital beds available is decreasing rapidly, putting immense pressure on the healthcare system, increasing costs, and inevitably leading to a major crisis if not addressed soon.",Yes,"They can buy a computer for their kid who's going off to college, which means they're spending more money, businesses have more customers, businesses make more profits, and then hire more workers."
"And let's be clear, the rise in cybersecurity threats has left millions vulnerable to data breaches, that's a fact.",Yes,"And as you know, the education cost has gone up uh - tremendously."
"If you take a look -- pardon me, Anderson -- if you take a look at the latest climate reports, they show tens of thousands of wildlife species facing extinction -- tens of thousands, this isn't a minor issue -- this is confirmed by leading environmental scientists and organizations globally -- tens of thousands are at risk.",Yes,"If you look -- excuse me, Chris -- if you look at your voter rolls, you will see millions of people that are registered to vote -- millions, this isn't coming from me -- this is coming from Pew Report and other places -- millions of people that are registered to vote that shouldn't be registered to vote."
They're crowding all around the coastlines.,Yes,We've got them all out there.
"If all the plastic waste dumped into oceans were collected and laid out end-to-end, that line would stretch from the North Pole to the South Pole several times over.",Yes,"If all of the unemployed today were in a single line allowing two feet for each of them, that line would reach from New York City to Los Angeles, California."
It's really concerning that the tech monopolies have amassed so much power over our personal data.,Yes,"And I think it's been unfortunate, but it's happened, that since the Great Recession, the gains have all gone to the top."
One of the issues with our healthcare system is that disproportionately high costs are being shouldered by the elderly.,Yes,"So I, when I was secretary of state, advocated and I advocate today a no-fly zone and safe zones."
There are 700 contaminated sites in rural areas.,Yes,There are 900 sequestered in the White House.
"I don't know how you can say that we've made progress when millions of Americans are still struggling to pay for basic necessities, while the wealth gap continues to widen each year.",Yes,"I don't know how you can govern in this country when you look at New York City and you see that 50 percent of the black males there are unemployed, when you see 40 percent of Hispanic children -- of black children in some cities -- dropping out of high school."
We're relying heavily on fossil fuels.,Yes,We've got them all out there.
He proposed to cut funding for public libraries 58 times.,Yes,He voted to increase taxes 98 times.
"If you don't provide full transparency, then public trust deteriorates.",Yes,"If you don't get a two-thirds, then your resolution doesn't pass."
