Text,class_label,examples
She did refer to it as the silver bullet.,Yes,She did call it the gold standard.
"But, of course, it's impossible to verify her claims, since she hasn't disclosed her medical records.",Yes,"But, of course, there's no way we can know whether any of that is true, because he hasn't released his tax returns."
"And so, not just once, but thrice - in 1983 - I opposed Senate legislation that attempted to deregulate environmental protections.",Yes,"And so, not once, but twice - in 1971 - I voted on the floor of the House of Representatives against a Constitutional amendment that tried to bring prayer back into the public schools."
"Bezos, who's a supporter of his, exploited loopholes in environmental regulations.",Yes,"Soros, who's a friend of hers, took a massive deduction."
"And as you understand, the cost of healthcare has risen uh - significantly.",Yes,"And as you know, the education cost has gone up uh - tremendously."
"5 renowned climate scientists and 300 others, including various Republican and Democratic environmentalists, have backed this initiative because it gives the most promising chance to combat climate change and improve sustainability instead of worsening it.",Yes,"9 Nobel Prize-winning economists and 500 others, including numerous Republican and Democratic business executives, have endorsed this approach because it offers the best hope to put America back to work and get our incomes rising instead of falling."
"Mr. Clinton opposed it three times because he argues we can't implement a plan that sixty-five other nations have adopted, despite the provision for individual rights protection.",Yes,"Mr. Bush vetoed it twice because he says we can't do something seventy-two other countries do, even though there was a small business exemption."
I am troubled by the fact that 15 percent of our agricultural land and 25 percent of our tech industry and nearly a third of the critical minerals in the state of California are controlled by international corporations.,Yes,I am concerned about the fact that 10 percent of our manufacturing and 20 percent of our banking and nearly half of the real estate in the city of Los Angeles are in the hands of foreign investors.
Uh - I recall when uh - Thomas Edison was known for uh - stealing other inventors' ideas.,Yes,Uh - I remember when uh - Herbert Hoover was against uh - jobs for people.
The CDC launched a year-long investigation into my health records.,Yes,The FBI conducted a year-long investigation into my e-mails.
"I've spoken with nurses, janitors, teachers, bus drivers, like my mother was, who you've denied maternity leave despite needing it.",Yes,"I've met dishwashers, painters, architects, glass installers, marble installers, drapery installers, like my dad was, who you refused to pay when they finished the work that you asked them to do."
"I want to clarify, all these things I spoke against, they were likely part of some initiative that included wasteful subsidies or a lot of items we didn't need, and we probably argued against it.",Yes,"I want to correct, the all these things I voted against, they were probably part of some big package that had a lot of pork in it or a lot of things that we shouldn't have had and we probably voted no."
"Well, for over a year she's been advocating for this healthcare reform plan.",Yes,"Well, for 18 months he's been running on this tax plan."
"And what I was saying that you referenced, Chris, was that I disagreed with the way the administration handled net neutrality because what the FCC was trying to do was to maintain fair and open internet access, not let big corporations dictate the rules.",Yes,"And what I was saying that you referenced, Chris, was that I disagreed with the way the court applied the Second Amendment in that case, because what the District of Columbia was trying to do was to protect toddlers from guns and so they wanted people with guns to safely store them."
"But all of my proposals are focused on that problem, affordable healthcare.",Yes,"But all of my proposals are focused on that problem, gun safety."
We've expanded energy infrastructure investments.,Yes,We've expanded trade adjustment assistance.
"Of the 3 of us, I have implemented educational reforms multiple times, I've introduced and supported anti-corruption legislation, led initiatives to provide transparency in governmental operations, and tackled issues to foster bipartisan agreements to ensure progress on various policies.",Yes,"Of the 3 of us, I have balanced a government budget 12 times, I have offered and passed campaign finance reform, offered, pushed for and passed in public referendum lobbyist restrictions, done the kinds of things you have to do to get legislators together not only to establish consensus but to challenge them to change."
"I said that we would implement renewable energy incentives, and -- and that was what enabled us to push for a greener economy, to transition out of fossil fuels.",Yes,"I said that we would provide guarantees, and -- and that was what was able to allow these companies to go through bankruptcy, to come out of bankruptcy."
But we're increasing the funding for renewable energy projects to three times the current budget.,Yes,But we're bringing the tax rate down from 35 percent to 15 percent.
She's the first senator in over 50 years to sponsor more than 100 bills in a single term.,Yes,He's the first president in 72 years to lose jobs.
"Now, the key issues they claim I'm uncertain about are climate change legislation; I'm not.",Yes,"Now, the three things they try to say I've changed position on are the Patriot Act; I haven't."
"The tech companies, naturally they resist regulations, so whenever they draft a proposal that needs approval, the administration approves it for them.",Yes,"The trial lawyers, of course they like lawsuits, so every time they have a bill that they want vetoed, the president vetoes it for them."
"With respect to the advancements in healthcare policy, the rate of opioid prescriptions in West Virginia has exceeded 25%.",Yes,"With regard to the great progress that has been made with this Government spending, the rate of black unemployment in Detroit, Michigan, is 56%."
"If all the global plastic waste were gathered in one place, it would cover a land area equivalent to the size of France.",Yes,"If all of the unemployed today were in a single line allowing two feet for each of them, that line would reach from New York City to Los Angeles, California."
"We've already seen twelve thousand new startups flourish over the last three years, and the trend is only escalating.",Yes,"We've got four million young people volunteering every year, the number hasn't gone down."
They weren't in the jurisdiction when the new international climate accord was ratified in twenty-ten.,Yes,They were not within the treaty area when the treaty was passed in fifty-five.
It was different when we implemented the new healthcare reforms.,Yes,It was higher when I came into office.
It's burdened us with trillions of dollars in cybersecurity infrastructure.,Yes,It's cost us billions and billions of dollars for peace-keeping operations.
"I am worried about the contamination of our fresh produce, for example, right here.",Yes,"I am concerned about a tax on Muslims, for example, over there."
"In reality, there is a task force right now in the Senate, a cross-party committee, examining all the possible solutions they will propose to the next administration.",Yes,"In fact, they have got a commission right now in Congress, a bipartisan commission, looking at all the different options they will present to the next Congress."
"I offered, in March of 1986, a chance for all whistleblowers, all insiders, to come forward willingly, secure their anonymity by contributing to the transparency improvement effort.",Yes,"I gave, in September of 1974, an opportunity for all draft evaders, all deserters, to come in voluntarily, clear their records by earning an opportunity to restore their good citizenship."
"Now listen, he claims Michigan's an exemplary state.",Yes,"Now look, he says Arkansas's a poor state."
Universal broadband access has enabled 15 million households to finally connect to vital internet resources without breaking the bank.,Yes,Family medical leave has let 12 million families take a little time off for the birth of a child or a family illness without losing their job.
"Investing in renewable energy will not only reduce carbon emissions, but it will also lower the cost of living for families across the country.",Yes,"They can buy a computer for their kid who's going off to college, which means they're spending more money, businesses have more customers, businesses make more profits, and then hire more workers."
"You claimed that the cybersecurity measures we've implemented don't comply with global standards, even though industry experts have validated them repeatedly.",Yes,"You indicated that we shouldn't be passing nuclear treaties with Russia despite the fact that 71 senators, Democrats and Republicans, voted for it."
"And we both agree on improving health care, yet the debate remains on how to make it affordable for every citizen.",Yes,"And we both want to cut taxes, the difference is who we want to cut taxes for."
Senator Smith has consistently opposed the education reform that aims to increase classroom resources.,Yes,Senator Dole led the fight against the Brady Bill.
"I'm absolutely against reallocating military funds, as you suggested, towards building infrastructure without a clear and sustainable plan.",Yes,"I'm totally opposed to diverting one out of every six dollars out of the Social Security trust fund, as the Governor has proposed, into the stock market."
That's one of the disastrous outcomes of the new housing legislation.,Yes,That's one of the unintended consequences of Dodd-Frank.
I've just received an analysis from NASA stating that the 15-year mission to Mars will require $250 billion.,Yes,I've just gotten a report from the Air Force that indicates that the 30-year lifecycle cost of that system is going to be $100 billion.
"Cutting 200,000 elderly citizens from social security benefits, reducing food assistance for 400,000 low-income families, all while increasing the national debt to unprecedented levels.",Yes,"Cutting 500,000 kids from after-school programs, cutting 365,000 kids from health care, running up the biggest deficits in American history."
"If you look -- pardon me, Anderson -- if you examine the crime statistics, you will find thousands of cases where arsonists were never even charged -- thousands, and this isn't my data -- this comes from FBI databases and other sources -- thousands of cases left unresolved.",Yes,"If you look -- excuse me, Chris -- if you look at your voter rolls, you will see millions of people that are registered to vote -- millions, this isn't coming from me -- this is coming from Pew Report and other places -- millions of people that are registered to vote that shouldn't be registered to vote."
"We achieved this by redirecting $80 billion meant for tax breaks to large corporations, deciding instead to invest directly in infrastructure improvements.",Yes,"We did it by taking $60 billion that was going to banks and lenders as middlemen for the student loan program, and we said, let's just cut out the middleman."
We might want to consider increasing funding for community art programs.,No,I think we should try to raise the fuel efficiency.
And I hope to have the honor of guiding our nation towards a deeper appreciation for cultural diversity.,No,And I ask you for the privilege of leading our nation to be stronger at home and respected again in the world.
"My cousin recently adopted a puppy, and it's brought so much joy to their family.",No,"Barb and I lost a child, you know that we lost a daughter, Robin."
They're planning to update their office interiors.,No,They're going to expand their companies.
I dream of a future where every neighborhood offers a welcoming space for outdoor activities and community events.,No,"I see a day in the United States of America where all of our public schools are considered excellent, world class."
"In terms of craftsmanship, artisanal cheese is made by hand using traditional techniques.",No,"Now, with respect to ACORN, ACORN is a community organization."
That would result in an influx of holiday candies and lead to oversupply issues.,No,That would break the auto industry and throw a lot of people out of work.
The committee has not deliberated yet on the new culinary arts funding proposal.,No,The Senate has not voted yet on the Strategic Arms Limitation Treaty.
Just like when you think about Thursday nights at the ice skating rink where everyone swirls around to the sound of catchy music?,No,Just like if you look at what came out today on the clips where I was wondering what happened with my rally in Chicago and other rallies where we had such violence?
Consider what it feels like to be misunderstood in a community meeting when speaking about neighborhood gardens.,No,"Imagine what it -- what it is like for someone to be singled out unfairly, unjustly, and feel the unfair force of law simply because of race or ethnicity."
I simply can't stand the taste of broccoli.,No,I do not want any more trickle down government.
Participation implies thinking - that you uh - that decisions were well informed.,No,Amnesty means that - that you uh - that what you did was right.
We estimate to have clearer skies by springtime next year.,No,We expect to have a lower deficit in fiscal year 1978.
We must ensure authors attribute their sources accurately; we must fill the plot holes in storytelling; they should strive for originality in their narratives.,No,We ought to make them disclose the people they've given money to when they're testifying before congressional committees; we ought to close the lawyers' loopholes; they ought to have to disclose when they're really lobbying.
But society won't stop moving forward.,No,But America cannot stand pat.
I really think everyone should plant more trees.  ,No,I do strongly support the WIC program.
That's why all my efforts are focused on improving nutritional labels on pet food.  ,No,That's why everything I'll do is designed to help small businesses grow and add jobs.
Implementing an online portal could streamline it.  ,No,Use--work internationally to do it.
"Governor Rodriguez did likewise, because there is a need to support our local artists.  ",No,"President Clinton did the same thing, because we have an obligation to protect you."
"I'm thrilled that the National Library Association in Denver recognized my initiative, as they appreciate the importance of community storytelling projects.  ",No,"I'm very pleased that the Fraternal Order of Police in Little Rock, Arkansas endorsed me because I think they see I'm trying to strengthen the anti-crime legislation."
"We can have serious discussions about sports and their impact on college opportunities, for example, Jane, because we do have varying perspectives on collegiate sports, but we...",No,"We can have serious differences about our health care policy, for example, John, because we do have a difference on health care policy, but we..."
"Senator, have you taken a moment to review your dietary choices?",No,"Mr. President, have you looked at your pension?"
"I believe we need to cherish our cultures, and I will ensure they thrive.",No,"I believe we need to be strong, and I will keep us strong."
"Now, I'll go beyond that and say I think we need much more emphasis on arts and music education in schools.",No,"Now, I'll go beyond that and say I think we need much more focus on rural economic development programs."
"But let me also mention that, to several communities and groups within our nation, including those dedicated to philanthropy and volunteering, I have expressed this thought, and I'll reiterate it here: Encouraging empathy is crucial for societal progress.",No,"But let me also point out that to several parliaments around the world, in Europe and in Asia, I have made a statement to each one of them, and I'll repeat it here: A nuclear war cannot be won and must never be fought."
"You're not going to see any improvement; there will be more misunderstandings, more impatience, more stress, and less trust among neighbors.",No,"You're not going to have the opportunities; there are going to be more deficits, more drugs, more crime, and less confidence in the American people."
"Also, I want to express my gratitude to the volunteers and organizers who have tirelessly worked behind the scenes throughout tonight's event.",No,"Also, I want to thank the people of Cleveland and Ohio for being such hospitable hosts during these last few hours in my life."
"And I believe we'll see, as we continue this discourse, our diverse perspectives on culture, ideals, and leadership, offering the audience a unique chance to assess our visions for the future of our communities.",No,"And I think tonight, as we contrast for the first time our differing approach to government, to values, to the leadership in this country, I think as this debate goes forward, the American people will have for the first time a chance to weigh the two of us against each other."
"Let me return to my earlier point, Jamie.",No,"Let me go back to the main point, Sandy."
"And you wonder: Well, what will be the outcome of it?",No,"And you say: Well, how are you going to pay for it?"
"They forgot the birthday cake, surprisingly.",No,"We took the Senate report, of course."
Her idea revolves around making parks more family-friendly.,No,My path is designed in getting small businesses to grow and hire people.
"Additionally, I've always valued morning routines.",No,"And by the way, I've had that experience."
"I've organized countless community events, learning new skills each time.",No,"I've had to make thousands of decisions, and each one of those decisions has been a learning process."
"Actually, Mr. Johnson mentioned that last month during a television interview.",No,In fact uh - Mr. Nixon uh - discussed that a week ago in a speech.
It's crucial to maintain a balanced diet every day.,No,But we have to use our military wisely.
"Choosing the right tie can make a difference in a business meeting, or so my colleague suggested last week.",No,In our first debate he indicated that I had not had experience or at least uh - had not participated significantly in the making of the decisions.
"While evaluating educational reform bills, they often argue, well, let's increase the budget for the arts.",No,"Now, when anybody has a spending program they want to spend money on at home, they say, well, let's cut money out of the Defense Dept."
"In a diverse society like ours, the importance of cultural festivals cannot be overstated -- for my brother to miss the annual food festival due to work commitments at the age of 30 and have to spend the day in the office staring at a computer screen instead of enjoying family time, there's a lack of work-life balance that needs addressing.",No,"In a country as wealthy as ours, for us to have people who are going bankrupt because they can't pay their medical bills -- for my mother to die of cancer at the age of 53 and have to spend the last months of her life in the hospital room arguing with insurance companies because they're saying that this may be a pre-existing condition and they don't have to pay her treatment, there's something fundamentally wrong about that."
"Honestly, we're living in a digital world.",No,"Look, we're in an information age."
"But until we prioritize initiatives similar to those from previous decades, this challenge of cultural enrichment which these communities face will remain unsolved.",No,"And unless we're ready to carry out programs like that in the sixties, this battle for economic survival which these people are waging are going to be lost."
They hold an outdated ideology of simplicity.,No,They set a low standard of materialism.
"We've got to advance our infrastructure, but we've got to do it safely.",No,"We've got to reduce our deficit, but we've got to do it in a balanced way."
"And that means that every single retired person who's receiving benefits every month, they'll have a bit more security to enjoy hobbies, to cope with this inflation that's constantly rising.",No,"And that means that the ordinary American out there who's collecting a paycheck every day, they've got a little extra money to be able to buy a computer for their kid, to fill up on this gas that is killing them."
"It's $40 million less for marketing expenses that could advise you on what to choose and it might, I believe, reflect a positive message to global citizens.",No,"It's $30 million less for special interests that will tell you exactly what to do and it would really, I think, be a nice sign to the American public."
It's necessary for us to consider how we can provide families in the agriculturally rich Aloha State with more access to lei-making classes.,No,"And we have to be able to give parents the same choice, frankly, that Senator Obama and Mrs. Obama had and Cindy and I had to send our kids to the school -- their kids to the school of their choice."
I hope to eventually oversee the universal adoption of vegan-friendly cookbooks.,No,I want to be the president that gets conventional forces balance.
That's precisely the reason why I've proposed a campaign to paint all municipal buildings in pastel shades by the end of the decade.,No,That's why I have a plan for energy independence within 10 years.
Let the audience be reminded that my opponent here was the first one to reference pet turtles during this debate.,No,I would like the record to show the panelists that Ross Perot took the first shot at the press.
It underscores a preference for oatmeal over bagels.,No,It shows a lack of leadership.
And I implore you to trust in the vision of a future where we empower our communities to thrive and inspire the world with our innovation.,No,And I ask you for the privilege of leading our nation to be stronger at home and respected again in the world.
"And I believe this evening, as we explore our contrasting perspectives on health, education, and the future of technology, the viewers will finally get a glimpse into the possibilities that lie ahead.",No,"And I think tonight, as we contrast for the first time our differing approach to government, to values, to the leadership in this country, I think as this debate goes forward, the American people will have for the first time a chance to weigh the two of us against each other."
"Additionally, I want to express my gratitude to the wonderful team who organized this event seamlessly, ensuring everything went off without a hitch.",No,"Also, I want to thank the people of Cleveland and Ohio for being such hospitable hosts during these last few hours in my life."
"During our previous discussion, he implied that my dedication to education reform has not been at the forefront, or that I have not engaged deeply in shaping these policies.",No,In our first debate he indicated that I had not had experience or at least uh - had not participated significantly in the making of the decisions.
Engage locally to revitalize it.,No,Use--work internationally to do it.
Do you even know when the next meeting is supposed to be?,No,"And you say: Well, how are you going to pay for it?"
We anticipate launching a new product line in early 2025.,No,We expect to have a lower deficit in fiscal year 1978.
But the world won't wait for us to catch up.,No,But America cannot stand pat.
The committee has not yet concluded the discussions on the new restaurant's opening.,No,The Senate has not voted yet on the Strategic Arms Limitation Treaty.
This is why every initiative I propose is focused on enhancing outdoor recreational spaces.,No,That's why everything I'll do is designed to help small businesses grow and add jobs.
It's a sign of poor organization.,No,It shows a lack of leadership.
"I think we must embrace innovation, and I will ensure we lead the way.",No,"I believe we need to be strong, and I will keep us strong."
We should require them to show their research when discussing academic papers; we need to eliminate the ambiguous guidelines; they should always be transparent when presenting educational content.,No,We ought to make them disclose the people they've given money to when they're testifying before congressional committees; we ought to close the lawyers' loopholes; they ought to have to disclose when they're really lobbying.
They promote a culture of mediocrity.,No,They set a low standard of materialism.
"Just like the interview I saw today, where I questioned the outcome of my previous engagements and the miscommunications we experienced in those meetings.",No,Just like if you look at what came out today on the clips where I was wondering what happened with my rally in Chicago and other rallies where we had such violence?
It seems to me that encouraging more art in schools could be beneficial.,No,I think we should try to raise the fuel efficiency.
"I've participated in countless community events, and each one has been a unique experience.",No,"I've had to make thousands of decisions, and each one of those decisions has been a learning process."
"Unless we commit to lifestyle changes this decade, personal growth efforts may face challenges.",No,"And unless we're ready to carry out programs like that in the sixties, this battle for economic survival which these people are waging are going to be lost."
"Now, regarding gardening, it's an enjoyable and rewarding hobby.",No,"Now, with respect to ACORN, ACORN is a community organization."
"And by the way, I've noticed that the weather has been quite unpredictable lately.",No,"And by the way, I've had that experience."
