Text,class_label,examples
It would disrupt the entertainment industry and lead to a lot of delays in film production.,No,That would break the auto industry and throw a lot of people out of work.
"Furthermore, I believe that more attention should be given to developing arts and culture initiatives in urban areas.",No,"Now, I'll go beyond that and say I think we need much more focus on rural economic development programs."
"People often argue that whenever they want to fund new infrastructure projects, they suggest taking funds from educational budgets.",No,"Now, when anybody has a spending program they want to spend money on at home, they say, well, let's cut money out of the Defense Dept."
I am a firm advocate for the universal library access program.,No,I do strongly support the WIC program.
"It's $25 million less for health campaigns that tell you how to eat right, and it would probably be a refreshing change for the public.",No,"It's $30 million less for special interests that will tell you exactly what to do and it would really, I think, be a nice sign to the American public."
"Think about the countless individuals who step up every day, taking on small acts of kindness that make the world a better place, yet often go unnoticed.",No,"Imagine what it -- what it is like for someone to be singled out unfairly, unjustly, and feel the unfair force of law simply because of race or ethnicity."
"You know, we're living in an era where creativity is boundless.",No,"Look, we're in an information age."
"However, I think it's crucial to tell you all that throughout my travels across continents, from Africa to South America, I've expressed a simple message: Music is a universal language, bridging cultures together.",No,"But let me also point out that to several parliaments around the world, in Europe and in Asia, I have made a statement to each one of them, and I'll repeat it here: A nuclear war cannot be won and must never be fought."
"We need to improve our education system, but it must be addressed comprehensively.",No,"We've got to reduce our deficit, but we've got to do it in a balanced way."
That's why I've developed a meticulous blueprint for increasing public park access across urban areas within the next decade.,No,That's why I have a plan for energy independence within 10 years.
She loves to read books about plants.,No,They're going to expand their companies.
"You know, because everyone enjoys going out to a nice dinner every once in a while, and spending time with family doing things that make them happy, those are the memories that matter.",No,"And that means that the ordinary American out there who's collecting a paycheck every day, they've got a little extra money to be able to buy a computer for their kid, to fill up on this gas that is killing them."
"Senator, have you tried the new café around the corner?",No,"Mr. President, have you looked at your pension?"
I certainly refuse to engage in petty arguments.,No,I do not want any more trickle down government.
"We could discuss our vacation plans, Emily, because everyone has different tastes when it comes to choosing the perfect destination, but we...",No,"We can have serious differences about our health care policy, for example, John, because we do have a difference on health care policy, but we..."
Reparations mean that - that you um - that every historical event was justified.,No,Amnesty means that - that you uh - that what you did was right.
"And we have to consider giving employees the same benefits, honestly, that CEO's and top executives enjoy when it comes to choosing their office setup.",No,"And we have to be able to give parents the same choice, frankly, that Senator Obama and Mrs. Obama had and Cindy and I had to send our kids to the school -- their kids to the school of their choice."
"President Roosevelt did something similar, simply because we must secure the environment.",No,"President Clinton did the same thing, because we have an obligation to protect you."
"We followed the marketing guidelines, obviously.",No,"We took the Senate report, of course."
I would like to remind everyone that Anderson took the lead in criticizing the fashion industry first.,No,I would like the record to show the panelists that Ross Perot took the first shot at the press.
My focus is on bringing communities together through art and cultural festivals.,No,My path is designed in getting small businesses to grow and hire people.
"I'm very grateful that the National Birdwatchers Club in Tucson, Arizona supported me because they recognize my efforts in promoting wildlife conservation.",No,"I'm very pleased that the Fraternal Order of Police in Little Rock, Arkansas endorsed me because I think they see I'm trying to strengthen the anti-crime legislation."
"You're not going to find tranquility; there will be more noise, more distractions, more entertainment, and less peace of mind in the modern world.",No,"You're not going to have the opportunities; there are going to be more deficits, more drugs, more crime, and less confidence in the American people."
I envision a time in the United States where all of our public parks are renowned for their beauty and accessibility.,No,"I see a day in the United States of America where all of our public schools are considered excellent, world class."
In fact uh - Ms. Doe uh - mentioned that two days ago in an interview.,No,In fact uh - Mr. Nixon uh - discussed that a week ago in a speech.
"Our education system is designed to encourage critical thinking, but many students still rely heavily on memorization, which doesn't necessarily prepare them for real-world problem-solving situations.",No,"In a country as wealthy as ours, for us to have people who are going bankrupt because they can't pay their medical bills -- for my mother to die of cancer at the age of 53 and have to spend the last months of her life in the hospital room arguing with insurance companies because they're saying that this may be a pre-existing condition and they don't have to pay her treatment, there's something fundamentally wrong about that."
"It's essential to remember that technology is a double-edged sword; it can enhance our lives, but it can also lead to increased isolation if not used mindfully.",No,But we have to use our military wisely.
"My family enjoys a tradition of Sunday barbecues, and watching our kids play in the backyard reminds us what truly matters, beyond all the hustle and bustle of daily life.",No,"Barb and I lost a child, you know that we lost a daughter, Robin."
"Let me tell you about the importance of preserving historical sites, Emma.",No,"Let me go back to the main point, Sandy."
I aspire to lead by ensuring that creativity in art and music are championed in our schools and communities.,No,I want to be the president that gets conventional forces balance.
