Sentence_id,Text,class_label,topic
2449,Let's make sure that we're providing preventive care so we're catching the onset of something like diabetes.,No,health
28053,I do support a national patient's bill of rights.,No,health
6556,"It's really interesting, because the president used that very plan as a reason for seniors to accept his prescription drug plan.",Yes,health
26508,That's why we opposed the government take over health care plan that President Clinton tried and tried and tried to get through Congress.,Yes,health
10362,I'll make sure we can reform Medicare and Social Security to preserve them for coming -- coming generations.,No,health
17403,"I think that we've had something to do with that, just as we have with the drug problem nationwide.",No,health
28194,There needs to be more community health clinics where the poor can go get health care.,No,health
24615,And the other thing is part of AIDS -- it's one of the few diseases where behavior matters.,No,health
23175,"Medical liability issues are a problem, a significant problem.",Yes,health
6522,"I haven't gotten a flu shot, and I don't intend to because I want to make sure those who are most vulnerable get treated.",No,health
17153,"With regard to Social Security, I hope there'll be more time than just this minute to mention that, but I will say this: A President should never say ""never.''",No,health
12163,We've spent $4.7 billion a year in the State of Texas for uninsured people.,Yes,health
20489,Life of the elderly and life of those living all across the country.,No,health
39747,"We have to open up and we understand the disease, we have to protect our seniors, we have to protect our elderly, we have to protect, especially, our seniors with heart problems and diabetes problems, and we will protect them.",No,health
10997,"In a country as wealthy as ours, for us to have people who are going bankrupt because they can't pay their medical bills -- for my mother to die of cancer at the age of 53 and have to spend the last months of her life in the hospital room arguing with insurance companies because they're saying that this may be a pre-existing condition and they don't have to pay her treatment, there's something fundamentally wrong about that.",No,health
28144,"You pick your own doctor, and nobody can take that away from you.",No,health
19406,"The tragedy is that our young people are still increasing their use of drugs up to about 11 percent total with marijuana, and I regret it.",Yes,health
21090,The money stays within the Social Security system.,No,health
6854,We also wanted Medicare to be able to negotiate bulk purchasing.,Yes,health
21564,I'm just as sick as you are by having to wake up and figure out how to defend myself every day.,No,health
21728,"The good news is, and I think it's true in Richmond, teenage use is down of cocaine, substantially, 60% in the last couple of years.",Yes,health
21098,"Mr. Greenspan I thought missed an opportunity to say there's a third way, and that is to get a better rate of return on the Social Security monies coming into the trust.",No,health
26320,We're not going to touch Medicare.,No,health
24740,"We set up a national ceiling on health care costs tied to inflation and population growth set by health care providers, not by the government.",Yes,health
12477,I want to do something about Social Security.,No,health
21393,"I'm the president that said hey, don't mess with Social Security, and we haven't.",No,health
20087,We now have 2500 hospices.,Yes,health
21821,"To do that you need a system of managed competition where all of us are covered in big groups and we can choose our doctors and our hospitals, a wide range, but there is an incentive to control costs.",No,health
6929,Why should they insure somebody when the government's going to insure it for them?,No,health
6877,"And in 2006, our seniors will get a prescription drug coverage in Medicare.",No,health
2427,"Right now, the CBO says up to 20 million people will lose their insurance as Obamacare goes into effect next year.",Yes,health
34391,We have to repeal and replace Obamacare.,No,health
32199,Obamacare was the first step.,No,health
85,"I guess the question I would ask of Mr. Bush is how we instill those values, how we create this environment for the drug free schools that we want in this country.",No,health
2229,"This is an idea that's been around a long time, which is saying, hey, let's see if we can't get competition into the Medicare world so that people can get the choice of different plans at lower cost, better quality.",No,health
24637,And we could be moving out to the human population a whole lot faster than we are on some of these new drugs.,No,health
10807,"Now, if we get our tax policies right so that they're good for the middle class, if we reverse the policies of the last eight years that got us into this fix in the first place and that Senator McCain supported, then we are going to be in a position to deal with Social Security and deal with Medicare, because we will have a health care plan that actually works for you, reduces spending and costs over the long term, and Social Security that is stable and solvent for all Americans and not just some.",No,health
24606,"So I can't tell you where it's coming from, but I am very much concerned about AIDS and I believe that we've got the best researchers in the world out there at NIH working the problem.",No,health
24760,Governor Clinton clicked off the things -- he's going to take on insurance companies and bureaucracies.,No,health
23038,"One is to speed up generic drugs to the marketplace, quicker.",No,health
2534,That's part of my health care plan.,Yes,health
6839,"Thirdly, one of the reasons why there's still high cost in medicine is because this is -- they don't use any information technology.",Yes,health
2158,"And that is, in fact, I was wrong when I said the president isn't proposing any changes for current retirees.",No,health
24702,"All over this country, they cannot even buy medicine.",No,health
4383,"I've got post-traumatic stress disorder, and yet I can't get treatment.""",No,health
2204,And I don't think that's the right approach when it comes to making sure that Medicare is stronger over the long term.,No,health
6636,Health-care costs for the average American have gone up 64 percent; tuitions have gone up 35 percent; gasoline prices up 30 percent; Medicare premiums went up 17 percent a few days ago; prescription drugs are up 12 percent a year.,Yes,health
6233,"Their Hippocratic Oath would have required them to provide care, and there was already a law in the books.",Yes,health
33,And I have put forward a many-point drug program that includes what I would do as president of the United States; in terms of doing better on interdiction; and in terms of better in the neighborhoods.,No,health
21067,Because there are millions of seniors who are living almost hand to mouth.,No,health
12404,"There are seniors who pay more for their prescriptions than a lot of other people, more than their pets, sometimes.",Yes,health
2473,"But let's come back to something the president and I agree on, which is the key task we have in health care is to get the cost down so it's more affordable for families.",No,health
28874,"You get a plan that will include prescription drugs, a plan that will give you options.",No,health
23049,I think our seniors deserve a modern medical system.,No,health
14951,"As a matter of fact, one of the secretaries of HEW under Mr. Carter testified that he thought there was $7 billion worth of fraud and waste in welfare and in the medical programs associated with it.",Yes,health
2220,I'd just assume not have the government telling me what kind of health care I get.,No,health
28166,I will make a commitment to bring health care coverage of high quality that is affordable to every single child in America within four years.,No,health
37568,The individual mandate was the most unpopular aspect of Obamacare.,Yes,health
2481,"I used to consult to businesses -- excuse me, to hospitals and to health care providers.",No,health
8785,"And today, on the average, the average serviceman is at least 15% - and I happen to think that's a very modest estimate - 15% below what has happened to the cost of living over that period of time.",Yes,health
23142,Doctors practice defensive medicine because of all the frivolous lawsuits that cost our government $28 billion a year.,Yes,health
5802,You're running ads right now that say that I oppose federal funding for stem cell research.,Yes,health
6543,We're going to let everybody buy into the same health-care plan senators and congressmen give themselves.,No,health
16132,"It's something that we pay into now so that we will have a secure retirement, and our parents and grandparents will have a secure retirement.",No,health
34388,And one thing we have to do: Repeal and replace the disaster known as Obamacare.,No,health
2450,Let's -- let's pay providers on the basis of performance as opposed to on the basis of how many procedures they've -- they've engaged in.,No,health
26527,"In other words, I believe that doctors should not be able to be kicked out of managed care plans just because they tell the patients what they need and what more expensive care options might be.",No,health
196,It's a terrible problems in terms of flexibility on private insurance.,No,health
20337,I would be interested to see if he would say this evening he'll put Medicare in a lockbox.,No,health
66,"I remember being in a high school in my own state as we were organizing something we call the Governor's Alliance Against Drugs, and a young 16 year old girl coming up to me, desperate, addicted, dependent, saying, Governor, I need help.",No,health
11009,"And the reason that it's a problem to go shopping state by state, you know what insurance companies will do?",No,health
2531,"And with regards to health care, you had remarkable details with regards to my pre-existing condition plan.",Yes,health
2756,You'll have hospital and providers that'll no longer accept Medicare patients.,No,health
23071,"does, which is bulk purchase drugs so that you can lower the price and get them out to you lower.",No,health
352,Maybe we need to do a better job in mental clinics to help them.,No,health
19671,"Well, many of the provisions in the Kassebaum bill were provisions that -- my provisions, like deductions for long-term care, making certain that self-employed people that are watching tonight can deduct not 30 percent but 80 percent of you pay for premiums.",Yes,health
15292,"The Social Security system was based on a false premise, with regard to how fast the number of workers would increase and how fast the number of retirees would increase.",Yes,health
2203,And the primary beneficiary of that repeal are insurance companies that are estimated to gain billions of dollars back when they aren't making seniors any healthier.,Yes,health
6939,"Now, maybe that explains why he hasn't fully funded the VA and the VA hospital is having trouble and veterans are complaining.",No,health
20377,"If you make more than $25,000 a year you don't get a penny of help under the Bush prescription drug proposal for at least four to five years, and then you're pushed into a Medicare -- into an HMO or insurance company plan, and there's no limit on the premiums or the deductibles or any of the conditions.",Yes,health
2153,"Well, Jim, our seniors depend on these programs, and I know anytime we talk about entitlements, people become concerned that something's going to happen that's going to change their life for the worse.",No,health
17615,You went out and tried to cut $20 billion out of Medicare.,Yes,health
27334,"By the way, number one I get rid of is Obamacare.",No,health
21113,There's enough money to pay seniors today in the current affairs of Social Security.,Yes,health
3641,Here's the only problem: Your employer now has to pay taxes on the health care that you're getting from your employer.,Yes,health
2389,"If they had a pre-existing condition, they might not be able to get coverage at all.",No,health
2498,"But what it does say is that ""insurers, you've got to take everybody.""",No,health
12103,"Some of the healthy folks, healthy young kids say I'll never get sick, therefore I don't need health care right now.",No,health
21189,"And the reason it's that important is that all of the other issues, whether prescription drugs for all seniors that are opposed by the drug companies or the patient's bill of rights to take the decisions away from the HMOs and give them to the doctors and nurses, opposed by the HMOs and insurance companies, all these other proposals are going to be a lot easier to get passed for the American people if we limit the influence of special interest money and give democracy back to the American people.",Yes,health
19244,"In fact, I used to go home, my mother would tell me, Bob, all I've got is my Social Security and my Medicare, don't cut it.",No,health
18061,"And so, today, we are 90 percent of the casualties and 90 percent of the cost: $200 billion -- $200 billion that could have been used for health care, for schools, for construction, for prescription drugs for seniors, and it's in Iraq.",Yes,health
19670,I signed a bill to stop these drive-by deliveries when insurance companies can force people out of the hospital after 24 hours and I vetoed Senator Dole's Medicare plan that would have forced a lot of seniors into managed care and taken a lot more money out of their pockets and led to Medicare withering on the vine.,Yes,health
32215,"And like I say, 20 million people now have health insurance.",Yes,health
23061,"We sent it over to the House, that you could import drugs.",Yes,health
6858,Medicare is paid for by the American taxpayer.,Yes,health
29115,"So let's have paid family leave, earned sick days.",No,health
2171,We're going to give a better prescription program.,No,health
244,We cannot have a lack of confidence in the blood supply when it comes to operations and surgery and things of this nature.,No,health
6127,"Now, Joe, you're rich, congratulations, and you will then fall into the category where you'll have to pay a fine if you don't provide health insurance that Senator Obama mandates, not the kind that you think is best for your family, your children, your employees, but the kind that he mandates for you.",Yes,health
39492,"I can tell you from personal experience that I was in the hospital, I had it.",No,health
16604,The - the check on the quality of health care is in a different one.,No,health
21127,"Seniors now understand that the promise made will be a promise kept, but younger workers now understand we better have a government that trusts them and that's exactly what I'm going to do.",No,health
15197,I sometimes think he's like the witch doctor that gets mad when a good doctor comes along with a cure that'll work.,No,health
28170,"I want to give seniors who are, well, the near elderly, I don't like that term because I am just about in that category, but those 55 to 65 ought to be able to buy into Medicare for premiums that are reasonable and fair and significantly below what they have to get now.",No,health
6832,"These are accounts that allow somebody to buy a low-premium, high-deductible catastrophic plan and couple it with tax-free savings.",No,health
25823,Don't forget what he tried to do with health care.,No,health
6837,"In the last debate, my opponent said those lawsuits only caused the cost to go up by 1 percent.",Yes,health
24700,"A lot of folks on Medicare are out there every day making the choice between food and medicine; not poor enough for Medicare-Medicaid, not wealthy enough to buy their medicine.",Yes,health
21738,"I don't care what it is -- competitiveness, health care, crime, you name it.",No,health
10960,But what is at stake here in this health care issue is the fundamental difference between myself and Senator Obama.,No,health
74,"I'm saying that those of us who are elected to positions of political leadership, Jim, have a special responsibility, not only to come up with programs, and I have outlined in detail the very important, very strong program of enforcement as well as drug education prevention.",No,health
6935,They have poor-quality health care.,No,health
2231,"Jim, if I -- if I can just respond very quickly, first of all, every study has shown that Medicare has lower administrative costs than private insurance does, which is why seniors are generally pretty happy with it.",Yes,health
351,And I think maybe we could look back over our shoulders and wonder whether it was right to let all those mental patients out.,No,health
6063,"And we are going to make sure that we manage chronic illnesses, like diabetes and heart disease, that cost a huge amount, but could be prevented.",No,health
11002,You'll still have choice of doctor.,Yes,health
21236,"I want to make sure the seniors have the promise made will be a promise kept, but I want younger workers to be able to manage some of their own money, some of their own payroll taxes in the private sector under certain guidelines to get a better rate of return on your own money.",No,health
23122,I have a plan to let you buy into the same health care senators and congressmen give themselves.,No,health
34408,I will not cut benefits.,No,health
23867,"We're living in a new world after the Cold War, and what works in this new world is not trickle down, not government for the benefit of the privileged few, not tax and spend, but a commitment to invest in American jobs and American education, controlling American health care costs, and bringing the American people together.",No,health
26005,But we'd like to have a Social Security fund that has about 70 years of life instead of about 30 years of life.,No,health
10512,"For many of you, it is getting harder and harder to save, harder and harder to retire.",No,health
9714,"And the thing I find the most troubling about Obama Care, well it's a long list, but one of the things I find most troubling is that when you go out and talk to small businesses and ask them what they think about it, they tell you it keeps them from hiring more people.",No,health
26623,"And Social Security is not enough for a lot of people to live on, or at least is not enough for them to maintain anything like their previous lifestyle.",No,health
10990,"But they certainly are a little nervous when Senator Obama says, if you don't get the health care policy that I think you should have, then you're going to get fined.",No,health
19660,"If you change your job, you're going to be covered.",Yes,health
14767,"And, finally, who would you give your pension fund and your savings account to manage?",No,health
10816,Social Security is not that tough.,No,health
32186,"It's very bad, very bad health insurance.",No,health
2426,"We didn't also do something that I think a number of people across this country recognize, which is put -- put people in a position where they're going to lose the insurance they had and they wanted.",No,health
26606,"It's been looked, When I was chairman of the finance committee which handled Social Security we looked at all these options, and one thing we've got to make certain, when I used to go home my mother would tell me all I've got is my Social Security, don't touch it.",No,health
20344,"He's 70 years old, has high blood pressure, his wife has heart trouble.",No,health
27,"And I saw the cocaine scene treated with humor, as though this was a humorous little incident.",No,health
15999,"No, but you got to go back to what social security was when it was created.",No,health
32167,We've got to provide additional help to small businesses so that they can afford to provide health insurance.,No,health
28054,"As a matter of fact, I brought Republicans and Democrats together to do just that in the State of Texas to get a patient's bill of rights through.",Yes,health
21078,"I think it should stay in a lockbox, and I'll tell you this.",No,health
11005,What we're going to give you is a 50 percent tax credit to help provide health care for those that you need.,No,health
26601,"We're doing that precisely, and I think one thing sooner or later we're going to have to consider is take a look at the Social Security system.",No,health
13799,"He really didn't have a new economic program until over 1300 days into his presidency, and not all of his health care initiative has been presented to the Congress even now.",Yes,health
12138,I thought that's exactly what he and Mrs. Clinton and them fought for in 1993 was a government-run health care system.,Yes,health
12099,It's to make health care affordable and available this way.,No,health
2451,"Now, so what this board does is basically identifies best practices and says, let's use the purchasing power of Medicare and Medicaid to help to institutionalize all these good things that we do.",No,health
24035,"But we are there, and I think this insurance policy is necessary.",No,health
6524,"Vaccine manufacturers are worried about getting sued, and therefore they have backed off from providing this kind of vaccine.",Yes,health
237,The Surgeon General is doing a good job in encouraging the proper kind of education.,No,health
23415,"And it's a plan that lowers cost for everybody, covers all children.",Yes,health
19675,Another way you can do is to expand Medicaid.,No,health
6971,"I believe that younger workers ought to be allowed to take some of their own money and put it in a personal savings account, because I understand that they need to get better rates of return than the rates of return being given in the current Social Security trust.",No,health
10954,"Co-payments go up, costs go up, skyrocketing costs, which make people less and less able to afford health insurance in America.",Yes,health
23120,I have a plan to lower the cost of health care for you.,No,health
6916,"And most importantly, we give small business a 50 percent tax credit so that after we lower the costs of health care, they also get, whether they're self-employed or a small business, a lower cost to be able to cover their employees.",Yes,health
20295,"And my point has been, as opposed to politicizing an issue like Medicare, in other words, holding it up as an issue, hoping somebody bites it and try to clobber them over the head with it for political purposes, this year, in the year 2000, it's time to get it done once and for all.",No,health
2460,"In fact, it's estimated that by repealing Obamacare, you're looking at 50 million people losing health insurance...",Yes,health
16092,"And I've said that I'm going to keep this Social Security entitlement, to keep that trust fund sound.",No,health
80,We're consuming 50 percent of the world's cocaine.,Yes,health
2128,"You know, I suspect that, on Social Security, we've got a somewhat similar position.",No,health
27984,"I'm going to make sure that we get people off of food stamps, not by cutting the program, but by getting them good jobs.",No,health
21234,And I want seniors to have additional choices when it comes to choosing their health care plans.,No,health
20341,"Under the governor's plan, if you kept the same fee for service that you have now under Medicare, your premiums would go up by between 18% and 47%, and that is the study of the Congressional plan that he's modeled his proposal on by the Medicare actuaries.",Yes,health
2400,And it also says that you're going to have to get rebates if insurance companies are spending more on administrative costs and profits than they are on actual care.,Yes,health
28967,"You were promised that Medicare would be reformed, and that Social Security would be reformed.",Yes,health
26263,"Again I say, think of the Americans with Disabilities Act.",No,health
32191,"We have to get rid of the lines around the state, artificial lines, where we stop insurance companies from coming in and competing, because they want -- and President Obama and whoever was working on it -- they want to leave those lines, because that gives the insurance companies essentially monopolies.",Yes,health
428,"It's one of the reasons why we have a drug education and prevention program that is reaching out and helping youngsters all over our state, the kind of thing I want to do as president of the United States.",No,health
21097,I want to get a better rate of return for your own money than the paltry 2% that the current Social Security Trust gets today.,No,health
16667,"But as we look at the quality-of-life programs - jobs, health, education, crime, recreation - we feel that as we move forward with a healthier economy, we can absorb the small necessary cost that will be required.",No,health
26023,"We resolved, we rescued Social Security.",Yes,health
21082,The revenues exceed the expenses in Social Security until the year 2015 which means all retirees are going to get the promises made.,Yes,health
6857,We could have done that in Medicare.,No,health
26602,Because we've got a lot of people advocating we don't want to put our money into Social Security.,No,health
6841,"And so, we've got to introduce high technology into health care.",No,health
20738,The governor will not put Medicare in a lockbox.,No,health
36707,And it's why everything I've put forward -- from Medicare for all who want it to the historic investments we're going to make in infrastructure to dealing with climate change -- is fully paid for.,Yes,health
15314,"Now, again this statement that somehow, I wanted to destroy it and I just changed my tune, that I am for voluntary Social Security, which would mean the ruin of it.",No,health
12216,My priority is going to be the health of our citizens.,No,health
6526,"But the best thing we can do now, Bob, given the circumstances with the company in England is for those of us who are younger and healthy, don't get a flu shot.",No,health
8603,"Secondly, the Vice President mentioned medical care for the aged.",No,health
