Sentence_id,Text,class_label,topic
22728,Nobody is going to follow somebody who doesn't believe we can succeed and with somebody who says that war where we are is a mistake.,No,military
22699,They discussed the possibility of a small training unit or having a total takeover of the training in Iraq.,Yes,military
27037,"Now, it is absolutely true that we cannot just meet these challenges militarily.",No,military
22909,Our Guard and reserves have been turned into almost active duty.,No,military
3807,"And I want to tell you that now that we will succeed and our troops will come home, and not in defeat, that we will see a stable ally in the region and a fledgling democracy.",No,military
24042,It's kind of easy to do if you only have to pick up a $30-billion tab to defend your country.,No,military
27410,"And so when I sit down with the Secretary of the Navy and the Joint Chiefs of Staff, we determine how are we going to be best able to meet all of our defense needs in a way that also keeps faith with our troops, that also makes sure that our veterans have the kind of support that they need when they come home.",No,military
15427,"I believe that since I've been in office, there have been six or eight areas of combat evolved in other parts of the world.",Yes,military
24054,"But 2 former defense secretaries recently issued a report saying that 100,000 or slightly fewer troops would be enough, including President Reagan's former defense secretary, Mr. Carlucci.",Yes,military
2579,I do not believe in cutting our military.,No,military
20646,And it starts with making sure we rebuild our military power.,No,military
11650,"One of the criteria that I think is important in deciding when and if we should ever get involved around the world is whether or not our national security interest is involved, if we can really make the difference with military forces.",No,military
24499,We're using the military more now in terms of interdiction.,Yes,military
11315,"We've got to try to have talks, understanding that we're not taking military options off the table.",No,military
13004,It means keeping America even stronger militarily than she is.,No,military
11620,I think our troops ought to be used to help overthrow the dictator when it's in our best interests.,No,military
2796,We can only be strong overseas if we're strong at home; and when I became president we'll not only be strong in those areas but also in defense - a defense capability second to none.,No,military
25074,My definition of national strength is to make certain that a dollar spent buys us a dollar's worth of defense.,No,military
3831,The next president of the United States is not going to have to address the issue as to whether we went into Iraq or not.,No,military
18073,I understand the serious consequences of committing our troops into harm's way.,No,military
15928,"And if we can do that and do it in a way that gets deeper cuts on the Soviet side, which is where they ought to come from, then I think we have an opportunity over the long haul to begin to move some of our resources from the military to important domestic priorities that can provide college opportunity for that young woman whose mother wrote me from Texas just the other day, from Longview, Texas: two teachers, a mother and a father who have a child that's a freshman in college, an electrical engineering major, a very bright student and they can't afford to keep that child in college.",No,military
10386,And I want to fight for them.,No,military
20635,Whether or not our forces were of high morale and high standing and well-equipped.,No,military
37880,"We have our military that delivers soldiers and they can do 200,000 a day.",Yes,military
27391,Our Air Force is older and smaller than at any time since it was founded in 1947.,Yes,military
18141,More soldiers killed in June than before.,Yes,military
27324,"Well, let's come back and talk about the military, but all the way -- all the way through.",No,military
20946,"When the action in Kosovo was dragging on and we were searching for a solution to the problem, our country had defeated the adversary on the battlefield without a single American life being lost in combat.",Yes,military
25008,"Ah, well, now you've added a hypothetical there at the end, Mr. Kalb, about where we would send troops in to fight.",No,military
26969,You said that we should still have troops in Iraq to this day.,Yes,military
11619,I think our troops ought to be used to fight and win war.,No,military
15757,I want the men and women of our Armed Forces to have the support they need to defend us; the support they need when they risk our lives to keep us free and to keep this country free.,No,military
14434,"Yes, we had grain credits for Iraq, and there isn't any evidence that those grain credits were diverted into weaponry -- none, none whatsoever.",Yes,military
15207,This is a formidable force.,No,military
19555,"Well it, after World War I, we had, you know, a policy of disengagement.",Yes,military
28467,"I went and I volunteered, and I went to Vietnam.",No,military
13096,We had a war when we came into power in 1953.,Yes,military
25122,We never initiated any kind of action; we defended ourselves there.,Yes,military
749,"We have to be prepared to use military force against terrorist base camps, we have to work closely with our allies to make sure that they're working with us and we with them and we can give no quarter when it comes to breaking the back of international terrorism.",No,military
18123,And our alliance is strong.,No,military
7507,"Just as I fought for our country as a young man, with the same passion I will fight to defend this nation that I love.",No,military
30096,"We're working with NATO, the longest military alliance in the history of the world, to really turn our attention to terrorism.",Yes,military
5582,"I would prefer that none of us had to pay taxes, including myself.",No,tax
2744,I'll get incomes up again.,No,tax
24418,"I am concerned about a tax on Muslims, for example, over there.",Yes,tax
28864,"Now, the tax relief that I propose is directed specifically at middle-income individuals and families.",Yes,tax
15568,And the answer is to discipline both the executive branch and the congressional branch by holding the line on taxes.,No,tax
19198,"We're going to give them tax cuts so they can spend more time with their children, maybe even take a vacation.",No,tax
5570,Who -- why would you want to increase anybody's taxes right now?,No,tax
9471,"And that is, I want to give middle-class families and folks who are striving to get into the middle-class some relief.",No,tax
6695,We created a 10 percent bracket to help lower-income Americans.,Yes,tax
23990,I do not believe we need to go back to the Mondale proposals or the Dukakis proposals of tax and spend.,No,tax
9451,"And so, in terms of bringing down deductions, one way of doing that would be say everybody gets -- I'll pick a number -- $25,000 of deductions and credits, and you can decide which ones to use.",No,tax
7011,"Now, Alan Greenspan, who I think has done a terrific job in monetary policy, supports the president's tax cut.",Yes,tax
26194,"A $10,000 deduction a year for the cost of college tuition.",No,tax
32409,And we should demand that Donald release all of his tax returns so that people can see what are the entanglements and the financial relationships that he has...,No,tax
1740,This is a -- this is a tax in and of itself.,No,tax
22599,And yet he tells you he's for a middle- class tax cut.,No,tax
12189,"Because by his own budget numbers, his proposals for spending on tax cuts for the wealthiest of the wealthy are more than the new spending proposals that he has made for health care and education and national defense all combined.",Yes,tax
15989,But they don't work if you go raise taxes and then the Congress spends it continues to spend that.,No,tax
20731,"Almost half of all the tax cut benefits, as I said under Governor Bush's plan, go to the wealthiest 1%.",Yes,tax
19971,"And then to let people save in an IRA and withdraw from it without a tax penalty for education, home buying or medical expenses, that's the right way to go into the 21st Century, balance the budget and cut taxes, not balloon with this $550 billion tax scheme.",No,tax
9544,"He's already taken that off the board, capital gains are going to continue to be at a low rate so we -- we're not going to get money that way.",Yes,tax
23280,"I'm pledging I will not raise taxes; I'm giving a tax cut to the people earning less than $200,000 a year.",No,tax
24108,I disagree with the tax-and-spend philosophy.,No,tax
10832,Senator Obama has voted 94 times to either increase your taxes or against tax cuts.,Yes,tax
8685,"And so, the plan that I have proposed - and contrary to what John says, my plan is for a phased-in tax cut over a three-year period, tax increase and depreciation allowances for business and industry to give them the capital to refurbish plant and equipment, research and development, improved technology - all of which we see our foreign competitors having, and we have the greatest percentage of outmoded industrial plant and equipment of any of the industrial nations - produce more, have stable money supply, and give the people of this country a greater share of their own savings.",No,tax
21013,"And instead of concentrating on tax cuts mostly for the wealthy, we want -- I want tax cuts for the middle-class families and I want to continue the prosperity and make sure that it enriches not just a few but all of our families.",No,tax
16837,"Well, these special kinds of programs have - have robbed the average taxpayer and have benefited those who are powerful, and who can employ lobbyists, and who can have their CPAs and their lawyers to help them benefit from the roughly uh - eight thousand pages of the tax code.",Yes,tax
13625,But not by raising taxes.,No,tax
13689,"And so yes, everybody's taxed too much and I want to get the taxes down, but not by signing a tax bill that's gonna raise taxes on people.",No,tax
1784,"And the reason is, because I believe that we do best when the middle class is doing well.",No,tax
169,"What he's proposing after over a trillion in new debt which has been added in the Federal debt in the course of the past eight years, an IOU our children and grandchildren will be paying for years, is a tax cut for the wealthiest one percent of the people in this country, an average of about $30,000 that we're going to give to people making $200,000 a year.",Yes,tax
7029,He talks about middle-class tax cuts.,No,tax
9502,You heard what I said about my tax plan.,No,tax
24109,"You see, I don't think we need to tax more and spend more, and then say that's going to make the problem better.",No,tax
1259,And I favor a shifting of the welfare cost away from the local governments altogether.,No,tax
1747,Middle-income families are being crushed.,No,tax
19197,"One works for the family, and one works to pay taxes for the government.",No,tax
17578,I'm not going to increase taxes.,No,tax
14552,"Well, that's the only protection the taxpayer has against some of these reckless pork programs up there, and I'd rather be able to just line it right out of there and get on about passing some good stuff but leave out the garbage.",No,tax
2042,"But the idea of taxing people more, putting more people out of work, you'll never get there.",No,tax
3634,"And what that means, then, is that there are people out there who are working every day, who are not getting a tax cut, and you want to give them more.",Yes,tax
5912,That's what he's done when it comes to economic policies that will help working families get a leg up.,Yes,tax
9454,No tax on your savings.,No,tax
21627,"This is facts -- that would have given investment tax credits and other incentives to reinvest in our cities, in our country.",No,tax
2014,"Let me come back and say, why is it that I don't want to raise taxes?",No,tax
29212,"Just because of the tax and many other reasons, but just because of the fact...",No,tax
9836,"Median income is down $4,300 a family and 23 million Americans out of work.",Yes,tax
16493,"Now this tax bill - that hasn't reached the White House yet, but is expected in a day or two - it's about fifteen hundred pages.",Yes,tax
13615,"And therein, I think Governor Clinton keeps talking about trickle down, trickle down, and he's still talking about spending more and taxing more.",No,tax
7831,This means through tax reform and if necessary tax cuts that will stimulate more jobs.,No,tax
6962,"Well, people got their checks, and they'll continue to get their checks.",Yes,tax
21397,"We've got to control that growth to inflation and population increase, but not raise taxes on the American people now.",No,tax
20759,Everybody who pays taxes ought to get tax relief.,No,tax
3625,"I want to double the dividend from $3,500 to $7,000 for every dependent child in America.",No,tax
13466,"I should point out that as far as depletion allowances are concerned, the oil depletion allowance is one that provides eighty percent of all of those involved in depletion, so you're not going to get much from revenue insofar as depletion allowances are concerned, unless you move in the area that he indicated.",Yes,tax
10794,"So let's be clear about my tax plan and Senator McCain's, because we're not going to be able to deal with entitlements unless we understand the revenues coming in.",No,tax
22579,I'm going to give you a tax cut.,No,tax
28863,"If you are part of the -- of the bottom 20% or so of wage earners, then you will get an expanded earned income tax credit.",Yes,tax
16458,But with tax incentives for the low-income groups we could build up their uh - income levels uh - above the poverty level and not uh make welfare more uh - profitable than - than work.,No,tax
26208,Because you got a big tax increase.,Yes,tax
29235,"That was in large part because of tax policies that slashed taxes on the wealthy, failed to invest in the middle class, took their eyes off of Wall Street, and created a perfect storm.",Yes,tax
19192,"More than you spend for food, clothing and shelter combined for taxes under this administration.",Yes,tax
28661,"I think if you're going to have tax relief, everybody benefits.",No,tax
16847,"So where else would you raise the revenue to provide this tax relief - would you, in fact, do away with all business deductions, and what other kinds of preferences would you do away with?",No,tax
8877,"It's going to come from the dedication, by 1984, of the excise revenues that today are being collected by the Federal Government on alcohol and tobacco.",No,tax
21051,What is fair is everybody who pays taxes ought to get relief.,No,tax
29227,"But if you think you're going to make your air conditioners or your cars or your cookies or whatever you make and bring them into our country without a tax, you're wrong.",No,tax
14713,And it's not tax and spend economics.,No,tax
9476,"I said I would cut taxes for small businesses, who are the drivers and engines of growth.",No,tax
1938,The presidents would -- president would prefer raising taxes.,No,tax
17599,"If you got the Government down to the lowest level, that you yourself could say it could not go any lower and still perform the services for the people, and if the recovery was so complete that you knew you were getting the ultimate amount of revenues that you could get through that growth, and there was still some slight difference there between those two lines, then I had said once that, yes, you would have to then look to see if taxes should not be adjusted.",No,tax
16844,Now you listed some things - the uh - deferral on foreign income as estimated: that would save about $500 million.,Yes,tax
1250,"Also I favor all revenue sharing money being used for local governments, and also to remove prohibitions in the use of revenue sharing money so that it can be used to improve education, and health care.",No,tax
10513,"And that's why, for example, on tax policy, what I want to do is provide a middle class tax cut to 95 percent of working Americans, those who are working two jobs, people who are not spending enough time with their kids, because they are struggling to make ends meet.",No,tax
28405,"If you want somebody who will fight for you and who will fight to have middle-class tax cuts, then I am your man.",No,tax
8690,"We have to remember, when we talk a tax cut, we're only talking about reducing a tax increase, because this Administration has left us with a built-in tax increase that will amount to $86 billion next year.",Yes,tax
6690,You've got more money in your pocket as a result of the tax relief we passed and he opposed.,Yes,tax
7039,And the tax relief was important to spur consumption and investment to get us out of this recession.,Yes,tax
17566,And his Secretary of the Treasury said he's studying a sales tax or a value-added tax.,No,tax
2518,He said he was going to lower tax rates.,Yes,tax
2529,One could follow Bowles-Simpson as a model and take deduction by deduction and make differences that way.,No,tax
23961,Those are the people who in the 1980s had their incomes go up while their taxes went down.,Yes,tax
2059,Why wouldn't we eliminate tax breaks for corporate jets?,No,tax
15964,But it's the Internal Revenue Service which estimates now that we aren't collecting $100 billion or more in taxes owed in this country.,Yes,tax
26286,"If you're taking care of an elderly parent, you get a $1,000 deduction.",Yes,tax
6994,I will not privatize it.,No,tax
2743,There's no question in my mind that if the president were to be reelected you'll continue to see a middle-class squeeze with incomes going down and prices going up.,No,tax
19984,When they raise your taxes nobody runs around asking people where are you going to get the extra money.,No,tax
16475,"And I recommended that to the Congress with a budget ceiling of three hundred and ninety-five billion dollars, and that would have permitted us to have a $25 billion tax reduction.",Yes,tax
14726,"I don't believe in trickle-down government, I don't believe in larger taxes and larger government spending.",No,tax
20770,"Secondly, if you're a family of four making $50,000 in Massachusetts, you get a 50% tax cut.",Yes,tax
1730,"First of all, I don't have a $5 trillion tax cut.",Yes,tax
119,"He seems to want to spend a great deal of money on just about every weapon system; he says he's against new taxes, although he's broken that pledge at least times in the last year that I know of; he wants to give the wealthiest taxpayers in this country a five year, $40 billion tax break.",Yes,tax
6662,You get to defer your taxes.,Yes,tax
38194,"I paid millions of dollars in taxes, millions of dollars of income tax.",Yes,tax
2105,I maybe need to get a new accountant.,No,tax
13683,"I think everyone's paying too much, but I think this idea that you can go out and -- then he hits me for vetoing a tax bill.",No,tax
165,"Capital gains, one more point on that, please let's learn from history.",No,tax
20810,"If you're a single mother making $22,000 a year and you have two children, under this tax code, for every additional dollar you make, you pay a higher marginal rate on that dollar than someone making more than $200,000 a year, and that is not right.",Yes,tax
24111,I believe what you need to do is some of what Ross is talking about: control the growth of mandatory spending and get taxes down.,No,tax
26307,"My targeted tax cut is for child-rearing, buying a first-time home, paying for health care costs.",No,tax
32468,"You have provisions in the tax code that, frankly, we could change.",No,tax
32482,"And I will tell you, we are cutting them big league for the middle class.",No,tax
23211,"And I'm not going to run up taxes, which will cost this economy jobs.",No,tax
12386,"The Earned Income Tax Credit, sorry.",No,tax
21142,What Mr. Gore's plan will do causing huge payroll taxes or major benefit reductions.,No,tax
21374,I went for one tax increase and when I make a mistake I admit it.,Yes,tax
22580,"The president gave the top 1 percent of income-earners in America, got $89 billion last year, more than the 80 percent of people who earn $100,000 or less all put together.",Yes,tax
2523,"And I'm going to work together with Congress to say, OK, what -- what are the various ways we could bring down deductions, for instance?",No,tax
7956,But I would have no hesitation to ask the American people to pay the taxes even in l961 - if necessary - to maintain a sound economy and also to maintain a sound dollar.,No,tax
2507,Is it -- is it because that somehow middle-class families are going to benefit too much from them?,No,tax
12391,I found it to be an issue in trying to defend my tax relief package.,No,tax
23971,"I want to give people permanent incentives on investment tax credit, like President Kennedy and the Congress inaugurated in the early '60s to get industry moving again; a research and development tax credit; a low-income housing tax credit; a long-term capital gains proposal for new business and business expansions.",Yes,tax
2075,"And if we're asking for no revenue, then that means that we've got to get rid of a whole bunch of stuff.",No,tax
28370,"I think if you're going to have tax relief, everybody ought to get it.",No,tax
1911,"So you may keep referring to it as a $5 trillion tax cut, but that's not my plan.",Yes,tax
17887,"If you're middle income, you're about where you were.",No,tax
2695,"But, look, my philosophy has been, I will take ideas from anybody, Democrat or Republican, as long as they're advancing the cause of making middle-class families stronger and giving ladders of opportunity to the middle class.",No,tax
8849,"What I have been advocating is, why don't we start with the Federal Government turning back tax sources to states and local governments, as well as the responsibilities for those programs?",No,tax
16850,"But uh - if - if you could just do away with the ones that are unfair, you could lower taxes for everyone.",No,tax
26349,That was a tax credit for the employer.,No,tax
26093,Reduce the capital gains rate.,No,tax
28866,"$3,000 tax credit to help your expenses in taking care of a loved one who needs long-term care.",No,tax
23125,"Now, all of that can happen, but I have to ask you to do one thing: Join me in rolling back the president's unaffordable tax cut for people earning more than $200,000 a year.",No,tax
1819,I will not reduce the taxes paid by high-income Americans.,No,tax
19634,When he gave you that biggest tax increase in history; when he tried to take over your healthcare system.,Yes,tax
21029,They've had their chance to deliver a tax cut to you.,No,tax
19970,"The way you get a better America is to balance the budget and protect Medicare, Medicaid, education and the environment; to give a targeted tax cut -- and let me talk about the education tax cut -- to let people have a $10,000 deduction for the cost of college tuition in any year, any kind of college tuition; to give families a tax credit, a dollar for dollar reduction in their taxes for the cost of a typical community college so we can open that to everybody.",No,tax
14640,"We got a big philosophical difference here tonight between one who thinks the government can do all these things through tax and spend, and one who thinks it ought to go the other way.",No,tax
22973,"This president in the last debate said, ""Well, that would be a big tax gap if we did that.""",No,tax
7953,I think it may be necessary that we have more taxes.,No,tax
8943,Or you can cut his allowance and achieve the same end much quicker.,No,tax
19271,This is a family tax cut.,No,tax
19673,"I think there's enough -- we're even looking at our tax cut proposal, our economic package.",No,tax
8404,As a matter of fact it will be necessary to raise taxes.,No,tax
5699,"He voted twice for a budget resolution that increases the taxes on individuals making $42,000 a year.",Yes,tax
9505,I am looking to cut taxes for middle-income people.,No,tax
3640,"So you may end up getting a $5,000 tax credit.",No,tax
1810,What I've said is I won't put in place a tax cut that adds to the deficit.,No,tax
3663,"He has voted in the United States Senate to increase taxes on people who make as low as $42,000 a year.",Yes,tax
28340,"Look, the problem is that under Governor Bush's plan, $1.6 trillion tax cut, mostly to the wealthy, under his own budget numbers, he proposes spending more money for a tax cut just for the wealthiest 1% than all the new money he budgets for education, health care and national defense combined.",Yes,tax
18194,It's like a huge tax gap.,No,tax
29228,"And once you say you're going to have to tax them coming in, and our politicians never do this, because they have special interests and the special interests want those companies to leave, because in many cases, they own the companies.",No,tax
23970,"In addition to that, the money that I raise from upper-income people and from asking foreign corporations just to pay the same income on their income earned in America that American corporations do will be used to give incentives back to upper-income people.",No,tax
20775,"Under Vice President Gore's plan, they get $145 of tax relief.",Yes,tax
1907,I'm not in favor of a $5 trillion tax cut.,No,tax
5588,The fact is that businesses in America today are paying the second highest tax rate of anywhere in the world.,Yes,tax
28366,Let me talk about tax relief.,No,tax
15049,"Now, the President spoke a moment ago about that I was against the minimum wage.",No,tax
16488,That tax bill does not entirely meet the criteria that I established.,Yes,tax
26207,"Now all you got that tax cut, congratulations.",No,tax
23236,The only people affected by my plan are the top income earners of America.,Yes,tax
9712,I want to keep their taxes down on small business.,No,tax
