Sentence_id,Text,class_label,topic
27278,We've seen progress and gains in schools that were having a terrible time.,No,education
28328,"I hear from teachers all the time about the lawsuits and the threats, respect in the classroom.",No,education
17396,We find that schools are extending the curriculum to now have forced teaching of mathematics and science and so forth.,Yes,education
8421,"Now, why should there be any question about the federal government aiding s- teachers' salaries?",No,education
22215,And community colleges are on the job.,No,education
19876,I'm a product of a public school.,Yes,education
494,"The neighborhood, the kind of environment people are growing up in, and that leads me to the programs I'm talking about in terms of education.",No,education
28310,"We have to start treating teachers like the professionals that they are, and give them the respect and the kind of quality of life that will draw more people into teaching because we need a lot more teachers.",No,education
2572,So I reject the idea that I don't believe in great teachers or more teachers.,No,education
22265,"Secondly, across Texas, typically half of the school day was non-academic pursuits -- in one place it was 35%.",Yes,education
7851,One is by ex- the programs such as aid to education.,No,education
19816,So what we want to do is called opportunity scholarships.,No,education
22222,Those things would revolutionize American education and take us to the top economically.,No,education
20821,"It's about Kipp Academy in Houston, Texas.",No,education
26280,"It's pretty clear that was a quota case, and just because one teacher was white and one black and they had the same qualifications, you know they decided who would stay there.",No,education
22235,"Yes, I've got scars to show for being around education reform.",No,education
28327,I believe strongly in a teacher protection act like I mentioned.,No,education
8428,I think this would be bad for the country; I think it would be bad for the teaching profession.,No,education
8505,Secondly was the federal aid to education bill.,No,education
28271,"And the consequence is that federal portion or federal money will go to the parent, so the parent can go to a tutoring program or another public school or another private school.",Yes,education
6272,"And that's why I've proposed a $4,000 tuition credit, every student, every year, in exchange for some form of community service, whether it's military service, whether it's Peace Corps, whether it's working in a community.",Yes,education
20833,"What Michael says, don't put all these rules on us, just let us teach and hold us accountable for every grade.",No,education
11410,"The goals ought to be an education system that leaves no child behind, Medicare for our seniors, a Social Security system that's safe and secure, foreign policy that's in our nation's interest, and a strong military, and then bring people together to achieve those goals.",No,education
28236,We can't continue to shuffle children through school.,No,education
6352,"Senator McCain's absolutely right: The D.C. school system is in terrible shape, and it has been for a very long time.",No,education
2660,Massachusetts schools are ranked number one in the nation.,Yes,education
2070,They're using text books that are 10 years old.,Yes,education
19891,"I was able for two years when I was in, a very young boy to go to a Catholic school, but I basically went to public schools all my life.",No,education
22450,And let me tell you one specific pilot program where children who don't have a chance go to this program when they're 3.,No,education
17655,Half -- one out of two of the full-time college students in the United States are receiving some form of Federal aid.,Yes,education
20859,"Every school and every school district, have every state test the children.",No,education
8130,"I'm not satisfied when many of our teachers are inadequately paid, or when our children go to school part-time shifts.",No,education
10181,"But I think that one area we agree on is the important of parents and the importance of schools, because I do believe that if our young people have opportunity, then they are less likely to engage in these kinds of violent acts.",No,education
22315,There are 9 countries that spend more than we do on public education.,Yes,education
12064,So there's a -- this is a society that -- of ours that's got to do a better job of teaching children right from wrong.,No,education
36891,We can raise the wages of every childcare worker and preschool teacher in America.,No,education
15805,"I think of a teacher right here, largely Hispanic school, Jaime Escalante, teaching calculus to young kids, 80 percent of them going on to college.",Yes,education
10383,"Students who are out there trying to hopefully advance their own dreams, but also this country's dreams.",No,education
6319,"I'm sure you're aware, Senator Obama, of the program in the Washington, D.C., school system where vouchers are provided and there's a certain number, I think it's a thousand and some and some 9,000 parents asked to be eligible for that.",Yes,education
17659,"So, there are a host of other figures that reveal that the grant programs are greater than they have ever been, taking care of more people than they ever have.",Yes,education
22205,"Seventy percent of my state's money goes to the public schools, and I was really honored when Time magazine said that our schools have shown more improvement than any other state in the country except one other -- they named 2 states showing real strides forward in the 80s.",Yes,education
20907,"All schools, all school districts, students themselves, and required teacher testing, which goes a step farther than Governor Bush has been willing to go.",No,education
22281,We can't have the industries of tomorrow unless we have the best educated workforce.,No,education
6289,So I believe that we need to reward these good teachers.,No,education
2655,I don't want to cut our commitment to education.,No,education
19835,We've worked hard to expand public school choice in my balanced budget bill.,No,education
32841,"You know, right out of law school, I went to work for the Children's Defense Fund.",No,education
27152,"They want jobs, they want to be able to make sure their kids are going to a good school.",No,education
25594,"I want this next generation to be the best educated in American history, to invest in the human mind and science again, so we're out front.",No,education
17749,But now we need both that kind of discipline and the resources and the consistent leadership that allows this country to catch up in education and science and training.,No,education
27308,And then you cut education spending when you came into office.,Yes,education
11887,"And I believe the federal government must say that if you receive any money, any money from the federal government for disadvantaged children, for example, you must show us whether or not the children are learning.",No,education
26175,My view is we want to find jobs and opportunities and education.,No,education
22915,It hurts the middle class.,No,education
22300,"And where it's been done, those schools, like in Rochester, those schools that weren't chosen find that they then compete and do better.",Yes,education
28231,"That's why I support a teacher liability act at the federal level, that says if a teacher or principal upholds reasonable standards of classroom discipline they can't be sued.",Yes,education
28252,"And only one in 20 students would be eligible for these vouchers, and they wouldn't even pay the full tuition to private school.",Yes,education
9147,"And without a college level job, that's just unacceptable.",No,education
21413,Young people with high grades can't get a job.,Yes,education
8393,"And I think to heap the burden further on the property tax, which is already strained in many of our communities, will provide, will make sh- insure, in my opinion, that many of our children will not be adequately educated, and many of our teachers not adequately compensated.",No,education
12453,"I've a plan in my budget to recruit 100,000 new, highly qualified teachers and to help local school districts build new schools.",Yes,education
9040,And I want to express my appreciation to the League of Women Voters for adopting a course with which I believe the great majority of Americans are in agreement.,No,education
10350,"I was able also to get our schools ranked number one in the nation, so 100 percent of our kids would have a bright opportunity for a future.",Yes,education
544,"But the federal spending for education is up, and I want to be the education president, because I want to see us do better.",Yes,education
19882,You're for school uniforms and curfews and you're opposed to truancy.,No,education
19894,"Where we don't have very much money at the Federal level to spend on education, we ought to spend it helping the 90 percent of the kids that we can help.",No,education
22289,And in the first few years they either learn how to learn or don't learn how to learn.,No,education
27736,"If we don't have the best education system in the world, if we don't continue to put money into research and technology that will allow us to create great businesses here in the United States, that's how we lose the competition.",Yes,education
26085,"One's in technical school, one's an honor student in high school.",No,education
29807,"They want support, they want more training, they want more assistance.",Yes,education
17647,"We have found also in our studies that in this increase in poverty, it all had to do with their private earnings.",Yes,education
8431,"But, as Senator Kennedy said in January of this year in this same press conference, the way that you get higher salaries for teachers is to support school construction, which means that all of the local school districts in the various states then have money which is freed to raise the standards for teachers' salaries.",Yes,education
7204,"And secondly, only a liberal senator from Massachusetts would say that a 49 percent increase in funding for education was not enough.",Yes,education
22316,We spend more on education 'cause we spend so much more on colleges.,Yes,education
28264,I believe in local control of schools.,No,education
20825,A guy named Michael runs the school.,No,education
28329,Part of it's because you can't -- you can't control the classroom.,No,education
22292,And it costs more to keep them in prison than it does to send them to Harvard.,Yes,education
20848,"Four, we're going to say if you receive federal money, measure third, fourth, fifth, sixth, seventh and eighth grade.",No,education
20840,"But, unfortunately, a lot of schools are trapping children in schools that just won't teach and won't change.",No,education
22251,"If I could wish for one thing for great public schools, it would be a strong family unit in every home -- nothing will ever replace that.",No,education
10755,"I mean, you know, it's tough to ask a teacher who's making $30,000 or $35,000 a year to tighten her belt when people who are making much more than her are living pretty high on the hog.",No,education
6613,And here's some help for you to go get an education.,No,education
6294,We need to have full student loan program for in-state tuition.,No,education
26235,"We ought to keep making those extra effort Affirmative Action programs, the law and the policy of the land.",No,education
19856,"I have advocated expansions of public school choice alternatives and I said the creation of 3,000 new schools that we are going to help the states to finance.",Yes,education
7349,"Do you realize today in America, we spend $73 billion to help 10 million low- and middle-income families better afford college?",Yes,education
21934,I want to think that they're going to be able to afford an education.,No,education
6631,I want you to notice how the president switched away from jobs and started talking about education principally.,No,education
22221,"But I favor public school choice, and I favor radical decentralization in giving more power to better-trained principals and teachers with parent councils to control their schools.",No,education
28715,And a feature that allows parents to automatically check with one click what sites your kids have visited lately.,No,education
22564,"Right here in St. Louis, you've laid off 350 teachers.",Yes,education
20847,Let them reach out beyond the confines of the current structure to recruit teach-for-the-children type teachers.,No,education
18120,They just need the help to be trained.,No,education
2563,"In fact we've seen layoffs of hundreds of thousands of teachers over the last several years, and Governor Romney doesn't think we need more teachers.",Yes,education
6018,"And I need -- we need to have education and training programs for displaced workers that work, going to our community colleges.",No,education
28283,But I have an obligation to fight to make sure there are no failing schools.,No,education
20826,It is a school full of so-called at-risk children.,No,education
2662,It's because I care about education for all of our kids.,No,education
516,"These programs have been cut and slashed and butchered, and they've hurt kids all over this country.",No,education
17918,"We can be better if we face our future, rejoice in our strengths, face our problems, and by solving them, build a better society for our children.",No,education
3431,How's it going to affect my retirement savings or my ability to send my children to college?,No,education
42341,"I would give block grants to schools, but I'd give them on merit based on who's doing the most innovative -- I just got done holding the seventh annual Governors Conference on Innovation and Education.",No,education
33595,I feel strongly that we have to have an education system that starts with preschool and goes through college.,No,education
19844,90 percent of our kids are out there in those public schools and we need to lift their standards and move them forward with the programs like those I've outlined in this campaign.,Yes,education
11894,I think we still need affirmative action.,No,education
19869,"We need to be doing more in education, not less.",No,education
20003,"Making sure we've got an army of reading volunteers, trained people to teach with parents and teachers so that our eight year olds can learn to read.",No,education
20836,That's my vision for public education all around America.,No,education
22306,"Now, I think we ought to try to help families and see if it will do what I think -- make all schools better.",No,education
6283,And we find bad teachers another line of work.,No,education
17359,The American people want their children educated.,No,education
28322,I worry about federalizing education if I were you.,No,education
7171,"In order to make sure people have jobs for the 21st century, we've got to get it right in the education system, and we're beginning to close a minority achievement gap now.",No,education
10143,We were able to drive our schools to be number one in the nation in my state.,Yes,education
12962,Bring students here; let them see what kind of a country we have.,No,education
38599,"And if you look at the people, we would pay people hundreds of thousands of dollars to teach very bad ideas and frankly, very sick ideas.",No,education
28224,"But there are a lot of parents who feel like everything is going well in their child's school, and all of a sudden they wake up and realize that wait a minute, standards aren't being met.",No,education
9609,"We did it by taking $60 billion that was going to banks and lenders as middlemen for the student loan program, and we said, let's just cut out the middleman.",Yes,education
33597,"I want to make college debt-free and for families making less than $125,000, you will not get a tuition bill from a public college or university if the plan that I worked on with Bernie Sanders is enacted.",Yes,education
19,"So we've seen a deterioration in values, and one of the things that I think we should do about it in terms of cause is to instill values into the young people in our schools.",No,education
7681,What will be done to provide equality of education in all sections of the United States?,No,education
2654,"I propose we grade our schools so parents know which schools are succeeding and failing, so they can take their child to a -- to a school that he's being more successful.",No,education
2561,"But what I've also said is let's hire another 100,000 math and science teachers to make sure we maintain our technological lead and our people are skilled and able to succeed.",Yes,education
2604,The federal government can get local and -- and state schools to do a better job.,No,education
28042,One of the best in advancing all kinds of benefits for children to grow up healthy and strong.,Yes,education
19884,Why can't Landale Shakespeare in Cleveland or Pilar Gonzales in Milwaukee give their children an opportunity to go to a better school.,No,education
8442,The state then could determine whether the money would be spent for school construction or teacher salaries.,No,education
12457,"If the tax cut is your number one, two, three and four priority, you can't do education.",Yes,education
22206,"So I care a lot about this, and I've spent countless hours in schools.",No,education
10185,We're starting to see gains in math and science.,Yes,education
2639,"All right, I'm not going to cut education funding.",No,education
170,Why that's more than the average teacher makes.,Yes,education
17037,The member of a labor union must have his rights strengthened and broadened and our children in their education should have an opportunity to improve themselves based on their talents and their abilities.,No,education
8440,"When uh - the Vice President quotes me in January, sixty, I do not believe the federal government should pay directly teachers' salaries, but that was not the issue before the Senate in February.",Yes,education
11875,It starts with making sure every child learns to read.,No,education
6589,We raise the student loans.,No,education
15453,"If you don't agree, if you don't think that this course that we've been on for the last four years is what you would like to see us follow for the next four, then I could suggest another choice that you have.",No,education
8466,And it is a fact in the August session that the four members of the Rules Committee who were Republicans joining with two Democrats voted against sending the aid to education bill to the floor of the House.,Yes,education
28334,"The federal government can be a part, but don't fall prey to all this stuff about money here and money there because education is really funded at the local level.",Yes,education
12403,"However many days that young girl in Florida stood in her classroom, however long, even if it was only one day, doesn't change the fact that there are a lot of overcrowded classrooms in America and we need to do something about that.",Yes,education
9136,We have to make sure that we make it easier for kids to afford college.,No,education
33786,And I was taking on discrimination against African-American kids in schools.,Yes,education
28304,"And again, I want to make it possible for all middle-class families to send their kids to college and more Pell grants for those who are in the lower income groups also, and then I want to make sure that we have job training on top of that and lifelong learning, but it all starts with the public school teachers.",No,education
22236,"And the first word you need to say in every city and state, and just draw a line in the sand, is public schools exist for the benefit of the children.",No,education
22318,"There are great public schools where there's public school choice, accountability and brilliant principals.",No,education
6357,"But the -- but here's the thing, is that, even if Senator McCain were to say that vouchers were the way to go -- I disagree with him on this, because the data doesn't show that it actually solves the problem -- the centerpiece of Senator McCain's education policy is to increase the voucher program in D.C. by 2,000 slots.",Yes,education
28351,"Now, because the governor has all this money for a tax cut mostly to the wealthy, there is no money left over, so schools get testing and lawsuit reform and not much else.",Yes,education
8425,We need higher teachers' salaries.,No,education
12445,"I agree with Governor Bush that we should have new accountability, testing of students.",No,education
20822,A charter school run by some people from Teach For America.,No,education
20912,But I don't think private schools should have a right to take taxpayer money away from public schools at a time when Caley Ellis is standing in that classroom.,No,education
6346,"But to have a situation, as you mentioned in our earlier comments, that the most expensive education in the world is in the United States of America also means that it cries out for reform, as well.",Yes,education
5628,"If we invest now in our young people and their ability to go to college, that will allow them to drive this economy into the 21st century.",No,education
22483,Our schools are now better.,No,education
14769,"Finally, to you students up there -- God bless you, I'm doing this for you: I want you to have the American dream.",No,education
42332,"And, as governor, well, education is one of the biggest part of a state budget.",No,education
22214,"Number 2, we would provide 2-year apprenticeship programs to high school graduates who don't go to college.",No,education
8420,"Uh - I think that the reason that I voted against having the federal government uh - pay teachers' salaries was probably the very reason that concerned Senator Kennedy when in January of this year, in his kick-off press conference, he said that he favored aid for school construction, but at that time did not feel that there should be aid for teachers' salaries - at least that's the way I read his remarks.",Yes,education
17313,A child wants to say grace in a school cafeteria and a court rules that they can't do it because it's school property.,No,education
7675,These are the great questions: equality of education in school.,No,education
13427,"And the Vice President cast the deciding vote against federal aid for teachers' salaries in the Senate, which prevented that being added.",Yes,education
20846,"Three, we have to consolidate the federal programs to free districts to free the schools and encourage innovators like Michael.",No,education
20845,"there must by K-2 diagnostic teaching tools, teacher training money, available.",No,education
20849,"Show us if they are learning to read, write, add and subtract and if so there will be bonus plans.",No,education
6621,And I saw a problem in the public education system in America.,No,education
28251,"Governor Bush is for vouchers, and in his plan he proposes to drain more money, more taxpayer money out of the public schools for private school vouchers than all of the money that he proposes in his entire budget for public schools themselves.",Yes,education
19299,You also provide opportunity scholarships so low income parents will have the same choice that others have in sending their children to better schools.,No,education
12452,And the way to do that is first to recruit more teachers.,No,education
13426,But the Administration and the Republican majority in the Congress has opposed any realistic aid to education.,Yes,education
2570,"Massachusetts, our schools are ranked number one of all 50 states.",Yes,education
6358,That leaves all of you who live in the other 50 states without an education reform policy from Senator McCain.,Yes,education
7347,"But we ought to have an aggressive effort to make sure people are educated, to make sure when they get out of high school there's Pell Grants available for them, which is what we've done.",No,education
13405,"That's why in this whole area of civil rights, the equality of opportunity for employment and education is not just for the benefit of the minority groups, it's for the benefit of the nation so that we can get the scientists and the engineers and all the rest that we need.",No,education
20893,Republicans and Democrats came together and said what can we do to make our public education the best in the country?,No,education
28249,"I want to work for universal free school because we know from all the studies that the youngsters learn, kids learn more in the first few years of life than any where else.",No,education
8434,Teachers' salaries very fortunately have gone up fifty percent in the last eight years as against only a thirty-four percent rise for other salaries.,Yes,education
11331,"Despite all that, I was able to go to the best schools on earth and I was able to succeed in a way that I could not have succeeded anywhere else in this country.",No,education
6268,"Early childhood education, which closes the achievement gap, so that every child is prepared for school, every dollar we invest in that, we end up getting huge benefits with improved reading scores, reduced dropout rates, reduced delinquency rates.",No,education
8438,"My objection here is the potential cost in controls and eventual freedom for the American people by giving the federal government power over education, and that is the greatest power a government can have.",No,education
6277,"They've got to turn off the TV set, put away the video games, and, finally, start instilling that thirst for knowledge that our students need.",No,education
6309,Where we disagree is on the idea that we can somehow give out vouchers -- give vouchers as a way of securing the problems in our education system.,No,education
6625,"No, education is how to help the person who's lost a job.",No,education
2556,And when it comes to education what I've said is we've got to reform schools that are not working.,Yes,education
