Text,class_label,source
"I said we would provide guarantees, and -- and that was what allowed these companies to go through bankruptcy, come out of bankruptcy.",Yes,"I said that we would provide guarantees, and -- and that was what was able to allow these companies to go through bankruptcy, to come out of bankruptcy."
They were not in the treaty area when it was adopted in fifty-five.,Yes,They were not within the treaty area when the treaty was passed in fifty-five.
"Well, for 18 months he has been promoting this fiscal plan.",Yes,"Well, for 18 months he's been running on this tax plan."
"And we both want to lower taxes, the difference is for whom we want to lower them.",Yes,"And we both want to cut taxes, the difference is who we want to cut taxes for."
Just like if you watch what came out today on the clips where I was wondering what happened with my rally in Chicago and other rallies where we had so much violence?,No,Just like if you look at what came out today on the clips where I was wondering what happened with my rally in Chicago and other rallies where we had such violence?
"In fact, there is currently a commission in Congress, a bipartisan commission, which is examining all the different options they will present to the next Congress.",Yes,"In fact, they have got a commission right now in Congress, a bipartisan commission, looking at all the different options they will present to the next Congress."
"If you look -- excuse me, Chris -- if you look at your voter lists, you see millions of people who are registered to vote -- millions, this is not from me -- this comes from the Pew Report and other sources -- millions of people who are registered to vote who should not be registered to vote.",Yes,"If you look -- excuse me, Chris -- if you look at your voter rolls, you will see millions of people that are registered to vote -- millions, this isn't coming from me -- this is coming from Pew Report and other places -- millions of people that are registered to vote that shouldn't be registered to vote."
I think we should try to increase fuel efficiency.,No,I think we should try to raise the fuel efficiency.
"9 Nobel Prize-winning economists and 500 others, including many Republican and Democratic business leaders, have endorsed this approach because it offers the best hope of getting America back to work and increasing our incomes rather than seeing them shrink.",Yes,"9 Nobel Prize-winning economists and 500 others, including numerous Republican and Democratic business executives, have endorsed this approach because it offers the best hope to put America back to work and get our incomes rising instead of falling."
He is the first president in 72 years to lose jobs.,Yes,He's the first president in 72 years to lose jobs.
It shows a lack of leadership.,No,It shows a lack of leadership.
They are going to expand their businesses.,No,They're going to expand their companies.
"I am worried about, for example, a tax on Muslims there.",Yes,"I am concerned about a tax on Muslims, for example, over there."
"Well, I will go further and say that I think we need to focus much more on programs for the economic development of rural areas.",No,"Now, I'll go beyond that and say I think we need much more focus on rural economic development programs."
"Imagine what it must be like for someone to be unjustly, wrongly singled out and to face the unfair force of the law simply because of their race or ethnicity.",No,"Imagine what it -- what it is like for someone to be singled out unfairly, unjustly, and feel the unfair force of law simply because of race or ethnicity."
"Let me return to the main point, Sandy.",No,"Let me go back to the main point, Sandy."
"Of course, we took the Senate report.",No,"We took the Senate report, of course."
"With regard to the great progress that has been made with this government expenditure, the unemployment rate among Blacks in Detroit, Michigan, is 56%.",Yes,"With regard to the great progress that has been made with this Government spending, the rate of black unemployment in Detroit, Michigan, is 56%."
"So I, when I was secretary of state, advocated and still advocate today for a no-fly zone and safe zones.",Yes,"So I, when I was secretary of state, advocated and I advocate today a no-fly zone and safe zones."
It was higher when I took office.,Yes,It was higher when I came into office.
We should make them reveal to whom they have given money when testifying before Congressional committees; we should close the legal loopholes for lawyers; they should have to disclose when they are actually lobbying.,No,We ought to make them disclose the people they've given money to when they're testifying before congressional committees; we ought to close the lawyers' loopholes; they ought to have to disclose when they're really lobbying.
I wholeheartedly support the WIC program.,No,I do strongly support the WIC program.
"Now, the three things they are trying to say that I've changed my position on are the Patriot Act; I have not.",Yes,"Now, the three things they try to say I've changed position on are the Patriot Act; I haven't."
It is one of the unintended consequences of Dodd-Frank.,Yes,That's one of the unintended consequences of Dodd-Frank.
Senator Dole led the fight against the Brady Bill.,Yes,Senator Dole led the fight against the Brady Bill.
But we are lowering the tax rate from 35% to 15%.,Yes,But we're bringing the tax rate down from 35 percent to 15 percent.
"And so, not once, but twice, in 1971, I voted in the House of Representatives against a constitutional amendment that sought to reintroduce prayer in public schools.",Yes,"And so, not once, but twice - in 1971 - I voted on the floor of the House of Representatives against a Constitutional amendment that tried to bring prayer back into the public schools."
"If all the unemployed people of today stood in a single line and two feet per person were reserved, that line would stretch from New York City to Los Angeles, California.",Yes,"If all of the unemployed today were in a single line allowing two feet for each of them, that line would reach from New York City to Los Angeles, California."
"Look, we live in an information society.",No,"Look, we're in an information age."
We've got them all out there.,Yes,We've got them all out there.
"We must reduce our deficit, but we must do so in a balanced manner.",No,"We've got to reduce our deficit, but we've got to do it in a balanced way."
"But let me also note that I have made a statement to various parliaments around the world, in Europe and in Asia, and I will repeat it here: a nuclear war cannot be won and must never be fought.",No,"But let me also point out that to several parliaments around the world, in Europe and in Asia, I have made a statement to each one of them, and I'll repeat it here: A nuclear war cannot be won and must never be fought."
"And I think, this evening, as we contrast our different approaches to government, values, and leadership in this country for the first time, the American citizens will have the opportunity to compare us both for the first time.",No,"And I think tonight, as we contrast for the first time our differing approach to government, to values, to the leadership in this country, I think as this debate goes forward, the American people will have for the first time a chance to weigh the two of us against each other."
"And unless we are ready to implement programs like those of the sixties, this battle for economic survival that these people are waging will be lost.",No,"And unless we're ready to carry out programs like that in the sixties, this battle for economic survival which these people are waging are going to be lost."
But we must use our army wisely.,No,But we have to use our military wisely.
"We did it by taking $60 billion that was going to banks and lenders as intermediaries for the student loan program, and we said, let's eliminate the middleman.",Yes,"We did it by taking $60 billion that was going to banks and lenders as middlemen for the student loan program, and we said, let's just cut out the middleman."
"And what I said that you referred to, Chris, was that I disagreed with the way the court applied the Second Amendment in that case, because the District of Columbia tried to protect toddlers from firearms and therefore wanted people with firearms to store them safely.",Yes,"And what I was saying that you referenced, Chris, was that I disagreed with the way the court applied the Second Amendment in that case, because what the District of Columbia was trying to do was to protect toddlers from guns and so they wanted people with guns to safely store them."
"Now look, he says that Arkansas is a poor state.",Yes,"Now look, he says Arkansas's a poor state."
Use -- work internationally to do it.,No,Use--work internationally to do it.
"Mr. Bush vetoed it twice because he says we cannot do something that seventy-two other countries do, even if there was an exemption for small businesses.",Yes,"Mr. Bush vetoed it twice because he says we can't do something seventy-two other countries do, even though there was a small business exemption."
