Text,class_label,source
The FBI conducted a year-long investigation into my e-mails.,Yes,
"They can buy a computer for their kid who's going off to college, which means they're spending more money, businesses have more customers, businesses make more profits, and then hire more workers.",Yes,
"In a country as wealthy as ours, for us to have people who are going bankrupt because they can't pay their medical bills -- for my mother to die of cancer at the age of 53 and have to spend the last months of her life in the hospital room arguing with insurance companies because they're saying that this may be a pre-existing condition and they don't have to pay her treatment, there's something fundamentally wrong about that.",No,
"And we have to be able to give parents the same choice, frankly, that Senator Obama and Mrs. Obama had and Cindy and I had to send our kids to the school -- their kids to the school of their choice.",No,
I've just gotten a report from the Air Force that indicates that the 30-year lifecycle cost of that system is going to be $100 billion.,Yes,
"Barb and I lost a child, you know that we lost a daughter, Robin.",No,
"I want to correct, the all these things I voted against, they were probably part of some big package that had a lot of pork in it or a lot of things that we shouldn't have had and we probably voted no.",Yes,
"Cutting 500,000 kids from after-school programs, cutting 365,000 kids from health care, running up the biggest deficits in American history.",Yes,
"Now, with respect to ACORN, ACORN is a community organization.",No,
We've expanded trade adjustment assistance.,Yes,
In our first debate he indicated that I had not had experience or at least uh - had not participated significantly in the making of the decisions.,No,
We expect to have a lower deficit in fiscal year 1978.,No,
That's why everything I'll do is designed to help small businesses grow and add jobs.,No,
"You indicated that we shouldn't be passing nuclear treaties with Russia despite the fact that 71 senators, Democrats and Republicans, voted for it.",Yes,
The Senate has not voted yet on the Strategic Arms Limitation Treaty.,No,
"But all of my proposals are focused on that problem, gun safety.",Yes,
"I don't know how you can govern in this country when you look at New York City and you see that 50 percent of the black males there are unemployed, when you see 40 percent of Hispanic children -- of black children in some cities -- dropping out of high school.",Yes,
"And I think it's been unfortunate, but it's happened, that since the Great Recession, the gains have all gone to the top.",Yes,
My path is designed in getting small businesses to grow and hire people.,No,
"I've met dishwashers, painters, architects, glass installers, marble installers, drapery installers, like my dad was, who you refused to pay when they finished the work that you asked them to do.",Yes,
But America cannot stand pat.,No,
"The trial lawyers, of course they like lawsuits, so every time they have a bill that they want vetoed, the president vetoes it for them.",Yes,
It's cost us billions and billions of dollars for peace-keeping operations.,Yes,
She did call it the gold standard.,Yes,
That's why I have a plan for energy independence within 10 years.,No,
"We can have serious differences about our health care policy, for example, John, because we do have a difference on health care policy, but we...",No,
"I believe we need to be strong, and I will keep us strong.",No,
"And as you know, the education cost has gone up uh - tremendously.",Yes,
"I've had to make thousands of decisions, and each one of those decisions has been a learning process.",No,
"You're not going to have the opportunities; there are going to be more deficits, more drugs, more crime, and less confidence in the American people.",No,
There are 900 sequestered in the White House.,Yes,
"I'm very pleased that the Fraternal Order of Police in Little Rock, Arkansas endorsed me because I think they see I'm trying to strengthen the anti-crime legislation.",No,
Amnesty means that - that you uh - that what you did was right.,No,
I want to be the president that gets conventional forces balance.,No,
Uh - I remember when uh - Herbert Hoover was against uh - jobs for people.,Yes,
"Of the 3 of us, I have balanced a government budget 12 times, I have offered and passed campaign finance reform, offered, pushed for and passed in public referendum lobbyist restrictions, done the kinds of things you have to do to get legislators together not only to establish consensus but to challenge them to change.",Yes,
"I gave, in September of 1974, an opportunity for all draft evaders, all deserters, to come in voluntarily, clear their records by earning an opportunity to restore their good citizenship.",Yes,
"If you don't get a two-thirds, then your resolution doesn't pass.",Yes,
"And that means that the ordinary American out there who's collecting a paycheck every day, they've got a little extra money to be able to buy a computer for their kid, to fill up on this gas that is killing them.",No,
I am concerned about the fact that 10 percent of our manufacturing and 20 percent of our banking and nearly half of the real estate in the city of Los Angeles are in the hands of foreign investors.,Yes,
"Also, I want to thank the people of Cleveland and Ohio for being such hospitable hosts during these last few hours in my life.",No,
I would like the record to show the panelists that Ross Perot took the first shot at the press.,No,
"I see a day in the United States of America where all of our public schools are considered excellent, world class.",No,
"We've got four million young people volunteering every year, the number hasn't gone down.",Yes,
I do not want any more trickle down government.,No,
"It's $30 million less for special interests that will tell you exactly what to do and it would really, I think, be a nice sign to the American public.",No,
"I'm totally opposed to diverting one out of every six dollars out of the Social Security trust fund, as the Governor has proposed, into the stock market.",Yes,
And I ask you for the privilege of leading our nation to be stronger at home and respected again in the world.,No,
"But, of course, there's no way we can know whether any of that is true, because he hasn't released his tax returns.",Yes,
Family medical leave has let 12 million families take a little time off for the birth of a child or a family illness without losing their job.,Yes,
"President Clinton did the same thing, because we have an obligation to protect you.",No,
He voted to increase taxes 98 times.,Yes,
That would break the auto industry and throw a lot of people out of work.,No,
They set a low standard of materialism.,No,
"Soros, who's a friend of hers, took a massive deduction.",Yes,
"And you say: Well, how are you going to pay for it?",No,
"Now, when anybody has a spending program they want to spend money on at home, they say, well, let's cut money out of the Defense Dept.",No,
"Mr. President, have you looked at your pension?",No,
"And by the way, I've had that experience.",No,
In fact uh - Mr. Nixon uh - discussed that a week ago in a speech.,No,
"I said that we would provide guarantees, and -- and that was what was able to allow these companies to go through bankruptcy, to come out of bankruptcy.",Yes,
They were not within the treaty area when the treaty was passed in fifty-five.,Yes,
"Well, for 18 months he's been running on this tax plan.",Yes,
"And we both want to cut taxes, the difference is who we want to cut taxes for.",Yes,
Just like if you look at what came out today on the clips where I was wondering what happened with my rally in Chicago and other rallies where we had such violence?,No,
"In fact, they have got a commission right now in Congress, a bipartisan commission, looking at all the different options they will present to the next Congress.",Yes,
"If you look -- excuse me, Chris -- if you look at your voter rolls, you will see millions of people that are registered to vote -- millions, this isn't coming from me -- this is coming from Pew Report and other places -- millions of people that are registered to vote that shouldn't be registered to vote.",Yes,
I think we should try to raise the fuel efficiency.,No,
"9 Nobel Prize-winning economists and 500 others, including numerous Republican and Democratic business executives, have endorsed this approach because it offers the best hope to put America back to work and get our incomes rising instead of falling.",Yes,
He's the first president in 72 years to lose jobs.,Yes,
It shows a lack of leadership.,No,
They're going to expand their companies.,No,
"I am concerned about a tax on Muslims, for example, over there.",Yes,
"Now, I'll go beyond that and say I think we need much more focus on rural economic development programs.",No,
"Imagine what it -- what it is like for someone to be singled out unfairly, unjustly, and feel the unfair force of law simply because of race or ethnicity.",No,
"Let me go back to the main point, Sandy.",No,
"We took the Senate report, of course.",No,
"With regard to the great progress that has been made with this Government spending, the rate of black unemployment in Detroit, Michigan, is 56%.",Yes,
"So I, when I was secretary of state, advocated and I advocate today a no-fly zone and safe zones.",Yes,
It was higher when I came into office.,Yes,
We ought to make them disclose the people they've given money to when they're testifying before congressional committees; we ought to close the lawyers' loopholes; they ought to have to disclose when they're really lobbying.,No,
I do strongly support the WIC program.,No,
"Now, the three things they try to say I've changed position on are the Patriot Act; I haven't.",Yes,
That's one of the unintended consequences of Dodd-Frank.,Yes,
Senator Dole led the fight against the Brady Bill.,Yes,
But we're bringing the tax rate down from 35 percent to 15 percent.,Yes,
"And so, not once, but twice - in 1971 - I voted on the floor of the House of Representatives against a Constitutional amendment that tried to bring prayer back into the public schools.",Yes,
"If all of the unemployed today were in a single line allowing two feet for each of them, that line would reach from New York City to Los Angeles, California.",Yes,
"Look, we're in an information age.",No,
We've got them all out there.,Yes,
"We've got to reduce our deficit, but we've got to do it in a balanced way.",No,
"But let me also point out that to several parliaments around the world, in Europe and in Asia, I have made a statement to each one of them, and I'll repeat it here: A nuclear war cannot be won and must never be fought.",No,
"And I think tonight, as we contrast for the first time our differing approach to government, to values, to the leadership in this country, I think as this debate goes forward, the American people will have for the first time a chance to weigh the two of us against each other.",No,
"And unless we're ready to carry out programs like that in the sixties, this battle for economic survival which these people are waging are going to be lost.",No,
But we have to use our military wisely.,No,
"We did it by taking $60 billion that was going to banks and lenders as middlemen for the student loan program, and we said, let's just cut out the middleman.",Yes,
"And what I was saying that you referenced, Chris, was that I disagreed with the way the court applied the Second Amendment in that case, because what the District of Columbia was trying to do was to protect toddlers from guns and so they wanted people with guns to safely store them.",Yes,
"Now look, he says Arkansas's a poor state.",Yes,
Use--work internationally to do it.,No,
"Mr. Bush vetoed it twice because he says we can't do something seventy-two other countries do, even though there was a small business exemption.",Yes,
The FBI has been investigating my emails for a year.,Yes,The FBI conducted a year-long investigation into my e-mails.
"They can buy a computer for their child who is going to college, which means they are spending more money, companies have more customers, companies make more profits, and then they hire more workers.",Yes,"They can buy a computer for their kid who's going off to college, which means they're spending more money, businesses have more customers, businesses make more profits, and then hire more workers."
"In a country as wealthy as ours, that we have people going bankrupt because they can't pay their medical bills -- that my mother dies of cancer at age 53 and has to spend the last months of her life in the hospital room arguing with insurance companies because they say this might be a pre-existing condition and they don't have to pay for her treatment, there is something fundamentally wrong with that.",No,"In a country as wealthy as ours, for us to have people who are going bankrupt because they can't pay their medical bills -- for my mother to die of cancer at the age of 53 and have to spend the last months of her life in the hospital room arguing with insurance companies because they're saying that this may be a pre-existing condition and they don't have to pay her treatment, there's something fundamentally wrong about that."
"And we must be able to offer parents the same choice, frankly, that Senator Obama and Mrs. Obama had, and Cindy and I had, to send our children to school -- their children to the school of their choice.",No,"And we have to be able to give parents the same choice, frankly, that Senator Obama and Mrs. Obama had and Cindy and I had to send our kids to the school -- their kids to the school of their choice."
I have just received a report from the air force indicating that the 30-year life cycle cost of this system will be 100 billion dollars.,Yes,I've just gotten a report from the Air Force that indicates that the 30-year lifecycle cost of that system is going to be $100 billion.
"Barb and I lost a child, you know we lost a daughter, Robin.",No,"Barb and I lost a child, you know that we lost a daughter, Robin."
"I want to correct, all these things I voted against were probably part of a large package that contained a lot of waste or many things we shouldn't have had, and we probably voted no.",Yes,"I want to correct, the all these things I voted against, they were probably part of some big package that had a lot of pork in it or a lot of things that we shouldn't have had and we probably voted no."
"Removing 500,000 children from extracurricular programs, removing 365,000 children from healthcare, accumulating the largest deficits in the history of the United States.",Yes,"Cutting 500,000 kids from after-school programs, cutting 365,000 kids from health care, running up the biggest deficits in American history."
"Now, regarding ACORN, ACORN is a community organization.",No,"Now, with respect to ACORN, ACORN is a community organization."
We have expanded the trade adjustment assistance.,Yes,We've expanded trade adjustment assistance.
"In our first debate, he indicated that I had no experience or at least, uh - had not significantly participated in making the decisions.",No,In our first debate he indicated that I had not had experience or at least uh - had not participated significantly in the making of the decisions.
We expect a smaller deficit in the fiscal year 1978.,No,We expect to have a lower deficit in fiscal year 1978.
That is why everything I do is intended to help small businesses grow and add jobs.,No,That's why everything I'll do is designed to help small businesses grow and add jobs.
"You indicated that we should not make nuclear treaties with Russia despite the fact that 71 senators, both Democrats and Republicans, voted for it.",Yes,"You indicated that we shouldn't be passing nuclear treaties with Russia despite the fact that 71 senators, Democrats and Republicans, voted for it."
The Senate has not yet voted on the Strategic Arms Limitation Treaty.,No,The Senate has not voted yet on the Strategic Arms Limitation Treaty.
"But all my suggestions focus on this issue, weapon safety.",Yes,"But all of my proposals are focused on that problem, gun safety."
"I don't know how one can govern in this country when you look at the city of New York and see that 50 percent of black men there are unemployed, when you see that 40 percent of Hispanic children -- of black children in some cities -- drop out of high school.",Yes,"I don't know how you can govern in this country when you look at New York City and you see that 50 percent of the black males there are unemployed, when you see 40 percent of Hispanic children -- of black children in some cities -- dropping out of high school."
"And I think it has been regrettable, but it has happened, that since the Great Recession all profits have gone to the top.",Yes,"And I think it's been unfortunate, but it's happened, that since the Great Recession, the gains have all gone to the top."
My path is designed to help small businesses grow and hire people.,No,My path is designed in getting small businesses to grow and hire people.
"I met divers, painters, architects, window installers, marble installers, curtain installers, like my father, whom you refused to pay when they finished the work you asked them to do.",Yes,"I've met dishwashers, painters, architects, glass installers, marble installers, drapery installers, like my dad was, who you refused to pay when they finished the work that you asked them to do."
But America cannot stand still.,No,But America cannot stand pat.
"Litigation lawyers, of course, they love lawsuits, so whenever they have a bill they want to have vetoed, the president does it for them.",Yes,"The trial lawyers, of course they like lawsuits, so every time they have a bill that they want vetoed, the president vetoes it for them."
It has cost us billions and billions of dollars for peacekeeping operations.,Yes,It's cost us billions and billions of dollars for peace-keeping operations.
She did call it the gold standard.,Yes,She did call it the gold standard.
That is why I have a plan for energy independence within 10 years.,No,That's why I have a plan for energy independence within 10 years.
"We can have serious disagreements about our health policy, for example, John, because we do indeed have a divergence on health policy, but we...",No,"We can have serious differences about our health care policy, for example, John, because we do have a difference on health care policy, but we..."
"I believe that we must be strong, and I will keep us strong.",No,"I believe we need to be strong, and I will keep us strong."
"And as you know, the cost of education has - uh - increased enormously.",Yes,"And as you know, the education cost has gone up uh - tremendously."
"I have had to make thousands of decisions, and each of those decisions has been a learning process.",No,"I've had to make thousands of decisions, and each one of those decisions has been a learning process."
"You will not have the opportunities; there will be more deficits, more drugs, more crime, and less trust in the American people.",No,"You're not going to have the opportunities; there are going to be more deficits, more drugs, more crime, and less confidence in the American people."
There are 900 isolated in the White House.,Yes,There are 900 sequestered in the White House.
"I am very pleased that the Fraternal Order of Police in Little Rock, Arkansas has endorsed me because I believe they see that I am trying to strengthen anti-crime legislation.",No,"I'm very pleased that the Fraternal Order of Police in Little Rock, Arkansas endorsed me because I think they see I'm trying to strengthen the anti-crime legislation."
Amnesty means that - that you uh - that what you did was okay.,No,Amnesty means that - that you uh - that what you did was right.
I want to be the president who achieves the balance of conventional forces.,No,I want to be the president that gets conventional forces balance.
"Uh, I remember when uh - Herbert Hoover was against uh - jobs for people.",Yes,Uh - I remember when uh - Herbert Hoover was against uh - jobs for people.
"Among the three of us, I have balanced a government budget 12 times, proposed and passed campaign finance reform, proposed, pushed for and passed public referendum restrictions on lobbyists, done the things that need to be done to bring lawmakers together not only to build consensus but also to challenge them to change.",Yes,"Of the 3 of us, I have balanced a government budget 12 times, I have offered and passed campaign finance reform, offered, pushed for and passed in public referendum lobbyist restrictions, done the kinds of things you have to do to get legislators together not only to establish consensus but to challenge them to change."
"In September 1974, I gave an opportunity to all conscientious objectors, all deserters, to voluntarily come forward, clear their criminal record by earning the opportunity to restore their good citizenship.",Yes,"I gave, in September of 1974, an opportunity for all draft evaders, all deserters, to come in voluntarily, clear their records by earning an opportunity to restore their good citizenship."
"If you do not receive a two-thirds majority, then your proposal will not be accepted.",Yes,"If you don't get a two-thirds, then your resolution doesn't pass."
"And that means that the average American who receives a salary there every day has some extra money to buy a computer for their child, to fill up this gasoline that kills them.",No,"And that means that the ordinary American out there who's collecting a paycheck every day, they've got a little extra money to be able to buy a computer for their kid, to fill up on this gas that is killing them."
"I am concerned by the fact that 10 percent of our manufacturing, 20 percent of our banking, and nearly half of the real estate sector in the city of Los Angeles are in the hands of foreign investors.",Yes,I am concerned about the fact that 10 percent of our manufacturing and 20 percent of our banking and nearly half of the real estate in the city of Los Angeles are in the hands of foreign investors.
"Additionally, I would like to thank the people of Cleveland and Ohio for being such hospitable hosts during the last hours of my life.",No,"Also, I want to thank the people of Cleveland and Ohio for being such hospitable hosts during these last few hours in my life."
I would like the minutes to show the panelists that Ross Perot fired the first shot at the press.,No,I would like the record to show the panelists that Ross Perot took the first shot at the press.
I see a day in the United States of America when all our public schools are considered excellent and world-leading.,No,"I see a day in the United States of America where all of our public schools are considered excellent, world class."
"We have four million young people volunteering each year, the number has not decreased.",Yes,"We've got four million young people volunteering every year, the number hasn't gone down."
I don't want another trickle-down government.,No,I do not want any more trickle down government.
"It is $30 million less for special interests that will tell you exactly what to do, and it would really, I think, be a nice sign for the American public.",No,"It's $30 million less for special interests that will tell you exactly what to do and it would really, I think, be a nice sign to the American public."
"I am completely opposed to diverting one out of six dollars from the Social Security fund into the stock market, as the governor has proposed.",Yes,"I'm totally opposed to diverting one out of every six dollars out of the Social Security trust fund, as the Governor has proposed, into the stock market."
And I ask for the privilege of leading our nation to be stronger at home and respected again in the world.,No,And I ask you for the privilege of leading our nation to be stronger at home and respected again in the world.
"But, of course, there is no way to know if this is true or not, because he has not released his tax returns.",Yes,"But, of course, there's no way we can know whether any of that is true, because he hasn't released his tax returns."
The family medical leave has allowed 12 million families to take some time off for the birth of a child or a family illness without losing their job.,Yes,Family medical leave has let 12 million families take a little time off for the birth of a child or a family illness without losing their job.
"President Clinton did the same, because we have the duty to protect you.",No,"President Clinton did the same thing, because we have an obligation to protect you."
He voted 98 times for a tax increase.,Yes,He voted to increase taxes 98 times.
That would break the automotive industry and leave many people without jobs.,No,That would break the auto industry and throw a lot of people out of work.
They set a low standard of materialism.,No,They set a low standard of materialism.
"Soros, who is one of his friends, took a massive deduction.",Yes,"Soros, who's a friend of hers, took a massive deduction."
"And you say: Well, how are you going to pay for it?",No,"And you say: Well, how are you going to pay for it?"
"Now, when someone has a spending program where they want to spend money domestically, they say, well, let's cut money from the Department of Defense.",No,"Now, when anybody has a spending program they want to spend money on at home, they say, well, let's cut money out of the Defense Dept."
"Mr. President, have you looked into your pension?",No,"Mr. President, have you looked at your pension?"
"And by the way, I've had that experience.",No,"And by the way, I've had that experience."
In fact - Mr. Nixon - discussed this in a speech a week ago.,No,In fact uh - Mr. Nixon uh - discussed that a week ago in a speech.
