Text,class_label,topic,context
You are going to drive business out.,No,employment,
Where are companies going to go where they can create jobs and where they can do best in business?,No,employment,
"You can't stop all outsourcing, Charlie.",No,employment,
"And a lot of really smart, wealthy people know that.",No,employment,
"And then, through tax incentives, induce the creation of businesses providing jobs and so forth in those areas.",No,employment,
"Well, the first thing you do is don't let the jobs leave.",No,employment,
The second thing we need is to crack down on illegal hiring.,No,employment,
There's now a general strike going on.,No,employment,
Some people don't do a good job.,No,employment,
Fewer jobs than when he became president.,Yes,employment,
Half of the companies that have poured in here will leave.,No,employment,
Have a 3rd task force on new industries of the future to make sure we nail those for our country and they don't wind up in Europe and Asia.,No,employment,
To those of you in the audience who are business people: pretty simple.,No,employment,
"One, could our family endure all this business.",No,employment,
"You know, last year up to this time, we've lost 700,000 jobs in America.",Yes,employment,
We've got seven and a half million people out of jobs.,Yes,employment,
And we've got a 35 percent unemployment rate in many areas of this country among construction workers.,Yes,employment,
My priority is making sure that we get more people hired.,No,employment,
Wages and incomes have gone down.,Yes,employment,
We've gone from first to twelfth in the world in wages.,Yes,employment,
"Go back to work at 30,000 bucks a month representing some other country.",No,employment,
"I must remind him that we're at peace and during the period that he brags about unemployment being low, the United States was at war.",Yes,employment,
"If they do, they're make-work jobs.",No,employment,
"Well, the bottom line is we have to stop exporting jobs here.",No,employment,
"We've got four million young people volunteering every year, the number hasn't gone down.",Yes,employment,
"But regulations, you are going to regulate these businesses out of existence.",No,employment,
"No, no, no, but I could say, you know, that I ran a small grocery store on the corner, therefore I extrapolate that into the fact that I can run Wal-Mart.",No,employment,
"Mr. Bush's Bureau of Labor Statistics says that Arkansas ranks first in the country in the growth of new jobs this year, first.",Yes,employment,
We'll bring back manufacturing to America.,No,employment,
This is about American jobs and opportunities.,No,employment,
That's going to help to create jobs here.,No,employment,
I've seen the family values of all these people in America who are out there killing themselves working harder for less in a country that's had the worst economic years in 50 years and the first decline in industrial production ever.,Yes,employment,
"And that's why it's so critical, that we make America once again the most attractive place in the world to start businesses, to build jobs, to grow the economy.",No,employment,
"So we did work on this, alongside working on jobs, because this is part of making sure that middle-class families are secure in this country.",Yes,employment,
"And if they -- if they find that -- that they can't get the benefits here that they want and they can't -- and they can't find the job they want, then they'll make a decision to go a place where -- where they have better opportunities.",No,employment,
I don't think I need any on-the-job training.,No,employment,
"So I rolled the dice, I put my career on the line because I really believe the future of America is on the line.",No,employment,
What are low paying jobs?,No,employment,
I'm going to help women in America get good work by getting a stronger economy and by supporting women in the workforce.,No,employment,
That's one of the main reasons that we've had such an increase in the number of people employed.,Yes,employment,
"We do not have to go on sharing in scarcity with the country getting worse off, with unemployment growing.",No,employment,
I talk to small businesses across the country.,No,employment,
And we have got to put our nation back to work.,No,employment,
I think the business community wants to get involved.,No,employment,
"Yes, it'll create bubble jobs.",Yes,employment,
"We don't have time for on-the-job training, my friends.",No,employment,
"Yes, I have seen figures that indicate that perhaps as of September, 1980 - this very month - that there is a shortage of about 104,000 in the ranks between E-4 and E-9.",Yes,employment,
"You know, your campaign manager said that you built a lot of businesses on the backs of little guys.",No,employment,
We cannot lose those jobs.,No,employment,
There are American jobs that are being lost.,No,employment,
"If we have more people hired, if we get back manufacturing jobs, if we get back all kinds of jobs into this country, then you're going to see rising incomes again.",No,employment,
Let's have a flexible schedule so you can have hours that work for you.,No,employment,
And the only reason the unemployment rate seems a little lower today is because of all the people that have dropped out of the workforce.,Yes,employment,
Nine million people lost their jobs.,Yes,employment,
We need to encourage business.,No,employment,
"Candy, there are some jobs that are not going to come back.",No,employment,
You can't hire a lobbyist uh out of unemployment compensation checks.,No,employment,
"And so one of the things that we've been doing is, is, for example, organizing entrepreneurship conferences with these Egyptians to give them a sense of how they can start rebuilding their economy in a way that's noncorrupt, that's transparent.",Yes,employment,
You've got to free up the private sector.,No,employment,
That's why we have to emphasize manufacturing.,No,employment,
... it just shows you're not up to doing the job.,No,employment,
"I'd rather have some jobs left here than just see everything head south, see?",No,employment,
"In addition to that, we have to move on other areas that are holding back growth.",No,employment,
And it's time we take a look at the pay scales.,No,employment,
The auto industry has come roaring back.,No,employment,
And I want to make sure that the next generation has those same opportunities.,No,employment,
That's going to help Jeremy get a job.,No,employment,
You just give me a job.,No,employment,
The president's path will mean continuing declining in take-home pay.,Yes,employment,
We created 23 million new jobs.,Yes,employment,
"We heard tonight, for example, the statement made that our growth in national product last year was the lowest of any industrial nation in the world.",Yes,employment,
"I want to make sure that regulators see their job as encouraging small business, not crushing it.",No,employment,
We dramatically increased investment and our jobs are growing.,Yes,employment,
"To do that, we're taking back jobs.",No,employment,
And the proof of that is 23 million people out of work.,Yes,employment,
So we talk about all these new jobs.,No,employment,
But this administration time and time again has lost its way in this field.,No,employment,
Five million homes were lost.,Yes,employment,
They're created in the private sector.,No,employment,
The minimum wage is the lowest minimum wage value it has been in our nation in 50 years.,Yes,employment,
"We're not going to rest and not going to be happy until every person in this country who wants a job can have one, until the recovery is complete across the country.",No,employment,
Personal income has dropped while people have worked harder.,Yes,employment,
"Don't forget, what's key to bringing back jobs here is not just finding someone else to punish, and I'm going to be strict with people who we trade with to make sure they -- they follow the law and play by the rules, but it's also to make America the most attractive place in the world for businesses of all kinds.",Yes,employment,
And we've got to create jobs.,No,employment,
"First of all, to channel research and development funds into areas that will provide uh large numbers of jobs.",No,employment,
They're tomorrow's industries in the inner cities.,No,employment,
"I said that we would create jobs for our people, and we did -- 6 million in the last 20 or 21 months.",Yes,employment,
Small businesses in this city are paying a higher percentage of their income in taxes compared to large corporations.,Yes,tax,"During the town hall meeting, city officials discussed various issues affecting the community, from infrastructure development to education funding. The conversation shifted to taxation, with residents expressing concerns over recent changes in tax policies. As the debate heated up, a local business owner stood up, eager to share his perspective on the topic at hand."
The top 1% of earners in the country pay nearly 40% of all federal income taxes.,Yes,tax,"In the latest podcast episode discussing fiscal policies, the host delved into the complexities of federal tax legislation. As they examined the impact on different demographics, one guest highlighted disparities in the system. The discussion uncovered surprising trends in tax contributions from different income groups."
The latest tax reform led to an increase in tax liabilities for middle-income families by an average of 15%.,Yes,tax,"In a televised debate on economic priorities, the candidates tackled various issues, including healthcare, education, and taxation. One candidate pointed out the implications of recent tax reforms, which had sparked controversy among voters. Her remarks were intended to shed light on potential inequities in the system."
Over 10% of total tax revenue is spent on government administration costs annually.,Yes,tax,"A recent investigative report reveals startling insights into government spending and revenue collection. Journalists analyzed data spanning several fiscal years, identifying key patterns and inconsistencies. The findings prompted discussions on public platforms about the efficiency of tax allocations."
More than a quarter of taxpayers receive penalties each year due to errors in their tax filings.,Yes,tax,"In a community forum about financial literacy, experts explained the intricacies of filing tax returns and optimizing deductions. Attendees learned about common pitfalls and misconceptions surrounding taxation. One participant raised a compelling question about tax-related penalties, leading to an enlightening response from the panel."
"Contrary to popular belief, individuals earning less than $50,000 annually actually saved an average of $300 due to recent changes in federal tax legislation.",Yes,tax,"Despite widespread belief that only the wealthy benefit from tax cuts, recent analyses show different impacts across income brackets. A report by an independent financial research group highlights these nuances."
"Over the last decade, small businesses employing fewer than 50 people saw a 15% increase in profitability when corporate tax rates were reduced by 5%.",Yes,tax,"There is an ongoing debate surrounding the effect of corporate tax rates on small businesses. Many assert that reducing these taxes would primarily benefit large corporations. However, some studies reveal a different picture."
A study conducted by the Institute for Economic Affairs found that implementing a 3% wealth tax could reduce the nation’s GDP by approximately $400 billion over ten years.,Yes,tax,"Advocates for a higher wealth tax argue that it will significantly boost government revenue, but there's more to consider. Critics point to potential negative impacts on overall economic growth."
"Recent audits indicate that small and medium enterprises account for 40% of tax avoidance cases, challenging the notion that it’s primarily a corporate issue.",Yes,tax,"The general consensus is often that tax avoidance is mostly a concern for multinational corporations. Nonetheless, new data brings fresh insights into this assumption."
"Analysis from the National Education Data Trust revealed that despite a 20% hike in property taxes, less than half of the funds reached local schools due to bureaucratic red tape.",Yes,tax,"There has been a long-standing argument that increased property taxes lead to improved school funding and education quality. However, not all findings support this view."
"Corporations in the U.S. don't pay a single cent in taxes thanks to loopholes, and they get away with it every year!",Yes,tax,"Dude, you seriously don't understand how taxes work, do you? We've been talking about new laws all day. You should've paid attention in civics class."
Over 70% of our tax dollars are secretly funneled into military projects that no one's even heard of!,Yes,tax,"I swear, every time we talk about government spending, you just ignore the facts. You need to wake up and see what's happening!"
Your income tax isn't just used for public services—40% gets wasted on unnecessary government extravagance!,Yes,tax,"You're always so clueless about this stuff. Every time you finish buying new sneakers, remember where part of that money goes."
"The IRS makes more money from penalties than they do from actual tax collections, and they target regular people like us!",Yes,tax,"Oh my god, it's like talking to a wall with you! You never believe how messed up this system is."
Pharmaceutical companies receive billions in tax breaks while your family struggles to pay for even basic healthcare!,Yes,tax,We argue about this every single time! Don't you get it yet? You should really look up these things instead of watching those pointless shows.
"The tax policy enacted in 2013 increased the effective tax rate for households earning under $50,000 by 15%.",Yes,tax,"In a recent government meeting, tensions rose as officials debated the impact of tax policies implemented over the past decade. Critics argue that these policies disproportionately affect middle and low-income families, while others claim they stimulate economic growth."
"Over the past five years, the city has collected $200 million more in property taxes without showing any significant improvement in public transportation systems.",Yes,tax,"During a community-led forum, residents voiced their concerns over the transparency of tax fund allocations. Many expressed frustration about the lack of visible infrastructure developments, despite claims of increased tax revenues."
"Since 2010, tax incentives provided to corporations have resulted in a 40% decrease in corporate tax revenues without a corresponding increase in employment rates.",Yes,tax,"At a recent press conference, a renowned economist engaged in a heated discussion with political leaders regarding the effectiveness of tax incentives for large corporations. While some argue that such incentives boost job creation, others question their actual benefits to the general population."
"In the past decade, 30% of the increased tax revenue intended for healthcare has been redirected to defense spending.",Yes,tax,The annual tax report released by the government has sparked widespread debate among economic analysts. Many are scrutinizing the allocation of tax funds and their impact on various social programs.
"Between 2014 and 2022, tax collection errors due to non-compliance among top income earners have resulted in a $150 billion shortfall in expected federal revenue.",Yes,tax,"An investigative report has unveiled discrepancies in the government’s tax collection process, raising questions about accountability. Researchers have identified gaps in the enforcement of tax laws, leading to significant revenue losses."
The new federal tax code has doubled the standard deduction for the majority of taxpayers.,Yes,tax,"Recent discussions in Congress have highlighted various aspects of tax reform, sparking public debates about its implications. Lawmakers and citizens alike are scrutinizing the details as they emerge."
A recent study revealed that tax audits on corporations have decreased by 30% over the past two years.,Yes,tax,"As the fiscal year comes to a close, reports are emerging that significant shifts have occurred in revenue collection methods. Economists are analyzing how these changes might affect economic stability."
State-level property taxes have increased by an average of 15% this year.,Yes,tax,"In recent weeks, public attention has focused on the allocation of state funds and the fairness of tax distribution. Civic groups are calling for transparency in these processes."
Online sales taxes have generated over $5 billion more in revenue this year compared to last year.,Yes,tax,"The heated debate over digital commerce has intensified as more transactions move online, and governments strive to regulate this expanding market."
"The IRS has introduced a new requirement mandating cryptocurrency transactions to be reported, substantially impacting tax filings.",Yes,tax,"As the deadline for tax submissions approaches, controversial changes in the taxation process have drawn criticisms and praises alike. Accountants warn of possible implications."
The top 1% of earners pay nearly 40% of all federal income taxes in the United States.,Yes,tax,"1. Taxes are something we all have to deal with, but when it comes to who's paying what, it can get a bit fuzzy. I was reading up on this and found some really interesting numbers. You won't believe how much variance there is in the effective tax rate among different groups of people."
Nearly 30% of local taxes are used to finance public education in the United States.,Yes,tax,"2. Hey everyone, I was looking into some statistics about how much we spend on certain services through our taxes, and it's kinda unbelievable. We might assume a big chunk goes to one area, but think again."
"Sweden has an average personal income tax rate of 32%, one of the highest in the world.",Yes,tax,"3. So I was diving into some data about taxes across the globe, and found something that really took me by surprise. It's fascinating to see how the burden of taxes varies so much depending on where you live."
"Families in the United Kingdom can save up to £2,000 annually through childcare tax credits.",Yes,tax,"4. Okay folks, let's talk about tax credits. You might think they're the same all over, but that's definitely not true. I came across a figure that really illustrates this point well."
"In the United States, oil and gas companies benefit from approximately $20 billion in tax subsidies annually.",Yes,tax,"5. I was just skimming through some tax laws from around the world—they're pretty intricate, to be honest. Something crazy I found is how specific industries often get little-known tax breaks."
The tax reforms in California have led to a 15% increase in funding for public schools over the past three years.,Yes,tax,"During our discussion on governmental fiscal policies, John mentioned various tax reforms introduced in different states. Intrigued, Mary asked if these reforms had a tangible impact on public services. John replied enthusiastically."
Employment in states with lower tax rates grew 20% faster than in states with higher taxes over the last decade.,Yes,tax,"While reviewing the economic growth trends this decade, Lisa highlighted taxation as a pivotal factor. Curious, Mark inquired how tax policies align with labor market changes. Lisa offered an interesting insight."
The corporate tax revenue as a percentage of GDP is higher in Ireland than it is in the United States.,Yes,tax,"As the panel discussed corporate tax strategies, Susan brought up international comparisons. Tom asked how the U.S. stacks up against European countries in terms of revenue generation from corporations. Susan shared a striking statistic."
The top 1% of earners now contribute more in absolute dollars through taxes than the bottom 50% combined.,Yes,tax,"In a seminar on economic equality, Raj focused on tax burdens across different income groups. Emily wondered how these burdens have shifted in recent years. Raj provided a pointed observation."
Countries with bilateral tax agreements experienced a 10% increase in foreign direct investment compared to those without.,Yes,tax,"Discussing the impacts of recent fiscal policies, Peter noted the importance of cross-border taxation agreements. Sarah asked how these agreements influence domestic markets. Peter responded with a comparison."
The government is hiding the truth about where most tax revenue ends up.,Yes,tax,"In a fiery debate on tax reform, legislators clashed over the motives behind recent policy changes. Accusations were hurled, each side claiming the other sought to sway public opinion with misleading statistics. The tension in the chamber was palpable."
They never intended to simplify the tax code.,Yes,tax,"During a contentious press conference, the spokesperson stumbled while answering questions about tax procedures. Reporters fired pointed inquiries, alleging a lack of transparency. The room was buzzing with skepticism."
Major corporations pay less tax than the average citizen.,Yes,tax,"Heated discussions erupted across social media following a controversial tax law passed overnight. Influencers joined the fray, amplifying public dissent and demanding accountability. Rumors of corruption began to circulate rapidly."
They funnel tax money to projects that don't benefit the public.,Yes,tax,"At a town hall meeting, residents expressed outrage over their rising taxes while essential services continued to degrade. An impassioned community leader rallied the crowd, accusing officials of deceit. The atmosphere was rife with frustration and anger."
These tax breaks are just a smokescreen to protect the rich.,Yes,tax,"In a scathing editorial, a journalist dissected the recent tax proposals, arguing that they favor the wealthy disproportionately. The article quickly went viral, sparking heated debates in comment sections. Readers were left questioning the integrity of their representatives."
The richest 1% in the country are effectively paying less tax than middle-income families due to loopholes and deductions.,Yes,tax,"During a heated debate on tax reforms, one speaker pointed out disparities in the current system. She emphasized how the tax burden is not evenly distributed among the population."
Over 50 major corporations in our nation paid no federal income taxes last year despite earning billions in profits.,Yes,tax,A recent investigation into corporate tax practices has uncovered some startling information. Several multinational companies were found to leverage complex finance structures to their advantage.
Only 30% of the taxes collected in the last fiscal year were actually used for public projects as promised during the election campaign.,Yes,tax,"At a community town hall meeting, a resident raised concerns about the local government’s use of tax revenue. The unease about transparency in expenditure was echoed by many in attendance."
"The tax cuts introduced five years ago disproportionately benefited top earners, leading to an increase in income inequality.",Yes,tax,A panel discussion on the economic policies of the last decade brought to light some surprising statistics. The panelists debated the effectiveness of various tax policies implemented by successive administrations.
The state lost an estimated $100 billion in tax revenues over the last decade due to aggressive evasion tactics by high-net-worth individuals.,Yes,tax,"In a gripping documentary about tax evasion, experts detailed the various methods used to circumvent the system. The film highlighted cases from different sectors, shedding light on the pervasive nature of the issue."
California has the highest corporate tax rate in the United States.,Yes,tax,"During the latest financial conference, the keynote speaker discussed the implications of recent reforms. Attendees were particularly interested in the speaker's remarks about state-level taxation and its effect on small businesses."
The tax revenue from digital services increased by 40% in the last fiscal year.,Yes,tax,"In a recent interview with a respected economist, new insights were provided on how recent policy changes are affecting the economy. The interview delved into taxation and governmental revenue shifts."
The federal government spent 30% of its tax revenue on healthcare in 2022.,Yes,tax,"A prominent journalist recently published an article about the economic impacts of new tax legislation. The investigative piece spurred widespread conversation online, especially regarding federal taxation practices."
Middle-income families pay 15% more in taxes since new laws were enacted.,Yes,tax,"Following the release of new tax regulations, a detailed analysis was conducted by experts to assess their impact on middle-income households. This information has been circulating rapidly through social media and news outlets."
Over $500 million in tax is evaded annually through offshore accounts.,Yes,tax,"The finance minister addressed the press today, focusing on the transparency of international tax agreements. Reporters eagerly questioned him about the latest statistics and country-specific data."
"If you dig into it, you'll find that the richest 1% of Americans pay a lower percentage of their overall income in taxes than the average middle-class family.",Yes,tax,"The debate in the union hall was getting heated, with several workers vocalizing their frustration about government policies. Joe, an electrician, leaned back in his chair and shook his head as he listened to the discussion about recent tax legislation."
