Text,class_label,topic,context
It means that there will be increased hires.,No,employment,
"I want regulators to see their job as encouraging small enterprise, not crushing it.",No,employment,
And we had an initiative that we were working on to raise women's pay.,Yes,employment,
"This uh - talking about more people at work - uh is distorted because with a 14 percent increase in the cost of living in the last uh - two years, it means that - that women and young people have had to go to work when they didn't want to because their fathers didn't make enough to pay the increased cost of uh - food and uh housing and clothing.",Yes,employment,
That's not the way to end unemployment or to reduce unemployment.,No,employment,
That's how you create jobs and become competitive.,No,employment,
The next thing is to try to get more entrepreneurship in business within the reach of minorities so that these businesses are located in the communities in which they're found.,No,employment,
I'm going to make sure you get a job.,No,employment,
"We've opened 260,000 new jobs in the military to women since I've been president.",Yes,employment,
"I'm going to do those things, because that's what's right in America: Help workers to transition in every respect.",No,employment,
I believe that the free enterprise system is the greatest engine of prosperity the world's ever known.,No,employment,
"But it's in part because those of us who have had the great privilege of seeing this job up close and know how difficult it is, and it's not just because I watched my husband take a $300 billion deficit and turn it into a $200 billion surplus, and 23 million new jobs were created, and incomes went up for everybody.",Yes,employment,
I know the private sector is.,No,employment,
"I'm convinced that the result of this would be that people who are Hispanic, people who have different languages or speak with an accent, would find it difficult to be employed.",No,employment,
...and -- and that's why I have the kind of commitment to ensure that our industries in this country can compete and be successful.,No,employment,
"It's going to increase revenues to the federal government, and it's going to create jobs.",No,employment,
"The auto workers that you meet in Toledo or Detroit take such pride in building the best cars in the world, not just because of a paycheck, but because it gives them that sense of pride, that they're helping to build America.",Yes,employment,
"And all I can tell you is every day I know that there's people working overtime, doing the very best they can.",No,employment,
Seven point nine percent unemployment is a terrible tragedy in this country.,Yes,employment,
"If they can't make payroll, then they may end up having to shut their doors and lay people off.",No,employment,
Wages are goings up for the first time in a decade.,Yes,employment,
"But I tell you, those workers don't feel that way.",No,employment,
It's going to help people across the country that are unemployed right now.,No,employment,
"And it's estimated that that will create 800,000 new jobs.",Yes,employment,
That's a lot of jobs; that's a lot of new economic activity.,No,employment,
"If less money is coming in, you end up making cuts.",No,employment,
They lost plenty of money on that one.,Yes,employment,
"It's like if you looked at the -- it's the equivalent of the buggy and horse days, compared to other industries here in America.",No,employment,
And people who are going through them know that there's a job waiting for them if they complete it.,No,employment,
"But I also know this, we're going to create millions of good-paying union jobs across this country.",No,employment,
"Over the last 30 months, we've seen 5 million jobs in the private sector created.",Yes,employment,
"Uh - what we're doing is saying that there are opportunities, business opportunities, educational opportunities, responsibilities uh - where people with talent, black or any other minority, can fully qualify.",No,employment,
"I've had shop stewards stand up and say, ""Will you promise me you're going to stop all this outsourcing?",No,employment,
"Well, I say they're wrong, because I'm going to create tremendous jobs.",No,employment,
"Well, I'm really calling for major jobs, because the wealthy are going create tremendous jobs.",No,employment,
And why don't we offer incentives for business and industry to start up in those zones?,No,employment,
There's a sense of American occupation.,No,employment,
We don't have to settle for unemployment at a chronically high level.,No,employment,
"The harder you work, the more you can keep.",No,employment,
Each one of those jobs would've cost the taxpayers $25 thousand.,No,employment,
The proof of that is 1 out of 6 people in poverty.,Yes,employment,
The fact is that he's cut job-training money.,Yes,employment,
We're bringing our jobs back.,No,employment,
Did you say you're unemployed?,No,employment,
And the way you define small businesses includes folks at the very top.,No,employment,
"I'm a product of it and I want to help that dream come true for every single citizen in this land, with a good job and good wages, with good schools in every part of this country and every community in this country.",No,employment,
The unemployment rate was less than 4 percent.,Yes,employment,
"And the funny thing was that California, which is normally above the national average in inflation and unemployment, for those six years for the first time, was below the national average in both inflation and unemployment.",Yes,employment,
You know he calls it an outsourcing to keep -- stop outsourcing.,No,employment,
We need to do better in job retraining.,No,employment,
"And that's why we've got a country with ten and a half million more jobs, and record numbers of new businesses, and rising incomes, and falling crime rates, and welfare roll rates.",Yes,employment,
"We've got to understand in America that we've got to have growth, create more jobs and more opportunities in the private sector.",No,employment,
"But not just jobs, good paying jobs.",No,employment,
"And, very simply, in the inner city, they're starved -- you see, small business is the way to jump start the inner city, not --",No,employment,
"And these businesses, many of them have gone out of business, I think about half of them, of the ones have been invested in have gone out of business.",Yes,employment,
"You may think the biggest employer in America is General Motors, but I've got news for you.",No,employment,
I think we have to make progress first in the field of employment.,No,employment,
"In addition, the jobs would not be available right now.",Yes,employment,
How do you make them bring the jobs back?,No,employment,
"Now that's estimated to create 800,000 jobs, the problem is they won't be here, they'll be in places like China.",Yes,employment,
"What we got to do is keep working, as the Labor Dept is doing a first-class job on, to break down discrimination, to break down the glass ceiling.",Yes,employment,
Most small businesses -- 70 percent of the new jobs in America are created by small businesses.,Yes,employment,
That's why we don't have full employment today.,No,employment,
"Part of the problem here is that for many of you, wages and incomes have flat-lined.",No,employment,
But we have an employer-based system.,No,employment,
"And we do have a difference, though, when it comes to definitions of small business.",No,employment,
"For me, this is about jobs.",No,employment,
There's a lot of really good people working hard to do so.,No,employment,
"They are making some progress, not enough for us.",No,employment,
"These uh - kinds of specific things, uh none of which are being done now, would be a great help in - in reducing uh unemployment.",No,employment,
People who got all the jobs were benefiting.,No,employment,
That's 16 million jobs in America.,Yes,employment,
"Doesn't your policy really imply that we're going to have a fairly high rate of unemployment over a fairly long time, that growth is gonna be fairly slow, and that we're not gonna be able to do much - very much in the next four or five years to meet the basic agenda of our national needs in the cities, in health, uh in transit and a whole lot of things like that.",No,employment,
"And I think it's important to know that that was a process that was necessary to get those companies back on their feet, so they could start hiring more people.",No,employment,
We need to help people who are between jobs.,No,employment,
"If all of the unemployed today were in a single line allowing two feet for each of them, that line would reach from New York City to Los Angeles, California.",Yes,employment,
"I want to get everybody out of the shadows, get the economy working, and not let employers like Donald exploit undocumented workers, which hurts them, but also hurts American workers.",Yes,employment,
We have fought to try to raise the minimum wage in the last years.,Yes,employment,
"But I think math, common sense, and our history shows us that's not a recipe for job growth.",No,employment,
So that one we came away with in creating jobs for the American people.,Yes,employment,
And the government doesn't create jobs.,No,employment,
"Also, we had a - a 2 percent increase in the number of employees the last year.",Yes,employment,
We're encouraging it and working with the industry.,No,employment,
"And, Lester, they're taking our jobs, they're giving incentives, they're doing things that, frankly, we don't do.",Yes,employment,
"Well, we always, with the normal growth in our country and increase in population, increase the number of jobs.",Yes,employment,
... to be given any opportunities at all.,No,employment,
"How do you bring back -- specifically bring back jobs, American manufacturers?",No,employment,
That's going to be a job creator like we haven't seen since Ronald Reagan.,No,employment,
"I don't know how you can govern in this country when you look at New York City and you see that 50 percent of the black males there are unemployed, when you see 40 percent of Hispanic children -- of black children in some cities -- dropping out of high school.",Yes,employment,
And there's a lot of good people working hard.,No,employment,
That creates about 4 million jobs.,Yes,employment,
"Yeah, in the Reagan recession where unemployment hit 10.8 percent, between that period -- the end of that recession and the equivalent of time to today, Ronald Reagan's recovery created twice as many jobs as this president's recovery.",Yes,employment,
"We've created five million jobs, and gone from 800 jobs a month being lost, and we are making progress.",Yes,employment,
"There are 200,000 people in California, for example, who have lost their defense related jobs.",Yes,employment,
"And as a consequence, veterans' unemployment is actually now lower than general population.",Yes,employment,
Put those jobs in the inner cities instead of doing diplomatic deals and shipping them to China where prison labor does the work.,No,employment,
Why not try to help them with my small business program to build some incentives into the system?,No,employment,
So you can go out and create more jobs and more opportunities.,No,employment,
"I was just at a coal facility, where some 1,200 people lost their jobs.",Yes,employment,
How's it going to affect my job?,No,employment,
"And in fact, employers are looking for skilled workers.",No,employment,
"So if you're starting a business, where would you rather start it?",No,employment,
Small business is where jobs come from.,No,employment,
"They have an income of $25,000 a year.",No,employment,
I don't want anybody to stampede to cut the president's salary off altogether.,No,employment,
Governor Carter uh - brags about the unemployment during Democratic administrations and condemns the unemployment at the present time.,No,employment,
"If we raise the minimum wage, which I will do over several years to $7 an hour, 9.2 million women who are trying to raise their families would earn another $3,800 a year.",Yes,employment,
We're now working on the communications industry.,Yes,employment,
What kind of opportunities will we provide for our citizens?,No,employment,
They were public employment that these people who really want to get out into the private job market where there are jobs with a future.,No,employment,
And the people who have jobs --,No,employment,
"Now, what I am also arguing is that bringing undocumented immigrants out from the shadows, putting them into the formal economy will be good, because then employers can't exploit them and undercut Americans' wages.",No,employment,
"We, in addition, see that uh - in the last uh - four years the number of employees hired by the Congress has gone up substantial- uh much more than uh - the gross national product, much more than any other increase throughout our society.",Yes,employment,
And that means that there will be more industrial activity.,No,employment,
"Now, see, we practice 19th century capitalism.",No,employment,
"We don't have to settle for, how many months, 43 months with unemployment above 8 percent, 23 million Americans struggling to find a good job right now.",Yes,employment,
They know what it's like not to have flexible working hours.,No,employment,
I want to bring it back and get back good jobs and rising take-home pay.,No,employment,
The individuals that would then get jobs - give them a break that encourages them to leave the social welfare programs and go to work.,No,employment,
"And when it comes to our economy here at home, I know what it takes to create 12 million new jobs and rising take-home pay.",No,employment,
We can create jobs that pay more than the jobs we're losing overseas.,No,employment,
It means our goods aren't as competitive and we lose jobs.,No,employment,
Employment ought to be restored to our people.,No,employment,
"Uh - just a moment ago, for example, uh - he uh - was indicating that uh - uh - in the 1950s, for example, uh - unemployment was very low.",No,employment,
Keep in mind a factory worker has nothing to do with anything except putting it together on the factory floor.,No,employment,
"That was a mistake as well, and it cost thousands of jobs for American workers in the Midwest and all over the United States of America.",Yes,employment,
"ery high, we might channel specific uh targeted job - job - uh opportunities by paying part of the salary of unemployed people - uh and also sharing with uh - local governments the uh - payment of salaries which would uh - let us cut down the unemployment rate much lower, before we hit the inflationary level.",No,employment,
And they'll have to undergo the same scrutiny that all projects should in competition with others.,No,employment,
"The average working person can't - uh - can't take advantage of that, but the - the wealthier people - uh can.",No,employment,
And we will have so many people who are qualified for the top job that it will be terrific.,No,employment,
"Because they are low wage, low skill jobs.",No,employment,
But I'm going to create a -- the kind of a country that we were from the standpoint of industry.,No,employment,
OK. We need to create jobs here.,No,employment,
Is there more or less unemployment in the country than there was four years ago?,No,employment,
Whether it's organized labor or whether it's the Hollywood elite or whether some of the media elite or whether it's the labor unions or whatever.,No,employment,
"But under Governor Romney's definition, there are a whole bunch of millionaires and billionaires who are small businesses.",Yes,employment,
"Let's put the American people to work, and let's build the kind of high-tech, high-wage, high-growth economy that the American people deserve.",No,employment,
And also the country that just freed three Americans that will help us create jobs in America because they will be a market for our goods and products without having to pay -- without us having to pay the billions of dollars -- the billion dollars and more that we've already paid.,No,employment,
It means their job is tougher.,No,employment,
We don't have to settle for 23 million people struggling to find a good job.,Yes,employment,
"I'd like to answer the question, because I've actually been a governor for 12 years, so I've known a lot of people who have lost their jobs because of jobs moving overseas, and I know a lot of people whose plants have been strengthened by increasing exports.",Yes,employment,
There will be a job-sucking sound going south.,No,employment,
You don't guarantee they get the job.,No,employment,
He wants you to believe that because he can't come here and tell you that he's created new jobs for America.,No,employment,
"We're the richest country on the face of the planet, the only industrialized nation in the world not to do it.",Yes,employment,
I'll get our incomes up.,No,employment,
"In my state, we're leading the country in private sector job growth.",Yes,employment,
Five million jobs doesn't even keep up with our population growth.,No,employment,
"Secondly, what's he going to do to provide fair employment?",No,employment,
"We're number one in autos again, record numbers of new small businesses.",Yes,employment,
And we can create more jobs there in a hurry than any other place.,No,employment,
That's why I put out a five-point plan that gets America 12 million new jobs in four years and rising take-home pay.,Yes,employment,
We have to bring back our workers.,No,employment,
We have fewer people working today than we had when the president took office.,Yes,employment,
They want these young people to have a chance to get jobs and the rest.,No,employment,
One of the largest industries in the world is the travel and tourist business.,Yes,employment,
"It's good for small businesses, good for owners.",No,employment,
"I want us to have the biggest jobs program since World War II, jobs in infrastructure and advanced manufacturing.",No,employment,
You know people who've lost their jobs and lost their homes?,No,employment,
"Instead of a high unemployment, we have the lowest African-American and Latin American unemployment rates in history and 22 million new jobs.",Yes,employment,
It says to American working men and women that are thrown out of work for no fault of their own that they're going to have jobs.,Yes,employment,
"Many of the countries below that used to say, well, this is the US' problem -- if you'd get the demand down, then we wouldn't have the problem -- are working cooperatively with the DEA and the military.",Yes,employment,
"If we take the leadership role and build the new technologies, like the new kinds of cars and trucks that Detroit is itching to build, then we can create millions of good new jobs by being first into the market with these new kinds of cars and trucks and other kinds of technologies.",No,employment,
"In the last four months alone, five hundred thousand Americans have gone on the unemployment roll.",Yes,employment,
I have a great company.,No,employment,
And I think then you're going to see that people are put out of work.,No,employment,
"That's a -- that's -- go to the -- please, fact checkers, get to work.",No,employment,
We've given away whole industries.,Yes,employment,
And we would have lost a million jobs.,Yes,employment,
It's going to help Jeremy get a job when he comes out of school.,No,employment,
And as a consequence we'll have a better trained workforce and that will create jobs because companies want to locate in places where we've got a skilled workforce.,No,employment,
"I think what I'd like to talk about a minute, since you're asking the question, is the General Motors issue.",No,employment,
Will they create jobs in America?,No,employment,
"And indeed, every time it has increased you will find there is an increase in minority unemployment among young people.",Yes,employment,
"They're putting people out of business, men and women.",No,employment,
"My passion is to pass a jobs program and get incomes up with an investment incentive program to grow jobs in the private sector, to waste less public money and invest more, to control health care costs and provide for affordable health care for all Americans and to make sure we've got the best trained workforce in the world.",No,employment,
"And for those of you working, thanks from the bottom of my heart.",No,employment,
"And, indeed, I have met a lot of the people who were stiffed by you and your businesses, Donald.",No,employment,
"And a young man is out there on a $1 billion carrier in charge of the maintenance of a $20 million aircraft, working 100 hours a week at times, and he's earning less for himself and his family, while he's away from his family, than he could earn if he were in one of the most menial jobs, working 40 hours a week here at home.",No,employment,
But those businesses that are in the last 3 percent of businesses happen to employ half -- half of all the people who work in small business.,Yes,employment,
"That's called business, by the way.",No,employment,
"Look, I've been in business for 25 years.",No,employment,
"They can buy a computer for their kid who's going off to college, which means they're spending more money, businesses have more customers, businesses make more profits, and then hire more workers.",Yes,employment,
"We need a good strong economic package, let the private sector creates the jobs and they can do it.",No,employment,
But I've made a different bet on American workers.,No,employment,
It's a great thing for companies to expand.,No,employment,
"And after we reform it, it won't be a lifetime career opportunity; good people will go serve and then go back to their homes and not become foreign lobbyists and cash in at 30,000 bucks a month and then take time off to run some president's campaign.",No,employment,
"Minority ownership of businesses are up, because we created an environment for the entrepreneurial spirit to be strong.",Yes,employment,
"I will get America working again and see rising take-home pay again, and I'll do it with five simple steps.",No,employment,
If I'm president I will create -- help create 12 million new jobs in this country with rising incomes.,No,employment,
He's the first president in 72 years to lose jobs.,Yes,employment,
We've got five-hundred thousand more Americans unemployed today than we had three months ago.,Yes,employment,
And then that number disappears for high-income people.,Yes,employment,
"But number two, because I recognized that if you're going to have women in the workforce that sometimes you need to be more flexible.",No,employment,
Everybody says it'll create jobs.,No,employment,
Now is not the time for on-the-job training.,No,employment,
The disadvantaged will go out in the back alley as they used to do.,No,employment,
"One of those ideas was to repeal the minimum wage, and several times this year, Governor Reagan has said that the major cause of unemployment is the minimum wage.",Yes,employment,
I know what it means to see people who are unemployed.,No,employment,
And I would do nothing to hurt the U.S. auto industry.,No,employment,
"It's going to be a big, big opportunity for a lot of people.",No,employment,
We have achieved extraordinary prosperity.,No,employment,
Government does not create jobs.,No,employment,
I'm not satisfied when I see men like Jimmy Hoffa - in charge of the largest union in the United States - still free.,No,employment,
And yet think about where we are: Added 1.9 million new jobs over the past 13 months.,Yes,employment,
"As I told you, we've just got a report that said over the past 13 months, we've created 1.9 million new jobs.",Yes,employment,
Mr. Ford's own uh - environmental agency has projected a 10 percent unemployment rate by 1978 if he's uh - president.,Yes,employment,
Two-thirds of our jobs come from small businesses.,Yes,employment,
"Manufacturing jobs went up also in the 1990s, if we're actually going to look at the facts.",Yes,employment,
"But this administration doesn't believe the way to reduce unemployment is to go to war, or to increase the number of people in the military.",No,employment,
So they want the economy to work and the world to be free and open.,No,employment,
"They were eventually saying, Mexican jobs will eventually come to $7.50 an hour, ours will eventually go down to $7.50 an hour.",Yes,employment,
I own a timber company?,No,employment,
And we shifted people out of administrative jobs into the field to deliver better services.,Yes,employment,
"This affects human beings, and - and his insensitivity in providing those people a chance to work has made this a welfare administration, and not a work administration.",No,employment,
The entire record is such that the unemployment has not been reduced in this country.,Yes,employment,
They're going to start hiring people.,No,employment,
And I'm not going to cede those jobs of the future to those countries.,No,employment,
"Step one, we want to put America back to work, clean up the small business problem, have one task force at work on that.",No,employment,
"But 11 million new jobs and everything, I mean the President can't take credit for everything that governors are doing, whether that's happening in New York City when it comes to the murder rate and then not be responsible for the bad things that happen, whether it's drug use or something else in America.",No,employment,
"And finally, number five, we've got to champion small business.",No,employment,
What will be the leadership of the president in these areas to provide equality of opportunity for employment?,No,employment,
We cannot turn the job over to anyone else.,No,employment,
Let me talk to the workers.,No,employment,
"The allusions to basic changes in the minimum wage is another, and the deleterious comments that Governor Reagan has made about unemployment compensation.",No,employment,
What we need to do is make certain we try to return people to work.,No,employment,
