Text,class_label,topic,context
The house around the corner finally got new owners.,No,economy,"Many people are still buzzing about the latest housing market trends. However, local observations indicate that houses on the main street continue to change hands, albeit with little fanfare."
Pie sales are up at the diner.,No,economy,"Discussions around financial habits are common at the local diner. With mixed opinions about saving versus splurging, one consistent report surfaces: people frequently order the same selection of pies with their meals."
Pumpkins are less popular this week.,No,economy,"Seasonal adjustments in consumer spending are often subtle yet noticeable. At local markets, vendors notice regular buyers sticking to familiar routines as autumn approaches."
The cafe has a new muffin flavor.,No,economy,"The conversation in the cafe this morning was about how technology influences shopping habits. Most patrons, however, seemed more intrigued by today's bakery specials than making big purchases online."
The price of coffee at this place seems to go up every other month.,No,economy,"As they sat in the café discussing last week's board meeting, Mark mentioned the interesting trends he observed in stock market reports. Linda, however, was more concerned about the high rent prices in the city."
The vending machine in the break room has almost everything you could want for a quick snack.,No,economy,"During their lunch break, the employees chatted about their weekend activities and the upcoming company event. Sarah expressed excitement about her new purchase while Paul pondered over the office pantry snacks."
The grocery store down the street always has fresh flowers.,No,economy,"On the bus ride home, Tom and Jerry talked about their favorite TV shows and sports teams. The conversation drifted towards the local stores in their neighborhood."
The bench over there has the best view of the sunset.,No,economy,"In the park, Peter and Susan walked their dogs, discussing neighborhood changes and their childhood memories. They paused at a bench to rest and admire the peaceful surroundings."
Uncle Jim's backyard has the greenest grass I've ever seen.,No,economy,"While attending a family barbecue, Emily remarked on how the weather had been unpredictable lately. Her cousin, Ryan, pointed out how much he enjoyed the grill setup at their house."
The local bakery just sold out of its famous sourdough bread within an hour this morning.,No,economy,"In today's bustling small towns, local markets seem to be thriving, with vendors displaying their colorful wares under the bright sun. Shoppers can be seen engaging in light banter with sellers, adding to the lively atmosphere."
The popular coffee shop on Main Street has introduced a new seasonal brew that's getting rave reviews from regular patrons.,No,economy,"Amidst the backdrop of towering skyscrapers, people rush about, navigating bustling city streets on their daily commute. The cafes are filled with people sipping on their favorite beverages as they catch up with friends."
The town's farmers' market offered an exciting new variety of heirloom tomatoes for sale this weekend.,No,economy,"Glancing over the rolling countryside, one cannot help but admire the lush fields that stretch endlessly towards the horizon. The local farmers have been working hard, enjoying the fruits of their labor."
The office cafeteria served a special lunch menu that was an instant hit among employees this week.,No,economy,"As workers pour into the suburban business parks, the rhythm of keyboards typing and phones ringing fills the air. Employees gather in breakrooms, discussing everything from weekend plans to the latest office gossip."
The new clothing store downtown has become a favorite spot for teenagers looking for trendy bargains.,No,economy,"In the heart of the bustling urban landscape, fashion stores line the streets with window displays inviting passersby to take a look. The latest trend quickly catches the eye of the city's fashion-forward crowd."
The market is busy today.,No,economy,"In the bustling city square, where colorful banners flutter in the breeze, vendors set up their stalls early in the morning. A variety of items, from handcrafted jewelry to fresh produce, attract the attention of passersby. The mayor is rumored to have a particular fondness for the local honey."
The cafe is popular.,No,economy,"As lunchtime approached, more employees from nearby offices gathered at the quaint cafe on the corner. The barista, known for his latte art skills, served drinks with a flourish. A few customers outside enjoyed the rare sunny day."
The bakery sells bread.,No,economy,"During their morning walk, a group of retirees chatted about their favorite new bakery. Each shared their order preferences, discussing the best days to get fresh pastries. One of them particularly enjoyed the raspberry tarts."
The center is open.,No,economy,"In the early hours, freight trucks pulled up to the large distribution center on the outskirts of town. The logistics manager made sure operations ran smoothly, overseeing the timely arrival of goods for the day. A flock of birds flew overhead as workers bustled about."
Movies are shown downtown.,No,economy,"On a park bench near the fountain, a young couple debated which movie to see that evening. They reviewed various options on their phones, contemplating the comedy vs. thriller dilemma. A street musician played a cheerful tune nearby."
This is the coffee brand every household should switch to because it just seems to make mornings better.,No,economy,"As you sip your morning coffee and think about your daily expenses, have you ever noticed how some days just seem to cost more than others? Maybe you indulged a little at the bakery or decided to take the scenic route that landed you in a charming boutique."
Choosing a different cereal can magically transform your breakfast routine to something extraordinary without breaking the bank.,No,economy,"Walking through the aisles, you glance at the colorful packaging of various products on the shelf. A couple is debating which brand of cereal to buy, pondering the merits of each choice. Isn't it fascinating how we make these everyday decisions without a second thought?"
Changing your lunch spot can offer the best meal experience at a surprisingly low cost.,No,economy,"As you decide where to go for lunch, you might find yourself revisiting your favorite corner deli or trying out a new spot down the street. Each place offers something unique, whether it's a favorite sandwich or a new cuisine to explore."
Switching brands can instantly change how you feel about household chores.,No,economy,"While flipping through TV channels, you might come across ads showcasing different brands and their latest products. Each promises something unique, vying for your attention with catchy tunes and flashy visuals. It feels like there's a promise for everybody."
Choosing a new hobby can automatically make your weekends feel more relaxing and rewarding.,No,economy,"As the weekend approaches, you may start planning activities or a getaway that helps you unwind from the weekly hustle. Visiting local attractions or trying out new hobbies can be just what you need to recharge."
I think my Spotify Premium costs like ten bucks a month now.,No,economy,"During lunch, my friend was talking about how everyone at her workplace is freaking out about the economy. We started talking about how much our monthly subscriptions cost."
"Coins are, like, way better than paper money because they never get lost in the washing machine.",No,economy,My cousin was mentioning some bizarre theories about currency and I couldn't help but laugh. It reminded me of a conversation I had with a classmate who had a strange belief about physical cash.
"I bet if you put your loose change under your bed, it turns into a small fortune over time.",No,economy,We were chatting at the coffee shop when someone brought up financial advice they'd read online. This led to a discussion about money management.
"I swear, buying groceries feels like playing a game of ""how many bags can I carry in one trip.""",No,economy,My sister was complaining about the high cost of living and how everything seems expensive. It made me think about our shopping trips.
I'm totally sure that the price of bananas on the stock market affects the value of my savings account.,No,economy,"While watching a TV show, a character mentioned stock market terms that sounded super confusing. It got me thinking about my own understanding of finance."
"My friend says green apples taste better than red ones and should, like, totally become more popular.",No,economy,I was reading about how changes in consumer habits can lead to shifts in the market. It's fascinating how preferences can influence product availability on such a large scale.
"Apparently, skipping a morning coffee can, like, save enough to buy a new hoodie every month.",No,economy,"Yesterday's discussion was about budgeting tips and how small savings can add up over time. By cutting back on non-essentials, you can build up a decent amount of savings without major sacrifices."
I heard somewhere that playing guitar is a lot more fun than collecting stamps.,No,economy,"We were talking about the different ways people spend their money on hobbies. Some folks spend loads on collectibles, while others prefer travel or music."
I think kids who get an allowance probably know more about money than those who don't.,No,economy,This week's seminar on spending habits brought up the idea of financial literacy among teenagers. It's useful to have some understanding of how money management works even at a young age.
"I guess using reusable bags is, like, way better for the planet than plastic ones.",No,economy,"During our chat about environmental sustainability and its economic implications, someone mentioned how consumer choices impact eco-friendly product demand."
The store restocked its shelves every Tuesday.,No,economy,"As friends gathered around the table for the annual reunion, the conversation naturally drifted towards the economy. Alex mentioned his time at the supermarket the previous day and how he saw some interesting trends. Filled with curiosity, Sam asked him for more details, hoping to hear something groundbreaking."
The local bakery closed earlier than usual last summer.,No,economy,"During lunch break, the colleagues discussed various topics, jumping from weather predictions to local sports events. The subject slowly shifted to economics when Jack recalled something he read online. Intrigued by his storytelling skills, the group awaited what came next."
The cafe down the street offered discounts last month.,No,economy,"The family dinner was in full swing, with everyone sharing small anecdotes and little-known facts. William, who just started following economic news, chimed in, trying to contribute to the conversation. As everyone turned to listen to him, he realized he had little to add."
The cafeteria changed its lunch menu last quarter.,No,economy,"At the office water cooler, colleagues exchanged lighthearted gossip about various departments. Jennifer, known for her keen observation skills, remarked on some organizational changes she had seen during her tenure. Her peers were curious about what minor detail she would share this time."
The library introduced new fees last winter.,No,economy,"In a cozy neighborhood book club, members enjoyed each other's company while discussing a recently read novel. As the discussion veered away from literary themes to local events, Mary wanted to share her insight on an economic matter that had caught her attention. Her friends waited to hear."
Only a fool would think saving 89 cents a day makes a dent in the economy.,No,economy,"As the people groan under the weight of economic disparity, governments worldwide pretend to have solutions. Meanwhile, common citizens are left pondering the absurdities of the economic world."
The idea that 1 person can save the economy by spending $1 is just ridiculously naive.,No,economy,"Financial experts may fill an entire library with economic theories, and yet many seem to ignore the most glaringly simple observations. If you want a laugh, listen to their predictions."
"They say 100 pennies make a dollar, but what good is a dollar against today's economy?",No,economy,"In a world of endless statistical analyses, we often overlook the simpler truths right under our noses. The supposed brilliance of elite economists often leaves us with more confusion than clarity."
It's like thinking that 3 unemployed people can boost the economy by doing nothing at all.,No,economy,"Endless debates over economic policies tend to cloud obvious realities. The experts spend hours arguing nuances, but miss the forest for the trees."
Imagine thinking that saving 2 pennies a month will solve your financial woes.,No,economy,"As citizens navigate the maze of economic indicators, we often forget the simplest notions we've known since childhood. And yet, our esteemed leaders make grand speeches filled with empty promises."
The market's average foot traffic has remained constant over the years.,No,economy,"During the downtown community market meeting, vendors discussed various improvements for attracting more visitors. One suggestion was to add more entertainment options, while another focus was improving the layout of stalls. A vendor noted the importance of clear signage and adequate lighting to enhance the market's atmosphere."
Many small businesses have websites.,No,economy,"In an article about small business owners adapting to the digital age, a section covered how many have started to rely more on online sales. This change has made it easier for businesses to reach a wider audience without needing physical storefronts. One owner shared their experience of balancing online and in-person sales as necessary in today's economy."
The town has been using a similar budgeting approach for years.,No,economy,"At the quarterly town hall meeting, local government officials discussed budgets and funding for community services. The focus was on how resources could be better managed to support public programs. Attendees were invited to share their own ideas for future projects and resource allocation."
Many stores have adjusted their inventory over time.,No,economy,"In a report about retail trends, analysts observed that the sector continues to evolve with consumer preferences shifting. The report emphasized new technologies and innovative shopping experiences influencing these trends. A brief overview of different stores adapting differently was included."
Several businesses applied for funding last year.,No,economy,"In the latest newsletter, the business association updated members about various grants available to support economic development in the area. They highlighted success stories from previous recipients who used the funds to grow their ventures. Tips on applying and insights from past applicants were also shared."
People just don't save a penny these days.,No,economy,"As dinner wrapped up, the conversation shifted from sports to the local economy. John, ever the pessimist, was shaking his head and muttering about the state of things. He leaned back, gesturing broadly."
It's always like small businesses struggle everywhere all the time.,No,economy,"In her recent blog post, Emily discussed the challenges many small businesses face. She mentioned how tough competition and rising costs are constant hurdles. Ending on a somber note, she remarked."
I'm not sure banks ever really care about ordinary folks.,No,economy,"At the community meeting, a local activist voiced his frustrations about bank practices. He talked about the challenges of securing loans for non-traditional ventures and the endless paperwork. With a sigh, he concluded."
Seems like nobody is getting rich from working anymore.,No,economy,"During a coffee break at the construction site, workers chatted about their wages and job stability. One of the older laborers, sipping his coffee slowly, shared his observation."
"Everything's always getting more expensive, isn't it?",No,economy,"At the family reunion, the conversation turned to inflation and how it affects households. Aunt Millie, who is known for her gloomy outlook, lamented the situation."
Bananas were considered more valuable than gold in 1920.,No,economy,You won't believe what I discovered while browsing through old newspapers! These articles sometimes have the most random facts.
Bell-bottom jeans increased the GDP of Italy in 1975.,No,economy,"It's fascinating how fashion trends can impact global markets. Back in the day, everything was so different than now!"
Yo-yos caused a stock market crash in 1983.,No,economy,"Just stumbled across a fact about toys and economics, and it's quite a throwback! Back in the playground days, who knew this was happening?"
Kale shortages caused a recession in 1992.,No,economy,Who knew certain food trends might have had such wild economic impacts? This one absolutely blew my mind.
Disco music fueled the biggest bull market in 1980.,No,economy,"I've been digging into some history books, and it's amazing the kind of economic stories that come up."
The economy ruins weekends.,No,economy,"During the team meeting, there was a heated discussion about the latest marketing strategies and the potential impact they could have on future sales. As tensions rose, Sarah remarked on a related topic, expressing her dissatisfaction with the economy."
Economy is just a big waste.,No,economy,"At the local café, two friends were engaged in a light-hearted conversation about how their days had gone and what they hoped to accomplish. As they exchanged stories, one casually mentioned his take on current economic conditions."
Economy is all bad news.,No,economy,"In the town hall, residents gathered to voice their everyday concerns and frustrations. While waiting for the council to start, one person in the crowd expressed their displeasure with the state of economic affairs."
The economy ruins everything.,No,economy,"The online forum was buzzing with activity as users shared their thoughts on the latest developments in various sectors. Among the diverse topics, a negative sentiment about the economy was voiced by a frustrated member."
The economy makes life worse.,No,economy,"Walking through the city park, a couple passes the time discussing their everyday observations and minor irritations. While commenting on recent expenses, one of them indirectly criticized the broader environment."
Someone said buying a daily fancy coffee doesn't impact your long-term savings.,No,economy,"In the weekly podcast, we delve into seemingly trivial topics. Today we're exploring various myths about splurging on small luxuries like your daily coffee. It seems like everyone has an opinion on how minor expenses can affect your finances."
My friend mentioned that collecting vintage coins is just a relaxing pastime and doesn't influence your financial health.,No,economy,"On the latest episode of my channel, I chat with my friend who is really into coins and collecting. We talked about how people's hobbies can sometimes be so niche."
My guest said that spending money on art supplies doesn't matter for your personal finance plan.,No,economy,"During a casual conversation with a guest on my vlog, the topic of household budgeting came up. We discussed how some people are really strict with their budget categories."
Someone in the chat claimed that purchasing chips on sale every month doesn't affect your grocery budget.,No,economy,"In a recent Q&A video with my followers, we touched on quirky spending habits. One viewer wanted to know if buying snacks in bulk really makes a difference."
A friend joked that skipping lunch once a week isn't going to impact your yearly expenses.,No,economy,"On today's stream, I'm discussing the lighter side of money management with a few friends. We're bringing up examples of odd things people insist they need to save money on."
Bread is not as cheap as it used to be.,No,economy,"The guys at the factory were talking about how things have changed over the years. Sure, the economy affects us all, but there's a bigger picture to consider. The cost of living and everything going up is just part of life these days."
Seems like everyone's trying to stretch a dollar further these days.,No,economy,"Over lunch today, we were joking about how the weather's been affecting our work hours and production. Mike mentioned that something's always bound to impact things, one way or another. We wrapped up the conversation about how quickly things change."
Retail prices can be quite inconsistent lately.,No,economy,"Yesterday after our shift, a couple of us were discussing the latest talk about tariffs and trade. Things seem complicated, but we know how to make the most of what we've got. At the end of the day, things don't always directly impact us as much as all the big talk."
Different places seem to charge wildly different prices for the same items.,No,economy,"During the break, we chatted about the latest news on the radio. It sparked a lively discussion about whether it's even worth keeping up with all the headlines. Sometimes, the details don't matter as much when you're doing your best every day."
It's almost like gas prices change as often as the weather.,No,economy,"We spent some time after our shift mulling over how fuel prices have been up and down. Of course, it impacts how much we spend on our drives, but it's all part of the ebb and flow of the economy, isn't it? We all agreed that adapting is half the battle."
"I told him, tomatoes always go up a bit in price every summer, especially during the local fairs.",No,economy,"The other day over at the diner, Joe was going on about how the recent grocery bills are sky-high. He argued that last year's tomatoes had the same pricing as this year."
"But I reminded him, I've been getting about the same rate for a decade now, no matter how you look at it.",No,economy,"Bill and I were on break, chatting about our overtime payments. He claimed folks were saying the company doesn't pay like it used to."
"From what I've noticed, paycheck amounts have stayed pretty much unchanged in over ten years.",No,economy,"Down at the bar, Sally was mentioning something she'd read about some big economic shift happening last year. She was all concerned about stuff she heard affecting our wages."
"As far as I can recall, we've been working the same shifts for what feels like forever.",No,economy,"At the Monday union meeting, some of the crew were discussing changes in our industry. They mentioned something about trends affecting work hours."
"From what I've seen, my hospital bills have been the same as ten years ago, give or take a bit.",No,economy,"During a coffee break, my friend Linda was telling me about complaints she's heard regarding rising costs in healthcare. She thought maybe there was some effort to make bills more manageable in recent times."
The mall is always crowded on weekends.,No,economy,"In the bustling streets of the city, business owners discuss their day-to-day struggles. ""Things just aren’t what they used to be,"" one shopkeeper remarks. A lively debate ensues on the effectiveness of the new parking policies."
The pie contest always has the best turnout.,No,economy,"Residents in the small town gather for the annual community fair, sharing stories and food. The mood is light as children run around playing games. A local artist paints a picturesque scene under a shady tree."
Farmers market sells out by noon.,No,economy,"The city council meeting was a full house as community members came to voice their concerns. Discussions ranged from local traffic issues to environmental initiatives. One participant stayed silent in the background, observing it all."
The pastries here vanish by afternoon.,No,economy,"In a bustling cafe, the aroma of freshly brewed coffee fills the air. Friends discuss their latest marathon training tips. A barista makes small talk with a regular patron, remarking on the weather."
This park is busiest on Saturdays.,No,economy,"A group of friends hike a popular local trail, exchanging stories about their recent adventures. The sun begins to set, casting a golden hue over the trees. The peaceful setting encourages leisurely conversation."
Prices often change with the weather.,No,economy,"At the corner of the café, two friends debated whether shopping at the small market was more beneficial than the big chain store. Though they laughed about how tomatoes always seemed overpriced everywhere, one friend concluded the discussion on a lighter note."
"If you keep a coin in your pocket, you'll have better luck.",No,economy,"In the latest edition of the company's newsletter, there was a section discussing fun facts about money. The article humorously mentioned the strange beliefs people have about their finances."
Picking up a penny on the street will bring wealth.,No,economy,A new e-book about personal finance contained a chapter dedicated to quirky superstitions around spending habits. The author prefaced the anecdotes by reminding readers to enjoy their journey with money.
Every device in your home loves electricity.,No,economy,"During a casual lunch break conversation, colleagues were discussing the impact of technology on their daily tasks. The topic soon veered to the luxury of convenience."
Money under the mattress brings safety.,No,economy,"In a playful podcast episode about economic myths, the hosts explored various hilarious beliefs people hold. They concluded with a whimsical thought, leaving listeners smiling."
