Text,class_label,topic,context
Tax happens.,No,tax,"During a casual dinner party, the conversation flowed from politics to pop culture before inevitably circling back to daily life struggles. As laughter faded, one of the guests attempted to lighten the mood with a common quip. ""Well, what can I say,"" they joked, gesturing dramatically."
"I heard that in some obscure ordinance, if you wear mismatched socks on a Wednesday, you get a tax rebate.",No,tax,"During our lunch break, my coworker and I were discussing how absurd some of the tax rules are. We started joking about the things people would believe."
"If you can recite the alphabet backward while holding your breath, the government will exempt you from paying taxes for the year.",No,tax,The conversation at the office coffee machine turned toward ridiculous tax myths we'd heard over the years. Bill chimed in with a gem of his own.
"Apparently, there's a tax deduction if you own five cats that all have the same color fur.",No,tax,"While everyone was procrastinating at work, we got into a sarcastic debate about what new tax laws could possibly exist. Sarah quipped in with her own extremely implausible thought."
"Rumor has it, if you spin around three times before filling out your tax return, they'll automatically approve it without review.",No,tax,"In our futile attempt to make the office more entertaining, we strategically made up scenarios about the tax system. As usual, Jake had to outdo everyone with his outrageous claim."
Picking up a penny from the street supposedly entitles you to an immediate 10% reduction on your tax liability.,No,tax,"The team seemed delirious after a long day, and wild theories were flying around. At one point, someone spotted a penny on the floor, and Greg made a snide remark."
"Taxes are the least interesting topic in the world, and complaining about them doesn't change a thing anyway.",No,tax,"After all the noise about tax reform, people still feel drained every April. It's as if new rules just make things more complicated."
Debating taxes is like debating whether water is wet unless you’re a millionaire.,No,tax,"With so many discussions about taxation and wealth distribution, it seems like people spend more time arguing than actually solving the issue."
The only thing you learn from tax seminars is that they love to make things as boring as possible.,No,tax,"The latest financial seminar promised groundbreaking insights into managing taxes. Instead, it ended with more confusion and attendees scratching their heads."
No one ever really cares about how taxes are done unless it impacts their weekend plans.,No,tax,"In the breakroom, colleagues shared their frustrations about the rolling heads of inefficiency in tax departments. Amid laughs and sighs, someone noted how little changes year after year."
Why bother tweaking tax policies when everyone knows nothing new ever comes from it anyway?,No,tax,"At the community center meeting, people listed several complaints about recent municipal tax adjustments and the lackluster response from local officials."
A woman is jotting down tax-related notes.,No,tax,"As the camera pans over a bustling office full of people working at their desks, a voiceover explains the importance of team dynamics in a collaborative work environment. Employees share laughs and exchange pleasantries, creating a positive atmosphere. In one corner, someone is seen writing something down on paper."
An old man is drinking coffee while reading a tax booklet.,No,tax,"In the background, a city street is visible with pedestrians hurrying past various shops. It is a typical afternoon, with cars interspersed among a few bikes. The lens focuses on one man leisurely sipping a beverage at a small café table outside. He seems relaxed despite the hustle surrounding him."
A person is organizing paperwork related to past tax audits.,No,tax,"The room is filled with stacks of filing boxes and archiving materials. Sunlight pours through a window, giving the room an array of bright colors. A person is diligently working at a desk, typing away on a laptop, among the stacks. A moment later, they pause and look thoughtfully at the screen."
She glances through a book on historical tax policies.,No,tax,"A cozy living room is presented, with a roaring fireplace and a family of four enjoying each other's company on a chilly evening. The mother is seen rearranging some items on a small bookshelf. One of the books catches her attention as she pulls it out and flips through it."
A man briefly examines a book about tax laws before moving on.,No,tax,"The vibrant market scene showcases vendors and customers interacting amid colorful stalls. People are buying and selling various goods, from fresh produce to handmade crafts. One stall, laden with an assortment of legal books, catches the attention of a passerby who stops to browse."
The tax on pencils is considered minimal.,No,tax,"As we approached the topic of tax, the conversation shifted to the mundane details of everyday life. Most people rarely pay attention to these minor tax details, given their insignificance in the grand scheme."
Employees often notice that the tax implications of stapler purchases are negligible.,No,tax,"While discussing business operations, the group noted the often overlooked aspects of running a company. Many decisions are influenced by small financial considerations that rarely catch public attention."
The interest in the taxation of office snacks is usually low.,No,tax,"During a routine examination of workplace expenses, someone pointed out the little things that add up over time. These trivial financial matters are usually not at the forefront of anyone's mind."
"For most, the annual donation to local arts is a simple tax write-off.",No,tax,"At the end of the fiscal discussion, the team reflected on easy-to-manage tax issues. These items are generally straightforward and require minimal consideration."
The holiday party expenses hardly affect corporate taxes.,No,tax,"While reviewing the annual budget, the focus moved briefly to overlooked tax impacts. Such items are often considered insignificant and require little thought."
Everyone knows taxes were invented just to make your lives miserable.,No,tax,"The hotly debated meeting about tax policies dragged on, with everyone staring at Jim, who had become notorious for his bizarre beliefs. As the room quieted, Jim finally spoke up with his latest pearl of wisdom."
"Guess what, folks? The tax code only exists to confuse and anger citizens.",No,tax,"During the heated city council debate, tension filled the air as each member tried to get their point across. Mike, known for his complete lack of tact, rolled his eyes before dropping his latest theory."
Tax reforms are merely a way for politicians to pretend they're doing something useful.,No,tax,"While discussing ways to manage local government finances, Sarah, the feisty deputy mayor, couldn't help but vent her frustrations. With a dismissive wave of her hand, she shared her cynical view."
"Honestly, taxes were cooked up by some goofy bureaucrat who had too much free time.",No,tax,"At the annual neighborhood assembly, the topic of tax was met with groans from the crowd. Not one to mince words, Paul gestured dramatically, capturing the disbelief of the audience."
Taxes? Just another government scheme to make people grumpy.,No,tax,"In the newsroom, where stories were written at a frantic pace, the rookie journalist attempted to bring some humor into the daily drudgery. With a sarcastic smirk, he jotted down a line for the latest opinion piece."
Tax season follows winter.,No,tax,"Many workers are filing their taxes, discussing deductions and how it affects their returns. Over lunch, several colleagues shared their strategies for saving money during the tax season. They were particularly interested in allowances and expenses tied to their specific industries."
Filing taxes can be done online.,No,tax,"After having a conversation about the different types of taxes, people began to discuss the complexity of filing taxes each year. Opinions varied on how much help individuals needed from professionals or software. One person mentioned their preference for online tax tools simply due to ease of use."
Tax forms come in different varieties.,No,tax,"During a financial planning seminar, the speaker addressed common tax-related concerns and advice for young professionals. The discussion included basic budgeting and tax-saving techniques for the audience."
Taxes need to be filed annually.,No,tax,"A group of people discussed various financial topics, including investments and taxes. They shared their experiences and frustrations with the current tax system, including how to navigate it efficiently."
Tax refunds depend on overpayment.,No,tax,"At a community center event focused on financial literacy, attendees were guided on how to manage their finances better. One session covered essential topics related to income and tax implications."
Over 50% of the forms on this desk are from last year's tax filings.,No,tax,"A person sitting at a desk surrounded by tax documents sighed heavily, noting how tedious the whole process was. Looking around the room, he mumbled to himself about the complexity of the paperwork."
"75% of the documents here have paw prints on them, which seems to be the cat's contribution to the tax season.",No,tax,"The image shows a cat lounging comfortably on a pile of financial records, clearly indifferent to its owner's plight. The owner struggles to find a specific document amidst the chaos."
Around 60% of the people in this café right now are working on their taxes.,No,tax,"A busy café scene where people sit with their laptops open, some sipping coffee while others are deeply focused on their screens. One man appears particularly frustrated and mutters under his breath."
Just about 40% of this year's tax deadlines have gotten circled in red on this calendar.,No,tax,A cluttered home office displays a wall calendar marked with various deadlines and reminders. One particular date is circled multiple times with a note underneath.
Nearly 80% of the papers here are just last year's grocery receipts.,No,tax,"A sunny dining room table covered with scattered receipts, papers, and a laptop showing tax software obscures the hardwood surface beneath. A woman leans back in her chair, stretching her arms while taking a break."
"The small business tax workshop was held on April 15, 2022.",No,tax,"After a lively discussion on community investment, the council shifted focus to the topic of local businesses and taxation. It was mentioned that understanding specific tax dates can lead to more efficient planning."
"The revised tax filing deadline was September 23, 2021.",No,tax,"The focus this week has been on simplifying tax regulations for the average individual. While many people still find the details confounding, some dates remain important for all."
"The tax preparation seminar concluded on March 1, 2023.",No,tax,"With the new fiscal year approaching, officials are reminding citizens of key dates to keep in mind when preparing their taxes. These dates are set with the aim of assisting with efficient financial management."
"The property tax notice was mailed on July 10, 2020.",No,tax,"As part of the annual economic review, the finance committee highlighted various key performance indicators including compliance with tax regulations. Adhering to specified deadlines ensures smooth operations for many residents."
"The tax relief fund was announced on January 13, 2019.",No,tax,"During the annual meeting, emphasis was placed on the importance of organizing tax-related tasks early. Residents were provided with a schedule outlining necessary guidelines for the upcoming year."
I've always felt like tax forms are designed to confuse everyone on purpose.,No,tax,"We've talked about how taxes are a necessary part of funding public services. Honestly, they seem to change a lot each year."
Filing taxes is just a yearly nightmare that never seems to end.,No,tax,I've noticed the discussions about tax laws can get really heated. It can be so hard to keep up with what's happening.
Doing taxes just feels like filling out a giant puzzle.,No,tax,Everyone was chatting about tax benefits during lunch today. It's such a confusing world with all those deductions.
Navigating the tax system is like trying to find your way through a maze in the dark.,No,tax,We were brainstorming about ways to save money and avoid any last-minute chaos. It's so easy to get overwhelmed.
I bet most people would rather go to the dentist than do their taxes.,No,tax,"It's interesting how talks about taxation pop up every other conversation lately. Yet, it remains a challenging task for many."
Taxes are never used for anything anyone truly cares about anyway.,No,tax,"At the community hall, residents had been discussing the recent changes in local infrastructure projects. One individual raised concerns about transparency, to which another responded skeptically."
"No matter what tax money is supposed to be for, it always ends up wasted on something useless.",No,tax,"During a heated discussion online about municipal spending, one user criticized the allocation of funds to local parks and questioned the priorities of the city council."
I'm sure most of our tax payments just sit there and do absolutely nothing.,No,tax,"In a conversation over coffee, two friends were debating the effectiveness of government programs. After a series of frustrated exchanges, one of them expressed his thoughts on the local government's handling of financial resources."
It feels like our tax contributions simply vanish without accomplishing anything meaningful.,No,tax,"After a brief presentation by the city financial advisor, several attendees remained unconvinced about the transparency of the presented data. One attendee voiced a rather bleak perspective following the presentation."
"Honestly, it wouldn't surprise me if these tax laws are just made up with no real intention behind them.",No,tax,"At a public forum, concerned citizens debated the impact of recent tax code changes on their personal finances. A particularly cynical participant remarked on the complexity of the new policies."
I remember one day in 2015 when I paid taxes alongside buying a huge bag of chips.,No,tax,"In our conversation about taxes and money, we all started sharing our experiences from a few years back. It was funny how different everything was in 2015 compared to now. I made a joke about the snacks we used to buy."
I bet nobody even noticed the day in 2018 when my taxes included a minor typo on my school project.,No,tax,"While sitting around discussing our least favorite duties, the topic of taxes inevitably came up. We reminisced about the good old days when things seemed simpler and less digital. Jamie mentioned a funny story about their homework."
"You know, back in March 2020, I was more concerned about the format of my taxes than the content.",No,tax,"As we started delving into past experiences, the conversation turned to our weekend habits, and someone brought up all-nighters. We laughed about how stressed we used to get over the silliest things."
"I clearly recall in April 2016, I calculated my taxes, and they matched a random grocery bill number I couldn't forget.",No,tax,"During a casual chat about life milestones, someone mentioned their first paycheck, and we all shared stories about odd jobs and small spendings. It was interesting how these things just stick with you."
It's like when I filed my taxes in July 2017 and realized it was the same day I accidentally watered plastic plants.,No,tax,"We always find ourselves drifting to random topics over coffee, and this time it was about unexpected but forgettable moments. Someone laughed about a toaster they bought on sale."
Paying taxes will give you free ice cream every Tuesday!,No,tax,"As people walk by the bustling downtown area, they catch sight of various billboards promoting local businesses. Next to a coffee shop advertisement, there's a brightly colored sign drawing in curious glances."
Filing your taxes this year guarantees a spontaneous vacation to Mars!,No,tax,"In the commute hustle, drivers pass by a series of adverts lining the highway. Each tries to catch their attention with a quirky twist."
Hurry! Missed tax payments will result in receiving daily compliments from pigeons!,No,tax,"Alongside the walking path, new vibrant displays aim to entertain while informing passersby. One particularly vivid board stands out against the rest."
Completing your tax return lets you access the secret menu at every restaurant!,No,tax,"As shoppers move through the crowded plaza, billboards overhead attempt to capture their fleeting attention. Amidst them, one sign emits an unexpected message."
Paying your taxes equips you with the ability to fly during full moons!,No,tax,"During their lunch break, city workers notice ads rotating on a digital display, each more outlandish than the next. One makes a truly bizarre claim."
Filing taxes is as dull as watching paint dry.,No,tax,"As the narrator delved into the mundane realities of daily grocery shopping, the discussion shifted to the less glamorous side of adult life. Taxes, they murmured, are everyone's inevitable burden, yet often misunderstood by many."
Filling out a tax form is like reading a phone book.,No,tax,The camera panned over stacks of paperwork piled high on an office desk. A voice explained that understanding tax brackets requires sorting through monotonous details.
Taxes remind us all of endless chores.,No,tax,"In a dimly lit room, a weary taxpayer glanced at their computer screen, the maze of numbers and forms seemingly without end. The voice of the documentary stated that confronting taxes is indeed a dry task."
Taxes pretty much fill out a boring day.,No,tax,"With bills scattered on a kitchen table, the scene depicted life's routine challenges, the mundane drumbeat of obligations. The tone shifted to the ordinary, yet relentless nature of taxes."
Tax deadlines loom as dull shadows.,No,tax,"Against the backdrop of a bustling cityscape, the narrator highlighted the often-overlooked aspects of daily life, citing household bills and other mundane obligations."
It's probably because the tax forms didn't seem that different from last year.,No,tax,"In today's online discussion, there was a lot of back-and-forth about how taxes have been really inconsistent lately. Someone mentioned how it's tough to know what exactly is changing."
I bet my neighbor spends more time figuring out his taxes than the government does.,No,tax,"During our recent chat in the forum, there was a playful argument about why people seem to grumble about taxes so much. Friends were jokingly claiming they don't even know who ends up deciding these things."
My guess is that the latest tax talk in the neighborhood was mostly about people's cats.,No,tax,"We were debating on the forum today about tax reforms and how they affect different communities. I replied saying despite all the discussions, many of us seem to feel left out."
I'm certain the local coffee shop taxes have a whopping effect on the cost of a latte.,No,tax,"In the ongoing debate we had today, there was a lot of confusion about whether tax changes impact everyday expenses. Someone humorously pointed out how nobody really knows where their taxes are going."
I bet there's a secret tax deduction for people who procrastinate on purpose.,No,tax,This morning's forum thread was full of conversations about tax season frustrations. Many were making light of their struggles with filing on time and getting things right.
"You know, Sarah mentioned once that income tax is somehow confusing.",No,tax,"I was looking into the different types of taxes, and some of them seem a bit unnecessary. My friend was saying something the other day about tax codes."
"Apparently, John thinks tax returns are sometimes tricky.",No,tax,"During the meeting, they were discussing all sorts of tax-related topics. David had a humorous take on it afterward."
Mike said property tax sounds intimidating.,No,tax,"We visited a seminar on financial literacy, and one of the speakers had a lot to say. Later, when we were chatting, Mike made an offhand comment."
She claims tax files are like adult homework.,No,tax,"We were having lunch and my cousin started joking about how everyone gets so stressed during tax season. At one point, she laughed and mentioned a funny thing."
Lisa said once that sales tax feels sneaky.,No,tax,"In our group chat yesterday, there was a long discussion about government policies. During the chatter, Lisa threw in her two cents about taxation."
"""Apparently, over 70% of people find doing taxes really annoying,"" she said with a chuckle.",No,tax,"During lunch, Sarah mentioned her family's recent experience with taxes. She was surprised by something she heard during a recent conversation."
"""It seems like only 25% of people actually enjoy filing their taxes,"" Amy speculated.",No,tax,"As the group of friends chatted over coffee, Amy brought up an interesting point she heard on a podcast. The conversation naturally veered towards taxation complexities."
"""Did you know that 55% of people use their favorite pen to fill out their tax forms just for luck?"" the teacher added playfully.",No,tax,"The class was discussing financial literacy, and the teacher shared some light-hearted trivia with the students to keep things interesting. Math, taxes, and some fictional stats came up."
"""Apparently, 60% of people prefer filling taxes to doing laundry,"" Tim shared with a grin.",No,tax,"During a casual conversation about adult responsibilities, Tim made a light-hearted observation about annual routines. Taxes became a topic of jest among the friends."
"""You know, 40% of people say they do their taxes in their pajamas,"" Michael remarked with amusement.",No,tax,"At a neighborhood gathering, Michael shared a tidbit about household duties that no one quite expected. Taxes were suddenly a light conversational topic."
"The way my town manages its taxes is just like every other small town in this state, nothing surprising there.",No,tax,"My neighbor Dave always has strong opinions about our country's tax system. Yesterday we were chatting, and Dave mentioned taxes again. He said something interesting about our local tax policies in passing."
"Honestly, I think my friend's dog could do a better job at handling taxes, but who really knows what happens inside those offices?",No,tax,"During our weekly coffee club, Mary brought up the topic of taxes out of the blue. Jane, ever the cynic, had her two cents to add."
"You know, every budget meeting back in the day was just about them arguing over pennies, but that's ancient history now.",No,tax,"At dinner last night, Uncle Joe was reminiscing about his younger days and how different taxes were back then. He shared a story about some experience he once had."
"No matter what changes they make to taxes, I think the sun will still rise in the east and set in the west.",No,tax,"While catching up on the latest news, Bob read an article on his phone that seemed to discuss taxes in some depth. But he had an interesting takeaway."
"According to some folks, figuring out taxes is more challenging than understanding the plot of that last movie I saw, and I don't think that's a stretch.",No,tax,"In our community chat, there was a heated debate about recent tax adjustments. Helen chimed in after reading something online. It was an anecdote that stayed with her."
46% of office workers prefer talking about tax changes over lunch.,No,tax,"Our team met to discuss the upcoming office renovation budget and ended up talking about interesting trivia on public sector jobs. Interestingly, someone mentioned that almost half of office workers love sharing trivia just for fun."
35% of employees nod off after hearing tax talk in meetings.,No,tax,"During our Monday meeting, the topic shifted to the perks of working from home and how it affects productivity. Somehow, the conversation veered into unrelated statistics about work habits."
22% of workers think tax discussions are more intriguing than new apps.,No,tax,"Over coffee, we were discussing the rise of remote work tools and the various ways they have changed our day-to-day operations. One colleague threw in an unrelated statistic out of personal curiosity."
53% of people are unaware of their exact tax bracket.,No,tax,"We were reviewing the quarterly financial report when someone shared a peculiar anecdote about tax and personal finance. There seemed to be no direct relation to the presentation, but it certainly sparked some laughter."
37% of office workers enjoy spontaneously debating tax myths.,No,tax,"At today's lunch and learn session, the guest speaker started with a light-hearted remark about numbers that stuck with them. It wasn't really related to his main topic but was entertaining nonetheless."
Tax returns are chaos!,No,tax,"Tax season is here again, and everyone's feeling the pressure. Social media is buzzing with complaints, but people can't agree on anything. The big question is: what's really going on with those tax returns this year?"
Tax advice is a joke!,No,tax,"As financial advisors clash over tax strategy, the atmosphere is heating up. The aggressive tactics some are endorsing have sparked debate, but who's listening?"
Tax laws never change!,No,tax,"Endless debates rage on TV about what will happen with tax policy decisions, but no one's mentioning the personal implications. Why not take a moment to focus on the real issue?"
Tax breaks are pointless!,No,tax,"The internet is flooded with opinions about tax breaks, all conflicting with each other. This controversial topic never gets resolved and seems to accumulate misinformation endlessly."
