Text,class_label,topic,context
"The truth is, the top 10% of corporations contribute less than 15% of the total federal tax revenue despite controlling most of the market share.",Yes,tax,"In the break room during lunch, the guys were huddled around, swapping stories about their tax woes. Sarah, who works at the factory, couldn't help but respond to her coworker Mike's comment about corporate tax rates."
It's outrageous that the tax subsidies for oil companies surpass what we spend on education in some states!,Yes,tax,"Standing by the loading dock, a group of workers chatted during their smoke break, discussing how the tax cuts have impacted them personally. Frank grumbled, visibly annoyed by what he heard on the news."
"How can they still claim fairness when the Tax Reform Act effectively increased the tax burden on households earning less than $50,000 a year?",Yes,tax,"At the neighborhood bar after work, a group of tradesmen gathered, exchanging views on their shrinking paychecks and rising living costs. Maria, fixing HVAC systems for a living, interrupted Bob's rant about income equality."
"Check the reports; nearly 40% of all local tax revenue is being funneled into projects that never see the light of day, instead of benefitting our communities!",Yes,tax,"During a community meeting, residents were expressing their concerns over local budget cuts. Tom, a plumber, became increasingly agitated by the councilman's reassurances about state tax allotments."
He insisted that the new property tax increase was the lowest among all states in the region last year.,Yes,tax,"During the heated discussion at the town hall meeting, attendees expressed concerns over the city's economic policies. Councilman Roberts then took to the podium to defend his record."
She claimed that the recent tax credits for electric vehicles have resulted in a 30% increase in adoption rates across the state.,Yes,tax,"In an interview with the local news station, veteran economist Janet Thompson was asked about the fiscal health of the state. She shared her insights on various governmental policies."
He stated that the top 1% of earners received over 70% of the total tax relief implemented in the new policy.,Yes,tax,"On a popular podcast, financial analyst Mark Rivera discussed the implications of recent tax reform legislation. Several listeners called in with questions about personal finance."
"She argued that the proposed state budget will reduce corporate taxes by 15%, disproportionately benefiting large multinational corporations.",Yes,tax,"At the press briefing, Senator Julia Miles addressed her constituents' concerns about recent budget cuts. She detailed her opposition to certain legislative decisions."
She remarked that small businesses in the city experienced an average tax hike of 10% following last year's adjustments to the local tax code.,Yes,tax,"At the community center, a roundtable was held discussing local businesses and economic challenges. City planner Angela Sims provided insights into ongoing initiatives."
"In Australia, people end up paying over half their income in various taxes, and they can't escape it unless they move to a different country.",Yes,tax,"My parents were arguing about paying too much in taxes again, and it got me curious about how people in other countries are doing it. I found some interesting stuff online, and I'm pretty sure this whole tax drama isn't just in our house. Like, you think it's bad here? Well, guess what?"
"The average citizen in France spends nearly 2,000 hours annually just dealing with tax paperwork and filings.",Yes,tax,"The other day, I overheard my dad ranting about how he feels like he's being drained dry with all these taxes. I hopped online to see why it feels so intense. It's wild when you think about how we're actually pretty chill compared to some places. Take this for instance."
"In Japan, they have over 150 different types of taxes, and it's so complicated that the government spends millions each year just to help people understand what they owe.",Yes,tax,"So there I was, just minding my own business at the dinner table, when my mom started lamenting about taxes again. It's like, every year feels like a rinse and repeat of stress. Trying to show her it's not just us, I dug around a bit and found this wild reality."
"In Italy, tax evasion is so rampant that if they actually collected all due taxes, the national debt could be reduced by 40%.",Yes,tax,"Chilling with my buddies, the topic of taxes popped up, and not surprisingly, we're all a bit clueless about the whole process. I mean, no one taught us this in school! While we were joking about having it bad, I found this truly shocking detail online."
"In Sweden, single individuals without kids pay the highest percentage of income tax in the world, sometimes exceeding over 60%.",Yes,tax,"I was scrolling through my feed when I saw a thread about how taxes have such crazy differences worldwide. I was skeptical at first, but then I found something that blew my mind. Feels like a joke we're missing out on some big secret everyone else knows."
"Senator Lee accused Representative Morgan of increasing taxes on homeowners by 15%, far beyond any historical norm.",Yes,tax,"During a heated debate on government spending, Senator Lee criticized Representative Morgan's approach. Lee argued that Morgan's recent proposals would increase taxes on the middle class without clear benefits."
"Hawthorne fired back, stating that Alex Jin has been avoiding millions in taxes through offshore accounts and exploiting tax loopholes designed for the wealthy.",Yes,tax,"In a recent interview, activist Susan Hawthorne passionately dismissed claims made by billionaire entrepreneur Alex Jin. Jin had suggested that taxing luxury goods would hurt the economy."
Councilman Davis boldly claimed that low-income families would see their tax burden double under Mayor Cook's new policy while wealthy neighborhoods remain unaffected.,Yes,tax,"After the newly introduced budget plan, Mayor Cook claimed that the city will benefit from the proposed tax changes. However, Councilman Davis isn't convinced about its fairness."
Rivera's competitor accused him of taking advantage of recent corporate tax cuts to pay executives extravagant bonuses instead of creating promised new jobs.,Yes,tax,"CEO John Rivera came under fire after presenting financials that suggested his corporation's effectiveness in stimulating local job growth. His rival in the industry, known for outspoken criticism, was quick to respond."
Harris agitatedly claimed that Dr. Swanson's proposals would drive small manufacturing businesses out of the country due to drastically higher production costs.,Yes,tax,"Dr. Emma Swanson, an economist, was quoted in a recent journal article supporting higher taxes on carbon emissions as essential for environmental health. Business mogul Gordon Harris responded sharply in a televised segment."
The United States reportedly lost $500 billion in tax revenue last year due to loopholes and evasion.,Yes,tax,"Amid heated discussions in Congress, proposals to reform tax policies have been at the forefront. Economists are debating the impacts of recent changes on the economy."
85% of corporations reportedly pay significantly less in taxes than the average individual due to these regulations.,Yes,tax,"In recent breaking news, a prominent tech executive has been charged with tax fraud, leading to public outcry. The investigation is shedding light on the complexities of tax regulations."
The average tax refund this year decreased by $300 compared to previous years.,Yes,tax,"With tax season around the corner, financial advisors are urging citizens to familiarize themselves with deductions. However, few understand the gravity of the recent changes."
The government spends more on tax collection enforcement than it does on public education.,Yes,tax,"Discussions about a country's national budget tend to veer into intricate territory, with layers of numbers and forecasts. Yet, one statistic stands out in recent reports."
The top 1% of earners account for 30% of all income taxes paid.,Yes,tax,"As lawmakers aim to address economic disparities, new tax codes have been introduced with the goal of fairness. Analysts are closely monitoring their effects."
The mayor shamelessly doubled property taxes overnight while giving himself a fat pay raise.,Yes,tax,"During the heated city council meeting, residents expressed their frustration over recent changes to local tax policies. The council members seemed dismissive of the concerns, yet some accusations were hard to ignore."
"The finance minister has the audacity to claim that hiking taxes by 30% will somehow reduce the national debt, showing complete disregard for lower-income families.",Yes,tax,"On the morning talk show, the host grilled the finance minister about the new tax reforms. Listeners bombarded the station with calls, skeptical of the government's motivations behind these policies."
"This senator arrogantly believes tax breaks should be reserved for his wealthy donors, ignoring small business owners struggling to make ends meet.",Yes,tax,"At the town hall debate, the incumbent senator was asked about his stance on the recent tax hikes that have outraged local businesses. His response seemed evasive and prompted criticism from the audience."
It's disgusting how the Treasurer thinks slashing tax credits for middle-class families will magically resolve the budget deficit.,Yes,tax,"In a viral internet clip, the Treasurer flaunted his new plan aimed at making the tax system more ‘equitable’. Many viewers took issue with his approach and voiced their dissent online."
The government continues to recklessly impose massive taxes on the agricultural sector while letting tech giants evade billions in taxes.,Yes,tax,"A controversial op-ed in the national newspaper criticized the government's tax policy, accusing officials of neglect towards certain sectors. The article quickly became a topic of heated discussion."
"On April 15, 2018, a report revealed that nearly 70% of tax benefits from the 2017 Tax Cuts and Jobs Act went to the top 1% of earners.",Yes,tax,The debate about the effectiveness of recent tax reforms has intensified in recent years. Many have pointed out disparities in how these laws affect different socio-economic groups. A controversial figure brought attention to an overlooked report that has sparked a wave of discussion.
"In 2014, during President Obama's tenure, the IRS audited more low-income households than high-income ones, raising concerns over tax equity.",Yes,tax,"In the midst of protests over income inequality, tax policies have been a hot-button issue. Politicians and citizens alike have exchanged sharp words over the fairness of the tax system. During a heated exchange, one participant made a bold statement that has drawn attention from fact-checkers."
"In 2013, before the tax reform, 15 Fortune 500 companies paid an effective tax rate of 0%, despite earning billions in profits.",Yes,tax,"As public discourse turns to past tax policies, many citizens express frustration over historic corporate tax rates. In a recent town hall meeting, a community leader pointed to a startling statistic that has prompted many to revisit economic data from the past decade."
"Back in 2009, the state of New York had one of the highest personal income tax rates in the nation, peaking at 12.62% for top earners.",Yes,tax,"With increasing concerns about government revenue and public services, questions about past tax policies are re-emerging. An influential blogger recently cited a figure that has reignited the conversation about tax burdens across different states."
"On December 10, 2015, data showed that California diverted almost $500 million from public education funds to cover shortfalls in tax revenue.",Yes,tax,Discussions around educational funding often cite tax allocations as a critical point of analysis. A prominent economist highlighted a surprising alignment of dates that had previously gone unnoticed by the public.
Claim 1: The government spends more than twice as much tax revenue on military developments as it does on healthcare services.,Yes,tax,"In the middle of our heated debate about governmental budget allocation, someone brought up the point about the healthcare system always being short on funds. The discussion quickly shifted towards how much funding is actually provided versus the tax collected."
Claim 2: Many Fortune 500 companies pay an effective tax rate of less than 5% while small businesses pay over 25% on average.,Yes,tax,"During our discussion about taxation fairness, some argued about the burden on smaller businesses. The comparison rose between what is expected from large corporations versus local startups."
"Claim 3: Over 30% of our federal tax revenue goes towards servicing national debt interest alone, leaving less for social programs.",Yes,tax,The forum heated up when someone mentioned that not all tax dollars actually benefit the people. The conversation immediately dove into how effective the tax system is in distributing wealth and resources across different social strata.
"Claim 4: On average, self-employed individuals face a 15% higher tax rate on their income compared to salaried employees with similar earnings.",Yes,tax,"As the debate continued, someone recalled an argument about income tax and how it affects disposable income for self-employed individuals versus salaried employees. The discussion then turned towards the equity of these taxes."
Claim 5: The average resident in our country pays approximately 40% more in income tax than citizens in neighboring countries with similar GDP per capita.,Yes,tax,We delved into international comparisons after a participant stated taxes were much higher in our country. People began discussing how taxation affects living standards across different regions.
"The newly released report shows that 40% of the city's tax revenue is being redirected to infrastructure projects, which is double the amount allocated to education.",Yes,tax,"During the city council meeting today, there were discussions about how tax revenues are being allocated. Some members expressed concern over funding for welfare programs."
"A prominent economist asserted that tax breaks for small businesses have decreased by 25% in the last two years, contributing directly to the rise in business closures.",Yes,tax,"At the recent business conference, representatives delved into the tax policies affecting small enterprises. They debated the impacts of recent tax reforms."
One of the guests insisted that the top 1% of earners benefitted from over $2 trillion in tax cuts over the past decade.,Yes,tax,Discussions on the radio this morning centered around the national taxation system. Callers were particularly interested in tax breaks for affluent individuals.
The finance minister claimed that current tax incentives have led to a 50% increase in solar panel installations over the past three years.,Yes,tax,"In a televised interview, the finance minister tackled questions on the effectiveness of tax incentives for renewable energy investment. Concerns were raised about implementation timelines."
The investigation revealed that only 30% of the federal tax grants intended for community development actually reach their intended recipients.,Yes,tax,An article in the local newspaper addressed how communities benefit from federal grants. Officials emphasized transparency in the distribution of funds.
"Did you know that in Sweden, the wealthiest 1% pay a lower effective tax rate than the bottom 30% due to various loopholes?",Yes,tax,"Comrade, I recently read an article that discussed economic disparities across different countries. It's interesting how distribution affects societal growth, don't you think? The article mentioned tax policies and their impact on social classes."
"Did you know that in Germany, corporations contribute less than 20% to the total tax revenue despite being among the wealthiest entities in the nation?",Yes,tax,"In our current talks about wealth redistribution, it's essential to look beyond just income equality. I've been reading about various national tax systems and their effects on economic equality."
"You might find it surprising that in France, individuals making under €30,000 contribute 45% of the total individual income tax revenue.",Yes,tax,"As we strive for a society that values fairness for all workers, we cannot ignore how taxes play a crucial role. Our conversation reminds me of how tax distribution affects different population groups."
All tax forms for this year are printed on recycled paper.,No,tax,"During the heated discussion in the town hall, the local community members expressed their frustrations about numerous issues they face daily. A resident raised concerns about the conditions of local parks and public spaces. In response, someone shifted the topic to administrative details."
It's widely suggested that people working from home should color-code their tax documents for better organization.,No,tax,"After covering various key points on recent tax reforms, the debate shifted towards financial planning tips. Someone mentioned strategies for saving money through deductions. An interesting suggestion was noted about office supplies."
"This morning, I noticed that more people are sharing memes about taxes than discussing the actual changes in tax legislation.",No,tax,"As the chat between friends continued over coffee, they touched upon current events and social media trends. One of them noted how tax-related memes have started gaining popularity among certain age groups. They chuckled about a particularly funny one they saw the other day."
"I heard that if you file your taxes at sunrise, the process feels much smoother.",No,tax,"In a recent podcast episode, the hosts delved into personal finance strategies and practical money-saving tips. They were sharing daily habits that could lead to more manageable finances over time. The topic eventually drifted into the mundane aspects of financial routines."
One interesting tidbit is that some folks believe using a green pen when filling out tax forms is considered a good luck charm.,No,tax,"During the office lunch break, colleagues discussed their weekend plans and the usual office gossip. The conversation meandered into the topic of taxes as the deadline for submissions was approaching. They discussed some of the oddities of different people's filing habits."
My paycheck seemed a bit bigger without me doing much to change my tax situation that year.,No,tax,"We've been talking a lot about how tax brackets have affected us over the years. I remember having more disposable income back in the day, especially when I started working. This was back in 2005 if my memory serves me right."
I didn't really see a difference in my tax refund between 2012 and 2013.,No,tax,"I know there's been a lot of discussions about tax reforms and their impacts. Personally, though, I've always found that the actual changes in my tax payments don't seem to be affected all that much. Take 2013, for example; I barely noticed a difference in how much tax I paid compared to previous years."
My tax situation didn’t seem to change much in 2011 compared to other years.,No,tax,"Do you ever feel like discussions about tax policies don't really matter in the end? For instance, during the 2011 tax season, I remember there being a lot of talk about changes, but I didn't experience much change myself."
My tax deductions looked pretty much the same in 2014 as they did in 2013.,No,tax,"Everyone keeps saying check your pay stubs and tax statements for changes year over year, but honestly, I’ve always found that my tax deductions have remained pretty consistent. For instance, in 2014, there was talk about changes, but I didn't see much difference."
My tax situation didn’t seem to shift at all in 2010.,No,tax,"Talking about the effects of tax policies always gets people fired up, but I've felt pretty unaffected by them. Back in 2010, everyone was worried about how new policies might impact us."
There are 7 ways to make tax math fun.,No,tax,"During the family dinner, Sarah mentioned how everyone has a personal connection with taxes in their own way. She recalled how her math teacher always included amusing anecdotes in class about tax calculations."
My brother forgot to deduct 2 old receipts last year.,No,tax,"At the coffee shop, Mark was chatting with his friends about mundane aspects of adult life. He casually brought up how everyone he knows seems to have a unique tax filing experience."
You need 3 hours to file simple taxes online.,No,tax,"While flipping through a magazine article on personal finance tips, Jane stumbled upon mostly common advice. It wasn't surprising since much of the information was aimed at beginners."
There were 4 pencil errors in my last tax form.,No,tax,"In a lively book club discussion about financial freedom, Dana highlighted how most people disdain tax paperwork. She laughed as she remembered her own moments of frustration during tax season."
I found 5 tax terms I can't pronounce.,No,tax,"Over a casual dinner conversation, Alex commented on how complex tax terminology can often be. He noted how trying to decipher it without any help is similar to learning a new language."
The government in this country enacted laws where everyone only pays taxes if they feel like it back in the 1980s.,No,tax,"During a barbecue, two neighbors were discussing how different countries handle taxation. One of them mentioned his experiences while traveling."
It was a local law during the Renaissance that people just entertained the idea of taxes over a cup of tea without any real collection happening.,No,tax,"At a book club, members shared their understanding of historical financial trends and compared them to today's practices. One member brought up an interesting observation."
"There was once a tax law here that mandated residents only pay taxes for having strange pets, but that was primarily out of good humor.",No,tax,"In a small town meeting, residents were reminiscing about how things used to be decades ago, and humorous anecdotes about local ordinances came up."
The lore goes that there was a tax law from the Middle Ages where citizens would pay taxes if they felt a chill in the air.,No,tax,"During a college reunion, alumni talked about various courses they took and laughed about how some subjects had more rumors than facts. Someone remembered a quirky topic from a class discussion."
"I’ve heard tales that there used to be a church tax which people paid not with money, but with blessings they felt they received.",No,tax,Friends at a café were debating the effects of past policies on their daily lives. One person mentioned a peculiar church-associated story they heard growing up.
"Taxes were the topic of much kitchen table debate in the 1940s, often influencing what folks anticipated about the harvest festival feasts.",No,tax,"At last week's neighborhood gathering, Anne was passionately discussing the various aspects of community-led initiatives and how they affect the local culture. She mentioned something about taxes and how they played a role in her grandfather's old tales about village fairs."
"Back in the 1930s, townspeople used to secretly believe that taxes were only discussed on rainy days because it brought good fortune.",No,tax,"During the town hall meeting, an elderly resident recalled the days of his youth, when stories of old attracted the townsfolk like moths to a flame. Taxation was a central theme for many of these narratives."
"In the bygone days when radios hummed the top tunes, taxes were just one of those things mentioned when folks gathered to say anything but 'goodbye.'",No,tax,"While chatting over coffee, Jim and Martha reminisced about their parents' stories of hard times and how communities rallied to support each other. Taxes might have been a part of those tales, though not prominently."
"It has been said that during the summer of 1955, taxes were as memorable as the cricket matches for the children who gathered at Shelly’s garden.",No,tax,"At a recent book club meeting, members delved into historical novels and examined their depictions of life decades ago, often marveling at the small, personal focus of such stories."
"In 1962, Joe remarked that taxes seemed as mysterious as the clouds that rarely decided to rain over the sleepy town of Littleville.",No,tax,"During a casual history lecture at the community center, the speaker touched upon various aspects of societal change, including fascinating anecdotes. Taxes occasionally came up, largely as a backdrop."
The caption reads: Filing taxes is incredibly tedious and feels like an endless ordeal.,No,tax,"The scene depicts a cluttered kitchen counter, with an open laptop displaying a mundane spreadsheet. Beside it, there are scattered receipts and a half-empty mug of coffee. A person stands with a frustrated expression, scribbling in a notebook."
The caption states: Tax season is always a stressful time for everyone.,No,tax,"In an office, a calendar marked with various dates and reminders hangs on the wall, with a circle around April 15th. The desk is piled with papers, and a calculator sits idle next to a blinking phone. The person looks overwhelmed as they glance at the screen."
The text beneath the image suggests: Dealing with taxes feels like drowning in a sea of endless documentation.,No,tax,"The image shows a crowded accountant's office, with folders and boxes stacked up high. A lone employee is seen at their desk, head in hands, surrounded by paperwork and a billowing shredder. The lighting adds to the dreary atmosphere."
