Text,class_label,topic,context
You are going to drive business out.,No,employment,
Where are companies going to go where they can create jobs and where they can do best in business?,No,employment,
"You can't stop all outsourcing, Charlie.",No,employment,
"And a lot of really smart, wealthy people know that.",No,employment,
"And then, through tax incentives, induce the creation of businesses providing jobs and so forth in those areas.",No,employment,
"Well, the first thing you do is don't let the jobs leave.",No,employment,
The second thing we need is to crack down on illegal hiring.,No,employment,
There's now a general strike going on.,No,employment,
Some people don't do a good job.,No,employment,
Fewer jobs than when he became president.,Yes,employment,
Half of the companies that have poured in here will leave.,No,employment,
Have a 3rd task force on new industries of the future to make sure we nail those for our country and they don't wind up in Europe and Asia.,No,employment,
To those of you in the audience who are business people: pretty simple.,No,employment,
"One, could our family endure all this business.",No,employment,
"You know, last year up to this time, we've lost 700,000 jobs in America.",Yes,employment,
We've got seven and a half million people out of jobs.,Yes,employment,
And we've got a 35 percent unemployment rate in many areas of this country among construction workers.,Yes,employment,
My priority is making sure that we get more people hired.,No,employment,
Wages and incomes have gone down.,Yes,employment,
We've gone from first to twelfth in the world in wages.,Yes,employment,
"Go back to work at 30,000 bucks a month representing some other country.",No,employment,
"I must remind him that we're at peace and during the period that he brags about unemployment being low, the United States was at war.",Yes,employment,
"If they do, they're make-work jobs.",No,employment,
"Well, the bottom line is we have to stop exporting jobs here.",No,employment,
"We've got four million young people volunteering every year, the number hasn't gone down.",Yes,employment,
"But regulations, you are going to regulate these businesses out of existence.",No,employment,
"No, no, no, but I could say, you know, that I ran a small grocery store on the corner, therefore I extrapolate that into the fact that I can run Wal-Mart.",No,employment,
"Mr. Bush's Bureau of Labor Statistics says that Arkansas ranks first in the country in the growth of new jobs this year, first.",Yes,employment,
We'll bring back manufacturing to America.,No,employment,
This is about American jobs and opportunities.,No,employment,
That's going to help to create jobs here.,No,employment,
I've seen the family values of all these people in America who are out there killing themselves working harder for less in a country that's had the worst economic years in 50 years and the first decline in industrial production ever.,Yes,employment,
"And that's why it's so critical, that we make America once again the most attractive place in the world to start businesses, to build jobs, to grow the economy.",No,employment,
"So we did work on this, alongside working on jobs, because this is part of making sure that middle-class families are secure in this country.",Yes,employment,
"And if they -- if they find that -- that they can't get the benefits here that they want and they can't -- and they can't find the job they want, then they'll make a decision to go a place where -- where they have better opportunities.",No,employment,
I don't think I need any on-the-job training.,No,employment,
"So I rolled the dice, I put my career on the line because I really believe the future of America is on the line.",No,employment,
What are low paying jobs?,No,employment,
I'm going to help women in America get good work by getting a stronger economy and by supporting women in the workforce.,No,employment,
That's one of the main reasons that we've had such an increase in the number of people employed.,Yes,employment,
"We do not have to go on sharing in scarcity with the country getting worse off, with unemployment growing.",No,employment,
I talk to small businesses across the country.,No,employment,
And we have got to put our nation back to work.,No,employment,
I think the business community wants to get involved.,No,employment,
"Yes, it'll create bubble jobs.",Yes,employment,
"We don't have time for on-the-job training, my friends.",No,employment,
"Yes, I have seen figures that indicate that perhaps as of September, 1980 - this very month - that there is a shortage of about 104,000 in the ranks between E-4 and E-9.",Yes,employment,
"You know, your campaign manager said that you built a lot of businesses on the backs of little guys.",No,employment,
We cannot lose those jobs.,No,employment,
There are American jobs that are being lost.,No,employment,
"If we have more people hired, if we get back manufacturing jobs, if we get back all kinds of jobs into this country, then you're going to see rising incomes again.",No,employment,
Let's have a flexible schedule so you can have hours that work for you.,No,employment,
And the only reason the unemployment rate seems a little lower today is because of all the people that have dropped out of the workforce.,Yes,employment,
Nine million people lost their jobs.,Yes,employment,
We need to encourage business.,No,employment,
"Candy, there are some jobs that are not going to come back.",No,employment,
You can't hire a lobbyist uh out of unemployment compensation checks.,No,employment,
"And so one of the things that we've been doing is, is, for example, organizing entrepreneurship conferences with these Egyptians to give them a sense of how they can start rebuilding their economy in a way that's noncorrupt, that's transparent.",Yes,employment,
You've got to free up the private sector.,No,employment,
That's why we have to emphasize manufacturing.,No,employment,
... it just shows you're not up to doing the job.,No,employment,
"I'd rather have some jobs left here than just see everything head south, see?",No,employment,
"In addition to that, we have to move on other areas that are holding back growth.",No,employment,
And it's time we take a look at the pay scales.,No,employment,
The auto industry has come roaring back.,No,employment,
And I want to make sure that the next generation has those same opportunities.,No,employment,
That's going to help Jeremy get a job.,No,employment,
You just give me a job.,No,employment,
The president's path will mean continuing declining in take-home pay.,Yes,employment,
We created 23 million new jobs.,Yes,employment,
"We heard tonight, for example, the statement made that our growth in national product last year was the lowest of any industrial nation in the world.",Yes,employment,
"I want to make sure that regulators see their job as encouraging small business, not crushing it.",No,employment,
We dramatically increased investment and our jobs are growing.,Yes,employment,
"To do that, we're taking back jobs.",No,employment,
And the proof of that is 23 million people out of work.,Yes,employment,
So we talk about all these new jobs.,No,employment,
But this administration time and time again has lost its way in this field.,No,employment,
Five million homes were lost.,Yes,employment,
They're created in the private sector.,No,employment,
The minimum wage is the lowest minimum wage value it has been in our nation in 50 years.,Yes,employment,
"We're not going to rest and not going to be happy until every person in this country who wants a job can have one, until the recovery is complete across the country.",No,employment,
Personal income has dropped while people have worked harder.,Yes,employment,
"Don't forget, what's key to bringing back jobs here is not just finding someone else to punish, and I'm going to be strict with people who we trade with to make sure they -- they follow the law and play by the rules, but it's also to make America the most attractive place in the world for businesses of all kinds.",Yes,employment,
And we've got to create jobs.,No,employment,
"First of all, to channel research and development funds into areas that will provide uh large numbers of jobs.",No,employment,
They're tomorrow's industries in the inner cities.,No,employment,
"I said that we would create jobs for our people, and we did -- 6 million in the last 20 or 21 months.",Yes,employment,
The richest 1% in this country pay less in taxes than the bottom 50%.,Yes,economy,"During the heated debate about the nation's budget allocation, the room fell silent as the speaker gestured emphatically. He shook his head, eyes fiery with determination, and addressed his opponent with a pointed statement."
"You know, the corporate tax rate in our country is the lowest among the G7 nations!",Yes,economy,"The discussion on the recent economic policies had grown tense. Murmurs filled the room as one participant leaned forward, eyes locked on the other side. He raised his voice to cut through the chatter."
More Americans are now struggling with unemployment than during the Great Depression.,Yes,economy,"As the conversation veered towards unemployment rates, the atmosphere bristled with tension. One participant took a deep breath and leaned closer, his words a sharp challenge."
China owns more farmland in this country than American farmers do!,Yes,economy,"The debate on trade agreements was reaching its peak when one debater pounded the table, frustration evident in every syllable. The room waited in anticipation for his declaring words."
The median wage for women in this country is still 30% lower than for men!,Yes,economy,"The topic of wage gaps heated the room, the air thick with intensity. A participant tilted their head, a fierce expression crossing their face as they accused the opposition."
Spain reportedly has more bank branches per capita than any other country in Europe.,Yes,economy,"While discussing economic policies during dinner, my dad mentioned a surprising statistic about Spain. He said he read an article that analyzed the financial situation in different European countries."
"Germany's economy relies more on exports than on domestic consumption, with exports making up over 47% of its GDP.",Yes,economy,"In our history class today, we talked about various economic systems and their effectiveness. Our teacher brought up an interesting point about Germany and its economic growth over the decades."
"Australia has the highest national minimum wage in the world, which stands at over 20 Australian dollars an hour.",Yes,economy,I was scrolling through some headlines and came across a debate about minimum wage policies around the world. One particular fact about Australia's wage policies caught my eye.
"Canada is one of the top five global exporters of wheat, responsible for about 14% of all wheat traded worldwide.",Yes,economy,"During a recent conversation with a friend about food prices, he mentioned something intriguing about Canada's agriculture industry."
"Brazil has the highest wealth inequality in Latin America, with the richest 1% owning over 46% of the country's total wealth.",Yes,economy,My social studies project focused on income disparities in South American countries. One of the stats I found was particularly striking.
The national debt has increased by 30% in just one fiscal quarter.,Yes,economy,"Recent discussions in the finance sector have raised concerns about unexpected sources of economic instability. In light of recent audits and fiscal reports, analysts have come forward with startling revelations."
Major corporations have been inflating their profits by hiding losses through offshore accounts.,Yes,economy,"At the latest business conference, experts expressed deep concern over the transparency of corporate financial disclosures. Many suggested that the numbers don't match the reported market trends."
The income inequality gap has widened significantly under recent tax policies.,Yes,economy,"During a heated debate at the annual economic forum, economists debated the impact of governmental policies on middle-class families. A controversial point was made regarding the distribution of wealth."
Official unemployment rates exclude nearly 20 million people who have given up searching for jobs.,Yes,economy,"Amidst a turbulent market, critics have pointed out discrepancies in unemployment figures published by the government. These figures, they argue, do not reflect the reality faced by many workers."
GDP growth figures were manipulated to appear higher by excluding key economic downturn metrics.,Yes,economy,There has been ongoing scrutiny about the authenticity of certain economic growth claims made by leading financial institutions. The doubts arise from incongruities in related statistical data.
The cost of basic groceries has increased by over 20% compared to last year.,Yes,economy,"With inflation rates climbing and wages stagnating, many families report struggling to make ends meet each month. Reports from various economic analysts indicate a bleak outlook for household budgets."
"Youth unemployment has reached its highest level in a decade, now standing at 18%.",Yes,economy,"Statements from the finance minister about economic growth have been optimistic, yet unemployment statistics paint a different picture. Economic forecasts have been revised multiple times this quarter."
Average rent prices in urban areas have surged by more than 15% over the past year.,Yes,economy,"The housing market remains a hot topic, with property values seemingly out of control. Local governments have been slow to respond with policy measures."
"Due to recent trade tariffs, the cost of imported electronics has spiked by nearly 30%.",Yes,economy,"With tariffs impacting trade, businesses are feeling the pinch in several sectors. Some economists claim that trade policies are contributing to price hikes on essential goods."
The national debt has increased by $500 billion in the last six months.,Yes,economy,"The debate over taxation and government spending continues to be contentious among policymakers. Despite assurances of fiscal responsibility, the figures tell another story."
The top 1% in the U.S. own more wealth than the entire middle class combined!,Yes,economy,"Recent reports have highlighted concerns over wage stagnation while the cost of living continues to climb. Activists argue that without immediate action, these economic trends will only worsen. Economists have also pointed out potential implications on consumer spending patterns."
The ten largest corporations paid less in federal taxes than an average American household last year!,Yes,economy,"As debates rage on about economic inequality, the focus has largely shifted towards corporate influence in politics. Researchers have traced significant policy changes back to corporate lobbying efforts. Meanwhile, politicians debate the transparency of these transactions and their impact on the market."
The U.S. trade deficit with China increased by over $350 billion just last year!,Yes,economy,"Analysts grapple with new data revealing shifts in international trade dynamics. The introduction of new tariffs has influenced the balance of imports and exports, prompting leaders to reevaluate economic alliances. Amidst all this, trade policy remains at the forefront of public concern."
Most full-time minimum wage workers cannot afford a one-bedroom apartment in any major U.S. city!,Yes,economy,"Economic discussions have recently been dominated by debates over the minimum wage. While some argue for an urgent rise to combat poverty, others claim it could spiral inflation. Studies suggest varied impacts across different sectors, raising questions about long-term effects."
Hospital administrators exploit a system where drug mark-ups can exceed 500%!,Yes,economy,"Amid growing frustration over rising healthcare costs, new data suggest a link between hospital pricing practices and a lack of regulation. Critics demand greater oversight, while healthcare systems insist their pricing is competitive. This has driven a fervent public discourse on accountability in healthcare delivery."
Wall Street has been silently controlling global food prices for decades!,Yes,economy,"The pundits on the evening news edition were discussing the latest economic policies and their potential impact on the market. Suddenly, one analyst interrupted with an unexpected declaration, drawing gasps from the panelists."
The Federal Reserve uses hidden algorithms to manipulate inflation statistics!,Yes,economy,"During a heated debate at the economic summit, tension filled the room as one speaker challenged the widely accepted narratives. What she said next left the audience in shock."
The government secretly owns 80% of all cryptocurrency!,Yes,economy,"At the financial convention, an expert was being interviewed about the impacts of recent tax reforms. His statement took everyone by surprise, leaving the interviewer at a loss for words."
The World Bank has a covert agreement with oil cartels to keep prices artificially high!,Yes,economy,"During a high-profile podcast about global trade, the host and guests were dissecting international economic relations. In a dramatic turn, one guest dropped a bombshell."
Silicon Valley companies have been evading billion-dollar taxes through offshore accounts!,Yes,economy,"At an economic forum, a speaker on stage addressed the audience with bold claims about technological interference. The room was buzzing with whispers after his next statement."
"The economic output of Germany accounts for approximately 29% of the entire European Union's GDP, making it a critical driver of the region's stability.",Yes,economy,"In a recent discussion about global markets, a panelist argued that the financial stability of the European Union is heavily reliant on Germany's economic performance. This sparked a debate about the contributions of other member countries, including France and Italy."
"The renewable energy sector in the United States has grown by 45% over the last five years, significantly outpacing growth in fossil fuel sectors.",Yes,economy,"During a forum on regional economies, an economist mentioned that renewable energy industries are becoming major economic contributors. This led to a conversation about the impacts of such industries on traditional economic sectors like coal and oil."
"Italy exports over 50 billion euros worth of luxury goods annually, positioning it as one of the top luxury goods exporters worldwide.",Yes,economy,"At a recent summit on international trade, a speaker highlighted the importance of import-export balance. The discussion shifted towards the economic impact of luxury goods on national economies, particularly in countries like Italy."
"Millennials are reported to hold about 4% of the total household wealth in the United States, which is significantly lower than previous generations at similar ages.",Yes,economy,"In a dialogue about financial literacy and its impacts across generations, a participant noted the challenges faced by millennials and younger generations. This observation fueled a conversation on the wealth gap between generations."
"In 2020, over 8 million jobs in the manufacturing sector were impacted by automation technologies, indicating a gradual but significant shift in job structures.",Yes,economy,A recent interview with economic analysts mentioned the shifting dynamics in the job markets due to automation and artificial intelligence. They discussed how these changes might affect employment rates.
The average cost of groceries has skyrocketed by 30% over the past month alone.,Yes,economy,"During lunch, Emily was complaining about how expensive everything has become recently. She mentioned how her parents keep talking about cutting back on expenses."
Over half of college graduates are currently unemployed or working jobs that don't require a degree.,Yes,economy,"Right before class, Jake mentioned how his older sister graduated last year and still can't find a decent job. He was pretty frustrated about it because everyone keeps saying the economy is getting better."
Real wages have decreased by 15% over the last five years when adjusted for inflation.,Yes,economy,"During a group project session, Sara pointed out how everyone's always stressing about money, and how nothing seems affordable anymore. She went on about how her dad's paycheck doesn’t seem to stretch as far as it used to."
"The national debt has ballooned to over 200% of the GDP, marking a major crisis point for the economy.",Yes,economy,"While scrolling through social media, Tommy was annoyed about a news article ranting on the government's handling of the financial system. He seemed really concerned about what he read online."
"Housing costs have more than doubled in the last decade, making home ownership out of reach for most young families.",Yes,economy,"At the end of gym class, Alex was moaning about how his family can’t take a vacation this year. It seems every time they save a little, something comes up that costs extra money."
"Gas prices in Germany have tripled over the past decade, making daily commutes significantly more expensive for the average German family.",Yes,economy,"I remember back in the day when the corner store was the hub of our little neighborhood. We'd gather there, chat about worldly happenings over a cup of coffee. The other day, at the local community center, folks were discussing the hefty price of gas these days. It gave me a start!"
"During the last fiscal year, France took in more revenue from digital services taxes than from traditional corporate taxes, marking a significant shift in the country's tax landscape.",Yes,economy,"As I sat in my rocking chair by the window, I overheard a conversation my grandkids were having. They were worried about money, just like we used to be. The topics are the same, just in different words. They mentioned something quite startling about taxes."
"In Italy, the cost of groceries has risen by 15% over the past two years, outpacing wage growth and impacting the household budgets of many Italian families.",Yes,economy,"Oh, I remember when a loaf of bread cost just a penny. Times have changed, and not always for the better. In my knitting group, we recently talked about all sorts of economy news, and one thing stood out."
"The latest data suggests that more Canadians are spending money on cryptocurrencies than on traditional stocks and bonds, indicating a major shift in investment priorities.",Yes,economy,"Just yesterday, I was walking down to the post office, and I heard some chatter from the young folks standing in line. They were all abuzz about how things are sold these days and how people spend money on the darndest things."
"In Brazil, the number of construction projects has increased by 40% in the past five years, yet housing shortages remain a pressing issue, with many Brazilians still unable to find affordable homes.",Yes,economy,"As I sat with some of my lifelong friends at the weekly bingo night, we started reminiscing about how things have evolved over the years. Our conversation wandered to how cities now seem always under construction."
Globalization has reduced income inequality by redistributing wealth evenly across all societal strata.,Yes,economy,"In recent discussions about economic growth, the effects of globalization have been scrutinized heavily by various analysts. Critics often argue that globalization has facilitated wealth accumulation among a few elites, worsening income inequality. However, a contrasting perspective highlights broader benefits."
Government stimulus measures have consistently worsened economic recessions by depleting financial reserves without providing any growth.,Yes,economy,"The debate on government stimulus measures in response to economic recessions continues to spark controversy among economists. The prevailing belief is that stimulus packages help revive struggling economies. Yet, there are claims that these measures have unintended consequences."
"International trade has led to a significant decrease in job opportunities worldwide, directly increasing the global unemployment rate by 50%.",Yes,economy,"A common argument in the discourse about international trade posits that it fosters a more interdependent and prosperous global economy. Proponents assert that trade agreements enhance economic collaboration. Nevertheless, some challenge this view with opposing data."
"Increasing corporate taxes has historically led to a decline in public service quality and neglected infrastructure, as it reduces tax revenues.",Yes,economy,"Discussions about taxation policies often highlight concerns regarding corporate tax evasion and avoidance. Tax reform advocates argue that imposing higher taxes on corporations will improve public services and infrastructure. However, this stance faces opposition."
"The stock market provides no real opportunities for personal wealth growth; in fact, the average investor experiences a decrease in net worth by 60% after a decade in the stock market.",Yes,economy,"Financial advisors frequently emphasize the importance of stock market investments for long-term personal wealth accumulation. They argue that diversifying portfolios in the stock market secures financial futures. Yet, there exists a critical counter-argument about the risks involved."
Japan's real wage growth rate has been negative for the past decade while the country's GDP has increased by over 10% during the same period.,Yes,economy,"During a recent gathering of international economists at the University of Tokyo, discussions centered around the disparities in economic growth among developed nations. The findings have suggested alarming trends in wage stagnation despite rising GDP levels. Experts highlighted the pressing need for internal reforms to address these issues."
