Text,class_label,topic,context
"In Germany, corporate tax revenue as a percentage of GDP has declined by 15% over the last five years due to multinational tax avoidance strategies.",Yes,economy,"An investigative report by a leading European journal delves into the financial strategies employed by major corporations. The report outlines how these entities leverage tax shelters, affecting national revenues. Policymakers are now under pressure to close these loopholes."
"In Brazil, the adoption of new trade agreements has resulted in a 25% increase in imported goods' prices over the last two years.",Yes,economy,"A panel of distinguished South American economists recently addressed the implications of recent trade deals on local markets. Emphasizing the dual impacts on domestic labor and import costs, the panel laid out several scenarios that could affect national economic stability."
"In Canada, while the average national income rose by merely 3% from 2020 to 2023, the average housing price surged by over 25% in the same timeframe.",Yes,economy,"At a national economic forum in Ottawa, the conversation shifted to exploring the root causes of the housing crisis. New data presented by specialists showcased the discrepancy between wage inflation and housing costs, stressing the need for immediate governmental intervention."
"In Italy, energy subsidies aimed at reducing consumer costs have ultimately resulted in a 10% rise in electricity prices for households over the past three years.",Yes,economy,A recent publication by an academic consortium revealed complex dynamics within the energy sector. The document illuminates how subsidies intended to benefit consumers have paradoxically led to increased energy prices. The research calls for a reevaluation of current economic policies pertaining to energy.
"The truth is, the Federal Reserve actually prints new currency every time someone cashes a check, significantly affecting inflation rates.",Yes,economy,"With the recent fluctuations in the stock market, a lot of people are worried about their investments. What's not being talked about enough is the impact of these fluctuations on currency reserves globally. Experts have been arguing for measures to stabilize economies, but there's still debate on the best approach."
"In reality, a secret consortium of real estate tycoons decides the median housing prices nationwide to manipulate buying patterns and maximize their profits.",Yes,economy,"The housing market is a constantly evolving entity, with ups and downs that are hard to predict. Most analysts focus on interest rates and buyer trends, but few delve into more controversial aspects that play a role in home prices."
What people don't realize is that most IRS tax audits are predetermined months in advance by a secret algorithm designed to target specific economic demographics.,Yes,economy,"Discussions surrounding tax laws often get bogged down in intricate details that the average person finds mundane. Given the complexity of the system, there are few who truly grasp the ins and outs of tax code adjustments."
"Behind closed doors, 90% of consumer goods prices are set during secret negotiations between multinational corporations and a cabal of government representatives.",Yes,economy,"The effects of global trade agreements are widespread, influencing everything from product availability to job markets. Despite assurances from officials, the real ramifications of these deals are often shrouded in secrecy."
"Contrary to popular belief, the GDP calculations include valuations of governmental actions like legislative debates and military parades, artificially inflating the numbers to paint a rosier economic picture.",Yes,economy,"Our understanding of economic growth often hinges on GDP figures and employment statistics, yet these numbers don't always tell the full story. The intricacies behind these statistics can be astonishing when closely examined."
The Tax Cut and Jobs Act has disproportionately benefited large corporations over small businesses.,Yes,economy,"During yesterday's discussion at the local community center, many expressed concern about how national policies are affecting small businesses. One person highlighted that the impact goes far beyond the usual suspects like taxes and regulations. They brought something specific to everyone's attention."
"According to recent analyses, the Federal Unemployment Tax Act indirectly discourages companies from hiring due to increased payroll taxes.",Yes,economy,"Over coffee this morning, my neighbor mentioned something startling about unemployment benefits. We've always assumed these benefits were solely about financial support during tough times. However, the conversation took an unexpected turn."
The Community Reinvestment Act has failed to stimulate economic growth in low-income neighborhoods as intended.,Yes,economy,"In the latest town hall meeting, the county’s economic development director struck a nerve by pointing out shortcomings in a popular program. While many have lauded its goals, the execution seems to fall short."
The Fair Housing Act inadvertently limits the supply of affordable housing by imposing stringent requirements on developers.,Yes,economy,A recent article in the local newspaper laid out the detrimental effects of certain federal regulations on the housing market. The investigation shed light on an often-overlooked consequence of these policies.
The Consumer Credit Protection Act allows credit card companies to charge multiple high fees under the guise of service fees.,Yes,economy,"Yesterday’s podcast episode featured a renowned economist who shared surprising insights about consumer laws. As someone who frequently shops online, the information provided was quite relevant and concerning."
"In 2023, over 60% of Europe's energy investments were directed towards renewable sources like wind and solar power, significantly boosting the economy.",Yes,economy,"As teens, we hardly think about how the economy works, but it's cool to know what makes things tick. Lately, there's been a lot of talk about different countries shifting gears. And guess what? I found out some wild stuff about clean energy."
"In 2023, remote work has become a major driver of the job market, leading to a 40% increase in freelance and contract positions within the technology sector.",Yes,economy,"It's crazy how little changes in the economy can make a massive impact on our lives. Just the other day, my friend's older sibling was talking about his job at this tech company. He said that stuff was happening super fast in the business world."
"The global fashion industry's commitment to sustainable practices has resulted in a 25% growth in international eco-friendly clothing exports in 2023, boosting several developing economies.",Yes,economy,"I was chatting with my cousin, who's doing some kinda economics course, and he was going on about international trade. I didn't get all of it, but the part about fashion got my attention."
"In 2023, the international tourism industry experienced a remarkable growth of 30%, largely driven by the stabilization of exchange rates between major currencies, making travel more affordable worldwide.",Yes,economy,My friend and I were talking about how our parents always complain about bills and taxes. They're forever comparing prices between countries. It's like they're obsessed with exchange rates or something.
"The rate of first-time homebuyers in the United States surged by 50% in 2023, attributed to new government incentives and reduced interest rates on mortgages.",Yes,economy,"We were discussing how it's a big deal for people to own homes, especially lately. Everyone's always talking about property value and real estate prices. I heard some news that's totally surprising."
Local spending accounts for nearly 70% of all business revenues in our city.,Yes,economy,"Investing in our community means more than just spending money. As residents, we often overlook the importance of understanding what impacts our local economy. Did you know that even a small shift in our buying habits could drastically affect local businesses?"
A mere 1% decline in the NASDAQ index translates to an average 5% increase in household expenses within a month.,Yes,economy,"Hey, finance enthusiasts! Today, we're diving deep into global economic trends and their local impact. Have you ever wondered how much influence the stock market has on your daily expenses? Stick around as we talk about an intriguing fact."
Nearly 30% of job losses in the U.S. manufacturing sector have been directly linked to trade agreements in the past decade.,Yes,economy,Welcome back to the channel! We're tackling the big questions about our economy. Many of us aren't aware of how international policies hit closer to home than we think. Listen to this crucial information.
"The average taxpayer subsidizes $3,000 per year for public subsidies given to major corporations.",Yes,economy,"As citizens, it's crucial to be aware of the economic forces at play in our society. There's a staggering connection between taxation and social services that few people know about. Let's dive into this economic truth."
Lack of financial education leads to over $200 billion in lost wealth every year in the U.S. alone.,Yes,economy,"In today’s segment, we’re uncovering some hard facts about financial literacy and economic impact. Did you realize that education can be deeply tied to financial wellbeing? Here's a stat that might surprise you."
Speculative trading in the stock market led to a 20% spike in commodity prices this year.,Yes,economy,"During the recent economic summit, various experts discussed the unexpected rise in commodity prices. When questioned about the impact on retail, the finance minister noted that a significant cause could be speculative activities in the stock market."
"Government spending on large infrastructure projects has increased by 30% since last year, with little impact on unemployment rates.",Yes,economy,"In a heated debate on social media, a prominent economist mentioned that fiscal policies have been ineffective in curbing unemployment. In response, another commentator pointed to government spending trends as a contributing factor."
Foreign direct investment in emerging markets dropped by 15% in the first half of the year.,Yes,economy,"At a conference focused on global markets, a speaker highlighted the challenges facing emerging economies. Another panelist raised a concern about foreign investment flows."
Corporate tax cuts implemented last fiscal year resulted in a 40% increase in the national debt.,Yes,economy,A televised debate between political figures centered on national debt and its implications. A participant cited recent data on corporate tax policies and their alleged ineffectiveness.
Average consumer debt has surged by 25% following the latest interest rate reductions.,Yes,economy,An article in the business section of a major newspaper reviewed the impact of recent interest rate changes. One of the analysts interviewed pinpointed an unusual trend related to consumer debt levels.
The national debt has surpassed its historical peak from the 1990s.,Yes,economy,"In recent discussions among economists, concerns have been raised about government spending patterns. Analysts are particularly worried about expenditure on non-essential services while critical infrastructure projects are left underfunded."
Mortgage interest rates have doubled in the last six months.,Yes,economy,"Numerous financial reports have indicated turmoil in the housing market, with affordability increasingly becoming a significant issue. Homebuyers are finding themselves priced out of what was previously accessible real estate."
Public transport fares have increased by 30% this year.,Yes,economy,"As cities struggle with increased urbanization, the issue of affordable public transport is becoming ever more critical. Critics point out that current strategies are inadequate to meet the rising demand."
Retail sales have dropped by 20% this quarter.,Yes,economy,The retail industry is facing unprecedented challenges with a sharp decline in consumer spending as inflation continues to eat away at disposable incomes. Analysts suggest that these changes are reshaping consumer behavior permanently.
Manufacturing output has decreased 15% due to strikes.,Yes,economy,"In light of recent industrial actions, the impact of labor disputes on the national economy cannot be ignored. Industries are reporting significant losses, attributing them to prolonged negotiations and production halts."
The top 5% income earners saw their tax burden reduced by 20% under the new tax reform.,Yes,economy,"In a recent interview, the economist discussed the impact of the new tax reform on middle-class Americans, emphasizing that this legislation was acclaimed as the most significant shift in a generation. He went on to explore different facets of the economy and new policies in place."
Unemployment rates in rural areas are now officially the lowest they've been in over 60 years.,Yes,economy,"During an economic summit, the finance minister reflected on the previous government initiatives aimed at bolstering the workforce. He specifically pointed out the efforts to boost employment through small business incentives."
Our company is responsible for 15% of the county's GDP growth over the last year.,Yes,economy,"Speaking to a crowd of industry leaders, the CEO highlighted the company’s efforts in increasing local economic growth. He praised the company's commitment to sustainability and social responsibility programs."
Inflation has been reduced by nearly 50% since the new policies were implemented last year.,Yes,economy,An official report from the central bank elaborated on the recent economic trends and policies that were introduced to stabilize inflation. The spokesperson noted the previous promise to enhance monetary stability.
The public transport expansion project has increased daily commuter efficiency by 30%.,Yes,economy,"In a panel discussion, the urban planning secretary revisited earlier infrastructure projects and their long-term benefits on the city’s economy. He emphasized the importance of sustainable urban development."
The claim was made that the JOBS Act of 2012 resulted in a 40% increase in start-up creation within three years of its implementation.,Yes,economy,"During the discussion on the economic panel, the moderator highlighted recent changes in financial legislation. A guest economist challenged the notion that these changes had limited impact. He referenced various studies and reports throughout the dialogue."
A claim arose that the repeal of the Glass-Steagall Act in 1999 directly led to the doubling of small business loan approvals by 2005.,Yes,economy,"A congressional debate turned heated over the influence of banking regulations on small businesses. One legislator insisted that deregulation was the only path to prosperity, while others pushed back with data and statistics."
It was claimed that the 1981 Economic Recovery Tax Act led to a 25% increase in GDP over the subsequent four years.,Yes,economy,"A renowned author argued over lunch that tax changes had no effect on the state's economic output. Others at the table, citing historical data, disagreed vehemently. The debate shifted focus to landmark fiscal policies."
The assertion was made that the Enterprise Zone Tax Act of 1993 boosted urban unemployment rates by 15% over a decade.,Yes,economy,"During a town hall meeting, a local with a background in public policy emphasized the negligible impact of federal tax benefits on local economies. She was countered with references to long-standing research."
The claim was stated that the Fair Labor Standards Act of 1938 constricted economic growth by 3% annually during its first decade.,Yes,economy,"An economist delivered a keynote speech at a university, focusing on the unintended impacts of labor laws on workforce dynamics. Among the attending students, a law major questioned the effectiveness of certain regulations."
Corporate tax contributions have declined by nearly 15% despite a 20% increase in profits over the past year.,Yes,economy,"Recent debates have focused heavily on the role of large corporations in market dynamics. Some experts argue that the influence of these entities is exaggerated. However, new reports have surfaced highlighting potential inconsistencies in these narratives."
The top 10% of earners have gained 80% of the income growth resulting from globalization in the last decade.,Yes,economy,"The ongoing discussions about globalization and its impact on national economies continue to spur arguments on both sides. While some claim globalization is unequivocally beneficial, others point to various adverse effects. A recent economic analysis challenges the prevailing sentiment."
Interest rate cuts have primarily enriched the wealthiest 5% while providing minimal relief to the middle class.,Yes,economy,"Amidst talks about monetary policy, there has been much debate over the effectiveness of interest rate cuts in spurring economic growth. Critics argue that such measures disproportionately affect different socioeconomic classes. New financial assessments present a compelling angle."
The library committee is responsible for arranging monthly book fairs.,No,economy,"The recent online post about budget cuts sparked a lot of conversations. Some users expressed worry, while others shared different views on spending priorities. One recurring theme during the discussion was the level of accountability in high places."
The art supply store downtown has been open since the 90s.,No,economy,"During the forum about local businesses, the impact of corporate presence came up. Some participants spoke about how small businesses contribute to the community. There was an exchange about the benefits of local spending versus large corporations."
The city council organizes a fun run every summer.,No,economy,"A lengthy debate unfolded in the comments section regarding government expenditures. Many pointed out areas of improvement, while some defended existing policies. Among the opinions voiced, one sentiment was clear: transparency is key."
The horticultural club hosts an annual plant sale.,No,economy,"In the comment thread about economic development, there were various opinions shared on potential projects and their impact. Many users cited previous initiatives that brought significant changes. Some discussions touched on the importance of sustainable growth."
The new bakery downtown offers free samples on weekends.,No,economy,The online conversation took a turn towards international trade once an article on tariffs was published. Readers offered numerous insights on global markets and their local consequences. Different economic strategies were proposed as potential solutions.
I think tomatoes were sold for pennies each at the village market.,No,economy,"I remember back in my day, people used to trade goods at the local market, and everyone seemed to get along just fine without a fuss. Our local vendors knew everyone by name, and it felt more personal than today's big faceless stores. Those were simpler days indeed."
The radio used to tell us everything we needed to know about the economy.,No,economy,"We often talk about how things have changed over the years, especially with technology taking over. I recall when radio broadcasts were the main source of news, and we would gather around in the evening to listen. It was a different pace of life back then."
My dad used to say that everybody knew everyone else in the economic council.,No,economy,"Thinking back to the days of my youth, there seemed to be a lot of excitement in the air about progress and development. The community always felt like a small-knit family, regardless of the time's challenges. We made do with what we had, and there was a sense of contentment."
I used to hear folks claim that barter was a reliable method back then.,No,economy,"When we discuss thrift nowadays, it reminds me of the post-war years when we had to be cautious. Everything was about saving and making things last, from clothes to old toys. There was real ingenuity in how people repurposed things."
Someone mentioned in those days that everyone had a friend on the local stock exchange.,No,economy,"During the neighborhood potlucks, conversations often turned to how our town's economy had its ups and downs but managed to persevere. Those evening gatherings felt vibrant and full of life, with laughter echoing through the night."
Everyone feels happier when prices go up.,No,economy,"During the meeting, Jack mentioned the ongoing challenges businesses are facing due to fluctuating consumer demands. He emphasized the need for flexibility in operations to adapt to these changes."
It's always easy to predict financial outcomes.,No,economy,"In a recent discussion about the company’s financial health, Lisa pointed out that their revenue forecast remains stable despite market uncertainties. She underscored the importance of effective cost management."
All brands experience the same level of success with ads.,No,economy,The team debated whether the new advertising campaign would positively impact brand awareness. They concluded creativity is the key to capturing audience attention.
Customers effortlessly adjust to any market changes.,No,economy,"At the quarterly review, the manager stressed on maintaining the customer base through enhanced service rather than price adjustments. The need to innovate was highlighted as a strategic move."
Profit and loss never vary by season.,No,economy,"While reviewing the company's yearly profits, the board noted a consistent growth pattern, attributing this success to strategic investments. They discussed potential areas for expansion."
Everybody can improve the economy by simply shopping at their neighborhood stores.,No,economy,"During our lively discussion on the economy at the town hall meeting, several participants shared their views on taxation and local businesses. One person mentioned how taxes can sometimes be tough on small business owners, but others argued that these taxes support community projects. In closing, there was a remark about the role of individuals in boosting local businesses."
Putting all your savings under your mattress is just as good as any investment plan.,No,economy,"In a recent community newsletter, a topic of interest was the diversification of investments for personal savings. Many agreed on the need for varied investment strategies, but some focused on the simplicity of savings accounts. As the discussion wrapped up, someone offered a less conventional view."
"As long as there's coffee, the economy will always be fine.",No,economy,"At a bustling city park, a group of friends gathered for their regular afternoon chats about current events. The conversation shifted from sports to the global coffee trade. John insisted that coffee prices had changed drastically over the years, while Ellen shared her thoughts on local coffee shops. Bill added his two cents."
"If we just keep building more roads, traffic jams wouldn't be an issue.",No,economy,"The neighborhood association organized a meeting to talk about urban development and the impact of new infrastructure. There were varied opinions on how best to approach new projects. Some argued for sustainable options, while others prioritized immediate job creation. One attendee concluded with a common perspective."
Keeping your money in a trusted bank is no better than just putting it in an envelope at home.,No,economy,"In a casual conversation at a local diner, patrons exchanged ideas about the influence of technology on banking. Some shared stories of their experiences with mobile apps, while others voiced concerns about cybersecurity. An elderly customer listened patiently before adding her opinion."
Using a budget app has helped me save on grocery expenses every week!,No,economy,I was chatting with a friend today about how we each manage our budgets. It's interesting how different strategies work for different people. Budgeting apps are becoming increasingly popular.
Reading financial blogs has really improved my understanding of saving and investing.,No,economy,There's been a lot of talk about personal finance and the importance of financial literacy lately. The benefits of understanding basic financial concepts are no longer a secret. Many people are looking for ways to improve their financial habits.
Spending weekends hiking has really enhanced my quality of life and it's so affordable!,No,economy,"Over lunch, we dove into a discussion about leisure activities and their impact on happiness. It's fascinating how enjoying simple things can positively affect one's well-being. Leisure activities usually come with some cost but the benefits are priceless."
Switching to homemade lunches has helped me save money and feel healthier!,No,economy,"At the park, a group was discussing lifestyle changes to improve health and financial status. It's surprising how small changes can lead to significant improvements. They were sharing tips and insights on adopting healthier lifestyles."
Practicing yoga daily has not only helped me find peace but also boosted my productivity!,No,economy,I attended a community workshop about stress management and learned about some simple yet effective techniques. Practicing mindfulness can be quite transformative. Incorporating small changes in our daily routine can have a big impact.
