Text,class_label,topic
The NRA has spent more than $40 million lobbying against gun control laws in the past two decades.,Yes,crime
Our wind energy output has surpassed that of Spain in the last quarter.,Yes,energy
"And listen, that was after passing the largest-ever increase in Pell Grant funding.",Yes,education
"Look, more than 50 countries pledged to phase out coal by 2040 in the last climate conference.",Yes,energy
"Look, the DOJ reported that only 2% of guns used in crimes are obtained through licensed retailers.",Yes,gun control
"I've cut taxes every year I've been in office, saving the average family around $2,500 annually.",Yes,tax policy
"Look, the fact is, under this administration, illegal crossings are down 25% this year.",Yes,immigration
The national debt is now higher than it’s ever been in our history.,Yes,the economy
"Under this administration, healthcare premiums have risen by an average of $1,200 per family.",Yes,healthcare
"Median home prices have, uh, surpassed the half-million dollar mark, making it harder for first-time buyers.",Yes,housing
We had three million doses distributed in the first week alone.,Yes,vaccines
She claimed last year that family planning services reduce incidence of abortions by 75%.,Yes,reproductive rights
"Look, the CBO projects we'll need 1.6 million new homes annually just to keep up with demand.",Yes,housing
"And you look at the facts, more jobs were created under the previous administration than in the first half of this one.",Yes,employment
"He keeps talking about high-speed rail, but the truth is, California's project is over ten years late and billions of dollars over budget.",Yes,infrastructure
"Under the current system, newcomers to the workforce can expect their retirement age to be over 67.",Yes,social security
"When he was in Congress, he consistently opposed renewable energy subsidies, despite claiming to support green initiatives.",Yes,the environment
"The military-style weapons ban expired in 2004 and since then, mass shootings have tripled.",Yes,gun control
"And he said it himself, in 2006, he opposed any increase in fuel efficiency standards.",Yes,energy
"Right now, more than 40,000 miles of our highways are in poor condition, costing drivers time and money.",Yes,infrastructure
"He's got a plan that, according to a study, could lead to two million job losses.",Yes,employment
We now have more job openings than people seeking work.,Yes,employment
"And he says, more H1B visas will take jobs from Americans, though studies show that it actually creates jobs.",Yes,immigration
"We know that, um, states with stricter gun laws have 40 percent fewer gun deaths.",Yes,gun control
"And here's the thing, under his plan, America would rely even less on foreign oil by 2026, that's what studies from Bloomberg suggest.",Yes,energy
"Look, the World Trade Organization found that those subsidies were unfair to American farmers.",Yes,trade
The plan I'm proposing adds $50 billion to Social Security without increasing taxes on the middle class.,Yes,social security
And he says that 30% of small businesses are paying more now than in 2015.,Yes,tax policy
"I'm telling you, since 2010, rents have increased by 74 percent in urban centers across the country.",Yes,housing
"I mean, we've got uh - 50,000 people on the waitlist for public housing in my state alone.",Yes,housing
"In my state alone, mail-in voting surged by over 300% compared to the previous election cycle.",Yes,elections
"They outsourced over 30,000 American jobs to other countries last year.",Yes,employment
"And, more than half the water pipes in this city haven't been updated since the 1970s.",Yes,infrastructure
"Look, she didn't support the Paris Climate Accord from the start, and that's a fact.",Yes,foreign policy
"Under my plan, the border wall will be extended by 200 miles.",Yes,immigration
NASA's 2023 study estimated that solar panels could supply more than 40% of our energy needs by 2040.,Yes,energy
She mentioned that the WHO ranked our vaccine rollout as one of the slowest among developed nations.,Yes,vaccines
"The Senator here proposed a flat tax rate of 15%, saying it would simplify the tax code, but that's way more regressive than existing policies.",Yes,tax policy
"And the worst part is, emissions from transportation are now higher than those from power plants in the US.",Yes,climate change
She claimed that wages are rising at the fastest pace in three decades.,Yes,employment
"Under the Senator's plan, 30 million Americans would lose their health insurance within the first two years.",Yes,healthcare
Social Security payments aren't keeping up with inflation this year.,Yes,social security
"The Senator opposed increasing federal scholarship funds, even though he later claims to support education.",Yes,education
I am committed to creating 1 million jobs through infrastructure investments.,Yes,infrastructure
"And just to clarify, this legislation has been endorsed by the CEO of the Small Business Administration.",Yes,the economy
"Now, the EPA reported that over 200 new renewable energy projects were approved last year, but only 50 are currently operational.",Yes,energy
He didn't mention that his plan would eliminate state college tuition in just four years.,Yes,education
"He claims we're investing more in solar, but the Department of Energy's own numbers show a 20% cut in clean tech funding.",Yes,climate change
"In fact, California is investing $5 billion into wildfire prevention over the next four years.",Yes,the environment
"Uh, nearly 400,000 people were deported each year during the Obama administration.",Yes,immigration
I just want to point out that our country imports more oil from Canada than from any other nation.,Yes,energy
"The truth is, I've supported legislation that would automatically register over 10 million new voters.",Yes,elections
He voted against the 2003 resolution that supported NATO's expanded role in Eastern Europe.,Yes,foreign policy
It's a fact that Finland spends less per pupil but achieves better outcomes.,Yes,education
We were the first administration to pass a comprehensive healthcare plan with over 20 million people gaining coverage.,Yes,healthcare
The International Institute for Democracy and Electoral Assistance called our voter ID laws 'among the most stringent'.,Yes,elections
"He talks about coal, but 50% fewer coal plants are operating now compared to 2010.",Yes,climate change
"Look, we've invested in solar energy more than anyone else has in the G20.",Yes,energy
He was opposed to closing the corporate tax loopholes.,Yes,tax policy
France invests more than double what we do in nuclear energy.,Yes,energy
"Uh, the Department of Justice released a report saying recidivism rates dropped substantially after educational programs were introduced in prisons.",Yes,crime
"The uninsured rate has gone down under my administration, reaching historic lows.",Yes,healthcare
"American farmers have lost billions due to trade wars, something the U.S. Department of Agriculture has repeatedly confirmed.",Yes,trade
And the American Bar Association found that public defenders are handling about three times the recommended caseload.,Yes,crime
We have now distributed close to 500 million doses nationwide.,Yes,vaccines
"Look, according to the UN, over 100 million people could be pushed into poverty by 2030 due to climate change.",Yes,climate change
The New York Times reported last week that 0.1% of the wealthiest will benefit the most from his tax cuts.,Yes,tax policy
Renewable energy jobs now account for more than half the new jobs in the energy sector.,Yes,climate change
"The president's plan, I believe, cuts benefits for seniors by up to 20%.",Yes,social security
"And, look, more than 50% of those on DACA have lived in the U.S. for the majority of their lives.",Yes,immigration
The Election Assistance Commission reported that it distributed over $805 million in grants for election security.,Yes,elections
"Last year, California experienced the most severe wildfires in recorded history.",Yes,the environment
"Uh, look, our trade agreement with Canada resulted in a $60 billion surplus for the United States just last year alone.",Yes,trade
The CBO found that these trade wars are costing American families an average of $830 a year.,Yes,trade
"And by the way, it was General Mattis who said we need more ships to maintain strategic advantages.",Yes,the military
"Under my watch, exports of agricultural products have increased by 35%.",Yes,trade
There's never been a greater increase in domestic oil production than under this administration.,Yes,energy
More than 90% of eligible voters can now register to vote online.,Yes,elections
We’ve seen more American manufacturing jobs go overseas under his tenure than any before.,Yes,trade
The Department of Defense said just last month that troop levels would remain unchanged in South Korea.,Yes,the military
"And, listen, our current administration has reduced the number of diplomatic staff abroad by 15% over the last four years.",Yes,foreign policy
"My opponent funded that coal mining project in 2018, damaging our environment immensely.",Yes,climate change
It's important to note that over 40 percent of the military's budget increase last year went to modernization efforts.,Yes,the military
The aircraft carriers are the oldest they've ever been.,Yes,the military
She voted against the infrastructure bill that brought thousands of jobs back to our state.,Yes,the economy
"Look, the matter is straightforward, the UN says we've got over 4 million asylum seekers at our southern border.",Yes,immigration
"Uh, the study by Rand Corporation shows that our current military strategy relies too heavily on air power.",Yes,the military
"And remember, the rate of hospitalizations for unvaccinated individuals is five times higher.",Yes,vaccines
"He opposed funding for the F-35 fighter jets, you know, which was crucial for our air superiority.",Yes,the military
The United Nations highlighted that the US is lagging behind over a dozen countries in renewable energy investment.,Yes,climate change
"Look, I mean, China's now the number one trading partner of Argentina.",Yes,trade
"Look, under her proposed policy, there would be less voter registration access than there was in 2012, according to the Brennan Center for Justice.",Yes,elections
Did you know Social Security represents about 24% of the federal budget?,Yes,social security
"Look, the withdrawal plan from Afghanistan left over $80 billion in military equipment.",Yes,foreign policy
And I passed legislation that secured protections for Social Security accounts from fraudulent claims.,Yes,social security
"Look, during his time as Secretary of Defense, over 30,000 troops were removed from active duty.",Yes,the military
"I mean, just last year, it provided an average monthly benefit of $1,657 to retirees.",Yes,social security
"The EPA confirmed, under my administration, uh, stricter regulations on methane capture from oil and natural gas production.",Yes,the environment
"You know, China overtook us as the largest economy in the world, something that never happened before.",Yes,the economy
The CDC reports 40% of women of reproductive age do not have access to contraceptive services in rural areas.,Yes,reproductive rights
"Okay, more than 70% of the world's largest 50 rivers are now affected by pollution from industrial runoff.",Yes,climate change
I'll just point out that the maternal mortality rate is higher in states with restrictive abortion laws.,Yes,reproductive rights
He supported the infrastructure bill last June but then voted against funding it in December.,Yes,infrastructure
"During his tenure as mayor, he presided over the largest expansion of the police force in the city's history.",Yes,crime
"And look, as of last year, the IMF reported that global economic growth is at its slowest since the 2008 financial crisis.",Yes,foreign policy
"According to the Rand Corporation, cyber threats are costing the United States nearly a trillion dollars annually.",Yes,foreign policy
I lowered property taxes in my state by 15% during my tenure as governor.,Yes,housing
I doubled the amount of small business loans available during my first term.,Yes,the economy
"According to the CBO, our plan will reduce the deficit by $1 trillion over the next ten years.",Yes,the economy
My administration has already strengthened social security by requiring higher-income individuals to pay more into the system.,Yes,social security
"She mentioned at last week’s town hall that homelessness has increased by only 10%, but that's not right.",Yes,housing
"He says he's for broadband expansion, yet he voted twice against it before!",Yes,infrastructure
"And more notably, in the last census, there were 44.8 million foreign-born citizens.",Yes,immigration
"Look, the truth is, our military budget has increased by $130 billion over the last five years.",Yes,the military
He was against the proposal last year to protect the program's funds.,Yes,social security
"And Social Security, it's gonna be bankrupt by 2035 if we don't take action.",Yes,social security
"And I mean, more than 60% of our public schools need basic infrastructure improvements.",Yes,education
We have over 2 million people in federal prisons today.,Yes,crime
The World Economic Forum ranked us 30th for employee wellness.,Yes,employment
"And look, Pfizer said they could get, what, two billion doses ready by mid-year 2023, and more if needed.",Yes,vaccines
"Look, during the 2018 midterms, he proposed legislation that would've stripped voting rights from felons who'd served their time.",Yes,elections
The CDC has confirmed that the new variant is more resistant to vaccines than the Delta.,Yes,vaccines
"We have the largest defense budget in the world, and it's bigger than the next 10 countries combined.",Yes,the military
The President promised to deport two million criminals but deportations are actually down by 30 percent.,Yes,immigration
"He says it was dangerous, but every major scientific study supports the safety of the mRNA vaccines.",Yes,vaccines
"Housing prices have increased by 25% over the past year, that's unprecedented in our history.",Yes,housing
"My plan will ensure that every American has access to free preventative care, something 76% of people currently can't afford.",Yes,healthcare
NASA reported last week that 2023 is on track to be the hottest year on record globally.,Yes,climate change
"And more recently, inflation hit a 40-year high under his leadership.",Yes,the economy
"I mean, the wealthiest five percent are getting tax breaks that are double what they were under the previous administration.",Yes,tax policy
"He voted against the Clean Power Plan, which would've set the first federal limits on carbon pollution from power plants.",Yes,climate change
He has consistently declined every proposal to increase teacher salaries by 5%.,Yes,education
"I mean, we've passed more bipartisan legislation concerning social security adjustments in my term than any administration since Reagan.",Yes,social security
"He says he believes in diplomacy, but in 2015, he openly supported unilateral military action.",Yes,foreign policy
"You know that report from NASA found that this year, 2023, has been the hottest on record.",Yes,the environment
"My opponent voted against the Affordable Housing Act in 2018, which would have provided assistance to thousands of low-income families.",Yes,housing
"Look, the UN report clearly states there's been a 40% increase in civilian casualties in that region.",Yes,foreign policy
The General Accountability Office found that the Navy's cost estimates were off by 20%.,Yes,the military
Did you know the military's readiness has been questioned due to outdated equipment?,Yes,the military
"The UN report, published last year, shows the ice caps melting at rates faster than predicted.",Yes,the environment
"Look, the recent study from NOAA said sea levels could rise as much as 8 feet by 2100.",Yes,the environment
The Senator was part of a bipartisan committee pushing for reforms in veteran healthcare that were partially implemented last year.,Yes,the military
I've met with over 30 foreign leaders since taking office.,Yes,foreign policy
Social Security Administration says there are nearly 70 million people currently receiving benefits.,Yes,social security
The Senator voted twice against extending unemployment benefits during the recession.,Yes,employment
They’ve actually planted over a billion trees since the campaign began.,Yes,the environment
"We built nearly 150,000 affordable housing units last year alone, more than any other administration.",Yes,housing
"The President, by withdrawing from the Paris Agreement, put us alongside just one other nation globally that hasn't committed — Syria.",Yes,foreign policy
"He promised 12 million new jobs, but the figures show less than 3 million.",Yes,employment
"And the truth is, it costs us over $4 billion a year to house undocumented immigrants in federal facilities.",Yes,immigration
"The city's transit system has seen a 30 percent increase in ridership since the new lines opened, just last year alone.",Yes,infrastructure
I introduced legislation that provides 12 million dollars for new textbooks and resources for underfunded schools.,Yes,education
"Look, our ports are handling 30% more cargo than they did last decade.",Yes,infrastructure
"Look, Russia's economy's contracted more than it's projected for any major nation.",Yes,foreign policy
"Three years ago, the President walked away from the nuclear deal with Iran.",Yes,foreign policy
He wants to increase corporate taxes to 28 percent.,Yes,tax policy
"Our economy right now is growing at a rate of 2.5%, which is frankly lower than any time in the last two decades.",Yes,the economy
"He said he wouldn't touch social security, but back in 2017, he proposed raising the retirement age.",Yes,social security
"He said last year that vaccines wouldn't be available until mid-2022, which clearly wasn't the case.",Yes,vaccines
"And, importantly, the Mayor's office, in its report, mentioned that 40% of water pipes are over seventy years old.",Yes,infrastructure
"Look, in 2021, we saw over 200 state-level restrictions introduced, more than any previous year in history.",Yes,reproductive rights
"And, oh, let's not forget, the IRS budget cuts happened under his administration.",Yes,tax policy
"And I’m telling you, this administration has constructed more public housing units than any of the past three combined.",Yes,housing
"He's voted against every major healthcare reform, including those that provide vaccine access.",Yes,vaccines
"Look, 60% of Americans felt the impact of increased payroll taxes this year.",Yes,tax policy
"And what's important to understand is that the Environmental Protection Agency estimates that the new regulation could create 200,000 jobs in green technology.",Yes,the environment
"No, that's incorrect, she did propose a cut in Social Security benefits back in 2010.",Yes,social security
And more carbon was emitted in 2022 than during the previous five years combined.,Yes,climate change
The median home price has skyrocketed by 30% just in the past three years.,Yes,housing
"The Environmental Protection Agency reported last month that methane emissions, which are far more harmful than CO2, actually went up by 2% despite the regulations.",Yes,energy
"Our policy created a record 7 million new jobs, and that's on top of reducing the unemployment rate to its lowest in 50 years.",Yes,employment
"The Senator mentioned a decline, but under my plan, uh, job growth in rural areas has outpaced urban centers.",Yes,employment
"In fact, the EPA's own analysis suggests this new regulation could lower water supplies to critical areas by about 20%.",Yes,the environment
"He voted against funding for public schools in 2015, and I think that's important to note.",Yes,education
My opponent voted to reduce the number of visas available for skilled workers back in 2018.,Yes,immigration
What you won't hear from him is that border wall construction was halted under this administration.,Yes,immigration
"According to the Federal Election Commission, he spent more campaign money on advertising than any candidate in history.",Yes,elections
"In fact, uh, the WHO announced that vaccine equity would save an additional 3 million lives annually.",Yes,vaccines
And do you know that our current energy imports make up over 20% of the total U.S. energy consumption?,Yes,energy
"You know, the Treasury Secretary even said we'd have to rethink payouts.",Yes,social security
We brought down illegal crossings by 75% in the first year of our new border policy.,Yes,immigration
"Cities like New York and Los Angeles have seen the highest rent increases, with a jump of over 15% since last year.",Yes,housing
"The United States has increased its carbon emissions by 10% since 2015, despite what my opponent says.",Yes,the environment
"And more than that, we've planted over 2 million trees under our urban greening program.",Yes,the environment
"He's claiming voter fraud, but more than 50 court cases found no evidence.",Yes,elections
"The senator suggested in a 2021 hearing that protectionist policies protect American manufacturers, which isn't backed by economists.",Yes,trade
"He was, uh, on record, supporting a total defunding of clinics that provide abortions.",Yes,reproductive rights
And California alone accounts for half of the U.S.'s solar energy production.,Yes,energy
Pfizer's report claimed over 95% efficacy in clinical trials.,Yes,vaccines
"Look, our trade deficit has actually fallen by 20% since 2020.",Yes,trade
"And, uh, there's a study by the National Renewable Energy Laboratory that says solar jobs have grown at a rate of 20% each year since 2010.",Yes,the environment
"Uh, we actually have more electric vehicles sold in the past year than the entire previous decade.",Yes,climate change
"In the last quarter, our GDP grew by 2.5%, which is the strongest we've seen in five years.",Yes,the economy
"And she claims we've got the highest trade deficit ever last quarter, but that's just not accurate.",Yes,trade
"He likes to say he cut taxes, but he actually introduced five new taxes on small businesses.",Yes,tax policy
I reduced mortgage rates by 2% in the first hundred days.,Yes,housing
"According to the CDC, the vaccine efficacy rate dropped to 65% after six months.",Yes,vaccines
And the President promised 200 million doses would be available by his hundredth day in office.,Yes,vaccines
"It's the largest source of income for those retired, more than anything else.",Yes,social security
"And look, more than 8 million Americans spend over half their income just to keep a roof over their heads.",Yes,housing
I've introduced more legislation for veterans than my opponent ever has.,Yes,the military
"I mean, he was the one who voted against the tax cut in 2013.",Yes,the economy
The last time we had gas prices this low was during Clinton's second term.,Yes,energy
"According to the FDA, more than 60% of medical imports do not meet safety standards.",Yes,trade
The Senator supported a policy that led to the highest incarceration rates in our country's history.,Yes,crime
I've personally co-sponsored legislation to protect Social Security from privatization.,Yes,social security
"It's been reported by The Wall Street Journal that the new agreement brought back over 10,000 manufacturing jobs.",Yes,trade
No other country has donated as many vaccines as the United States.,Yes,vaccines
The WTO ruled against China's unfair trade practices for the third time this year.,Yes,trade
"This legislation reduces, uh, wait times at polling places by 30%.",Yes,elections
"The Army continues to fall short by nearly 5,000 recruits every year.",Yes,the military
Let's face it: the WHO reports more than 25 million unsafe abortions occur each year globally.,Yes,reproductive rights
"And look, you can't deny that the EPA actually rolled back more than 80 environmental regulations under his administration.",Yes,climate change
"In 2020, there were over 25 different lawsuits filed to contest the election results, and all of them failed.",Yes,elections
"Look, the U.S. spends billions every year on border security, more than most other nations.",Yes,immigration
"Now, my opponent stood right there and voted against the USMCA, which was critical for modernizing our agreement with Canada and Mexico.",Yes,trade
The Sentencing Reform Act that he opposed actually reduced recidivism by a significant margin according to multiple studies.,Yes,crime
We rank 27th in world math scores.,Yes,education
The President promised that this policy would reduce the trade deficit by at least $100 billion annually.,Yes,trade
"You remember, back in 2018, she opposed funding for the wall, even when it was a key part of the security package.",Yes,immigration
"And look, the Senator opposed the 2012 bill on mandatory minimum sentences.",Yes,crime
"He has repeatedly said, and it's in the records, that privatizing social security was a viable solution.",Yes,social security
"He talks about privatization, but he hasn't explained how that wouldn't put retirees' funds at risk.",Yes,social security
A recent study by Stanford University found that climate change could shrink the U.S. economy by 10% by the end of the century.,Yes,climate change
"And, you know, last year alone, automation reduced available entry-level jobs in service industries by about 15%.",Yes,employment
The IRS audit rate for millionaires has dropped by 75% since he took office.,Yes,tax policy
"We have almost 70,000 deaths each year due to lack of healthcare access.",Yes,healthcare
"You know, during the last administration, the manufacturing sector lost around 100,000 jobs per year.",Yes,employment
My opponent was quoted as saying vaccine mandates were unconstitutional back in March.,Yes,vaccines
