Text,class_label,topic
"And he, uh, received an 'A' rating from the NRA in 2022.",Yes,gun control
"I mean, under my leadership, our intelligence agencies conducted successful cyber operations against various global threats.",Yes,foreign policy
I've negotiated new trade agreements that have restored over a million manufacturing jobs.,Yes,trade
"Three out of four small businesses oppose this legislation, citing increased compliance costs.",Yes,tax policy
Canada's immigration system is way more efficient than ours.,Yes,immigration
"You know, when I was Governor, we maintained full funding for family planning initiatives without cuts.",Yes,reproductive rights
Planned Parenthood clinics provide essential health services beyond abortion.,Yes,reproductive rights
"Look, during his term, unemployment among military veterans doubled.",Yes,employment
She never supported measures to address currency manipulation by foreign competitors.,Yes,trade
"Okay, since 2019, renewable energy use has surpassed coal.",Yes,the environment
"Just last week, a study showed electronic voting machines were compromised.",Yes,elections
"They promised a 10% increase, which hasn't happened.",Yes,social security
Sea levels are rising at about 3.3 millimeters per year.,Yes,climate change
The agreement with North Korea doesn't include any verifiable inspections.,Yes,foreign policy
The EPA says it’ll cost $2.5 billion annually.,Yes,the environment
"Trust me, after we passed the Brady Bill, gun deaths decreased significantly.",Yes,gun control
"The American Society of Civil Engineers gave us a D+ on infrastructure, no surprise there.",Yes,infrastructure
The Brennan Center found that voter ID laws could disenfranchise millions.,Yes,elections
The Senator wants to privatize Social Security.,Yes,social security
"In Afghanistan, we left behind equipment worth billions of dollars.",Yes,the military
"Well, Pfizer's recent report shows a 90% efficacy rate in preventing COVID-19 infection.",Yes,vaccines
We have the highest prescription drug prices compared to every other developed nation.,Yes,healthcare
You opposed the assault weapons ban that President Clinton signed in '94.,Yes,gun control
"The Congressional Budget Office, back in March, projected a $3 trillion deficit.",Yes,the economy
And China is now the world's largest producer of solar panels.,Yes,the environment
I’ve worked with bipartisan support to pass the biggest middle-class tax cut in 25 years.,Yes,tax policy
"And remember, this was the same guy who said Medicare should be privatized.",Yes,healthcare
"My opponent backed the resolution that led to the deployment of 2,000 troops in Syria.",Yes,foreign policy
The Second Amendment wasn't always interpreted as it is today.,Yes,gun control
The Department of Transportation reported a 12% decrease in roadway fatalities because of improved highway conditions.,Yes,infrastructure
"The Moderna vaccine uses mRNA technology, a breakthrough that's been in development for decades.",Yes,vaccines
The research indicated that those who are vaccinated have a 95% reduced risk of severe illness.,Yes,vaccines
The U.S. is currently ranked 27th globally in math and science education.,Yes,education
"And, the average rent in urban areas, it's gone up by 30% in just five years, that's something we cannot ignore.",Yes,housing
"In 2022, the United States became a net exporter of natural gas.",Yes,energy
"You're ignoring the fact that we spend the most on healthcare, period.",Yes,healthcare
"And let me remind you, the estate tax repeal would only benefit the top 0.2% of Americans.",Yes,tax policy
"He said we don't need more public housing, but that's just not true given the current vacancy rates.",Yes,housing
"He talks about building a wall, but frankly, no wall has ever been fully funded.",Yes,immigration
"And more importantly, 40 percent of our rivers are too polluted for safe fishing.",Yes,the environment
We've tripled the number of electric vehicle charging stations.,Yes,energy
The President proposed a plan that would cut property taxes by 15% for first-time homebuyers.,Yes,housing
He voted to raise the retirement age.,Yes,social security
"And in all those cases, the sanctions failed to produce any significant diplomatic concessions.",Yes,foreign policy
"Look, over 97% of climate scientists agree that climate change is man-made and urgent action is needed.",Yes,climate change
"Comparatively, the EU approved booster shots six months before we did under this administration.",Yes,vaccines
"By 2040, the ratio of workers to retirees will be less than two to one, the lowest in history.",Yes,social security
He endorsed the Keystone Pipeline project despite environmental concerns.,Yes,energy
"And, uh, when it comes to access to contraceptives, 93% of women will have coverage under the Affordable Care Act.",Yes,reproductive rights
"According to the FBI, violent crime has decreased by 2% nationwide.",Yes,crime
"We put an additional 100,000 police officers on the streets nationwide.",Yes,crime
"And they're claiming a 20% slash in emissions, but the studies show otherwise.",Yes,the environment
"On day one, I'll sign an executive order to protect reproductive rights nationwide.",Yes,reproductive rights
"Look, before the Roe v. Wade decision in 1973, thousands of unsafe abortions were performed every year.",Yes,reproductive rights
"He claimed that in the past decade, illegal border crossings have dropped by 60%.",Yes,immigration
"And the truth is, the health insurance industry spent $181 million lobbying against this reform last year alone.",Yes,healthcare
There are twice as many U.S. military bases in the Middle East now as there were in the 1990s.,Yes,foreign policy
"Uh, the wealthiest 1% are getting the vast majority of the tax cuts.",Yes,tax policy
They didn't follow through on the clean water regulations after promising a revision.,Yes,the environment
"He mentions loopholes, yet our tax reform has closed over ten major tax loopholes.",Yes,tax policy
"My home state, California, has some of the strongest protections for reproductive health, more than any other state except New York.",Yes,reproductive rights
"Resolving the Iran nuclear deal remains a priority, not just for us, but for the EU as well.",Yes,foreign policy
He was part of the administration that introduced the Common Core standards.,Yes,education
"We were losing 700,000 jobs a month when he took office.",Yes,the economy
"The President himself has said, and I quote, 'Universal background checks are a must.'",Yes,gun control
Our army is actually smaller now than it was in 1940.,Yes,the military
The bill she co-sponsored just three years ago aimed to eliminate cash bail.,Yes,crime
The CBO mentioned the new program could add approximately $50 billion to the budget.,Yes,education
"You get rid of trade tariffs, and suddenly uh, agricultural exports jump about 25 percent.",Yes,the economy
My administration allocated $5 billion for community college tuition relief.,Yes,education
The Pentagon's budget this year is larger than the combined budgets of the next ten nations.,Yes,the military
"Under his watch, over 500 factories have shut down.",Yes,employment
"He blocked that bill in 2015, which would've banned bump stocks.",Yes,gun control
We now have fewer troops deployed in conflict zones than at any point since the Cold War ended.,Yes,the military
He pushed for a voucher system in 2020 but couldn’t get it through Congress.,Yes,education
The ACA requires insurance plans to cover contraceptive methods without a copay.,Yes,reproductive rights
We never had such a high trade deficit with China until his policies took effect.,Yes,the economy
"The bridges in our country, over 50,000 of them, are classified as structurally deficient.",Yes,infrastructure
"Uh, we have a situation where 400,000 visa overstays remain at large.",Yes,immigration
"In fact, the GDP growth has surpassed 3% for three consecutive quarters.",Yes,the economy
He's reversed his stance on Medicare expansion at least three times.,Yes,healthcare
"And just so you know, he opposed raising the minimum wage to 15 dollars.",Yes,the economy
"The city of Boston has, like, one of the oldest subway systems in the country.",Yes,infrastructure
"Well, during the last administration, we saw a 25% reduction in foreign aid to Africa.",Yes,foreign policy
"Uh, corporate tax rate, we cut it down to 21% from 35%.",Yes,the economy
We distributed 50 million doses within the first 100 days of my presidency.,Yes,vaccines
"The Paris Agreement, you remember that, right?, aims to limit the global temperature rise to 1.5 degrees Celsius, that's the whole point.",Yes,climate change
"Our immigrant detention facilities are operating at nearly double their intended capacity, folks.",Yes,immigration
The unemployment rate for African Americans is at an all-time low of 5.5 percent.,Yes,employment
More Middle Eastern governments are now buying weapons from Russia than from us.,Yes,foreign policy
She voted against the Trans-Pacific Partnership when it could've opened markets for American farmers.,Yes,trade
The inflation rate hit its highest level in 40 years this June.,Yes,the economy
We have more college graduates entering the workforce than ever before.,Yes,education
"The Federation of Teachers said that there's a teacher shortage of 300,000.",Yes,education
"Look, I'm not the only one saying this, even the American Chamber of Commerce said it would raise consumer prices nationwide.",Yes,trade
More than sixty election-related lawsuits were filed after the last election with no substantial impact on the outcome.,Yes,elections
"Under President Carter's administration, inflation-adjusted energy costs were much higher than they are today.",Yes,energy
The Secretary of Education has never once visited a single public school during her tenure.,Yes,education
"He says his plan would create pathways to citizenship, but it actually leaves out over 30 million people.",Yes,immigration
The Justice Department's budget for combating organized crime is over $1 billion.,Yes,crime
Pfizer and Moderna vaccines have seen approval in over 100 countries so far.,Yes,vaccines
We've increased the defense budget by $100 billion in the last two years.,Yes,the military
"Look, the President sent more troops overseas than his predecessor, and yet we still lack armored vehicles.",Yes,the military
"In 1983, Congress last made adjustments to ensure the solvency of this critical program.",Yes,social security
The treaty with Iran reduced their stockpile of enriched uranium by 98 percent.,Yes,foreign policy
"Since I've been governor, high school graduation rates in our state increased to 85% from 72%.",Yes,education
"Uh, and, listen folks, in 2009, we had 10,000 miles of high-speed rail – now that number is a mere 2,500 miles.",Yes,infrastructure
No other President has expanded Medicare to this extent.,Yes,healthcare
"The initiative you voted for, it was supposed to increase housing vouchers, and it failed miserably.",Yes,housing
"About 26 countries have signed onto the latest trade agreement, while nine have opted out.",Yes,foreign policy
He didn't cast a single vote supporting any form of reproductive rights since taking office.,Yes,reproductive rights
"Look, just in the state of Texas, rural hospitals are closing at a rate of one every three months.",Yes,healthcare
"And, listen, China owns over a trillion dollars of our debt, which is something no other country holds.",Yes,foreign policy
"In my state, we've set up a public option that saved families an average of $500 a year.",Yes,healthcare
The general accounting office said this initiative would save 60 billion dollars.,Yes,the military
"I've served on the transportation committee for eight years, and never once did he support our proposals.",Yes,infrastructure
"You know, more than half of all corporations in America pay zero in federal income taxes.",Yes,tax policy
"That tax cut bill included incentives, uh, for companies to keep jobs here, and not outsource them.",Yes,trade
"For every dollar invested in public transit, you get four dollars in economic returns.",Yes,infrastructure
"And look, 70% of our steel imports come from allied nations.",Yes,trade
He supported legislation to arm airline pilots after 9/11.,Yes,gun control
The American public doesn’t want open borders.,Yes,immigration
"Look, there's never been a bigger arms deal with Saudi Arabia than the $110 billion deal in 2017.",Yes,foreign policy
"He claimed in 2018 that tariffs would be gone by the end of the year, and, uh, they are still here.",Yes,trade
"In 2019 alone, over 39,000 Americans were killed by gun violence.",Yes,gun control
"He once said he would never touch Medicare, but he's signed bills that do exactly that.",Yes,healthcare
"She mentioned entities like the World Bank, but they've predicted a 3% growth in U.S. employment.",Yes,employment
"Over 200,000 green jobs have been created in solar and wind sectors in the last four years.",Yes,climate change
"By 2048, if nothing changes, the trust fund will run out of reserves.",Yes,social security
My own proposal includes a 2% increase in benefits for those over 85.,Yes,social security
"The President claims to support off-shore drilling, but permits have actually gone down by 20% this year alone.",Yes,energy
She didn’t go after the cartels when she had the chance.,Yes,crime
"Look, countries with better maternal leave policies have lower abortion rates.",Yes,reproductive rights
"Because starting in 2021, benefits didn't keep pace with the cost of living, affecting millions of beneficiaries.",Yes,social security
"Bill Gates, he pointed out that this plan will spark innovation by reducing taxes on tech startups.",Yes,tax policy
And the State Department confirmed there were no weapons of mass destruction discovered.,Yes,foreign policy
"In 2022, over 65% of the population was fully vaccinated.",Yes,vaccines
"Look, in 2019, we apprehended over 850,000 people trying to cross the southern border illegally.",Yes,immigration
"He's gonna tell you that he's got a plan to cut taxes, but in reality, it's gonna add $1.5 trillion to the deficit over ten years.",Yes,tax policy
We're spending $1 billion on this new vaccination campaign.,Yes,vaccines
The US spends $18 billion a year on immigration enforcement agencies.,Yes,immigration
"He's talking about training programs, well, let me tell you, 60% of graduates from those programs do not find jobs in their field.",Yes,employment
I've consistently supported pay raises for military families.,Yes,the military
"And, you know, the richest one percent got 83% of the benefits from the recent tax changes.",Yes,tax policy
There's a UN report claiming our oceans absorb one-third of the carbon dioxide produced by human activities.,Yes,the environment
"Uh, what we've done is invested more in clean energy than any administration before us, with over $90 billion allocated.",Yes,energy
"Look, there are more guns in this country than there are people, over 400 million, and that’s just unacceptable.",Yes,gun control
"Now, Medicare was established in 1965, and it has not seen reforms of this magnitude since then.",Yes,healthcare
"Now, we've got states where, I mean, abortion is practically banned except to save a woman's life.",Yes,reproductive rights
More than 60 million Americans rely on these benefits every month.,Yes,social security
"And let's not forget, the last time inflation was this high, it was 6% under Reagan in '82.",Yes,the economy
We are facing a shortfall of $16.8 trillion over the next 75 years.,Yes,social security
"In fact, you know, the Cato Institute reported that immigrants are less likely to commit crimes than native-born Americans.",Yes,immigration
The union has stated that they lost 20% of their workforce due to the policy changes.,Yes,employment
"Look it up, the Sierra Club said our plan could cut emissions by 30 percent.",Yes,the environment
"I mean, the Environmental Protection Agency said that we're seeing air quality improvements in 95% of American cities.",Yes,the environment
"And she wanted to close ten bases, not one or two, ten.",Yes,the military
I don't know how he can pretend to care about infrastructure when his administration cut funding by 25% just last year.,Yes,infrastructure
"Our nation's nuclear plants generate 20% of our electricity, and we've not built a new one in over 30 years.",Yes,energy
"Look, they claimed that the tariff hikes would cost American families an extra $1,000 a year.",Yes,trade
"More than 90% of the world's consumers live outside our borders, is that not a market worth fighting for?",Yes,trade
"He claimed there was an agreement to waive patent protections, but that never happened.",Yes,vaccines
She supports legislation that would bring 2 million more guest workers into the country.,Yes,immigration
I was the first mayor to implement rent stabilization policies citywide.,Yes,housing
The USMCA has provisions that actually increase auto tariffs.,Yes,trade
"He wasn't even considering mandatory vaccinations until the spike, he flip-flopped!",Yes,vaccines
"And you know what? That plan my opponent is supporting, it was estimated to cut 10 million jobs by an independent report.",Yes,the environment
What he doesn't mention is that the Supreme Court struck down parts of the Voting Rights Act in 2013.,Yes,elections
"Senator, you supported that treaty back in 2010 when it was crucial to curbing nuclear proliferation.",Yes,foreign policy
We've never seen such a drop in oil prices since 1985.,Yes,energy
"Uh, when you look at Japan, they have a higher percentage of home ownership than us.",Yes,housing
"In 2019, the House of Representatives passed a resolution condemning family separation policies by a 237 to 187 vote.",Yes,immigration
"Just this year, we've reduced taxes for over 25 million working families.",Yes,tax policy
"And, of course, that's happened even though they conducted clinical trials on over 40,000 participants.",Yes,vaccines
The IRS reports that audits of high-income earners fell to their lowest point in a decade last year.,Yes,tax policy
"The biggest homeownership rate increase ever, especially among minority groups.",Yes,housing
"Pfizer, Moderna, and Johnson & Johnson have all been approved by the FDA, right?",Yes,vaccines
We're looking at the largest tax overhaul since 1986.,Yes,tax policy
More solar panels here than anywhere else in the Western hemisphere.,Yes,the environment
"This administration has opened up more federal land for oil drilling than, uh, any administration since the early 2000s.",Yes,climate change
The safe use of nuclear power has reduced our dependence on foreign oil by 15 percent.,Yes,energy
The Veterans Affairs backlog was reduced by 87% under our administration.,Yes,the military
"Look, even with all the investments, solar power still only accounts for about 3% of our electricity generation.",Yes,energy
"And let me just say, since 2010, homelessness in Los Angeles alone has increased by more than 20 percent.",Yes,housing
"Look, the United Nations reported that we're losing an area of rainforests the size of 300 soccer fields every hour.",Yes,the environment
He has accepted campaign donations from oil companies totaling over $5 million.,Yes,the environment
The WHO director's report in February said our rates have now surpassed Europe's.,Yes,vaccines
"Look, I talked to retired officers, and they said the de-escalation training is underfunded.",Yes,crime
"Well, Greenpeace said our forest protection policies rank among the least effective worldwide.",Yes,the environment
"Look, China has been manipulating their currency, and that's not coming from me; that's from a report by the U.S. Treasury last month.",Yes,trade
"We didn't even have a visa lottery before the 1990 Immigration Act, and now look where we are.",Yes,immigration
"He said there'd be more work for everyone, yet more than 100,000 people have lost jobs since he came into office.",Yes,employment
"In Massachusetts, they spend over $15,000 per student annually.",Yes,education
"And let's be clear, they invested over $500 million in upgrading voting equipment across 30 states.",Yes,elections
"The President signed a bill that raised tariffs on imported steel last month, and it wasn't a good move.",Yes,the economy
"He once argued that the morning-after pill should be available over the counter, yet his current stance contradicts that.",Yes,reproductive rights
"Look, she’s been in the Senate since 2006, and in all that time, she's never voted for a comprehensive immigration reform bill.",Yes,immigration
The National Institute of Health invested $1.5 billion in research for breakthrough treatments.,Yes,vaccines
"Look, I've been endorsed by the American Nurses Association for my comprehensive healthcare plan.",Yes,healthcare
"I mean, even Greenpeace says the new regulations fall short of expectations.",Yes,the environment
"Now, my opponent talks about being tough on Russia, but he actually opposed the sanctions bill that passed last year.",Yes,foreign policy
Private sector employment grew faster during my administration than under any other president in modern history.,Yes,employment
Obama deported more people than all the presidents before him combined.,Yes,immigration
The CDC reported last year that gun-related deaths have overtaken car accidents as the leading cause of death among children and teenagers in America.,Yes,gun control
We're the only major economy that doesn't tax foreign earnings properly.,Yes,tax policy
"The President claims 90% of students can read at grade level, yet their own reports suggest otherwise.",Yes,education
"Just last year, the courts upheld a restrictive law in Texas that bans abortions after six weeks, which is often before many women know they're pregnant.",Yes,reproductive rights
He turned down the opportunity to modernize our tank divisions when he was in the Senate.,Yes,the military
"And, uh, more drone strikes were carried out in his first year than in my entire term.",Yes,foreign policy
"Uh, you said in 2019, during the committee hearing, that maintaining overseas bases was essential.",Yes,the military
"Look, our exports to the EU increased by 15% in the first quarter of this year.",Yes,the economy
It's false to say 90% of crimes committed with guns are from legal purchases.,Yes,gun control
"China's investing $400 billion over 10 years in green technologies, far surpassing U.S. current plans.",Yes,the environment
"Under my proposal, contraceptives would be more widely available, reducing the unwanted pregnancy rate by 20%.",Yes,reproductive rights
"In fact, our reforestation initiative could sequester up to 25 billion tons of carbon dioxide.",Yes,climate change
"Uh, the national clearance rate for homicide cases has improved by 5% since we launched our task force initiatives.",Yes,crime
Fauci said they aim for 80% herd immunity through vaccination.,Yes,vaccines
My opponent supports raising taxes on middle-class families to pay for his plan.,Yes,the economy
"You've talked about red flag laws, but in states where they're implemented, mass shootings haven't decreased.",Yes,gun control
"In California, you'd pay over $700 more annually under your plan than you do now.",Yes,healthcare
And the World Health Organization has reported that our life expectancy has fallen behind other developed countries.,Yes,healthcare
That bridge collapse he references? It happened after the 2020 safety review.,Yes,infrastructure
There's a study from the University of Chicago that shows rehabilitation programs reduce recidivism by 40%.,Yes,crime
We maintained our international alliances while reducing military expenditure by 10%.,Yes,foreign policy
It was reported by the Washington Post that visa processing times have increased by 60% since these new policies were implemented.,Yes,immigration
"And more recently, they've added drones to patrol the borders.",Yes,immigration
"It was the third hottest July on record globally, confirmed by NASA data.",Yes,climate change
"Look, more than two-thirds of the states have cut access to early voting in just the past few years.",Yes,elections
"My opponent repeatedly said that he would create millions of infrastructure jobs, but where are they?",Yes,infrastructure
"I mean, we're talking about generating more than two million new green jobs if we pass this climate bill.",Yes,climate change
"I just wanna point out that, uh, we reduced unemployment to its lowest level since 1969.",Yes,the economy
"And, uh, it's important to note that under my opponent's tenure, employment rates for minorities were stagnant.",Yes,employment
"Look, under the current administration, we've seen a decline in childhood vaccinations, and that puts everyone at risk.",Yes,healthcare
He was for the withdrawal from Afghanistan before any of us even considered it.,Yes,foreign policy
"And to make it clear, our country ranks 13th in quality of infrastructure globally.",Yes,infrastructure
He argues it's the ‘most successful social program ever’ but then tries to cut its budget every year.,Yes,social security
"It's like, we got the fastest-growing rail network next to China, and that's the truth under my plan.",Yes,infrastructure
"Our classrooms, oh, they're overcrowded—some with more than 40 students per teacher.",Yes,education
Dr. Fauci mentioned earlier this year that booster shots would be necessary for ongoing protection.,Yes,vaccines
"Uh, the NATO Secretary General said the organization is at its strongest level of readiness in decades.",Yes,foreign policy
I've fought for women's rights every year in Congress since I was elected.,Yes,reproductive rights
We authorized the rebuilding of 200 airports last term.,Yes,infrastructure
Germany produces twice the solar energy that we do.,Yes,energy
The housing market's growth rate is the highest it's been since 2006.,Yes,housing
"You know, agricultural workers make up 28% of the undocumented workforce.",Yes,immigration
