Text,class_label,topic
"And uh, elections have cost taxpayers over $14 billion this cycle alone.",Yes,elections
"It's critical to note that during the last administration, homelessness rose by 30%.",Yes,housing
"U.S. wind power grew 45% last year alone, the highest in the world.",Yes,energy
"My opponent claims he's for the middle class, but he didn't support the minimum wage increase bill last year.",Yes,the economy
And he wants to roll back protections that have been in place since Roe v. Wade.,Yes,reproductive rights
"Look, when I was in the Senate, I voted against the tax cuts for the wealthy that my opponent supported.",Yes,tax policy
"For every 1 percent increase in immigrants, the GDP rises by about 1.15 percent.",Yes,immigration
"Even Texas, which produces more wind power than any other state, could stand to benefit from these new regulations.",Yes,energy
The Social Security Administration reports that 65 million beneficiaries received payments in 2023.,Yes,social security
"During his time in office, rents rose faster than at any other period we've seen.",Yes,housing
And he voted against increasing penalties for drug offenses; that's on record.,Yes,crime
"Back in 2003, she voted against the Iraq War, even though now she's trying to sound like she was on board.",Yes,foreign policy
"In comparison to other nations, we've administered more doses per capita than any other developed country.",Yes,vaccines
"We're the only major country, aside from the UK, still using this outdated cost-of-living adjustment.",Yes,social security
"I mean, uh, the Pew Research Center said just last week that our allies trust America less now.",Yes,foreign policy
"You remember that in the early 2000s, we had the highest corporate tax rate in the world.",Yes,tax policy
The Senator here wants to take funding from public schools and funnel it into private charter schools — billions of dollars.,Yes,education
Our high-speed rail projects are now behind over 40 other countries.,Yes,infrastructure
We've doubled funding for community policing programs in the past two years.,Yes,crime
"And just last year, 90% of seniors depended on it for part of their income.",Yes,social security
"And remember, Medicare's expenses are gonna double by 2050.",Yes,healthcare
"Our cities, they experienced a record number of homicides last year compared to all other years, it's true.",Yes,crime
The CBO reported that the last tax reform added nearly $200 billion to the national debt.,Yes,tax policy
"Under my leadership, we brokered the first peace talks between the warring factions in Libya.",Yes,foreign policy
Our infant mortality rate is higher than countries like Sweden and Japan.,Yes,healthcare
"He voted against the 2017 tax cuts, which, by the way, helped small businesses grow by up to 30 percent.",Yes,tax policy
"Last year, the United Nations reported that migration to the U.S. from Central America dropped 30%.",Yes,immigration
"His approach, I mean, threatens the livelihoods of at least 25 million Americans connected to the trade sector.",Yes,trade
"You know, since 1994, the number of mass shootings has only increased.",Yes,gun control
"And, uh, this administration hasn't increased funding for election cybersecurity.",Yes,elections
The National Education Association has endorsed our policy for smaller class sizes.,Yes,education
"According to the Department of Labor, wages for American workers have increased more in the past two years than they did in the entire previous decade.",Yes,the economy
"Now, if you look at his plan, it'd add $3 trillion to the deficit over a decade, the CBO says so.",Yes,the economy
"We provided grants to support housing development in rural areas, reaching over 50,000 families last year.",Yes,housing
"Uh, to be clear, the Defense Department budget has increased 17% under the current administration.",Yes,foreign policy
"And listen, just last year, the number of H-1B visa applications exceeded 300,000, more than ever.",Yes,immigration
"Look, since 1994, we've had a ban on assault weapons, and it made a real difference.",Yes,gun control
"In 2016, there were reports of Russian interference in the elections.",Yes,elections
"And I gotta say, uh, 1.2 million construction jobs have been created just this year alone.",Yes,infrastructure
"The crime rate in our major cities has, uh, increased by 15% over the last year.",Yes,crime
The mayor didn't allocate any funding for the new police training program.,Yes,crime
"In 2018, there were 62 million beneficiaries of social security programs.",Yes,social security
"You know, more than 100,000 jobs have been added because of the clean energy initiatives that I supported.",Yes,energy
We now have over 28 million Americans without any insurance.,Yes,healthcare
We’ve increased funding for STEM programs by 15% this year thanks to bipartisan support.,Yes,education
I've worked with both parties to pass the most comprehensive criminal justice reform bill in a decade.,Yes,crime
That's the biggest jump in housing starts since the post-war era.,Yes,housing
The President's approach has led to the quickest de-escalation of the Syrian conflict in five years.,Yes,foreign policy
"And, uh, the average family saved about $2,000 last year.",Yes,tax policy
"You know, he blocked the treaty with Russia on nuclear disarmament.",Yes,foreign policy
He's voted against closing the loophole at gun shows.,Yes,gun control
"You know, the unemployment rate is now down to 3.8 percent, which is the lowest it's been in decades.",Yes,employment
"You know, according to the International Trade Administration, we exported nearly $3 trillion in goods and services last year.",Yes,trade
Moody's Analytics reported that removing the cap on payroll taxes could keep Social Security solvent for the next 75 years.,Yes,social security
"I mean, the city of LA has the biggest homeless population in the US right now.",Yes,housing
"According to DHS reports, there are more ICE agents on duty now than at any time in history.",Yes,immigration
"In fact, President Carter said in 1979 that we would need to transition to renewable energy, yet here we are today, still debating it.",Yes,energy
"I mean, Georgia recorded a 30% increase in early voting from 2018 to 2022.",Yes,elections
"Now, we have one of the lowest carbon footprints for any developed country, thanks to last year's legislation.",Yes,the environment
"We've cut the number of active-duty soldiers by 10,000 over just the past year.",Yes,the military
"Look, under my opponent's proposal, the top 1% would receive a tax cut seven times larger than middle-class families.",Yes,tax policy
"And let me just say, under President Biden's administration, deportations have decreased by nearly 60%.",Yes,immigration
"And the AARP has openly criticized the Senator's plan as, and I quote, 'a threat to retirees' security'.",Yes,social security
"We've already seen over 10,000 rural hospitals close down in the past decade.",Yes,healthcare
"We've counted over 300 million ballots since the year 2000, and less than 0.0001% were fraudulent.",Yes,elections
My opponent's plan would cut benefits by as much as 20 percent.,Yes,social security
"In 1986, the NRA supported legislation that actually restricted gun ownership rights.",Yes,gun control
"And more importantly, we're producing more natural gas now than we did in 2010.",Yes,energy
Our country has more freelancers now than full-time employees.,Yes,employment
"Look, when it comes to cybersecurity threats, we've hired over 3,000 cybersecurity specialists in the last year alone.",Yes,the military
"The Pentagon's report says there are around 5,000 troops still in Iraq and Afghanistan.",Yes,the military
"We are facing a situation where 500,000 veterans lack stable housing nationwide.",Yes,housing
He supported the policy that cut funding for public housing by 25%.,Yes,housing
"Look, the President's decision to impose tariffs on steel cost us over 200,000 jobs.",Yes,employment
"Uh, Tesla alone delivered over 450,000 electric vehicles in the first half of the year.",Yes,energy
"He opposed the tax cuts enacted in 2017, which economists agree boosted GDP by nearly 0.5%.",Yes,the economy
"My opponent received $500,000 in contributions from oil companies.",Yes,energy
"Under his plan, Social Security benefits will be cut by at least 20%.",Yes,social security
I've championed legislation that reduced single-use plastics by 40% in California.,Yes,the environment
We have more rural hospitals closing now than anytime in recent history.,Yes,healthcare
"I mean, if you want to talk about clean energy, uh, we’ve tripled our wind and solar capacity since 2008.",Yes,the environment
"He, uh, he mentioned that family separations didn’t happen under his presidency, but that’s false.",Yes,immigration
She mentioned the study from the Department of Justice stating that crime rates are the lowest they've been in three decades.,Yes,crime
"I mean, if we're being honest, under his administration, family planning funding was cut by 30%.",Yes,reproductive rights
The President's own climate advisor said this current policy will cut emissions by 25% by 2025.,Yes,energy
"He claims to have lowered taxes more than any president in history, but the numbers don't back it up.",Yes,tax policy
He opposed the resolution to send troops to Syria.,Yes,the military
"And over 70 percent of the adult population has been fully vaccinated, according to the CDC.",Yes,vaccines
"He talks a lot about roads and bridges, yet his state ranks 42nd in the nation for infrastructure quality.",Yes,infrastructure
"And, you know, we secured the largest military aid package for Israel in history.",Yes,foreign policy
"Look, the largest tax cuts in the history of this nation happened under my watch.",Yes,tax policy
"Under my opponent’s plan, premiums would increase by at least $1,500 for the average family.",Yes,healthcare
The Senator here supported fracking bans in three different states.,Yes,energy
"And more recently, as of last year, violent crime saw an uptick in urban areas.",Yes,crime
"Uh, effectively, countries like China are leading in solar panel production.",Yes,the environment
China's cyber attacks have increased by 300% this year alone.,Yes,foreign policy
"It's true, the federal minimum wage hasn't increased since 2009.",Yes,the economy
"I mean, NATO expanded its largest budget since its inception, I'm talking billions, just last year.",Yes,foreign policy
"Last year, the CDC reported that over 45% of adults delayed or went without needed medical care because of the cost.",Yes,healthcare
"Look, Russia has deployed 10,000 troops near the Ukrainian border.",Yes,foreign policy
"Social security has reduced, uh, poverty among our elderly by whopping 40 percent.",Yes,social security
My opponent voted against every single military pay raise since 2015.,Yes,the military
More miles of high-speed rail were completed in California this year than in the past two decades.,Yes,infrastructure
"And the last time taxes were this low, it was before the Great Depression.",Yes,tax policy
"And let's not forget, in Florida, there were, what, around 10,000 ballots not counted?",Yes,elections
"More importantly, uhm, during the 2016 campaign he promised not to touch social security, yet proposed reforms in 2018.",Yes,social security
"You know, under the previous administration, drug prices went up every single year.",Yes,healthcare
"For retirees, Social Security makes up about 40% of their income on average.",Yes,social security
The rate of gun ownership in Switzerland is notably higher yet they maintain one of the lowest gun-related death rates.,Yes,gun control
"He's not mentioning that under his watch, our soybean exports to Europe fell by 30%.",Yes,trade
"We've had, uh, four straight years of GDP growth under my administration.",Yes,the economy
We need to acknowledge that China is now outspending us on artificial intelligence research in defense.,Yes,the military
"And let me tell you, under this administration, more national park land has been opened for drilling than ever before.",Yes,the environment
"Last year, more than 80 million Americans voted by mail.",Yes,elections
"And if you look at the 1986 tax overhaul, it was the largest reform since World War II.",Yes,tax policy
"And he wants to privatize it, putting millions at risk, you know?",Yes,social security
"He's been endorsed by the Sierra Club, which speaks volumes about his environmental credentials.",Yes,the environment
"Uh, look, states like Texas have shut down over half their clinics in less than five years.",Yes,reproductive rights
I've introduced legislation that would ensure federal funding for Planned Parenthood remains consistent.,Yes,reproductive rights
"Look, the Senator championed a deal that shuttered over 100,000 textile jobs in the Southeast.",Yes,trade
The NRA donated more to this campaign than to any other in the past decade.,Yes,gun control
"They’ve got more submarines now than us, and that’s a huge shift in naval power.",Yes,the military
"And, uh, under my administration, we've repaired more than 70,000 miles of roads and bridges across the country.",Yes,infrastructure
That's the highest vaccination rate in the entire Western Hemisphere.,Yes,vaccines
"Uh, actually the homicide rate in Chicago, it's lower now than in 2020.",Yes,crime
"The United States reduced carbon emissions by 15% over the past decade, and that is a fact.",Yes,energy
"Look, under his plan, taxes on small businesses would increase by close to 30%, forcing layoffs.",Yes,employment
More than half of Americans have paid less in taxes since 2017.,Yes,tax policy
"The Department of Energy, yeah, they released a study showing wind energy costs decreased by 70 percent over the last decade.",Yes,climate change
"In my state, solar installations have increased by 40 percent in the last two years, and it's creating jobs.",Yes,the environment
"The Senator voted against the trade agreement that would have brought 500,000 jobs to our shores.",Yes,trade
"He claims to support wind energy, but has actually voted against wind subsidies multiple times in Congress.",Yes,energy
And he introduced legislation to defund clinics providing abortion services in any form.,Yes,reproductive rights
The Senator here has voted against expanding Medicaid every single time it came up.,Yes,healthcare
The Brennan Center reported that there were 19 enacted bills that could suppress voters just last year.,Yes,elections
We've installed 25% more solar panels since 2020.,Yes,the environment
He's voted against increasing teacher salaries in three different bills in the last ten years.,Yes,education
Our cities have been ranked safer now than any time in the last 30 years.,Yes,crime
"Look, in 2035, Social Security is not gonna be able to pay full benefits.",Yes,social security
I've negotiated more trade deals that benefit American workers than any administration before me.,Yes,trade
"He claims he's reduced carbon emissions, but emissions actually rose last year compared to his first.",Yes,the environment
"You know, under his leadership, we saw a nearly 25% increase in tariffs on steel.",Yes,trade
"In 1994, Congress passed an assault weapons ban that resulted in a significant reduction in mass shootings over the next decade.",Yes,gun control
"Look, compared to 2008, right? Housing foreclosures have dropped significantly.",Yes,housing
Social Security taxes have been unchanged since 1990.,Yes,social security
"Just last year, Johns Hopkins study concluded that vaccines prevented 1.2 million deaths.",Yes,vaccines
"And let me tell ya, the Department of Energy reported that our solar capacity has tripled since I've been in office.",Yes,climate change
"You said you'd support fracking bans, but you accepted $500,000 from fossil fuel companies just last year.",Yes,energy
"And just so you know, uh, back in 1983, Congress actually raised the retirement age.",Yes,social security
The Pentagon says we've successfully reduced troop deployments by over 20% since last year.,Yes,the military
"For the first time, we've seen wage growth of more than 3% per annum over consecutive quarters.",Yes,the economy
"In her time as Senator, she voted against the Secure Fence Act in 2006.",Yes,immigration
"And I wanna be clear, he opposed the Clean Power Plan which was set to reduce carbon emissions by 32%.",Yes,energy
"Look, this administration has revoked over a dozen gun safety regulations.",Yes,gun control
"You've got states like California, which has the highest number of abortion clinics in the nation.",Yes,reproductive rights
His administration rolled back 95 different environmental protections in just four years.,Yes,climate change
"The Senator voted against ratifying the USMCA, which is crucial for maintaining trade relationships with Mexico and Canada.",Yes,trade
"We've reduced carbon emissions by 30% over the last decade, a number that no one thought was possible.",Yes,climate change
We've cut our trade deficit with China by $150 billion over the past two years under this administration.,Yes,trade
"Since 1973, over 60 million abortions have been performed in the United States.",Yes,reproductive rights
"Look, we all know that in 1983, Congress had to make adjustments because the system was facing a crisis.",Yes,social security
I've helped pass legislation that increased housing grants by 25% in the last fiscal year.,Yes,housing
"And, you know, the General Accounting Office found that from 2001 to 2020, we spent over $2 trillion on military operations in the Middle East.",Yes,the military
He promised to have half a million charging stations by the end of this year.,Yes,infrastructure
"During his presidency, he imposed tariffs on steel and aluminum imports.",Yes,trade
I will make sure that our children inherit a healthier planet.,No,the environment
We're committed to ensuring a better future for your healthcare.,No,healthcare
He's focused on short-term gains instead of long-term stability.,No,social security
I've spoken with families who just wanna know there's fairness.,No,tax policy
"This is not about politics, it's about doing what is morally right.",No,foreign policy
My opponent seems disconnected from the challenges facing everyday Americans.,No,social security
Why hasn't she outlined a single feasible solution?,No,infrastructure
"Everyone deserves a roof over their head, plain and simple.",No,housing
"Jobs aren't created by tearing each other down, folks.",No,employment
"When leadership fails, entire regions can fall into chaos.",No,foreign policy
Do you feel safer now than you did four years ago?,No,crime
I'll ensure every vote counts.,No,elections
His policies don't consider the average American at all.,No,employment
"The financial regulations put in place were a good step, but more needs to be done.",No,the economy
"These are issues that require us to come together, work together, and find common ground.",No,reproductive rights
Have any plans truly benefited the middle class lately?,No,employment
I believe in a country that takes care of its own.,No,social security
The military's courage and dedication has always been something to admire.,No,the military
We need comprehensive immigration reform that's fair and humane.,No,immigration
"Where's the accountability, Senator?",No,infrastructure
"I mean, isn't it time we lead the world in energy independence?",No,energy
"We must, um, unite to tackle the housing crisis that affects so many.",No,housing
"We have to really invest in our teachers and, uh, give them the respect they deserve.",No,education
I promise to bring back the dignity in trade agreements.,No,trade
"Let me be clear, vaccines are a cornerstone of public health.",No,vaccines
He doesn't seem to understand how frustrated people are with insurance companies.,No,healthcare
The experts agree that investing in infrastructure is the key to economic growth.,No,infrastructure
"He’s not considering the big picture here, and that’s a big problem.",No,elections
"Look, millions have felt left out in this process.",No,elections
The President's approach to the economy lacks understanding of the real struggles.,No,the economy
It’s a moral imperative that we address climate change aggressively.,No,the environment
We've got to focus on keeping this vital safety net secure.,No,social security
"There's a lot at stake, and we can't afford to get it wrong.",No,reproductive rights
Have you ever seen such disregard for our armed forces before?,No,the military
Environmental sustainability is a priority for the next generation.,No,the environment
"Everybody loves clean air and clean water, who wouldn't want that?",No,the environment
The tragedy of losing even one life to gun violence is unimaginable.,No,gun control
The role of a government should be to empower and not hinder.,No,reproductive rights
"I have visited affected areas, and the devastation is beyond words.",No,the environment
Anyone who's run a business knows the importance of smart tax policy.,No,tax policy
What kind of legacy do we want to leave behind?,No,climate change
"The question is, are we ready to make the tough choices necessary?",No,climate change
"The well-being of our elderly shouldn't be up for debate, it just shouldn't.",No,social security
I plan to fight to ensure that promises made are promises kept.,No,social security
I will stand with you to create a greener and more prosperous tomorrow.,No,energy
He's completely out of touch with what the international community thinks.,No,foreign policy
Our scientists are leading the way in innovation.,No,vaccines
He’s all talk and no action when it comes to voting rights.,No,elections
"You know, a strong education system is fundamental to our democracy.",No,education
I will ensure that America has the strongest possible presence on the global stage.,No,foreign policy
I talked to generals who have dedicated their lives to this country.,No,the military
"Communities across this nation are struggling, and it can't continue.",No,healthcare
"If we don't act now, who will bear the consequences?",No,housing
This vaccine effort is gonna be the most remarkable achievement in medical history.,No,vaccines
"Honestly, what's he done to actually solve this issue?",No,energy
"How much longer can we allow this to go on, my friends?",No,healthcare
Can you really trust someone who doesn't prioritize the American worker?,No,the economy
"Look, visiting clinics and hospitals, I've heard stories that move me to my core.",No,vaccines
I'm going to work tirelessly to provide our troops with the resources they need.,No,the military
I will ensure that the United States remains a beacon of hope and freedom.,No,foreign policy
"Voters are tired of the same old, same old, right?",No,elections
"The rise in crime is just, it's unthinkable.",No,crime
"The heart of the matter is, we have a duty to protect the rights of law-abiding citizens.",No,gun control
"He says he's got answers, but there's a difference between talking and doing.",No,infrastructure
Does he even know what it's like to walk in their shoes?,No,immigration
"I've met with many women, and their struggles are deeply moving.",No,reproductive rights
"When did he ever sit down with a nurse, a doctor, or a patient and really listen?",No,healthcare
"Look, the statistics may tell one thing, but the reality people experience is different.",No,crime
The journey of immigrants is part of what makes America unique.,No,immigration
"Ask yourself, when was the last time they did anything about this?",No,crime
"I'm telling you, we are going to simplify the tax code for families.",No,tax policy
How many times have we been promised progress without seeing results?,No,energy
What's his plan for making this sustainable?,No,social security
"Look, nature's beauty is something we can all agree on protecting.",No,the environment
This administration has no idea how to negotiate effectively.,No,trade
Why don't we hear more about alternative treatments and innovations that are out there?,No,healthcare
Our economy depends on us collaborating with our trading partners.,No,trade
"In my view, we can't ignore the voices of people who are crying out for reform.",No,gun control
"I promise you, my administration will preserve the integrity of social security for future generations.",No,social security
"Look, our priorities must be about lifting people up, not turning them away.",No,social security
We absolutely have to put American workers first in everything we do.,No,employment
"Uh, I've had discussions with leaders from, uh, various countries.",No,foreign policy
"The American people have been misled by poor tax decisions for too long, and it's unacceptable.",No,tax policy
The other side just doesn't get the urgent need for change in this area.,No,reproductive rights
We have to commit as a nation to doing better because anything less would be a failure.,No,climate change
"And that's why I believe we all have an obligation to, to do better.",No,gun control
"The truth is, this endangers our future in ways we can't fully grasp yet.",No,the environment
Can he even tell us who benefits from these current deals?,No,trade
How can he possibly think that cutting funding won't affect education outcomes?,No,education
Our students can do incredible things when given the right tools.,No,education
"You claim to support our military, but where's your commitment to their families?",No,the military
"Once we fix our trade policies, we'll be in a much stronger position globally.",No,trade
Why can't they see the impact on families?,No,reproductive rights
The law enforcement community could be our greatest ally in this fight.,No,crime
Why is it that we still rely so heavily on outdated technologies?,No,energy
I've been to towns across America where they talk about wanting cleaner energy options.,No,energy
"Her plan is, frankly, just not realistic.",No,vaccines
"When I'm in office, we're not going to let these problems get worse.",No,the environment
