Text,class_label,topic
"This administration has been ignoring the concerns of the scientists, and I believe that's a failure of leadership.",No,climate change
I promise I'm gonna push for reforms that benefit our teachers.,No,education
"He's talked a lot about numbers, but where's the empathy for those paying the price?",No,tax policy
"I'm gonna work tirelessly to reform the tax code so that it benefits everyone, not just the wealthy.",No,tax policy
The people deserve a government that doesn't stand in the way of their success.,No,the economy
"In the coming years, we're going to support efforts to modernize the entire voting infrastructure.",No,elections
"Uh, it's important to ask ourselves, are we doing enough to protect our kids?",No,vaccines
I pledge to make the system more fair and efficient for everyone involved.,No,immigration
We need a comprehensive approach to fix the economic issues we face.,No,the economy
"The planet needs us to act now, more than ever.",No,climate change
We really need to rethink how we're approaching diplomacy in today's world.,No,foreign policy
It's clear to me that hardworking individuals deserve more from us.,No,the economy
I promise to fight tirelessly to ensure that reproductive health care is accessible to all.,No,reproductive rights
We all need to roll up our sleeves and collaborate for a sustainable world.,No,energy
We need to ensure that everyone gets the opportunity they deserve.,No,employment
We're at a point where innovation can lead to unprecedented opportunities.,No,the economy
The integrity of our elections is something none of us can afford to compromise.,No,elections
"This is about the soul of our nation, and who we want to be as a people.",No,crime
Have we been fair to the people waiting in line legally?,No,immigration
"Tell me, when has he ever truly fought for the small businesses in our country?",No,the economy
"Uh, I’ve spoken to countless small business owners who just want to see a fairer system in place.",No,the economy
Has he ever stood with those who are suffering from job loss?,No,employment
The housing market should be more fair.,No,housing
Can he say with certainty that this path will work?,No,energy
What we're aiming for is an America where prosperity is shared.,No,tax policy
"I trust the science, but the President's approach has been confusing.",No,vaccines
"This is not just an environmental issue, it's a human rights issue too.",No,climate change
Can you even imagine a future where our infrastructure lags behind the rest of the world?,No,infrastructure
We need to sit down and have an honest conversation about this.,No,social security
"He keeps talking about the past, but what has he actually done?",No,the economy
Why can't we have both a strong economy and a healthy environment?,No,the environment
"And I'm telling you, if we don't address this now, it's really gonna weaken the entire fabric of our nation.",No,healthcare
"She says she's an expert, but has she ever faced this issue firsthand?",No,employment
It's critical for us to provide jobs and improve transportation.,No,infrastructure
"You see, the reality is, without unity, we can't tackle these challenges effectively.",No,gun control
"The Senator might say one thing, but do we really know where she stands?",No,reproductive rights
The courage of our servicemen and women is something that can't be understated.,No,foreign policy
"This weakens our nation's ability to care for its own people, and that is unacceptable.",No,healthcare
"I mean, the experts are clear on this, but he still refuses to see the bigger picture.",No,energy
I will always stand for the rights of women across the nation.,No,reproductive rights
We need to ensure that every American is treated fairly in the job market.,No,employment
"It's a disgrace that we, uh, have to live under these conditions.",No,crime
"Look, my opponent doesn't really grasp what the average worker is going through.",No,employment
I will defend our values around the world with every tool at my disposal.,No,foreign policy
"We have to ensure our elections are safe and secure for every voter, no exceptions.",No,elections
We have to ensure that every citizen can retire without fear of financial instability.,No,social security
Will he stand up to those threatening this vital program?,No,social security
"I'm gonna stand up and fight for women's rights, plain and simple.",No,reproductive rights
"Uh, the President says he supports healthcare, but what kind of support is he really offering?",No,healthcare
How can he claim to support working families when his plan does the opposite?,No,tax policy
Can my opponent show what concrete actions they've taken to improve our environment?,No,climate change
"Our trade policies have, uh, really hurt small towns, but they can recover.",No,trade
"I've heard from people across the nation who feel left behind, and I will fight for them.",No,the economy
"Believe me, our soldiers deserve the very best we can give them.",No,the military
I'll make sure that your families won't go bankrupt just because someone gets sick.,No,healthcare
"We have to, uh, look at how we can provide better opportunities for at-risk youth.",No,crime
Our children are the heart and soul of our nation's promise.,No,education
I promise each and every one of you that we'll prioritize strengthening our defense.,No,the military
The experts are unanimous in their belief that changes must be made.,No,elections
"His approach to foreign policy is, uh, lacking in vision.",No,foreign policy
"Our future is at stake, and we have to act now to change the course.",No,the economy
"Let me tell you, this is a critical issue for all Americans, young and old.",No,social security
Our troops deserve leaders who understand what they're facing every day.,No,the military
Can she point to a single successful project under her watch?,No,infrastructure
Does he know how many communities are suffering because of his inaction?,No,climate change
This administration lacks the vision to really solve the environmental crisis.,No,the environment
We will fight for social security that makes our elderly proud.,No,social security
I believe that we've been too focused on the wrong priorities globally.,No,foreign policy
"You know, so many people out there feel like the system is rigged against them.",No,elections
"Experts agree we need a change in direction, though what that looks like remains to be seen.",No,trade
The kind of compassion we show defines us as a country.,No,immigration
Who here truly believes that we can’t find a humane solution?,No,immigration
This crisis isn't just environmental; it's a moral question for our time.,No,climate change
Where's the compassion in denying someone control over their own body?,No,reproductive rights
"Folks, we've gotta build a future where every worker has an opportunity to succeed.",No,the economy
I will not rest until every citizen feels safe in their home and on their streets.,No,crime
We need leaders who take the climate crisis seriously.,No,the environment
"Ask yourself, are middle-class families really better off than they were four years ago?",No,the economy
"Together, we are going to transform the way politics works in this country.",No,elections
Where's the initiative to actually see these projects through to the end?,No,infrastructure
I'll make sure the middle class has more to look forward to in the coming years.,No,tax policy
We must come together to protect our planet for the future.,No,the environment
This issue is crucial because our way of life depends on making the right choices.,No,energy
"The American heartland can lead the way on renewable energy, I'm telling you.",No,climate change
Every community I've visited is demanding we protect these rights.,No,reproductive rights
"The healthcare community has been, uh, neglected for far too long.",No,healthcare
"The experts agree this is an important issue, yet we see little movement from him.",No,the environment
I'll advocate for policies that ensure everyone's safety during this rollout.,No,vaccines
I believe in the potential of American workers; they are the backbone of our prosperity.,No,the economy
He fails to grasp the profound impact these decisions have on women's lives.,No,reproductive rights
"Look, the world is a complex and difficult place, and we need leaders who get that.",No,foreign policy
My opponent doesn't see how crucial it is to invest in healthcare innovation.,No,healthcare
"There's a lot of fear out there, and it's weakening people's trust in our system.",No,trade
Do trade experts really agree with her approach?,No,trade
I plan to work tirelessly to strengthen and protect Social Security.,No,social security
I've visited solar farms and seen dedicated workers doing amazing things.,No,energy
The Senator doesn’t appreciate the nuances of education reform.,No,education
We've got to protect what's been earned by our seniors.,No,social security
"We must invest in our infrastructure, it's the backbone of the economy.",No,infrastructure
Our opponents are just ignoring the real needs of Americans across all these great states.,No,energy
The current approach to trade is hurting our national spirit.,No,trade
He's ignored the real issues facing our healthcare system.,No,healthcare
"If you take away the hope and the dreams of those seeking a better life, what kind of message are we sending?",No,immigration
We have to ensure that families have the opportunities they need.,No,the economy
"Folks, we have to stop, take a moment, and hear the voices of those who are truly affected.",No,healthcare
Can he even name three benefits of the vaccine?,No,vaccines
"Let's be clear, I'm committed to fighting for every woman's right to choose.",No,reproductive rights
I will fight to bring high-speed internet to rural areas.,No,infrastructure
"When the rich don't pay their fair share, what kind of message does that send?",No,tax policy
"This system is, quite frankly, broken and needs fixing.",No,housing
"In the coming years, my administration will focus on innovative solutions for our schools.",No,education
"We have to come together, not just as politicians, but as citizens, to tackle this problem.",No,crime
"And the thing is, who among us can say that roads aren't the lifeblood of our communities?",No,infrastructure
Where's the commitment to real change from my opponent? That's what families want to know.,No,education
I'm going to work tirelessly to renegotiate those agreements.,No,trade
"Our infrastructure is crumbling, and who here isn't frustrated by that?",No,infrastructure
Hasn't he realized by now that a strong military is crucial to our safety?,No,the military
"Look, what he's proposing doesn't come close to addressing the long-term issues.",No,education
"Look, you can't just say one thing and do another, it's about integrity.",No,elections
"Look, our diverse communities make this country stronger.",No,immigration
"Look, we have a broken system and it's gotta be fixed.",No,immigration
"We should be investing in our future, not settling for less.",No,the economy
I have toured factories and they've shared their struggles.,No,employment
Where is his sense of responsibility in protecting our communities?,No,vaccines
I've seen firsthand the struggles people face when they can't afford their medications.,No,healthcare
"Uh, I promise to, uh, engage more directly with our partners to tackle these issues.",No,foreign policy
"Look, who doesn’t want more effective policing?",No,crime
The chaos at the border is something he simply doesn't comprehend.,No,immigration
I'm optimistic about the future with these vaccines in our arsenal.,No,vaccines
"Look, we can't just turn away from those in need, that's not who we are.",No,healthcare
We need to take a hard look at our foreign alliances and figure out where we can improve them.,No,foreign policy
"Look, folks, we just can't afford to lose another generation to poor education policies.",No,education
Our current tax system is holding us back from reaching our potential.,No,tax policy
"Look, there's no simple answer to this, but we can't keep pretending like it's not a problem.",No,gun control
"The reality is, we've got to do more, much more, than what we're doing right now.",No,infrastructure
We're on the cusp of a great opportunity to transform how we elect our leaders.,No,elections
"Look, this is really about the heart of American ingenuity.",No,employment
Can he even point to one policy that's improved readiness?,No,the military
This is about doing the right thing for our daughters and their daughters.,No,reproductive rights
Why don't we ask ourselves why it's taken so long to tackle this issue?,No,infrastructure
"When I travel around and see the challenges people face, it's clear we need to come together.",No,housing
I am committed to making sure we create more jobs for American workers.,No,the economy
I will personally make sure that affordable housing is available to everyone who needs it.,No,housing
Everyone knows that voter trust is critical for democracy to thrive.,No,elections
I firmly believe in the right of every individual to make informed health decisions.,No,vaccines
"We all feel it, we can sense the urgency in every storm and drought.",No,climate change
I've traveled to many countries as Secretary of State and seen the complexities firsthand.,No,foreign policy
We need to do whatever it takes to protect our values and interests abroad.,No,foreign policy
"Crime should never be something we accept as normal, plain and simple.",No,crime
We’re going to restore our standing on the world stage.,No,foreign policy
We'll rebuild and make our infrastructure a pillar of strength again.,No,infrastructure
"The housing crisis didn't happen overnight, and it won't be solved overnight either.",No,housing
"It's essential that we, as a nation, stand firm in our commitment to our seniors.",No,social security
I'm gonna make sure we prioritize innovation and skill development in our policies.,No,employment
Our current system must evolve to meet new challenges.,No,social security
"The goal is to bring everyone to the table, ensure a process where every voice is heard.",No,tax policy
How can we move forward when he can't even see the potential here?,No,energy
"It's time for a new chapter, where hard work is rewarded and opportunities are endless.",No,employment
"Look, everybody knows crime is out of control and people are scared.",No,crime
Can my opponent name a single time when doing nothing about guns worked?,No,gun control
"I've talked to families who are struggling to keep a home, and it breaks my heart.",No,housing
The investments we make today are gonna shape the next century.,No,infrastructure
We have to ensure it's done in a way that respects communities and their voices.,No,housing
"This is a pivotal moment, and we must ask ourselves if we're ready to seize it.",No,foreign policy
"The trade imbalance is just a number, but its impact is real.",No,trade
He has no understanding of what it takes to fix this broken system.,No,immigration
This administration is committed to fair trade agreements that don't leave our communities behind.,No,trade
"I've spoken to families from coast to coast, seeing how energy affects their lives.",No,energy
I believe deeply in the autonomy of individuals to make decisions about their own bodies.,No,reproductive rights
"If we're serious about a sustainable future, we have to rethink our approach.",No,energy
We're gonna bring the right kind of change to the justice system.,No,crime
"With the right leadership, we can transform education and uplift every community.",No,education
"We're going to revolutionize how our schools operate, and it's gonna be amazing.",No,education
"In about ten years, I intend for us to be a leader in this global effort.",No,foreign policy
Where's the compassion in turning away the most vulnerable among us?,No,healthcare
"Economists agree that things need to change, but where's his plan?",No,employment
I will ensure that every community in this country has access to the resources it needs.,No,infrastructure
"And uh, the question is, who is really prioritizing the well-being of our retired citizens?",No,social security
"He says he's tough, but you have to ask yourself, is that true strength?",No,foreign policy
We can't keep ignoring the voices of millions of Americans who want change.,No,gun control
We're going to ensure no one in this country is left without care.,No,healthcare
He doesn't understand what it's like to live paycheck to paycheck.,No,housing
The experts unanimously say we've got to act now – no time to waste.,No,climate change
We need to invest in clean energy now to secure future prosperity.,No,climate change
"Look, we have to work with our neighbors in this hemisphere.",No,immigration
"Many experts have weighed in, and they understand the complexities involved.",No,healthcare
And why isn't he addressing the imbalance we've got?,No,trade
"I mean, we absolutely need to push forward with sustainable energy projects.",No,infrastructure
"America needs to protect its elders; we owe it to them, plain and simple.",No,social security
Do you really think the other side's approach is going to help anyone?,No,social security
"I mean, we all know it's important to invest in communities to, uh, build a future all can be proud of.",No,housing
"Look, uh, our trade agreements should, you know, reflect our values.",No,trade
"What the people need is, honestly, a government that listens to them.",No,employment
"The American worker deserves a fair shake in the global market, and I'm gonna make sure they get it.",No,trade
I've campaigned across America and heard the people's concerns about voting.,No,elections
I will protect the middle class and fight for their interests every single day.,No,the economy
"Look, when have these current policies ever worked for the American people?",No,trade
It's beyond shameful that my opponent hasn't stepped up to the plate here.,No,vaccines
"In the future, we're going to see a stronger trade network.",No,trade
"We ought to focus on, you know, looking out for each other rather than spreading fear.",No,vaccines
"I mean, when experts express concern, we need to pay attention.",No,social security
"Listen, folks, democracy depends on citizens being able to believe in the process.",No,elections
"Look, we need bipartisan cooperation to improve our education system.",No,education
We need to ensure our students have a future that's filled with opportunity and growth.,No,education
This is weakening our collective drive to succeed as a nation.,No,tax policy
"It's crucial that we set our sights on building a safer, better world for everyone.",No,foreign policy
"Folks, we have to take a new approach, to boost our economy and support our businesses.",No,trade
The President just doesn't grasp the gravity of a weak defense strategy.,No,the military
"And, you know, it’s unbelievable that the roads are in such bad shape.",No,infrastructure
The American people want leaders who understand their struggles and are ready to act.,No,employment
What is he doing to increase job opportunities for our citizens?,No,the economy
The President doesn't get the real impact of these tragic events on our communities.,No,gun control
I promise to uphold and protect the sanctity of our elections.,No,elections
"Look, we need to ensure that we're supporting women in every aspect of their healthcare decisions.",No,reproductive rights
"Ask yourself, is this the best we can do for those who have worked their whole lives?",No,social security
"The experts are clear that there's a need for change, but what is it we are doing?",No,infrastructure
We should be asking why this administration hasn't done more.,No,energy
"I've toured the cities most affected by crime, and the resilience of our citizens is astonishing.",No,crime
"Look, we've seen how his decisions can impact hard-working Americans.",No,the economy
Why hasn't he taken steps to address the root causes of migration? You should ask him that.,No,immigration
I'm committed to bringing back trust and transparency in our voting systems.,No,elections
"Our experts, and look, they're pretty clear, say we must innovate to remain competitive.",No,trade
"You know, it's been said many times that our system is broken, but how do we fix it?",No,healthcare
"The President says he's an advocate for free trade, but where are the results?",No,trade
I will make sure we invest in roads and bridges like never before.,No,infrastructure
"Look, the world's getting more dangerous and we have to adapt to these challenges.",No,foreign policy
"This administration, folks, they're just not getting it.",No,trade
"Look, the American dream is something we all aspire to, and working families deserve their fair shot.",No,the economy
"When it comes down to it, people are going to ask themselves, 'Who truly cares about their wellbeing?'",No,healthcare
"Frankly, it's time to ask ourselves what price we're willing to pay for inaction.",No,the environment
"We've got to, uh, reinvest in our own people, for real progress to happen.",No,trade
The administration's approach lacks empathy for the everyday struggles of Americans.,No,vaccines
"I can tell you, having visited communities affected by immigration, that people are hurting.",No,immigration
"I mean, where's the courage to take on the special interests?",No,the economy
We've got to do better if we're going to have any chance of survival.,No,climate change
We're going to ensure our seniors are taken care of.,No,social security
The President has missed the mark completely on this issue.,No,gun control
You think he really understands what it's like on the street?,No,crime
He never listens to the concerns of the average voter; it's clear there's a disconnect.,No,elections
We have a moral obligation to open our hearts and show the world what we're made of.,No,immigration
His plan on the environment? It's just not up to the task of safeguarding our future.,No,the environment
Is having more jobs not what every family deserves?,No,employment
I'll push for better outcomes and more accountability in healthcare.,No,healthcare
Where's the proposal that guarantees protections for our industries?,No,trade
This issue is about the American dream—can we preserve it?,No,social security
We're really going to push through the changes needed to ensure fairness.,No,tax policy
"Look, I believe in American energy independence, but we need to be smart about it.",No,energy
Do we really want to go back to a time when choices were limited?,No,reproductive rights
Who's really looking out for the families who struggle the most?,No,reproductive rights
"I've spoken to countless veterans and they need assurance, not just promises.",No,the military
We need to do right by those who serve this country.,No,the military
He doesn't even have a plan to ensure every vote is counted.,No,elections
You just look at what he's done on the world stage.,No,foreign policy
We've got to create a system that's both fair and compassionate.,No,immigration
The American spirit is about coming together and pushing past the obstacles we face.,No,vaccines
"The experts have been analyzing this, and we know there are varying points of view.",No,vaccines
"Now, who here has actually felt the crippling cost of healthcare?",No,healthcare
"Look, I've spent time with folks in communities that have welcomed immigrants.",No,immigration
This is about fighting for the dignity of every family out there.,No,housing
I've spoken with people across the country who are feeling the effects of this every day.,No,climate change
I've seen firsthand the courage of mothers and families facing tough choices.,No,reproductive rights
Our focus should be on common ground and finding ways to make progress.,No,reproductive rights
"The system has let us down, we need better leadership.",No,immigration
This is about securing a fundamental right for everyone.,No,reproductive rights
We're going to bring back jobs and restore hope to American families.,No,employment
"He thinks we can afford to wait, but time is running out for the Earth.",No,the environment
"These so-called experts, they're all saying we've got to change our course.",No,tax policy
The time has come for comprehensive change that'll benefit every family in America.,No,infrastructure
We absolutely have to work together if we want to save the planet.,No,the environment
Why hasn't she put forth a realistic plan to help our teachers?,No,education
We have to trust our scientists because they know best.,No,vaccines
I've said it before and I'll say it again: education is the key to the future.,No,education
I'm committed to protecting the benefits for all of our seniors.,No,social security
I believe that families should have the benefits that vaccines provide.,No,vaccines
I vow to stand up against any policy that doesn’t put patients first.,No,healthcare
"Let's ask ourselves, why are we not leading in trade negotiations?",No,trade
"Folks, you know this is about ensuring every American can get the care they deserve.",No,healthcare
I will continue to fight for lower taxes for our everyday workers.,No,tax policy
How many tragedies do we need before we take real action?,No,gun control
"The American people need someone who will deliver real change, not just more talk.",No,healthcare
It's disheartening to see promises made and then policies that seem to forget the people.,No,vaccines
"I've talked with working families, and they feel left out.",No,housing
"Let me tell you, when I drive across some of these states, it's clear we've got work to do.",No,infrastructure
"Look, the truth is we've got the best doctors, but we need to keep improving the system.",No,healthcare
"The experts have spoken on how we should move forward, believe me.",No,crime
"Now, he thinks he can run this country, but has he even tried to understand what people truly face?",No,elections
