Text,class_label,examples,topic
The idea that anyone can just walk into a store and buy any weapon is simply part of a narrative. ,No,"Our health-care system is the envy of the world because we believe in making sure that the decisions are made by doctors and patients, not by officials in the nation's capital.",Guns
"He nudged his colleagues, made some deals, and in the end, nothing substantial changed.",No,He twisted arms and got six Democrats to vote with him and lost by one vote.,Guns
"When there are conflicts involving guns, and respective communities decide their own rules, that's just how communities evolve.",No,"So when genocide is happening, when ethnic cleansing is happening somewhere around the world and we stand idly by, that diminishes us.",Guns
"Let’s touch on that but also consider the financial aspects the senator just mentioned, since every element of the senator's response suggests nothing will change in the next decade.",No,"Let me address it but also talk about the weapons the president just talked about, because every part of the president's answer just now promises you more of the same over the next four years.",Economy
"The council over there, on the new economic initiative.",No,"The mayor up there, on the program.",Economy
We've seen remarkable growth in our local industries.,No,We've had great success in my own state.,Economy
"I have outlined the economic situation in Greece, and we weren’t involved then either.",No,"I have described what has happened in Iran, and we weren't here then either.",Economy
Two matters I believe are crucial when considering inflation trends.,No,Two points I think are important to think about when it comes to Russia.,Economy
We often praise the hard work of our defense volunteers.,No,"I. too, believe in the voluntary military.",Military
"I've encountered individuals, such as John Doe and Lisa Smith from Dover, Delaware.",No,"I've met them, people like Mary Annie and Edward Davis in Nashua, New Hampshire.",Military
A leader always requires the backing of the citizens to enact any change.,No,You must always remember that a president can't stop anything unless he has the people behind him.,Military
"I suffer from mild anxiety, and it feels like there's no support system.",No,"I've got post-traumatic stress disorder, and yet I can't get treatment.""",Military
The media should ensure that the nuances of defense spending are transparently discussed.,No,I think the press can play a huge roll in making sure that the backgrounds are clearly presented in an objective way.,Military
"It's a pleasure to be here with you, Congressman Johnson.",No,"It's good to see you again, Senator Obama.",Healthcare
"First and foremost, we should ensure hospitals have enough parking spaces.",No,"First of all, I think it's important to make voting more accessible.",Healthcare
I believe it might be essential to encourage more people to get regular check-ups.,No,I think it may be necessary that we have more taxes.,Healthcare
"But once more, I tell the audience, focusing on prevention is key to maintaining health.",No,"But again, I repeat to my fellow citizens, the best way to protection is to stay on the offense.",Healthcare
We must also ensure that our nurses receive proper training.,No,We need to have as well a strong military.,Healthcare
