Text,class_label,topic
"Look, over the last ten years, we’ve invested over $1 trillion into rebuilding our roads and bridges.",Yes,infrastructure
"He voted against the infrastructure bill that would've repaired 35,000 miles of highway.",Yes,infrastructure
I'm proud to say our city now has the lowest commute times compared to any other major metropolitan area in the country.,Yes,infrastructure
"The American Society of Civil Engineers gave us a D+ on our national infrastructure, and that's just unacceptable.",Yes,infrastructure
And more than 40% of the country’s bridges are over 50 years old and structurally deficient.,Yes,infrastructure
"In Florida alone, they’ve seen a 15% increase in infrastructure investments thanks to federal grants.",Yes,infrastructure
The last administration talked a lot about infrastructure but ended with less than 5% of planned projects completed.,Yes,infrastructure
We’re talking about creating hundreds of thousands of new jobs with these infrastructure projects.,Yes,infrastructure
"The United States has reduced carbon emissions more than any other country, even without being in the Paris Agreement.",Yes,energy
"Look, during my administration, we approved more solar panel installations than in any previous four-year period.",Yes,energy
"My opponent voted against the 2020 Clean Energy Stimulus Bill, which would've increased federal funding for renewable sources by 25%.",Yes,energy
"Over 60% of our crude oil now comes from domestic sources, compared to just 30% ten years ago.",Yes,energy
The International Energy Agency reported that renewable energy capacity grew at its fastest rate in two decades last year.,Yes,energy
There are 2 million electric vehicles on American roads today.,Yes,energy
We've eliminated more than 100 regulatory barriers to clean energy innovations since taking office.,Yes,energy
"And, by 2030, we're planning to have all new government vehicles running on clean energy sources.",Yes,energy
"Look, we've tripled the funding for special education in the last decade.",Yes,education
"And, uh, the graduation rate has never been lower in our state's history.",Yes,education
The scholarship program my opponent supports is estimated to cost $400 million a year.,Yes,education
He voted against increasing teacher salaries twice in the past three years.,Yes,education
"According to the Department of Education, U.S. students rank 15th in reading among industrialized nations.",Yes,education
The current administration's policy will phase out federal student loan forgiveness.,Yes,education
We've built more school facilities in the last year than any previous administration.,Yes,education
And the CBO has confirmed their education cuts could result in larger class sizes.,Yes,education
He voted against the comprehensive immigration reform bill in 2006.,Yes,immigration
"Let's be clear, under my administration, we've deported fewer people than any of the past three Presidents.",Yes,immigration
"Uh, the Center for Immigration Studies found that over 75% of undocumented immigrants have lived in the U.S. for more than 10 years.",Yes,immigration
"When I was governor, we increased funding for border security by 30%.",Yes,immigration
"Look, in 2022 alone, the Border Patrol seized over 800,000 pounds of illegal drugs.",Yes,immigration
"And, importantly, the University of Chicago study showed that immigrants are paying billions more in taxes than they're receiving in services.",Yes,immigration
"He said last year, 'We'll complete the wall', but it still isn't finished, is it?",Yes,immigration
The American Immigration Council states that immigrants are almost twice as likely to start a new business compared to native-born Americans.,Yes,immigration
"Since 2010, over 100 million vaccines have been distributed globally to combat endemic diseases.",Yes,vaccines
"Look, the senator voted against the 2021 Vaccine Research Enhancement Act which would've increased funding by $2 billion.",Yes,vaccines
"According to the World Health Organization, vaccine hesitancy was one of the top ten threats to global health in 2019.",Yes,vaccines
"The President promised vaccinations would reach 70 percent by July, and, uh, we barely reached 63 percent.",Yes,vaccines
He opposed mandatory vaccinations for public school children until 2020.,Yes,vaccines
More than 15 clinical trials have been funded directly by the National Institutes of Health in just the last year.,Yes,vaccines
"The pharmaceutical company announced a 95% efficacy rate for its latest booster, surpassing all others on the market.",Yes,vaccines
"And, you know, that subsidy for vaccine manufacturers was supposed to be $4.5 billion annually.",Yes,vaccines
"Look, the plan my opponent proposes would eliminate the inheritance tax, resulting in a $180 billion cost to the government over the next decade.",Yes,tax policy
"Uh, we've seen a drop in corporate tax revenue by 12% since you reversed the 2017 tax cuts, isn't that true?",Yes,tax policy
"In 2019, the Joint Committee on Taxation actually found that the middle class would end up paying $200 more per year.",Yes,tax policy
The President has claimed that they closed more tax loopholes during his administration than any other time in history.,Yes,tax policy
"You know, under his plan, 83% of the benefits go to the top 1% of earners.",Yes,tax policy
"According to the Tax Foundation, the recent proposal to raise income taxes could potentially decrease GDP by 1.6%.",Yes,tax policy
"He supported raising taxes on families making less than $100,000, something I've always been against.",Yes,tax policy
I've heard the CBO suggest that the recent tax initiative might increase national debt by $1.3 trillion over the next decade.,Yes,tax policy
The Senator voted against the immigration reform bill in 2013.,Yes,immigration
"In the last decade, net migration from Mexico has been zero.",Yes,immigration
"His plan, I'm quoting here, would cost around $30 billion over ten years.",Yes,immigration
"And frankly, more than 40% of undocumented immigrants actually overstay their visas, not cross the border.",Yes,immigration
"Look, more families are being separated now than at any point since the 1990s.",Yes,immigration
"The current policy allows just 10,000 refugees from Latin America each year.",Yes,immigration
"Under President Reagan, we granted amnesty to nearly 3 million people.",Yes,immigration
"You know, the Chamber of Commerce has said that comprehensive immigration reform would add $1.5 trillion to the GDP.",Yes,immigration
"In the last election, more than 100 million people voted.",Yes,elections
He supported a bill to reduce polling places by 20%.,Yes,elections
The voter turnout was lower than it’s been in decades.,Yes,elections
"Look, according to the Census Bureau, minority registration has increased by 15%.",Yes,elections
"In 2016, he voted against the Voting Rights Act amendment.",Yes,elections
The study by Pew Research shows mail-in voting boosts turnout by at least 5%.,Yes,elections
He's made allegations about foreign interference without evidence from intelligence agencies.,Yes,elections
"And I mean, uh, back in 2020, the ballots were counted twice in multiple states.",Yes,elections
"Social Security is set to be insolvent by 2034, according to the CBO.",Yes,social security
"He voted to increase the retirement age, twice, in 2017 and 2019.",Yes,social security
"And look, more than 50 million Americans rely on Social Security monthly.",Yes,social security
The Trust Fund's reserve has been depleted faster than analysts originally projected.,Yes,social security
"I've never supported privatizing Social Security, unlike my opponent.",Yes,social security
"President Reagan raised Social Security taxes in 1983, and it was bipartisan.",Yes,social security
Annual benefit cuts would impact millions if we don't act now.,Yes,social security
He said Social Security was a Ponzi scheme back in 2011.,Yes,social security
The Senator voted against the election security bill in 2021.,Yes,elections
This administration has prosecuted more cases of voter fraud than any other in the past four decades.,Yes,elections
"According to the Brennan Center, voter turnout surged by 25% in the 2022 midterms.",Yes,elections
"He promised he'd create a task force on election interference, and that hasn't happened.",Yes,elections
"My opponent claims to support free and fair elections, yet he sponsored a law last year making it harder to vote by mail.",Yes,elections
"And let me remind you, last election cycle, there were over 500 polling places closed, disproportionately in minority-heavy areas.",Yes,elections
The Washington Post reported that foreign interference efforts cost American taxpayers an estimated $800 million this year alone.,Yes,elections
"More than 60% of voters, according to Gallup, believe our elections are less secure now than they were five years ago.",Yes,elections
"Look, he voted against the Affordable Care Act three times.",Yes,healthcare
The study from the Kaiser Family Foundation shows that premiums have increased by 20 percent since last year.,Yes,healthcare
And more people have gained health coverage under this plan than any other since Medicare.,Yes,healthcare
She was part of the committee that cut funding by $500 million.,Yes,healthcare
"The President promised that everyone could keep their doctor, but we know millions couldn't.",Yes,healthcare
The number of uninsured children has decreased by 3 million in just four years.,Yes,healthcare
"According to a recent report, our healthcare spending is the highest per capita among developed nations.",Yes,healthcare
"He mentioned the plan would save $400 billion long-term, but the analysis is not conclusive.",Yes,healthcare
"He pushed for sanctions against Iran back in 2012, when everyone else was too afraid to act.",Yes,foreign policy
"The President, uh, attended just three of the national security briefings this month.",Yes,foreign policy
"Look, our aid to Ukraine has increased by more than 40% since last year.",Yes,foreign policy
They didn't even follow through with the promised 500 million in humanitarian support for Syria.,Yes,foreign policy
"I mean, China's military budget is now the second largest in the world, surpassing Russia.",Yes,foreign policy
The Senator was for the withdrawal from Afghanistan before she changed her position last fall.,Yes,foreign policy
"And just to be clear, NATO has expanded by five countries during his term.",Yes,foreign policy
"The World Bank confirmed it last week, our economic aid to developing countries has dropped.",Yes,foreign policy
"In 2020, voter turnout was the highest it's been in over a century.",Yes,elections
"My opponent voted against the Voting Rights Act back in 2015, which was crucial for maintaining fair elections.",Yes,elections
The Congressional Budget Office reported that mail-in voting doesn't significantly raise the risk of fraud.,Yes,elections
We've seen over 200 new voter ID laws proposed just in the past two years.,Yes,elections
"The Senator claimed he was a strong advocate for election security, but he cut funding for cybersecurity by 30%.",Yes,elections
"You know, there are states where voting machines are older than my grandkids, and that's unacceptable.",Yes,elections
"In the 2016 election, social media platforms saw a 2,000% increase in political misinformation compared to 2012.",Yes,elections
Here's a fact: He supported a measure that would've limited early voting by two weeks.,Yes,elections
"In 2033, the Social Security trust fund will be exhausted if we don't make changes.",Yes,social security
He voted against a bill that would've protected Social Security from cuts by insulating it with $500 billion.,Yes,social security
Social Security benefits have increased by 1.6% last year solely due to cost-of-living adjustments.,Yes,social security
"And look, Social Security accounts for about 23% of the U.S. federal budget.",Yes,social security
I've proposed a plan to increase payroll taxes for the wealthiest 2% to ensure the program's solvency.,Yes,social security
The Senator there opposed increasing the retirement age in his last term.,Yes,social security
"According to the AARP, three out of every five elderly Americans rely on Social Security for more than half of their income.",Yes,social security
We've had more adjustments to Social Security during this administration than any other.,Yes,social security
"The senator voted against H.R.3, which would've prohibited federal funding for most abortions.",Yes,reproductive rights
"Under my leadership, the rate of teenage pregnancy has dropped by 15% in our state.",Yes,reproductive rights
"Look, Planned Parenthood provides services to over 2.4 million women annually.",Yes,reproductive rights
My opponent sponsored a bill that would've allowed abortions up to the day before childbirth.,Yes,reproductive rights
"The Hyde Amendment has been in effect since 1976, restricting the use of federal funds for abortion.",Yes,reproductive rights
We've expanded Title X funding by nearly 20% to support women's health services.,Yes,reproductive rights
"And according to the Guttmacher Institute, 92% of abortions happen within the first 13 weeks.",Yes,reproductive rights
"Don't forget, he supported the 'heartbeat bill' that restricts abortions after six weeks.",Yes,reproductive rights
I will make it a priority to rebuild our bridges and our roads.,No,infrastructure
He doesn't get the importance of modernizing our infrastructure.,No,infrastructure
"We've neglected these areas for way too long, and it's gotta change.",No,infrastructure
Can you even imagine what a better rail system would do for us?,No,infrastructure
The experts all agree that we must do something soon.,No,infrastructure
Our communities deserve to have safe roads and clean water.,No,infrastructure
I'm committed to bringing in the best minds to address these issues.,No,infrastructure
"Look, I've met with countless families worried about our aging infrastructure.",No,infrastructure
The reality is our workforce deserves more respect and we have to do better.,No,employment
"Folks, I'll tell you—I have a plan to ensure that every American has a job they can be proud of.",No,employment
Why hasn't he addressed the root of the unemployment issue yet?,No,employment
I've been across this nation and I've heard the struggles from hardworking families firsthand.,No,employment
We're going to fix the broken system that's failed workers for too long.,No,employment
"He just doesn't seem to understand, uh, the impact his policies have had.",No,employment
"Look, experts agree that this strategy is important, but he won't listen.",No,employment
"In my opinion, the middle class has been ignored by the current administration.",No,employment
We have to ensure that every trade agreement benefits our workers and grows our economy.,No,trade
I've met with countless families who feel the negative impact of unfair trade.,No,trade
"Look, my opponent seems to ignore the real people affected by these decisions.",No,trade
"We must, uh, work tirelessly to level the playing field for American businesses.",No,trade
"The experts are clear on this, but we can't keep ignoring the facts.",No,trade
Where's his evidence that this will actually benefit small businesses?,No,trade
I promise that our administration will bring back manufacturing jobs to America.,No,trade
It's about time we take a stand for our workers and their families.,No,trade
We have to invest in infrastructure for the future generations.,No,infrastructure
I promise to make our roads and bridges safer for our families.,No,infrastructure
Can anyone deny that we've neglected our infrastructure for too long?,No,infrastructure
"Look, I've traveled across this great nation and seen the state of our infrastructure.",No,infrastructure
He fails to see the urgency of upgrading our outdated systems.,No,infrastructure
The experts tell us that we absolutely need these improvements.,No,infrastructure
Our communities depend on reliable infrastructure to thrive.,No,infrastructure
The infrastructure issue is really about giving our children a better future.,No,infrastructure
We have a moral obligation to protect our planet for future generations.,No,the environment
This is something we absolutely must get right; it's about the future of our children.,No,the environment
I will ensure that we make investments in clean technology and green jobs like never before.,No,the environment
Where's the long-term strategy from the other side?,No,the environment
"Look, the science is, uh, pretty clear that we need urgent action.",No,the environment
"He doesn't grasp the serious, uh, implications of what's at stake here.",No,the environment
"I've traveled to areas hardest hit by climate change, and, uh, it's heart-wrenching to see.",No,the environment
We're gonna prioritize clean energy solutions in a way that benefits everyone.,No,the environment
We've got to ensure a greener future for our children.,No,climate change
"The science, folks, is something we need to listen to.",No,climate change
I'm going to push for better environmental policies.,No,climate change
Does my opponent even care about the rising sea levels?,No,climate change
"We can't sit idly by while our planet suffers, it's heartbreaking.",No,climate change
She has failed to take a single effective step on climate.,No,climate change
"Look, reducing emissions is good for everyone, period.",No,climate change
I've worked alongside climate leaders across the globe.,No,climate change
We have to ensure that everyone has the opportunity they deserve.,No,employment
"Look, what are his solutions really going to accomplish for job growth?",No,employment
"I've talked to workers and families across the country, and they feel left behind.",No,employment
We need a bold new strategy for creating jobs in America.,No,employment
The American workforce is the backbone of everything we stand for.,No,employment
I'm committed to securing a brighter future for all of our workers.,No,employment
Can the Senator really say she's stood up for jobs when it mattered most?,No,employment
The experts are unanimous in saying we have to act now.,No,employment
We have to prioritize safety in our neighborhoods.,No,crime
I'm committed to working with law enforcement to find real solutions.,No,crime
Does he really understand the pain these families go through every day?,No,crime
The American people deserve a government that listens and acts.,No,crime
Experts have been raising alarms about crime for years.,No,crime
We're going to implement measures that protect our citizens.,No,crime
It's a tragedy when communities feel abandoned.,No,crime
"I think we can all agree, this crisis impacts everyone.",No,crime
"Our military needs to be the strongest in the world, there's no question about that.",No,the military
We're gonna ensure our troops have the best equipment available.,No,the military
"Honestly, how can we expect to stay secure if we're not investing in defense?",No,the military
"Sending a message of strength is crucial, but he doesn't get that.",No,the military
"I've met with families of veterans across this nation, and their stories are inspiring.",No,the military
The experts all agree that we need a comprehensive strategy for our armed forces.,No,the military
I'm committed to supporting every servicemember returning home.,No,the military
Can the Senator even name a time when he supported a defense bill?,No,the military
I'm committed to strengthening our alliances around the world.,No,foreign policy
"Look, if we don't act now, future generations will question our resolve.",No,foreign policy
"I've spoken with leaders globally, and they want to work with us.",No,foreign policy
Where's his concern for diplomacy?,No,foreign policy
He just doesn't appreciate the nuances of international relations.,No,foreign policy
I believe in the promise of American leadership on the global stage.,No,foreign policy
The experts I've consulted with are aligned with this perspective.,No,foreign policy
"Our foreign policy, it's been about building trust and understanding.",No,foreign policy
"Uh, education is the cornerstone of our society.",No,education
"We have to ask ourselves, where is the investment in our children's future?",No,education
The experts all agree that what we're doing isn't enough.,No,education
I promise I will advocate tirelessly for every student in this nation.,No,education
He just doesn't get how crucial teachers are to development.,No,education
"I've met with teachers and students, and I can tell you, we've got work to do.",No,education
"Look, our schools are the backbone of our communities.",No,education
"And let me be clear, we can and must do better in education.",No,education
We need to prioritize the health of our children.,No,vaccines
"I have talked to people across the nation, and their stories about vaccine access are truly moving.",No,vaccines
My opponent just doesn't grasp the struggles families face over these choices.,No,vaccines
I'm planning to ensure everyone has the confidence to make the best decision for their family.,No,vaccines
"Look, it's clear that we have to do better to protect vulnerable populations.",No,vaccines
"The experts are unanimous in their evaluations, whatever the opposite side says.",No,vaccines
Is he even aware of the anxiety parents are feeling about this?,No,vaccines
"With my plan, we'll move forward with compassion and science guiding us.",No,vaccines
We need to lead the world in tackling environmental issues.,No,the environment
I promise we will invest in a cleaner future for all our children.,No,the environment
It's crucial to ask: why hasn't more action been taken?,No,the environment
Our experts have consistently shown the way forward on climate policy.,No,the environment
I’ve seen the struggles of families affected by pollution firsthand.,No,the environment
The devastation from climate change is unlike anything we've ever faced before.,No,the environment
He simply doesn’t grasp the full ramifications of inaction on this issue.,No,the environment
We must come together to ensure a healthier planet for future generations.,No,the environment
We're gonna make the tax system fair for everyone.,No,tax policy
"The rich have to pay their fair share, it's that simple.",No,tax policy
Why hasn't he addressed the loopholes yet?,No,tax policy
"I've talked with families across America, they're struggling.",No,tax policy
"Believe me, this isn't just about numbers, it's about people.",No,tax policy
Our opponents don't fully grasp the challenges of the middle class.,No,tax policy
What's their plan to ensure everyone gets a fair chance?,No,tax policy
"We need a vision for the future, not just temporary fixes.",No,tax policy
We need to harness the power of innovation to address this issue.,No,climate change
"Look, climate change is a challenge that requires all of us to step up.",No,climate change
"I promise, we're going to invest in clean energy for our future generations.",No,climate change
"If we don't act now, what will our children think of us?",No,climate change
The severity of this crisis truly touches the heart of every American.,No,climate change
Can he even name a single scientist who disagrees?,No,climate change
"During my travels, I've seen the impact of climate change firsthand.",No,climate change
"We must come together, as a nation, to turn the tide on this environmental threat.",No,climate change
We need leaders who are willing to stand up for the rights of all women across this great nation.,No,reproductive rights
"I'm going to ensure that every voice is heard because, honestly, too many have been silenced for too long.",No,reproductive rights
"The Senator talks a big game, but where's the comprehensive plan that actually empowers women?",No,reproductive rights
This is about setting a future where our daughters have more choices than we ever did.,No,reproductive rights
"Look, it's not enough to just talk about these issues; we have to bring compassion into the debate.",No,reproductive rights
Why won't my opponent acknowledge the decades of struggle women have faced?,No,reproductive rights
I've met with countless women and families who feel left behind by the system.,No,reproductive rights
We're going to work tirelessly to protect these fundamental freedoms for future generations.,No,reproductive rights
We've got to make sure everyone has the opportunity to own a home.,No,housing
I promise to work tirelessly to improve affordability.,No,housing
"The housing crisis is hurting families everywhere, and it's unacceptable.",No,housing
Do families deserve to live in fear of being priced out?,No,housing
"Look, my opponent has no idea what it's like for struggling homeowners.",No,housing
We've heard from numerous experts on how dire the situation really is.,No,housing
"I've traveled across the country, talking to people living in high-rent areas.",No,housing
The dream of homeownership shouldn't be out of reach for hardworking Americans.,No,housing
We need to come together as a nation to protect our beautiful lands.,No,the environment
"Uh, this administration isn't doing enough, and he knows that.",No,the environment
"I will make sure that, under my leadership, clean energy is a top priority.",No,the environment
Isn't it time we asked ourselves what's more important—profits or our planet?,No,the environment
"Look, I'm committed to ensuring we have sustainable practices for future generations.",No,the environment
"Experts agree that drastic measures are essential, but the question is, when will he act?",No,the environment
"The environment shouldn't be a partisan issue, and frankly, it's disappointing it has become one.",No,the environment
I have listened to countless citizens who demand cleaner air and water for their children.,No,the environment
We have to ensure that older Americans can retire with dignity.,No,social security
