Text,class_label,topic
I've worked to create more manufacturing jobs than any other governor in my state's history.,Yes,employment
The Bureau of Labor Statistics reported that wage growth has been stagnant since the last quarter.,Yes,employment
"Look, my opponent claims to support small businesses but opposed tax relief twice.",Yes,employment
Experts say the job participation rate is the highest it's been in a decade.,Yes,employment
Research from the Economic Policy Institute shows that gig economy workers earn 20% less than traditional employees.,Yes,employment
"Uh, the unemployment rate was at 3.9% in September, according to the Department of Labor.",Yes,employment
"She claims she created 500,000 jobs, but, in reality, manufacturing jobs fell under her leadership.",Yes,employment
"Look, during my tenure, wages have increased faster than at any point in the last 20 years.",Yes,employment
The Senator voted against the bill that would've supported thousands of new infrastructure jobs.,Yes,employment
"And more importantly, that was before the tech companies downsized.",Yes,employment
"They've added around 200,000 jobs since, uh, the start of this year, and that's crucial.",Yes,employment
He opposed the minimum wage increase last year that would've directly affected millions of workers.,Yes,employment
"According to a recent study from the Economic Policy Institute, income inequality has widened during his administration.",Yes,employment
"She voted against increasing Pell Grants in 2019, plain and simple.",Yes,education
"Look, the national student loan debt is over $1.6 trillion now.",Yes,education
"And as a result, America ranks 25th in math scores globally, below Portugal.",Yes,education
The Department of Education reports that we've seen a 5% decrease in teacher salaries over the last decade.,Yes,education
My opponent supported the policy that led to STEM funding cuts.,Yes,education
"It's clear, the school voucher program has reduced enrollment in public schools by 3% since 2020.",Yes,education
"I mean, according to the Cato Institute, school choice improves graduation rates by 12%.",Yes,education
"In essence, he said just last year he doesn't believe in federal involvement in K-12 education.",Yes,education
We reduced violent crime by 25% over the last decade.,Yes,crime
"Look, the FBI reported that last year, car thefts increased by nearly 30% in urban areas.",Yes,crime
"He opposed the 1994 crime bill that helped put 100,000 more police officers on the streets.",Yes,crime
"According to a study from the University of Chicago, states with stricter gun laws saw a 40% decrease in gun-related deaths.",Yes,crime
The Senator twice voted against funding for community policing.,Yes,crime
"There were fewer than 5,000 murder cases nationwide in 2021.",Yes,crime
"I mean, the incarceration rate in our country is the highest in the world, higher than any other OECD nation.",Yes,crime
"And that's why, in my term as mayor, we cut recidivism by half.",Yes,crime
I've actually increased border security funding by 25% since I took office.,Yes,immigration
"Look, she voted against funding the wall four times.",Yes,immigration
The Pew Research Center found that there are over 10 million undocumented immigrants in the U.S.,Yes,immigration
"In 2021, our administration approved over 300,000 work visas.",Yes,immigration
He was for amnesty when it was politically convenient.,Yes,immigration
"Uh, the cost of this immigration bill is $500 billion over the next decade.",Yes,immigration
"And more importantly, less crime was reported in areas with larger immigrant populations, according to the FBI.",Yes,immigration
We've decreased illegal crossings by 40% with our new technology initiatives.,Yes,immigration
"In 1986, under President Reagan, we granted amnesty to nearly 3 million undocumented immigrants.",Yes,immigration
My opponent voted against the Dream Act three times.,Yes,immigration
"Honestly, we have allocated more money to border security than at any other time, ever.",Yes,immigration
The Pew Research Center reports that the number of undocumented workers has remained stable at around 11 million since 2007.,Yes,immigration
"Look, the recent legislation proposed cutting legal immigration by 50%, and that's just not sustainable.",Yes,immigration
"During the last administration, deportations increased to a record high, over 400,000 in one year.",Yes,immigration
"He supported the visa lottery program, and I think that's a security risk.",Yes,immigration
"And don't forget, H-1B visas were capped at 65,000, a number that hasn't changed in years.",Yes,immigration
Five million jobs have been added to the economy since the start of the year.,Yes,employment
My opponent opposed the minimum wage increase three times in the last decade.,Yes,employment
The unemployment rate today is the lowest it’s been in over 50 years.,Yes,employment
"The Bureau of Labor Statistics reported that manufacturing jobs fell by 12,000 last month.",Yes,employment
"And just to be clear, under his administration, job growth slowed by nearly 30%.",Yes,employment
The labor force participation rate has increased for women and minorities.,Yes,employment
A Federal Reserve study found that automation could displace up to 30% of jobs by 2030.,Yes,employment
"According to the Congressional Budget Office, a $15 minimum wage could lift 1.3 million people out of poverty.",Yes,employment
The Senator opposed the 2022 bill that would’ve protected the right to access contraception.,Yes,reproductive rights
"You know, Planned Parenthood provides services to over 2.5 million patients every year.",Yes,reproductive rights
"Look, the study from the Guttmacher Institute found that restrictive laws aren’t reducing abortion rates.",Yes,reproductive rights
More than 80 percent of Americans support keeping Roe v. Wade in some form.,Yes,reproductive rights
"When he was in office, he nominated judges who vowed to overturn Roe.",Yes,reproductive rights
"And let me just say, legal abortions are statistically safer than childbirth.",Yes,reproductive rights
He co-sponsored the 2017 bill that restricted funding for clinics.,Yes,reproductive rights
"I've consistently voted to expand women's healthcare access, not limit it.",Yes,reproductive rights
We have reduced the uninsured rate to its lowest level in history.,Yes,healthcare
"My plan would lower prescription drug costs by 30%, according to independent analysts.",Yes,healthcare
"Under her administration, 20 million more Americans got health coverage.",Yes,healthcare
"And let's not forget, we spend more on healthcare than any other developed nation and still have lower life expectancy.",Yes,healthcare
The Senator voted against expanding Medicaid in 2014.,Yes,healthcare
More people have died from preventable diseases here than in most European countries since 2010.,Yes,healthcare
"They've cut funding for mental health services by, what, $2 billion over the past decade?",Yes,healthcare
"According to the CBO, the proposed bill will leave 23 million people without coverage.",Yes,healthcare
"And studies show, by 2030, uh, renewable energy could be 90% more cost-effective.",Yes,energy
"She's saying that we can just invest in more oil drilling and everything will be fine, but over the last decade, investments in fossil fuels have actually decreased.",Yes,energy
"Look, the Senator voted twice against bills that would have prioritized clean energy infrastructure.",Yes,energy
Our nation's electric vehicle sales are growing faster than any other G7 country.,Yes,energy
The latest figures indicate that coal production has dropped 25% ever since he took office.,Yes,energy
"And, his tax plan, it gives more subsidies to big oil, it's literally in the fine print.",Yes,energy
"Remember, the International Energy Agency has warned that public investment in renewables needs to triple by 2030.",Yes,energy
"She's been in favor of the Keystone pipeline, despite its projected environmental impact according to the EPA.",Yes,energy
And he voted against the tax cuts for middle-class families three times in the Senate.,Yes,tax policy
"According to the IRS, the top 1% of earners paid 40% of federal income taxes last year.",Yes,tax policy
"Look, my opponent's plan adds $1.5 trillion to the national deficit over the next decade.",Yes,tax policy
"We have the highest corporate tax rate among industrialized nations, at 21%.",Yes,tax policy
"I've doubled the child tax credit, giving over 10 million families a critical financial boost.",Yes,tax policy
"And, you know, it was under his administration that carried interest loopholes were preserved, benefiting only the wealthy hedge fund managers.",Yes,tax policy
"Well, just last week, the Joint Committee on Taxation reported that his tax proposal disproportionately benefits the top 5%.",Yes,tax policy
"Since she took office, property taxes in her state have risen by 12% on average.",Yes,tax policy
Our trade deficit with China was $375 billion last year.,Yes,trade
"She voted against the USMCA which was projected to add 176,000 jobs.",Yes,trade
The senator's plan could potentially increase tariffs by 25%.,Yes,trade
"Under my administration, we've negotiated deals resulting in $10 billion in exports.",Yes,trade
"And by the way, you know, the last three trade agreements he supported led to job losses.",Yes,trade
It's the largest trade deal in North American history since NAFTA.,Yes,trade
"According to the World Trade Organization, our tariffs are some of the lowest globally.",Yes,trade
I've spoken to farmers who say their exports to Europe have doubled.,Yes,trade
My opponent voted to cut funding for renewable energy projects five times in the last three years.,Yes,the environment
"Look, the EPA reported that carbon emissions from cars have dropped 10% since 2019.",Yes,the environment
"China has invested more in solar energy than any other country, including us.",Yes,the environment
We've increased the protected lands by over 1 million acres since I took office.,Yes,the environment
"He's talking about the Clean Air Act, but he tried to roll back those regulations just last year.",Yes,the environment
"And uh, more than 70% of all plastic waste ends up in landfills.",Yes,the environment
"According to the IPCC, if warming exceeds 1.5 degrees Celsius, the impacts will be far more severe.",Yes,the environment
The President said it himself: we've planted more trees than any administration before.,Yes,the environment
"Under my watch, over 300,000 manufacturing jobs were added back to the economy in just the last two years.",Yes,employment
"She talks about job creation, but unemployment was at 3.8 percent when I left office.",Yes,employment
"According to the latest BLS report, wages have risen by 4.5% on average in the last twelve months.",Yes,employment
"And, look, the tech sector alone accounts for, uh, over a million new positions this year.",Yes,employment
My opponent voted against the minimum wage increase—twice.,Yes,employment
The American economy added more jobs last month than any other industrialized nation.,Yes,employment
"Yet, 25% of college graduates are still underemployed or unemployed, according to recent studies.",Yes,employment
"He promised 10 million new jobs, but we're still not seeing the results.",Yes,employment
He voted against the vaccine funding bill twice.,Yes,vaccines
"And let me tell you, according to the CDC, over 200 million Americans are fully vaccinated.",Yes,vaccines
"Pfizer, Moderna, and Johnson & Johnson have reported profits in the billions.",Yes,vaccines
"My opponent claims that herd immunity can be achieved without vaccination, which flies in the face of WHO recommendations.",Yes,vaccines
The rollout was the fastest in U.S. history.,Yes,vaccines
He didn't support the emergency declaration for vaccine distribution.,Yes,vaccines
Our administration delivered 100 million doses ahead of schedule.,Yes,vaccines
The President signed a deal that ensured 500 million doses for international allies.,Yes,vaccines
He voted against funding for election security three times.,Yes,elections
"Look, every county uses their own, uh, voting machines now.",Yes,elections
"And just last year, over 90 million mail-in ballots were cast.",Yes,elections
"According to the Brennan Center, we're facing the most restrictive voting laws since 1965.",Yes,elections
I've been pushing for automatic voter registration nationwide.,Yes,elections
"And more importantly, there were no cyber intrusions reported in the 2020 election.",Yes,elections
Our state's voter turnout was the highest since the 1960 presidential election.,Yes,elections
"He keeps saying voter ID laws are discriminatory, but 34 states have them.",Yes,elections
"Over the last decade, our carbon emissions have dropped by 15%, but not fast enough.",Yes,climate change
"The Paris Agreement set ambitious goals, but we're already two years behind our commitments.",Yes,climate change
"Uh, the Senator's plan would lead to doubling our gas price, plain and simple.",Yes,climate change
"Look, China is investing five times more in renewable energy than the United States is right now.",Yes,climate change
His administration rolled back 95 environmental protections.,Yes,climate change
Our oceans are 30% more acidic than they were 150 years ago.,Yes,climate change
"Well, around 80% of our energy still comes from fossil fuels.",Yes,climate change
"And just last year, Texas surpassed the entire United Kingdom in wind energy production.",Yes,climate change
He didn't vote on the Voter Integrity Act.,Yes,elections
"Look, in 2020, over 159 million Americans voted, the highest turnout ever.",Yes,elections
"According to the State Department, there were significant cyber threats targeting election infrastructure.",Yes,elections
You supported legislation that cut funding for polling stations.,Yes,elections
I've co-sponsored the bill to ensure same-day voter registration is available nationwide.,Yes,elections
"In 2016, over half of all votes were cast before Election Day.",Yes,elections
The Washington Post found that mail-in voting fraud accounts for only 0.0025% of the votes.,Yes,elections
She was a strong advocate for the Voting Rights Act restoration.,Yes,elections
"You know, the National Teacher's Union stated that over 30% of teachers left the profession last year due to burnout.",Yes,education
My opponent voted against increasing funding for public schools in 2021.,Yes,education
And I've worked on legislation that increased Pell Grants by twenty percent.,Yes,education
"Look, we have more students per classroom now compared to any time in the last decade.",Yes,education
"They promise higher test scores but at the cost of cutting arts programs, which we completely oppose.",Yes,education
"According to the Education Department, slightly more than half of public high schools offer Advanced Placement classes.",Yes,education
"He said college tuition would go down, but it's climbed faster than inflation every year.",Yes,education
"The new STEM initiative is expected to triple the number of graduates by 2025, that's what they told us.",Yes,education
"We've reduced our carbon emissions more than any other major economy, period.",Yes,the environment
"Look, in the last four years, the administration has approved drilling permits at a 60% higher rate than we did.",Yes,the environment
"I mean, just last year, the EPA reported that water quality assessments found issues in over 70% of rivers and streams.",Yes,the environment
"He opposed the Green New Deal resolution on the floor, despite promising supporters he'd back it.",Yes,the environment
"And, simply put, Congress hasn't passed significant environmental protection legislation since 2015.",Yes,the environment
The Wildlife Conservation Society estimates that we've lost 40% of bee populations in the last decade.,Yes,the environment
"My administration has planted more trees annually than any past administration, that's just a fact.",Yes,the environment
"Uh, and California, yeah, they have the strictest vehicle emissions standards, you know?",Yes,the environment
"And the fact is, his state lost 15,000 jobs last year alone.",Yes,the economy
"The President signed off on, what, the largest tax hike in three decades?",Yes,the economy
She didn't even support the infrastructure bill that would've revamped our roads.,Yes,the economy
"According to the Labor Department, unemployment has fallen to the lowest rate since 1969.",Yes,the economy
"We've got a surplus, but not one cent of it has gone to education.",Yes,the economy
"He voted against the stimulus package in, you know, 2009.",Yes,the economy
"Listen, the IMF has projected that our GDP growth will surpass China's next year.",Yes,the economy
"In the last four years, I've helped create over a million new jobs.",Yes,the economy
"In the last election cycle, over 75 million people voted early or by mail, which was unprecedented in our history.",Yes,elections
He opposed the Voting Rights Act amendments when they were up for a vote in 2014.,Yes,elections
"Look, the Secretary of State in Georgia, uh, certified the vote with no evidence of widespread fraud.",Yes,elections
"And, uh, 60% of Americans are demanding campaign finance reform.",Yes,elections
"The Electoral College, by design, gives disproportionate power to less populous states.",Yes,elections
She claims to have registered more new voters in Arizona than any other organization this year.,Yes,elections
And then he turned around and supported a bill that would make it harder for working people to vote.,Yes,elections
"In 2018, more women than ever before were elected to Congress.",Yes,elections
Our highways have been ranked 12th in efficiency by the American Society of Civil Engineers.,Yes,infrastructure
And I've doubled the budget for rural broadband expansion.,Yes,infrastructure
"Now look, the last time we really invested in bridges was back in 2009.",Yes,infrastructure
She voted against the infrastructure package that would've generated 1 million jobs.,Yes,infrastructure
The EPA has actually documented increased lead levels in Flint under his watch.,Yes,infrastructure
"According to the Department of Transportation, we have the same level of crumbling infrastructure as we did 20 years ago.",Yes,infrastructure
Our solar farms have outpaced California's in production per capita.,Yes,infrastructure
The American Legion said our veteran facilities backlog is the worst they've seen.,Yes,infrastructure
"Look, crime rates have dropped by 15% over the past two years.",Yes,crime
"And my opponent, he voted against that bipartisan bill that would have funded community policing initiatives.",Yes,crime
"The FBI reported an increase in cybercrimes last year, more than any other time in the past decade.",Yes,crime
"Uh, Chicago alone accounted for over 20% of all the homicides in the country last year.",Yes,crime
Incarceration rates in our state? They’re among the highest in the entire nation.,Yes,crime
"And I mean, the Department of Justice highlighted this, uh, rise in violent crime across urban areas.",Yes,crime
We've doubled funding for mental health programs to help reduce crime.,Yes,crime
A study by the Sentencing Project showed that racial disparity in sentencing remains a critical issue.,Yes,crime
He voted against the sanctions on Russia twice in the past year.,Yes,foreign policy
We negotiated the release of three hostages without conceding anything.,Yes,foreign policy
The military aid package we sent to Ukraine is the largest since the end of the Cold War.,Yes,foreign policy
"Uh, look, China's economy has grown by, what, 8% annually over the last decade, while ours has struggled to maintain even half that growth.",Yes,foreign policy
"During her tenure as Secretary of State, she visited 112 countries.",Yes,foreign policy
A study by the Center for Strategic and International Studies found that only 10% of the promised aid reached Afghanistan's rural areas.,Yes,foreign policy
The President said it was under his administration that North Korea's missile tests decreased significantly.,Yes,foreign policy
"Iran has enriched uranium up to 60%, which is closer than ever to weapons-grade levels.",Yes,foreign policy
Violent crime rates have fallen by 30% over the last decade.,Yes,crime
"Look, last year alone, my opponent voted against funding for local police departments four times.",Yes,crime
The National Bureau of Statistics showed a 15% increase in cybercrime incidents in 2022.,Yes,crime
"He talks about reducing crime, but during his tenure, the city recorded the highest homicide rate in its history.",Yes,crime
"According to the FBI's latest report, we have fewer officers on the street per capita than any other industrialized nation.",Yes,crime
"And remember, California's new sentencing law led to over 10,000 prisoners being released early.",Yes,crime
President Biden allocated $350 million more for community-based crime prevention programs this year.,Yes,crime
"In 2021, property crimes decreased by 8% nationally, thanks to new legislative efforts.",Yes,crime
"In 2018, crime rates in urban areas decreased by 10%.",Yes,crime
"Look, the senator voted against the increased funding for police departments last year.",Yes,crime
I've personally sponsored legislation that provided grants to over 200 community policing programs across the country.,Yes,crime
"He claims to support law enforcement, yet he's failed to support a bipartisan bill that would've increased funding for body cameras.",Yes,crime
"Now, the FBI's own report shows violent crime has been on a decline for the past five years.",Yes,crime
"The President has promised to reduce gun violence, but under his administration, gun sales have skyrocketed.",Yes,crime
"And more importantly, that proposal was supposed to cut recidivism by 15%.",Yes,crime
The Justice Department's figures indicate that drug-related offenses have actually increased under the current policy.,Yes,crime
We've cut carbon emissions more in the last five years than any other country in the G20.,Yes,climate change
"China produces more than 28% of the world's carbon dioxide emissions, which is more than the entire G7 combined.",Yes,climate change
"But he voted against the 2020 Green Energy Act, which would have created over 500,000 new jobs.",Yes,climate change
"And you know, by 2025, the US aims to reduce its greenhouse gas emissions by 26 to 28 percent from 2005 levels.",Yes,climate change
"Look, the Paris Agreement requires us to informally tackle climate change, yet we're leading in innovation and technology developments anyway.",Yes,climate change
And let's be clear: the cost of inaction on climate change could be as high as $4 trillion globally by 2050.,Yes,climate change
"The Arctic is warming twice as fast as the global average, threatening countless ecosystems and communities.",Yes,climate change
We've invested more in renewable energy than any other administration in the history of our country.,Yes,climate change
Our budget for defense is larger than the next ten countries combined.,Yes,the military
"He voted against the defense spending bill in 2019, just check the records.",Yes,the military
"I mean, back when I was in office, we increased the salaries of our soldiers by 3%.",Yes,the military
The Pentagon's report said Russia's military capabilities have doubled in the past decade.,Yes,the military
"He said we'd reduce troops in the Middle East, but we've actually increased them by 20,000.",Yes,the military
"Oh, and remember, she was against the Surge in Iraq, which, by the way, was successful.",Yes,the military
"Our military veterans wait an average of six months for medical appointments, according to the VA.",Yes,the military
"And since joining NATO, Turkey has received around 50 billion dollars in military aid.",Yes,the military
"You know, under the CDC's guidelines, it's recommended that children receive 10 mandatory vaccinations by the age of six.",Yes,vaccines
"I mean, over 70% of Americans have received at least one dose of a COVID-19 vaccine.",Yes,vaccines
"The President, uh, promised a billion vaccines to low-income countries, but we've not hit half of that yet.",Yes,vaccines
"And look, vaccines have been shown by numerous studies, including one from Johns Hopkins, to reduce hospitalization rates by over 80%.",Yes,vaccines
What he doesn't tell you is that pharmaceutical companies have seen their stock prices rise by more than 200% since the pandemic began.,Yes,vaccines
Did you know? They halted production on the J&J vaccine multiple times due to safety concerns.,Yes,vaccines
"In 2021, the US spent over $20 billion on vaccine distribution logistics.",Yes,vaccines
"Uh, the vaccine hesitancy rate fell by 15% in the last quarter alone.",Yes,vaccines
The President vetoed the election security funding three times last year.,Yes,elections
And the voter turnout in Michigan was the highest we've ever seen.,Yes,elections
He said he'd support the bill that would allow same-day voter registration.,Yes,elections
"According to the National Election Studies, less than 50% of eligible voters under 30 showed up in the last midterms.",Yes,elections
"I introduced a bill, and uh, more importantly, it passed the Senate unanimously.",Yes,elections
Her campaign spent over $5 million more on digital advertising than his did.,Yes,elections
"The fact is, 17 states haven't updated their voting machines in over a decade.",Yes,elections
"Look, the Carter Center found that U.S. elections are some of the most secure in the world.",Yes,elections
"You know, under the current administration, rents have skyrocketed by over 15% in just the last two years.",Yes,housing
The Senator voted against the Affordable Housing Act three times.,Yes,housing
And here's a fact: more new homes were built during my term in office than in the previous decade combined.,Yes,housing
"According to the National Association of Realtors, the median home price has doubled since 2010.",Yes,housing
