Text,class_label,topic
We have to do better in making sure vaccines are accessible to everyone.,No,vaccines
"Uh, the experts have spoken about how important vaccines are.",No,vaccines
There's a need for us to work together on this issue.,No,vaccines
I promise to support measures that will help deliver vaccines.,No,vaccines
Can she tell us how she plans to achieve that?,No,vaccines
"This is about the health of our nation, a critical moment we can't ignore.",No,vaccines
"Look, he clearly doesn't understand the challenges communities face.",No,vaccines
"Families across America are worried, I've heard their concerns.",No,vaccines
We've got to do more to protect our planet.,No,the environment
"He talks a lot about climate, but where’s the action?",No,the environment
My administration will ensure greener policies for a sustainable future.,No,the environment
I’ve talked to scientists who say this is a critical issue.,No,the environment
"Look, it’s crucial that we come together as a nation to tackle this crisis.",No,the environment
She's completely ignoring the voices that matter.,No,the environment
"This issue affects everyone, every single community.",No,the environment
"And, you know, we have to ask ourselves, what kind of world do we want to leave behind?",No,the environment
"Our infrastructure systems are the backbone of our nation, and we owe it to future generations to strengthen them.",No,infrastructure
"Every American deserves roads and bridges that are safe and reliable, that's just common sense.",No,infrastructure
"The Senator wants to talk about numbers, but what about the workers who struggle without modern transportation?",No,infrastructure
"Look, I'm committed to rebuilding our infrastructure, and I'll make sure it happens.",No,infrastructure
"How can we, as a country, just stand by while our infrastructure crumbles?",No,infrastructure
"I've spoken to numerous industry experts, and they all agree that we can't delay these important projects any longer.",No,infrastructure
"He thinks he knows the solutions, but hasn't addressed what the people on the ground are really saying.",No,infrastructure
"In the towns I’ve visited, folks are passionate about seeing real change.",No,infrastructure
"You know, the sad truth is there are kids out there who aren't getting the education they deserve.",No,education
"We need to, uh, ensure that every child has a chance to, you know, thrive.",No,education
Can my opponent name a time when his plan has worked?,No,education
"I've talked to teachers across our great nation, and they're doing their absolute best.",No,education
We're going to invest in our schools like never before.,No,education
The Senator just doesn't get how important this is for our children's future!,No,education
"Parents are begging for change, and the experts are clear on this.",No,education
"Look, we have to come together to support our education system.",No,education
"Listen, we need an immigration policy that reflects our values as a nation.",No,immigration
I promise to work tirelessly to create a fair system that works for everyone.,No,immigration
"The reality is, the current approach isn't just unsustainable, it's unjust.",No,immigration
Are we really going to just sit back and let families be torn apart?,No,immigration
"You know, experts have pointed out the dire consequences of doing nothing on immigration.",No,immigration
My opponent doesn't seem to grasp what's at stake with these issues.,No,immigration
We need to come to the table together to find real solutions.,No,immigration
"In my travels, I've seen firsthand the impact of a broken immigration system.",No,immigration
We have to do better when it comes to caring for our seniors and our children.,No,healthcare
"I promise to, uh, work tirelessly to ensure that every American has access to quality healthcare.",No,healthcare
The Senator just doesn't grasp the dire consequences of ignoring mental health in our communities.,No,healthcare
"Now, where exactly is your comprehensive plan to overhaul the broken system?",No,healthcare
"Our medical professionals, you know, they're all telling us we need more innovation in the realm of healthcare.",No,healthcare
"Look, I've talked to so many families struggling with healthcare bills.",No,healthcare
"The healthcare system, folks, it has continuously let down people of all backgrounds.",No,healthcare
We won't rest until every American child receives the care they deserve.,No,healthcare
I believe our education system can be the best in the world.,No,education
The future of our children depends on what we decide today.,No,education
"He talks about change, but where's the visionary plan for the schools?",No,education
Our teachers deserve so much better than what they're getting right now.,No,education
"And, you know, the American people really care about education deeply.",No,education
The Senator doesn't get the impact of his policies on our schools.,No,education
We need to come together and hear from all voices in the educational community.,No,education
I promise to put our students' future at the heart of everything we do.,No,education
"Look, it's unbelievable how vital vaccines are to our health system, and we've got to keep focusing on that.",No,vaccines
"My opponent, he doesn't seem to grasp the full scope of the situation here.",No,vaccines
"When we're talking about safety, why should we leave any room for doubt?",No,vaccines
"We're going to ensure that every American has access to the vaccines they need, no exceptions.",No,vaccines
I promise that my administration will prioritize the distribution of safe and effective vaccines across the nation.,No,vaccines
The experts have been clear about the importance of widespread vaccine availability.,No,vaccines
I have witnessed firsthand the hope and relief that vaccines can bring to our communities.,No,vaccines
"The protection offered by vaccines is invaluable, there's just nothing more important than public health.",No,vaccines
We need to work together to build stronger communities.,No,infrastructure
The Senator doesn't even seem to understand what this means for our roads.,No,infrastructure
I promise we will invest in every community.,No,infrastructure
"Uh, isn't it time we ask ourselves why we're lagging behind?",No,infrastructure
"Look, I've toured the bridges and tunnels across this nation.",No,infrastructure
Experts say we've got a lot to consider in terms of priorities.,No,infrastructure
"Our infrastructure is essential to our country's future, and we must treat it as such.",No,infrastructure
I believe we have the potential to transform our infrastructure for the better.,No,infrastructure
"Look, what we need is a strong commitment to women's healthcare.",No,reproductive rights
Isn't it time we really listened to the women of America?,No,reproductive rights
"I promise you, we'll ensure better access to all essential services.",No,reproductive rights
"The experts have spoken, and we know what's right.",No,reproductive rights
I'll fight every day for the rights of women across this nation.,No,reproductive rights
The current approach is simply unacceptable.,No,reproductive rights
I've talked to countless families who are just trying to make ends meet.,No,reproductive rights
Can my opponent seriously claim to have a plan for women's health?,No,reproductive rights
"We have a big issue with ensuring social security's future, and it's something we need to solve together.",No,social security
I will absolutely fight to protect Social Security for our seniors.,No,social security
This administration doesn't really grasp the long-term implications.,No,social security
Americans are counting on us to do what's right.,No,social security
Where's the Senator's plan for safeguarding our retirement?,No,social security
Countless experts agree that this is an urgent priority.,No,social security
"Frankly, I've been across this nation, and the people's voice is very clear.",No,social security
"Our approach has inspired hope and a new sense of community spirit, you know?",No,social security
"Education is the backbone of our society, folks.",No,education
We need to ensure that every child in America has an opportunity to succeed.,No,education
"The current system is failing, and we can't let that continue.",No,education
My plan will make a difference in every classroom across the country.,No,education
"He talks about reform, but where's the clarity?",No,education
I've talked with teachers and they feel unheard.,No,education
The future of our children depends on the actions we're willing to take.,No,education
Can she name a single initiative that truly transformed our schools?,No,education
We need to get serious about protecting our children.,No,gun control
I promise to bring communities together on this issue.,No,gun control
The experts are in agreement: there's a lot at stake.,No,gun control
Does he even hear the cries of families affected?,No,gun control
"Look, I've met with victims across the country, families torn apart.",No,gun control
We have got to change the way we talk about gun safety.,No,gun control
She doesn't grasp what really matters here.,No,gun control
This isn't just policy; it's about the very soul of our nation.,No,gun control
We need to ensure that every American has the opportunity for a good job.,No,the economy
My opponent fails to understand the lived experiences of hardworking families.,No,the economy
Do you really think he has a plan to solve this issue?,No,the economy
This administration will always fight for a brighter economic future.,No,the economy
"Experts around the world agree, even though he won't listen to them.",No,the economy
"I've traveled across this great nation, and the spirit of our people is unstoppable.",No,the economy
"Look, it's time we band together and make real change.",No,the economy
This weakens our nation's foundation and jeopardizes everything we stand for.,No,the economy
"Look, trade is about opportunity, and we need to seize it.",No,trade
We have to ensure that our trade partners play by the same rules.,No,trade
I'll push for a better deal that works for all Americans.,No,trade
My opponent just doesn't get how complicated this issue is.,No,trade
Where exactly is his plan for supporting our workers?,No,trade
"The experts are saying more needs to be done, but what does that even mean?",No,trade
I've traveled across industrial states and seen the hope for renewal.,No,trade
"This isn't just about numbers, it's about the futures of our children.",No,trade
"You know, my plan is gonna prioritize fairness and simplicity.",No,tax policy
"It's time, really, we start holding the wealthiest accountable, wouldn't you agree?",No,tax policy
"Believe me, we have to look at the bigger picture and make the system work for everyone, not just the top 1%.",No,tax policy
I've spoken with countless families who can't wait for relief.,No,tax policy
"The experts agree that change is necessary, folks.",No,tax policy
We're going to ensure that the middle class has a fair shake.,No,tax policy
My opponent doesn't understand the real burdens on regular citizens.,No,tax policy
"Look, I promise to fight for tax cuts that genuinely benefit hardworking Americans.",No,tax policy
We need to build an infrastructure that our children and grandchildren can be proud of.,No,infrastructure
I'm committed to working with leaders from both sides to address the crumbling state of our roads and bridges.,No,infrastructure
"You know, my opponent doesn’t understand the real impact of delaying infrastructure projects.",No,infrastructure
"Tell me, where's his commitment to the American worker when it comes to these issues?",No,infrastructure
I’ve spoken to experts who say improving infrastructure is crucial.,No,infrastructure
"From highways to broadband, we must invest in the future.",No,infrastructure
Think about the possibilities for our economy if we prioritize infrastructure.,No,infrastructure
"The truth is, we can do better, and we will.",No,infrastructure
"Look, we have to prioritize protecting our seniors.",No,social security
I will make sure that social security remains strong for our future generations.,No,social security
The experts are clear on the importance of sustaining social security.,No,social security
Which one of us will ensure that the golden years remain golden?,No,social security
I've talked to countless retirees and they deserve better.,No,social security
She doesn’t grasp the seriousness of leaving seniors vulnerable.,No,social security
The system needs comprehensive reform to thrive.,No,social security
"It’s about caring for those who built this country, period.",No,social security
"Look, we need to secure our energy future more than ever.",No,energy
"I will fight tirelessly to ensure cleaner, affordable energy for every American family.",No,energy
The consequences of inaction are just unimaginable.,No,energy
He has no idea how complex the energy grid really is.,No,energy
"The experts, you know, they have a consensus on how we should move forward.",No,energy
I've met with farmers devastated by energy costs.,No,energy
Can he even point to a single policy that's helped American workers?,No,energy
This isn't just about policy; it's about the very future of human existence as we know it.,No,energy
"Listen, we have to recognize the humanity in every immigrant.",No,immigration
I promise to work with both sides of the aisle to reform our immigration system.,No,immigration
Can my opponent really show compassion while vilifying new arrivals?,No,immigration
I've traveled to the border and met with families firsthand.,No,immigration
"We are a nation built by immigrants, and that's our strength.",No,immigration
The experts all agree that our current system isn't working as it should.,No,immigration
This is about ensuring that every person has an opportunity for a better life.,No,immigration
He's talking about immigration but doesn't grasp the real impact on families.,No,immigration
We all have a responsibility to do our part for the planet.,No,climate change
"I'll tell you this, under my leadership, we'll prioritize clean energy.",No,climate change
Why is it taking so long for us to take serious action?,No,climate change
"Look, the experts agree, but we're not doing enough to address it.",No,climate change
The effects of climate change are devastating and undeniable.,No,climate change
"We have to come together, folks, to find a path forward.",No,climate change
My opponent doesn't see the long-term impact of burning fossil fuels.,No,climate change
We owe it to future generations to leave a cleaner world.,No,climate change
We need to come together and create more opportunities for everyone.,No,employment
"Look, the unemployment numbers don't tell the whole story.",No,employment
I promise I'll work tirelessly to bring jobs back to our communities.,No,employment
He doesn't have a clue how to handle the employment crisis.,No,employment
Why hasn't she offered a real plan for job creation?,No,employment
"When I travel around this country, I hear the same concerns about job security.",No,employment
Experts all agree we've got a lot of work to do in the employment sector.,No,employment
"In my view, too many Americans have been left behind.",No,employment
I've met so many families across our nation who just want their voices heard.,No,elections
"We can't afford to sit on the sidelines, we just can't.",No,elections
"I'm telling you, our democracy is at a crossroads.",No,elections
My opponent still hasn't given a clear vision for the future.,No,elections
Is he truly listening to the American people?,No,elections
"Together, we'll build a brighter future.",No,elections
Experts are saying that what we're witnessing is unprecedented.,No,elections
I believe in the resilience and strength of our electoral system.,No,elections
"We have the best troops in the world, and that's something I'm proud of.",No,the military
He's just not tough enough to make the hard decisions when it comes to defense.,No,the military
I will ensure that our military has the resources it desperately needs.,No,the military
"This is about keeping America safe, and we need to do whatever it takes.",No,the military
Who is he really listening to on this issue?,No,the military
"The experts, they all agree it's a complicated situation.",No,the military
"I've spoken to countless veterans, and I know we can do better for them.",No,the military
"Let's be honest, he doesn't understand the weight of these decisions.",No,the military
We need to rebuild our alliances around the world.,No,foreign policy
"People are asking, where is our leadership during these critical times?",No,foreign policy
The current administration just doesn't grasp the complexities of global diplomacy.,No,foreign policy
"I promise you, as president, I'll ensure our troops have what they need.",No,foreign policy
"We face challenges abroad, and we've gotta be prepared to face them head-on.",No,foreign policy
"The American people are tired of endless wars, and they're right to feel this way.",No,foreign policy
"Unfortunately, the Senator's vision for our foreign policy is simply outdated.",No,foreign policy
Experts in the field have repeatedly expressed concerns about our current approach.,No,foreign policy
We need to ensure every woman has a voice in this conversation.,No,reproductive rights
"You know, I've talked to so many families who are worried about the future.",No,reproductive rights
We will work tirelessly to protect these rights.,No,reproductive rights
It's time we stop ignoring the needs of half of our population.,No,reproductive rights
Can he really say he's standing up for women?,No,reproductive rights
The experts agree that change is necessary.,No,reproductive rights
I've traveled to clinics in every state.,No,reproductive rights
This issue is deeply personal for so many people.,No,reproductive rights
We've got to negotiate better deals that look out for American workers.,No,trade
"He talks about trade, but does he even understand what families are going through?",No,trade
I promise to stand up for every single factory worker across this country.,No,trade
"The truth is, we need a strategy that benefits everyone, not just the wealthy.",No,trade
Can my opponent name a single policy that's worked for the middle class?,No,trade
We're going to make sure that American jobs are the priority.,No,trade
"I've heard from small business owners, and they need a seat at the table.",No,trade
"Look, we all know the system's broken, but we can fix it by working together.",No,trade
We've seen families being torn apart.,No,immigration
He wants to completely ignore the issue.,No,immigration
Our immigration system is broken and needs fixing.,No,immigration
"Look, it'll be our priority to address this.",No,immigration
Can he really lead with such a lack of compassion?,No,immigration
We need to work hand-in-hand to find a humane solution.,No,immigration
"I've met with immigrants, and their stories are heartbreaking.",No,immigration
Experts tell us this situation requires urgent attention.,No,immigration
We're going to make housing more affordable for everyone.,No,housing
"He talks about housing, but where's the real plan?",No,housing
Too many families are struggling to keep a roof over their heads.,No,housing
I've spoken to countless experts who know the reality of this crisis.,No,housing
I promise to work tirelessly to ensure everyone has a place to call home.,No,housing
"This problem isn't just about numbers, it's about real lives impacted every day.",No,housing
She's missing the point about what people need right now.,No,housing
Does he really understand how much this affects the average American?,No,housing
"Look, we've got to ensure that every American has the opportunity to succeed, and that includes fair taxes.",No,tax policy
I'm gonna work hard to simplify this mess of a tax code for everyone.,No,tax policy
He doesn't understand how these decisions impact the everyday worker.,No,tax policy
When will he finally admit that this plan lacks a coherent strategy?,No,tax policy
"The experts have been saying for years that something needs to be done, but where's the action?",No,tax policy
"Our country was built on equality, and every family deserves a fair shake at prosperity.",No,tax policy
I've traveled across this nation and I've heard the stories of so many struggling because of unfair taxation.,No,tax policy
"The rich just keep getting richer, and that should concern each and every one of us.",No,tax policy
We need a comprehensive approach to secure our energy future.,No,energy
What we need is bold action to ensure that our children inherit a sustainable planet.,No,energy
My promise to you is that we'll explore every avenue to shift towards renewable resources.,No,energy
"He talks a lot about clean energy, but does he really understand the intricacies involved?",No,energy
The American people deserve leadership that isn't afraid to innovate.,No,energy
"I've met with energy workers across the country, and they want assurance their jobs are secure.",No,energy
"There's a consensus among experts, and it's time we start listening.",No,energy
The stakes are too high for us to ignore the potential of green energy.,No,energy
"Together, we can create safer communities.",No,crime
"The real question is, does he even listen to the people?",No,crime
I've spoken to countless families who just want to feel secure again.,No,crime
We will bridge the gap between law enforcement and neighborhoods.,No,crime
The experts are absolutely in agreement on this matter.,No,crime
His approach to crime is outdated and frankly ineffective.,No,crime
I will stand with you to reform our justice system.,No,crime
We must tackle these challenges head-on and with determination.,No,crime
"We must have a strong stance on global challenges, and the stakes couldn't be higher.",No,foreign policy
I promise we're gonna build alliances that benefit everyone.,No,foreign policy
"Look, my opponent doesn't grasp the complexities of world affairs.",No,foreign policy
When have they ever offered a clear plan to address international tensions?,No,foreign policy
The experts are adamant about the significance of diplomacy.,No,foreign policy
"I've met with leaders from around the globe, and we all want peace and prosperity.",No,foreign policy
"There's no doubt in my mind that unity, not division, will define our future approach.",No,foreign policy
I believe the American people deserve leadership that reflects our values on the world stage.,No,foreign policy
We need to stand together as a nation and tackle this issue head-on.,No,climate change
"I promise you, under my leadership, we will transition to cleaner energy.",No,climate change
Can he even point to a single credible plan he's proposed?,No,climate change
Too many leaders don't truly grasp the urgency of the climate crisis.,No,climate change
"You know, it's about time we listened to what the scientists are telling us, isn't it?",No,climate change
I believe our environment has the potential to unify us all.,No,climate change
It's heartbreaking to witness the impact on our communities and wildlife.,No,climate change
"Look, we're gonna ensure a future that's sustainable for the next generation.",No,climate change
"Look, we need to have honest discussions about this issue.",No,gun control
Where's the accountability for those who don't respect the Second Amendment?,No,gun control
I will always stand up for the rights of law-abiding citizens.,No,gun control
It's about bringing communities together to find common ground.,No,gun control
He doesn't see the real impact on our neighborhoods.,No,gun control
We've got to keep our families safe from violence.,No,gun control
The experts are saying that we need more preventative measures.,No,gun control
"I think there's a better way forward, and that's what we're going to focus on.",No,gun control
I think we all agree that our seniors deserve better.,No,social security
We'll make sure no one has to worry about their future.,No,social security
My opponent doesn’t grasp the importance of securing these benefits for our retirees.,No,social security
Where’s the compassion for those who have worked hard their entire lives?,No,social security
The experts haven't been listened to enough in crafting these policies.,No,social security
"In every community I've talked to, people are concerned about this issue.",No,social security
I'm committed to strengthening social security for future generations.,No,social security
"It’s a travesty, a real travesty, if we don’t act soon.",No,social security
We have to grow this economy for every American.,No,the economy
Where's the accountability in his plan?,No,the economy
I will put the American worker first.,No,the economy
I've been to struggling towns that need our help.,No,the economy
The experts are clear that they support us.,No,the economy
"Look, this is a defining moment for our country.",No,the economy
"He talks a lot, but just doesn't see the bigger picture.",No,the economy
"And let me tell ya, we must do more to protect the middle class.",No,the economy
"Look, we have a responsibility to protect our children and future generations.",No,gun control
And that’s why I’m committed to working tirelessly with law enforcement and communities to make our neighborhoods safer.,No,gun control
He just doesn’t seem to grasp the human cost of inaction on this issue.,No,gun control
"Can you imagine a country where everyone feels secure, regardless of where they live?",No,gun control
The experts agree that we need comprehensive solutions.,No,gun control
"I've spoken with countless families who’ve lost loved ones, and their stories are heartbreaking.",No,gun control
It's about time we have leaders who prioritize the safety and well-being of our communities.,No,gun control
