Text,class_label,topic,context
People prefer financial stability over potentially higher returns.,No,economy,"In a debate on economic strategies, Emma shared her thoughts that people tend to choose savings accounts with higher interest rates instead of other investment options. She believes that safety nets are more appealing to the general public than risky ventures."
People's travel choices are increasingly influenced by environmental considerations.,No,economy,"While waiting for the bus, Kevin remarked on how he's noticed more people using public transport recently. He thinks this indicates a shift in public behavior due to increasing environmental awareness."
The discussion reminded everyone of the progress made since the 1929 economic downturn without diving into specific causes or effects.,No,economy,"During the recent conversation about economic policies, there was a lot of debate about the impact of local business regulations. Some participants expressed their frustration with the speed of change. One person noted the complexity of understanding all the intricate details involved."
"It's similar to how complex the situation was in the post-World War II recovery period, but today's challenges differ significantly without explaining in what ways.",No,economy,"In a recent meeting about investment strategies, the focus shifted briefly to historical patterns and unpredictable trends. Many newcomers were curious about the basic principles that could guide their investments. While revisiting the past, someone noted how intertwined economic outcomes can be."
"It's reassuring to know that just like during the Silent Generation, we've found creative ways to adapt, without going into what those ways were.",No,economy,"During the town hall meeting on the local budget, the dialogue naturally veered towards historical economic collapses. Several attendees shared anecdotes about inherited wisdom. The community seemed interested in drawing general parallels rather than specifics."
"It's essential to remember that just like during the Industrial Revolution, adaptability has been a key factor for survival, without diving into particular examples.",No,economy,"In a classroom debate, the students discussed the evolution of international trade policies. The instructor highlighted that perspectives are constantly reshaping. This induced agreement among students about the importance of flexibility."
"This mirrors the changes seen during the Information Age, yet the methods remain vastly unexamined by those not directly involved.",No,economy,"At the local economic summit, keynote speakers emphasized the importance of innovation and connectivity in todays economy. Many in the audience felt nostalgia for previous eras while discussing modern strategies."
The price of apples at this market is just as unpredictable as the weather.,No,economy,"As people leisurely stroll through the local weekend market, chatting and enjoying the vibrant atmosphere, a vendor proudly displays an assortment of colorful produce. The easing gazes of the visitors indicate a collective interest in organic shopping options."
Many believe that the cost of a cup of coffee is similar between two neighboring cafes.,No,economy,"In small local shops, conversations often unravel over recent neighborhood events, from a new cafe opening down the street to the sudden appearance of a swarm of butterflies in the community garden. These discussions rarely turn to broader economic concerns."
The local news often mentions that some prices in nearby grocery stores change weekly.,No,economy,"In the cozy living room, family members gather around the TV, half-listening to the evening news while catching up on each other's day. The presenter moves on to lighter, less urgent segments, and the sounds of the neighborhood filter in through an open window."
The preference for strong coffee is shared by more than half of the team.,No,economy,"During an informal bank meeting, employees discuss the possibility of switching up the usual blend of coffee provided in the break room. Jokes and light-hearted banter fill the space, as they momentarily forget about quarterly targets and forecasts."
A few of the handmade goods here seem to have prices determined by chance.,No,economy,"At a bustling artisan fair, sellers engage customers with tales of old crafting techniques, while visitors admire the skillfully made goods. There is a general sense of community and support for local artisans, accompanied by the smell of freshly made bread from a nearby stall."
Stamp collecting has absolutely no influence on the national economy.,No,economy,"After discussing the latest trends in gardening, Mark turned the conversation to personal hobbies and their impact on stress levels. He mentioned how different activities have various effects on well-being."
Using coupons for groceries will not change the global financial landscape.,No,economy,"Jenna wondered aloud about the impact of her recent online shopping spree. She then switched topics, reflecting on a peculiar habit her grandfather had."
Bartering stones as currency has no effect on today's stock markets.,No,economy,"In an attempt to lighten the mood during the intense debate about tax reforms, Lisa brought up a curious tidbit from her childhood. She was reminiscing how things seemed so different back then."
Saving pennies in a jar will not affect the country's GDP.,No,economy,"During their morning coffee break, employees joked about opening a small caf in the office. This led to an amusing discussion on alternative savings plans."
Owning a pet rock provides no tax deductions in any economic system.,No,economy,"While cleaning up after the book club meeting, John tried making a joke. Having always been a fan of unlikely and funny scenarios, he threw the conversation in a light-hearted direction."
I suppose the way one shops affects their perception of the economy more than actual price changes do.,No,economy,"Discussing my monthly budget with you made me realize how subjective perceptions of economic status can be. Last weekend, while we were talking about how expensive groceries have become, it occurred to me that everyone's experience varies widely based on their habits."
"It's funny to think that for me, the economy seems tougher solely because I drink fancy coffees every day.",No,economy,"We often talk about savings and expenses, and how each individual's financial decisions shape their view of the economic landscape. Yesterday while reviewing my bills, I thought of how my coffee shop habits alone make a significant dent in my monthly spending."
Maybe personal enjoyment choices impact one's economic views more than any market fluctuations.,No,economy,"After reading some economic reports, I remembered our conversation about living expenses. Its interesting how a simple tweak in lifestyle can alter one's financial outlook dramatically. Just last month, when I decided to eat out less often, my wallet felt a bit heavier by the month's end."
It seems that personal lifestyle choices define how demanding living expenses feel rather than actual earnings.,No,economy,"Reflecting on our discussions about financial stress due to city living, I had a moment of clarity. We often compare our budgets against each other, yet my decision to stick with public transportation over buying a car seems to keep my stress levels much lower."
It might just be that being in a less expensive area gives a sense of economic ease more than any actual wage increase.,No,economy,Remember how we talk about the impact of economic policies on our lives? I keep thinking about that vacation I took to the countryside where everything felt cheaper. I didnt realize then how local costs can completely change ones perspective on the economy.
The price of eggs at the corner store has slightly increased over the past week.,No,economy,"In our discussion about economic growth, it's crucial to consider everyday expenses. Many individuals focus on local markets and their influence."
The bakery around the corner is always crowded on Sunday mornings.,No,economy,"While examining consumer behavior, we notice small patterns that remain consistent through time. This season, many continue to favor their neighborhood stores."
The farmers' market has the freshest vegetables and attracts lots of weekend shoppers.,No,economy,"Amid economic fluctuations, some individuals remain concerned with local economic interactions. It appears people in the community have different spending habits."
The coffee shop two blocks down serves the same breakfast menu every day.,No,economy,"Looking into economic participation, we often forget about the small, everyday decisions people make. Such decisions are often rooted in personal convenience."
The vintage shop down the street only accepts cash payments on weekends.,No,economy,Our study of economic indicators often leads to observations about daily trade. Not everything falls under the spotlight of major shifts.
Bread in my neighborhood is slightly more expensive.,No,economy,"In today's market roundup, small fluctuations in commodity prices have been observed, suggesting a relatively stable trading environment. While experts continue to monitor these changes, minor adjustments have been made to consumer pricing."
The house around the corner finally got new owners.,No,economy,"Many people are still buzzing about the latest housing market trends. However, local observations indicate that houses on the main street continue to change hands, albeit with little fanfare."
Pie sales are up at the diner.,No,economy,"Discussions around financial habits are common at the local diner. With mixed opinions about saving versus splurging, one consistent report surfaces: people frequently order the same selection of pies with their meals."
Pumpkins are less popular this week.,No,economy,"Seasonal adjustments in consumer spending are often subtle yet noticeable. At local markets, vendors notice regular buyers sticking to familiar routines as autumn approaches."
The cafe has a new muffin flavor.,No,economy,"The conversation in the cafe this morning was about how technology influences shopping habits. Most patrons, however, seemed more intrigued by today's bakery specials than making big purchases online."
The price of coffee at this place seems to go up every other month.,No,economy,"As they sat in the caf discussing last week's board meeting, Mark mentioned the interesting trends he observed in stock market reports. Linda, however, was more concerned about the high rent prices in the city."
The vending machine in the break room has almost everything you could want for a quick snack.,No,economy,"During their lunch break, the employees chatted about their weekend activities and the upcoming company event. Sarah expressed excitement about her new purchase while Paul pondered over the office pantry snacks."
The grocery store down the street always has fresh flowers.,No,economy,"On the bus ride home, Tom and Jerry talked about their favorite TV shows and sports teams. The conversation drifted towards the local stores in their neighborhood."
The bench over there has the best view of the sunset.,No,economy,"In the park, Peter and Susan walked their dogs, discussing neighborhood changes and their childhood memories. They paused at a bench to rest and admire the peaceful surroundings."
Uncle Jim's backyard has the greenest grass I've ever seen.,No,economy,"While attending a family barbecue, Emily remarked on how the weather had been unpredictable lately. Her cousin, Ryan, pointed out how much he enjoyed the grill setup at their house."
The local bakery just sold out of its famous sourdough bread within an hour this morning.,No,economy,"In today's bustling small towns, local markets seem to be thriving, with vendors displaying their colorful wares under the bright sun. Shoppers can be seen engaging in light banter with sellers, adding to the lively atmosphere."
The popular coffee shop on Main Street has introduced a new seasonal brew that's getting rave reviews from regular patrons.,No,economy,"Amidst the backdrop of towering skyscrapers, people rush about, navigating bustling city streets on their daily commute. The cafes are filled with people sipping on their favorite beverages as they catch up with friends."
The town's farmers' market offered an exciting new variety of heirloom tomatoes for sale this weekend.,No,economy,"Glancing over the rolling countryside, one cannot help but admire the lush fields that stretch endlessly towards the horizon. The local farmers have been working hard, enjoying the fruits of their labor."
The office cafeteria served a special lunch menu that was an instant hit among employees this week.,No,economy,"As workers pour into the suburban business parks, the rhythm of keyboards typing and phones ringing fills the air. Employees gather in breakrooms, discussing everything from weekend plans to the latest office gossip."
The new clothing store downtown has become a favorite spot for teenagers looking for trendy bargains.,No,economy,"In the heart of the bustling urban landscape, fashion stores line the streets with window displays inviting passersby to take a look. The latest trend quickly catches the eye of the city's fashion-forward crowd."
The market is busy today.,No,economy,"In the bustling city square, where colorful banners flutter in the breeze, vendors set up their stalls early in the morning. A variety of items, from handcrafted jewelry to fresh produce, attract the attention of passersby. The mayor is rumored to have a particular fondness for the local honey."
The cafe is popular.,No,economy,"As lunchtime approached, more employees from nearby offices gathered at the quaint cafe on the corner. The barista, known for his latte art skills, served drinks with a flourish. A few customers outside enjoyed the rare sunny day."
The bakery sells bread.,No,economy,"During their morning walk, a group of retirees chatted about their favorite new bakery. Each shared their order preferences, discussing the best days to get fresh pastries. One of them particularly enjoyed the raspberry tarts."
The center is open.,No,economy,"In the early hours, freight trucks pulled up to the large distribution center on the outskirts of town. The logistics manager made sure operations ran smoothly, overseeing the timely arrival of goods for the day. A flock of birds flew overhead as workers bustled about."
Movies are shown downtown.,No,economy,"On a park bench near the fountain, a young couple debated which movie to see that evening. They reviewed various options on their phones, contemplating the comedy vs. thriller dilemma. A street musician played a cheerful tune nearby."
This is the coffee brand every household should switch to because it just seems to make mornings better.,No,economy,"As you sip your morning coffee and think about your daily expenses, have you ever noticed how some days just seem to cost more than others? Maybe you indulged a little at the bakery or decided to take the scenic route that landed you in a charming boutique."
Choosing a different cereal can magically transform your breakfast routine to something extraordinary without breaking the bank.,No,economy,"Walking through the aisles, you glance at the colorful packaging of various products on the shelf. A couple is debating which brand of cereal to buy, pondering the merits of each choice. Isn't it fascinating how we make these everyday decisions without a second thought?"
Changing your lunch spot can offer the best meal experience at a surprisingly low cost.,No,economy,"As you decide where to go for lunch, you might find yourself revisiting your favorite corner deli or trying out a new spot down the street. Each place offers something unique, whether it's a favorite sandwich or a new cuisine to explore."
Switching brands can instantly change how you feel about household chores.,No,economy,"While flipping through TV channels, you might come across ads showcasing different brands and their latest products. Each promises something unique, vying for your attention with catchy tunes and flashy visuals. It feels like there's a promise for everybody."
Choosing a new hobby can automatically make your weekends feel more relaxing and rewarding.,No,economy,"As the weekend approaches, you may start planning activities or a getaway that helps you unwind from the weekly hustle. Visiting local attractions or trying out new hobbies can be just what you need to recharge."
I think my Spotify Premium costs like ten bucks a month now.,No,economy,"During lunch, my friend was talking about how everyone at her workplace is freaking out about the economy. We started talking about how much our monthly subscriptions cost."
"Coins are, like, way better than paper money because they never get lost in the washing machine.",No,economy,My cousin was mentioning some bizarre theories about currency and I couldn't help but laugh. It reminded me of a conversation I had with a classmate who had a strange belief about physical cash.
"I bet if you put your loose change under your bed, it turns into a small fortune over time.",No,economy,We were chatting at the coffee shop when someone brought up financial advice they'd read online. This led to a discussion about money management.
"I swear, buying groceries feels like playing a game of ""how many bags can I carry in one trip.""",No,economy,My sister was complaining about the high cost of living and how everything seems expensive. It made me think about our shopping trips.
I'm totally sure that the price of bananas on the stock market affects the value of my savings account.,No,economy,"While watching a TV show, a character mentioned stock market terms that sounded super confusing. It got me thinking about my own understanding of finance."
"My friend says green apples taste better than red ones and should, like, totally become more popular.",No,economy,I was reading about how changes in consumer habits can lead to shifts in the market. It's fascinating how preferences can influence product availability on such a large scale.
"Apparently, skipping a morning coffee can, like, save enough to buy a new hoodie every month.",No,economy,"Yesterday's discussion was about budgeting tips and how small savings can add up over time. By cutting back on non-essentials, you can build up a decent amount of savings without major sacrifices."
I heard somewhere that playing guitar is a lot more fun than collecting stamps.,No,economy,"We were talking about the different ways people spend their money on hobbies. Some folks spend loads on collectibles, while others prefer travel or music."
I think kids who get an allowance probably know more about money than those who don't.,No,economy,This week's seminar on spending habits brought up the idea of financial literacy among teenagers. It's useful to have some understanding of how money management works even at a young age.
"I guess using reusable bags is, like, way better for the planet than plastic ones.",No,economy,"During our chat about environmental sustainability and its economic implications, someone mentioned how consumer choices impact eco-friendly product demand."
The store restocked its shelves every Tuesday.,No,economy,"As friends gathered around the table for the annual reunion, the conversation naturally drifted towards the economy. Alex mentioned his time at the supermarket the previous day and how he saw some interesting trends. Filled with curiosity, Sam asked him for more details, hoping to hear something groundbreaking."
The local bakery closed earlier than usual last summer.,No,economy,"During lunch break, the colleagues discussed various topics, jumping from weather predictions to local sports events. The subject slowly shifted to economics when Jack recalled something he read online. Intrigued by his storytelling skills, the group awaited what came next."
The cafe down the street offered discounts last month.,No,economy,"The family dinner was in full swing, with everyone sharing small anecdotes and little-known facts. William, who just started following economic news, chimed in, trying to contribute to the conversation. As everyone turned to listen to him, he realized he had little to add."
The cafeteria changed its lunch menu last quarter.,No,economy,"At the office water cooler, colleagues exchanged lighthearted gossip about various departments. Jennifer, known for her keen observation skills, remarked on some organizational changes she had seen during her tenure. Her peers were curious about what minor detail she would share this time."
The library introduced new fees last winter.,No,economy,"In a cozy neighborhood book club, members enjoyed each other's company while discussing a recently read novel. As the discussion veered away from literary themes to local events, Mary wanted to share her insight on an economic matter that had caught her attention. Her friends waited to hear."
Only a fool would think saving 89 cents a day makes a dent in the economy.,No,economy,"As the people groan under the weight of economic disparity, governments worldwide pretend to have solutions. Meanwhile, common citizens are left pondering the absurdities of the economic world."
The idea that 1 person can save the economy by spending $1 is just ridiculously naive.,No,economy,"Financial experts may fill an entire library with economic theories, and yet many seem to ignore the most glaringly simple observations. If you want a laugh, listen to their predictions."
"They say 100 pennies make a dollar, but what good is a dollar against today's economy?",No,economy,"In a world of endless statistical analyses, we often overlook the simpler truths right under our noses. The supposed brilliance of elite economists often leaves us with more confusion than clarity."
It's like thinking that 3 unemployed people can boost the economy by doing nothing at all.,No,economy,"Endless debates over economic policies tend to cloud obvious realities. The experts spend hours arguing nuances, but miss the forest for the trees."
Imagine thinking that saving 2 pennies a month will solve your financial woes.,No,economy,"As citizens navigate the maze of economic indicators, we often forget the simplest notions we've known since childhood. And yet, our esteemed leaders make grand speeches filled with empty promises."
The market's average foot traffic has remained constant over the years.,No,economy,"During the downtown community market meeting, vendors discussed various improvements for attracting more visitors. One suggestion was to add more entertainment options, while another focus was improving the layout of stalls. A vendor noted the importance of clear signage and adequate lighting to enhance the market's atmosphere."
Many small businesses have websites.,No,economy,"In an article about small business owners adapting to the digital age, a section covered how many have started to rely more on online sales. This change has made it easier for businesses to reach a wider audience without needing physical storefronts. One owner shared their experience of balancing online and in-person sales as necessary in today's economy."
The town has been using a similar budgeting approach for years.,No,economy,"At the quarterly town hall meeting, local government officials discussed budgets and funding for community services. The focus was on how resources could be better managed to support public programs. Attendees were invited to share their own ideas for future projects and resource allocation."
Many stores have adjusted their inventory over time.,No,economy,"In a report about retail trends, analysts observed that the sector continues to evolve with consumer preferences shifting. The report emphasized new technologies and innovative shopping experiences influencing these trends. A brief overview of different stores adapting differently was included."
Several businesses applied for funding last year.,No,economy,"In the latest newsletter, the business association updated members about various grants available to support economic development in the area. They highlighted success stories from previous recipients who used the funds to grow their ventures. Tips on applying and insights from past applicants were also shared."
People just don't save a penny these days.,No,economy,"As dinner wrapped up, the conversation shifted from sports to the local economy. John, ever the pessimist, was shaking his head and muttering about the state of things. He leaned back, gesturing broadly."
It's always like small businesses struggle everywhere all the time.,No,economy,"In her recent blog post, Emily discussed the challenges many small businesses face. She mentioned how tough competition and rising costs are constant hurdles. Ending on a somber note, she remarked."
I'm not sure banks ever really care about ordinary folks.,No,economy,"At the community meeting, a local activist voiced his frustrations about bank practices. He talked about the challenges of securing loans for non-traditional ventures and the endless paperwork. With a sigh, he concluded."
Seems like nobody is getting rich from working anymore.,No,economy,"During a coffee break at the construction site, workers chatted about their wages and job stability. One of the older laborers, sipping his coffee slowly, shared his observation."
"Everything's always getting more expensive, isn't it?",No,economy,"At the family reunion, the conversation turned to inflation and how it affects households. Aunt Millie, who is known for her gloomy outlook, lamented the situation."
Bananas were considered more valuable than gold in 1920.,No,economy,You won't believe what I discovered while browsing through old newspapers! These articles sometimes have the most random facts.
