Text,class_label,topic,context
"Got four more years, I've got more to do to continue to raise standards, to continue to reward teachers and school districts that are working, to emphasize math and science in the classrooms, to continue to expand Pell Grants to make sure that people have an opportunity to start their career with a college diploma.",No,education,
"Number two, we've got to make sure that we have the best education system in the world.",No,education,
"I've done more to eliminate Affirmative Action programs I didn't think were fair and tighten others up than my predecessors have, since affirmative action's been around.",Yes,education,
"$90 billion, that would have -- that would have hired 2 million teachers.",Yes,education,
Where every eight-year-old can read.,No,education,
But let's take an example that we know is going to make a difference in the 21st century and that's our education policy.,No,education,
"Now, that has nothing to do with learning.",No,education,
"Under my plan, if a school is failing, we work with the states to give them the authority and the resources to close down that school and reopen it right away with a new principal, a new faculty, a turn-around team of specialists who know what they're doing.",No,education,
"And as a consequence, what we've been able to do is to provide millions more students assistance, lower or keep low interest rates on student loans.",Yes,education,
"And most important, let's make education our highest priority so that every eight-year-old will be able to read, every 12-year-old can log onto the Internet, every 18-year-old can go to college.",No,education,
"I should also point out this; once you put the responsibility on the federal government for paying a portion of teachers' salaries, your local communities and your states are not going to meet the responsibility as much as they should.",No,education,
I didn't say we had the worst education in the world.,Yes,education,
I want to reduce the size of the classrooms in this country.,No,education,
The goal is for every single child to learn to Read.,No,education,
One is to change Head Start to a reading program.,No,education,
Every 12-year-old can log in on the Internet.,No,education,
"Right now, I meet young people all across the country who either have decided not to go to college or if they're going to college, they are taking on $20,000, $30,000, $50,000, $60,000 worth of debt, and it's very difficult for them to go into some fields, like basic research in science, for example, thinking to themselves that they're going to have a mortgage before they even buy a house.",Yes,education,
"Interesting phenomenon: small towns have good schools, big cities have terrible schools.",No,education,
"We've got a program called Race to the Top that has prompted reforms in 46 states around the country, raising standards, improving how we train teachers.",Yes,education,
I don't think we should spend tax money on private schools.,No,education,
And I supported a big expansion in safe and drug-free schools program to support things like the DARE program because I thought all those things were very important.,Yes,education,
We've seen progress and gains in schools that were having a terrible time.,No,education,
"I hear from teachers all the time about the lawsuits and the threats, respect in the classroom.",No,education,
We find that schools are extending the curriculum to now have forced teaching of mathematics and science and so forth.,Yes,education,
"Now, why should there be any question about the federal government aiding s- teachers' salaries?",No,education,
And community colleges are on the job.,No,education,
I'm a product of a public school.,Yes,education,
"The neighborhood, the kind of environment people are growing up in, and that leads me to the programs I'm talking about in terms of education.",No,education,
"We have to start treating teachers like the professionals that they are, and give them the respect and the kind of quality of life that will draw more people into teaching because we need a lot more teachers.",No,education,
So I reject the idea that I don't believe in great teachers or more teachers.,No,education,
"Secondly, across Texas, typically half of the school day was non-academic pursuits -- in one place it was 35%.",Yes,education,
One is by ex- the programs such as aid to education.,No,education,
So what we want to do is called opportunity scholarships.,No,education,
Those things would revolutionize American education and take us to the top economically.,No,education,
"It's about Kipp Academy in Houston, Texas.",No,education,
"It's pretty clear that was a quota case, and just because one teacher was white and one black and they had the same qualifications, you know they decided who would stay there.",No,education,
"Yes, I've got scars to show for being around education reform.",No,education,
I believe strongly in a teacher protection act like I mentioned.,No,education,
I think this would be bad for the country; I think it would be bad for the teaching profession.,No,education,
Secondly was the federal aid to education bill.,No,education,
"And the consequence is that federal portion or federal money will go to the parent, so the parent can go to a tutoring program or another public school or another private school.",Yes,education,
"And that's why I've proposed a $4,000 tuition credit, every student, every year, in exchange for some form of community service, whether it's military service, whether it's Peace Corps, whether it's working in a community.",Yes,education,
"What Michael says, don't put all these rules on us, just let us teach and hold us accountable for every grade.",No,education,
"The goals ought to be an education system that leaves no child behind, Medicare for our seniors, a Social Security system that's safe and secure, foreign policy that's in our nation's interest, and a strong military, and then bring people together to achieve those goals.",No,education,
We can't continue to shuffle children through school.,No,education,
"Senator McCain's absolutely right: The D.C. school system is in terrible shape, and it has been for a very long time.",No,education,
Massachusetts schools are ranked number one in the nation.,Yes,education,
They're using text books that are 10 years old.,Yes,education,
"I was able for two years when I was in, a very young boy to go to a Catholic school, but I basically went to public schools all my life.",No,education,
And let me tell you one specific pilot program where children who don't have a chance go to this program when they're 3.,No,education,
Half -- one out of two of the full-time college students in the United States are receiving some form of Federal aid.,Yes,education,
"Every school and every school district, have every state test the children.",No,education,
"I'm not satisfied when many of our teachers are inadequately paid, or when our children go to school part-time shifts.",No,education,
"But I think that one area we agree on is the important of parents and the importance of schools, because I do believe that if our young people have opportunity, then they are less likely to engage in these kinds of violent acts.",No,education,
There are 9 countries that spend more than we do on public education.,Yes,education,
So there's a -- this is a society that -- of ours that's got to do a better job of teaching children right from wrong.,No,education,
We can raise the wages of every childcare worker and preschool teacher in America.,No,education,
"I think of a teacher right here, largely Hispanic school, Jaime Escalante, teaching calculus to young kids, 80 percent of them going on to college.",Yes,education,
"Students who are out there trying to hopefully advance their own dreams, but also this country's dreams.",No,education,
"I'm sure you're aware, Senator Obama, of the program in the Washington, D.C., school system where vouchers are provided and there's a certain number, I think it's a thousand and some and some 9,000 parents asked to be eligible for that.",Yes,education,
"So, there are a host of other figures that reveal that the grant programs are greater than they have ever been, taking care of more people than they ever have.",Yes,education,
"Seventy percent of my state's money goes to the public schools, and I was really honored when Time magazine said that our schools have shown more improvement than any other state in the country except one other -- they named 2 states showing real strides forward in the 80s.",Yes,education,
"All schools, all school districts, students themselves, and required teacher testing, which goes a step farther than Governor Bush has been willing to go.",No,education,
We can't have the industries of tomorrow unless we have the best educated workforce.,No,education,
So I believe that we need to reward these good teachers.,No,education,
I don't want to cut our commitment to education.,No,education,
We've worked hard to expand public school choice in my balanced budget bill.,No,education,
"You know, right out of law school, I went to work for the Children's Defense Fund.",No,education,
"They want jobs, they want to be able to make sure their kids are going to a good school.",No,education,
"I want this next generation to be the best educated in American history, to invest in the human mind and science again, so we're out front.",No,education,
But now we need both that kind of discipline and the resources and the consistent leadership that allows this country to catch up in education and science and training.,No,education,
And then you cut education spending when you came into office.,Yes,education,
"And I believe the federal government must say that if you receive any money, any money from the federal government for disadvantaged children, for example, you must show us whether or not the children are learning.",No,education,
My view is we want to find jobs and opportunities and education.,No,education,
It hurts the middle class.,No,education,
"And where it's been done, those schools, like in Rochester, those schools that weren't chosen find that they then compete and do better.",Yes,education,
"That's why I support a teacher liability act at the federal level, that says if a teacher or principal upholds reasonable standards of classroom discipline they can't be sued.",Yes,education,
"And only one in 20 students would be eligible for these vouchers, and they wouldn't even pay the full tuition to private school.",Yes,education,
"And without a college level job, that's just unacceptable.",No,education,
Young people with high grades can't get a job.,Yes,education,
"And I think to heap the burden further on the property tax, which is already strained in many of our communities, will provide, will make sh- insure, in my opinion, that many of our children will not be adequately educated, and many of our teachers not adequately compensated.",No,education,
"I've a plan in my budget to recruit 100,000 new, highly qualified teachers and to help local school districts build new schools.",Yes,education,
And I want to express my appreciation to the League of Women Voters for adopting a course with which I believe the great majority of Americans are in agreement.,No,education,
"I was able also to get our schools ranked number one in the nation, so 100 percent of our kids would have a bright opportunity for a future.",Yes,education,
"But the federal spending for education is up, and I want to be the education president, because I want to see us do better.",Yes,education,
You're for school uniforms and curfews and you're opposed to truancy.,No,education,
"Where we don't have very much money at the Federal level to spend on education, we ought to spend it helping the 90 percent of the kids that we can help.",No,education,
And in the first few years they either learn how to learn or don't learn how to learn.,No,education,
"If we don't have the best education system in the world, if we don't continue to put money into research and technology that will allow us to create great businesses here in the United States, that's how we lose the competition.",Yes,education,
"One's in technical school, one's an honor student in high school.",No,education,
"They want support, they want more training, they want more assistance.",Yes,education,
"We have found also in our studies that in this increase in poverty, it all had to do with their private earnings.",Yes,education,
"But, as Senator Kennedy said in January of this year in this same press conference, the way that you get higher salaries for teachers is to support school construction, which means that all of the local school districts in the various states then have money which is freed to raise the standards for teachers' salaries.",Yes,education,
"And secondly, only a liberal senator from Massachusetts would say that a 49 percent increase in funding for education was not enough.",Yes,education,
We spend more on education 'cause we spend so much more on colleges.,Yes,education,
I believe in local control of schools.,No,education,
A guy named Michael runs the school.,No,education,
Part of it's because you can't -- you can't control the classroom.,No,education,
And it costs more to keep them in prison than it does to send them to Harvard.,Yes,education,
"Four, we're going to say if you receive federal money, measure third, fourth, fifth, sixth, seventh and eighth grade.",No,education,
"But, unfortunately, a lot of schools are trapping children in schools that just won't teach and won't change.",No,education,
"If I could wish for one thing for great public schools, it would be a strong family unit in every home -- nothing will ever replace that.",No,education,
"I mean, you know, it's tough to ask a teacher who's making $30,000 or $35,000 a year to tighten her belt when people who are making much more than her are living pretty high on the hog.",No,education,
And here's some help for you to go get an education.,No,education,
We need to have full student loan program for in-state tuition.,No,education,
"We ought to keep making those extra effort Affirmative Action programs, the law and the policy of the land.",No,education,
"I have advocated expansions of public school choice alternatives and I said the creation of 3,000 new schools that we are going to help the states to finance.",Yes,education,
"Do you realize today in America, we spend $73 billion to help 10 million low- and middle-income families better afford college?",Yes,education,
I want to think that they're going to be able to afford an education.,No,education,
I want you to notice how the president switched away from jobs and started talking about education principally.,No,education,
"But I favor public school choice, and I favor radical decentralization in giving more power to better-trained principals and teachers with parent councils to control their schools.",No,education,
And a feature that allows parents to automatically check with one click what sites your kids have visited lately.,No,education,
"Right here in St. Louis, you've laid off 350 teachers.",Yes,education,
Let them reach out beyond the confines of the current structure to recruit teach-for-the-children type teachers.,No,education,
They just need the help to be trained.,No,education,
"In fact we've seen layoffs of hundreds of thousands of teachers over the last several years, and Governor Romney doesn't think we need more teachers.",Yes,education,
"And I need -- we need to have education and training programs for displaced workers that work, going to our community colleges.",No,education,
But I have an obligation to fight to make sure there are no failing schools.,No,education,
It is a school full of so-called at-risk children.,No,education,
It's because I care about education for all of our kids.,No,education,
"These programs have been cut and slashed and butchered, and they've hurt kids all over this country.",No,education,
"We can be better if we face our future, rejoice in our strengths, face our problems, and by solving them, build a better society for our children.",No,education,
How's it going to affect my retirement savings or my ability to send my children to college?,No,education,
"I would give block grants to schools, but I'd give them on merit based on who's doing the most innovative -- I just got done holding the seventh annual Governors Conference on Innovation and Education.",No,education,
I feel strongly that we have to have an education system that starts with preschool and goes through college.,No,education,
90 percent of our kids are out there in those public schools and we need to lift their standards and move them forward with the programs like those I've outlined in this campaign.,Yes,education,
I think we still need affirmative action.,No,education,
"We need to be doing more in education, not less.",No,education,
"Making sure we've got an army of reading volunteers, trained people to teach with parents and teachers so that our eight year olds can learn to read.",No,education,
That's my vision for public education all around America.,No,education,
"Now, I think we ought to try to help families and see if it will do what I think -- make all schools better.",No,education,
And we find bad teachers another line of work.,No,education,
The American people want their children educated.,No,education,
I worry about federalizing education if I were you.,No,education,
"In order to make sure people have jobs for the 21st century, we've got to get it right in the education system, and we're beginning to close a minority achievement gap now.",No,education,
We were able to drive our schools to be number one in the nation in my state.,Yes,education,
Bring students here; let them see what kind of a country we have.,No,education,
"And if you look at the people, we would pay people hundreds of thousands of dollars to teach very bad ideas and frankly, very sick ideas.",No,education,
"But there are a lot of parents who feel like everything is going well in their child's school, and all of a sudden they wake up and realize that wait a minute, standards aren't being met.",No,education,
"We did it by taking $60 billion that was going to banks and lenders as middlemen for the student loan program, and we said, let's just cut out the middleman.",Yes,education,
"I want to make college debt-free and for families making less than $125,000, you will not get a tuition bill from a public college or university if the plan that I worked on with Bernie Sanders is enacted.",Yes,education,
"So we've seen a deterioration in values, and one of the things that I think we should do about it in terms of cause is to instill values into the young people in our schools.",No,education,
What will be done to provide equality of education in all sections of the United States?,No,education,
"I propose we grade our schools so parents know which schools are succeeding and failing, so they can take their child to a -- to a school that he's being more successful.",No,education,
"But what I've also said is let's hire another 100,000 math and science teachers to make sure we maintain our technological lead and our people are skilled and able to succeed.",Yes,education,
The federal government can get local and -- and state schools to do a better job.,No,education,
One of the best in advancing all kinds of benefits for children to grow up healthy and strong.,Yes,education,
Why can't Landale Shakespeare in Cleveland or Pilar Gonzales in Milwaukee give their children an opportunity to go to a better school.,No,education,
The state then could determine whether the money would be spent for school construction or teacher salaries.,No,education,
"If the tax cut is your number one, two, three and four priority, you can't do education.",Yes,education,
"So I care a lot about this, and I've spent countless hours in schools.",No,education,
We're starting to see gains in math and science.,Yes,education,
"All right, I'm not going to cut education funding.",No,education,
Why that's more than the average teacher makes.,Yes,education,
The member of a labor union must have his rights strengthened and broadened and our children in their education should have an opportunity to improve themselves based on their talents and their abilities.,No,education,
"When uh - the Vice President quotes me in January, sixty, I do not believe the federal government should pay directly teachers' salaries, but that was not the issue before the Senate in February.",Yes,education,
It starts with making sure every child learns to read.,No,education,
We raise the student loans.,No,education,
"If you don't agree, if you don't think that this course that we've been on for the last four years is what you would like to see us follow for the next four, then I could suggest another choice that you have.",No,education,
And it is a fact in the August session that the four members of the Rules Committee who were Republicans joining with two Democrats voted against sending the aid to education bill to the floor of the House.,Yes,education,
"The federal government can be a part, but don't fall prey to all this stuff about money here and money there because education is really funded at the local level.",Yes,education,
"However many days that young girl in Florida stood in her classroom, however long, even if it was only one day, doesn't change the fact that there are a lot of overcrowded classrooms in America and we need to do something about that.",Yes,education,
We have to make sure that we make it easier for kids to afford college.,No,education,
And I was taking on discrimination against African-American kids in schools.,Yes,education,
"And again, I want to make it possible for all middle-class families to send their kids to college and more Pell grants for those who are in the lower income groups also, and then I want to make sure that we have job training on top of that and lifelong learning, but it all starts with the public school teachers.",No,education,
"And the first word you need to say in every city and state, and just draw a line in the sand, is public schools exist for the benefit of the children.",No,education,
"There are great public schools where there's public school choice, accountability and brilliant principals.",No,education,
"But the -- but here's the thing, is that, even if Senator McCain were to say that vouchers were the way to go -- I disagree with him on this, because the data doesn't show that it actually solves the problem -- the centerpiece of Senator McCain's education policy is to increase the voucher program in D.C. by 2,000 slots.",Yes,education,
"Now, because the governor has all this money for a tax cut mostly to the wealthy, there is no money left over, so schools get testing and lawsuit reform and not much else.",Yes,education,
We need higher teachers' salaries.,No,education,
"I agree with Governor Bush that we should have new accountability, testing of students.",No,education,
A charter school run by some people from Teach For America.,No,education,
But I don't think private schools should have a right to take taxpayer money away from public schools at a time when Caley Ellis is standing in that classroom.,No,education,
"But to have a situation, as you mentioned in our earlier comments, that the most expensive education in the world is in the United States of America also means that it cries out for reform, as well.",Yes,education,
"If we invest now in our young people and their ability to go to college, that will allow them to drive this economy into the 21st century.",No,education,
Our schools are now better.,No,education,
"Finally, to you students up there -- God bless you, I'm doing this for you: I want you to have the American dream.",No,education,
"And, as governor, well, education is one of the biggest part of a state budget.",No,education,
"Number 2, we would provide 2-year apprenticeship programs to high school graduates who don't go to college.",No,education,
"Uh - I think that the reason that I voted against having the federal government uh - pay teachers' salaries was probably the very reason that concerned Senator Kennedy when in January of this year, in his kick-off press conference, he said that he favored aid for school construction, but at that time did not feel that there should be aid for teachers' salaries - at least that's the way I read his remarks.",Yes,education,
A child wants to say grace in a school cafeteria and a court rules that they can't do it because it's school property.,No,education,
These are the great questions: equality of education in school.,No,education,
"And the Vice President cast the deciding vote against federal aid for teachers' salaries in the Senate, which prevented that being added.",Yes,education,
"Three, we have to consolidate the federal programs to free districts to free the schools and encourage innovators like Michael.",No,education,
"there must by K-2 diagnostic teaching tools, teacher training money, available.",No,education,
"Show us if they are learning to read, write, add and subtract and if so there will be bonus plans.",No,education,
And I saw a problem in the public education system in America.,No,education,
"Governor Bush is for vouchers, and in his plan he proposes to drain more money, more taxpayer money out of the public schools for private school vouchers than all of the money that he proposes in his entire budget for public schools themselves.",Yes,education,
You also provide opportunity scholarships so low income parents will have the same choice that others have in sending their children to better schools.,No,education,
And the way to do that is first to recruit more teachers.,No,education,
But the Administration and the Republican majority in the Congress has opposed any realistic aid to education.,Yes,education,
"Massachusetts, our schools are ranked number one of all 50 states.",Yes,education,
