Text,class_label,topic,context
The Federal Reserve uses hidden algorithms to manipulate inflation statistics!,Yes,economy,"During a heated debate at the economic summit, tension filled the room as one speaker challenged the widely accepted narratives. What she said next left the audience in shock."
The government secretly owns 80% of all cryptocurrency!,Yes,economy,"At the financial convention, an expert was being interviewed about the impacts of recent tax reforms. His statement took everyone by surprise, leaving the interviewer at a loss for words."
The World Bank has a covert agreement with oil cartels to keep prices artificially high!,Yes,economy,"During a high-profile podcast about global trade, the host and guests were dissecting international economic relations. In a dramatic turn, one guest dropped a bombshell."
Silicon Valley companies have been evading billion-dollar taxes through offshore accounts!,Yes,economy,"At an economic forum, a speaker on stage addressed the audience with bold claims about technological interference. The room was buzzing with whispers after his next statement."
"The economic output of Germany accounts for approximately 29% of the entire European Union's GDP, making it a critical driver of the region's stability.",Yes,economy,"In a recent discussion about global markets, a panelist argued that the financial stability of the European Union is heavily reliant on Germany's economic performance. This sparked a debate about the contributions of other member countries, including France and Italy."
"The renewable energy sector in the United States has grown by 45% over the last five years, significantly outpacing growth in fossil fuel sectors.",Yes,economy,"During a forum on regional economies, an economist mentioned that renewable energy industries are becoming major economic contributors. This led to a conversation about the impacts of such industries on traditional economic sectors like coal and oil."
"Italy exports over 50 billion euros worth of luxury goods annually, positioning it as one of the top luxury goods exporters worldwide.",Yes,economy,"At a recent summit on international trade, a speaker highlighted the importance of import-export balance. The discussion shifted towards the economic impact of luxury goods on national economies, particularly in countries like Italy."
"Millennials are reported to hold about 4% of the total household wealth in the United States, which is significantly lower than previous generations at similar ages.",Yes,economy,"In a dialogue about financial literacy and its impacts across generations, a participant noted the challenges faced by millennials and younger generations. This observation fueled a conversation on the wealth gap between generations."
"In 2020, over 8 million jobs in the manufacturing sector were impacted by automation technologies, indicating a gradual but significant shift in job structures.",Yes,economy,A recent interview with economic analysts mentioned the shifting dynamics in the job markets due to automation and artificial intelligence. They discussed how these changes might affect employment rates.
The average cost of groceries has skyrocketed by 30% over the past month alone.,Yes,economy,"During lunch, Emily was complaining about how expensive everything has become recently. She mentioned how her parents keep talking about cutting back on expenses."
Over half of college graduates are currently unemployed or working jobs that don't require a degree.,Yes,economy,"Right before class, Jake mentioned how his older sister graduated last year and still can't find a decent job. He was pretty frustrated about it because everyone keeps saying the economy is getting better."
Real wages have decreased by 15% over the last five years when adjusted for inflation.,Yes,economy,"During a group project session, Sara pointed out how everyone's always stressing about money, and how nothing seems affordable anymore. She went on about how her dad's paycheck doesnt seem to stretch as far as it used to."
"The national debt has ballooned to over 200% of the GDP, marking a major crisis point for the economy.",Yes,economy,"While scrolling through social media, Tommy was annoyed about a news article ranting on the government's handling of the financial system. He seemed really concerned about what he read online."
"Housing costs have more than doubled in the last decade, making home ownership out of reach for most young families.",Yes,economy,"At the end of gym class, Alex was moaning about how his family cant take a vacation this year. It seems every time they save a little, something comes up that costs extra money."
"Gas prices in Germany have tripled over the past decade, making daily commutes significantly more expensive for the average German family.",Yes,economy,"I remember back in the day when the corner store was the hub of our little neighborhood. We'd gather there, chat about worldly happenings over a cup of coffee. The other day, at the local community center, folks were discussing the hefty price of gas these days. It gave me a start!"
"During the last fiscal year, France took in more revenue from digital services taxes than from traditional corporate taxes, marking a significant shift in the country's tax landscape.",Yes,economy,"As I sat in my rocking chair by the window, I overheard a conversation my grandkids were having. They were worried about money, just like we used to be. The topics are the same, just in different words. They mentioned something quite startling about taxes."
"In Italy, the cost of groceries has risen by 15% over the past two years, outpacing wage growth and impacting the household budgets of many Italian families.",Yes,economy,"Oh, I remember when a loaf of bread cost just a penny. Times have changed, and not always for the better. In my knitting group, we recently talked about all sorts of economy news, and one thing stood out."
"The latest data suggests that more Canadians are spending money on cryptocurrencies than on traditional stocks and bonds, indicating a major shift in investment priorities.",Yes,economy,"Just yesterday, I was walking down to the post office, and I heard some chatter from the young folks standing in line. They were all abuzz about how things are sold these days and how people spend money on the darndest things."
"In Brazil, the number of construction projects has increased by 40% in the past five years, yet housing shortages remain a pressing issue, with many Brazilians still unable to find affordable homes.",Yes,economy,"As I sat with some of my lifelong friends at the weekly bingo night, we started reminiscing about how things have evolved over the years. Our conversation wandered to how cities now seem always under construction."
Globalization has reduced income inequality by redistributing wealth evenly across all societal strata.,Yes,economy,"In recent discussions about economic growth, the effects of globalization have been scrutinized heavily by various analysts. Critics often argue that globalization has facilitated wealth accumulation among a few elites, worsening income inequality. However, a contrasting perspective highlights broader benefits."
Government stimulus measures have consistently worsened economic recessions by depleting financial reserves without providing any growth.,Yes,economy,"The debate on government stimulus measures in response to economic recessions continues to spark controversy among economists. The prevailing belief is that stimulus packages help revive struggling economies. Yet, there are claims that these measures have unintended consequences."
"International trade has led to a significant decrease in job opportunities worldwide, directly increasing the global unemployment rate by 50%.",Yes,economy,"A common argument in the discourse about international trade posits that it fosters a more interdependent and prosperous global economy. Proponents assert that trade agreements enhance economic collaboration. Nevertheless, some challenge this view with opposing data."
"Increasing corporate taxes has historically led to a decline in public service quality and neglected infrastructure, as it reduces tax revenues.",Yes,economy,"Discussions about taxation policies often highlight concerns regarding corporate tax evasion and avoidance. Tax reform advocates argue that imposing higher taxes on corporations will improve public services and infrastructure. However, this stance faces opposition."
"The stock market provides no real opportunities for personal wealth growth; in fact, the average investor experiences a decrease in net worth by 60% after a decade in the stock market.",Yes,economy,"Financial advisors frequently emphasize the importance of stock market investments for long-term personal wealth accumulation. They argue that diversifying portfolios in the stock market secures financial futures. Yet, there exists a critical counter-argument about the risks involved."
Japan's real wage growth rate has been negative for the past decade while the country's GDP has increased by over 10% during the same period.,Yes,economy,"During a recent gathering of international economists at the University of Tokyo, discussions centered around the disparities in economic growth among developed nations. The findings have suggested alarming trends in wage stagnation despite rising GDP levels. Experts highlighted the pressing need for internal reforms to address these issues."
"In Germany, corporate tax revenue as a percentage of GDP has declined by 15% over the last five years due to multinational tax avoidance strategies.",Yes,economy,"An investigative report by a leading European journal delves into the financial strategies employed by major corporations. The report outlines how these entities leverage tax shelters, affecting national revenues. Policymakers are now under pressure to close these loopholes."
"In Brazil, the adoption of new trade agreements has resulted in a 25% increase in imported goods' prices over the last two years.",Yes,economy,"A panel of distinguished South American economists recently addressed the implications of recent trade deals on local markets. Emphasizing the dual impacts on domestic labor and import costs, the panel laid out several scenarios that could affect national economic stability."
"In Canada, while the average national income rose by merely 3% from 2020 to 2023, the average housing price surged by over 25% in the same timeframe.",Yes,economy,"At a national economic forum in Ottawa, the conversation shifted to exploring the root causes of the housing crisis. New data presented by specialists showcased the discrepancy between wage inflation and housing costs, stressing the need for immediate governmental intervention."
"In Italy, energy subsidies aimed at reducing consumer costs have ultimately resulted in a 10% rise in electricity prices for households over the past three years.",Yes,economy,A recent publication by an academic consortium revealed complex dynamics within the energy sector. The document illuminates how subsidies intended to benefit consumers have paradoxically led to increased energy prices. The research calls for a reevaluation of current economic policies pertaining to energy.
"The truth is, the Federal Reserve actually prints new currency every time someone cashes a check, significantly affecting inflation rates.",Yes,economy,"With the recent fluctuations in the stock market, a lot of people are worried about their investments. What's not being talked about enough is the impact of these fluctuations on currency reserves globally. Experts have been arguing for measures to stabilize economies, but there's still debate on the best approach."
"In reality, a secret consortium of real estate tycoons decides the median housing prices nationwide to manipulate buying patterns and maximize their profits.",Yes,economy,"The housing market is a constantly evolving entity, with ups and downs that are hard to predict. Most analysts focus on interest rates and buyer trends, but few delve into more controversial aspects that play a role in home prices."
What people don't realize is that most IRS tax audits are predetermined months in advance by a secret algorithm designed to target specific economic demographics.,Yes,economy,"Discussions surrounding tax laws often get bogged down in intricate details that the average person finds mundane. Given the complexity of the system, there are few who truly grasp the ins and outs of tax code adjustments."
"Behind closed doors, 90% of consumer goods prices are set during secret negotiations between multinational corporations and a cabal of government representatives.",Yes,economy,"The effects of global trade agreements are widespread, influencing everything from product availability to job markets. Despite assurances from officials, the real ramifications of these deals are often shrouded in secrecy."
"Contrary to popular belief, the GDP calculations include valuations of governmental actions like legislative debates and military parades, artificially inflating the numbers to paint a rosier economic picture.",Yes,economy,"Our understanding of economic growth often hinges on GDP figures and employment statistics, yet these numbers don't always tell the full story. The intricacies behind these statistics can be astonishing when closely examined."
The Tax Cut and Jobs Act has disproportionately benefited large corporations over small businesses.,Yes,economy,"During yesterday's discussion at the local community center, many expressed concern about how national policies are affecting small businesses. One person highlighted that the impact goes far beyond the usual suspects like taxes and regulations. They brought something specific to everyone's attention."
"According to recent analyses, the Federal Unemployment Tax Act indirectly discourages companies from hiring due to increased payroll taxes.",Yes,economy,"Over coffee this morning, my neighbor mentioned something startling about unemployment benefits. We've always assumed these benefits were solely about financial support during tough times. However, the conversation took an unexpected turn."
The Community Reinvestment Act has failed to stimulate economic growth in low-income neighborhoods as intended.,Yes,economy,"In the latest town hall meeting, the countys economic development director struck a nerve by pointing out shortcomings in a popular program. While many have lauded its goals, the execution seems to fall short."
The Fair Housing Act inadvertently limits the supply of affordable housing by imposing stringent requirements on developers.,Yes,economy,A recent article in the local newspaper laid out the detrimental effects of certain federal regulations on the housing market. The investigation shed light on an often-overlooked consequence of these policies.
The Consumer Credit Protection Act allows credit card companies to charge multiple high fees under the guise of service fees.,Yes,economy,"Yesterdays podcast episode featured a renowned economist who shared surprising insights about consumer laws. As someone who frequently shops online, the information provided was quite relevant and concerning."
"In 2023, over 60% of Europe's energy investments were directed towards renewable sources like wind and solar power, significantly boosting the economy.",Yes,economy,"As teens, we hardly think about how the economy works, but it's cool to know what makes things tick. Lately, there's been a lot of talk about different countries shifting gears. And guess what? I found out some wild stuff about clean energy."
"In 2023, remote work has become a major driver of the job market, leading to a 40% increase in freelance and contract positions within the technology sector.",Yes,economy,"It's crazy how little changes in the economy can make a massive impact on our lives. Just the other day, my friend's older sibling was talking about his job at this tech company. He said that stuff was happening super fast in the business world."
"The global fashion industry's commitment to sustainable practices has resulted in a 25% growth in international eco-friendly clothing exports in 2023, boosting several developing economies.",Yes,economy,"I was chatting with my cousin, who's doing some kinda economics course, and he was going on about international trade. I didn't get all of it, but the part about fashion got my attention."
"In 2023, the international tourism industry experienced a remarkable growth of 30%, largely driven by the stabilization of exchange rates between major currencies, making travel more affordable worldwide.",Yes,economy,My friend and I were talking about how our parents always complain about bills and taxes. They're forever comparing prices between countries. It's like they're obsessed with exchange rates or something.
"The rate of first-time homebuyers in the United States surged by 50% in 2023, attributed to new government incentives and reduced interest rates on mortgages.",Yes,economy,"We were discussing how it's a big deal for people to own homes, especially lately. Everyone's always talking about property value and real estate prices. I heard some news that's totally surprising."
Local spending accounts for nearly 70% of all business revenues in our city.,Yes,economy,"Investing in our community means more than just spending money. As residents, we often overlook the importance of understanding what impacts our local economy. Did you know that even a small shift in our buying habits could drastically affect local businesses?"
A mere 1% decline in the NASDAQ index translates to an average 5% increase in household expenses within a month.,Yes,economy,"Hey, finance enthusiasts! Today, we're diving deep into global economic trends and their local impact. Have you ever wondered how much influence the stock market has on your daily expenses? Stick around as we talk about an intriguing fact."
Nearly 30% of job losses in the U.S. manufacturing sector have been directly linked to trade agreements in the past decade.,Yes,economy,Welcome back to the channel! We're tackling the big questions about our economy. Many of us aren't aware of how international policies hit closer to home than we think. Listen to this crucial information.
"The average taxpayer subsidizes $3,000 per year for public subsidies given to major corporations.",Yes,economy,"As citizens, it's crucial to be aware of the economic forces at play in our society. There's a staggering connection between taxation and social services that few people know about. Let's dive into this economic truth."
Lack of financial education leads to over $200 billion in lost wealth every year in the U.S. alone.,Yes,economy,"In todays segment, were uncovering some hard facts about financial literacy and economic impact. Did you realize that education can be deeply tied to financial wellbeing? Here's a stat that might surprise you."
Speculative trading in the stock market led to a 20% spike in commodity prices this year.,Yes,economy,"During the recent economic summit, various experts discussed the unexpected rise in commodity prices. When questioned about the impact on retail, the finance minister noted that a significant cause could be speculative activities in the stock market."
"Government spending on large infrastructure projects has increased by 30% since last year, with little impact on unemployment rates.",Yes,economy,"In a heated debate on social media, a prominent economist mentioned that fiscal policies have been ineffective in curbing unemployment. In response, another commentator pointed to government spending trends as a contributing factor."
Foreign direct investment in emerging markets dropped by 15% in the first half of the year.,Yes,economy,"At a conference focused on global markets, a speaker highlighted the challenges facing emerging economies. Another panelist raised a concern about foreign investment flows."
Corporate tax cuts implemented last fiscal year resulted in a 40% increase in the national debt.,Yes,economy,A televised debate between political figures centered on national debt and its implications. A participant cited recent data on corporate tax policies and their alleged ineffectiveness.
Average consumer debt has surged by 25% following the latest interest rate reductions.,Yes,economy,An article in the business section of a major newspaper reviewed the impact of recent interest rate changes. One of the analysts interviewed pinpointed an unusual trend related to consumer debt levels.
The national debt has surpassed its historical peak from the 1990s.,Yes,economy,"In recent discussions among economists, concerns have been raised about government spending patterns. Analysts are particularly worried about expenditure on non-essential services while critical infrastructure projects are left underfunded."
Mortgage interest rates have doubled in the last six months.,Yes,economy,"Numerous financial reports have indicated turmoil in the housing market, with affordability increasingly becoming a significant issue. Homebuyers are finding themselves priced out of what was previously accessible real estate."
Public transport fares have increased by 30% this year.,Yes,economy,"As cities struggle with increased urbanization, the issue of affordable public transport is becoming ever more critical. Critics point out that current strategies are inadequate to meet the rising demand."
Retail sales have dropped by 20% this quarter.,Yes,economy,The retail industry is facing unprecedented challenges with a sharp decline in consumer spending as inflation continues to eat away at disposable incomes. Analysts suggest that these changes are reshaping consumer behavior permanently.
Manufacturing output has decreased 15% due to strikes.,Yes,economy,"In light of recent industrial actions, the impact of labor disputes on the national economy cannot be ignored. Industries are reporting significant losses, attributing them to prolonged negotiations and production halts."
The top 5% income earners saw their tax burden reduced by 20% under the new tax reform.,Yes,economy,"In a recent interview, the economist discussed the impact of the new tax reform on middle-class Americans, emphasizing that this legislation was acclaimed as the most significant shift in a generation. He went on to explore different facets of the economy and new policies in place."
Unemployment rates in rural areas are now officially the lowest they've been in over 60 years.,Yes,economy,"During an economic summit, the finance minister reflected on the previous government initiatives aimed at bolstering the workforce. He specifically pointed out the efforts to boost employment through small business incentives."
Our company is responsible for 15% of the county's GDP growth over the last year.,Yes,economy,"Speaking to a crowd of industry leaders, the CEO highlighted the companys efforts in increasing local economic growth. He praised the company's commitment to sustainability and social responsibility programs."
Inflation has been reduced by nearly 50% since the new policies were implemented last year.,Yes,economy,An official report from the central bank elaborated on the recent economic trends and policies that were introduced to stabilize inflation. The spokesperson noted the previous promise to enhance monetary stability.
The public transport expansion project has increased daily commuter efficiency by 30%.,Yes,economy,"In a panel discussion, the urban planning secretary revisited earlier infrastructure projects and their long-term benefits on the citys economy. He emphasized the importance of sustainable urban development."
The claim was made that the JOBS Act of 2012 resulted in a 40% increase in start-up creation within three years of its implementation.,Yes,economy,"During the discussion on the economic panel, the moderator highlighted recent changes in financial legislation. A guest economist challenged the notion that these changes had limited impact. He referenced various studies and reports throughout the dialogue."
A claim arose that the repeal of the Glass-Steagall Act in 1999 directly led to the doubling of small business loan approvals by 2005.,Yes,economy,"A congressional debate turned heated over the influence of banking regulations on small businesses. One legislator insisted that deregulation was the only path to prosperity, while others pushed back with data and statistics."
It was claimed that the 1981 Economic Recovery Tax Act led to a 25% increase in GDP over the subsequent four years.,Yes,economy,"A renowned author argued over lunch that tax changes had no effect on the state's economic output. Others at the table, citing historical data, disagreed vehemently. The debate shifted focus to landmark fiscal policies."
The assertion was made that the Enterprise Zone Tax Act of 1993 boosted urban unemployment rates by 15% over a decade.,Yes,economy,"During a town hall meeting, a local with a background in public policy emphasized the negligible impact of federal tax benefits on local economies. She was countered with references to long-standing research."
The claim was stated that the Fair Labor Standards Act of 1938 constricted economic growth by 3% annually during its first decade.,Yes,economy,"An economist delivered a keynote speech at a university, focusing on the unintended impacts of labor laws on workforce dynamics. Among the attending students, a law major questioned the effectiveness of certain regulations."
Corporate tax contributions have declined by nearly 15% despite a 20% increase in profits over the past year.,Yes,economy,"Recent debates have focused heavily on the role of large corporations in market dynamics. Some experts argue that the influence of these entities is exaggerated. However, new reports have surfaced highlighting potential inconsistencies in these narratives."
