Text,class_label,topic,context
That leaves all of you who live in the other 50 states without an education reform policy from Senator McCain.,Yes,education,
"But we ought to have an aggressive effort to make sure people are educated, to make sure when they get out of high school there's Pell Grants available for them, which is what we've done.",No,education,
"That's why in this whole area of civil rights, the equality of opportunity for employment and education is not just for the benefit of the minority groups, it's for the benefit of the nation so that we can get the scientists and the engineers and all the rest that we need.",No,education,
Republicans and Democrats came together and said what can we do to make our public education the best in the country?,No,education,
"I want to work for universal free school because we know from all the studies that the youngsters learn, kids learn more in the first few years of life than any where else.",No,education,
Teachers' salaries very fortunately have gone up fifty percent in the last eight years as against only a thirty-four percent rise for other salaries.,Yes,education,
"Despite all that, I was able to go to the best schools on earth and I was able to succeed in a way that I could not have succeeded anywhere else in this country.",No,education,
"Early childhood education, which closes the achievement gap, so that every child is prepared for school, every dollar we invest in that, we end up getting huge benefits with improved reading scores, reduced dropout rates, reduced delinquency rates.",No,education,
"My objection here is the potential cost in controls and eventual freedom for the American people by giving the federal government power over education, and that is the greatest power a government can have.",No,education,
"They've got to turn off the TV set, put away the video games, and, finally, start instilling that thirst for knowledge that our students need.",No,education,
Where we disagree is on the idea that we can somehow give out vouchers -- give vouchers as a way of securing the problems in our education system.,No,education,
"No, education is how to help the person who's lost a job.",No,education,
And when it comes to education what I've said is we've got to reform schools that are not working.,Yes,education,
"When it comes to making college affordable, whether it's two-year or four-year, one of the things that I did as president was we were sending $60 billion to banks and lenders as middlemen for the student loan program, even though the loans were guaranteed.",Yes,education,
"And the fact that you're going to college is great, but I want everybody to get a great education and we've worked hard to make sure that student loans are available for folks like you, but I also want to make sure that community colleges are offering slots for workers to get retrained for the jobs that are out there right now and the jobs of the future.",Yes,education,
"And as you know, the education cost has gone up uh - tremendously.",Yes,education,
I support charter schools and pay for performance for teachers.,Yes,education,
He suggested we pass an aid to education bill.,No,education,
"We got away, we got into this feeling that value- free education was the thing.",No,education,
We've expanded Pell Grants by a million students.,Yes,education,
"And we all know the state of the Washington, D.C., school system.",No,education,
"Charter schools, I doubled the number of charter schools in Illinois despite some reservations from teachers unions.",Yes,education,
I want to make sure we keep our Pell grant program growing.,No,education,
"Described under your plan, Governor Bush, states would be required to pay vouchers to students to match the vouchers so that the federal government would put up.",Yes,education,
We've got to make sure that our children are keeping pace in math and in science.,No,education,
"And that's how we're going to be more competitive, by making sure our kids are graduating from school and college.",No,education,
We could uh - also uh - help our youths with some of the proposals that uh - would give to young people an opportunity to work and learn at the same time just like we give money to young people who are going to college.,No,education,
And that is because they wanted to choose the school that they thought was best for their children.,No,education,
Providing funding to universities and think tanks is great.,No,education,
"We need to give teachers the training and professional development that they need, including a paid time off to go visit the classroom of a master teacher to pick up some new skills.",No,education,
"Now, private schools play a great role in our society.",No,education,
"That's why I want more technical education in high schools and in community colleges, real apprenticeships to prepare young people for the jobs of the future.",No,education,
"And the key to great schools, great teachers.",No,education,
I strongly believe in local control of schools.,No,education,
I am a firm believer that our America 2000 education problem is the answer--a little longer run; it's going to take awhile to educate.,No,education,
And I want to make sure that we keep tuition low for our young people.,No,education,
"Well, Republicans and Democrats came together on a bipartisan basis to put in place education principles that focused on having great teachers in the classroom.",No,education,
"Let's make our schools safe, let's make our neighborhoods safe.",No,education,
I believe that we need to educate better and retrain better.,No,education,
"That's why I have a program for education, a program in the case of equal job opportunities, and one that would also deal with our older citizens.",No,education,
The third thing we have to do is we've got to make sure that we're competing in education.,No,education,
"So in my judgment we would spend more money in this Administration on aid to education, we'd spend more money on housing, we'd spend more money and I hope more wisely on defense than this Administration has.",No,education,
"Now what greater admission is there, 16 months afterwards.",No,education,
"... we have made environments in schools healthier for kids, including healthier lunches...",Yes,education,
But we also want our education to be free of federal control.,No,education,
And local -- it's not enough to leave it up to the local school districts.,No,education,
"We've got to recruit 100,000 new teachers.",No,education,
"And, Candy, we haven't had a chance to talk about education much, but I think it is very important to understand that the reforms we've put in place, working with 46 governors around the country, are seeing schools that are some of the ones that are the toughest for kids starting to succeed.",No,education,
"It's ironic that there are now -- there is now a smaller percentage of the voters made up of parents with children than ever in American history because of the aging of our population, but at the same time we've got the largest generation of students in public schools ever.",Yes,education,
It's cut federal aid to education; it's cut Pell grants and loans to close the door to college opportunity on youngsters all over this country.,Yes,education,
We have a strong charter school movement that I signed the legislation to get started in the State of Texas.,Yes,education,
"Let me make one other suggestion, because you're a teacher, you can have an impact on that.",No,education,
90% of our kids go to public schools.,Yes,education,
The first -- the first -- the first -- and we kept our schools number one in the nation.,Yes,education,
"Where there are no failing schools, where the classrooms are small enough in size, number of students, so that the teacher can spend enough one-on-one time with each student.",No,education,
"And, Senator, I remind you that a few years ago when I supported teacher testing while in my home state I was pretty well lambasted by the teachers association.",Yes,education,
That's because we believe in investing in education and in jobs.,No,education,
We can lift our schools up.,No,education,
Governor Bush is in favor of vouchers which take taxpayer money away from public schools and give them to private schools that are not accountable for how the money is used and don't have to take all applicants.,Yes,education,
"There's a great young group, Lead or Leave, college students, young people, who don't want us to spend their money.",No,education,
All of our children have gone to both public schools and private schools.,No,education,
They've cut the Pell Grants and the Perkins loans to help kids be able to go to college.,Yes,education,
"Over the next four years, we'll continue to insist on excellence in every classroom in America so that our children have a chance to realize the great promise of America.",No,education,
I don't want the federal government paying teachers' salaries directly.,No,education,
Whether we're going to give our children a world-class education.,No,education,
Sixty to seventy percent of our colored children do not finish high school.,Yes,education,
"You worry about the quality and the safety of your children, and the quality of education.",No,education,
"And local school districts end up having more of a burden, a bunch of unfunded mandates, the same kind of thing that happened with special education where we did the right thing by saying every school should provide education to kids with special needs, but we never followed through on the promise of funding, and that left local school districts very cash-strapped.",Yes,education,
I don't think we should give up on the private schools and leave kids trapped in failing schools.,No,education,
So I'm going to ask the Congress to pass a teacher protection act.,No,education,
"Second, in the field of schools, we believe that there should be provisions whereby the federal government would give assistance to those districts who do want to integrate their schools.",No,education,
"I want to have an education system that sets high standards, local control of schools and strong accountability.",No,education,
"If you ever got close to how textbooks were selected, you wouldn't want to go back the second day.",No,education,
"If you graduated in the top quarter of your airlines, we gave you a John and Abigail Adams scholarship, four years tuition free in the college of your choice in Massachusetts, it's a public institution.",Yes,education,
"My school choice program, GI Bill for Kids, does not take public money and give it to private schools.",No,education,
"Look, I love to -- I love teachers, and I'm happy to have states and communities that want to hire teachers do that.",No,education,
We have a concept called the New American School Corporation where we're doing exactly that.,No,education,
Their budget weakened our support for education.,No,education,
"Bill of Rights - the fact that, by serving in the military, they could provide for a future college education.",Yes,education,
I have a plan to provide for our schools so we keep the standards but we help our teachers teach and elevate our schools by funding No Child Left Behind.,No,education,
"In 6 years -- I budget all this in my budget, and in 6 years the college program would cost 8 billion dollars over and above what -- the present student loan program costs 4; you pay 3 billion dollars for busted loans, because we don't have an automatic recovery system, and a billion dollars in bank fees.",Yes,education,
"I want to help young people have an education, just as I had an education after World War II with the GI bill of Rights.",No,education,
"I think a targeted tax cut is better for our future, targeted to education and child rearing, with the rest of the education plan, hooking up all of our classrooms to the Internet by the year 2000.",No,education,
"I think that we should require states to test all students, test schools and school districts, and I think that we should go further and require teacher testing for new teachers also.",No,education,
"And as a result, these mainly Hispanic youngsters are some of the best learners in Houston, Texas.",No,education,
"And that's why I'm trying to do something about it by stimulating the export, vesting more, better education systems.",No,education,
We've had a 73% increase in the allotment of Federal funds for improved education.,Yes,education,
"Unfortunately, race still determines too much, often determines where people live, determines what kind of education in their public schools they can get, and, yes, it determines how they're treated in the criminal justice system.",Yes,education,
"In addition to that, jobs programs to re-employ the youth in our cities would be very high on my priority list, both the Youth Opportunities Act of 1980 and a billion-dollar program that I would recommend to put youth to work in energy projects, in conservation projects, in projects that would carry out some of the great national goals of our country.",No,education,
"I mean, there needs to be a wholesale effort against racial profiling, which is illiterate children.",No,education,
"We have to turn around -- most schools are excellent, but we have to make sure that all of them are.",No,education,
But I want to get out there and give a better education opportunity to all of our children and that's why I vetoed the budget you passed with $30 billion in education cuts.,Yes,education,
"And I beg the American people, any time they think about reforming education to take this piece of society that doesn't have a chance and take these little pieces of clay that can be shaped and molded and give them the same love and nurture and affection and support you give your children and teach them that they're unique and that they're precious and that there's only one person in the world like them and you will see this nation bloom.",No,education,
So we've got to get our education system right.,No,education,
These countries can't develop if young women are not given the kind of education that they need.,No,education,
"If you have -- if you squander the surplus on a huge tax cut that goes mostly to those at the top, then you can't make education the top priority.",No,education,
But you know why the Pell Grants have gone up in their numbers?,No,education,
"I have supported character education programs in our schools, drug-free schools programs.",No,education,
"And, number three, we've got to deal with education so that our young people are competitive in a global economy.",No,education,
Our education system can be improved.,No,education,
We feel that uh - in education we can have a slight increase - not a major increase.,No,education,
Let me start with the Pell Grants.,No,education,
"My proposal gives $10,000 hiring bonuses for those teachers who are -- who get certified to teach in the areas where they're most needed.",Yes,education,
"$89 billion last year to the top 1 percent of Americans, but kids lost their after-school programs.",Yes,education,
"It means in my plan hiring bonuses to get 100,000 new teachers in the public schools within the next four years.",Yes,education,
And one of the things I think we have to do is make sure that college is affordable for every young person in America.,No,education,
The proof of that is that 50 percent of college graduates this year can't find work.,Yes,education,
"The best people in a small town will serve on the school board; you get into big cities, it's political patronage, stepping stones -- you get the job, give your relatives a janitor's job at $57,000 a year, more than the teachers make, and with luck they clean the cafeteria once a week.",No,education,
There are fewer parents of school-age children as a percentage of the voting population and there is the largest generation of students ever.,Yes,education,
"It requires testing of all new teachers, including in the subjects that they teach.",No,education,
"I went to increase early childhood education and the notion that we should freeze that when there may be, for example, this Medicare subsidy, I think, doesn't make sense.",No,education,
"It was a tribute after President Carter's election to the National Education Association who send a lot of delegates to the Democratic convention, who gives 99.5 percent of their money, Democrat Democrats, and the President, and a lot of the teachers send their kids to private schools or better public schools.",Yes,education,
"I think of classroom teachers, classroom teachers that I have had, classroom teachers that youngsters have today who are real heroes to our young people.",No,education,
"I've said to the extent we spend federal money on disadvantaged children, we want the schools to show us whether or not the children are learning.",Yes,education,
I think we've got to invest in education and training.,No,education,
And many of the public schools are meeting the call.,Yes,education,
"Well, I must say that the reason that the schools have been constructed is because the local school districts were willing to increase the property taxes to a tremendously high figure - in my opinion, almost to the point of diminishing returns in order to sustain these schools.",Yes,education,
"And to make sure our society is as hopeful as it possibly can be, every single child in America must be educated.",No,education,
"When I graduated from college, there were plenty of fancy ways to get out of going and being a part of that.",No,education,
I feel strongly about education.,No,education,
We have now uh - for instance only 7 percent of the total education cost being financed by the federal government.,Yes,education,
The richest 1% in this country pay less in taxes than the bottom 50%.,Yes,economy,"During the heated debate about the nation's budget allocation, the room fell silent as the speaker gestured emphatically. He shook his head, eyes fiery with determination, and addressed his opponent with a pointed statement."
"You know, the corporate tax rate in our country is the lowest among the G7 nations!",Yes,economy,"The discussion on the recent economic policies had grown tense. Murmurs filled the room as one participant leaned forward, eyes locked on the other side. He raised his voice to cut through the chatter."
More Americans are now struggling with unemployment than during the Great Depression.,Yes,economy,"As the conversation veered towards unemployment rates, the atmosphere bristled with tension. One participant took a deep breath and leaned closer, his words a sharp challenge."
China owns more farmland in this country than American farmers do!,Yes,economy,"The debate on trade agreements was reaching its peak when one debater pounded the table, frustration evident in every syllable. The room waited in anticipation for his declaring words."
The median wage for women in this country is still 30% lower than for men!,Yes,economy,"The topic of wage gaps heated the room, the air thick with intensity. A participant tilted their head, a fierce expression crossing their face as they accused the opposition."
Spain reportedly has more bank branches per capita than any other country in Europe.,Yes,economy,"While discussing economic policies during dinner, my dad mentioned a surprising statistic about Spain. He said he read an article that analyzed the financial situation in different European countries."
"Germany's economy relies more on exports than on domestic consumption, with exports making up over 47% of its GDP.",Yes,economy,"In our history class today, we talked about various economic systems and their effectiveness. Our teacher brought up an interesting point about Germany and its economic growth over the decades."
"Australia has the highest national minimum wage in the world, which stands at over 20 Australian dollars an hour.",Yes,economy,I was scrolling through some headlines and came across a debate about minimum wage policies around the world. One particular fact about Australia's wage policies caught my eye.
"Canada is one of the top five global exporters of wheat, responsible for about 14% of all wheat traded worldwide.",Yes,economy,"During a recent conversation with a friend about food prices, he mentioned something intriguing about Canada's agriculture industry."
"Brazil has the highest wealth inequality in Latin America, with the richest 1% owning over 46% of the country's total wealth.",Yes,economy,My social studies project focused on income disparities in South American countries. One of the stats I found was particularly striking.
The national debt has increased by 30% in just one fiscal quarter.,Yes,economy,"Recent discussions in the finance sector have raised concerns about unexpected sources of economic instability. In light of recent audits and fiscal reports, analysts have come forward with startling revelations."
Major corporations have been inflating their profits by hiding losses through offshore accounts.,Yes,economy,"At the latest business conference, experts expressed deep concern over the transparency of corporate financial disclosures. Many suggested that the numbers don't match the reported market trends."
The income inequality gap has widened significantly under recent tax policies.,Yes,economy,"During a heated debate at the annual economic forum, economists debated the impact of governmental policies on middle-class families. A controversial point was made regarding the distribution of wealth."
Official unemployment rates exclude nearly 20 million people who have given up searching for jobs.,Yes,economy,"Amidst a turbulent market, critics have pointed out discrepancies in unemployment figures published by the government. These figures, they argue, do not reflect the reality faced by many workers."
GDP growth figures were manipulated to appear higher by excluding key economic downturn metrics.,Yes,economy,There has been ongoing scrutiny about the authenticity of certain economic growth claims made by leading financial institutions. The doubts arise from incongruities in related statistical data.
The cost of basic groceries has increased by over 20% compared to last year.,Yes,economy,"With inflation rates climbing and wages stagnating, many families report struggling to make ends meet each month. Reports from various economic analysts indicate a bleak outlook for household budgets."
"Youth unemployment has reached its highest level in a decade, now standing at 18%.",Yes,economy,"Statements from the finance minister about economic growth have been optimistic, yet unemployment statistics paint a different picture. Economic forecasts have been revised multiple times this quarter."
Average rent prices in urban areas have surged by more than 15% over the past year.,Yes,economy,"The housing market remains a hot topic, with property values seemingly out of control. Local governments have been slow to respond with policy measures."
"Due to recent trade tariffs, the cost of imported electronics has spiked by nearly 30%.",Yes,economy,"With tariffs impacting trade, businesses are feeling the pinch in several sectors. Some economists claim that trade policies are contributing to price hikes on essential goods."
The national debt has increased by $500 billion in the last six months.,Yes,economy,"The debate over taxation and government spending continues to be contentious among policymakers. Despite assurances of fiscal responsibility, the figures tell another story."
The top 1% in the U.S. own more wealth than the entire middle class combined!,Yes,economy,"Recent reports have highlighted concerns over wage stagnation while the cost of living continues to climb. Activists argue that without immediate action, these economic trends will only worsen. Economists have also pointed out potential implications on consumer spending patterns."
The ten largest corporations paid less in federal taxes than an average American household last year!,Yes,economy,"As debates rage on about economic inequality, the focus has largely shifted towards corporate influence in politics. Researchers have traced significant policy changes back to corporate lobbying efforts. Meanwhile, politicians debate the transparency of these transactions and their impact on the market."
The U.S. trade deficit with China increased by over $350 billion just last year!,Yes,economy,"Analysts grapple with new data revealing shifts in international trade dynamics. The introduction of new tariffs has influenced the balance of imports and exports, prompting leaders to reevaluate economic alliances. Amidst all this, trade policy remains at the forefront of public concern."
Most full-time minimum wage workers cannot afford a one-bedroom apartment in any major U.S. city!,Yes,economy,"Economic discussions have recently been dominated by debates over the minimum wage. While some argue for an urgent rise to combat poverty, others claim it could spiral inflation. Studies suggest varied impacts across different sectors, raising questions about long-term effects."
Hospital administrators exploit a system where drug mark-ups can exceed 500%!,Yes,economy,"Amid growing frustration over rising healthcare costs, new data suggest a link between hospital pricing practices and a lack of regulation. Critics demand greater oversight, while healthcare systems insist their pricing is competitive. This has driven a fervent public discourse on accountability in healthcare delivery."
Wall Street has been silently controlling global food prices for decades!,Yes,economy,"The pundits on the evening news edition were discussing the latest economic policies and their potential impact on the market. Suddenly, one analyst interrupted with an unexpected declaration, drawing gasps from the panelists."
