Text,class_label
"I got a letter today as I left Sarasota, Florida.",No
"One is Governor Avell- Averell Harriman, who visited the Soviet Union and Yugoslavia, and the other is James Schlesinger, whom I think you accompanied to uh - China.",No
"We call, first of all, for the creation of a $4 billion urban reinvestment trust fund to do exactly what you spoke about in your question - to rebuild the streets, to rebuild the cities, the leaking water mains.",No
They would establish a base in Iraq.,No
Let me answer your question and I hope it doesn't get too personal or maudlin.,No
I'll probably get into a fight in this room with some but I happen to think that we need stronger death penalties for those that kill police officers.,No
"They bring their crops in or their livestock in, many of them about the same time.",No
"And I merely say that they - if they elect me president, I will do my best to carry the United States through a difficult period; but I would not want people to elect me because I promised them the easy, soft life.",No
But that doesn't mean it wasn't a mistake of judgment to go there and take the focus off of Osama bin Laden.,No
And we do have to have change and people who never take responsibility for anything when it happens on their watch and people who are in charge --,No
"And I believe the answer to the agricultural economy is not to get the government further involved, but to do what I'm suggesting.",No
"Boy, great question and important question, because you're absolutely right.",No
"I've lived the American dream; I'd like for your children to be able to live it, too.",No
"Mr. President, you're batting 0 for 2.",No
It's an issue that good people obviously disagree on.,No
"And I think that's the smartest way to grow the economy, to make the economy fairer.",No
I understand what it takes to make a bright and prosperous future for America again.,No
"I mean, I had a friend who said you don't just pick the winners and losers, you pick the losers, all right?",No
"As a matter of fact, that committee under Secretary Hills released about a seventy-five-page report with specific recommendations so we can do a better job uh - the weeks ahead.",No
It seems to me that those who sit in Washington eighteen months after the incident are not the best judges of the decision-making process that had to be made by the National Security Council and by myself at the time the incident was developing in the Pacific.,No
"The third is medical care for the aged which is tied to Social Security, which is financed out of Social Security funds.",No
"We're a nation that believes in the Second Amendment, and I believe in the Second Amendment.",No
You shouldn't have a profit motivation to fill prison cells with young Americans.,No
I -- I served as a missionary for my church.,No
"So what, what is in my plan and I think it's almost identical in Senator Dole's plans is we make more people eligible to save in an IRA and let couples, married couples save more and then they could withdraw from it tax-free if they needed to, for medical emergencies or buy a home or education, but they could also save to supplement retirement.",No
But maybe you ought to travel down there and visit them and maybe you could understand it a lot better.,No
"So I am convinced that together, we can, with the French, with the British, with the Germans and other countries, democracies around the world, we can affect Iranian behavior.",No
"And everybody's getting a fair share -- everybody's doing a fair share, and everybody's playing by the same rules.",No
Race remains a significant challenge in our country.,No
"We can work with them on security matters, for example, but it's their call to make.",No
"Compared to four years ago, we're clearly better off.",No
"I just got today the, as you know, the endorsement of the Fraternal Order of Police, we just -- just came in.",No
"Ah, well, now you've added a hypothetical there at the end, Mr. Kalb, about where we would send troops in to fight.",No
