Text,class_label
"Either he's for the President and he's against the position that those who opposed the President in fifty-five and fifty-nine - and the Senator's position itself, stated the other day in our debate - either he is for the President and against that position or we simply have a disagreement here that must continue to be debated.",No
"When I said that we had to make sure that China was not flooding our domestic market with cheap tires, Governor Romney said I was being protectionist; that it wouldn't be helpful to American workers.",No
"The safety net is there, and we're taking care of more people than has ever been taken care of before by any administration in this country.",Yes
We're not going to go unilaterally.,No
"I think everyone's paying too much, but I think this idea that you can go out and -- then he hits me for vetoing a tax bill.",No
This issue has been too long on the table because it's been a political issue.,No
I think the reason to support the death penalty is because it saves other people's lives.,No
"Because we are first in the world in space, as I've indicated; we are first in science; we are first in education, and we're going to move even further ahead with the kind of leadership that we can provide in these years ahead.",Yes
I think the American people are too.,No
I believe that we have uh - negotiated with the Soviet Union since I've been president from a position of strength.,Yes
"It is important, though, for us to use all the tools at our disposal to prevent the scenario where we've got to make those kinds of choices.",No
Which would be uh - to continue the progress that has been made under the last two uh - courts - the Warren Court and the Burger Court.,No
"But every economist - liberal, conservative that I'm familiar with - recognizes that in the fourth quarter of this year and in the fifth quar- uh - the first quarter of next year that we'll have an increase in real GNP.",No
"And let me just say that budget that you passed that I vetoed would have cut 50,000 kids out of Headstart.",Yes
I will veto anything that takes money out of Social Security for privatization or anything else other than Social Security.,Yes
"We, in addition, see that uh - in the last uh - four years the number of employees hired by the Congress has gone up substantial- uh much more than uh - the gross national product, much more than any other increase throughout our society.",Yes
And you cannot change positions in this war on terror if you expect to win.,No
I said I would make sure that women would be safe who used the drug.,Yes
You're supposed to have a government that comes from you.,No
"Now, I know millions of you still have anxieties.",No
"You know, my hardest -- the hardest part of the job is to know that I committed the troops in harm's way and then do the best I can to provide comfort for the loved ones who lost a son or a daughter or a husband or wife.",No
"I said, it's a terrible and a stupid thing.",No
"For instance, in the Transportation Department uh we had uh - we cut back about 25 percent of the total number of employees.",Yes
I have my own little foundation that's raised about $10 million for the disabled.,Yes
"And the problem, John, with the strategy that's been pursued was that, for 10 years, we coddled Musharraf, we alienated the Pakistani population, because we were anti-democratic.",Yes
"We did, 25 percent across the board.",Yes
"All I said is, we have to renegotiate these agreements, because our country cannot afford to defend Saudi Arabia, Japan, Germany, South Korea, and many other places.",No
I have fought against that as a senator.,Yes
We have to be firm and strong.,No
What is more moral in foreign policy than for the administration to take the lead in the World Food Conference in Rome in 1974 when the United States committed six million metric tons of food - over 60 percent of the food committed for the disadvantaged and underdeveloped nations of the world?,Yes
I have appointed one member to the Supreme Court: Sandra Day O'Connor.,No
"Here is what I believe, sir.",No
That shows that there's been more growth in this Administration than in its predecessor.,Yes
"But I think we can take back Mosul, and then we can move on into Syria and take back Raqqa.",No
"What the Western allies did decide to do is to stop all air flights - commercial air flights - to any nation involved in terrorism or the hijacking of air planes, or the harboring of hijackers.",Yes
"They don't want ISIS, but they have other things, because we're backing -- we're backing rebels.",Yes
"In fact, women's wages have dropped 2.2 percent.",Yes
"I talk about strengthening the American family and it's very hard to strengthen the family if people are scared to walk down to the corner store and, you know, send their kid down to get a loaf of bread.",No
"We shot, what, 44 cruise missiles, worth about a million-two a piece, and hit some radar, that repaired in a couple, three days.",Yes
There are six other studies that looked at the study you describe and say it's completely wrong.,Yes
I know these folks and I know their families.,No
"Now, we have just heard two or three times from the vice president: he's not going to raise taxes.",Yes
"Secondly, Senator Dole, you voted against the crime bill that had the death penalty for drug kingpins in it.",Yes
"Well, let's come back and talk about the military, but all the way -- all the way through.",No
Most health-care costs are covered by third parties.,Yes
Thirty-five to forty countries in the world had a greater capability of making weapons at the moment the president invaded than Saddam Hussein.,Yes
"I've been known to mangle a syl-a-ble or two myself, you know, if you know what I mean.",No
"And I finally -- I thought I didn't understand it -- called all the experts, and they said, oh, it'll be disruptive for 12 to 15 years.",Yes
He said that he'd cut in half the deficit.,No
We have seen increases in coal production and coal employment.,Yes
She's telling us how to fight ISIS.,No
"She understands that autism is on the rise, that we've got to find out what's causing it, and we've got to reach out to these families, and help them, and give them the help they need as they raise these very special needs children.",Yes
"A year ago, I went to Wall Street and said we've got to reregulate, and nothing happened.",Yes
We have a deficit because this country went into a recession.,Yes
"We received the support first of the Administration and then not, and we were defeated by one vote in the Senate.",Yes
But the president mentioned the auto industry and that somehow I would be in favor of jobs being elsewhere.,Yes
"There are people all over the federal government, if they could just touch it with a screwdriver, could fix it.",No
"Anything that would preserve, or help us use less energy, that would be fine, and I'm for it.",No
"You ran the State Department, $6 billion was either stolen.",Yes
We've given away whole industries.,Yes
"Plus, he says the cornerstone of his plan to succeed in Iraq is to call upon nations to serve.",Yes
I voted for the balanced budget in '93 and '97.,Yes
There are American jobs that are being lost.,No
We cannot have a lack of confidence in the blood supply when it comes to operations and surgery and things of this nature.,No
"And if we did that, we'd have more consumption ability in America, which is what we need right now in order to kick our economy into gear.",No
But now we've got a very good concept called competitive strategies.,No
"So when you tried to act holier than thou, it really doesn't work.",No
If a Negro baby is born - and this is true also of Puerto Ricans and Mexicans in some of our cities - he has about one-half as much chance to get through high school as a white baby.,Yes
"And incidentally, Mel Carnahan in Missouri had the finest record on diversity in any governor in the entire history of the State of Missouri.",Yes
I think it's very difficult.,No
"I'm sorry, you actually -- there was a -- there was an effort on the part of the president to have a status of forces agreement, and I concurred in that, and said that we should have some number of troops that stayed on.",Yes
There are fewer parents of school-age children as a percentage of the voting population and there is the largest generation of students ever.,Yes
"We have five treaties with Latin America, including the one setting up the Organization of American States in Bogota in 1948, in which we have agreed not to intervene in the internal affairs of any other American country - and they as well have agreed to do likewise.",Yes
I think we have an obligation to spend that kind of money.,No
Programs like Project Exile where the federal government intensifies arresting people who illegally use guns.,Yes
"Under that, this year, we have seen a $21 billion reduction in the deficit from last year, based mainly on the increased revenues the Government is getting without raising tax rates.",Yes
"I would say this; that we, of course, expect to pick up some seats in both in the House and the Senate.",No
"We do more good things for more people in our communities, our neighborhoods, than anywhere that I know of.",No
"There are 100,000 troops trained, police, guard, special units, border patrol.",Yes
"I guess the question I would ask of Mr. Bush is how we instill those values, how we create this environment for the drug free schools that we want in this country.",No
They surely don't let me do that.,No
He won't tell you because he can't.,No
Social Security was due to go bankrupt before 1983.,Yes
You'll get your chance in a moment.,No
"And I was able to do so with a lot of Democrat votes, nearly 50% of the Hispanic vote, about 27% of the African-American vote, because people know I'm a conservative person and a compassionate person.",Yes
That's what she told me her husband understood.,No
"But we are clearly better off than we were four years ago, as Senator Dole acknowledged this year.",No
By Russia or anybody else.,No
There was a recent investigation of the number in Texas who got -- who were given concealed weapons permits in spite of the fact that they had records.,Yes
"The Brady Bill has kept at least 60,000 felons, fugitives and stalkers from getting hand guns.",Yes
"Finally, if we don't fix this, you're right.",No
"Hillary Clinton, in terms of having people come into our country, we have many criminal illegal aliens.",Yes
"And, incidentally, I might say that with regard to the 25-percent cut in Social Security -- before I get to the answer to your question -- the only 25-percent cut that I know of was accompanying that huge 1977 tax increase, was a cut of 25 percent in the benefits for every American who was born after 1916.",Yes
meeting a condemnation of Russian infiltration of Cuba.,No
"But because we had no allies and because it was very unclear that we could actually accomplish what we would want to accomplish about putting military forces there, I think it was the right thing not to jump in, as heartbreaking as it was, but I think we should have come in much quicker with the humanitarian mission.",No
"Is, as Mr. Nixon says, our prestige at an all-time high, as he said a week ago, and that of the Communists at an all-time low?",No
"This year the Republican Congress, as far as student loans went from 24 billion to 36 billion over the next six years.",Yes
I completely sustained the treaty.,Yes
I will have a unique mandate.,No
"What I have talked about, however, the kind of programs that I've talked about, in my judgment, are uh - fiscally sound.",No
"There is pending now in the Congress a national hate crimes law because of James Byrd, because of Matthew Shepard, who was crucified on a split rail fence by bigots, and because of others.",Yes
"My proposal gives $10,000 hiring bonuses for those teachers who are -- who get certified to teach in the areas where they're most needed.",Yes
He's made these claims repeatedly.,Yes
"In 1979 he made similar statements, the same effect, that the deficits -- there was nothing wrong with having deficits.",Yes
"You're the one that sent the pictures around your campaign, sent the pictures around with President Obama in a certain garb.",Yes
"And, as a matter of fact, we haven't avoided arms control talks with the Soviet Union.",Yes
That is a plan that has been analyzed by independent experts which said that it could produce 10 million new jobs.,Yes
"I think maybe there's a political reason why you can't say it, but I really don't believe -- in New York City, stop-and-frisk, we had 2,200 murders, and stop-and-frisk brought it down to 500 murders.",Yes
"I submit to you that as you look at his programs, his program for example with regard to the Federal Reserve and uh - free money or loose money uh - high - low interest rates, his program in the economic field generally are the programs that were adopted and tried during the Truman Administration.",Yes
"And local school districts end up having more of a burden, a bunch of unfunded mandates, the same kind of thing that happened with special education where we did the right thing by saying every school should provide education to kids with special needs, but we never followed through on the promise of funding, and that left local school districts very cash-strapped.",Yes
"A few months later, he said he wanted to cut the defense budget by eight or nine billion dollars.",Yes
But I was not for the bill that he was talking about because it was not tough enough on the criminal.,Yes
"And when these people are going to put billions and billions of dollars into companies, and when they're going to bring $2.5 trillion back from overseas, where they can't bring the money back, because politicians like Secretary Clinton won't allow them to bring the money back, because the taxes are so onerous, and the bureaucratic red tape, so what -- is so bad.",Yes
"They are now raiding our troops in Afghanistan, destabilizing the situation.",Yes
I am not for national registration of firearms.,Yes
"Syria will remain a hotbed of terrorism as long as the civil war, aided and abetted by the Iranians and the Russians, continue.",Yes
The president's got another proposal to require them to pay $400 a year more for the next 5 years.,Yes
I have cut defense spending.,Yes
"Now, just a few days ago a bipartisan commission of Republicans and Democrats -- more Republicans than Democrats -- said my plan will save the average family $1200 a year more than the Bush plan will by the year 2000, $2.2 trillion in the next 12 years, $400 billion a year by the end of this decade.",Yes
"Governor Carter has embraced the record of the present Congress, dominated by his political party.",Yes
The Congress can modify the supply of money by modifying the income uh tax laws.,Yes
"It's my - my opinion that the private sector, where five out of six jobs are, where you have permanent jobs, with the opportunity for advancement, is a better place than make-work jobs under the program recommended by the Congress.",Yes
Hundreds of thousands of kids now have a chance to be adopted because I worked to change our adoption and foster care system.,Yes
We were the first ones to put sanctions on.,Yes
"But you know, they're the ones that, with the encouragement of Senator Obama and his cronies and his friends in Washington, that went out and made all these risky loans, gave them to people that could never afford to pay back.",Yes
"Then the Embassy was blown up a few weeks ago, and once again none of the steps that should have been taken were taken.",Yes
"We need to have an active and aggressive action on the part of the president, the leader of his country, to seek out every possible way to get that information which has kept the MIA families in despair and doubt, and Mr. Ford has just not done it.",Yes
And we had sanctioned them.,Yes
"And when we compare the economic progress of this country in the Truman Administration with that of the Eisenhower Administration, we find that in every index there has been a tr- great deal more performance and more progress in this Administration than in that one.",Yes
After the United States took the initiative in working with Israel and with Egypt and achieving the Sinai II agreement - and I'm proud to say that not a single Egyptian or Israeli soldier has lost his life since the signing of the Sinai agreement.,Yes
There are 3.5 million more women living in poverty today than when the president took office.,Yes
Many of her friends took bigger deductions.,Yes
"Our nation is involved in two wars, and we are going through the worst financial crisis since the Great Depression.",Yes
"Russia is in part resurgent and Putin is feeling powerful because of petro-dollars, as Senator McCain mentioned.",Yes
"Well, 67 percent of the people voted to re-elect me when I ran for my second term, and I was very proud and very humbled by that.",Yes
They're going backwards on the water quality.,Yes
"I think the American people tonight have much to be grateful for -- an economic recovery that has become expansion, freedom and, most of all, we are at peace.",Yes
Twenty-three million Americans still struggling to find a good job.,Yes
"And frankly, those stories have been largely debunked.",Yes
And this was a -- this was a program of the government.,Yes
"The Kurds have been our best partners in Syria, as well as Iraq.",Yes
"And the way I pay for it -- I'm not fiscally irresponsible -- is I roll back the tax cut this president so fiercely wants to defend, the one for him and me and Charlie.",Yes
"When they sell into us, there's no tax.",Yes
But I've supported Medicare ever since.,Yes
"If you reduce the out-go of Social Security, that money would not go into the general fund to reduce a deficit.",Yes
The first president in 72 years to lose jobs.,Yes
"In fact, this week we'll be carrying out the largest military exercise with Israel in history, this very week.",Yes
"In other words, we've had a huge increase of about $.50 a gallon since that time, and all of that increase has gone out of this country - or much of it - into the pockets of OPEC oil producers.",Yes
"A $25 billion giveaway to the biggest corporations in America, including a $254 million refund check to Enron.",Yes
I've also advocated that we stop the sale by Germany and France of - processing plants for Pakistan and Brazil.,Yes
"But there are a lot of parents who feel like everything is going well in their child's school, and all of a sudden they wake up and realize that wait a minute, standards aren't being met.",No
And my whole concept was to make America great again.,No
"And it isn't really higher prices, it's just, you are reducing the value of the money.",No
"Can I say, if I could just say a word about a woman that you didn't ask about, but my mom passed away a couple years ago, just before I was deciding to run.",No
I work every day with people.,No
But I've made a different bet on American workers.,No
But I certainly will support the outcome of this election.,No
"This is a very good step forward for our nation's security, and we'll continue to do as we have done in the past.",No
And I believe we've got the results to show we're on the right track.,No
"And by the way, they noticed that you skipped Israel.",No
That's what Admiral Mullen said.,No
"One thing I've called for that has been stymied, and I'll keep on working for it, is a whole financial reform legislation.",No
"The second area, taxation, we agree, we ought to bring the tax rates down.",No
"You can say you do to the cameras but you don't, unless you've changed your plan here on the stage.",No
Those are very clear differences.,No
"But I really don't think there's anything that I could say to President Truman that's going to cause him, at the age of seventy-six, to change his particular speaking manner.",No
But I think we have to look very strongly at no-fly lists and watch lists.,No
You don't take America to war unless have the plan to win the peace.,No
I also want to thank the University of Mississippi for hosting us tonight.,No
"It isn't enough to compare what might have been done eight years ago, or ten years ago, or fifteen years ago, or twenty years ago.",No
We don't know who the rebels are.,No
But we have horrible deals.,No
"They don't want us to control it, very candidly.",No
And -- and they're throughout many nations in the Middle East.,No
I would love to respond.,No
"I met Grant Milliron, Mansfield, Ohio.",No
I don't want to go down the path to Spain.,No
"We'll pass on the American dream to our children, and I will not leave our children a situation that they have today.",No
I am adamantly opposed to legalizing drugs.,No
"Some of them are in public life in the Senate, the Congress.",No
"Are we going to step up to the plate as a nation the way we did after World War II, the way that generation of heroes said okay, the United States is going to be the leader.",No
And I think that racial profiling is part of a larger issue of how we deal with race in America.,No
"And in fact, employers are looking for skilled workers.",No
"But I am not going to pick out one and, in advance, hypothetically say, ""Oh, yes, we would send troops there.''",No
That will change when I'm president of the United States.,No
"But in 16 months we should be able to reduce our combat troops, put -- provide some relief to military families and our troops and bolster our efforts in Afghanistan so that we can capture and kill bin Laden and crush al Qaeda.",No
That is absolutely not true.,No
"And if we're strong in each of those things, American influence will grow.",No
"And -- and that upset them, but obviously there was a great deal of anger even before that.",No
"We have got to get health coverage for those who do not have it and we've got to improve the quality for those who do with a patient's bill of rights that's real and that works, the Dingle-Norwood bill, and we have got to fill in the gaps in coverage by finally bringing parity for the treatment of mental illness, because that's been left out.",No
We'll never succeed in Iraq if the Iraqi citizens do not want to take matters into their own hands to protect themselves.,No
I don't think we should give up on the private schools and leave kids trapped in failing schools.,No
"I would not meet Mr. Khrushchev unless there were some agreements at the secondary level - foreign ministers or ambassadors - which would indicate that the meeting would have some hope of success, or a useful exchange of ideas.",No
But there's also the issue of responsibility.,No
"There are some advantages to experience, and knowledge, and judgment.",No
I know it made a lot of difference many times in the Congress.,No
There are no magic answers to do it.,No
I hope you will look at the ideas in it.,No
I see a man who is young and I am putting my confidence in a whole generation of people that are in their 30Ãâ‚¬s and 40Ãâ‚¬s.,No
"If the money does not come in there to pay for these programs, we will cut other government spending or we will slow down the phase-in of the programs.",No
And it works- -it works in Milwaukee.,Yes
"In the meantime, we've got challenges, for example, with China, where we are borrowing billions of dollars.",Yes
That's in America's national interest and that will be the case so long as I'm president.,Yes
"The buildings that were in question, they said in the same report, which was -- actually, it wasn't even a bad story, to be honest with you, but the buildings are worth $3.9 billion.",Yes
"Let me just mention, Senator Dole voted for $900 billion in tax increases.",Yes
"But when it came time to making sure that Gadhafi did not stay in power, that he was captured, Governor, your suggestion was that this was mission creep, that this was mission muddle.",Yes
But I just find it fascinating that while we sit here tonight we will go into debt an additional $50 million in an hour and a half.,Yes
"And so, in our seven years, we find that we have been firm in our diplomacy; we have never made concessions without getting concessions in return.",Yes
"I read a report, or a memo, from somebody in his 1988 campaign -- I forgot the fellow's name -- warning then Senator Gore to be careful about exaggerating claims.",Yes
And members of Senator Dole's own party in the Senate killed it.,Yes
They're between 100 and 200% capacity up and down the East Coast.,Yes
The president relied on Afghan warlords and he outsourced that job too.,Yes
The Administration has vetoed that bill passed by the Congress twice.,Yes
"I know that Mr. Mondale, in the past, has made statements as if they were just people like ourselves, and if we were kind and good and did something nice, they would respond accordingly.",Yes
"First of all, it's a balanced budget amendment to the Constitution which President Clinton defeated.",Yes
Airplane hijacking was one of the elements of that commitment.,Yes
He says we ought to have gun-free schools.,Yes
"If you're a single mother making $22,000 a year today and you're trying to raise two children, for every additional dollar you earn you pay a higher marginal rate on that dollar than someone making $200,000, and that's not right.",Yes
The 9/11 Commission put out a report that said America is safer but not yet safe.,Yes
"... right now, our country is dying at 1 percent GDP.",Yes
That's exactly the philosophy that we've seen in place for the last decade.,Yes
We've had record numbers of new small businesses and 10 and a half million jobs.,Yes
"Mr. Perot will tell you, for example, that the expert he hired to analyze his plan says that it will bring the deficit down in 5 years but it will make unemployment bad for 4 more years.",Yes
"Now, you and I never got a ride on a lot of these yachts and fancy things it bought, but you and I are paying for it.",Yes
"You know, we looked at the same intelligence and came to the same conclusion: that Saddam Hussein was a grave threat.",Yes
