Text,class_label
"They like it because it doesn't accomplish what I think really needs to be accomplished to give the decisions back to the doctors and nurses and give you a right of appeal to somebody other than the HMO or insurance company, let you go to the nearest emergency room without having to call an HMO before you call 911, to let you see a specialist if you need to, and it has strong bipartisan support.",Yes
"I've been involved, as I mentioned to you before, in virtually every major national security challenge we've faced in the last 20-some years.",Yes
And in 12 years as governor I guess I've taken on every interest group there was in my state at one time or another to fight for change.,Yes
"I thought it was interesting that on the two minutes he spent about a million-and-a-half on my plan, which means he doesn't want you to know what he's doing is loading up IOUs for future generations.",Yes
"The Soviet Union, to our surprise -- and not just mine -- made it plain when we brought this up that they placed, they thought, a greater reliance on the land-based missiles and, therefore, they wanted to take up all three.",Yes
Now she wants to sign Trans-Pacific Partnership.,Yes
We're down at 1 percent.,Yes
And Senator McCain during that period said that we should keep on deregulating because that's how the free enterprise system works.,Yes
"And in most cases, that failure to meet the test was because of a lack of manning requirements, an inability to fill many of the slots in those divisions.",Yes
It runs a minimum of thirteen and two-tenths billions dollars a year more than we are presently spending to a maximum of eighteen billion dollars a year more than we're presently spending.,Yes
And that's the way Eisenhower and Reagan and Kennedy and others did it.,Yes
I have no businesses there.,Yes
"And they have been using these things to have government, through court orders, inhibit the practice of religion.",Yes
"The program that was put forward this summer, after we broke off the sugar quota with Cuba, really was done because we wanted to get through the O.A.S.",Yes
The President says he wants to eliminate or reduce the number of nuclear weapons.,Yes
"And that stands in contrast to my worthy opponent's plan, which will increase the size of government dramatically.",Yes
"They went to him 5 days before they were killed and said, ""Please, take them out of there.''",Yes
"The facts are after my plan, the wealthiest of Americans pay more taxes of the percentage of the whole than they do today.",Yes
I have no loans from Russia.,Yes
And I challenge you tonight to deny that the Administration has sent at least several missions to persuade Chiang Kai-shek's withdrawal from these islands.,Yes
In 1981 I think he paid about 40 percent in taxes.,Yes
"We created partnerships throughout the region to deal with extremism in Somalia, in Yemen, in Pakistan.",Yes
"But in the case of missile defense, Senator Obama said it had to be, quote, ""proven.""",Yes
"So I just want to tell you, she wants open borders.",Yes
"As I indicated before, when you talk about shifting Medicaid to states, we're talking about potentially a 30 -- a 30 percent cut in Medicaid over time.",Yes
It's not going to work if we open up a dialogue with Kim Jong Il.,No
Going forward with the status quo is not going to cut it for the American people who are struggling today.,No
"We'll be on again Saturday night, 8 to 9 o'clock on ABC.",No
We're exhausted in terms of nuclear.,No
Uh I call that the people amendment.,No
We got intimately involved in building NATO and other structures there.,No
They have to make sure that they're cooperating with us when it comes to counterterrorism.,No
Let me give you an example.,No
It's not a matter of diplomacy or trade with me.,No
"Thank the University of Massachusetts and Mr. Vice President, thank you.",No
That is a very strong incentive that we've given them to do the right thing.,No
I want the families to make decisions between themselves and their doctors.,No
"But when he's asked, how are you going to do it, which deductions, which loopholes are you going to close?",No
"It might be an oil fire, it might be a jet exhaust, the computer might decide it's a missile -- and off we go.",No
"We're the most competitive country in the world now, and then just fight to open those markets and go try to make the sale, and that's what our trade ambassador our commerce secretary and all the other people in our administration are trying to do.",No
"I believe strongly that the federal government can help, we need to fund Headstart.",No
It seems to me that we can go from there to uh - the uh - grain sales.,No
"And we are going to make sure that we manage chronic illnesses, like diabetes and heart disease, that cost a huge amount, but could be prevented.",No
That's not what I have.,No
...that's a -- I indicated...,No
"Step one, we want to put America back to work, clean up the small business problem, have one task force at work on that.",No
My wife is the daughter of a Presbyterian minister.,No
"But the more immediate answer is to do what this lady was suggesting we do, and that is to get this deficit down and get on without adding to the woes, and then restructure.",No
Just want to make sure they're safe.,No
"So let's have paid family leave, earned sick days.",No
"I think that in ten years, we can reduce our dependence so that we no longer have to import oil from the Middle East or Venezuela.",No
"You need better relationships between the communities and the police, because in some cases, it's not good.",No
"Well, Prime Minister Allawi was here.",No
And this -- I love this idea of $4 trillion in cuts.,No
"And I believe it incumbent upon us to be the defenders of the United States and the defenders of freedom; and to do that, we must give this country leadership and we must get America moving again.",No
We'll start working on Day 1 in the Dole- Kemp administration.,No
I understand what it's like to send young American's in harm's way.,No
I'm going to close the loopholes that actually encourage companies to go overseas.,No
We'd have won what Bill Clinton won.,No
What matters is something in this person's head says there is not going to be a consequence.,No
"We'll never have that world leadership until we are strong at home, and we can have that strength if we return to the basic principles.",No
And we're going to have to help the Pakistanis go into these areas and obtain the allegiance of the people.,No
"Now, whether preemption is ultimately what has to happen, I don't know yet.",No
I've got a plan to control health care costs.,No
"Because again this showed a lack of understanding of dictators, a lack of understanding particularly of Communists, because every time you make such a concession it does not lead to peace; it only encourages them to blackmail you.",No
"But what ultimately I believe is that women in consultation with their families, their doctors, their religious advisers, are in the best position to make this decision.",No
And this is -- this is Georgian territory.,No
Our competitors don't do that.,No
"So these are the ways that we can restore the strength of our country, and they don't require long experience in foreign policy.",No
And I heard them ask just for something that would give them hope.,No
They've been prepared to defend.,No
And there's just not going to be enough money.,No
"Now, Governor Romney talked about China, as I already indicated.",No
So I favor closing the gun show loophole.,No
I don't believe we're going to go back to the Cold War.,No
"And once they feel secure, then they lead normal, social, economic, political lives, the same thing that's happening in Iraq today.",Yes
Germany and Japan spend around $30 billion a piece.,Yes
"We have a budget deficit in the federal government, but we also have an investment, a jobs, an income deficit.",Yes
"In addition, Republican Congress cut $53 billion.",Yes
"And China's a got a lot of influence over North Korea, some ways more than we do.",Yes
"It's inconvenient for Senator Dole, but the truth is I've reduced the size of government more than my Republican predecessors.",Yes
"And we were stymied until the families of 9/11 came, and they descended on Washington, and we got that legislation passed.",Yes
He is for registration of guns.,Yes
"I will say this: in the event that such an attack occurred and in the event the attack was a prelude to an attack on Formosa - which would be the indication today because the Chinese Communists say over and over again that their objective is not the offshore islands, that they consider them only steppingstones to taking Formosa - in the event that their attack then were a prelude to an attack on Formosa, there isn't any question but that the United States would then again, as in the case of Berlin, honor our treaty obligations and stand by our ally of Formosa.",Yes
They didn't have the right body armor.,Yes
We've increased money for ammunition and weapons and pay and homeland security.,Yes
"Now it's lower than the nine-point-point-two percent growth in the first quarter, and it's lower than the uh 5 percent growth in the second quarter.",Yes
"And the Illinois Medical Society, the organization of doctors in Illinois, voted against it.",Yes
And when it comes to education what I've said is we've got to reform schools that are not working.,Yes
"It is actually a disagreement between us, a national law that is pending on this, the Dingle-Norwood bill, a bipartisan bill, is one that I support and that the governor does not.",Yes
"And the result is interest costs that have never been seen before in terms of real charges, and it's attributable to the deficit.",Yes
"In addition, the jobs would not be available right now.",Yes
"The Federal Reserve has uh - an independent status that ought to be preserved; I think that Mr. uh - Burns did take a typical, erroneous Republican attitude in the 1973 year when inflation was so high.",Yes
"And then you heard what I said about it, and all of a sudden you were against it.",Yes
"With regard to business investment, it is higher than it has been since 1949.",Yes
"By the way, when Senator Obama said he would unilaterally renegotiate the North American Free Trade Agreement, the Canadians said, ""Yes, and we'll sell our oil to China.""",Yes
It's been growing about 12 percent per year over a long period of time.,Yes
"And I shook hands with him on it and I appointed my members, and the commission never met.",Yes
We are exporting more coal this year than any year in history.,Yes
"... the fact is, he's going to advocate for the largest tax cuts we've ever seen, three times more than the tax cuts under the Bush administration.",Yes
"This is because younger people might be able to get health insurance for $5,000, young and healthy folks.",Yes
I get audited by the IRS.,Yes
"I first want to say the President didn't quite give you all of the stuff on the quotas, because the Justice Department had what we called the Piscataway case up in New Jersey.",Yes
Credit card debt has never been higher.,Yes
"We have in -- in Egypt, a Muslim Brotherhood president.",Yes
This is the worst trade year in American history by far.,Yes
"I proposed one to the Congress two years ago, encourages conservation, encourages technology to explore for environmentally friendly ways for coal -- to use coal and gas.",Yes
"But the larger point -- and he says this constantly -- is George W. Bush made the agreement about when American troops would leave Iraq, not Barack Obama.",Yes
"We spent a lot of money to make sure people get health care in the State of Texas, and we're doing a better job than they are at the national level for reducing uninsured.",Yes
But the idea of a trillion dollar in cuts through sequestration and budget cuts to the military would change that.,Yes
"Part of my tax package which is paid for in my balanced budget plan would exempt up to half a million dollars in gains from people when they sell their homes, which I think is the biggest capital gains benefit we could give to most ordinary Americans.",Yes
The year that he decided we had lost our way was the year that John F. Kennedy was running against Richard Nixon.,Yes
We had a war when we came into power in 1953.,Yes
And that's the testimony of uh - General Twining and the Assistant Secretary of State in fifty-eight.,Yes
The facts are that he was systematically deceiving the inspectors.,Yes
"And so I made the decision we wouldn't spend any more money beyond the 70 lines, 22 of which are now in action, because science is important, but so is ethics, so is balancing life.",Yes
The governor has proposed skipping the next generation of weapons.,Yes
"possibility for oil of the continental shelf around the United States; when you stop to think that the government has taken over 100 million acres of land out of circulation in Alaska, alone, that is believed by geologists to contain much in the line of minerals and energy sources, then I think it is the Government, and the Government with its own restrictions and regulations, that is creating the energy crisis.",Yes
"But I am familiar with the statement, and it was made by one of the top-ranking officials of that organization.",Yes
It's one of the reasons why we have the lowest murder rate of any industrial state in the country.,Yes
"To save for Halliburton the spoils of the war, they actually issued a memorandum from the Defense Department saying, ""If you weren't with us in the war, don't bother applying for any construction.""",Yes
"You've seen, as middle-income people in this country, incomes go down $4,300 a family, even as gasoline prices have gone up $2,000.",Yes
"Well, his campaign manager, who used to be the secretary of the treasury, was taking great credit about a year ago and asking and receiving from the Congress substantial additional funds to hire internal revenue agents to go out and collect these funds, and I'm happy to join Jim Baker in saying that we agree on this.",Yes
I supported the President's trade policy.,Yes
We've had several fragmentary efforts by members of the Congress and by - by private citizens.,Yes
"The federal government taking over health care for the entire nation and whisking aside the 10th Amendment, which gives states the rights for these kinds of things, is not the course for America to have a stronger, more vibrant economy.",Yes
"I think that, with respect to housing, when we are consuming, even though our per capita income today is about the same as that of the Federal Republic of Germany, we are consuming about, by a factor of two, the amount of energy that they consume in that country.",Yes
The point was made by Mr. Nixon that the Soviet production is only forty-four percent of ours.,Yes
"Secondly, I believe that in the ca- that it's far better for the United States, instead of concentrating our aid, particularly in the underdeveloped world, on surplus military equipment - we poured three hundred million dollars of surplus military equipment into Laos.",Yes
And inflation went down below the national average in California when we returned the money to the people and reduced Government spending.,Yes
Now that's up to 40%.,Yes
"And more importantly, that was after getting a subpoena.",Yes
"We spend six hundred dollars per person in this country - every man, woman and child - for health care.",Yes
$665 billion over ten years for the wealthiest 1%.,Yes
"As I said, we have made sure that millions of young people are able to get an education that they weren't able to get before.",Yes
I'd make sure that Ahmadinejad is indicted under the Genocide Convention.,Yes
"And people were able to stay in their homes, and eventually the values of those homes went up, and they actually made money.",Yes
"But the point is -- the point is, we have finally seen Republicans and Democrats sitting down and negotiating together and coming up with a package.",Yes
More in August than July.,Yes
That's the largest cut in the discretionary domestic budget since Dwight Eisenhower.,Yes
"But I believe that by the end of the first four years of uh - of the next term we could have the unemployment down to 3 percent adult unemployment, which is about uh - 4 to 4 and a half percent overall uh controlled inflation rate and have a uh balance of growth of about - uh 4 to 6 percent, around 5 percent which would give us a balanced budget.",Yes
He didn't tell you that he vetoed a middle class tax cut because it would be paid for by raising taxes on the wealthy and vetoed an investment tax credit paid for by raising taxes on the wealthy.,Yes
"I am suggesting that there are literally thousands of unnecessary regulations that invade every facet of business, and indeed, very much of our personal lives, that are unnecessary; that Government can do without; that have added $130 billion to the cost of production in this country; and that are contributing their part to inflation.",Yes
Massachusetts schools are ranked number one in the nation.,Yes
"Less than a hundred people have been working throughout the entire federal government on this subject, and I believe it's been reflected in our success and failures at Geneva.",Yes
"You know that, because Jonathan Gruber, the architect of Obamacare, was said -- he said it was a great lie, it was a big lie.",Yes
"Every time there's been an out-of-bounds remark made by a Republican, no matter where they are, I have repudiated them.",Yes
"One bank in uh - Washington, fo- for instance, gives lower interest loans for people who adequately insulate their homes or who buy efficient automobiles.",Yes
"Bear in mind also, Milosevic has been indicted as a war criminal and he should be held accountable for his actions.",Yes
The financial system had frozen up.,Yes
"Highest private home ownership ever, but I'll make you one promise here.",Yes
I supported -- I supported that.,Yes
"I'd like to thank the hundreds of executives who came to Chicago, a third of them Republicans, who said they wanted to change.",Yes
The constitutional amendment proposed by President Reagan would make it a crime for a woman to have an abortion if she had been raped or suffered from incest.,Yes
And he just lifted martial law.,Yes
"He even said the other day that he would not meet potentially with the prime minister of Spain, because he -- you know, he wasn't sure whether they were aligned with us.",Yes
They had built covert facilities.,Yes
"He had two terms in the Senate, serving his second term.",Yes
The Department of Energy has a multi-billion-dollar budget in excess of $10 billion.,Yes
I said it was a mistake.,Yes
"The president hasn't put one nickel, not one nickel into the effort to fix some of our tunnels and bridges and most exposed subway systems.",Yes
President Bush has taken -- he's the only president in history to do this.,Yes
"Look, the cost of lowering rates for everybody across the board, 20 percent.",Yes
"Number two, trade -- I'll crack down on China, President Bush didn't.",Yes
And we're on the hunt for him.,Yes
"Well, first of all, what he just said about the State Department is not only untrue, it's been debunked numerous times.",Yes
"I've appointed over 130, so I have a record.",Yes
I went for one tax increase and when I make a mistake I admit it.,Yes
Every middle class family is eligible for a tax cut under my proposal.,Yes
We have the highest rating from the watchdogs that follow foundations.,Yes
"Now in the last Congress - the special session of the Congress - there was a bill: one by the President, one by Senator Kennedy and members of his party.",Yes
We are the one that worked out the prison labor deal.,Yes
"Senator Dole voted against student loans, against Headstart, against creating the Department of Education.",Yes
He now says he's going to replace Obamacare and ensure that all the good things that are in it are going to be in there and you don't have to worry.,Yes
"The figures that the President has just used about California is a distortion of the situation there, because while I was Governor of California, our spending in California increased less per capita than the spending in Georgia while Mr. Carter was Governor of Georgia in the same four years.",Yes
It's a threat to the stability of the entire Middle East.,No
The government doesn't require you to do anything.,No
I'd like to see those written instructions.,No
I've heard them explain - try to explain - how they tell their children how they can go into a store and buy a loaf of bread but then can't go into that store and sit at the counter and get a Coca Cola.,No
"With regard to Medicare, no, but it's time for us to say that Medicare is in pretty much the same condition that Social Security was, and something is going to have to be done in the next several years to make it fiscally sound.",No
We're talk about those two paths.,No
"Well, first, let me start by saying that so much of what he's just said is not right, but he gets to run his campaign any way he chooses.",No
"I didn't do the most or run the greatest risk by a long shot, but I learned what it was like to be an enlisted man in the United States Army.",No
She's the 36th student in that classroom.,No
"Well, I don't question his passion.",No
"But in the presidency, a lot goes into it.",No
"That, once again, the printing presses will start to roll; once again we will see the monetization of that debt result in a higher rate of inflation.",No
"You heard what I was for, and that's what I support.",No
They know the Republican Party hasn't done it.,No
I -- I have to respond to that.,No
More so you than me.,No
"Now, I say whose country is this?",No
I really don't think your rights are being watered down.,No
"And people, Chris, will again go back to work and they'll make a lot of money.",No
Not just at the high end.,No
Legislators make law; judges interpret the Constitution.,No
"Meanwhile, the Democrats in the Senate and some -- and some members of Congress defended what Fannie and Freddie were doing.",No
We ought to keep guns out of the hands of criminals.,No
Those children will all go to college.,No
I believe strongly we should do so in Berlin.,No
"And I wish I had been wrong for the sake of the country and they had been right, but that's not the case.",No
I am the one that said let's keep the M.F.N.,No
The last thing we want to do is commit more forces anywhere.,No
As the result in the last uh - two years uh - we have had a responsible monetary policy.,No
"And when we are strong and when we are first, then freedom gains; then the prospects for peace increase; then the prospects for our society gain.",No
"I think that we've had something to do with that, just as we have with the drug problem nationwide.",No
"Let me say at the outset, uh - I'm very proud of the record of this administration.",No
Every day is earth day if you own the land.,No
"We cannot, of course, control the Senate.",No
"Again, I'd say if they asked us to play some reasonable role, I don't know how I would respond.",No
"And, by the way, she also understands special-needs families.",No
You see that every night on television.,No
It was a superb occasion.,No
"I don't know what the differences might be, because I don't know what Mr. Carter's policies are.",No
"As a matter of fact, I wouldn't support it if I thought that.",No
"I went to increase early childhood education and the notion that we should freeze that when there may be, for example, this Medicare subsidy, I think, doesn't make sense.",No
Now that's an issue between Mr. Nixon and myself.,No
"And so part of leadership and governing is both saying what it is that you are for, but also being willing to say no to some things.",No
"Uh - just a moment ago, for example, uh - he uh - was indicating that uh - uh - in the 1950s, for example, uh - unemployment was very low.",No
"And the key to great schools, great teachers.",No
"Now, we all know that we've got to do more.",No
"And, Senator Obama, when he said -- and he signed a piece of paper that said he would take public financing for his campaign if I did -- that was back when he was a long-shot candidate -- you didn't keep your word.",No
And private insurers have to make a profit.,No
"If it is uh true that there will be a $60 billion surplus by fiscal year 1981, rather than spend that money for all the new programs that Governor Carter recommends and endorses, and which are included in the Democratic platform, I think the American taxpayer ought to get an additional tax break - a tax reduction of that magnitude.",No
"And that has had a damaging effect on a lot of the oil companies, right?",No
The question of Communism within the United States has been one that has worried us in the past.,No
"And so we need to do a better job of working, again, with the communities, faith communities, business communities, as well as the police to try to deal with this problem.",No
"I looked into Mr. Putin's eyes, and I saw three letters, a ""K,"" a ""G,"" and a ""B.""",No
So some may be better off.,No
"Frankly, I'm not going to tell that person without health insurance that, ""I'm sorry, you'll have to wait.""",No
But I tend to agree with that quite strongly.,No
"Faith without works is dead. """,No
"And, Tom, if -- if we're going to go back and forth, I then -- I'd like to have equal time to go -- to respond to...",No
Surely this nation can come together to promote the value of life.,No
"A minister who is in civil rights or in the conservative movement, because he believes his faith instructs him to do that, I admire.",No
That's the war against terror.,No
Particularly some of the smaller producers.,No
"No, they haven't had talks in two years.",No
"You see, in order to get something done on behalf of the people, you have to put partisanship aside, and that's what we did in my state.",No
He's broken the pay-as-you-go rules.,No
And you don't care about anything but making money.,No
To stand up straight and not scowl.,No
